reviewId,userName,content,score,thumbsUpCount,reviewCreatedVersion,at,appVersion
b522086a-f56d-4335-a456-c97e08c304d4,Dawar Azhar,The keyboard overlaps the chat data entry region. Its hard to minimizing again and again.,3,8,22.20.0.100,2021-10-19 13:51:47,22.20.0.100
3b84bbb4-51e6-4e35-9c22-4fb81d1888bd,Aidan Jenkin,Worst app ever I ordered a carb 2 weeks ago and they still said that the shipping was on hold because they don't know where the address is but they do Don't even bother with this app it's a waste of time and money,1,0,22.19.0.100,2021-10-04 21:13:41,22.19.0.100
d9ca74b4-73a2-47d2-8386-7a556ef8dbbe,Nicholas Loh,I clicked a link that turned out to be in French from someone in Quebec and now my app is in French even though I changes the settings back to English,1,1,22.20.0.100,2021-10-19 13:44:36,22.20.0.100
11b12109-0c57-4c2a-90fc-bf6f22bd1295,Eli Eckstein,"It's very slow and the ""window shopping"" thing is now gone. Update: I cant add items to lists anymore, cont figure out why.",1,1,22.20.0.100,2021-10-20 06:26:03,22.20.0.100
2bb4624d-8b4d-426a-90b3-19af0187938c,Maria Cubitt,"Why is the map so small? It used to be bigger, now it is only a cm or less in height, so difficult to see how far delivery van is away.",3,0,22.20.0.100,2021-10-21 17:41:52,22.20.0.100
ee2b0493-6529-4351-bc3c-fac469fd936f,Penny Oslin,Make sure you don't pay your purchases (balance) within 1-2 weeks or they'll put you payment on hold for SEVEN DAYS BEFORE it's released to your account!!! Sorry for paying on time!!! Ridiculous!!!,2,1,22.21.0.100,2021-10-29 14:01:16,22.21.0.100
3f295070-d12c-4912-aa30-a08410e7c8b5,Jennifer Gill,"I don't understand why this app won't let me use my EBT card when, it clearly states that the items are ""SNAP EBT eligible."" Can you help me with this problem?",4,0,22.19.0.100,2021-10-04 22:30:02,22.19.0.100
802cbbe7-bf9c-4ba3-a29c-aed0525f1054,Tahira J.,I buy from Amazon regularly. It's unusual for them to not be on time. Their returns policy is vert clear and easy.,5,2,22.19.0.100,2021-10-03 11:43:22,22.19.0.100
db59f7cc-2d7d-4cfd-92bb-6516b447f378,Vhyel Britten,"App has been ruined. It is faster to build the product yourself than to try and order it now. And, yes, I do mean build it yourself.",1,1,,2021-10-22 13:20:00,
ebe087b1-e0a4-40e9-a7a4-5605bd59a3e2,Krista Dischler,very disappointed that we pay for prime and do not recieve our products for 2weeks when it is suppose to be two days.when i call bo one can give an explanation.we should be told why.i might as well go to a store and buy because amazon is very disappointing,1,1,22.19.0.100,2021-10-18 15:31:02,22.19.0.100
dbaa5c7d-ebf4-4e20-a946-cd3c0082bfda,Salli Tyrrell,"Used to love the ape simple and quick to use but since the last update it no longer loads properly, needs to be sorted out,",3,2,22.20.0.100,2021-10-22 17:00:42,22.20.0.100
ce4988a5-4272-4a11-a34a-111866a761d1,MariaE,"I sent at least 2, TWO, messages cancelling this order BEFORE you shipped it 4 hours later. A supreme waste on Amazon's part, as I plan to refuse the order.",1,0,16.21.0.100,2021-10-18 23:08:44,16.21.0.100
628832c3-d342-4873-9252-b3da4c079dd0,Aurora Tymkew,"Lots of glitches, not able to look at my lists, not able to purchase what I want do to this issue. Please fix!",1,0,22.19.0.100,2021-10-08 16:09:21,22.19.0.100
f701ef5f-c9d2-42b0-96ad-ba25bf1f35e7,Jim F,"Completely broken with the most recent update. Do not use the app, use a PC or an entirely different service.",1,3,22.21.0.100,2021-10-29 18:04:55,22.21.0.100
ff9223f4-efeb-46d9-b043-73b83213764c,Zeynep Yilmaz,"I ordered something and guess what the box was empty. Yes, empty. Can you believe that causing I can't and I'm very disappointed in Amazon. This way you can see that you can't trust Amazon.",1,4,22.20.0.100,2021-10-20 13:42:15,22.20.0.100
43036517-4b3d-4500-aeca-f072cb58c64b,Kremz Rosario,"Bad business, why? Because I have left a note on my front door and I guess the driver couldn't or does not know how to read !! Iam really frustrated !!!",1,0,22.20.0.100,2021-10-15 23:01:25,22.20.0.100
892e6d7e-f917-4691-82d8-6285b794eba4,Garrett,Latest update is trash. So horrid I've uninstalled it completely. Looks like I'll be canceling my Prime account too at this rate.,1,1,22.19.0.100,2021-10-07 12:53:17,22.19.0.100
9f253495-a2d7-49f9-9785-e20b3d4149f2,Paul,What has happened recently. Its becoming unusable. No smooth scrolling and freezes.,1,4,22.20.0.100,2021-10-18 14:53:42,22.20.0.100
c7599ed8-bb80-4bc5-a993-eff6203962ee,Giulia Orlando,Just downloaded the apps and it crushed several times...awful experience...I will uninstall it and go back to the old fashioned website on browser...,1,0,22.20.0.100,2021-10-25 02:07:04,22.20.0.100
59e38250-ab5a-407e-babe-4999c387ddfb,Eyad Mallah,"Very very very bad experience, the shipment was send to wrong address, and after that no one know where is the shippment!!! Customer service keep giving promises to solve it. After 5 days not solved a d more promises!",1,5,22.20.0.100,2021-10-20 13:32:43,22.20.0.100
802741ea-337d-4b06-9e3d-abc43e4be68a,Rickard Linck,"Scrolling wishlist is jumpy and almost impossible to scroll past the two first on the list, it scrolls up again.",2,10,22.19.0.100,2021-10-01 04:48:54,22.19.0.100
8b491c5b-8a51-4b8a-a8ca-0dd101df787b,Duane Leith,"Awesome site to get all our shopping needs and always fast delivery and excellent customer service, and returns are a breeze never an issue.",5,1,22.20.0.100,2021-10-16 22:59:31,22.20.0.100
d1c1655b-ba73-4cce-b0d6-2b2b5c78e76c,Desaray Michelle,I freaking love Amazon!! Always get what I want and the package is never damage or anything. And the tracking is amazing ☺️,5,0,22.19.0.100,2021-10-20 18:16:16,22.19.0.100
6f0f53c9-0064-4a48-bc15-e53d4e4967f5,Gillian Zubairi,"I find it confusing when Amazon says they will deliver on a specific day ( and time) and they do not, even though I have stayed in to receive my order.",4,1,22.21.0.100,2021-10-29 12:38:16,22.21.0.100
7eba4015-beb0-4eb5-90e6-4a519809293c,srfalahss,If you cancel an order will you get your money back?I have cancelled one order and stiil no news.Overall this app is really good for buying stuff but the Amazon Prime has to STOP popping up.,4,2,22.19.0.100,2021-10-04 05:27:18,22.19.0.100
fa733af5-40c6-4f90-9df6-ceb7231bc11f,Trout,The more they add to the app the worse it gets. The app is totally unusable. It locks my phone up. I have to use the website now.,1,0,,2021-10-29 17:52:09,
c3753294-3f74-45d0-b1ef-692723613ce4,Umesh Umesh,Amazon services are amazing and awesome. Because we are order any products in Amazon it is 💯% guarantee they are delivering that product. again Amazon is amazing..... With my experience ☺️,5,2,22.19.0.100,2021-10-05 08:12:10,22.19.0.100
c7a635f5-cc2c-4ec0-b015-e55eb5372b7c,Angela Rojas-Dedenbach,"Amazon, thru no fault of my own, closed my account after YEARS of being a faithful customer. Why? Because someone hacked my account and started buying e-gift cards at $50 a pop. I had NEVER BOUGHT GIFT CARDS!! While their customer service department tried to help me by communicating with the Fraud dept. via their ' internal report with no answer' system.. the fraud department treated me like I was the hacker. My emails were responded to with ""no reply emails"" tone deaf to the facts I presented",1,2,18.9.0.100,2021-10-17 14:05:00,18.9.0.100
de9b7cde-dc17-42cb-be10-54fc14df5310,Laura Wilson,Rarely receive items on time anymore if I receive them at all. What good is an app for a business that fails to give what they offer.,1,1,22.20.0.100,2021-10-29 00:20:08,22.20.0.100
3ab63b03-b3b6-488b-9bec-16b00f6ae730,Rokaya Allam,This app helps me a lot and anything I want is there you should buy from amazon it comes the day after and sometimes it can be 59 minutes such a great app I recommend it,5,1,22.20.0.100,2021-10-23 08:39:49,22.20.0.100
b541410a-308a-4578-900e-143d145c0875,Iain Pollock,Plagued with oops something went wrong errors. Getting to the point I'll need to uninstall and use the web page instead.,2,2,22.19.0.100,2021-10-03 20:40:57,22.19.0.100
df46ea01-f2b1-48cd-a8cd-641c1a2c0117,Alpha Hendricks,It gets to the comfurme point and have me do it multiply times and its really frustrating. And I just want my costume.,1,0,22.19.0.100,2021-10-14 03:27:48,22.19.0.100
9f9e155d-1dad-441b-9bbd-f533b20b6253,Gordon Hook,"Poor app that is really slow, I install it to get into the new type lockers that need the app then uninstall it so I can browse Amazon using chrome",1,0,22.20.0.100,2021-10-24 10:09:48,22.20.0.100
b062f9ac-314f-4117-a5b0-eceb56ac22b6,Chelsey -,"Works good, but please add a way to access your digital content library within the app (game download codes in particular).",4,2,22.19.0.100,2021-10-01 17:26:47,22.19.0.100
e7ea2fe1-2fe3-4fe1-938a-356af9e18e4f,Robert Fouts,"Constant crashes recently. And by constant, I mean every few seconds.",1,0,22.20.0.100,2021-10-27 16:24:29,22.20.0.100
f9a8ad15-6923-413f-b7c4-f4b26333b7b4,Jemar Butler,"useful in comparing prices, delivery is simple , effective and timely. Large selection of vendors",5,4,22.19.0.100,2021-10-04 02:35:32,22.19.0.100
0b027d71-4cc4-4cda-9d70-e8dcf4bbe7f5,C,"Always something missing or different size from the original order, and when you ask for refund the will cut hulf of the original price you purchased, super dissatisfaction.",1,3,22.20.0.100,2021-10-16 05:28:12,22.20.0.100
47644c8f-534e-4b18-bb70-9580fcb0f6a6,Death Zone,This one star is for yalls late deliveries. I'm now on the third day of waiting for a delivery that was supposed to happen three days ago. Yall keep on saying that it'll come the next day. I have never had mail be this late ever. This is just pitiful.,1,0,,2021-10-22 05:45:07,
a81177c4-0f4b-4e23-b72b-25b4a4a09bd7,David Darcy,"Why have you removed the ability to change stores? I switch between USA, UK and uae all the time. Now suddenly I can't. Really annoying.",1,2,22.21.0.100,2021-10-28 09:59:09,22.21.0.100
c50402e8-9ac0-4210-95aa-3c80a884215d,Tamara Austin,I pay for Amazon prime. Trying to have a package delivered to a business as a gift for someone. I updated everything so the know the business closes at 2. Today is the third attempt to try to deliver the package. The lady told me yesterday that I would get my package today for sure. Im livid. Now I have to wait 3 to 5 business days for a refund. This isn't the first time something like this has happened. But it will be the last. I won't be renewing my membership after this.,2,0,22.14.0.100,2021-10-20 23:17:01,22.14.0.100
36d3087e-ab7d-4d4c-9283-01714ee3370d,Mohammad Saquib,Cannot book orders. Error: an error occurred when we tried to set your shipping address. Customer support has no idea about it.,1,0,22.21.0.100,2021-10-30 20:19:31,22.21.0.100
230382a3-934a-472d-832b-5784f005f7aa,Leckie Alexis,Horrible... I wish i never did an update app was working fine i never do updates i decided to give it a try and now it keeps freezing up,1,0,22.20.0.100,2021-10-20 06:21:06,22.20.0.100
a26fd3bf-f4ab-4007-b423-63a48bc1d53a,Jazzy G,"The last app update has made this app so glitchy. It keeps saying ""oops something went wrong connect to Amazon home"" please fix this ASAP!!!",1,1,22.19.0.100,2021-10-10 17:47:46,22.19.0.100
cafa478d-44a8-4032-94ff-5d4fccdd12a1,omar h,How do you collect at least 4gb of data on people fire stick daily and feel people should be okay with that. 4gb is a lot of data to collect.,1,0,22.16.0.100,2021-10-02 19:35:16,22.16.0.100
9cc423f8-6644-473c-a469-ce39af890a6d,bandari bharath,awesome experience! simple and authentic.no one can beat Amazon not even Walmart. best prices and customer centric. my life time bestie and one stop destination,5,2,22.18.0.100,2021-10-01 11:18:57,22.18.0.100
fb9684a3-43a8-4431-b184-4d1554694c47,Darlene Elmore-Machon,I don't like that you are forced to have these apps on your phone talking up space and wasting data miss the old days when phones were what you chose to put on them,1,1,,2021-10-02 10:08:27,
e0480a6f-8467-4b40-8988-fd4e46a5517d,joshua austria,I ordered in seller two weeks ago via creditcard (mastercard) then after amazon charge me for the payment then the seller cancelled my order. Pls fix this amazon.jp. refund my money,1,0,22.20.0.100,2021-10-17 10:14:29,22.20.0.100
355f0e9b-7dfb-42b4-8b42-ed02cfd0a531,Gwyneth roberts,I have been a customer of amazon for a lot of years and I have never had a problem with delivery's or after service . Love amazon,5,1,22.19.0.100,2021-10-10 10:09:53,22.19.0.100
c2ebdb2a-e965-4466-9ecc-19354de1c373,Dotty Thomas,"When ever the app is opened for shoping a message in red ink commes as "" This item is not availablein your country "" What a pity ? If not availble for purchase why you publish these items for sale ? I am from India !",1,0,22.20.0.100,2021-10-24 05:19:44,22.20.0.100
8fdc1265-2820-43d3-9f64-b2b48a2344c5,Mason T,"Can be very buggy at times and even completely freezes. And ever since Bezo's went to space my packages seem to be consitently late or just flat out not what I ordered. Get your head out of the clouds, your company is slipping.",2,1,22.20.0.100,2021-10-26 23:11:19,22.20.0.100
ab1896b3-ec1e-4e68-8023-c4f4c9d71692,lucas smith,Definitely prefer the old layout with everything under the 3 bars on the top left.,5,0,,2021-10-04 11:47:00,
6e0d6e73-2977-4b5f-a6c0-b9d5ddc00698,Jeremy Halden,"I've read other reviews critical of the app, however I personally find it simple and easy to use. And no I'm not lying or work for Amazon",4,0,22.20.0.100,2021-10-18 08:12:57,22.20.0.100
1d16b999-c254-49d0-a62b-e36ccbb45477,Emma Letch,Honestly preferred the old version better this is garbage it's slow the filters for products are just not right like common don't fix it if it ain't broke,1,5,22.19.0.100,2021-10-05 10:08:46,22.19.0.100
4f2018f1-9b89-4522-99fc-3d17581b1bca,L,"I love Amazon,and i have never had any major problems at all... the customer service is beyond exceptional, thanks to all involved!",5,0,22.20.0.100,2021-10-30 06:54:56,22.20.0.100
a1bbbb88-d808-478b-9a41-73d71866fe2d,Brenda P,"All day today when I look at my cart I get an error that something has gone wrong. I wanted to purchase some things, but I guess not.",3,1,22.19.0.100,2021-10-11 00:25:12,22.19.0.100
97fb2496-eba6-489c-ac07-9b82eda390f0,Husein MS,"I canceled the order, and i got this message from amazon app. ""We're sorry there was an issue with your delivery. The package is being returned, and we will issue a refund within 3 - 5 business days after the return is processed"" But it's been 1 week, the money has not been returned to me.",1,11,22.19.0.100,2021-10-02 01:09:36,22.19.0.100
bf4aff32-8bf4-4542-b469-2eae1310cdbd,Terry Heck,Alexa was added to the app! I don't need another app listening to everything I say! Highly recommend everyone delete the Amazon app.,1,0,22.14.0.100,2021-10-29 19:30:09,22.14.0.100
2df7e3ab-4520-4a01-ada8-d96037a4eb89,Shannon Moreau,"Amazon has been amazing, haven't had a problem yet and very impressed with their products. Def will keep shopping lol, thanks amazon😊",5,2,22.19.0.100,2021-10-08 12:54:11,22.19.0.100
ea5acfe8-f5e5-4d3d-b399-74ec24aa11f4,Tammie Lynch,Since the update and changing things it doesn't load alot of times. Frustrating. Guess I'll shop Amazon online. Shame.,1,0,22.19.0.100,2021-10-14 16:09:23,22.19.0.100
77990a9e-cbae-4c52-9ab3-9e307c9a4dad,Emillio Martinez (EMM),"Amazing try before you buy policy 30+days to return Item is Amazing if you find anything Wrong/broken upon package Arival. You can get amazing prime deals if you buy from Verifird sources, btw be Observant before you buy from 3rd party Stores, esprcially from china... they really dislike America, not bias just expressing my genuine Expirence Researching CHINA Culture Unknowingly bought the Lie that the people are different but sadly Everywhere its a norm to teach about USA being the Enemy to CN.",5,0,22.19.0.100,2021-10-12 06:51:24,22.19.0.100
993162e9-bd02-4029-b5c6-c377415087bf,J T,Since the update the Amazon app is totally unusable. I can't do anything including adding payment methods.,1,4,22.19.0.100,2021-10-06 03:07:02,22.19.0.100
802cbcab-41fc-498c-9a94-ab614b48b508,mark endara,"Watch you money, orders and credits. Amazon cheats people all the time. Take away from local businesses. And not all items are returnable.",2,0,,2021-10-15 12:44:55,
6ba64427-5635-4088-95e0-e89c3f8e5d4b,Ferretgurl 1973,I absolutely enjoy this it's a great place to find all you are looking for and there is sooo much more too! It's very easy to use and I think it's just wonderful!!,5,3,22.19.0.100,2021-10-04 00:22:03,22.19.0.100
132de01d-1277-4b39-9477-395299385a39,David Bussey,Uninstalled after about a year. Sluggish and much more difficult to use than just going to the website.,2,0,,2021-10-24 02:31:16,
4a38858a-c466-405b-ba53-0703f3244252,I'm Moofasu,"Its usually fine but most recently the app is akward ""attempted to deliver at 1:07"" must of been a poor attempt considering was at the door waiting",3,1,22.21.0.100,2021-10-30 12:15:57,22.21.0.100
2dc85a90-e5f3-4663-8364-cab0fe458658,Ivan Bukreyev,Opens supported links even though I tell the app not to. I can't stop the app from opening links. Please fix!,1,0,22.18.0.100,2021-10-14 19:11:47,22.18.0.100
77c6eb3d-9bd9-4db9-8292-47ee060bb520,Ana Collins-Sandoval,"I used to like this a lot but, it needs to get more updates because the app doesn't scroll correctly which is annoying.",2,1,22.13.0.100,2021-10-04 03:20:00,22.13.0.100
5f72ab2d-6699-497f-850e-134dea388b8f,S L,"why is it SO laggy now? it takes forever to scroll through pictures. i closed all my apps, restarted my phone and it's still doing it.",1,2,22.20.0.100,2021-10-18 13:52:47,22.20.0.100
d6fbfb8b-3ff2-4e61-95d4-7f129ce69660,Sherif Adel,"Since souq turned their name to amazon, I really had a bad experience in too many points that i can't just write it, everything is horrible!",1,0,,2021-10-18 19:33:58,
f4875337-f5f7-402e-85f6-f3967b73b27c,Steven Beechum,Very quick checkout and great items. Convenient one day delivery on a lot of products.,5,1,22.20.0.100,2021-10-19 17:24:29,22.20.0.100
268942df-5945-4513-ac9a-327bc08ae9e5,John Fewtrell,Totally changed this should of been a separate app Have you ever heard if its not broke don't fix it well you fixed it now its well.and Truely broke I had things in my Basket now they have all gone when you changed the APP,1,1,22.19.0.100,2021-10-03 00:08:28,22.19.0.100
85004d13-965a-4362-821b-218abc00961a,Luke B.,"Idk if they are short handed due to the pandemic, but never in the past have I had to wait 2 or more weeks from the time of return for my money to be returned to me. I would have shopped somewhere else if I would have known 15 days and counting that I could get my money back for the product you confirm came in two days ago.",1,0,22.14.0.100,2021-10-23 04:47:47,22.14.0.100
03c42754-5882-4220-918c-449f12046006,Jane Chapman,Amazon prime is amazing! I've had only great experience with Amazon! Must have! Try it out and you will never use any app except Amazon!,5,1,18.17.1.100,2021-10-02 11:46:25,18.17.1.100
c603723f-6033-427d-ab7d-2042bcbc5fb2,Gloria Lewis,"Very nice to know that I don't have to go to the store to get the things that I need and I enjoy the option to browse , find items that I don't expect to find, THANKS AMAZON 💥💥 !",5,5,22.20.0.100,2021-10-20 20:37:28,22.20.0.100
77e7b7a9-3af0-45fc-bbcf-d3cbaba9cea9,Raney Risner,Please fix app... you cant view pictures of items and it keeps freezing up!!!,1,0,22.20.0.100,2021-10-19 16:05:19,22.20.0.100
7df6ca5d-ee4f-43d1-8300-b4f1236a8081,keith savall,Took something out of my cart and jacked the price up it before I could buy it. Wont be doing business with Amazon anymore.,1,0,,2021-10-10 23:49:23,
290a0dd6-c741-4ec5-906f-20518a6e05da,Raina Taparra,l was disappointed to find out that I bought a fake addidas shoes through Amazon. Now I dont trust anything with the name AMAZON attached to it. This company should be doing more to protect the consumers.,1,0,22.16.0.100,2021-10-27 20:44:37,22.16.0.100
0592d98a-4f3a-4b41-853b-b5429c71ab32,Big Bang Big Crunch,"Latest update is awful! Constantly freezing. App developer must have taken the week off while Bezos was flouting his billions, entertaining Shatner in space.",1,1,,2021-10-21 17:22:16,
7fe50c74-660e-40c1-adf0-fae91ed0aaa2,Sergey Budnikov,Everything good but lately for some reason my Amazon app switched to Spanish and I can't find the way to change back to English,4,1,22.20.0.100,2021-10-25 19:07:10,22.20.0.100
87971d04-9e08-401f-a8c0-d00f7bd853b0,CATCH22,I wanted to buy a book and it said FREE POSTAGE not so . At the checkout it asked for $15 for postage that's not free . Also the items are quite pricey so if the seller's are making a larger profit than other sites why pay for postage . VERY MISLEADING WILL NEVER USE AGAIN .,1,0,,2021-10-27 13:25:33,
9af41155-13f5-4519-9f6d-8e9b87aa5ed8,Derek Murray,I never have had a problem with anything I bought from Amazon. The App I find is easy to use which is awesome.,5,2,22.20.0.100,2021-10-16 01:28:06,22.20.0.100
0a8eb7cd-f989-4335-acec-8fc03a60f439,Angelina Jones,"App was a 5 star till yesterday, now I can look at my order history but can't shop or browse at all now, really hope this gets fixed soon!",1,2,22.20.0.100,2021-10-19 13:20:03,22.20.0.100
17fa9803-63dd-4fcc-a371-9836d3bbc011,Tiwana Barefoot (Tiwana),Not happy with Amazon lost all my gift cards bcs I haven't signed in for awhile and got a new number. I don't have all the old info so they said sorry start a new account....ugh,1,9,22.19.0.100,2021-10-09 20:30:03,22.19.0.100
3b34c0d9-8b2a-4f44-bd25-10526f8d1d2c,Wassim Chammat,"Payment method constantly needed to be added and revised, despite me already having enough Gift Card funds. €33 I'm very likely not getting back.",1,10,22.20.0.100,2021-10-15 19:46:27,22.20.0.100
2c4ca0c6-81b2-4dfb-bc63-d27d16a975b4,Hannah Olsen,Recently my Amazon app has been acting up and glitching out all over the place. It's nearly unusable at times.,2,0,,2021-10-13 14:07:46,
331393d4-f4dc-489b-af26-7029f3ec7850,sid sullivan,"They advised two day shipping on items they know will not actually ship for weeks. And even when it takes the shipping takes weeks, they do nothing. Terrible customer service",1,1,,2021-10-02 14:22:29,
e90bfac9-046d-42e5-b4d8-ae0a46d953eb,tim dunn,Never on time they send threw regular mail which I'm ordering from Amazon got Amazon prime don't want it going threw regular mail cause it slow never on time I pay for prime and hardly ever get on time,1,0,,2021-10-18 23:30:02,
79d0bd20-96ed-409d-b98f-fe55951a1d2e,alfons tellian,"App keeps bombing out - ""oops something went wrong, go to Amazon Home"" and then again same story. I deleted and reinstalled but no diff",1,1,22.20.0.100,2021-10-24 08:06:41,22.20.0.100
c25a54e3-8760-4001-88c6-1b627708418c,SarahAnn,"Who knew there was so much going over there in the Amazon Shopping App?!?! After 6 hrs of checking out all the goods and account options, I am still learning about different product divisions and all of their customer reward programs! Thanks for being You, Amazon Inc, for moving to Texascçg fgggc and bringing a small army's6y worth of kobs. and an even bigger thanks to all of you who work at swiftly delivering the goods to your local customers . 🙏🤠💛",5,0,,2021-10-07 20:55:55,
5f874880-69ec-4993-be4d-fb93335a7ffe,Robin Kann,It's so convenient.. 90% of the time Is of good quality and what you expect expect. The other 10% customer service is really good..,4,0,22.19.0.100,2021-10-07 05:44:29,22.19.0.100
28cc31d9-21f5-4722-8cc2-e9c876f66155,flexter83,Please optimise your! When using the chat the keyboard is hiding what is written. I tried it on Samsung note 10 plus and Samsung galaxy fold 3,1,0,22.19.0.100,2021-10-14 17:48:58,22.19.0.100
a7ea9a4b-be7e-4a22-a573-3ef7f9c14ac8,Supergoldfish,Annoying that they now resort to popping up a purchase prime now page immediately when opening the app.. slimy tactic.. was a 5 star before that..,3,1,22.19.0.100,2021-10-12 16:25:28,22.19.0.100
bd323e86-c4eb-4874-bbed-e97036f9c61e,Kennneth Peters,Awkward and slow. I really don't care about their epic daily deals why can't I configure it to open to my lists or orders?,2,0,22.21.0.100,2021-10-31 19:21:02,22.21.0.100
b8576032-bd76-42ae-8c88-10ef11b53f38,Sheri Lahti,Everything Nicole Clark said is true. I had to update now nothing works. I cant view anything or if it does come thru you cant get any info on it.☹️,1,0,,2021-10-20 04:13:42,
fde48621-7343-45ba-aabf-798073aa74fc,anj,really slow app. will try to scroll but wont respond until a couple of seconds pass. very annoying.,1,0,22.19.0.100,2021-10-14 14:37:20,22.19.0.100
e3732c6b-1e32-41d1-9e49-82e25569a8d9,John Doez,amazon prime is my favorite way to shop. hassle free returns superfast shipping and one of the biggest selections in the world.,5,0,22.19.0.100,2021-10-19 20:04:14,22.19.0.100
73734ade-16c1-4f57-9329-8986adca5495,Rick hope,Was always really good but since the last update its slow and uni and crashes regularly.,1,0,22.20.0.100,2021-10-21 19:53:53,22.20.0.100
345f853e-cd37-41ff-b993-2b86036ff8d1,L,From Amazon website I was instructed to download app to resolve issue. You shouldn't be forced to download an app to talk to customer service.,1,0,22.20.0.100,2021-10-29 17:46:28,22.20.0.100
bc1fc06d-7ece-4297-8f2c-3c81c142f5a1,Sabrina Otey,"I like how easy it is to find certain items, but sometimes it's almost impossible to find a certain thing because so many things show up",4,0,22.20.0.100,2021-10-24 19:05:22,22.20.0.100
7b3fcd5b-66e0-4649-bbb5-702199d84a2d,Edward Stewart,Helpful. But I wouldn't mind some of the products I order get checked for damage and notified of it.,5,0,22.5.0.100,2021-10-21 01:25:59,22.5.0.100
