reviewId,userName,content,score,thumbsUpCount,reviewCreatedVersion,at,appVersion
4a89f11d-52be-4b0e-bcb4-7ab223a36a2c,Bry Si,"Not so much about the app itself but the content. When you select one item, it suggests two other items to go which are unrelated at best and at worst ridiculous. Also, it is unfathomable how the algorithm comes up with completely nonsensical suggestions. Is this the much touted AI in action?",3,1,22.20.0.100,2021-10-25 23:35:32,22.20.0.100
f7512e3f-7a7e-47ea-ae07-62f225502353,Ayiana McCaw,"Amazon, youve been a great app, 5 stars really, but for the love of christ PLEASE fix the app. Your latest update ruined you and clearly by these reviews a lot of people agree. I can hardly search anything but on the now rare occasion when I can it either never loads, or most commonly, Ill click on one thing and then the app freezes so I cant save it, buy it, or compare it with a similar item.",2,28,22.20.0.100,2021-10-19 22:52:24,22.20.0.100
9738eef4-eb84-4395-ac18-f6daa59e5cf9,Sherry An,Check all system and in app permissions and settings. There is no way to remove/permanently disable the Alexa button. If I accidentally tap and enable it I will immediately disable my account and permanently uninstall the app. You have around 15-19 square inches of screen space and you already use FAR too much of it on a search bar and nav bar that can't be hidden. Its just annoying.,1,0,22.17.4.100,2021-10-26 04:13:32,22.17.4.100
1269091a-7797-4f46-9707-aec782ac2e03,Annie,"Horrible ..Not sure what they did but with all the money and resource that Amazon has, how can you make an application with so many glitches?? VERY slow and freezes up when you try to look an item.. Funny, that they can build a spaceship but can not make a decent app!! Fix this!!!",1,5,22.20.0.100,2021-10-22 03:40:25,22.20.0.100
cf191e6f-4c07-4447-a381-93fd9675fd96,Nikki Z,"When I open an item if their are other options when I click on the other options the image doesn't come through clear... it is in the gray mode like it's thinking, I do not get a clear picture. Rachel dunning said it best, I 100% agree. It might be time to shop individual stores",1,18,22.19.0.100,2021-10-09 13:00:01,22.19.0.100
4c0529e5-797e-46c1-9af1-ff7dc10d5a35,Tom Hindley,"Good, convenient. Easy to use, and obviously faster than using a desktop PC. The near realtime delivery updates are reliable. Occasionally doesn't work, but I think that's an issue with Amazon servers, not necessarily the actual app. And no app can be perfect!",5,21,22.20.0.100,2021-10-18 22:50:41,22.20.0.100
6aeb79ca-e787-44c3-99ae-5b85a833accf,Randi Keats,Makes life so much easier. Minimizes time spent on errands. Search and purchase from wherever you are. Much better than a store. Stores are individually rated and products vary. See it all. Don't worry about not finding your size in one location see all. One stop shopping for so many goods and products. Don't need multiple stop errands. More free time. Easy returns quick deliveries. Life made easier!,5,107,22.20.0.100,2021-10-26 03:53:52,22.20.0.100
dc336eb0-73cb-4d19-9daf-32e7ab4494d1,Nick D. Sykes,"No way to exclude terms in your search, and amazon doesn't monitor misleading and/or straight up dishonest listings, leading to a lot of wasted time and potentially wasted money. The (-) operator to exclude terms in a search has been around for a long time... you'd think the richest company in the world would have the cents to implement it!",2,4,22.19.0.100,2021-10-03 15:39:11,22.19.0.100
dae80996-3ba6-444a-b527-eebfd6294edb,Das Faria,"Dude I can't buy anything literally. Its saying my card doesn't match up with the numbers and when I try the scan option instead, it just stays stuck on a black screen. Its not my phone cause I had to download a scanner app to test it and works fine. So idk if this is an Amazon thing or whatever but as a first timer to the app, its absolute hotdog water and piss.",1,11,22.19.0.100,2021-10-04 11:45:10,22.19.0.100
ee054617-0672-4ecc-93ae-ce6f3df22ca8,s bari,"Update is rubbish. When buying books cannot add kindle books to basket, so if you click buy accidentally you will be charged, which means you can't add discount code. Amazon suggest you add it in accounts then look for books, if this is correct why isn't this method used for other products. Can't also see what I'm typing when chatting with customer service",1,34,22.21.0.100,2021-10-29 06:19:16,22.21.0.100
41386b13-cc11-4664-ab4f-386850e881c2,Courtney Maerzluft,"Okay I don't know what it is but the last update freaking sucks, I swear something is wrong. When I first load the app it's relatively okay, but when I try to look at something I'm thinking about purchasing, it just won't let me look at the photos like it wasn't done uploading everything that was supposed to be on the screen in the first place. I also want to know if you can tell your orders that you have received it instead of saying 'still shipping' when I've received the order months ago!",1,22,22.20.0.100,2021-10-27 02:44:33,22.20.0.100
2fd1d4ba-a43b-42b6-b472-60d0a4879a46,L M,"Not a fan of the new layout. I hate the buttons on the bottom. It makes no sense. Photos stopped loading since update, constant errors loading. It's driving me insane, I've had to shop elsewhere. App has been not working correctly for weeks. I can't load photos or items I want to buy. It's all messed up.",1,14,22.20.0.100,2021-10-21 18:19:06,22.20.0.100
937eb0ed-9b12-408d-ae3b-98f8650aebb6,Loren Willis,"I really dislike the payment options. Most other online shopping sites allow you to pay via PayPal, not Amazon. They want you to keep your credit card details stored in your account, not really safe in today's world. I know nothing is 100% safe, but at least with PayPal you have that extra layer of security with payment details. The amount of junk is phenomenal when searching for particular items.",2,21,22.18.0.100,2021-10-01 21:17:35,22.18.0.100
bd87fe77-fbe4-44bb-9432-00de104eeb1c,Louis Jimenez,One thing amazon has that is good is the delivery. It shows when your order is near by. But when ordering it's really a 50/50 thing like all app. One thing I really dislike about Amazonis that when contacting the seller you never get a response or answer for your questions. So when something goes wrong with your order you might not get a solution. I experienced situation where their was no solution. $$ LOST.,3,96,22.21.0.100,2021-10-31 17:20:09,22.21.0.100
4f342bd5-1ff6-451d-a25f-bfab8fde89a3,Denny Owens,"Pretty good, use it a lot as most people do. The app menu design can be a little odd sometimes. For example if you're trying to get information about a delivery, it can take you in circles through menus rather than just giving you a customer support link. Other than that no complaints.",4,8,22.20.0.100,2021-10-24 01:58:07,22.20.0.100
67d268ff-5e3c-4bf7-84c4-3d4023c0b0ab,Felicia Gribbon,"This app is so garbage now. I can't even use the live chat with customer service anymore without uninstalling and reinstalling the app, just so I can see what I'm typing because the interface won't adjust for my keyboard on my phone. They have also as a whole been a terrible company for the past 2 months! I've had nothing but trouble with deliveries from them in that time and no matter how much I report and complain, they do nothing to fix things and prefer to remain broken as hell.",1,45,22.19.0.100,2021-10-01 17:28:56,22.19.0.100
2782d6da-2d26-4fba-99e8-f0ce397d581a,Bridget Mallak,"Used to be great, now almost unusable. Every single search now only works for a very short time. Then the app becomes unresponsive, won't open new pictures or links, won't scroll down the page. Have to hard restart the app after looking at just a few items now. So frustrating and worthless.",2,16,22.21.0.100,2021-10-30 05:06:06,22.21.0.100
d0acac76-8f7c-45c0-9300-eee26260faf6,Nelliliuciamylove Andriukaitytegood,"Became complete rubbish. Can't do ant see anything! No access to my account, even through their website. On website no my activity during last 3 months, though preordered items and their emails continue to come. Even one star is too much! They do nothing to change the situation and do what they want with my account! SIMPLY TERRRRIBLE ATTITUDE TO CUSTOMER!",1,8,22.20.0.100,2021-10-26 10:18:06,22.20.0.100
cbd238bc-b70d-4133-b7b5-eabf61165c44,Julian L,"New version where the buttons are on the bottom is laggy very often. Android here. Swiping product images becomes impossibly laggy it's unusable. Amazon you're one of the world's largest entity. Faulty app should be visible/identified/fixed in a matter of days... CMON GET IT RIGHT, ITS JUST AN APP!",1,7,22.20.0.100,2021-10-23 19:33:56,22.20.0.100
cbd610eb-03e4-4cb9-8031-f9b0e3936bcc,Shubham Gupta,"The image scrolling is completely freezing, this is both on chrome and Android app. Please fix, ruins the experience of shopping. By images,I am referring to the 4-5 images that show up of the product I open. These images are are the top part of any product page",1,6,22.20.0.100,2021-10-18 07:09:10,22.20.0.100
bc4b357a-7d04-4c6a-82c9-5a5a571d7740,Normashel Gonzalez,"These updates make the app super slow. Like unbearable slow. I wish you guys would add a (add to cart) 🛒 on each item. Sometimes i don't want to click on the item, wait for it to load so that i can than add to cart. I just want to add to cart and keep scrolling down! Love the new features about furniture and clothing 👍🏽👍🏽👍🏽",3,3,22.20.0.100,2021-10-28 00:25:34,22.20.0.100
1d679c9e-343a-4681-82ed-f2c602a60219,Holly Indence,"Fix the textbox for declining orders. when you use your stylist the Box covers what you're typing and you can't see your Mistakes Not can you see where you're at when using a device such as a Note plus. Overall, I find the app clumsy, Not user-friendly, nor is it intuitive. Trying to manage family through this app is ridiculous.",1,12,22.19.0.100,2021-10-05 11:27:05,22.19.0.100
0d95840e-1a2e-4e81-966c-1b0a78d11832,Dea Flemming,"Amazon needs to change their payments. I want to pay when I order, not when things are shipped. I order stuff only to find out two days later that it's been canceled, saying there was a payment issue, (which has been false all three times)! Getting sick of this!",1,11,22.20.0.100,2021-10-20 21:59:13,22.20.0.100
e1898d8d-dace-4f2e-9c27-b003c6cba1fa,M O,"Very frustrating when it displays items that cannot be delivered to my location. I'm logged in and have prime so it should be able to filter these items out and save me trawling thru numerous products I can't actually order. Also it offers no advantage over simply using the website. Stick to the website and ditch the app, it's not worth the effort.",2,93,22.19.0.100,2021-10-04 22:29:31,22.19.0.100
50b8d4ca-6cd2-4cab-bbf0-1fc0d400cbb6,Jenna Galvan,"The app is super convenient, but it crashes a lot. I also wish that I'd a payment method needs to be revised, that they allow you to use a gift card as an option. Currently you can only use a gift card from your shopping cart, but if your payment is declined and you go to change payment method, this option is not available and its super annoying to have to cancel an item and then reorder it just so I can use my gift card. Please add this as an option.",3,112,22.20.0.100,2021-10-28 11:26:29,22.20.0.100
3b2cd64c-d37b-4c3e-b690-ea9848ad65f6,crystal chiatto,Update is so bad! It crashes and freezes constantly! I'm apart of deals groups and now I cant get the deals cause it sells out by the time it brings me into the app. It's always freezing when I'm trying to buy something too. It's really frustrating! Please fix this!,2,1,22.20.0.100,2021-10-27 22:02:24,22.20.0.100
c13c3635-e005-4822-b92c-f62fb2a44e0f,db,App used to be very good. Now since the last update its slow as hell. Every screen takes forever to come up. (Not a connection issue ive got a gig up and down on my home network and pull +100mbps off the cell tower in my neighborhood) the app just doesnt want to load worth a damn now. Its the same with my wifes app on her phone. Since they changed everything about the app its just slow,1,40,22.20.0.100,2021-10-25 19:01:03,22.20.0.100
43f4ccfb-e505-49b9-9468-140df8008f90,Denise Booth,"It was fine before. However, in the last few weeks, the app has been glacial. It freezes when you try to look at the next picture of an item. It freezes when you try to load another item. It freezes when you do a search. No longer shopping thru the app until they fix it.",2,1,,2021-10-19 22:33:02,
5e8dcf16-cbb1-4121-a12e-c51e7d3e333c,Philip Bateson,"Difficult to use. Took me ages to find out how to sort orders from low to high price. When there are hundreds of items found after entering a search, why does it only show me about half a dozen and then I have to keep clicking next and next and next to display the following half dozen. Very poor design, poor use of available screen space. Stop pushing ""items related to your search"" taking up a third of the screen and just concentrate on showing what I have searched for, in one scrollable list.",1,182,22.19.0.100,2021-10-10 10:49:45,22.19.0.100
26ade74c-18e0-433c-bee9-07a602b1841d,jerrielyn Coupe,I absolutely love the app! What I don't like is the fact I can't get it to stop running in the background I have to go in and force stop every time however I can't remember to or I'll be in a store I look some up and who's going to remember while they're shopping! I have a good phone and great battery and my phone is getting hot and my batterys not lasting 1/4 of the time it should. It's not done this before and I have the same phone!!,3,6,22.21.0.100,2021-10-30 23:59:32,22.21.0.100
9ce23cfc-1111-4c9f-9eff-5b86f6c08507,Cynnimin Danton,"Last Update, Made Shopping Impossible to Enjoy. I am a Heavy Shopper on Amazon. Now it freezes up, pages will not load, app won't open, slow slow slow. I have to close the app in between items just to see the next one. Most frustrating is it won't let you add to cart most of the time. Fix this Please. Maybe Amazon has Monopolized the Market too fast.",3,19,22.19.0.100,2021-10-04 15:27:52,22.19.0.100
982fd01c-113f-409a-8354-19aea5bbfaec,Chynna LeBlanc,"The new app is so horrible, it loads slow and freezes up. It's also not as user friendly. It took me so long to find out how to cancel a channel that I have deleted my entire amazon account. No use to try to use it anymore. You cant keep changing apps this much and expecting older ppl to be able to use it when u make it harder to use. Two thumbs down.",1,172,22.20.0.100,2021-10-19 14:57:44,22.20.0.100
6929fcfa-3559-479f-b2e5-59283b8779e4,Monica W,"Since the last update, if you click on a different color product when viewing it the pictures freeze when loading. So many times, I can't see what the color I think I want actually looks like in photos and I have to pass. Please fix this!",3,3,22.19.0.100,2021-10-11 01:18:07,22.19.0.100
7fdf883b-6a15-4c34-b339-11240e5038da,Angela Sarvis,The last two weeks Amazon Shopping has all of a sudden become very glitchy and unresponsive. I have had this app for years and never had any issues but it's so bad now it's almost impossible to look at or order anything. Something with this app has been changed recently and not for the better.,2,12,22.20.0.100,2021-10-23 22:20:33,22.20.0.100
6a33f9d8-918c-4ce4-9b10-d2410ebc0035,Malcolm Lalkaka,"The app is has become less reliable and responsive lately. For example, tapping on photo thumbnails to bring up the larger photo now takes very long to load. And pinching and zooming in lags so bad that it basically doesn't work at all.",2,1,22.20.0.100,2021-10-28 02:41:23,22.20.0.100
708b6697-5dbd-4efd-b08d-c1379b15ca70,Y L,"Worst Update Ever. Ever since the last update I can't view other colors/sizes/options for any item selected. Once I click on a different color etc. it freezes and won't display anything more except the first thing I looked at. Used to love the app, now it's broken",1,7,22.20.0.100,2021-10-18 02:08:50,22.20.0.100
b61ad791-2523-4691-8dfb-4e211fa1006b,Ian Howerton,"This app is convenient. Too convenient... Or it would be if it would stop giving error messages, and being glitchy. Recent update has caused the app to freeze, run sluggishly, or just glitch its way to the item/menu I would like to view.",3,0,22.19.0.100,2021-10-16 05:06:53,22.19.0.100
12b34e33-bc36-463e-8cc7-e9fec911eaec,gary shearer,"Search results failing to return anything. Blank page when searching for ""cat"". Switched to wifi, results showed. Turned wifi back off, next 2 searches worked, then the results disappeared from the screen. Screen then said something went wrong on our end.",1,4,22.21.0.100,2021-10-31 06:37:20,22.21.0.100
d403b417-9438-4760-9866-5308d5f6c14b,Stephanie Brent,"Unresponsive and slow. Can't scroll, it just stays frozen for way too long. Can't tap on anything unless you hit it several times. Nothing wants to load and random errors popping up. 2021 seems to be the year all these big companies destroy their apps and make them useless.",1,9,22.20.0.100,2021-10-17 18:20:46,22.20.0.100
055f5d2a-b943-4d37-9c05-39f9473d75f1,Debra Mason,"It seems as if Amazon doesn't worry about the online shopping experience for customers because they have few competitors. App is messed up since update, search engine is worthless...I have items that don't show up in search results that I sometimes find by accident. The paid results are so so so annoying. Just let me shop.",2,16,22.21.0.100,2021-10-28 17:05:02,22.21.0.100
fe90379e-0b21-4be4-aa5a-3bb5f5527cd6,Richard Crowley,"They plan to start charging an additional 0.5% fee for Visa credit card users next month, per their repeated emailing. Given the size and profitability of Amazon, this just seems like another way to extract more cash from customers rather than a legitimate claim (especially given the lack of a fee on American Express cards, where the fees should be higher, on average).",1,10,22.20.0.100,2021-10-24 02:25:50,22.20.0.100
d6a93597-a5a1-4e4e-882c-3f0fbdbb757f,Cameron D,"This is an app review, not an Amazon review. The app is strictly for buying and has little other utility now. The search engine is useless unless you're looking for a specific item to buy. It's virtually impossible to find a storefront page or a smile charity. And, the Nosey Alexa button brings no value and can't be disabled. And, WARNING: Alexa has access to record without your knowledge unless you block the app's microphone access directly from your phone settings ... even then, who knows.",2,13,22.19.0.100,2021-10-07 04:09:43,22.19.0.100
7dbf8656-1518-426d-a8f9-6c28e816b28e,A Google user,"Absolutely LOVE Amazon app. I ALWAYS price compare things I need / want with Amazon. I find it's also a million times better than Ebay !! The amount I've brought off Ebay lately that hasn't showed up is disgusting, I've NEVER had a missing / incomplete / wrong item / no delivery at all with Amazon. I literally check Amazon for everything I buy, even as I'm walking round Wilkos I will check to see if Amazon sell it cheaper & with same day / next day delivery one can't complain.",5,18,22.19.0.100,2021-10-12 04:43:02,22.19.0.100
c12deb55-33ea-4840-9a8f-8f9c90ada4e0,Roland Tyler Smith,"Amazon has always been outstanding. It's so much fun for me to shop Amazon and have a variety of choices. My only complaint would be, how they've started generating more emails ànd delivery notices, and such receipts, confirmations, etc. And the emails become too much. To many to delete. Confusing too.",5,8,22.20.0.100,2021-10-17 06:21:28,22.20.0.100
882af80a-3691-41c4-ae00-1529b249be93,M L,"The Fresh search option does not work on my S7 tablet. It returns normal Amazon stuff instead of Fresh ones. It's been like that for months, please fix it. The app on my phone works correctly, it's only the one on my tab that doesn't work well. Thx Update Oct 2021: STILL NOT WORKING, PLEASE FIX THIS!!!",1,17,22.19.0.100,2021-10-04 06:47:25,22.19.0.100
e6428734-329b-469c-92ea-7d1cc483448b,Andrew Bryant,"Use to be a great service. Less and less items ship in two days after paying $120 a year for the shipping. You can usually find the same items cheaper on the Walmart app and still get free shipping. Most of the so called benefits, I don't use. It would be nice if Amazon would itemize benefits and let you pick whats best for you.",2,57,22.20.0.100,2021-10-19 03:43:24,22.20.0.100
c6d79ca4-cf75-43a8-a9fc-e6617505525b,Lily L,"Used to work fine, but I made the terrible mistake of updating it and now it freezes when I tap on pictures of products and/or doesn't let me see different color options without crashing. RIDICULOUS that AMAZON a company spawned on the Internet, cannot manage an app that actually works!",2,0,,2021-10-22 03:43:10,
e0069011-0a96-4001-89c9-16f00f3b6d44,Kevin Arnold,"The app has become so bloated and slow and navigating back and forth between pages is a pain because the page will display but then reload itself. Amazon obviously is a massive storefront, but there's no reason their app should be so clunky and bloated.",2,2,22.19.0.100,2021-10-15 09:22:41,22.19.0.100
f4570311-4ec6-40e8-88df-ec15487f8e7b,Starr,"Love the appsuper functional. Easy to track orders,love thier suggestions for products to purchase. The newest UI is wonderful much easier to locate things. Easy to use. Great company,awesome customwr service chat or call back options when there's a problem. Overall thee functioning and ease if use is top notch best shopping app out there. Just don't lose access to your 2 factor authentication phone number cause you'll lose your account and ev erything in it. Even gift cards! Lost everything",3,69,22.17.4.100,2021-10-03 18:33:39,22.17.4.100
fe8f0501-fcb7-4adb-b6b8-dc1bc2ee75f3,Matt W,"Two weeks later app is still buggy and laggy. Unfortunately, this is likely the new Amazon as they got too big and lost the ability to control quality. Time for competition to start taking chunks of business away. Happens to all big companies. Amazon isn't special.",1,8,22.20.0.100,2021-10-21 01:23:51,22.20.0.100
a0ffd327-6fe3-4fa7-84aa-47591cea057b,Iggy M,"Latest update sucks, my order list is not complete so I can't cancel or contact sellers on orders that are missing. I also don't like having to click the bottom to find my orders in multiple ways, just not as intuitive as it was previously. Sometimes on their way orders show on top, sometimes they're just Mia.",2,13,22.19.0.100,2021-10-03 03:33:09,22.19.0.100
dbbb56d2-2ddd-4de2-a4b0-6d666fc1f4b4,Charles Cox,"The app is now slow and I get the puppy dog something happened in our end stuff often. It's longer enjoyable. I'm going back to just using the website. Also, I was able to copy some hidden text from the puppy dog page and it contained a lot very personally details like my device model and my carrier. Why does Amazon need that to display products?",1,27,22.20.0.100,2021-10-25 00:28:36,22.20.0.100
3b5b2bd9-5cc9-41bd-bc79-b69af4911678,Brendan Boerner,"Can't install one phone after firmware reset (""this app is not compatible with your device"") despite it being on my phone previously. Amazon support referred me to Google which isn't providing support during the pandemic. Noticed same thing on my backup phone which I'd previously done a firmware reset. Oh well.",3,1,22.21.0.100,2021-10-29 21:39:09,22.21.0.100
68cbda49-1652-46e9-b3e6-56ed3db8568c,Phil J,"Uninstall/Reinstall! The latest app (as of 22.20.0.100) for android is absolutely TERRIBLE if a previously installed ver of the app is upgraded in-place!  It's laggy to the point of being unusable. An uninstall / reinstall seems to be the only way to restore acceptable functionality. Amazon, if you're listening...your app dev, and more importantly QA and pilot testing (the latest upgrade problems are painfully obvious), needs improvement.",2,17,22.20.0.100,2021-10-23 14:20:38,22.20.0.100
a3b68708-c292-4369-9ad1-1c1c59bc50e9,Jourdan Devant,"This app was great...now when you try to see another option available, you cannot save it or scroll through the photos. I have to add the item to my cart and click on it from there to view it, then delete it. Super frustrating. I have un/reinstalled the app and rebooted my phone...no joy.",2,20,22.19.0.100,2021-10-07 11:12:05,22.19.0.100
93457c74-0410-4dd2-9f92-458e3d9fa6a0,Rebecca Ditto,Glitchy! The screen is so jumpy while I'm trying to navigate and I've been trying to proceed to check out my items in the cart but it won't load that page at all. I guess I'm going to have to wait for another app date to be able to purchase items.,1,5,22.19.0.100,2021-10-10 13:55:42,22.19.0.100
59575b38-2a85-4ea3-b8cd-779d69157079,Rebekah Amelia,"I liked amazon. Not anymore cause subscribed to all there channels. Not just amazon prime but shudder, icon movie channel, MGM, amazon audible among others. I dont even remember to signing up for a audible subscription. I try cancel all these and yet there still charging every month after a confirmation of cancellation. Also customer service unhelpful. I was even refused a refund for cancelled and returned order and had to wait over 2 weeks for refund. Joke of a company. I wont be using much.",3,8,22.20.0.100,2021-10-31 07:43:37,22.20.0.100
82fa3275-d6eb-4441-a55a-ebda0022bcc8,Ingrid Parena,"Sending orders through is easy (maybe too easy for my own good). Review process could be better. I like when there are shipping options, with bonuses for no rush shipping. Hard to edit reviews and keeps reverting to old version if you try to update it.",4,2,22.20.0.100,2021-10-27 19:25:48,22.20.0.100
