reviewId,userName,content,score,thumbsUpCount,reviewCreatedVersion,at,appVersion
bf3297a9-cab0-4b65-8390-918148d91afd,Jason Hamer,"I would give them negative 1000 stars if I could. I e been trying to order a $1700 electric scooter for over 3 hrs. First my bank declined the transaction and I have no problem at all with that. But then after ordering 2 orders of this and another order they all are cancelled, because it's suspicious activity of me buying something for $1700. I'm sure most people don't buy $1700 items from Amazon, does everyone get this type of shittery service. I am cancelling my prime membership & deleting thm",1,2,26.15.0.100,2023-08-05 13:41:53,26.15.0.100
afa5cf77-b9e8-481b-9816-c0092409804b,B R,"You can only see the stars now, not the number of reviews right beside it. so now you have to click every single one to check. It could show 5 star rating, but only have like 4 reviews and somehow it's listed as a best seller? Sketchy. Also, put the search bar back at the top. Annoying.",1,1,26.16.0.100,2023-08-31 04:01:12,26.16.0.100
2a97ecbb-56f1-4320-9b42-2b6414fa8412,Kaytie A,Update Not using the app till they fix the search bar from bottom and back to top!! Hate it!!! Can't find the help button easily. Need to be able to easily open a chat with customer service. Please fix. Hate the new update omggg now you cant see how many reviews as easily from the searching. Walmart is better.,1,11,26.15.2.100,2023-08-18 22:15:54,26.15.2.100
50a11489-4b1b-4904-af55-67410d4a9c77,Elizabeth Marquis,"Who decided to move the search bar to the bottom of the screen? Has this person been fired yet? Were they already and this was their parting joke on the way out the door? App was fine and worked well most of the time. Now it's just a mess and I keep looking for the search at the top, like everything else on the planet. Fix it or let us move it where we want.",1,0,26.14.2.100,2023-08-03 03:59:16,26.14.2.100
47cfe887-3e9e-428d-8d14-5e11c9f7931f,Na Na,"Yeah, sucks. You make a purchase, then it says you made a purchase; then to find out you thought the purchase was paid for, so you carry on your day thinking you had enough money in you account to pay for it. Next you know you didn't have enough in your account to cover the purchase bc again, carrying on your day assuming you made the purchase. Then it's not purchased. So basically Amazons payment methods horribly. It takes way to long for it to be processed, it's more of a hindrance. Done buyin",1,0,26.15.0.100,2023-08-11 19:12:39,26.15.0.100
79e45cea-63fa-4d7d-a1db-d1455245ccad,asmar adel,"Access popular pages quickly with our new shortcuts. Tap and hold the Amazon app icon to access your Orders, Daily Deals, Shopping Cart, and Search. AmazonSmile customers can now generate donations for their favourite charity. Just open Settings from the menu and tap AmazonSmile. Enjoy our latest update where we have fixed some bugs and improved our app to provide you a seamless shopping experience.",5,1,26.15.0.100,2023-08-06 01:01:33,26.15.0.100
d93ae2bf-733f-4ce5-9dab-f98552beb68f,paul putnam,"App keeps Crashing & I have trouble completing orders. Everything else on my phone works just fine, with no problem, only the Amazon app. Just started happening recently & is Very Frustrating!",1,0,26.16.0.100,2023-08-20 21:11:31,26.16.0.100
415290e7-fa10-452b-b811-83f8e8caa80a,Dan,"A good placeholder for the website, dropping to three stars because if you want notifications when you shipments arrive you also get spam notifications, basically ads that pop up trying to sell you stuff you're not interested in. Very big let down all because of greed",3,0,26.15.0.100,2023-08-10 16:55:02,26.15.0.100
66adfc13-589e-42d2-821a-78183a1d52cc,katherine hewko,I can always find what I need on Amazon. There is a vast selection of products and the prices are usually the best. The app makes it easy to search for items and refine desired categories.,5,3,26.15.2.100,2023-08-19 06:01:39,26.15.2.100
acccc9ea-9bc7-4df8-8331-6f2c78b6763f,NOM DEPLUME M.,"Amazon especially Prime member for yrs was okay however since 2023 its been constant with prime next day delivery and that includes prime purchasing too, Ive even been stopped buying certain purchases with unrealistic reasons like this is because this item or items are a best seller at the moment? So that actually stops me purchasing them ? Really. Also why did Amazon have my new bank card details on my account when i didn't put them their?",1,2,26.15.0.100,2023-08-12 05:27:36,26.15.0.100
6091cb90-8935-42e0-8d06-4eb4e88eb8e5,Shawndra DB,"It's the vast array of products (many available for next day shipping) that gets me. I'd give all 5 stars but every now and then I snag a ""lemon deal"" (a bad product from a poor seller, for that, 1 star subtracted but other than that. I've mostly been pleased with products purchased).",4,0,26.15.0.100,2023-08-09 17:07:12,26.15.0.100
0a83bbf8-a52b-4eac-add2-259dbb465c4e,Jim Rasmussen,"Claire was given the option to move home with certain expectations. We had given her today as the final date to return. She has chosen not to move here and has also blocked me on phone and text. Therefore, Claire has also chosen to not fulfill her parental responsibilities. Dan and I have done and offered everything possible to help Claire to return home and regain custody of her children with no response from Claire. In light of these facts, each family needs to take any/all actions that they f",4,0,26.16.0.100,2023-08-20 13:59:16,26.16.0.100
51ec0d8e-87cd-40da-8167-3fb7a1b14d3d,Jeff,I can rarely view my orders. It does not load. Even if I exit the app and reopen it. I even updated the app and it did not fix it. Still having the same problem many months later. Guess the billion dollar company can't fix it.,1,1,26.16.0.100,2023-08-26 00:28:38,26.16.0.100
bbaea936-6be4-46bd-b7a0-6c7ca95bb11f,Ian Shepherd,"Why even have Amazon Prime? Your package won't arrive same or next day, its always late and when it's not, its damaged. Wasted 16$ a month for ages before I finally realized that Amazon doesn't offer a good service anymore. Its a waste of money and time. USPS is faster.",1,0,24.21.4.100,2023-08-27 20:39:47,24.21.4.100
1ea86794-16e4-4527-8bc3-5ad7a2a8722a,M,"Please fix the app. For the last couple months or so the Amazon app has been a hassle to use. It either does not load or is slow to load pages, videos, pictures.",2,0,26.10.4.100,2023-08-26 19:51:10,26.10.4.100
d0f075c8-9a88-44a3-9337-c18f6d6dc22a,Grant Ceffalo,"Ok, removing the ability to buy Kindle books is annoying. But then to force users who brouse for the desktop site, then be forced to use the nonfunctional app is beyond annoying!!! So now I need to use a desktop to buy Kindle books? BAD AMAZON!!! I wish I had a virtual newspaper to tap them on the nose.",1,1,26.8.0.100,2023-08-13 21:39:35,26.8.0.100
b3675faf-5f79-4818-87f7-fd16472c123c,Casey Joe,"Removed the ""at a glance"" numbered star rating. Being able to see the difference between items that are 4.1 stars and 4.6 stars is helpful. Now I'm having to click each individual item. Not helpful.",1,1,26.15.2.100,2023-08-17 19:40:56,26.15.2.100
22d019be-79d6-4437-900f-e290ecae6e14,James,"Amazon continues to ruin everything that was good about Amazon. Shopping has made horrible changes. So has Prime Video, Photo, Music, Alexa. I wonder if the executives that order these changes ever use these services.",1,1,26.11.0.100,2023-08-27 08:02:59,26.11.0.100
4543e995-4c25-4ad7-a06a-6f2009649e60,Viola Davidson,The new update does not show me the number of people who reviewed an item until I click on it. It shows the star rating and the % of people who gave the item 5 stars but I much more prefer knowing how many reviws an item has before I click on it. Not happy with this update at all.,1,3,26.15.2.100,2023-08-16 00:43:48,26.15.2.100
4f9f6dbc-455e-4a66-91f5-a7980f586605,james,Latest app update was 6 days ago. Now the app opens the home page but there is no response when I tap one of the icons on the bottom Nav bar. The app is essentially unusable.,1,2,26.16.0.100,2023-08-24 20:33:29,26.16.0.100
a6ab5784-514b-4ec4-b5e7-ab8bb44d8011,Ta Duh,"The app is semi user-friendly but also garbled enough to make it difficult to get any assistance. If you're able to find that function - GOOD LUCK GETTING ANY HELP! 7 different customer service reps in a row could not resolve one simple issue, which was a result of Amazon breaching Australian Consumer Law with false & misleading advertising. Of course the whole organisation is incredibly unethical and I don't blame them for hating their jobs when they work for an evil creeper.",1,0,26.14.0.100,2023-08-01 12:53:09,26.14.0.100
dd8cd5c1-ebc4-4568-bea8-79d8c1c3be08,Yvan Shank,"The changes to the interface of the app makes it extremely difficult to find what I was used to . The warehouse Deals section has done away with a whole bunch of departments, or has made it impossible to find.",1,2,26.16.0.100,2023-08-29 23:40:22,26.16.0.100
d20cbe51-5a34-4696-8bb0-4365f1d7d752,Ifeoluwa Peters,I LOVE to use Amazon the is very easy to use and it has all things I need on there. The free shipping is very nice and the things I buy last a long time too. There is no false advertising every thing the product says is what it is. I do not what my world would be like without Amazon Shopping. ❤️☺️😁🤩👍😘,5,4,26.15.0.100,2023-08-12 01:11:50,26.15.0.100
85c594a4-6553-44ff-aa57-2b97fcb9a019,Vladimir Mijatović,"The app started opening itself at random, usually when I'm on FB. Page that Amazon app is opening is related to an add in FB Lite app that's not even in my viewport. I have serious privacy concerns.",3,1,26.14.2.100,2023-08-03 11:44:46,26.14.2.100
b2c5a427-1150-4851-8246-4dd7dba8fb40,Anthony Torrero Collins,"I have deleted the amazon app on android because of videos in search results. it's intrusive, and only delays my ability to find the product I want. Do not install if you want a fast, non distracting search.",1,1,20.13.0.100,2023-08-28 15:34:40,20.13.0.100
a35a4fe0-a0b8-46f4-8862-0b3395082306,Jaymie H,"Hate the new update that shows you the percentage of 5 star or 4 star reviews instead of how many reviews there are. I don't care what the percentage is. I want to know at a glance when browsing whether there's 10 reviews or a 1,000. That has a much bigger impact on my interest in buying something and helps me to gauge the quality and reliability way better. Switch it back",2,2,26.15.2.100,2023-08-17 23:52:32,26.15.2.100
a15a1007-54e3-4b48-840d-636bd33ed211,Phil E,I only installed it to get a £15 discount which I had to complain to get. I have kept it though because I like the notification it gives when the delivery is close e.g. 8 stops away and then easy to track or add delivery instructions.,4,2,26.15.0.100,2023-08-08 17:21:37,26.15.0.100
78118185-7458-4956-ae58-ac74203c37b7,Jeremy Martinez,What's even going on? It's basically showing the desktop product webpage on my tablet. The add to list feature is broken. These changes happened all of the sudden and I'm not even sure if it's supposed to be this way.,1,1,,2023-08-06 19:36:18,
9444856c-042c-4d20-805a-7af2e586e293,Patty Boyer,"Amazon is the greatest!! Excellent customer service, can take my time to check out an item at any hour from the comfort of my home, see customer reviews and compare products side by side. Prices are better than at the stores and I can always find what I need on Amazon. Fast shipping and free with Prime!",5,2,26.15.0.100,2023-08-08 14:08:48,26.15.0.100
acd3c0c4-9376-401f-ad8a-35a5a1b0e2d6,Tracey Fortney,I love Amazon!! They have everything you could ever want. Most items are shipped within 2 days. Saves me time from standing in long lines at the store and saves me money in gas for my car. I shopped comfortably from my home and never have to worry about the weather. My packages are treated with care and my deliveries are always on time and on my porch. What's not to love about Amazon?,5,2,26.16.0.100,2023-08-22 18:35:00,26.16.0.100
254f68c0-8c93-4bb6-97a6-27b3b396893d,Erin,"The app won't work at all now. Thanks. Chrome won't open it either. I'm not going through all this just to buy something that I can find in other, simpler ways... Why do the devs want to waste time pushing out unnecessary and malfunctioning updates? It was working fine before. >1☆",1,1,26.15.0.100,2023-08-10 16:36:11,26.15.0.100
fd259f85-e43c-4599-a3ac-fc5ce89022ce,Malakai Foster,"Gets away with CONSTANTLY lying about delivery times. I've ordered countless times for items that I need to be at my house at a certain time, and read the delivery dates, of course sometimes packages are a bit late, but Amazon needs to stop pushing back delivery dates after I purchase. If the estimated delivery date is that off then Amazon needs to fix that asap. How am I waiting a whole week after my delivery date and Amazon keeps pushing my dates back.",2,1,26.15.0.100,2023-08-05 11:00:35,26.15.0.100
ffb8b709-4760-46ec-8540-82237036aee0,patricia smith,"Tried to order something that I needed asap, I check the progress of it, and it says I need to update my payment information, and it gets delayed by 4 days. I check again today and it says the same thing. I have the write amount in my bank account, but for some reason it won't go through. Won't be ordering anything through here again",1,1,26.15.2.100,2023-08-13 00:51:07,26.15.2.100
9e794723-782d-417c-93f3-0248e0a47bfd,Sierra Link,"I love to make lists, but I noticed that once I tap the item I want to add to the list, the heart is there, but when I select a size, the heart dissappeared. I looked up solutions, but apparently, I'm not the only one with this problem. I have tried everything I can think of to fix it but nothing.",2,0,26.15.0.100,2023-08-05 04:28:32,26.15.0.100
2a8ea688-0524-4a73-b20d-1f37080a9201,Amar Saini,"Laggy UI, pictures don't update when you select an option... Why? This app should be perfected by now. This is Amazon, THE largest online market but they can't get a developer or two to fix the app? Shame",1,2,26.15.2.100,2023-08-11 05:49:21,26.15.2.100
51667bf5-973f-42d2-b1d0-e3d5c3951157,Randy Scott,"So I never have anything but positive things to say about most businesses or services I encounter. However, it seems increasingly apparent that The largest, most financially comfortable online sales platform has traded a lot of quality for quantity. Most of the merchandise that Amazon represents is trash. Secondly, What is going on with all the scams? I understand a few ads slipping through the cracks, but I saw an E-Bike for $69 and have a premium ad space. I can recognize a scam they can too.",2,1,26.15.0.100,2023-08-04 18:04:20,26.15.0.100
5fb3027d-efd1-4852-b970-b2d154eb96d9,Paul Pawlowski,"The latest app version takes a massive move towards hiding statistics from consumers in the way it displays reviews info on the search pages. Sure it's a ""fancy and clean"" interface but it's less beneficial for consumers",1,1,26.16.0.100,2023-08-25 23:09:03,26.16.0.100
924d4195-af17-4139-9933-5cce73668856,Levi,"Amazon was okay but the new update literally sucks. I can't even open my app because it won't load, and I have multiple things of importance on my lists and in my cart that I need to look through.",2,1,26.15.0.100,2023-08-06 18:42:30,26.15.0.100
a7bbc413-1b7d-4b3a-8d31-37422de22d2e,Rene Diedrich,The intuitive and swift app is a model other need to use. Amazon has always evolved accordingly. They have way too much stuff and lots of people selling dodgy products that should make one wary.,4,0,24.10.2.100,2023-08-10 01:34:45,24.10.2.100
81c4f70a-9ecd-4590-9819-ac72c5c24ff1,New Mexico Birdman,App keeps getting worse. Bottom search bar is in the way and is very annoying. Very glitchy so can no longer choose a vehicle from your garage. Should not be do difficult to find things!,1,0,26.15.2.100,2023-08-13 04:23:11,26.15.2.100
a710e24a-7b66-4598-8c57-83016f55a224,Mathew Pinard,"It's alright.. but I wish there was a way to modify the ""share"" functionality to notninclude the article title, and use the full URLs and not the shortened URLs.",3,1,26.16.0.100,2023-08-19 22:58:07,26.16.0.100
d9e326a1-166f-4469-a979-21abb98945ba,Doug Sleezer,"Bring back full list of Q&A! While many questions/answers are irrelevant, I get a lot of info from answers. Wouldn't know what keywords to search for so need to see full questions list. Otherwise the app is pretty good.",3,0,26.16.0.100,2023-08-19 20:27:17,26.16.0.100
d8fa8f02-9150-41a5-b195-86d55dab95ed,Alexandra Mcmullen,Amazon is so easy to buy off & all items have more to read about them then most shops do.I like reading what other customers think about the item before I buy it aswell & i'd be so lost without Amazon.The delivery is so fast & worth being on Prime & pay for a year so next day delivery & free delivery.The drivers are so nice to me & with being disabled they always wait for me to open door & put delivery where I ask them to in my porch.Thanks for all your help & keep up the good work,5,2,26.15.2.100,2023-08-14 08:41:33,26.15.2.100
45120193-0ca3-43f9-92ad-64c468e24511,LaShona,Amazon standards has dropped. I don't know why they have started using third party delivery services. I've been complaining for months about USPS delivering my things. I never get my things when USPS has to delivery and I'm done with that.,1,0,26.15.0.100,2023-08-20 11:28:58,26.15.0.100
fcf123a3-e9ec-46c1-a5d2-4146aac1e702,Patrick Lippy,I removed one star only because it has issues with links from family and friends. Also the Internet. You click on a shared link (item) and it only takes you to their home page. Also... Sometimes you look at the picture in the reviews... They are for a totally different product or item.,4,0,,2023-08-04 12:06:31,
86a23d79-5b50-4ff1-a8de-c0ea218f38ed,thelost prophet,"So many updates, still the goofy search bar at the bottom. It legit messes with my eyes when I search for something. Please put it back or give the option. It's been like this for over a month.",1,7,26.16.0.100,2023-08-19 01:24:17,26.16.0.100
f7afe226-84e9-4bd6-91c3-877aeef6745f,Gregory Lewis (St. Gregory),Although I like shopping on Amazon I kept a very close eye on my bank account and discovered a triple deduction for a transaction from Amazon. I only received one reversal of the triple deduction. I will advise everyone to scrutinize your Amazon deductions of any online purchase. You might be surprised why your bank balance is suddenly lower than expected. Let me watch this situation and I will report back if this matter has been resolved.,1,0,26.16.0.100,2023-08-31 23:34:18,26.16.0.100
e7f69f4c-b20a-4842-83bf-a19bc05129d1,Andrew Wheeler,"Recently, it had always been the worst experience dealing with Amazon. It really isn't with using them anymore unless you want rubbish that breaks and lies instead of a refund.",1,1,26.15.0.100,2023-08-06 20:29:45,26.15.0.100
ee057fcf-0254-4651-acf1-dafb4a7d31af,Георгий Чеботарёв,"I bought a phone number and tried to create account. Amazon said, that this phone number had already been attached to an account. Okay, but single way to detach it - hack account of another guy (I did it by restore password - His account attached to my phone number) or wrote to support. But you can't write to support if you are not registered. By for registration you need a phone number. But you account is already attached... Amazon, Bezos, fu.. you. I say you good bye! Will use Alibaba",1,0,26.15.2.100,2023-08-20 11:32:26,26.15.2.100
0749cf33-2cad-4664-a660-cad09634fb22,Donald Ritz,It should be a crime to let sellers write any description they feel will get them noticed. I'm shopping for a new way to shop that has a honest view of products and not misleading in so so many ways. There is some convenience but no accountability or integrity anymore on Amazon Shopping.,1,0,18.8.0.100,2023-08-08 13:19:38,18.8.0.100
53381108-dacc-4e3a-86f1-a487b0ec2b84,T.K. Wiedemann,"BAD UPDATE - and can't uninstall! Cannot add item to my ""lists."" When ""add to cart"" is selected, it says ""page not found""! Screen is not formatted to my device - too large. I can't make purchases! Sucks!!! Just had to place order with Walmart. Fix this, please! I need to order!!",1,2,26.16.0.100,2023-08-19 21:28:07,26.16.0.100
4466bc85-6b9a-422a-bf6c-5673958d2c11,Susan McQuilkin,"It is the place to go for a great shopping experience, and deals that are priced wihtin your budget. The app makes navigating quite easy.",5,4,26.16.0.100,2023-08-18 15:16:39,26.16.0.100
ecd1603d-ff8d-4f87-a1e1-65582dd21695,Loracyme1,The change of the app is a little off putting. The biggest problem is checking out. The newest glitch check out just cycles thru payment no matter how you choose to pay. Check out WILL NOT complete.,2,2,26.16.0.100,2023-08-19 14:29:38,26.16.0.100
cff86f26-3fc9-47f1-a98c-8c2d512a1c18,Logan Wojcik,"Slowly they keep changing feature by feature and the ones they keep changing are for the worst. I find it very slow, this app used to be a lot better...",2,0,26.15.2.100,2023-08-15 22:44:53,26.15.2.100
095c86f7-8fdd-4f15-80ce-782fce9d41a1,Jimmy Roo,"Amazon has always been a standard service. However, since Temu gained momentum, it's obvious how much more you're paying on Amazon. Amazon still has more variety, but for the same item you're paying 5x to 10x as much as you'd pay on Temu.",3,0,26.15.0.100,2023-08-11 20:44:13,26.15.0.100
795f7145-18c7-4b65-9884-845ce471b595,Kyle St Jacques,"Does a lot of things well, but still has a fair share of issues. No dark mode Some features like channel subscription setting only available through website",4,3,26.15.2.100,2023-08-16 05:46:07,26.15.2.100
28554e9c-59a1-47f7-b1b0-7e8b3fa9d874,Graham Williams,Latest update has made this app almost impossible to navigate or view seller details or perform a text search. Remember... if it's not broken then don't fix it.,2,2,26.15.0.100,2023-08-07 19:45:52,26.15.0.100
1c3054f9-02ae-4d5b-832b-84d11a146e10,D Media,"New version buggy. Quit moving things around, keep search bar at top, quit trying to reinvent what is standard. Get rid of the bugs, this app now freezes.",1,3,26.15.0.100,2023-08-05 22:25:44,26.15.0.100
0b0a1706-49b3-4388-9dba-cf7ebcd163a4,hend abdelsalam,"Dealing with Amazon Egypt is one of the worst experiences ever I purchased a product, and it didn't match what I ordered, and when I made a request to return it, the account was closed without giving any reasons I contacted customer service by phone more than once, and I didn't even know the reason for closing my account, and the problem wasn't resolved, and the product that didn't match wasn't returned. Now I have a product that I don't want and my account is closed too and I have no idea why!!",1,0,26.14.2.100,2023-08-04 18:40:54,26.14.2.100
4ff26546-6c64-42d6-861a-ec5cf26e1117,Harry,"A significant difficulty in using Amazon is that they have so little respect for their customers that they have no genuine concerns about problems experienced by them, so make it almost impossible for them to contact support, other than by messaging racially exploited people in third world countries who struggle with the English language. The only other way is via a list of common questions and answers, but nothing is ever so straightforward; however, it serves Amazon's indifference.",1,0,26.14.2.100,2023-08-02 07:15:31,26.14.2.100
39e47933-e21f-4728-920c-29f6e3c2e5eb,Ann Wenn,"Service is always the best. I shop online and have never had a problem, products are always as advertised. Staff are always patient ,eager to help . price is right Amazon IS My GO TO SHOP I was very pleased to find they stocked he vitamin I was out of, but, it was a lower price with same properties.",5,1,26.16.0.100,2023-08-19 04:12:43,26.16.0.100
32f4a2ce-ecff-4e2b-afb3-7dab4aae3e12,Terry Salazar,"After I updated Amazon new Ap I no longer have access on my cellphone to Automatically click & start shopping I now have to go to play store to get into my Amazon App, you're new updated version is terrible! It was so user friendly before, why did you mess up a good thing!",3,0,26.15.0.100,2023-08-07 21:22:45,26.15.0.100
e5add715-35ae-45ae-82f7-1070cedfe60f,Shawn Walsh,"Like and dislike Love / hate Delivery service is the best I use to like the bad reviews part of the reviews, but they eliminated it So now it's hard to tell if there are a lot of problems with a product or customer service Many third parties now also I look for prime or I avoid products now Lots of Chinese junk Where's all the USA stuff Why isn't it promoted more Made in the USA",3,0,26.15.0.100,2023-08-22 02:27:01,26.15.0.100
09af1843-a0bd-4ecb-a888-a342e4e09961,Ashley Banta,"Tons of items to choose from (most have great prices), always free fast shipping (if you have prime), simple easy free returns (mostly if not a 3rd party seller), and good customer service when needing to talk.",5,1,26.15.0.100,2023-08-10 16:01:01,26.15.0.100
4aa0ca90-53d0-45ce-8e0c-e416f1ea0ba8,Luke Miller,"New update is bad for user experience. Listings have been changed so it no longer shows the number of reviews unless you click on it. In addition, the star rating has changed to just show the number rather than a visual 5-star rating, making it more cumbersome to compare ratings. This is a big deal for me so I will probably be using the website from now on.",1,1,26.16.0.100,2023-08-18 06:57:41,26.16.0.100
78ffed6d-f6f7-4ffc-9015-480d06a7edec,Phoenix Everwolf,I despise this new update. I hate that the search bar is at the bottom of the app. I HATE that the star ratings are now a percentage instead of the number of reviews. I don't care about a percent. I care about how many people ordered the product. I hate that there's no q and a. I used that to help figure out if the product would work for me. I hate this update. Hate. It. I like the old layout soooo much better. Hate this update so much. I don't think I've said that enough 😡🤬,1,232,26.16.0.100,2023-08-21 04:40:44,26.16.0.100
