reviewId,userName,content,score,thumbsUpCount,reviewCreatedVersion,at,appVersion
ab914624-df55-41e9-a0f2-10222ac5cd36,James Rey Regala,Philippines not available 🥲🥲,3,0,,2025-09-07 10:02:21,
733e998f-108e-4c32-ab4d-c7ff621c6a77,Jacob Casack,"Do Not use Amazon!!! If you do, do not save your cards. I've been using for years and have all my emails and past numbers attached. someone got into my account and started to change the emails and password. The account recovery number was useless. Had to speak to some Indian and neither of us could understand each other. It ended with her basically saying my answers don't add up and my emails weren't working. I told her she was spelling my name wrong but she wouldn't listen and refused to delete",1,0,,2025-09-07 09:37:59,
01d1c607-efed-48d2-b1c1-ac6e1cdb5960,Sunshine Ray Taylor,they never help me as a mom ... often have other shippers mess up my delivery and then amazon does zero to make up for it or fix it .. I hate Amazon ... not a fan of their customer service or shipping prices or anything really ... don't even wanna know how stupid it is to have to return something they sent the wrong one of but can't return it cause it's the wrong one ?? make that make sense .. you can't,1,0,30.12.4.100,2025-09-07 08:57:20,30.12.4.100
cda77950-8f27-423e-89a3-95704f51d0e1,Jesse Bourne,It's beginning to have more errors,4,0,30.16.0.100,2025-09-07 08:12:46,30.16.0.100
1db4d790-0dc0-4f03-8c83-01c98e4c97da,Derek Pulley,"for the last few months, every order has been late and/or delivered to the wrong unit. prime member",3,0,30.16.0.100,2025-09-07 08:12:37,30.16.0.100
853a63a8-defe-4433-b874-42a4058ba85f,MurderChickenXL,"my main complaint is that I cannot view my orders, instead it just shows order numbers, which don't tell you what they're for.",3,1,30.16.0.100,2025-09-07 07:52:36,30.16.0.100
de759925-9a02-474d-9baf-fc01c4234395,Sandra Hare,so easy!,5,0,30.16.0.100,2025-09-07 07:38:21,30.16.0.100
38c4d15c-b3df-4c10-9305-bd97595ae947,Cordell Curleyhair,Amazon is a great place to shop online,5,0,30.14.0.100,2025-09-07 07:11:57,30.14.0.100
6a4730e4-45d9-41ab-83ad-413e5adfa293,Kelly Lester,another trash route. it's become a daily thing my route is total garbage. I'm no longer a customer that's how bad my routes have gotten. reporting to my dispatch and amazon does nothing.,1,0,24.21.0.100,2025-09-07 07:02:06,24.21.0.100
3da49923-da0a-42c4-9069-fa8c6db9081d,Charles Mui,option to download invoice on app is missing,3,0,30.16.0.100,2025-09-07 07:01:04,30.16.0.100
c1c08355-032f-4b29-95e9-d35beecb170f,Nrek77,"I used to drive all over town to find my items, a lot of times they were out!! Waste of time and money and energy dealing with traffic, finding parking spot. Now I just use Amazon. Save time and money and sanity. Read reviews to narrow down your purchases and confidently select which items to buy.",5,0,30.16.0.100,2025-09-07 06:47:10,30.16.0.100
ca984179-77d0-457b-aa47-2a41ced7e0e7,Crypto “Cryptological” logical,Amazon have been reliable and great all these years. Just hope they'll offer extra end of life support for older devices running older versions of android. eBay ended their support so they lose out. I can use a different device but why be forced to? Google? A 20 year old PC will work just fine too. It's all about obsolescence and no efficiency in coding.,5,0,,2025-09-07 06:41:59,
791cad28-51d2-4dfa-9d1a-218662aa8570,Cornfed CobaltSS,i have a prime membership i pay extra for shipping dont recive my product and they say i have to wait 2 days for a refund for a package that never came worst customer service ever 👎,1,0,30.16.0.100,2025-09-07 06:27:43,30.16.0.100
dc3ea11b-8a4e-4fa2-abeb-3dcb2377c2fc,Sumit Kumar,nice,5,0,30.16.0.100,2025-09-07 06:13:14,30.16.0.100
522cf3d6-f9a0-4d4d-8f70-b04ee8fbeb77,Vince Coniglio,Amazon as always A+,5,0,30.16.0.100,2025-09-07 05:23:09,30.16.0.100
d33fb4bd-c336-4fa0-8855-6327844a910e,Mirage,WHY DID U DELETE ALL MY LISTS!? ALL MY STUFF!?,1,0,30.16.0.100,2025-09-07 05:04:33,30.16.0.100
ac86e36f-b486-4f05-bb6f-ebc459cae675,Rebekah Ocon,easy,5,0,30.16.0.100,2025-09-07 04:28:01,30.16.0.100
d69e18d4-12b5-46d8-b3fd-dfb9dda34c1f,Breanna Ware,"The Amazon app is a total lifesaver — fast, easy to use, and super convenient. I can find anything I need, track orders, and even return items with no hassle. Shopping is stress-free and I use it daily. The only disappointment: after switching from Apple to Android, I learned Android users are forced to tap their payment card at checkout every single time. It’s annoying and makes no sense, especially since Apple users don’t have to deal with it.",4,0,30.16.0.100,2025-09-07 04:26:46,30.16.0.100
40a4f9dd-52ae-4c0e-a3e9-67acb52d0c46,Jacob Campbell,It's great to use but can't login in account,1,0,,2025-09-07 04:23:42,
17b50777-bc1f-41c2-8479-55c157db2f6d,Jonathan Ramirez,great price s fast shipping,5,0,24.4.0.100,2025-09-07 04:16:11,24.4.0.100
0dbe33ef-10e3-4a84-98c2-5cd44db5094c,Crop Dust,"Please enforce Warrenty/Guarantee on your platform for Sellers to make a mandatory option for months or years. Other platforms does this, it's only Amazon where you have to click everywhere just to find some protection for the customer",3,0,30.12.2.100,2025-09-07 03:57:05,30.12.2.100
9c2e46a6-d106-4f60-a6ba-a3df90fa6e9b,Cheryl Lewis,Sometimes the app gets very slow and lags,3,1,30.16.0.100,2025-09-07 03:51:08,30.16.0.100
7284865a-9419-41a1-a320-d3da0f123e1d,Jarrod,"This app was better before the Rufus shopping assistant add-on. it's frustrating that there's no way to disable or opt out of this feature. I hate digital assistants. They're completely annoying and serve no practical purpose, for me. Other than that the app is okay.",3,0,30.16.0.100,2025-09-07 03:42:01,30.16.0.100
ce618f77-294e-4ca5-b753-9774e44a77de,Ron Woodworth,Rufus...... get that garbage off my app.... tells me I have to go through Alexa to turn it off......I don't have Alexa on!!!! Nor do I want to have it on.....,1,0,26.10.4.100,2025-09-07 03:35:14,26.10.4.100
b2b581f1-c35a-40be-b9ad-8a586853a611,Wyatt Grote,Best shopping app out there,5,0,30.16.0.100,2025-09-07 03:16:49,30.16.0.100
1aa1ca98-7977-4e11-a9f3-d11fbf88746f,Jason Bolduc,love it for most things.,5,0,30.16.0.100,2025-09-07 03:03:12,30.16.0.100
e93c0cc8-d82a-4349-9e1e-b4d913e64ca5,Lisa Hosang,My orders always arrive on time and sometimes ahead of schedule.,5,0,30.16.0.100,2025-09-07 03:02:20,30.16.0.100
da373eea-033f-4cde-a580-46b2e0d88dd5,Keyoumars Habibian,"It is really enjoyable to buy from Amazon and if some goods don't fulfill my requirement, I can easily return. And the goods arrive with an incredible delivery speed. Nothing is missing.",5,0,30.16.0.100,2025-09-07 02:51:38,30.16.0.100
d7328d79-92fb-4a87-bb92-56ede15e3d21,Jacqueline,I love how fast pkgs come. I prefer to buy in bulk over shopping over an hour drive to nearest Wal-Mart.,5,0,,2025-09-07 02:51:15,
d05c5875-8a5d-4b9f-9c59-664be8c5917e,Edgar Zamudio,it's the worst I never used it got me trying to sign in and apparently I have suspicious activity ? how? so I try making a new account and it says the same thing got me all types of frustrated,1,0,30.16.0.100,2025-09-07 02:41:46,30.16.0.100
081ae025-b120-4b5a-9fc0-414c2aac74c6,Juan Ram1rez,They always send my stuff by FEDEX and it never arrives it's horrible I've spent a lot Amazon sucks,1,0,,2025-09-07 02:21:57,
e8dd086c-a4d4-43d8-abd2-be5e0c51d0aa,Chris Alexander Walker,when a package is damaged....I don't want a refund....I want it replaced. that there is no option for that is just annoying and frustrated that I now have to wait 5 days to resolve it.,1,0,30.16.0.100,2025-09-07 02:19:41,30.16.0.100
9d821868-0769-4ed1-9bbe-f256df8d3aa4,David,The price of prime for a year is a bit to much and why does the app not have a dark mode yet it's 2023 it is now 2025 still no dark mode and the price for prime has double with prime video now having ads interrupting every movie and show unless you own or rather purchase but never really own a digital license so basically rent at full price greed strikes again rating continues to drop until dark mode is added to settings,2,1,30.16.0.100,2025-09-07 02:10:40,30.16.0.100
37767dbc-5e88-4e49-85b5-ed174fca337b,Edwin Howard,these used to be one of the greatest outfits to deal with there customer service was next to Noone but those days are long gone they dont do nothing now I spent 260 dollars on a light used it for a month and it stopped working and Amazon won't do nothing bout it I dont even want a refund I wa t another light,1,0,30.16.0.100,2025-09-07 02:03:09,30.16.0.100
16ea2e34-9b5d-4a51-8ad0-837dc040659d,George Jetson,can't figure out how to remove purchased items from Amazon purchased list. Google said to go to play store and remove Amazon???,1,0,30.16.0.100,2025-09-07 00:40:41,30.16.0.100
27fb6d86-8aa8-466c-94b5-e416766f966f,nar Tamang,everything is faster in delivery than Amazon it's take min 1week maximum idk to deliver. sad but the truth it wasn't like that before Amazon. I liked you before not anymore.,2,0,30.16.0.100,2025-09-07 00:25:47,30.16.0.100
e861500b-9109-4954-8efe-83aa300abcc7,john wik,for one don't like the Spanish to English and it starts out in Spanish I'm an American I only want to see American writing on my page,1,0,30.16.0.100,2025-09-07 00:15:10,30.16.0.100
2b0ac9ed-b3f9-4175-ae02-b2e5217a1537,David,Àmazing pric,5,0,30.16.0.100,2025-09-06 11:47:59,30.16.0.100
d52d3626-d931-4680-8b44-a6cdc1043887,Debbie Herschy,Usually great for shopping. deliveries not so at times as parcels get left at front door. no initiative used. Can go walkies at times due to this.,4,0,30.16.0.100,2025-09-06 11:40:00,30.16.0.100
8f40feb1-85ef-49da-8ae8-d1a92dfa1098,Kathy DiAntonio,Easy-to-use,5,0,30.16.0.100,2025-09-06 11:31:19,30.16.0.100
76643c8f-4dff-45fc-8bd9-ce3312a6ca11,Morgan van Deventer,create variety. only problem is seeing items that can't be shipped to my location. further on a creat app.,3,0,,2025-09-06 11:26:20,
dc1ef508-358d-4e9d-949f-4f80b9b964fa,W J,Getting marketing notification daily and sometimes even more. I didn't consent to this - you are in breach of data privacy regulations. No feature in the app to turn off or on website.,1,0,30.16.0.100,2025-09-06 11:19:11,30.16.0.100
7cedd6b1-3da7-4f2a-ba5d-a7ee24f70130,Kxng Joker,some orders arrive as said some don't and some end up damaged or stolen by the drivers themselves I've seen this first hand and always open package before giving code to ensure you have everything do this infringement of delivery driver if you don't have cctv make sure you have a witness with a camera ready,3,0,30.16.0.100,2025-09-06 11:05:22,30.16.0.100
2e41a88b-c3e8-4d4f-8f4e-e11fd5120fc3,Kay,The best shopping experience ever!,5,0,,2025-09-06 11:03:07,
bcdd70f0-206c-45fb-bd54-29f36dd40ab3,Keri De Leo,Amazon speaks for itself,5,0,30.16.0.100,2025-09-06 10:58:52,30.16.0.100
96f7ae54-a649-4acd-a65a-828d119a3366,Nicos Schiniou,very good app,5,0,30.16.0.100,2025-09-06 10:49:43,30.16.0.100
08ec8a99-b700-4124-9b62-07d53977e1ed,Kemar Watson,very good,5,0,30.16.0.100,2025-09-06 09:56:35,30.16.0.100
f81deca3-2f5e-4114-af83-8ac77f36ab0b,Anna Dicker,"Wir bestellen oft und meistens kommt es auch an und liegt in unserer posttruhe aber am Donnerstag hatten wir für meine schwester noch ein paar dinge für ihre neue schule bestellt die sie am montag braucht und es stand, dass es heute ankommen soll. Es waren ungefähr 10 produkte und wir glauben dass der postbote zu faul war alles zur tür zu tragen, weil nicht einmal jemand angeklingelt hat und deswegen hat er wahrscheinlich einfach geschrieben dass wir es an einem postamt abholen sollen.",3,0,30.16.0.100,2025-09-06 09:28:08,30.16.0.100
9d167de1-aa26-44e4-a749-34374326a260,Jason Cunniff,pretty easy to use,3,0,30.16.0.100,2025-09-06 09:23:00,30.16.0.100
dedba036-bf02-4c08-81a7-08608d623049,Vickie Cogdell,Best when using Prime.,4,0,30.16.0.100,2025-09-06 08:23:32,30.16.0.100
ac6a8386-7635-4657-b8b9-81aba34a02c9,Tiaan Liebenberg,Worst app ever they said my order went trough but it dident and now im in debt.,1,0,,2025-09-06 08:16:18,
e7100143-98cc-435f-a6b5-82a0ce27509d,iZad C,This app is lagging when running on the Samsung Fold 7.,1,0,30.16.0.100,2025-09-06 07:41:11,30.16.0.100
366b20ec-07a4-4fef-bce0-29068bba8fef,Peter Girgis,مفيش مصداقية والشركة ميالة للبائع ويولع المشتري ف داهية,1,0,30.13.0.100,2025-09-06 07:23:38,30.13.0.100
14f944e7-16c4-4562-8a96-b1b3996624f7,Bruce Boswell,we love buying on Amazon Spain,5,0,30.16.0.100,2025-09-06 07:13:20,30.16.0.100
1dc4b3ba-c165-4950-ab64-16e50faa4cbe,Aidyn West,I love amazon,5,0,,2025-09-06 07:11:05,
cccc4fbe-9f24-45ca-8aba-31fb60993cfd,David Smith,Missing functionality. Just use the website.,1,0,30.16.0.100,2025-09-06 06:37:55,30.16.0.100
2b52ccad-c290-4371-94ed-efcc62c23e1f,Ed Aganda,Please remove the ask bar.,1,1,30.16.0.100,2025-09-06 06:18:25,30.16.0.100
87b98172-a9d1-48dd-8f86-cbfdc3591fd7,Fatih Asci,"hic siparis vermemisim aylardir yine de prime ucreti oduyorum. 100tl lik bir urun diye komsuya teslim edildi imza alındı deniliyor. hangi komsuya teslim edildi ise ben nerden bileyim dogru mu yalan mi, komsuya teslim edin de demiyoruz zaten. maalesef artik siparis verilen ürünler gelmiyor ! Amazon tr artik aliexpress modunu acmis ! not: 1 ay gecti ve uzun ugraslar sonucu 100 tl iade yapıldı. 30bin tl lik de alisveris yaptigim bi mecrada mesele 100 tl degil tamamen guven. parami aldim, teşekkür",1,0,30.15.0.100,2025-09-06 05:53:17,30.15.0.100
85351284-06e3-405d-ad51-87f0b1dc9f35,Declan Ryan,Great,5,0,30.16.0.100,2025-09-06 05:43:18,30.16.0.100
3de79bdc-f71a-4534-999a-76bd314510e7,Position,"hey amazon. I need a account From Bangladesh. & need amazon associate account. but I'm no't createing account, please need a account on amazon",3,0,30.16.0.100,2025-09-06 04:53:35,30.16.0.100
8bc020af-f8a5-4695-b8ad-adf7a8852eba,Bubbles McSquats,"Where did the reviews go? I can read them in my browser, but not the app? I went through the steps of clearing cache, deleting data, force stop, reboot, uninstall and reinstall, I'm perfectly logged in, and I still cannot read reviews in app. I see that many others on reddit are reporting the same issue? What's going on?",1,3,30.16.0.100,2025-09-06 04:52:08,30.16.0.100
165a96d5-dc8d-4568-9aba-bdbdc0044609,Paul Webb,always received my orders fast,5,0,30.16.0.100,2025-09-06 04:41:40,30.16.0.100
17315e4b-80bb-4204-ba71-d177d14f1f74,Jor Ge,No dark mode?? Come on!,1,0,30.16.0.100,2025-09-06 04:37:11,30.16.0.100
0f1180cf-1389-4126-867b-608263f526eb,Chanelle Revels,did deluver what I order days ago,2,0,30.16.0.100,2025-09-06 04:06:22,30.16.0.100
686ed318-0b5d-4e50-bb29-12cb4eddfef4,Hernando Hurtado R,it is a great app. I can used to buy anything I want,5,0,30.16.0.100,2025-09-06 03:57:29,30.16.0.100
4619f844-7d38-4d51-825e-b3e7339c630b,Johnny Nguyen,I really hate the amazon app. the shopping experience is really ruined due to the fact that the app runs choppy frame rate while scrolling. While swiping on review images and videos the animations are not consistent while moving through the app. Amazon needs to pay its developers more and improve the app experience. Do not shop on amazon if this app is really sucky...,1,104,30.16.0.100,2025-09-06 03:50:21,30.16.0.100
e12d20a5-6961-4e92-ab87-77f0364604ee,Dharma Rodriguez,my entire save for later and past orders have disappeared. looks like i just made the account but I've had this account for years now and don't have any others that im aware of..what happened,2,0,30.16.0.100,2025-09-06 03:08:07,30.16.0.100
8a48016f-73d8-4afd-901f-4370e921ce47,James Damon,best all around customer experience.,5,0,30.16.0.100,2025-09-06 03:06:58,30.16.0.100
cb346c96-4956-4b68-bad6-cf082b2a68ea,Mister Larn,"Trash service. I was lied to by multiple agents that said they could help correct a delayed order for over a week that should have been 2 days just for UPS to attempt delivery in the middle of a work day that required a signature. Twice. Order was locked, so neither Amazon nor I could do anything about it. Last agent was some help. The eventual reimbursement along with the refund wasn't enough for the end of this janky week. Thank you Amazon and UPS.",1,1,,2025-09-06 02:36:15,
c0f09f89-204b-4aea-ac47-ee2a83bde950,Logan Frazier,"I'm sorry but where is the customer service phone number? I try finding it and it sends me to an FAQ. An FAQ is not ""customer service"" that is ""customer figure it out for yourself.""",1,2,30.15.0.100,2025-09-06 02:07:05,30.15.0.100
8c9b6413-8188-4b97-9a7d-fbb65e60ae36,Elaina Lee,Love it!,5,0,30.16.0.100,2025-09-06 01:18:54,30.16.0.100
3b836355-d2a5-4251-a42e-df22b5f2eb4e,Shelly Manning,ttttgttttgtty in,2,0,,2025-09-06 00:47:25,
821c7ef8-a94b-4f8b-a1e1-b5152ea61b5f,denice hoday,Amazon delivery drivers are always so nice and take pride in their work. Thank you for your care of our purchases.,5,0,30.16.0.100,2025-09-06 00:43:51,30.16.0.100
2dd63d63-839f-4de9-9ea0-5b4ded1ceafd,Suzanne Petty,"love I can shop from home! but with clothes it is a little harder. But, their return process is easy! Definitely recommend",5,0,30.16.0.100,2025-09-06 00:43:39,30.16.0.100
2995eb5f-4365-438a-80de-d6e78ca46f0b,Joni Wilenski,the best.,5,0,30.15.0.100,2025-09-06 00:39:32,30.15.0.100
1ea9fd7a-5f8a-4cc4-a9b0-002b4050d848,Guys World,"trash, this app is crazy slow and continues to freez",1,0,30.16.0.100,2025-09-06 00:34:40,30.16.0.100
d68c177d-b6bb-4148-b050-371cf324ed39,Adrienna Backman,problems creating an account my original account went dormant and now I am told thetes a glitch of some kind,1,0,,2025-09-06 00:16:56,
e3403ee4-3153-437b-9b0d-0e2391e3b06f,Linda Ford,So good to use. easy 😉,5,0,30.16.0.100,2025-09-06 00:08:21,30.16.0.100
02a7238e-86a9-44b8-8d6b-21ebff7f752d,IsraeliteLioness,Its fun shopping on Amazon,5,0,30.16.0.100,2025-09-05 12:00:14,30.16.0.100
34945386-986d-4ad8-aec9-69c069dbd0c9,Denis Metherell,I see more sponsored products than the actual product that I am looking for. This entire app is riddled with ads that it becomes borderline impossible to shop.,1,0,30.16.0.100,2025-09-05 11:43:32,30.16.0.100
2a29c4e7-cf05-47a1-8900-f8ff9037f471,Joannah,Good,5,0,30.16.0.100,2025-09-05 11:40:41,30.16.0.100
e3c0c9a0-3555-4a07-8d44-ee052b5bd3e4,Gabriel Carvalho,Free shipping is a mess!!,1,0,30.16.0.100,2025-09-05 11:35:15,30.16.0.100
953442f0-7a46-4d67-a4a3-de693b6ce6d5,Shernil Winter,The app seems to drop/skip frames when scrolling on the home tab. It doesnt happen if you search something then scroll in the same home tab.,4,0,30.16.0.100,2025-09-05 11:24:44,30.16.0.100
06c06779-582c-4637-b5f4-52eb0dfcfb87,Laurie Shanks,The website is Easy to use. The items they sell are good products.,5,0,30.15.0.100,2025-09-05 11:12:21,30.15.0.100
2963756f-257b-451a-842e-b4894a649cc3,Rick Streich,out standing,5,0,30.16.0.100,2025-09-05 10:51:54,30.16.0.100
a877d8fa-5d9c-4ac4-94f3-182b89ed5eea,Ahmad Khan,he is the very best app,5,0,,2025-09-05 10:30:30,
c24fda32-6d0d-4a09-b8bb-5291cebd55a2,Mimi Annotobby,conveniently easy and helpful,5,0,28.10.0.100,2025-09-05 10:26:12,28.10.0.100
b200c962-7a79-4c37-b9ef-0f85cb2a8a0a,Mo,lovely jubbly,5,0,30.16.0.100,2025-09-05 10:20:29,30.16.0.100
6ff521b2-bf1e-4dfd-9d8f-08f099d1810d,James Taylor,"a temu resealing page, everything is overpriced",1,0,30.16.0.100,2025-09-05 09:36:48,30.16.0.100
22af9872-c241-4ce3-9ef7-a0d8c6ff9a06,Andrew,I don't appreciate receiving notifications soliciting me to leave reviews but I also don't want to disable ALL community-related notifications. The app forces you to choose between those two options because it doesn't allow any more precision than that. They also still haven't added a dark mode; this makes the app very unpleasant to use for last minute shopping in the evening and can actually disturb my sleep if it's late enough.,1,34,30.16.0.100,2025-09-05 09:33:51,30.16.0.100
e4914095-d0ea-4d92-9538-8a5660e40655,Delvin Chua,From awesome to lousy services. App is a little broken here.. the show password doesn't worked. And no contact with customers service. Delivery used an unregistered phone number easily mistaken as scam. And don't know since when a security code is needed to receive goods. Product cannot be delivered if the call is not answered. I think Amazon might be the second app i banned after Shopee.,3,1,30.16.0.100,2025-09-05 09:19:40,30.16.0.100
0badf109-507e-4440-b9cc-a66310be5d0c,Ann Grayson,When I can't find items locally I'm able to shop Amazon and get them. It's great!!!,5,0,30.16.0.100,2025-09-05 09:18:54,30.16.0.100
da2af1b2-a010-4b11-a361-de1a827ad1c0,Kenneth Brooks,good,5,0,30.16.0.100,2025-09-05 08:52:13,30.16.0.100
bcfe86a6-9750-4078-8375-780f62934631,Victoria Castrillo,love it always shopping an made it easy,5,0,30.16.0.100,2025-09-05 08:13:21,30.16.0.100
bafe5016-93b0-40e2-bd23-bef31e74fae0,Nikolay Kostov,perfect. fast and quality!,5,0,30.16.0.100,2025-09-05 08:10:41,30.16.0.100
2272fde8-811a-4cd9-956a-a04bd01d0eb8,Rob MacAdam,I buy a lot from Amazon. Great way to shop and save money.,5,0,30.16.0.100,2025-09-05 08:02:19,30.16.0.100
2919ae43-e33c-4a32-aeb0-0cb942e2ce2a,Jennie Cruise,fast efficient and reliable,5,0,30.15.0.100,2025-09-05 07:43:10,30.15.0.100
e615992a-b844-460e-af49-b1ff0ebca7c7,Anthony Rinehart,again if you deal with Amazon prime itself any of their additional services use Amazon prime they're excellent okay so you can't find the Amazon are there app and you'll find everything that you need.,5,0,30.16.0.100,2025-09-05 07:29:12,30.16.0.100
f51713f4-b23e-460b-b14f-8e2f7894ac8c,Susanahmed Ahmed,موقع محترم و خدمة عملاء محترمين,5,0,30.16.0.100,2025-09-05 07:08:12,30.16.0.100
1d768c86-4f6c-43bf-8409-32bb5dbd1080,One Lady,Amazon is a time saving helpful platform,5,0,30.12.4.100,2025-09-05 06:51:18,30.12.4.100
c0903fff-b53e-4acb-a181-9d398bfd2010,Sine Nomine,What is this stupid spinning wheel thing? Just show me the products i'm searching for ffs. At this point I'm going to need a 3rd party app just to view what is available on your site.,1,25,30.16.0.100,2025-09-05 06:50:50,30.16.0.100
5b35cfda-df37-4352-850a-b5133a2b2ca3,Jo Stenn,Chance-based loading times. Sometimes doesn't load pages at all.,1,0,30.16.0.100,2025-09-05 06:36:15,30.16.0.100
6835e6ad-8697-4c8f-8ea7-8772dccd4900,Mike G,"too many moving bits. sponsored ads are videos and they are every third item, then the things that aren't randomly start playing videos... then the things that don't have a little bit on the picture that moves... they are doing whatever they can to get you to stop reading item description and look at pictures instead, and it is extremely distracting. the app has become unusable for me. I literally give up when looking for something and go to a computer.",2,0,30.16.0.100,2025-09-05 06:16:58,30.16.0.100
527e6789-e5f4-4366-86d2-be79a04cf758,Allyn Binmore,"TAKE MY MONEY! BUT CAN'T GET INTO ACCOUNT!!! been with Amazon for over 10 years, tried to access my account...don't have the recovery number now, phoned an ignorant customer service man who kept taking over me, kept asking me for an address, I've moved 3 times in 10 years, what about the security questions? just hard work to access an account I've paid a premium for!!!",1,0,30.16.0.100,2025-09-05 05:58:30,30.16.0.100
61e31f84-8796-414a-bf35-5fc9da5b1052,Vic Jr,please don't buy in Amazon Arabia because my order package I didn't receive it. may the driver stolen,1,0,30.16.0.100,2025-09-05 05:50:00,30.16.0.100
8b158071-5927-415a-99ae-bad0389cf573,Bubbly Scouser,App doesn't work . Hasn't worked fully & properly for months. All other apps work perfectly on my mobile. If I could I would give Amazon zero stars.,1,3,30.16.0.100,2025-09-05 05:25:10,30.16.0.100
3d0508b9-7174-4a40-a12c-f2b0b55efc71,Anthony M. Martinez,stop uninstall,1,0,,2025-09-05 05:08:58,
dd7ee778-f817-47b3-86a8-49d5f2542d07,Asia Rahin,Amazon ham asaan ham Arzan,5,0,30.16.0.100,2025-09-05 04:51:02,30.16.0.100
e80b3d79-99bb-4fcb-808a-d077bf00f575,elly emaas,very good,5,0,30.16.0.100,2025-09-05 04:49:16,30.16.0.100
a1cc5d4f-a294-4903-bbab-28968124e6b8,Manuel Leal Jr,This company is great had customer support fixed everything my membership was lowered I'm enjoying buy a lot merchandise from Amazon 👍👍👍👍 update since about 2 years my deliveries has encountered problems no delivery at all or late this company needs to hire compent driver's or get a company that knows the areas,1,4,30.16.0.100,2025-09-05 03:50:44,30.16.0.100
730db973-7390-456d-a834-8326dc7321f9,Barry Marson,convenience of shopping,5,0,30.16.0.100,2025-09-05 03:40:08,30.16.0.100
f8968147-9cd1-4969-9a9f-c3fcb91eff93,Ronald Galindo,I have been very happy with my purchases.,5,0,30.16.0.100,2025-09-05 03:19:55,30.16.0.100
ec65fcd5-8720-48c7-9db2-d6039ecae441,Art Vandelay,"& I Thought USPS📨 Delivery Was Bad! Amazon is running a race for Worst deliveries. some drivers do their job and deliver to the apartment doors in the high-rise others may be contractor. drivers think it's okay to leave packages by the sidewalk in a major city outside of a high-rise or in unsecured areas, anywhere they think they think they want to throw the package so they can appear to be making fast, efficient deliveries. 9 months even executive management has not made drivers compliant",1,0,30.16.0.100,2025-09-05 02:11:10,30.16.0.100
8f745903-efc6-426a-8230-7ae53cbc49eb,myrna johnson-brock,I love it,5,0,30.16.0.100,2025-09-05 02:09:30,30.16.0.100
f4b6d269-a7cb-4e0d-a72c-de3e58126ad2,Trevetta Marie,can yall deliver to my place so I don't stress about it it would be great🫠,2,0,30.16.0.100,2025-09-05 01:13:48,30.16.0.100
ff510e26-f96e-4f15-a378-87759ad74ae2,Judy Lloyd,"my tulip flower order is sent to wrong address. sent to me Instead of recipient in Grand Junction CO. instead it was sent to my house Sacramento CA . Before it was shipped, I was unable to contact Amazon to correct delivery address. Judy in Sacramento Ca.",1,0,30.16.0.100,2025-09-05 00:15:07,30.16.0.100
