reviewId,userName,content,score,thumbsUpCount,reviewCreatedVersion,at,appVersion
26c1be72-7095-4c7d-ba2a-13526cce7908,Jeremy Frazar,"The app works okay for now. However, based on the experience with Amazon removing functionality and charging extra for it (like they did with Photos, and now in Nov 2022 with Music). Simple things like playing a specific song now cost extra, it will only play songs ""similar"" to for the fee we already pay. Expect bad decisions like this to come to the Amazon shopping app.",1,279,24.20.2.100,2022-11-04 15:21:35,24.20.2.100
26cc808b-a6be-4166-8a5d-d5679e1c16b4,Ashley Williams,"**Update: gave app another try, STILL TRASH.** Deleted due to bugs that prevent use of essential functions. Can't select ""my orders"", ""buy again"" or several other actions: every time you try to select them, you get the ""Return to home screen"" pop up. Unable to start a return on the app due to this and had to go to the full website on a computer. A bit scummy that the app is bugging in a way that makes it impossible to do anything other than shopping and ordering items. App crashes frequently.",1,1,22.14.0.100,2022-11-06 11:09:07,22.14.0.100
517eb278-b9d7-45b8-81bb-8f4ebb9ccf26,Ty of Florida,"Since a recent update, I can barely stand the search results because now they AUTOPLAY the images. I look to those images to tell whether I want to click on the result or not, but if I only got 2 seconds to tell what it is, how does that benefit anyone? This is pure ""fixing what isn't broken"" example; way worse than what I've seen Microsoft do. For the love of God, at least let me turn it off! If I could guess, it's decreased my chance of buying anything by 30% out of frustration.",1,540,24.21.4.100,2022-11-21 17:21:43,24.21.4.100
518c3703-e284-4b80-965a-a1323281f441,Sonny Hayes,"Horrible algorithm, you have to know exactly how to search to find what you want, and your home page will be filled with the most useless items for you. It crashes, loads slow, bugs, and is generally inconvenient. Also they keep updating what the app looks like and every time it gets uglier and more inconvenient. The orders page has changed so my past orders and current are all combined and mixed making my orders extremely hard to visualize.",1,197,24.20.2.100,2022-11-08 22:16:06,24.20.2.100
76849405-a537-4cd9-999c-d47b19b5052f,Dan Africk,"Useful but broken. The 'my orders' screen does not load a majority of the time, it just gets stuck / frozen. This makes reordering items, handling returns, checking order status, and sharing product links all much more difficult than it has to be. It's been broken for months, and I've reported the bug previously with no response. I place many more orders than most people probably, which may be why I have the problem. FYI there is a workaround, you can go to 'buy again' and search for the order",2,172,24.20.2.100,2022-11-09 22:45:24,24.20.2.100
ab7e2dea-e245-4c40-bdeb-a0bcac9749de,J R,Junk auto play in search results. Junk junk junk. It's unusable for me. Can't look at a product and decide if that's what I'm looking for. Also I don't like that this junk that I can't turn off is using up data on my cellphone plan. I don't plan on doing any shopping at Amazon until it's changed. On a side note I tried the mobile website and it's the same on there as well. Amazon must have thought doing this to their site they would increase sales. Just the opposite is happening in my case.,1,251,24.21.4.100,2022-11-19 11:59:40,24.21.4.100
446b435b-be8a-4b56-aebb-f4f8cdfb7971,Lucy Tinsley,"They just updated the app so that when you go to shop and you look up a product it autoplays a video on every. single. product. And when you go to click on the product that you may be interested in, it starts blasting the product video. I was advised there is no way to turn this off unless I also wanted to stop autoplay on my Amazon prime videos. Which means that if I were watching a show it would not autoplay the next episode. I fail to understand why these two would be linked.",1,1010,24.21.4.100,2022-11-17 10:39:03,24.21.4.100
bb29910d-20dd-483a-bcfd-6a1e99283055,Jason Grayson,"Amazon please fix your app. It can become incredibly buggy to the point where the app has even closed on me. Another thing would be the search engine. I can look up something and get something entirely different. I'm sure if i looked up circles on your engine it would give me squares. Even the filters don't work right. Example. If i choose the filter ""Physical Copy"" it literally also chooses the ""Playstation 4"" filter on top of it. Why? I chose ""Physical Copy"" so why can't i get what i chose?",3,87,24.21.4.100,2022-11-25 16:20:17,24.21.4.100
e2d595d3-a103-40ee-898e-09f2808d9f89,Cat Landess,"I'm really o.k. with a lot of its FEATURES. I changed my provider & that's causing issues. I do have ideas for improvements for those NON technical people. I like it. Wish u could select items from your basket or list, then only purchase the few things u want. Without having 2 do it the current system of putting stuff in the main cart or in a list. Hope it makes sense?",4,1,,2022-11-28 19:06:24,
bcdecec8-968c-4173-a333-002e6f0fcf3f,Mitali Gupta,Horrible algo for filters. The results are unrelated. The filters don't even work. You apply a filter for a price range and it shows products higher or lower too. The filters sucks and makes it so hard to navigate and look for a desired product. I don't understand why Amazon can't work on this feature and make it smooth and useful for the user.,1,326,24.20.2.100,2022-11-10 19:17:45,24.20.2.100
5ef43a6f-4974-40fe-89fb-5ace978806ab,Jules S.,"The option to save item to shopping list is not at all visible. I always struggle to find it. Is it that hard to have a favourites / heart button? Also, when I search for something and change the sort by option from the default 'featured' to 'price from low', for example, I get less items (like half as many). This is sorting, not filtering. Bug right there! Also, would be great to have the option to sort by number of reviews (from most reviewed to less).",3,65,24.21.4.100,2022-11-27 20:33:28,24.21.4.100
1376a13f-f06b-421f-a715-6cbdbe598ced,Juliana,"Please get rid of the new video autoplay feature! Whoever thought is was a good idea, what were you smoking? I want some of that! ðŸ˜ Tracking map is RIDICULOUSLY tiny! Why not expand it to the whole screen? It's not like you can't - you do it for Fresh, why not do the same for all deliveries? Also, sorting by price stopped working recently. Pretty frustrating.",2,71,24.21.4.100,2022-11-20 20:05:35,24.21.4.100
084edbf5-afe8-4bd8-8f18-ce4233001c7e,Bailey Beatrice,"Not Great. I liked Amazon at first but now they have multiple items listed for WAY over actual value, the filters don't work well at all and in my household alone there have been SIX packages gone ""missing,"" in the last 30 days. It's insane. I can't believe that many items could go missing like that, I am starting to lose all faith/interest in Amazon.",2,181,24.21.4.100,2022-11-17 01:57:21,24.21.4.100
e1e3ca0f-77a4-40f7-8eb0-9c8b5d2e23e9,DJ cRay-z,"Since the new update, I'm asked repeatedly in a small time frame to verify that I'm not a bot. Then completely glitches even after I verify. Viewing/tapping anything n editing Wishlists leads to the same ""Something Went Wrong On Our End"" message for the next 15-30 minutes. App is now impossible to use. Constant error messages when saving to a wishlist, glitchy misclicks (clicks items on even on screen) and very slow response when tapping Add to List. Will be uninstalling until further notice.",1,100,24.21.0.100,2022-11-12 17:10:24,24.21.0.100
3d5dc451-5bb3-47fa-bc66-e775231ee7c4,Graham (Kentos),"Used to be an app for shopping. Still is but not with these new annoyance ""features"". Why am I being spammed with watch live sports? I spent over an hour trying to disable these app notifications. I've contacted support and their answer was ""you can't"". Even if you disable ALL notifications in app, you will still get those push notifications. You can't change these setting on the website either. Seriously Amazon? Terrible design, and customer support.",2,0,18.13.0.100,2022-11-17 17:27:11,18.13.0.100
64f81bb8-14ed-433b-832e-f2247a9c1a35,kylie boydston,"It's hard to find exactly what you're looking for and sometimes it excludes results for some reason. Heaven forbid you try and move something from one list to another or delete something off a list. Everytime I try the app immediately stalls and quits working within a few minutes. I never get more than 7 things deleted at a time. The only good thing about it is I've never had issues with orders. They arrive within the projected time. Website works well, app is extremely buggy.",3,172,24.21.0.100,2022-11-14 20:21:56,24.21.0.100
e9fa66cf-942a-4ac9-b2f7-085d56545f06,Ashley S,"update: liking the app more BUT can you guys please create a multi selection option for our ""saved for later"" items so we can move to certain ""Lists"" quicker? That'd be amazing. Also, please remove having to click the button ""load more"" when swiping down our saved for later items. I preferred when it just loaded automatically. now it takes longer to organize. I have 600 items saved ðŸ˜†",3,6,22.13.0.100,2022-11-19 18:06:33,22.13.0.100
f857b855-a77b-4e25-baca-ac2e7f6d6b60,ash,"This used to be a five star app but recently they've started issuing advertisements in push notifications, and that's frankly not acceptable no matter what app it is. I'd have given four stars if they used Android's built in system for disabling specific types of notifications, but they didn't, so now I have to turn off both the unwanted ads and helpful notifications at the same time.",1,121,24.21.4.100,2022-11-23 00:34:16,24.21.4.100
154a1437-5134-42ab-93c5-3ec1e8fc16a9,Stacey Bell,"I cannot understand how this app has a 4.5 rating. They have to be false reviews, because the app has almost become completely unusable. It won't load searches. Constantly saying Oops.. . We hit a snag and tries to send me back to the home page. Items with multiple choices to purchase do not load when you choose a different one. I have to jump through hoops just to be able to search for my most recent purchases. I don't even know why I'm still using this app. It's absolutely horrible.",1,0,,2022-11-28 20:53:21,
ef96b903-5f2c-487b-94a5-b2faaa9bb08e,Kristen Kramer,"The items in my cart just disappeared which is extremely frustrating adding what I want to buy and going to purchase the items and them not being there. The items didnt even go back to saved items they are just gone. And searching through my saved for later takes so much longer now that I can't scroll through the lost and instead have to tap, ""load more."" It's highly annoying.",1,96,24.21.4.100,2022-11-24 14:48:31,24.21.4.100
766e026f-3bef-4641-94c2-b2b9431798f0,Oveta Alexander,"I love Amazon and the app can be somewhat useful. The ways to narrow down options of what u want could be better though. For ex: if you're looking for a certain price on items it would be nice to be able to put it in manually from how low to high of a price range instead of up to $25 and then $25 to $50. What if I need something up to $60?Also, when I pick the option to show items from lowest to highest I notice a significant difference in the # of items found.",3,317,24.21.4.100,2022-11-29 08:40:11,24.21.4.100
2dd5af04-2563-40b9-a0cb-caa0d0c2849b,Shi,"Edit: The new filters are terrible. ""Order by"" is in between all the other filters and hard to find. Edit: Everything I add to my cart is by default a periodic order. The default should be single order. Thank you for not selling our data.I think Amazon is the only app that doesn't share my shopping preferences with third parties.I sometimes search for very specific items on Amazon extensively and I have never gotten any suggestions for similar products outside of the site.",3,1,,2022-11-23 04:59:04,
136e90de-8d8d-4a8b-b5ff-55a8bc68cf60,Alexander Lobstein,"Just... I don't really even have words to describe how indifferent this site has left me. I've had to cancel my Amazon Prime subscription SEVERAL times, and it seems that every few months, it magically renews itself. While PRIME has no problem figuring out which credit card to charge, Amazon can never seem to figure it out. I've had to delete the same card from my account FOUR times, and like prime, it magically reappears every couple of months. -1/10 for the site itself.",1,51,24.21.4.100,2022-11-29 22:08:33,24.21.4.100
40750fef-0eb9-4c14-87da-64b146074d8c,K Fam,"I've tried installing this for 3 months. It fails w/o error every time. I resorted to trying the Aurora store. That also failed, giving an error about insufficient memory space. Which is odd. I have 10gb free on the phone and another free 15gb on the SD card. I've tried clearing Playstore cache+data, & rolling back the play store updates. Even tried installing a 2021 version of the app from apkpure... Still failed. EVERYTHING else installs, Amz appstore, prime video, waze, netflix, etc HELP!",1,0,14.0.1.100,2022-11-10 06:42:07,14.0.1.100
c601d6ac-11f6-491e-9faa-65ef90f95ed2,Madeline,"I've used Amazon for over a decade, and the app for nearly as long. It's been great until recently. What is with the ad loading screens now?? Now during promotional periods like Prime Day and Black Friday when you launch the app you have to sit through a dumb promotional loading screen. As if I couldn't figure out there were sales going on by looking at banner on the main screen. The loading screens don't make me want to shop the sales. In fact, they make me want to not open the app at all.",1,39,24.21.4.100,2022-11-26 01:35:36,24.21.4.100
bbc18378-0f67-48e7-b733-ea0a49867b61,Todd Beam,"Discouraged and galled. I used to be able to purchase an individual song and have it automatically added to Amazon music, but some content you've restricted to Music Unlimited only. All search results only exhibit Music Unlimited option, which is restrictive, hinders, and will ultimately make me lose interest in technology. You can't fly with no wings.",1,71,24.21.4.100,2022-11-22 02:28:40,24.21.4.100
2ffd17ad-5e1c-47fc-9d8a-7eb8cbc387d8,S Ajayi,"An app from one of the biggest tech companies ever should not be this unstable. It's constantly timing out or failing to connect or throwing some random error that it doesn't explain. Also, the search / filter functionality is abysmal. Update: It's always crashing. You can't filter by custom price points. If it was some new start up it'd be mildly irritating but for Amazon....",1,388,24.21.0.100,2022-11-14 21:07:19,24.21.0.100
97978d84-11e9-4abc-bc89-8821a560894e,Nick,"The recent updates have been steadily making the app worse and worse. The wishlist function is awful to use to the point it's almost useless. The filters now are an absolute joke - you cannot narrow it down nearly like it used to allow. Auto playing videos, completely irrelevant results abound. It feels like I'm on social media, not a shopping app.",1,172,24.21.4.100,2022-11-25 23:40:59,24.21.4.100
81fdd801-da27-4874-b633-e3ca11f0dd78,Sherri S,"I have been using Amazon smile shopping app for years! It is simple to use and is my go to shopping app. There is room for improvement, however. One thing that frustrates me is that you cannot type services in the search Box , for example you cannot type in Amazon music, or subscriptions and pull up your lists. Navigating to personalized apps and subscriptions is a pain in the rear, If they fixed that 1 feature I would give it 5 stars!",4,26,24.17.0.100,2022-11-17 18:28:35,24.17.0.100
6ff5d786-e78e-4529-8632-b5e5a7310a82,Sathish Mukundan,"(1) Search results are basically ads and irrelevant to the search criteria. The recent updates have basically screwed up the shopping experience. (2) I don't understand the need for the so called ""influencers"" popping up on the homepage. I can decide for myself what I need. I would recommend moving them to a different tab or at the bottom. Waste of space that can be used for something better.",2,29,24.21.4.100,2022-11-30 00:28:25,24.21.4.100
93ad3859-b60b-40cc-9dd9-3d991f50482c,Jonathon Seal,"Unfortunately I have to write my first negative experience of Amazon. Long story short I found a promotion that showed up online and in the app. I put the items in my cart that matched the terms of the promotion, did not apply. So I chatted with customer service who assured me how to fix this problem, then randomly got told I needed a call back. So I did that, and after an hour of transfers, the promotion page magically said this is no longer available. I am beyond disappointed and frustrated.",1,47,24.20.2.100,2022-11-08 03:13:32,24.20.2.100
23aa81f5-77b5-4770-b1ef-b9be7f295f80,kota e,"ive never seen an app that didn't want to be an app more than this one. scrolling is awful on the lists page, it lags horribly and you can only smoothly scroll if you swipe really fast. kinda negates the whole browsing thing. no pages load, they all give me the error page. the dogs do take the edge off a little, hence the 2 stars. the amount of sponsored listings makes it impossible to find anything you're looking for. eat my shorts, bezos, make a good app.",2,18,24.21.4.100,2022-11-28 05:55:03,24.21.4.100
548956c4-53f0-42e9-b3a6-c16b3d30474a,Bindiya Bol,"App doesn't load anymore! In the last four weeks the app keeps showing its ""Uh-oh! Something went wrong on our end."" message. No resolution, no update, no bug fix patch, and no communication from Amazon as to why. And it wasn't fixed in time for Black Friday! Really unexpected show. The computer-version works okay, and it's a faff trying to use Chrome or IE on my phone and NOT have it redirect to the broken app. Good service in itself, but very poor user experience on the mobile app.",1,434,24.21.4.100,2022-11-25 11:55:57,24.21.4.100
090d2985-39e2-417e-83d1-47a892dfc6b5,Night wolf,"As far as I'm concerned Amazon has went extremely downhill in recent years. I have many complaints with them. First, Amazon Prime. The only reason I use Amazon Prime is for 2 day shipping. They never fulfill it. Ever. They're not that great in prices. Best Buy and many other stores meet their prices pretty competitively anymore. But mainly Prime. Prime is a joke. If all you want is 2 day shipping. Prime is a succubus that doesn't give you anything in return.",1,5,24.21.4.100,2022-11-16 06:33:44,24.21.4.100
b847e844-25ab-410f-a110-cda261b6c7f5,J R,"I always look for Sales and Deals, had no problems buying before. Now some sellers will choose not to ship the item on deal or Sale and there's also many scammers. It will state on your Amazon order account ""Running Late"", sellers will return money, a scammer keeps the money. You can check UPS or FedEx tracking number to see if it was shipped. Contact Amazon asap if not shipped or if there's no way to track the item or unable to contact seller. It's getting frustrating to buy now from Amazon.",3,14,24.21.4.100,2022-11-19 15:13:18,24.21.4.100
186123bf-df6e-4d1f-8f05-a5d0d16c0dae,Raven,"Dear Amazon, it's 2022. Put a damn option to get notified when wishlisted items are on sale. Without that option, which is PATHETIC it isn't already offered thru the damn site, but without that, this app is only good for spying on customers location, having access to their microphone & cameras to be able to gather info to get more targeted ads to sell you more stuff. Not to mention Prime shipping is slower than FREE shipping from Walmart, Target, Best Buy & others for the past 3 years. 0/5 stars",1,12,24.21.4.100,2022-11-24 03:21:23,24.21.4.100
d79cb42d-315e-4de0-8193-2c5070a7752e,David Dunlow,"Its an ok site if your looking for some items but pretty pointless to have Prime due to half the packages don't arrive at all or even on time if they do make it! Had to cancel orders that never came and i ended up getting them from another sites to get the product! They like to blame the shipping end but don't seem to have any changes to their shipping for the price they charge you to be prime, so kinda pointless when u get free shipping but items never arrive!",1,10,24.21.4.100,2022-11-30 02:01:01,24.21.4.100
2436e275-a47b-4d92-a865-5ccc028e2aaf,Walter Pond,"Since most of the Amazon apps have become inconvenient and useless, I had to wonder what I have need of you for. I've decided to move on and get my music and movies through more convenient services and I can do my other shopping elsewhere, as well. Good riddance, Amazon.",1,4,24.15.2.100,2022-11-07 19:33:23,24.15.2.100
805c6655-e01e-4ccb-8ebe-723f477599bc,Michael De Gracia,"""Something went wrong on our end"" The app post additional ads within the search results but when clicking on it it gives this annoying error with a picture of a dog. Sometimes the error pops up with some of the results. This has been happening for quite some time now. Very aggravating.",2,0,,2022-11-29 00:29:03,
3d61a3d0-83a7-478b-84f2-f148143c6463,Shawn Crites,"The app works pretty well but recently started pestering me with ads and deals through it's notifications permission. I only want notifications regarding my transactions but can find no way to choose that. I don't really want to turn off permissions, because I need to know when packages are delivered, so PLEASE STOP using the permissions otherwise, or make a way to choose which notifications to receive.",3,10,24.21.4.100,2022-11-26 20:35:06,24.21.4.100
0eb15994-e9ac-4954-9a12-01c8ae84177c,Mark Searfoss,It's no wonder Amazon has lost a trillion in market value. The gap between price versus value has only gotten bigger. Prime 2 day shipping has become 3-11 day shipping from the day it ships. The warehouse packers don't use common sense when packing items for shipment. I have already canceled my music unlimited subscription will be considering canceling Prime also.,3,12,24.21.0.100,2022-11-13 15:09:33,24.21.0.100
e1d13319-ef9e-4ba7-950c-20f25eb4e04d,Andrew,"The app will not stay logged in. Every day or two and I have to log in again. And it doesn't help that I have one of the Amazon edition phones with the Amazon widget so the moment it logs me out, I get widget notifications reminding me to log in. It's a total pain. Otherwise the app does exactly what it's supposed to. This issue has existed for a couple years and never seems to get fixed. *Update* I just upgraded to a new phone (pixel 6) and assumed that this issue would go away. It has not",1,268,24.21.4.100,2022-11-24 18:32:19,24.21.4.100
d27fea2a-aaa9-4e44-9594-6ff1609b4973,Robert Mason,"I love shopping with Amazon because they seem to have absolutely anything and everything I want at such reasonable prices, for some reason I don't mind maybe looking at a different suit to go out in even though there's nothing wrong with the clothes I'm wearing, maybe I feel a little bit off and im just now able to admit it to myself, my favorite Amazon purchases surround electronics! Anything with Electronic nature, like videogames of any and all types, radios, Television and even automotives",5,2,20.14.0.100,2022-11-17 09:17:59,20.14.0.100
3f3f6c25-d421-4bb5-a429-f2eb2ad28a70,Kelly McDonald,"This app has been a part of my daily life for maybe a decade. Lately I've had increasing trouble getting decent search results with it. I mean, ridiculous, like when I shop for a power tool, I get bathing suits. Filters, options, and history are totally limited vs. the web site. The one time I asked for help with an app feature (today), I was told that THERE IS NO APP SUPPORT. For all the money I spend here, you can't lift a finger, but you keep trying to shove Alexa down my throat. Nope.",1,11,24.20.2.100,2022-11-08 03:08:37,24.20.2.100
c963881c-4ac7-4e7b-8323-dc65251a310a,Colby Arent,"I love when they randomly remove the useful bits. Apparently they don't want to include age rating information for books anymore or Q&A for products or the ability to search reviews for details that aren't listed but are important to know before purchasing. It gets 2* because it's stable, but I swaer Amazon is continuously lowering the online shopping bar industry wide by showing companies just how bad you can be and still sell products.",2,18,24.20.2.100,2022-11-03 16:51:05,24.20.2.100
917bffab-45d2-452f-822f-0d962d3a0aa0,Dave L,"Very annoying that you can't purchase through the app anymore, tried to buy an ebook via the kindle app, can't. Tried to buy it through amazon app, can't. Added it to my wishlist so I could find it on the website... none of my lists were there. Really tried to buy it but gave up and got it from a second hand book store... that's what I'll be doing from now on, feels better. Actually going to buy everything in person from now on, saves money and I only buy things I really need... goodbye Amazon!",1,10,24.21.0.100,2022-11-16 21:05:13,24.21.0.100
450d52bb-0542-4872-8243-5ddb7915d858,Jim C,"OMG what did they do to this app. So the external links for retus are broken, insecure, non existent. The search filters give you completely different results. What happened, shouldn't you have tes8ir before black Friday . Or do all the bugs work to your benefit. Roll back to the last version or update is one because holiday shopping shouldn't be this hard",1,4,24.21.4.100,2022-11-24 06:53:01,24.21.4.100
29282a43-c297-4050-ab91-76c2d6c5ae94,Casting Conan,"Dude what happened to you guys? I've never had problems up into this year. Like the tracking was perfect the way it was, now it's third party and requires another app, that is a 50/50 if it actually works or not. I get the help I need via your ""automated help system"" litterly talks you in circles like you are in grade school. I have no idea where 2 of my items are, or if I going to receive them, probably not going to use after my items arrive. Lemme know if you genuinely wish to fix this. IBF...",1,9,24.21.4.100,2022-11-27 21:45:52,24.21.4.100
