reviewId,userName,content,score,thumbsUpCount,reviewCreatedVersion,at,appVersion
94ea6d3b-5c88-4c94-97f0-c9715d421874,Cris R,"It's getting worse overtime it is now more expensive than shopping in store, I used to love using Amazon because they had great deals, but the app has gotten worse and so have the prices same with Amazon fresh, Amazon is raising prices don't believe me add something to your save for later leave it there for a few days and go back it will go up in price, DyNaMiC pRiCiNg, no you are just a greedy corp, it's just another ebay now with all the resellers with most of the stuff coming from Alibaba.",1,0,24.21.4.100,2022-11-23 04:19:49,24.21.4.100
d8ec7a2a-461c-42a0-a34d-cd76da371cc1,Amber Voegele,The new update is making it so I can not add things to my cart via android Samsung phone. I have been trying to order a phone case through Amazon prime and I have picked 5 different brands and none of them will let me add the cases to my cart. I'm getting livid and overly frustrated.,1,0,24.20.2.100,2022-11-03 15:02:42,24.20.2.100
81eb7238-f18f-4de4-8d6e-d79b39206bd4,Nic Jones,"Genrally good service. Docking points for endless marketing push notifications. I removed the ability to notify me, but that probably means that I don't get the notifications that I do care about. Learn to use the notification channels api",3,0,24.21.4.100,2022-11-28 18:21:02,24.21.4.100
c14c7ddf-482f-4966-8155-2143f79cc32f,Chivo R,I would have Givin this higher rating but the thing I dislike about it is that when I buy stuff from this app I expect to get charged right away and then I'll be waiting for my package. But this is the opposite I receive my package and then a couple days later they start charging which sucks because I expect to have that money deducted and not have to worry about not having enough money in the account. Makes me not want to buy from Amazon anymore if you guys keep on doing this.,3,1,24.21.4.100,2022-11-19 04:15:34,24.21.4.100
3af14be3-6191-4ad0-95fa-26e78b7e55dc,Sarah,"Come on Amazon!!! Automatic videos for everything while scrolling through???? People hated that with Netflix, why would this ever be a good idea??? I just want to look at the item and not have to chose whether to watch a video or not. Just leave things be. Stupid idea.",1,2,24.21.0.100,2022-11-14 19:37:06,24.21.0.100
26edbc2c-f5e9-49d9-a6b9-88c03a6aa08a,Lisa Smith,"It is a complete waste of time and money paying for Prime. I use to get my packages within a couple of days, now I get everything in 5 or more days. The only reason I got Prime was to get my packages early and now that doesn't happen AT ALL. Terrible way to rope people in and then stop with the main benefit that was advertised.",1,4,24.21.4.100,2022-11-18 23:30:07,24.21.4.100
3117ab1e-012d-4c82-8fbb-bd5e767c950d,Jessica Rushing,Since the update it keeps glitching and jumping pages at a time while I'm looking at products. It also shows the same thing over and over page after page. Getting frustrated with the app.,1,1,24.21.4.100,2022-11-17 08:07:27,24.21.4.100
330f28f8-0b2e-4ea9-a377-5d18ce7ca09b,Benjamin Huntington,"Whenever you're trying to scroll up, on a spot that has an ad for scrolling left and right, you cannot. You have to touch PAST the ad (especially the amazon ads) to be able to keep scrolling.",1,0,24.18.0.100,2022-11-14 00:24:32,24.18.0.100
b8ab6964-0969-403e-8310-87ecf3d64a88,MÏƒÏƒÉ³SÔ‹Î¹É³Ò½,"SCAM! I ordered 3 mystery boxes of electrics and said that they shipped it but they totally erased everything all my orders, its like i gave them free money. This app is a scam I never trusted Amazon since I was a kid and now they gave me a reason again to not trust them. I will never order anything from Amazon ever again. You guys be careful when you order something from here. They erase your data and everything you purchased, you can't even track your order coz nothings there.",1,1,24.21.4.100,2022-11-20 00:47:37,24.21.4.100
9c6e698f-2184-46da-9c02-a981fce9e6b5,Emma C,"Absolutely ridiculous. Can't even use the app, it's so slow and glitchy it's unreal. If your going to make an app at least make sure it works first ffs, can't do anything at all crashes my full tablet.",1,11,24.21.4.100,2022-11-26 12:20:29,24.21.4.100
806a0e8f-f6a7-4e5d-af73-55f8d80ff631,Conor Keddy,"Deliveries are late, they outsource bad couriers that leave parcels anywhere. Quality of a lot of products aren't great. Not impressed. Heard good things but only got disappointed. When you don't receive an item it is difficult to let them know because you deal with the buyer and it's not their fault... Stick to old fashioned shops is my recommendation.",1,1,24.21.4.100,2022-11-30 03:13:18,24.21.4.100
fae75b39-fde2-4c03-b111-a16414e4e5b2,Rebecca Harkins,"Since the update from 11/11/22, everything is in Spanish. I went to the web page and not the app and made sure it said ""English,"" however, that still didn't fix the app. There are no buttons showing to use English in the app.",1,2,24.21.0.100,2022-11-12 21:46:45,24.21.0.100
31688d2e-7646-4cf3-bb4e-d645611dd5ee,Georgia Holman,"Really like shopping with this website only problem is getting your items lots of time. But they do help you when this happens, only thing it gets tiring trying to prevent this from happening wish there was a solution to this whole scenario.",4,0,24.18.2.100,2022-11-08 04:47:39,24.18.2.100
bb65a431-bab5-4e44-b208-79a47ef48792,Stephen H,Not a bad app but everytime someone sends me a link it switches to their language and I have to go to the the settings and change it back. It is quite annoying. The app is now sending adds in the notifications= one star,1,2,24.21.0.100,2022-11-12 16:36:40,24.21.0.100
42530ada-0669-4fe2-be6c-7aee1e676967,Dede Dorr Allen,What is going on with the app Amazon? I've never had any issues until the last few weeks. There have been so many issues from trying to search to adding an item to cart. I order weekly but if this keeps up I'm going to have to shop elsewhere bcuz it is that bad.,1,2,24.20.2.100,2022-11-07 04:36:06,24.20.2.100
f26b25ea-2d2a-42ca-ae8b-ed3e79a8500b,richard carrey,"Every time you switch to another app, Amazon forgets what you were looking at and goes to the home screen when you switch back. Total pita when researching items to buy. Filter is rubbish too. Could learn lessons from ebay.",1,2,24.21.4.100,2022-11-22 18:37:25,24.21.4.100
50a9de02-925d-488c-8de1-0df50266972b,amry munna,"I found used item, I ordered the Matepad 11, I received it, but they delivered different, used tablet. box was already unboxed... This is the situation of Amazon.. Worlds standard.... This is not acceptable, I'm really disappointed... Costomer care is really irrespective about their costomers. I had to call them & 3 to 4 times, to get my refund.. Luckily I got it back. Only one person in the costomers service, a lady she was really good & were being polite. Thanks for that...",1,1,24.20.2.100,2022-11-08 20:45:36,24.20.2.100
210f69a9-469d-47d2-8dd7-de90ba19009b,Kayla Wright,This App works really well and their customer service is super nice but the carriers deliver to the wrong address a lot. I'd avoid ordering stuff around busy seasons cause this is when it always happens :/,3,0,24.21.4.100,2022-11-27 03:12:22,24.21.4.100
c495a8a9-5029-4d23-b1b6-14bd7873ef60,Adriane Williams,App keeps changing the language to Spanish. I change the preference back to English and it reverts right back to Spanish. I'm can't read Spanish so no purchases will be made. It's a good way to guarantee loss of revenue.,1,1,24.21.4.100,2022-11-17 02:10:08,24.21.4.100
e5917253-2562-478b-b7d2-cac11cbcf097,Carole Talaway,Good deals and selection is pretty good. Some product quality is less than what was expected but overall good experience. Most clothing is not name brands I recognise or sizes are limited.,4,0,24.21.4.100,2022-11-27 21:42:46,24.21.4.100
0fc5f8af-d964-48ac-a974-1ef252e4235b,The Real DMT (The Real DMT),"They will deliberately send you their previously returned, damaged items knowing how much of a pain returning an item is. Amazon is for convenience, but that goes out the window when they make you go on a drive to return their garbage. They will make you drive to a location on their list and drop it off before a certain time which they know a certain percentage of people wont do or will forget to. It's a scam to charge double and get us to pay for their bad inventory with our gas, money and time",1,98,24.21.4.100,2022-11-23 15:35:18,24.21.4.100
6ae46fb9-c7d3-4b8a-9ac9-952ea5a83177,David Gordon,Stopped working after latest update. App will start but looks it's buffering and nothing ever populates in the screen. Tried a complete uninstall followed by a fresh reinstall. Please fix as we're now heading into Black Friday sales that can't even be accessed now,1,3,24.21.4.100,2022-11-21 19:41:32,24.21.4.100
6b2628ab-d88f-4e76-bc8b-97538c902254,Randy Reynolds,The app was great BUT since it updated everything is in Spanish!! Had to uninstall & reinstall 3 times! Even when language is set to English. Ridiculous. When I do get back to English all of my Amazon emails and notifications are bloody well still in Spanish. Tired of seeing Hola Bella ðŸ™„,4,0,,2022-11-13 20:35:30,
66b4c6be-1ebc-4891-b961-e14aba582f37,Mitchel Power,"Horrible. Do not order, they will always use Intelcom. They never deliver packages. Address not found. I've stopped ordering on Amazon because they cheap out and use a useless delivery company from Montreal, Quebec. Every single package, ""delivery address not found"". There is coordinates on my address, why aren't they delivering my packages.",1,0,24.20.2.100,2022-11-08 19:17:11,24.20.2.100
5bb20a62-2dc9-4b5a-901d-50b9301f844f,Chris,Livestreams just pop up at full volume and full screen when I'm trying to scroll down the main page. Getting ready tired of that. We should be able to disable all streams in settings.,1,5,24.21.4.100,2022-11-19 13:56:36,24.21.4.100
7aeb29bd-6932-4793-8dcf-f31f572649a4,Brian Harley,"I've been receiving the ""uh oh"" error message constantly when navigating the app for weeks. It has progressively increased in frequency to the point that the app is basically unusable now.",2,1,24.21.0.100,2022-11-13 14:24:41,24.21.0.100
580c13e3-b39d-47dc-8f35-bb5615be583f,Attila Kiss,"Sockingly bad delivery service! 5 of my last orders arent arrived to my address. Each time they said delivered to me on the app! I was able to lacate my packages on the nerby streets at same house numbers! Their drivers are absolutely useless. I dont mind if they leave it next door but dont say they left it with me when they didn't! I wish they would left the packages next door but they just leave it at random houses in the area, and its keep happening! I will stop using amazon for shopping now.",1,1,24.20.2.100,2022-11-03 20:32:35,24.20.2.100
1b4725f5-fa29-41e4-99d2-867efbedbe60,Eric Feltz,Love Amazon But Unfortunately there are many items on Amazon that are ridiculously overpriced from 3RD Party sellers so an item that you would normally purchase for $10 can have an inflated price of $75 so thats how ridiculous it is. Also many items from 3RD Party sellers seem to be fictitious and counterfeit. I literally LOVE Amazon but they need to get rid of 3RD Party sellers who take advantage of people by selling items at 50-75% more than any retail price.,3,1,24.21.4.100,2022-11-25 14:53:09,24.21.4.100
86eb8343-bc20-400e-a776-4d2f5669204d,Laya Schnelten,"Offen have to close and reopen the app to get it to add things to my cart..it only works half the time and it's driving me batty!! Fix it for God sakes before I lose my marbles! Christmas shopping is the worst! ðŸ˜« Ps. Also expensive...since most of your Sellars sell stuff from cheap Chinese whole salers and jack up the price on us, aka ali-express. A discount would be really nice! ðŸ¤£ ..but seriously..please fix the app...ðŸ˜©",1,0,,2022-11-20 18:07:48,
f6ef9229-ac69-48bb-9631-ac7be3a4d00d,CJ Bentley,"Amazon just lies about shipping times now and the gaurantee is less than worthless, most products and reviews are false, and prime services cost more while being worth less every year. App is usually stable although link handoffs will try to open a web page half the time.",1,1,24.20.2.100,2022-11-03 22:07:21,24.20.2.100
fe681faa-d6ac-4b6f-8b39-78c2affc03dd,vincent divitis,"Edited to one star despite i would give it more based on how much is on there to choose from. But at least give us a choice if we want you to charge our card when we order something, or 5 days later. Its some of the most frustrating, dumbest bs I've come across when dealing with online orders, absolutely any where. Who's stupid idea was that any way? At least give us a chance to turn it off, or im not changing this review to what it could be..",1,2,24.21.4.100,2022-11-18 06:45:16,24.21.4.100
283858c9-57d3-4855-afda-97f5185fcb78,Michal Skye,The app constantly changes my language without any form of confirmation or query. I live in Germany and want the app in German SPECIFICALLY to make it easier to find products under their German names. It is infuriating to have to manually change it back to German on the regular.,2,0,24.20.2.100,2022-11-08 10:26:33,24.20.2.100
14cb4bc8-d6f7-4718-a709-46495ebeb39b,Nomie Kitten,"The new update I can't even select sizes for shirt, or look at different colours. It's been really really slow thus last year. I've updated the app, Uninstalled, and installed it again but nothing.",1,3,24.21.4.100,2022-11-16 23:49:46,24.21.4.100
57425ff9-d97f-423f-ae5b-94933af3974a,Promise Emmanuel,"App is designed like it's a deliberate action to stop people from using it. The catÃ©gorisations are confusing, and located in settings! Please bring the 2018 version back.",1,1,18.7.0.100,2022-11-05 06:23:29,18.7.0.100
b30cdff5-f116-4279-b3dd-c8cb07968e7c,Alejandro MartÃ­nez LeÃ³n,"There is a bug when I try to open my "" Your Orders"" sometimes loads and a lot of time is only trying to but only a progres bar at the top goes on and one and nothing happens. The rest is perfect ðŸ‘",3,0,24.20.2.100,2022-11-05 12:25:16,24.20.2.100
ff84932a-05c2-48ad-a02e-427f135bf90e,Crysta Diment,Not buying prime again. Got an email that I am no longer allowed to write reviews. No idea why! Contacted Amazon twice both times the person said we will change that and then I get an email from someone else saying I'm not allowed to make reviews and I'm in a relationship with a seller... what!? I get sent those write a review for money off and I never do it but apparently everyone else who does it can still write reviews and amazon doesn't say anything about it. I'm so confused by this. Why!??,1,7,24.21.4.100,2022-11-22 14:55:40,24.21.4.100
ceae31b1-2122-47d7-a921-8b1363ab4412,Tavina Byars,"I love using Amazon. However, when i log in It keeps turning into Spanish not English. Then my stuff got hacked. Almost lost 5000 dollars. Can you please check your end as I have tried everything. Let me know if I have been hacked in any way please. Oh yeah also how do you delete a card that is no longer available.? These things are not easy for me to figure it out.",3,0,24.20.2.100,2022-11-10 18:42:16,24.20.2.100
b79b00c6-3eff-4a06-9e75-fba6da151d45,Kim Saddler,"I love my Amazon, I didn't think I would ever love shopping until I got my prime Amazon prime is the best shopping experience and I've never ever been disappointed with anything I've ever ordered my only problem now is I can't stop ordering stuff I think you guys should give points to people when they order stuff so they can collect them and get free stuff or gift cards. I also love my prime TV there's not one movie I can't find I would never have cable, I just get internet & I Love it ðŸ’•",5,0,,2022-11-23 03:59:15,
5787308f-3677-47b0-9fe7-5bc12bf65ed8,Mendy Geeteh,"Love Amazon... Hate this app! With the last update my notification emails started coming in Spanish. Now the entire freaking app is in Spanish! Why? I can't read anything on your app now, so I'm thinking about getting rid of it. Guess you don't want people to buy off the app. At least those of us who can't read Spanish.",3,1,24.21.4.100,2022-11-25 22:28:28,24.21.4.100
2966744b-24eb-463f-b3ef-ea4f929fc624,Matthew Baum,"Absolutely horrible experience. I paid for 1 day shipping at $10.00. Your driver marked my package as delivered and said it was in the mail room. It was not. When I called, they said that it was an error and it was not delivered and that all they would do was return my shipping fees. Now, a day later and I have no idea where my package is or when I'll get it. I called again 24 hours later, and they still couldn't give me an answer besides wait until tomorrow. Absolutely absurd!",1,0,24.18.2.100,2022-11-23 02:31:33,24.18.2.100
2991ae7f-bb5f-40fd-8170-d5c14b7be059,Shaggy,Keep your orders separate. I love Amazon but every time I have more than one item in my cart it confuses the delivery guy and is delayed for days. Still waiting for my glow sticks for Halloween and it's now delayed til NOV 2nd... Same day shipping my arse. From here on I will just deal with the extra garbage and pollution so my items arrive on time.,3,0,24.20.2.100,2022-11-01 22:30:37,24.20.2.100
ab7694d7-5ed3-4def-887d-f13f65a02cc8,Ani Faisal,Everything seems to be goid.. this is for the customer service.. I had issue of returning an item to a 3rd party seller.. agents not only are unable to help but one agent just hung up on me when asked for the supervisor... Amazon also blocked me from writing reviews for no reason... horrible horrible experience this time.. DONOT buy anything if the seller is a 3rd party....,1,0,24.21.4.100,2022-11-25 14:14:39,24.21.4.100
1f5a4e3c-3d2a-4c78-80ce-7aa3db7317a2,M. Manasra,It has become extremely difficult to return items since they have removed Kohl's as an option. Now returns have to be done through whole Foods (really far away) or UPS store... The UPS store always has extremely long lines and takes like 30 minutes to get a return in.,1,0,24.19.0.100,2022-11-05 17:07:24,24.19.0.100
b83ffc51-f5f7-4f90-a208-62245c4c7bb9,A googleaccount,"Even after updates still issues, example - drop lists that do not work ""do anything"" and you cannot filter your searches which is a BIG failure ""greedy sales push"" for alternatives. Ask user to select (for more options) would be less offensive.",2,3,24.20.2.100,2022-11-04 12:28:08,24.20.2.100
08279c23-9552-48bc-a5fd-faa36e698963,Tammy Mitcham,"I would normally give this app more stars, but I HATE that you can no longer purchase books in the app. This seems absolutely absurd that you can purchase everything except books. This is very inconvenient and annoying! Fix whatever agreement you have with the Play store. I am very disappointed.",3,1,24.21.0.100,2022-11-15 01:22:59,24.21.0.100
3a93f8a7-914a-4f01-a962-f639b344c5ec,Brian,"The app signed me out twice when texting customer service. Then tell the same story to 4 different customer service reps due to them ending the thread prematurely and was finally told to wait 30 days, then contact them if I hadn't received my refund?! So the whole process took 25+min and I was left with nothing but a maybe. Not what I would expect from the largest retailer in the world. All their money goes into greedy pockets instead of tech for their customers, apparently",1,0,24.21.4.100,2022-11-25 03:26:39,24.21.4.100
a5a96c86-2915-42b9-bbed-2be12b879ba5,Jack Pierone,"I'm pretty sure the reason Walmart outdid Amazon on Black Friday is because the mobile app only shows you ""up to 37% off"" or something. Then you click on it and you realize the brand is wrong or the tablet is only 8% off but the case is 37% off. It's not useful and I can't be bothered looking there. Plus, you'd have to be an idiot to think that some of these deals are good. They encourage companies to take advantage with ""fake sales"" whether they intend to or not.",1,1,24.21.4.100,2022-11-28 16:45:39,24.21.4.100
7cf2c018-de04-4766-bb5b-49dadf9c703a,William Wright,Lately my packages are not showing up when they say they are and then it tells me I can get a refund if I don't want to wait for 2 more days hoping it shows up. Then I wait and it still never shows up by the time they say. I recommend other shopping apps besides this one. He'll walmart does next day shipping and actually delivers it next day.,1,3,24.21.4.100,2022-11-19 04:25:41,24.21.4.100
f8562310-79be-4a03-ae6a-5941be80006a,Susan Feigenbaum,"I hate how icons for items are now videos... I'm scrolling, trying to look for a product I want, and I can't even tell what products look like because it's a teeny tiny video of people moving around. The whole experience is distracting and unpleasant.",1,1,24.21.0.100,2022-11-14 19:19:21,24.21.0.100
16832705-ff7c-4a85-8a44-ce0bcb004af0,Dan Twing,"The new icon is so butt ugly, I have deleted the app. I'll use my browser if I need something. I don't need a poop brown smudge on my screen. Amazon has so messed up support it is a circular path to no where if you want actual help. Seriously close to dumping Amazon Prime and walking away.",1,1,8.3.0.100,2022-11-14 19:32:23,8.3.0.100
cbaaaafb-e64a-439b-bf2b-328a23181a1a,paula elliott,"Well i do like all amazon apps but since yesterday 11/25/22 ALL of my amazon apps stopped working on my phone(Android). I restarted, force stopped, uninstall and reinstall checked ALL connectivities and still it doesn't work. Now i'm a person who loves to shop and read but for whatever reason it doesn't work. I've reached out to amazon CSR and even though they were really nice and helpful. The damn apps still wouldn't work on my phone. What to do next??",4,0,24.21.4.100,2022-11-26 13:57:22,24.21.4.100
cb95a87b-ce59-4cf1-b900-48abe2638c3d,Raven Holmes,I love using amazon but yall got some things to figure out. When you search for things you usually end up with 100 random things that have nothing to do with what you searched and the filters are absolutly usless. The app its self does not work you guys keep updating the app and it just gets worse everytime and just the other day a $250 pair of shose that i never even searched or liked for that matter was trying to be purchased from my account.,1,1,24.20.2.100,2022-11-02 11:20:15,24.20.2.100
25152946-49b5-4682-bba8-489e858e4561,CHRISTOPHER,It seems to me that I can't purchase shows digitally for streaming through the Amazon app. I know it doesn't work for the prime video app but it should work in the Amazon shopping app...yet it doesn't. In the app I have 0 options to purchase shows I want to own digitally. It's ridiculous.,1,1,24.21.4.100,2022-11-24 01:43:48,24.21.4.100
ca58bcf9-10f4-4768-8fe1-d905f226bf85,Kenneth Conrad,"Please allow users to disable video thumbnails, or just eliminate them altogether. I can't believe anybody thought that was a helpful feature, but it makes browsing more difficult.",3,3,24.21.0.100,2022-11-15 15:24:41,24.21.0.100
72f4ff43-7242-410f-a3d4-759e628c30b7,Daniel DJGS,"Crashes every time I attempt to remove an item from my wishlist. Fixing this may move it up to a 4 star rating, but there have been several other glitches with orders in the past, so I can't give it a 5.",3,0,24.17.0.100,2022-11-01 20:13:14,24.17.0.100
40c0877a-c99c-4967-84c4-11650b9c558d,Dustin Robinette,"App and service are great. The drivers are a different story. Don't bother ordering something that is expensive or something someone else would want because it will usually end up being ""delivered"" but you won't be able to find the package. Ordered a really cool and pricey cyberpunk mask, waited over 3 weeks for it just to encounter a ""problem"" with delivery. Never showed but at least I got a refund. I would keep the prime membership of they'd hire honest drivers.",2,1,24.20.2.100,2022-11-04 13:45:24,24.20.2.100
676179d8-e301-48f3-8d5a-37c981a87988,S Hall,"Amazon is ok to use, but it shouldn't take 24hrs to verify your card information. If you place an order, the card should be immediately charged. Also the option for rush and overnight shipping should be added as an option to choose at the buyers discretion. This is the only app that I have had problems with lately.",2,0,24.21.4.100,2022-11-16 10:46:38,24.21.4.100
8c51ec41-e7c7-4554-9ca1-7982fd37a4ae,MiyuEmi,"The app strangely doesn't sync with activity on your account. Despite being linked to your account, the app seems to function as a stand alone account. The accounts should be linked. The app is worthless if you can't access all of your data.",2,0,24.21.4.100,2022-11-24 11:33:51,24.21.4.100
a4327461-c3ef-4ab9-91c0-90c44222597c,K. Gonzalez,Amazon used to be a great app and a great way to shop. You used to be able to search for a specific item and find it but not anymore. Now the search and filters are useless and laughable. Whoever they're paying to make this app is trying their best to destroy Amazon from within. Too bad no one is at the helm paying attention. No one even bothers to read these Google play reviews.,1,9,24.20.2.100,2022-11-06 14:48:11,24.20.2.100
2138206b-da1f-48a5-b329-96f9075a8755,Jeanette Bermudez,"Undo last update!! Hate to see videos instead of a still picture of the product and out for delivery notification takes you to a page that all your orders are squeezed into a page that looks distorted and is useless. Also, hate that green color!!",1,2,24.21.4.100,2022-11-19 14:16:11,24.21.4.100
d6a71156-a583-4cea-8952-d260b1fdf58b,Chris M,"I've paid extra for a guaranteed same day delivery times and have been denied a refund too many times to be quiet about this BS. All while getting no delivery for what I pay for. All lies with no way to get a refund or even ask about a refund. No wonder Bezo's rocket program fails to deliver... can't even get a paid for up front ""guaranteed delivery"" dropped off one block away within 12 hours. God help us if this company wants to send humans more than a mile away...",1,5,24.21.4.100,2022-11-19 06:42:02,24.21.4.100
