reviewId,userName,content,score,thumbsUpCount,reviewCreatedVersion,at,appVersion
51bd855d-9f7f-44f8-89e0-4eeef799e684,Serenity FroggÃ©,"It's hard finding clothing that's a good quality, and when you look up ""gifts for mom""and stuff like that, it shows a very generalized and non-variety of items to purchase. And I hate the whole thing where every single recommended item is just something I've already clicked on. It's not recommended if I just clicked on it and decided against it. Why is there no real recommendations? And lastly..... Very slow, very glitchy. But has the most stuff compared to other apps ig.....",2,0,,2022-09-09 02:58:23,
7dacc161-9e03-4b77-b7d2-6bd4aa927af2,Kathy Logan,"Loved it until a couple of weeks ago when suddenly everything is now in Spanish instead of English! I have to keep tapping ""Translate"" for each page, even though I have my settings on ENGLISH. Even my order confirmation email was in Spanish! I've tried several times to get them to correct it, but with no success. I'm SO frustrated with this, and VERY disappointed in what had been a wonderful app...especially since I'm disabled and need to use Amazon for most of my shopping.",2,110,24.14.0.100,2022-09-08 10:01:44,24.14.0.100
a764cb5e-9ac2-4ccd-bfe5-f5edbe116a82,Adam Haas,"What on earth did you do to this app?! The new search filters are absolute trash. It is so much more difficult to narrow things down properly, and everything is much more broad. Example: Men's Pants for fit type there is now only straight, loose, fitted. Where is the athletic, slim, bootcut, etc etc. Also the whole left/right column look just really doesn't look good at all. Though the old version did have some flaws, it was way better than this UI. You could have just improved on what you had!",2,1519,24.16.2.100,2022-09-15 09:49:28,24.16.2.100
785d38e5-2e0e-40db-8950-d6b5f83b7005,Stephen Cumbee,"This app has gone from functional to barely functioning over the last few months. It used to run fine, but now it takes forever to load, and it's always erroring and unable to load. Absolute hot garbage. It's supposed to be convenient, but is only frustrating because of how poorly it works, when it works. Even with a strong WiFi connection, it's unable to connect and load anything.",1,282,24.16.2.100,2022-09-16 15:49:47,24.16.2.100
c2b2a85a-56e9-43ec-b1e3-ec891f4ab64e,Daniel Carter,"I can usually find what I'm looking for at a reasonable price. I don't like that it gives you one price on shipping, which may change on checkout. I also don't like that it will give you a delivery date, that becomes a different delivery date, only after you have completed your order and checkout! Amazon also doesn't give enough options for bad reviews, leaving the blame to anyone else, giving themselves a scapegoat for having to replace an item.",3,1274,24.16.2.100,2022-09-13 01:43:36,24.16.2.100
5244836a-6e97-4cbb-b961-706343f3acf0,MB Droid,"Ever since the update about a month ago this is the worst app ever, and so frustrating. Ridiculously slow. I could go to my computer and log in before this app loads its pages. Buttons have been moved to the bottom, which is not a big deal, but that's when the app somehow got really slow. Alexa button is always present and in the way even if you've disabled alexa. I've already switched to other stores for shopping, solely because it's no longer easy to shop Amazon with the new app versions.",1,224,24.17.0.100,2022-09-21 19:14:01,24.17.0.100
d2a1e5b1-2922-46d9-ac06-d8db6ccfd6e9,PaTrice,"The new app doesn't work with my old phone anymore, so I had to Uninstall it and tried to install it in my new phone (which is the latest version of Samsung) still have problems, but it doesn't download, but before that had issues with the app very slow and other major problems. They should have stayed with the old app there were no issues or problems at all or at least for me, so they go from 4 stars to 1 stars.",1,0,,2022-09-24 20:26:20,
072c4497-9caf-4495-9987-d910378949d2,Adam Cappella,"2nd review, first got deleted. Hhmm, wonder why. App won't work. Tried downloading an update cause the app wouldn't work without it, It downloads %100 goes to install, then says it can't install. So I deleted the app to reinstall it, same thing, now I don't have the app at all. I have space, can still download other things. Amazon you lost a customer. Edit: I read other reviews, I think the update was the full vid adds. My phones older. I see this a bullet dodged. Not coming back to this app",1,0,,2022-09-14 17:44:25,
f24a0ef1-060d-403c-8104-188427c5fc9b,Rachael Reeves,"I have really been having a hard time with Amazon here lately. The shipping has been absolutely atrocious. They also make it impossible to leave feedback about anything. Now they've also blocked the talk to text option on everything. I use that constantly.... It's the only app it won't work on. I'm not sure why. Honestly, it's so corporate, It's impossible to get help if it doesn't just work perfectly for you.",1,349,24.17.0.100,2022-09-22 18:29:25,24.17.0.100
2d28ac67-a452-4042-ad26-6bd9959340a5,Nyx,"Until this last update I have had zero issues with this app. However now, even after clearing cache, data, uninstalling and reinstalling, the app will not allow me to access my account information, has lost my saved addresses and so on. Normally this wouldn't bother me however being able to make orders on the fly while traveling or st work etc is the one major convenience this app offers. Its quite redundant without it. Please fix this. No point to the app if its only fully functional on my PC.",1,241,24.17.0.100,2022-09-19 22:18:32,24.17.0.100
005e19ea-77ce-4940-8d79-01f3df826389,Maria Perez,"This app was wonderful without any issues before this recent update. I can't filter search items from low to high as every item and its prices are randomized. Also, it keeps glitching for every action. It's always failing to search anything, to look at a item I press, and even to checkout. Its gotten so frustrating to the point where I haven't bought anything from Amazon these past two weeks. I've decided to get a Walmart plus membership and buy the items I need from there.",1,279,24.17.0.100,2022-09-22 04:03:26,24.17.0.100
5d586a83-f406-4612-9dad-5d89b8e91ccd,Sarah Martin,"Since the update the app says my address fors not exist and I had to change the address. I called customer service and it wasn't showing on their end, even tho I have had things delivered to my residence forever. Had to update the billing address, and then change it back. It's correct on one screen and not the other. I uninstalled and reinstalled the app and placed the order, but I have no idea if the payment will go thru because the billing addresses are different on the screens.",1,101,24.17.0.100,2022-09-24 17:38:39,24.17.0.100
c67ec836-62e3-4408-8b6d-1ed7f70feb28,E,"This app use to be fine no problems with it, then around 3 months ago I feel something has changed. It's terrible now. When you try to check your orders to be able to track delivery updates the app just sticks & says ""oops there seems to be a error"". I'm sick of this. Also Amazon use to give you updates on your deliveries but that feature seems to be a hit or miss now. Sometimes you don't know when the estimated delivery time is to track your order. Amazon please fix this!! Not acceptable!!",2,412,24.16.0.100,2022-09-01 15:16:52,24.16.0.100
7175fa8f-f499-46cc-825d-5a57f4a184d8,Lemming,"I live in Australia and have the app set as such. FREQUENTLY when I click on a link in discord, YouTube, websites etc etc it's to the US store. Rather than just show me the item... The app prompts me to change country. Every. Single. Time. I shouldn't need to change the country in the app just to view an item in another country, by all means flag it on the screen or in the items page or something... But don't force me to change the country for the whole damned app!",2,153,24.17.0.100,2022-09-28 01:23:18,24.17.0.100
f9374bea-a9db-4f54-a3c8-65cee086f254,Mrs. Sherri C,"Good app. I don't like how this app is constantly running in the background, it drains my battery!!! I even have it set on my phone not to run in the background & it still runs in the background. Another bummer that I found for this app, is that I can't uninstall it because it came pre-installed on my phone. So I had to disabled it, even though I still would like to use it every now & again! It's frustrating!!! That's why I rated this app 2 stars!!!",2,0,,2022-09-22 18:11:29,
9094f1e3-012e-4d0f-8c44-10792164b460,Eddie L.,First of all I don't like ' apps. That put words into your mouth and then expect you to choose one of the incorrect one? Actually I have two items that I would like to gripe about although in the past Amazon won't answer and probably throws these into the trash. I hope you are listening!! I bought a 18 piece small flashlight set which included 18 mini lights and complete set of AAA batteries. I did not repeat did not get the batteries! . SEND ME BATTERIES;!!!!!!!...NOT MORE..FLASHLIGHTS?,1,0,22.19.0.100,2022-09-23 01:06:58,22.19.0.100
5eb10aba-c59b-479c-ab4a-e32d5807b68a,Aaron Lewis,"The latest update puts advertisements that play for several seconds when opening the app for stupid Amazon shows I will never watch. Then, I can't open my shopping cart... every time I try to go to my cart to check out, it goes to my previous search results page instead. I'm so frustrated with the app experience because it just shows how Amazon is behaving as a business, faulty app updates that ruin customer experience just for the sake of ad revenue. I might cancel my entire Prime subscription.",1,280,24.16.0.100,2022-09-03 17:32:19,24.16.0.100
15a78ac7-e715-47ba-85b4-ab83dcbd88ce,DUSTIN VERNON,The ui isn't as clean as it could be. The search settings in app are completely different from the website. If you try to search on website it shows you relevant items whereas in app it sometimes shows something close other times not so much but never as well as the website. The app can be slow loading at times. And while browsing there's the issue when scrolling down and a video comes up instead of continuing it stops and pulls up the video. Should be a way to disable videos for prime members.,1,107,24.15.2.100,2022-09-02 03:14:43,24.15.2.100
50a2776d-f733-446a-ac80-46ecb569c356,Jessie Kelso,"Have used Amazon Prime for over 10years and has always been a very beneficial app with prime shipping, music, video, and audible all included. However recently in the event that there is an issue that needs to be resolved through customer service the process has never been more frustrating and confusing. I have emailed twice now about why my account is unable to submit reviews or review videos as I was wanting to leave a beneficial detailed review on a recently purchased product and no response.",3,59,24.16.0.100,2022-09-06 23:49:18,24.16.0.100
9ba4415e-e5b2-43a7-88a2-6e62b026d85d,Truk Doogso,"App now shows an add on every start up, even if you pay for prime, and most prime items still aren't 2 day shipping. The search still isn't very good (often get partial matches well before the full search match you are looking for, items out of price order due to scam, used, or other size options, and numerous other problems,) and the reviews are often obvious fakes or sometimes for a different product.",1,57,24.16.0.100,2022-09-02 20:39:41,24.16.0.100
6c524430-09d6-4020-aae7-c290f816c8ac,Kenneth Cassabian,"Advertisements are starting to become extremely intrusive. When LOTR tv show came out, an Amazon advertisement would overlay on top of the screen and made you wait several seconds before allowing you to access the app. Today, 9/14/22, they sent me a push notification to advertise a football game to stream. There isnt any way to disable this without disabling the useful ""your package is 10 stops away"" notifications. Dystopian. We are getting closer to that black mirror episode every day.",1,83,24.16.2.100,2022-09-14 15:39:24,24.16.2.100
6df78a9e-9c70-4cd2-9981-fdab8cf60bdd,El Morientez,"1 Step For ward, 2 Steps Back in my opinion. Previous version of the app worked absolutely fine, the one thing it was missing was the ability to filter results by price. That's now been added in, but now the user interface is just an absolute minefield. Used to get you straight to the info you wanted in 1 click, now it's going to a page, scrolling, going into a sub menu etc. Notifications also now don't work - previously I'd get continuous tracking updates, now it rarely even tells me anything.",2,427,24.16.0.100,2022-09-03 22:36:00,24.16.0.100
ef5a4898-d90b-4218-83d8-a951b3018d73,Lisa Holler,"Since one of the recent updates I can no longer view the entire page on my screen. I can't even move it around to see the rest and I can't access the 'next page' button. I do all my shopping by phone so this is a real problem. Seriously, I am going more and more to other sites because of these problems. Hate that I am forced to watch a commercial when opening the app. Not cool. Uninstalling app now.",1,99,24.15.2.100,2022-09-02 13:38:50,24.15.2.100
04d573a9-0fb1-4132-b448-1f1ed3005ffc,Zane Ross,"This app is only good for tracking shipments. Browsing Amazon is so much easier on an actual browser with tabs. On devices with larger screens (ZFold 4) the experience is horrible, the app is not able to take advantage of screen real estate, just blowing up the UI in size instead of allowing you to see more info. Lack of tabbed browsing, and poor usage of higher screen resolution make this app very unuseful for shopping.",2,374,24.16.0.100,2022-09-04 16:05:13,24.16.0.100
23025d2d-7537-4ad5-8920-25fa11868be6,B Marie,"Not sure why they ever felt the need to make it more difficult to search through past orders. Even more fun when an order you placed through Amazon literally doesn't exist in your purchase history anymore too. Wild! I haven't updated the app in a while, but clearly their most recent update is trash so I'll keep avoiding their updates!",2,12,24.14.0.100,2022-09-21 19:30:10,24.14.0.100
86477e32-b439-4d83-802f-466bb587f99c,Ja Le Gr,"The app has worked fine for some time, and all of a sudden today it won't let me log in, I can't search my order history, nothing seems to be working. I tried clearing the app data and cache, tried uninstall and reinstalling, the app is just flat out refusing to work and gives me an error about my internet connection, even though I can access my Amazon account on my phone web browser just fine. What happened Amazon?",1,108,24.17.0.100,2022-09-15 22:18:10,24.17.0.100
4ff4f856-4a36-49ea-a167-5b2237c7cf47,Christopher Smith,"Terribly wasteful with data usage, and the app has distracting autoplay videos that can't be disabled. (Even *Facebook* recognizes this is an accessibility problem.) It performs some basic tasks, but Amazon has confused ""Shopping"" with ""intrusive billboard"". The in-app navigation is also a catastrophe: ""Back"" doesn't remember where you were, so every page change means scrolling through several screens. No tabs. Advertised real-time tracking doesn't actually exist.",2,139,24.16.0.100,2022-09-03 14:43:15,24.16.0.100
c5e69c11-8fad-4162-914d-860f7c4d9f5d,Laura,Placed an order that never came. Received an email stating it had been returned. Went to reorder the item; I put the item in the cart & it read 'get a $15 coupon if you order this through the app'. I click the button to get the app. The app downloads. There is no coupon. I go back to the email that lead me to the coupon & click again; it reads 'you've already received this coupon '. IVE RECEIVED NOTHING. So beyond frustrated with this whole ordeal.,1,41,24.17.0.100,2022-09-29 03:33:05,24.17.0.100
aea07241-0e1e-421c-a505-465708594938,Shannon Davison,"9/21/22 update. It STILL won't load order screen. I'm ready to not use this app anymore. It's THAT ANNOYING. Won't load orders screen. Ever. For about a month now I haven't been able to look at my orders. I can log into my email and see if they've been shipped but the app won't let me see them. It just tries to load and starts again, etc etc. Please fix it.",2,78,24.17.0.100,2022-09-21 19:21:19,24.17.0.100
2add2981-fe49-4d69-a55a-a757e6ef6a5b,Joseph Ward,Had a subscription to prime which was a good deal in a trial run I canceled a week and a half before the final canceled date for 2 years they continued to take money out of my account never paid it back never got it back after being told that it was definitely canceled by their email they continued to take money out of my account until I found out about it I didn't miss it because I have a small budget that I live on and mostly everything is budgeted to the t. This is truth,2,0,,2022-09-28 17:54:20,
e0649cd9-40fd-4850-9758-b8f2dc0dc5e4,Matthew Voorhees,"The app is buggy and Amazon does nothing to address the issues. I constantly have to force the app to stop, clear the cache, power down my phone, and then power it in again (not restart) if I want to view my orders. Otherwise I get nothing and my orders will not show up, or I maythe stupid dog picture with the ""Oops"" screen. This renders the app virtually useless because one has to check on one's orders since Amazon fails to deliver on time if even at all so frequently these days.",1,42,24.16.0.100,2022-09-03 17:44:02,24.16.0.100
c83cc44e-fb2e-4e13-b756-cf80b9dcc7ba,Tim Eller,"Very slow to open, but otherwise pretty functional. I would expect a pretty immediate response from opening the app, but my lists, cart and menu area all take over 45 seconds just to bring up text, let alone images. Unacceptable, in this age of speed and convenience (admittedly first world problems, but Amazon should be big enough to fix this post haste.)",2,205,24.17.0.100,2022-09-22 20:13:55,24.17.0.100
8539acf5-c883-428a-adc1-ac5881a016b6,Noor Ahmadzi,I used to shop a lot from Amazon. Sometimes more than 50 items per month. I had even subscribed to 30 items per month. The reason I was shopping for everything from them was that they offers me 12 month's warranty. But when some of the items stopped working before 12 months and I call for repair or refund I started getting a warning from amazon keep saying why you send back so many items. Even though I did explain for each item the reason but still they kept emailing me. So now I only..,1,0,18.17.0.100,2022-09-30 09:17:15,18.17.0.100
36ebe312-c056-4c02-afdd-c0a3ea4cab5a,John Couchman,"Forces you to use the app even though you can't buy digital content in the app anymore. Example: you can't buy ebooks in the app anymore. But if you try to search for an ebook in your browser, the app somehow takes over and forces itself open where there's no option to buy the book. I might be able to work with this if the browser search would execute simultaneously, but going back to the browser just leaves you on the homepage. Tap search and the app forces open again.... And again.",3,41,24.17.0.100,2022-09-26 12:51:03,24.17.0.100
4e95b937-9522-40e8-a06e-e55697020743,Cecil Williams (neXt Gen Tek),"I'm having issues when I go to checkout and the total and or calculation is not right. I had to exit/close the App and then it ring's it up correct. But now I'm having issue with after sale: it's saying I need to add a different payment method yet it took All the money from my credit card, the exact amount leaving 70 cent's behind but the App ship one item from the that one big order and start complaining that there is a decline and I need to add another payment method. Buggy ðŸ¤” App.",2,1,,2022-09-20 22:48:46,
c49b5484-429d-49f3-9f2c-506076617925,Yvonne McCumber,New update is not good at all. Very. very slow even in 5 G area. I echo some other people's criticism about shipping transparency. I have not ordered because shipping changed at checkout even to my primary address. I can understand if I change address at checkout. I cannot search by size. It brings up other sizes. Not even a range. Looking for plus sizes I get medium only options. Let's not even discuss the inconsistent sizing. Find a great XXL then look at measurements. Not even close,1,0,22.21.2.100,2022-09-23 12:56:31,22.21.2.100
c666ead1-8107-49b1-9129-c6b6331a2b41,Risa,"Shopping experience is great but something is broken in your code. When I'm in my cart and I swipe from right to left to save an item for later, the entire UI below the light blue delivery info bar shifts and pushes the contents directly into the very left side of my screen. This doesn't happen when I swipe the other way around. It's like the left side padding ceases the exist and it's very odd. I though maybe I needed to update the app and I did so.....issue is still there though.",4,80,24.17.0.100,2022-09-16 20:43:03,24.17.0.100
b494d684-fa00-4a58-95f2-55a85a964eb7,Pyro Flame (Lilpaox),"Full screen non-skippable ads when you launch the app are the worst! I'm opening your app to buy things and give you money. You don't need to make that harder with annoying ads. If anything it makes hate the thing in the ad and want to use this app less. Also please let me disable the videos inside the app. They eat up data, are annoying, and way to easy to accidently click on them scrolling through the app. Just make it easy for me to get into the app and give you money. How hard is that?",1,62,24.16.0.100,2022-09-02 20:26:05,24.16.0.100
47c52ea3-1c20-4ca8-9b1d-41f50f7897da,Paul Allen,"Post update use is ok, just slow. Relevant push updates are either sporadic or none existent. I HATE the way the App clears/resets previous searches/activity & defaults back to the home screen if I go off app & come back; I then have to start again! The current app is definitely less responsive & slower than the pre-face change update! Note: I have re-edit my original review I wrote immediately after the app facelift because a few elements have been resolved & improved. The review above stands.",3,142,24.18.0.100,2022-09-28 19:00:52,24.18.0.100
3671ddd0-1250-4436-b34f-62528989ea74,Tim Morris,"A lot of times the app gets confused and sends you to a page that says oops something went wrong and then you have to go back to the homepage to start over again, happens a lot! Also recently purchased a bike bag that was to come with a lock. Order arrived no lock in package customer service could only give me a credit for the lock but was only good towards Amazon's own products, therefore I can never use that credit unless I buy an Amazon product excluding all other sellers, BOGUS!!!",2,11,24.17.0.100,2022-09-27 15:33:11,24.17.0.100
ca090b4c-986c-48c8-925f-5cca43d39a3d,Simeon Valenti,One of the worse optimized apps from a major company such as Amazon. Extremely laggy and slow to respond to input. That combined with the practically zero quality control of the stuff people sell on Amazon makes me extremely close to stop being their customer. Update: No matter what I do I can't switch the app to English. It keeps reverting back to Spanish. I'd give it zero stars if I could.,1,24,24.15.2.100,2022-09-01 23:19:09,24.15.2.100
c3134cee-0bdc-4ce1-a9f3-703ffd7f259f,Barton Ramsey,"Amazons search engine is the worst ive ever used and always has been. It's beyond frustrating to have to scroll through pages of irrelevant items to find what your looking for. If I type ""mens medium Blue t-shirt"" into the search field that's the only items that I should see. I shouldn't have to scroll through 15 pages of items that aren't what I'm searching for. It's a waste of time. If the search engine was like eBay, I would do all my shopping on Amazon.",1,2,,2022-09-12 04:19:26,
aa2cd89a-0129-4c3f-93f3-887fec98195b,Jennifer Morrison,The amazin app is great and I appreciate that I can use the service on my phone so well. The thing that annoys me are wish lists. You aren't able to select multiple items if you want to move more than one thing to another list. So you have to go through item by item to move them BUT it shoots you back up to the very top of the wish list. Scrolling back down to where you left off (and the placeholder not being automatically removed after you've moved an item) is pretty annoying after a while.,3,267,24.16.0.100,2022-09-03 16:58:08,24.16.0.100
bc20317a-de24-48a9-bd94-0dc3b791f931,M. Happy,"I recently did the new update and now I can't check my orders 90% of the time. I am an avid Amazon user, I check on my orders on a daily basis. If I can't see when my packages are due, there is no use for this app. I press on the order button and the page just keeps reloading. PLEASE FIX THIS NOW. I have uninstalled, reinstalled, cleared my cache, and have powered down and powered on my phone multiple times. Nothing is working. I have a Samsung Ultra 22. Please get on it. Thanks.",1,38,24.16.0.100,2022-09-05 13:27:59,24.16.0.100
77f9a7d4-e715-474f-9425-e36b4bf8600d,Amanda Jones,"The app used to run fine...over the last month or so it simply will not load. I have waited and waited and get nothing. I close the app and restart it to try again and still...nothing. The only thing it loads is the home page and if you shop from there it works 80% of the time. If I search something it will eventually pull up a list as well. But if I try to go to my menu where I can go to my account, prime, outlet, etc...It will not load. I am so frustrated with it! Fix it! Fix it, please!!",2,76,24.17.0.100,2022-09-28 19:05:03,24.17.0.100
545895dd-0cee-4574-906d-860835519c38,Roel Taga,"Had the worst and most terrible experience, item arrived late, even after talking to support team multiple times and telling me I would get the item in time. I even explained to them that if the item does not come in time please do not send it at all because Iwas going to leave the country. But the item did not arrive and I left the country, although I still was not able to cancel the order. It took me multiple times to contact them again to get a refund and it was so so stressful.",1,0,,2022-09-08 19:57:25,
