reviewId,userName,content,score,thumbsUpCount,reviewCreatedVersion,at,appVersion
88e19160-d0e1-4eb6-b443-51fcc4e9df12,Daniel Adams,"There is one product I tried to find over a few days, and that product is an Amazonbasics Universal Travel Case for Small Electronics and Accesories. I would like to order that for my sd/microsd card readers, usb A to usb C flash drives, and usb c male and usb a female, but it's currently unavailable. The other tech organizers Amazon display are too large to fit in my backpack, and I need a small case for my adapters. So Amazon, If you see this, please inform me about that case.",3,0,,2025-09-30 10:24:57,
11fbb2cc-4873-43db-8107-1120b23be764,Niru,I've tried to cancel my account but Amazon is not sending my link to confirm.,1,0,30.18.2.100,2025-09-30 10:20:37,30.18.2.100
177ccebc-4038-4443-960c-101a37d58a8e,Mailee Yad,I love the Amazon,5,0,30.18.2.100,2025-09-30 10:14:13,30.18.2.100
42cfed8d-e135-4bc3-ab80-8f9aa5ec230b,Tony Hill,👍,5,0,30.18.2.100,2025-09-30 09:53:02,30.18.2.100
b5a36320-6240-4de8-9f0b-06b06a79464f,xXWARHEADXx X,"App is fine. problem is all the late deliveries and missing packages and not getting the stuff when it says it's going to arrive. I've had packages out for delivery, 10 stops away, never shows up. Not exactly sure why I'm paying for prime...",1,0,30.18.2.100,2025-09-30 09:47:25,30.18.2.100
34b68bff-5485-4c28-b1e3-7afd4a8b2707,Arkadyuti Bhattacharjee,"There should be an option to request shipping in a single package and to cancel the entire order if any item is unavailable. Often, items purchased together (such as a phone and its case) are shipped separately, and sometimes the main item—like the phone—is cancelled while the accessory is still delivered. This does not make sense.",3,0,30.18.2.100,2025-09-30 09:29:50,30.18.2.100
cf51a9e4-8cca-43ce-bda0-e388962bba71,Abdulla Arif,worst experience they cancel order without any reason. I paid with cc and then order cancelled.,1,0,30.18.2.100,2025-09-30 08:55:13,30.18.2.100
be357178-eb35-4511-ad08-7059dac6fe4a,Joana Mad,"I love shopping on Amazon. It's fast and easy. Fast delivery as well. Thank you, Amazon teams, for making our shopping so easy.",4,0,30.18.2.100,2025-09-30 08:31:09,30.18.2.100
ecc72aaf-fd4c-4ce1-bc5f-991157719b48,E BVD,"Charging for returns is so lame, beware. so many adds, missing items in like new warehouse items. Return things is almost impossible these days. Ending smile charity support is pretty lame. Prime day was pretty disappointing. Amazon is Full of 3rd party scam products and stuff not legal to sell in the USA. Their chatbot is the worst, let me talk to a real person. No price protection on any purchases.",1,4,30.18.2.100,2025-09-30 08:29:49,30.18.2.100
4f8fca4a-0b20-4d37-b33a-9964ccc22e23,Keith Perry,great way to shop when you are disabled and find it hard to get out,5,0,30.18.2.100,2025-09-30 07:57:59,30.18.2.100
1035a902-8f3d-4bf3-9245-e1fccfe2410f,William Joyce,"useless, tried logging on with the app and it continued to ask me to log in securely won't be using the app anytime soon, absolutely disgraceful",1,0,,2025-09-30 07:55:52,
313044fb-bfab-4138-8530-a9608372f02b,Shubham Ukani,really bad experience i ever had i tried to buy a new samsung s25 ultra and also bought this one but when my mobile arriving day i saw that history empty after that I again ordered and had again everything the same . I want to give this mobile to my sister on her birthday now ?? also didn't response from customer service really bad experience 😞,1,0,30.18.2.100,2025-09-30 07:44:06,30.18.2.100
ecc3db26-e559-4665-9fde-a325414922bc,Bra Nun,easy ways to spend thrifty.,5,0,,2025-09-30 06:52:38,
9d9dbb01-08eb-4de7-bcea-d8c57098c6f4,Joe Benton,I don't understand this.,5,0,30.18.2.100,2025-09-30 06:49:19,30.18.2.100
469a9aef-5165-4843-aa40-25ee048353df,SOMEONE,new update the filter dissappears,1,0,30.18.2.100,2025-09-30 06:45:08,30.18.2.100
d068c1a6-9341-4940-a878-626a5ce845bf,Sam Moses,"Payment revision needed nearly everyrime I use gift card balance. I get about 20% of the items I ever order. the other 80% my gift card gets charged ""payment revision needed"" and the item doesn't ship. More than enough to cover the purchase. Starting to feel like an intentional hurdle to not use the gift card balance.",1,0,30.18.2.100,2025-09-30 06:28:13,30.18.2.100
038e0e79-f26c-490e-93cf-f0fc55f869c0,Dominic Chibber,I've learnt to enjoy online shopping 🛍 and Amazon is easy-to-use for a guy who has no bank and credit cards...use of gift cards is convenient and makes shopping on Amazon Great. Thanks.,5,0,30.18.2.100,2025-09-30 06:22:59,30.18.2.100
465eef6e-f60c-4b1b-899b-4500c6cf3453,Jessica Bundy,the app has issues and places where it could be improved yet there is no where to leave suggestions or comments.,1,0,30.18.2.100,2025-09-30 06:04:27,30.18.2.100
6778c9be-e598-49b3-919d-77e0230d200d,Zainab Abdullahi,"it's a good thing to get an Amazon gift card, looking forward to utilizing it easily",3,0,,2025-09-30 05:27:46,
14212c8d-40d4-4823-96f8-808f173d5079,Kristi Hampton,love it,5,0,30.18.2.100,2025-09-30 04:41:22,30.18.2.100
68d169ed-a693-4eca-abf1-bbd7afad295e,Jean-francois Lemire,super,5,0,30.18.2.100,2025-09-30 04:27:56,30.18.2.100
a926491f-6b7e-4fb0-a4e0-0a89858524d6,AJ NEWMAIN,"any plans to add DARK MODE in the next 5 years ?! guys it's LITERALLY only your app on the whole android system who has NO DARK MODE until now. other apps made it 11 years ago ! can you please consider adding that basic feature?!, cuz most people like to shop for new items before getting sleep, so that ULTRA BRIGHT them, will definitely prevent them from both, sleeping and shopping. Thanks in advance!",3,0,,2025-09-30 03:22:13,
be913276-3d89-436d-9e73-3c948465d743,Willam Lewis,every good,5,0,30.17.0.100,2025-09-30 03:05:19,30.17.0.100
c2f5ed11-b7b4-4552-a7ae-ba43f5e5f08f,william foster jr,when they are out of items it's hard to find those items unless you check everyday they tell you it's going to arrive on Monday can you make arrangements to be near your delivery location however a lot of times they are late by a day or so,3,0,30.18.2.100,2025-09-30 02:48:24,30.18.2.100
63362aae-8585-4768-bd73-3baae4efa412,Cathey Lunsford,it's Ben good so far,5,0,30.17.0.100,2025-09-30 02:36:49,30.17.0.100
4fdc9d0a-fb8f-4b85-aac7-bd28a48a61ae,Mack Manzel,"Amazon delivery is a total JOKE. I don't order much from them because most of their products are GARBAGE. The last several times I've expected a delivery, it has taken until late at night, and they'll say ""2 stops away"" for an HOUR , then ""lost signal"" The drivers NEVER follow my simple instructions either.",1,0,30.18.2.100,2025-09-30 02:30:42,30.18.2.100
af4df229-e452-4f85-a38d-5d13d23aa63a,Ohiep Valen,"when searching for an item, it does no allow to press mext after a couple of pages... it doesn't allow to press next. Also, something very annoying, when searching for example a ""wedge pillow"" it shows every possible pillow shape and the wedge pillows... why would I seach for a wedge pillow but the app shows me another pillow that has another shape?. And one of the worst things are the quantity of ads... it is soooo annoying!",2,0,30.18.2.100,2025-09-30 02:24:27,30.18.2.100
a243ecae-30fe-438f-9f62-926b955433d2,Debbie Beam,I'm a prime member and have saved so much money on shipping fees. Always find what I'm looking for at a decent price.,5,0,30.18.2.100,2025-09-30 02:04:01,30.18.2.100
1072f10e-0813-40f7-8e20-301ab7535f38,Elijah Goodridge,"The Amazon app is pretty solid. I like how easy it is to search for stuff and the checkout process is really smooth. One thing I wish was better is how it sometimes crashes or takes a while to load, especially when there’s a big sale. Other than that, it’s super convenient and I use it all the time.",4,1,30.18.2.100,2025-09-30 02:00:26,30.18.2.100
86e09982-bee4-4e69-9780-0f0aa5d0ddba,Spencer,Amazon pays for abortions now ($4000 per employee for travel). App is slow and has too many permissions. They try to trick you into Prime at check out. They also started defaulting to used products instead of new.,1,20,30.18.0.100,2025-09-30 00:46:47,30.18.0.100
203b4b40-5cb7-417a-86ac-da712396aab2,V W,Our family hopes to continue with our membership and subscription support .Money is tight; times are tough and tumble. Please keep providing the proper network for our dollars. Thank you!,5,0,,2025-09-30 00:46:14,
05f96ee7-9c61-45cf-bf1c-59f76ccf62e3,Harold Zucca,😀🎉💯🔊💪🏻❤️,5,0,30.18.2.100,2025-09-30 00:37:09,30.18.2.100
56930155-5b37-4d2c-aea2-0283c772f4de,Candace Chapple,"I wish that you would just display the actual prices on your ""deals"" pages, instead of the percent off. It is so annoying having to click on each item just to see the prices.",2,0,30.18.2.100,2025-09-30 00:27:22,30.18.2.100
704eccc7-4ec1-4d34-9c07-bf6d427ff4af,MARK on point,The screen is blinding can we get a dark mode for people with sensitive eyes or also that work 3rd shift in dark areas. And make settings for the app easy to find and use. I can not find a setting for this on my s24 ultra 1 terabyte,1,3,30.18.2.100,2025-09-30 00:22:24,30.18.2.100
402d6f18-e2f9-4c89-8836-962492c4fe8b,Sikiru Aremu,"Throughout my purchasing experiences with Amazon, I have consistently been satisfied with the products and services provided. Your team has performed admirably.",5,0,30.18.2.100,2025-09-30 00:15:05,30.18.2.100
729ffe6b-70e8-4165-80ae-37b26f1b9857,Ale Madrigal,"It has a fake delivery time, it said I could order it a certain date for free delivery, yet when that date comes up, they change it to a different time, least favorite place to order online. They charge so much for an item that they will bring wet, and they really want to get money off the delivery as if paying for the stuff isn't enough plus taxes.",1,0,30.18.2.100,2025-09-29 11:12:44,30.18.2.100
e125a6a2-3290-4737-9797-628b010ae33a,ASly Demon,"Your schedules are trash and useless, Temo is way better than you by far We are sorry the product has been delayed I’ve heard that more then hello",1,0,30.18.2.100,2025-09-29 10:57:41,30.18.2.100
4ea62324-46e9-4d1f-9712-ebe7813a0ca6,Ouma Shabangu,The best online shop there is👏,5,0,30.5.0.100,2025-09-29 10:56:19,30.5.0.100
a009c15c-886a-4f49-9981-1c1af19cc278,Eduardo Diazdiaz,No liked sory im can get the i want in other store im happy Sory for you,1,0,,2025-09-29 10:34:40,
db8d6893-8bc2-4e0f-99be-8f5209126576,Uttam,"Good shopping app with glitches in login. OTP doesn't come sometimes especially in quick succession, which is required to edit security related stuff. Customer care says it is service provider, service provider says it is Amazon. Ultimately a bad experience for me.",3,0,30.18.2.100,2025-09-29 10:14:29,30.18.2.100
d04070b1-9523-42f3-a1cf-7e4d7de6cd7e,Collen Maswanganye,It's fast and reliable,5,0,30.16.0.100,2025-09-29 09:59:04,30.16.0.100
26c735c7-cde9-4506-bcd7-d15530676eae,Cynthia Holmes,I have problems with standing very long. having items I need delivered makes life easier.,5,0,30.18.2.100,2025-09-29 08:58:45,30.18.2.100
9f0c59ae-2a7b-4bd6-b82b-99936559baf2,Paula Lewis,love it can always find what your looking for A ***,5,0,30.18.2.100,2025-09-29 08:50:00,30.18.2.100
a8d949c6-3a9b-4747-a504-426668d59fd1,Colin Norris,"Scamazon, completely trash place to shop, neither cheap nor reliable",1,2,30.18.2.100,2025-09-29 08:36:19,30.18.2.100
7e7e6be5-d79a-43e9-be10-9d66905a3531,Fermín,Acabo de darme cuenta que están metiendo publicidad (patrocinados) en la app. Por lo visto no ganan los suficientes millones que tienen que ensuciar la experiencia de usuario poniendo anuncios mientras buscas incluso en tus propios pedidos. 1 estrella hasta que esto cambie,1,0,30.18.2.100,2025-09-29 08:30:52,30.18.2.100
5fdb79c2-d450-48f3-a8ab-1b307b4889b0,Anthony Woolford,Amozon member 4 years now cause definitely a good choice for door to door serverice Had a few ups and downs but that's lifestyle of 2day yesterday or tomorrow The day ends in Y. Slip trips and falls Regards Anthony,4,0,26.16.0.100,2025-09-29 08:18:41,26.16.0.100
4aff8f96-c537-4ddc-b365-b1c243f48058,Kelly Lester,another garbage route. Amazon doesn't care. I deliver in Washington and had a hole tote for Arizona. how does that happen,1,0,24.21.0.100,2025-09-29 07:39:58,24.21.0.100
409f0496-83a1-4f46-a379-f87ffe2786e5,Heleus Brands,"This app is a perfect example of what not to do when building an app. The simplest functions don't work, and the design is beyond unintuitive. It would be actually quite hysterical if it weren't so damn infuriating. The fact that Amazon is willing to even stamp their name to it, says a lot about the company.",1,0,30.18.2.100,2025-09-29 07:11:49,30.18.2.100
8c1b67ce-c1ba-473a-beac-b3d43a73a0c4,claire perry,fast and reliable,5,0,30.18.2.100,2025-09-29 06:23:10,30.18.2.100
d933eec9-a428-4321-a2e0-382166d206b1,juan cruz,great app,5,0,30.18.0.100,2025-09-29 05:52:29,30.18.0.100
092df8e4-f0f9-4ff9-b6cb-d10cad74f4e0,Kevin Collazos,Tiene algunos problemas de rendimiento,4,0,30.14.0.100,2025-09-29 05:11:40,30.14.0.100
ff934724-700a-4eac-8499-7f4b308a0fe2,Jack Evans,randomly introduced one time passwords on delivery with no way to opt out making it impossible for anyone who lives alone and works to use amazon,1,0,30.18.2.100,2025-09-29 05:07:35,30.18.2.100
9e47036f-22d7-49bc-b5bc-db998dd42a22,Bonnie Kraynick,easy to use app,5,0,30.18.2.100,2025-09-29 04:50:33,30.18.2.100
8ffb1d4f-4d3b-49ae-bba6-28c26acc418a,D S,never do an update. now it lags. doesnt load,1,1,30.18.2.100,2025-09-29 04:03:38,30.18.2.100
6b47e53e-f553-40e2-a4a6-8c025162b9db,Noé Miranda,they charge you for shipping if you not no prime member,2,0,30.18.2.100,2025-09-29 03:20:18,30.18.2.100
328da3d6-aa8a-4c6b-9b98-b88accade5d2,Reshma A,Best ever. I love Amazon shopping. Even I can shop for India from Germany. I am very happy with Amazon. Since 15 years I am amazon customer. I never left online shopping from this platform. Vielen Dank,5,0,30.17.0.100,2025-09-29 03:17:32,30.17.0.100
563960b0-3e74-41a5-b06a-ea54ace5b639,McMann Michael & Tawnya,Amazon is awesome,5,0,30.17.0.100,2025-09-29 03:06:25,30.17.0.100
7a25611e-c2d8-4bd7-96e3-5201e90a528a,Wendy Bradley,hate the app.,1,1,,2025-09-29 03:02:01,
68f54e48-9aa6-4881-87c7-0f8b3bb82469,abhilash angaloor,cool and awesome as always,5,0,30.18.2.100,2025-09-29 02:51:21,30.18.2.100
a910a50b-ef5b-452b-94e8-f997ff6d5f38,Ernest “JR”,I like shooping amazon they have reasonable prices and super fast shipping,5,0,,2025-09-29 02:41:55,
28ae0d2c-656c-4d34-89fd-eef50a216530,Meleny Garcia,doesn't let me cancel my subscription,1,0,,2025-09-29 01:57:26,
34dae548-d1d5-4146-81cc-b48cd9b0795c,Theda Holland,GOOD,5,0,30.18.2.100,2025-09-29 01:48:42,30.18.2.100
18da75d3-2ea2-49f5-9543-ad8fdd50d852,Benjamin Ezequiel Contreras Figueroa,"Ni siquiera te avisa de que lo van a entregar otro día, me echaron la culpa. Neta que coraje la verdad. Pésimo servido. no son buenos para decir que no pudieron por una cosa u otra, lo hubiera entendido para nadie te dice nada ni un mensaje y solo me culparon. neta que coraje",1,0,30.18.2.100,2025-09-29 01:35:37,30.18.2.100
ae40f678-d925-4de6-ac75-e786d4a06242,Pat Colon,find a better way to sign in 😠,1,0,30.18.2.100,2025-09-29 01:34:25,30.18.2.100
e68d858e-641b-4479-9a6c-23063ac8d84a,S cerinany,join prime link isn't working for Android,1,0,30.18.2.100,2025-09-29 01:21:18,30.18.2.100
67510dcb-b7ef-4bbf-8e44-0801c60a5e56,Sajjat Hossain Sakil,"I had a very bad experience. They assured me a refund, but I never received it. No proper communication and very poor customer service.",1,0,30.18.2.100,2025-09-29 01:10:22,30.18.2.100
9c9d4854-2447-4ace-919e-e7a5331813cb,Saif Jutt,very bad service 😒 because I am Places the order and amazon cancel my order only 10 sec,1,0,30.18.2.100,2025-09-29 00:48:28,30.18.2.100
1ac671b3-2e70-444e-9b6f-473a771c9abd,zachary morris,the app is easy to use and helps you find stuff you need and want.,5,0,30.17.0.100,2025-09-29 00:37:31,30.17.0.100
f5e4fbae-a8db-4df7-b6f2-f4693781ed24,jesus adame,Amazon shipping,5,0,30.17.0.100,2025-09-29 00:27:48,30.17.0.100
e919d501-3825-4c61-8c82-c7818d5b9a7c,Iris Rivera,WOW,5,0,30.18.2.100,2025-09-29 00:07:14,30.18.2.100
8b8b8946-aca4-4803-8732-ac10dba932ef,Natasha Hill,very affordable and reliable thank you,5,0,30.17.0.100,2025-09-28 11:35:24,30.17.0.100
648a0b11-37d3-4891-9518-404f0ba52b1c,Wayne Wright,This will be my first attempt at catalogue shopping. I prefer in store shopping . That way I KNOW WHAT I am GETTING. No surprises.,3,0,30.18.2.100,2025-09-28 10:17:30,30.18.2.100
2911db97-c5cb-4b94-9945-8cec72ed52af,Carl Dicki,temu,2,0,30.16.0.100,2025-09-28 10:15:37,30.16.0.100
53640849-0c02-41f8-939a-ed355e531d5a,Electric Blue (66.),inaccurate. Hi.,5,0,30.15.0.100,2025-09-28 10:13:32,30.15.0.100
5414ff2f-8fd2-4002-9b20-813741207a89,Theresa A. Michaels,fast delivery,5,0,30.17.0.100,2025-09-28 10:05:31,30.17.0.100
8eee1aff-9850-45da-9dd4-991b0bc2d01f,محمد الحناوي,🤝,5,0,30.17.0.100,2025-09-28 09:40:48,30.17.0.100
5b3a7796-adbf-419d-b815-d035386f8acc,Yasir Khan,I love amazon one of the world 🌎,5,0,30.18.2.100,2025-09-28 09:19:43,30.18.2.100
e19c3ade-8fd8-4816-8a9c-b8484884f53f,Amaka Iheanacho,"Icl it's jst easy to shop with and not suspicious like shein or temu u can track orders + it's simple and not confusing to use like bsfr temu is not gonna deliver ur ""free iPhone pro max."" So yhh jst use amazon and + it doesn't store ur card details for examp my mum and dad was abroad and ordered baby clothes off temu for my mums close friend as they they went to visit her after she had a baby long story short when my mum came back £500+was spent frm her card without knowledge bcs of sus temu",5,0,30.18.0.100,2025-09-28 09:19:30,30.18.0.100
5d91f540-c1b8-43a0-8a2e-aba3e50c1a34,Lorraine Koehler,"I shop on that for everything. From food to prtfume To clothes,",5,0,30.17.0.100,2025-09-28 07:59:29,30.17.0.100
334be036-ea4b-400a-bb5c-2a4e7c3fadbc,Pedro Paramo,excelent,5,0,30.17.0.100,2025-09-28 07:20:50,30.17.0.100
e10f2408-af62-40f7-8513-26238296ec86,Andrius Lengvinas,Amazing app,5,0,30.9.0.100,2025-09-28 07:00:47,30.9.0.100
4e18a8b4-163b-4dbc-8132-3508941528e2,Tre H,love it,5,0,30.18.0.100,2025-09-28 06:51:20,30.18.0.100
b196a188-032d-48aa-a346-4450273f58cf,Be Will Be,I pray you have an issue with your account. If you do. I hope they do more for you than me because these people are useless. Lol. Now I can't even get a refund for a stolen package!!! I'll never buy from Amazon again.,1,0,30.17.0.100,2025-09-28 06:24:08,30.17.0.100
b1ca45cc-1220-4f8b-80be-5dbe9f4c49e7,Phung Nguyen,Amazon is amazing never fail me and customer support is very good too.,5,0,30.18.0.100,2025-09-28 05:51:33,30.18.0.100
f39fc9b9-4696-4658-ba87-3858a31e4a50,julia christian,enjoying shopping when I want,5,0,30.16.0.100,2025-09-28 05:30:35,30.16.0.100
405da411-bdb4-4928-a4e5-f7ce3d2413f5,Tink,"I can't even sign into my account that has a 50 dollar gift card on it because of ""suspicious activity"" and want me to verify with a picture of a card I don't have anymore :/",1,0,30.18.2.100,2025-09-28 05:01:51,30.18.2.100
72411f27-9710-4805-899c-ccfdba03c957,David Taunton,"I never thought I would be buying off Amazon-Prime. I always thought it would be overpriced. Amazingly it is only slightly so, and the delivery speed makes up for that. I can compare different products and have found 3 products that have ceased being sold, or had unacceptable pricing. Thank you for being competitive. Davidt",5,0,30.18.0.100,2025-09-28 04:52:11,30.18.0.100
17596e19-273e-4f0a-a45c-dccecfa406a6,Wayne Elms,don't need this app,1,0,26.19.4.100,2025-09-28 04:21:41,26.19.4.100
7954cd1a-f7c6-48fe-a20e-17bdc4f1e972,Galen Johnson (BigdaddyG),"Lots of good things to look at and buy, works well for me! Updates were nice also thanks so mooch.",5,86,30.18.0.100,2025-09-28 03:57:45,30.18.0.100
cbd4a57b-d666-40c4-86f8-95cd3aa3be39,Tata Gaming,so cool app please trying,5,0,30.17.0.100,2025-09-28 03:57:43,30.17.0.100
8646a2d6-c5d2-4501-a302-d9c755690496,Ivory Lane,You all know how i feel i said it on my video on my channel,5,0,28.18.4.100,2025-09-28 03:52:57,28.18.4.100
1519af7e-703a-4dfe-80f2-4e9b7ed8d819,Dijon,inflated prices on most things and such a terrible app experience that i'd rather just use Walmart.,1,0,30.17.0.100,2025-09-28 03:39:19,30.17.0.100
634ab87a-b77f-40c4-90bf-2934f703b315,Beverley Reed,really good,4,0,30.17.0.100,2025-09-28 03:37:39,30.17.0.100
01f0e8e2-3eac-4ed2-b93c-7118178d9d63,H-bomb Copas,it finds what i want and there is almost anything,5,0,30.18.0.100,2025-09-28 03:24:35,30.18.0.100
5c8ecf2a-d581-4cb8-8956-2367512265e3,Mayank Verma,"Son un verdadero grupo de incompetentes, tanto en el servicio al cliente como en las entregas. Retrasan los envíos y, con total descaro, afirman que fue el cliente quien solicitó la reprogramación. Basan su operación en mentiras y culpan a otros para encubrir sus errores. Cuando uno contacta al servicio al cliente, nadie se disculpa. No tienen cortesía ni empatía para tratar a los clientes. Si algo sale mal después de hacer un pedido, quedas a merced de gente incompetente, ignorante y arrogante",1,0,30.18.0.100,2025-09-28 03:09:35,30.18.0.100
95c68cd9-81af-4a8a-9b22-29a99fbd8d1b,Arnie Adams,"App always seems to randomly display wish list filter options. For instance, click on Lists and it will sometimes display categories Deals, Price Dropped, and Low Availability. Next time it only gives Deals or maybe it just gives Low Availability or nothing at all. Really stupid bug to have and it has existed for 5+ years in iOS and Android apps. I mainly shop from the Price Dropped list but doesn't display majority of time so I buy less now. Will it ever get fixed?!",2,0,30.17.0.100,2025-09-28 03:00:30,30.17.0.100
91b7e0f0-6ade-4306-9e0e-129aa1f7a4ac,Juan Diaz Ramos,Really hard to get support when having problems. the AI options do not help at all and they make it really hard to contact you with a live agent.,1,1,30.17.0.100,2025-09-28 02:47:55,30.17.0.100
162906bd-c27f-46e0-b675-b3856f6a18fc,Sandra Harrison,"They trick you into ordering. $25.00 worth of items. When I do, then I find out that is not the case. It happened a few times. This time I told them to cancel the one that's not going to arrive the following day. That is deception, and it's annoying.",3,1,22.14.0.100,2025-09-28 02:38:50,22.14.0.100
f290aece-05d8-4451-8b40-d2b6fb82b37c,Tanya Mcgregor,great job,5,0,30.16.0.100,2025-09-28 02:12:49,30.16.0.100
f138545f-250b-4a72-b3ec-993a7c0286df,IrishPride 29,Very pleased with service,5,0,30.18.0.100,2025-09-28 01:55:38,30.18.0.100
c01a082a-c9bd-468c-811d-9379c7d5f50b,Joshua Stephenson,"Amazon is an awful company run by an insane billionaire hell-bent on making the world a worse place for everyone but him. app sucks too, don't give this company your money. shop local, buy direct from the manufacturer, it's much easier than it seems.",1,0,28.18.0.100,2025-09-28 01:41:06,28.18.0.100
71fddb2b-1e2e-46b6-8e72-b1433f0f92c4,Gina Mathews,So convenient. I love it,5,0,30.17.0.100,2025-09-28 01:08:21,30.17.0.100
db6105d8-6830-4f4e-b440-7110d1e6f94a,James Joseph,too many ads. very confusing to deal with annoying sponsored products. Extremely shameful greed displayed.,1,0,,2025-09-28 01:01:02,
89313e06-ed91-44ec-b51d-2dc25413df13,Kevin Fowler,"They messed up several orders. made me go through AI ""help"" for hours and hours finally when I get to a human they say they'll make it good no problem, but then they never do. It just isn't worth the headache and everything I've saved is cancelled out by the money I've spent on products that didn't arrive. 0/10 would not get scammed again. Only reason I'm giving them 1 star is that's the minimum I can give them.",1,1,30.18.0.100,2025-09-28 00:49:30,30.18.0.100
bc495359-735a-4c1f-b729-8a2c18db4cbc,Thomas Lara,scumbags,1,0,30.18.0.100,2025-09-28 00:12:12,30.18.0.100
56481a60-9688-4377-abdd-79ebaf688ccb,james frantz,I love Amazon Shopping,5,0,30.18.0.100,2025-09-28 00:03:32,30.18.0.100
95d6e845-6f01-4ca2-98f2-039199bcc74c,Mashanya Kedibone,My phone can't install the app because it's on my old phone which is broken. How should I install on the old phone,1,0,30.16.0.100,2025-09-27 12:09:00,30.16.0.100
d5830061-127f-4e92-b3c7-548b2efa06c5,Prince Akinrolabu,I love Amazon,5,0,,2025-09-27 11:28:17,
15bdd87d-0b8f-4cae-ba1a-a9967482507d,A Fourther,the only app on my device that doesnt have dark theme and has a UI like windows xp.,1,0,30.18.0.100,2025-09-27 11:27:17,30.18.0.100
aa95d708-db3a-4bee-9ebc-e61ca214bd0d,Daniel,The recent update has made loading time for images painfully slow. Shopping on this app has become much more of a drag. I think the blame lies with the sideshow of images that is now in the search result list.,1,0,30.17.0.100,2025-09-27 11:21:33,30.17.0.100
9235d969-52af-42ea-bba0-e15337f1a9d4,Robin Sims,only place to get what you need....,5,0,30.18.0.100,2025-09-27 10:33:21,30.18.0.100
9459bd93-e606-49cb-b5b7-4a35b1967af6,Alexx Gogh,"Установил это приложение теперь оно меня спамит рекламой постоянно, отвратительно",1,0,30.18.0.100,2025-09-27 10:28:57,30.18.0.100
10b99e0c-6e37-441f-bbd5-c4bb852eca53,Kay Martin,why am I being charged $14 99 for this app question my membership worth Amazon prime is for us free for the next 6 months bc I'm a student,5,0,30.18.0.100,2025-09-27 10:14:57,30.18.0.100
a8d40732-9da7-47aa-94bd-159c2b193dda,kris reed,"love shopping with Amazon. prices are great, and returns are easy. I have also always received my items quickly.",5,0,30.17.0.100,2025-09-27 09:05:48,30.17.0.100
079d2ebb-ec56-4ec9-9ed1-427475fcdce7,B777 Avionics,thank you for everything ❤️,5,0,30.18.0.100,2025-09-27 08:34:07,30.18.0.100
