reviewId,userName,content,score,thumbsUpCount,reviewCreatedVersion,at,appVersion
183bdf7b-27e8-4587-ad8d-04a1bc5a68a0,John B,app works okay but whenever there is a technical issue it is guaranteed to take forever to solve because the foreigners dont speak proper English and mess everything up even though they think they understand. asked them to cancel my AMC and make sure that I will be able to continue again later since I didn't use it at all. they said no problem. well now I can't begin my trial again and also another unrelated subscription was cancelled. customer service sucks very very bad,1,0,30.12.4.100,2025-08-18 02:52:07,30.12.4.100
ee703829-7b85-4570-896c-2a8a1b5d6954,Neariyah B.Y. Izraayl,very good,5,0,30.15.0.100,2025-08-18 02:33:52,30.15.0.100
d21bebd5-662b-4fd5-8ada-c563edaf6ea1,Drew Ortega,"every item says ""unavailable"" and out of stock. The website works fine though. I had the app up to date, my phone up to date.",1,0,30.15.0.100,2025-08-18 02:25:01,30.15.0.100
8fc6211f-036e-48c1-ad27-4abbcc2e0afe,Sharon Sejang,good product,5,0,30.14.0.100,2025-08-18 02:02:04,30.14.0.100
5b3d06fd-c5ba-4f9d-96f5-3999da59a22a,Jon Mes,"it's easy to use, and gets the job done.",5,0,30.15.0.100,2025-08-18 02:01:19,30.15.0.100
8ceecd0c-7b46-44dc-8e3c-6f6b9d89701b,Jorge Alberto Ramirez Aviles,I've been a customer for years. Lately this company have problems with the people they hire for delivery. I waited for my last purchase for two days and had to ask for a refund. A disgrace service. Keep doing that and another business closed,1,0,30.15.0.100,2025-08-18 01:56:42,30.15.0.100
60eff112-941e-46f6-bbf5-2cfc16b17afb,George Maura,"very easy to search, explore and pay",5,0,30.15.0.100,2025-08-18 01:54:36,30.15.0.100
dffb7375-f933-41a1-82f4-db7695c8c3f4,Levi Parrish,is the best app you can use for groceries shoes sometimes shoes I love that they have footballs cuz my son's athlete,5,0,,2025-08-18 01:46:27,
21b846ef-79dc-450d-894c-51400afaabcc,Michael Hopkins,"The shopping experience has gone down hill. It seems like I always end up with a used item, or wrong item.",2,0,30.15.0.100,2025-08-18 01:41:26,30.15.0.100
452b317d-9684-431d-b60c-23819bdaad49,Alex Pease,ease of use,5,0,30.15.0.100,2025-08-18 01:32:38,30.15.0.100
aaff05c7-5752-495e-8463-4fae3e22f2ff,Ahmet Selim GÜRBÜZ,No dark mode.,1,0,30.15.0.100,2025-08-18 00:59:44,30.15.0.100
0ace812c-697e-4420-82ab-c7064fa33ee4,Carlisle Wykes,Nothing ever shows up on time.,1,1,30.15.0.100,2025-08-18 00:58:54,30.15.0.100
75781b02-cd9c-42ad-9453-66de882c760c,Erica Winter,it kept declining my card four separate identification,5,0,30.15.0.100,2025-08-18 00:31:25,30.15.0.100
94e5a399-d656-49ac-839c-e37378885a83,ARMAN PETROSYAN,Want to canceled p l ea se,1,0,30.15.0.100,2025-08-18 00:21:13,30.15.0.100
93f7ab91-b80f-4293-8d3b-ca2a97439897,Sue Wigglesworth,online ordering from Amazon is the only way to go. You can find everything & anything you need plus Items come quickly.,5,0,30.15.0.100,2025-08-17 11:43:36,30.15.0.100
af06b203-ffb7-483c-bd4c-27a0d82f5d01,S Walker,Is it a joke that this app is going away? I can't imagine how that would help Amazon make money.,5,0,,2025-08-17 10:59:20,
724e7e1c-cf27-454a-a1dc-859eadd6b6af,LC Golden,Remove the stupid quick view. Makes using this app so frustrating.,1,0,30.15.0.100,2025-08-17 10:09:43,30.15.0.100
c1cbf2e9-d200-4818-b89f-63da4786cc07,John Parkinson,Amazon Shopping is the best way to shop online!,5,0,,2025-08-17 09:55:11,
9fc5283a-7e63-4163-a8bc-3bf73017f35a,James D (Jamie),It isn't worth ot anymore. Same day delivery isn't true anymore. prices arent the best. Online store wise Amazon has just become the worst of all online stores. used to be the best at what they started but to many stores are online cheaper and better now.,1,1,30.15.0.100,2025-08-17 07:44:59,30.15.0.100
421a9b57-5a96-4c01-af3e-f51504231f90,youssef ismaili,Best app and BEST costumer service,5,0,30.14.0.100,2025-08-17 06:37:10,30.14.0.100
05de21c9-c364-40c6-a752-1b35c489345c,Michelle Ward,Awesome products and fast delivery,5,0,30.15.0.100,2025-08-17 06:15:00,30.15.0.100
196a9832-ca09-4fc3-a6f6-d74f508e5306,Alice Hlungwani,I absolutely hate it,1,0,,2025-08-17 06:11:18,
18336399-2954-4305-a9d4-e3f8c9e412ae,G. Breemhaar,moi!!,5,0,30.15.0.100,2025-08-17 06:00:10,30.15.0.100
65e6ba72-d137-4847-bf93-fc41b51bd2c8,Dylan Fowler,"it's great to see your deliveries, but you can't browse the web and view products in different countries without overriding app settings. Stay away, makes your life a PITA, just use the web to see your deliveries. Battery draw you don't need.",1,0,20.20.0.100,2025-08-17 05:44:48,20.20.0.100
b3b446a0-ab10-4bec-b846-e8c19afd9f32,Farrol Hunter,terrible garbage security system,1,0,30.15.0.100,2025-08-17 05:16:10,30.15.0.100
6c91c68a-61a3-494a-a453-5cd6c4d8bc7b,Sadiq hussain,best app to order every thing 🤩🤑,5,0,30.15.0.100,2025-08-17 05:13:37,30.15.0.100
0c893be0-b0fd-4fea-b669-2ae77224c780,life leaves,"it's a virus,",1,0,30.15.0.100,2025-08-17 04:51:55,30.15.0.100
314d32e0-25fb-4d94-aa70-87eb1149b96d,Bridget,spp brings me 😊,5,0,,2025-08-17 04:21:01,
5ff4e9ab-1348-4714-be1a-f80f727ab06b,Davion M,delivery is consistently unreliable,1,0,30.14.0.100,2025-08-17 04:08:36,30.14.0.100
28d94af4-d93b-4741-9425-65060bb05401,Ramina,it keeps deleting my lists and taking out the items I saved. Now I have to save things again.....and I was so sad because all those things I don't think I remember what I saved...😭😭😭,2,0,30.15.0.100,2025-08-17 03:58:41,30.15.0.100
4444815a-8e5f-47c4-84ef-5d1bccd2547c,Amy GRIMES,horrible!,1,0,30.15.0.100,2025-08-17 03:32:38,30.15.0.100
465942e0-19bf-418d-9fb4-00367b352809,Chloe,The app has been so slow at loading anything all week. So annoyed.,1,0,30.15.0.100,2025-08-17 03:29:17,30.15.0.100
3b68771c-a073-4425-b331-e2096956a573,Judi,"I accidentally ordered the wrong thing and when I canceled it, it never gave me my money back",1,0,30.15.0.100,2025-08-17 03:29:01,30.15.0.100
b5adddec-1351-436e-9d11-44f7e60f898f,Thomas Ramirez,why can't ya'll help me ? It says something wrong. I've been at customer for years all I did was change Email. Now it's giving me hell to sign in. I'm a Sr Citizen this is to complicated for me. Just put my account back on. Use old Email if U have to. Ya'll done got me all tired with all this texting & reading.,1,0,30.14.0.100,2025-08-17 02:59:54,30.14.0.100
80d428c0-3ed9-4b6f-986c-0fdabe63ae32,W W,Cannot sign into a Canadian account... useless,1,0,30.15.0.100,2025-08-17 02:43:54,30.15.0.100
de82cb3b-17a6-4e6d-95a4-82a40a74d161,Amit Singh,Great and humble customer care. They are the best. 👏👏👏👏,5,0,30.14.0.100,2025-08-17 02:35:43,30.14.0.100
3c72c2f1-5785-4445-b2a8-d55f32e7165e,Danny,"I'm changing my review. the app now shows page suggestions when I'm scrolling for products. Who in their absolute monkey mind thought this was a good idea? not only was this idea brought up to a dev team, but the team of buffoons actually thought that the fir st idiot had a great idea and implemented it. I guess I should thank whatever genius greenlit this horrendous ""feature"" cause I just close the app instead of buying what I wanted to buy.",1,4,30.15.0.100,2025-08-17 02:35:20,30.15.0.100
f8ac77ad-79cb-4585-b206-5d063703cf29,Eydie Wetmiller,"I love Amazon, but the new plan(August 31 2025) for delivering packages only to the front door really is sad. My front door is only ten feet from a busy highway in a village. I've had several packages from different delivery services stolen from my front door . Right now having packages delivered to my back deck has saved me a lot of grief. With the new plan , If I'm not home when my packages arrive there is a good chance they will be stolen.",4,0,30.15.0.100,2025-08-17 02:17:00,30.15.0.100
76a3f0d8-07b0-42af-b8c7-b8dd2c9ca3d4,_ItsSpy,This Is Very Good But prices is not combality in Pakistan PKR,5,0,,2025-08-17 01:41:00,
4394c130-6dd9-4c43-b5d2-f1c459435aff,Rhonda Mickelson,Amazon prime has opened my eyes to a whole New world I love it,5,0,30.14.0.100,2025-08-17 01:39:15,30.14.0.100
d3d9bd14-83ba-42bc-89a6-c16696e8074f,James Archie,Good! 93701,5,0,30.15.0.100,2025-08-17 01:07:57,30.15.0.100
ff4d754e-a1d8-4c0f-a1a2-038fca4e2656,MR. Meeks Sr.,prices are too high,5,0,30.15.0.100,2025-08-17 00:57:51,30.15.0.100
0e77ae57-2ce4-489f-9ab2-8caeaafc841d,Tabitha Fowler,didn't even let me make an account,1,0,30.14.0.100,2025-08-17 00:56:19,30.14.0.100
0ae9f9cc-820e-4e98-8951-b2be32c622d5,James Brown,best thing sliced bread,5,0,30.15.0.100,2025-08-17 00:54:44,30.15.0.100
c6628ed6-a593-4746-8605-f86599ab689a,Mattie Hubbard,it was great.fit real good.hope two get order soon.,5,0,30.14.0.100,2025-08-17 00:53:32,30.14.0.100
5443d1e8-e184-4342-944d-24f5b1b7f4d4,mark west,thank 😊,5,0,30.14.0.100,2025-08-17 00:46:14,30.14.0.100
38ea353a-b1ce-470f-9d4d-2634b2c5a5ae,Enrique Thurber,"Couldn't even make a account because it said ""suspicious"" activity was detected, everytime I went to make a account 😡🤦🏽‍♂️",1,0,28.14.2.100,2025-08-17 00:16:29,28.14.2.100
0b66b688-3c61-4d78-9c27-b140bd379b7d,bucky mayfield,"Prime service is a waste of time. Shipments don't arrive on time, and they make it extremely hard to cancel orders.",1,0,30.15.0.100,2025-08-17 00:07:49,30.15.0.100
782a2314-fb06-4698-a12d-84ed9e607ed8,Alvin Williams,love it,5,0,30.15.0.100,2025-08-16 11:57:42,30.15.0.100
36545600-6cc8-40fb-a8e4-d307f9d58a20,Joseph Frenzel,"App ran by greedy, unhelpful monsters and is a net negative on society",1,0,,2025-08-16 11:42:36,
5b9d78ac-2576-48df-a5b5-5d854fdea4cf,Stephano Kessler,Durch Drittzulieferer runtergewirtschaftet. Auf fristgerechte Lieferung kann kein Vertrauen mehr sein.,1,0,30.15.0.100,2025-08-16 11:38:35,30.15.0.100
1459bf4d-2ada-429f-9473-c1fd93005646,Michele Gardner,always a great quick service,5,0,30.15.0.100,2025-08-16 11:36:59,30.15.0.100
da43134c-2f16-4498-bc53-c71fb031ab1d,matel brady,fast delivery,5,0,,2025-08-16 11:18:54,
3e3a2cdc-81da-4abc-9e1e-2e7673e0b0db,Joe Valentin,love it,5,0,30.15.0.100,2025-08-16 11:17:31,30.15.0.100
2d111a64-bdb3-42f3-a272-1d7e8856906c,Nader Elmahdy,dont order from here,1,0,30.15.0.100,2025-08-16 11:02:01,30.15.0.100
15b7dbae-4514-4851-a9dd-8acfb30da7b6,Frank Mcdonnell,app is hopeless. got a prime subscription but app tells me to sign in to my amazon app within 3 days or I lose the subscription. have did this several times but keep getting same message and when I click on it it takes me to the amazon app page to install which I have already installed. message sent to Google play customer services but they don't reply back.,1,0,30.15.0.100,2025-08-16 10:51:22,30.15.0.100
e3af0cc7-edc5-43cb-bd89-49dc54e67124,Alison Burnett,"I love shopping with Amazon, I can find everything I want 95% of the time and their returns policy is really easy to do.",5,0,30.15.0.100,2025-08-16 10:39:41,30.15.0.100
1c13f4e9-9dd6-4a88-a9b4-49b3ab6b13e0,Ste the CAT,Ma è così difficile aggiungere il tema scuro (dark mode) alla GUI?,3,0,30.15.0.100,2025-08-16 10:08:11,30.15.0.100
823468ec-8ee4-40b7-8878-5b6a08c584b0,Leto,can you please do something about your awful UI,1,0,30.15.0.100,2025-08-16 10:00:12,30.15.0.100
b1f3f267-6a25-4455-9cfe-c57636e637cd,Ismaeel Melepeediyekkal,😇,1,0,,2025-08-16 09:30:03,
c6b9d699-9b38-4dff-81e4-73f4316c67d5,Chris Lee,"I don't know if being a Prime subscriber or not changes anything. But usually, I would get my items correctly if I was a Prime user. But yeah, I'm trying not to online shop so often, so I canceled my Prime sub. I bought items without my Prime sub and ended up getting the wrong items with none of my original items delivered. Good thing, I called customer service and had the issue fixed. I hope that they'll do a proper job next time, whether I am a Prime subscriber or not.",3,0,30.15.0.100,2025-08-16 08:20:21,30.15.0.100
155ec08a-b4cd-4048-906e-25e0603d43bf,Charlie 586,"They sent me an offer, download the app get a 10 voucher then never gave me the voucher. The app itself does nothing more than using chrome website. Waste of time to install.",1,0,30.15.0.100,2025-08-16 07:57:56,30.15.0.100
ffcd749b-296a-44a7-a110-056833a9aa7a,Catina marie Claytor,The searching has gotten bad and so has the algorithm the app has gone downhill,1,0,30.14.0.100,2025-08-16 07:24:43,30.14.0.100
f067bd5f-6263-411e-a557-7053819402d3,Ludovic OBONGUI,VG !,5,0,,2025-08-16 06:30:08,
28e4b954-0bfd-434b-a014-b5ac55b6863b,Jessica Davis,love love amazon,5,0,30.14.0.100,2025-08-16 05:46:21,30.14.0.100
4a776a93-d6a6-4a00-a2f7-d346cc79399a,Владимир Гонта,"Scrolling in the Amazon app constantly locks the main thread, causing freezes and stutters that make browsing frustrating. Shockingly, this issue has been around for over a year without a fix. For such a big company, leaving such a basic function broken is unacceptable.",1,0,30.15.0.100,2025-08-16 05:20:10,30.15.0.100
19106ecb-1e77-4b7b-870b-1476bab10743,John Smith,"was okay, but last update causes items to not add to cart when you go and look, then when you go back to order the item again it adds the initial item AND the retry, so you get 2 instead of the one you tried to originally order. Boots me back to home screen a lot when trying to go to cart. Needs work, very clanky app right now.",2,0,,2025-08-16 04:05:08,
d5e83cc9-5dc3-4c07-a530-baa20569d1c0,Frankie Bambootu,won't play videos,1,0,30.14.0.100,2025-08-16 03:42:01,30.14.0.100
946f5351-db0e-47d9-b04b-63d361275a33,Boy ;],terrible my package never arrived and can't uninstall the app. said it was delivered they said too many refunds but only had ONE refund 4 years ago for a pair of jeans and said the account is not associated with the order and it was for a Playstation 5. 500 $$ 😡,1,0,30.6.0.100,2025-08-16 03:07:17,30.6.0.100
c8ea5613-7ec7-4dc8-b29b-f6cc19384564,Juan-Carlos Miranda,I don't like the application because everytime I ordered something is never available in Canada and I have to pay 5he Canadian equivalent for the U.S.A price even though they have wherhousing in Canada. it is a rip off. It is always the same. costumer service is garbage 🗑 the people are rude and highly speak English. Why you ripping us off. thief you are,1,0,30.15.0.100,2025-08-16 02:50:55,30.15.0.100
93e4d8e8-2072-4f17-920c-3b6d088ae7e8,Abdelmalek Alaa,bad,1,0,,2025-08-16 02:39:46,
362c3384-cc40-4ee7-8f76-07c41c8c6132,Bentaley Reynolds,it's so easy to sign up,5,0,30.15.0.100,2025-08-16 02:10:10,30.15.0.100
e3eea1f8-e094-44e6-9d23-52b033cfcf41,Ricardo Lopez,the best amazon store I ever use,5,0,30.15.0.100,2025-08-16 02:09:20,30.15.0.100
f486a0ad-b0c2-4411-b3e0-14923e22425c,Spencer JL,They ruined the app with the latest update. I can't scroll in peace without an item pop up. 2025 and still no dark mode,1,3,30.11.0.100,2025-08-16 01:36:41,30.11.0.100
da40fe27-301c-4bd5-a98e-17b624a107be,uthe gentry,Amazon always has great things to buy.,5,0,30.15.0.100,2025-08-16 01:27:04,30.15.0.100
383cbd70-d09b-4fad-9a3b-69acb52fe62e,Lavern Halverson,been great !,5,0,30.14.0.100,2025-08-16 01:15:25,30.14.0.100
2983419d-a99b-4d93-a4d8-fb8ed5c73d21,Anthony Scott,"prime prices are the initial price given even though I'm not a prime member. I find an item that I like the stars, number of reviews, and price. psych, can't buy it at that price unless you have prime",1,0,30.15.0.100,2025-08-16 01:11:10,30.15.0.100
2d8af555-a8ff-43ec-a6b1-ec2d61f2d733,Michael,exceptional enjoyable,5,0,,2025-08-16 01:10:40,
6a2da132-17b7-4dd5-95bf-43e746c58963,B Cole,Any body notice you can't put reviews on the website with the company info . the other day I had a package store because the driver did not follow directions as usual so when I asked for a refund they needed my ID even after I was promised I would get the refund back then when I yelled at the employees I got a letter that I can't do that but I guess it's okay for the employees to lie and not do the job even the managers on the supervisors will lie to you,1,0,30.15.0.100,2025-08-16 00:59:45,30.15.0.100
56b0a229-23ab-49e6-adc3-4c0614238710,ali.mohamed,شركه نصابه يا جماعه محدش يشتري منها حاجه اقسم بالله اشتريت جهازين موبايل جالي جهاز واحد فقط وقفلوا الاكاونت بتاعي ومحدش بيرد عليا,5,0,,2025-08-16 00:19:13,
c5fb48ed-5546-44f6-86e1-564ca65d60c9,Jean-Luc Beaulieu,"Prime is a scam. You pay 100+ a year, and you're supposed to get 1-2 day shipping on most items, and half the time when you watch the tracking on the day its supposed to be delivered, it goes from 'arriving today' to 'arriving tomorrow', I was expecting the package, so I made sure I was available to grab it after its delivered so its not stolen. A gross lack of respect for people's time and money they pay for the service provided. UPS+fedex get things to me faster than prime 2-day delivery.",2,0,30.15.0.100,2025-08-16 00:13:24,30.15.0.100
c73f9711-5158-4812-b361-5576c43084da,Diane Mckown,very satisfied,5,0,,2025-08-16 00:10:03,
0d73f250-0029-4b5d-baad-ac19d19fbaee,murunwa makongoza,This app makes life very easy,5,0,30.14.0.100,2025-08-15 12:29:42,30.14.0.100
1accca78-320f-488a-a6c9-a853edf99dd8,All Gas No Brakes,consistently loses packages and makes in more difficult every time you attempt to contact customer service. I swear every time the app updates they change how you contact customer service. also quick to steal(incorrectly charge) money from you...but will take weeks to refund the money when you catch the thieves in the act.,1,0,30.15.0.100,2025-08-15 12:20:06,30.15.0.100
afb4eb44-ea8f-490c-a552-211b57ed1c2c,John Roujinsky,The best internet shopping,5,0,30.14.0.100,2025-08-15 12:02:48,30.14.0.100
ffd4bc99-7389-4468-9b88-35c95fb7cb9a,Pete Aviles,We love it quick and easy,5,0,30.14.0.100,2025-08-15 11:59:39,30.14.0.100
ac75acd6-8240-440e-b6c6-80779daa4adb,John Mellow,I've only had a couple problems with Amazon but on the whole I'm happy with the entire concept of ordering from home.,5,0,30.15.0.100,2025-08-15 11:17:13,30.15.0.100
33f2025c-d04f-42ba-b849-085f3b3568ad,judy harris,Great selection of items and prompt delivery! I can not imagine life without Amazon!,5,0,30.15.0.100,2025-08-15 11:14:36,30.15.0.100
3538d79a-aa09-4142-9f59-39dfbcfa8b44,Hower Blair,"Since the recent update, the cart is malfunctioning. I would add an item and went to go checkout and it says I don't have anything in the cart. Not sure how to contact the developers other than this review platform.",1,0,30.15.0.100,2025-08-15 10:41:39,30.15.0.100
7035b5f5-1faf-44c2-9274-f4725be64357,Mahad Abdi,the app gets stuck loading,1,1,30.15.0.100,2025-08-15 10:28:27,30.15.0.100
d4e60821-8b45-463e-9ad3-d79e09505f95,Kaels,"Come on now, dark mode is such a basic feature yet you're telling me something as big as Amazon can't seem to have it? Ridiculous. The app otherwise is okay. Search can be frustrating because filters often don't actually filter things out.",1,1,30.15.0.100,2025-08-15 10:16:31,30.15.0.100
266a348d-97ce-471c-9ed4-94e024f95b8a,monkeyboy27,"The app in and of itself is great easy to use and buy things at home or on the go. makes life easy. however for the past month or so it is targeting me with what has started to feel like aggressive marketing, everyday approx 10am uk time, an app notification pops up and its a recommendation to buy invicta watches. I had no need or interest in buying one of these (but you know you can ignore one or 2 attempts at advertising of something you dont want) and have even less interest now. and annoying",3,0,30.15.0.100,2025-08-15 09:36:11,30.15.0.100
74c77933-cdbc-4ccc-89ea-58b5b83c8d85,Laszlo Stadler,"I am disappointed in the current state of Amazon in Germany. Most of the things sold on Amazon are very bad Chinese products. Whenever I search for something I only get offered Chinese products, and if I'm looking for something better, it takes ages to find them (if I even do). For this, I could also go to Alibaba or Temu. Shopping on Amazon is not fun anymore. Also recently the Amazon app shows spam several times a day, and there is no notification channel to disable it without disabling all.",1,1,30.15.0.100,2025-08-15 07:51:56,30.15.0.100
d49eb020-73c9-4139-8ff2-500976b0fd4f,Nome Nick,"Big bug to solve. Amazon changes the shipping address when you insert a new payment method. It happens at the last step of an order, and, especially on small mobile screens, you can not notice this error.",1,0,30.15.0.100,2025-08-15 07:48:42,30.15.0.100
05de2045-5c0f-455d-b4a4-ac96caaf6138,Tonia Tonia,I think is very good because things are so affordable looking forward to get more stuffs.,5,5,10.7.0.100,2025-08-15 07:43:45,10.7.0.100
d31030dd-f0a8-4730-8a3e-22d46e3cb0c4,Charetha Ramos Ramirez,love amazon,5,0,30.14.0.100,2025-08-15 07:23:41,30.14.0.100
7c500fda-9adc-4062-a4ab-47689ab0fe7b,Jacob Murphy,"Worse interface ever designed, they have prioritized functions and layout for iPhones, no dark mode which is insane. claustrophobic bloated design.",1,3,30.15.0.100,2025-08-15 05:57:07,30.15.0.100
cf02bdbc-6817-40bd-8260-cbae83c171fd,Homosexual GrandSon Satan,Highly Prejudicial,1,0,,2025-08-15 05:52:31,
ff62f8c9-e016-46d1-89b4-bfc40cb5cdda,Don Cota,"The app has gotten much better over the years. However, the 2day free shipping for Prime Members is less frequent than normal. Also, Bezos takes more away from Prime memberships every year just to try and reach the richest man status. Bennies for being a Prime Member are just about equal to non-Prime members. The App gets 4 Stars but the Prime program would only get 2 Stars.",4,0,30.14.0.100,2025-08-15 05:43:40,30.14.0.100
0c46d533-83c8-4dfe-8e8d-f41d84b174ed,Angel,very easy and convenient app to use,5,0,30.14.0.100,2025-08-15 04:46:34,30.14.0.100
386726cc-f248-4c45-9eeb-35f4b6b13d86,Joe Lysek,quality items?,4,0,30.14.0.100,2025-08-15 04:41:14,30.14.0.100
ac15e75b-bf8b-482e-95aa-4eaf414278f8,Drew Murphy,Package never came and no refund was given. straight up robbery! no way to talk to a human in customer service. Prime canceled.,1,0,30.14.0.100,2025-08-15 04:21:45,30.14.0.100
8898167e-dea9-49d9-9e0d-9b9ab2ede074,Frank M. Chomenko,Endless selection of everything!,5,0,30.15.0.100,2025-08-15 04:12:23,30.15.0.100
8b8e9309-0a5c-468a-9a16-250fdc3801b7,Sue Bradley,Amazing service,5,0,30.14.0.100,2025-08-15 03:56:18,30.14.0.100
6b5a9a65-0833-4d71-a18a-5c57addd61da,Ronald Dyshon,"What I hate about this app is when you purchase something it tells you when it's coming, stay with me now. You won't know if the payment was successful unless you look at your card's transaction history. And it doesn't tell you when it's about to be late it says ""Arriving Today"" and then once you don't get it then says it's late, really annoying how it assures you of false things. Let me know if the payment went through and the accurate time my package will arrive.",1,0,,2025-08-15 03:17:51,
5f18f4f7-20d2-4cf0-8bb4-922c19d4e587,Merri Bea Spencer,I always find what I need at a very good price ❤️,5,0,30.14.0.100,2025-08-15 03:03:45,30.14.0.100
efa8331c-75ed-40bc-a8ee-e551e8e27170,Joshua Neva,It's efficient commerce.,5,0,30.14.0.100,2025-08-15 02:55:35,30.14.0.100
43a9fff9-8fb6-4489-8ecc-6928cb5d9129,Karl Doss,love it,5,0,30.14.0.100,2025-08-15 01:54:48,30.14.0.100
e588bc4c-ae4f-45df-b279-4174d9cc0fd1,Emam Hesham,دائما تخلف من المسؤولين عن التوصيل,1,0,,2025-08-15 01:50:37,
e199b524-02d2-4441-a181-8335e5c39109,Kate Williams,"They won't stop adding ""features"" that are changing the app and glitching it out. I use this app for groceries, so I'm close to canceling my Prime and figuring it out with another company.",1,0,,2025-08-15 01:33:59,
836baa7d-3b54-437c-abeb-367dbc7653cd,Frances Thurlow,love amozon shopping without leaving home,5,0,30.14.0.100,2025-08-15 01:30:38,30.14.0.100
91dbb611-cc06-45e4-9879-5697b6898317,allen neal,"Got a digital visa card to shop here. After 3 days with customer service, still would not work. Visa was great, gave me different cards, registered them, and it worked with Target. sketchers, Dicks, etc.. Half the time Amazon's check out wouldn't even ask for the cvv number. Going to the websites of the items I wanted to order was much easier and delivery times were the same. I'm sure the websites were happy also since they didn't have to pay off Amazon. Good luck if you keep shopping here",2,0,30.14.0.100,2025-08-15 01:17:51,30.14.0.100
32168f8f-1358-47e3-85af-cda6f908d94b,Darci S,"I love the first pair I bought so much I'm back for 2 more pair👌!!! They fit nice, no ripples of fat showing",5,0,30.14.0.100,2025-08-15 01:17:24,30.14.0.100
12d9a42f-f102-47d3-b105-c8ee95406a0b,Andrew JJ,app won't load any pages no matter what my internet connection is. won't let me search anything or veiw my account,1,0,30.15.0.100,2025-08-15 01:16:41,30.15.0.100
3f43c50e-d199-438e-a388-7f0cd4910b8e,Scuba Boomer,"I have always had the best experience shopping on Amazon, best all the other sites hands down, and I have recommended Amazon to so many friends and family too. Keep up the great work and thank you",5,0,30.14.0.100,2025-08-15 00:15:09,30.14.0.100
ff9e8f6a-dae7-465f-b334-6c6ccbb59548,Ashton James Cutler-Larkin,"doesn't connect to Amazon locker - I go to this locker all the time. yet when I walk in today, the app preloaded where I need it to be, it stops working. it's telling me, ""hmm, can't find any recent orders"" as I'm standing in front of the locker. I walked outside and it was still doing this. as well as a delayed load, so when it DOES get to the Bluetooth connect screen and you hit pickup package, the next screen is BLANK AND DOESNT LOAD. I waited 10 minutes trying to get it to work.",1,0,,2025-08-15 00:01:26,
217b7337-a869-4a8f-ad3f-773d754fdf44,Philip DiMarco,lots of good deals. some you have to really look for,5,0,30.14.0.100,2025-08-14 12:35:15,30.14.0.100
cc3bf748-28dd-408f-b7bb-4ecb9f69a7a1,Christina,love Amazon,5,0,30.14.0.100,2025-08-14 12:33:29,30.14.0.100
