reviewId,userName,content,score,thumbsUpCount,reviewCreatedVersion,at,appVersion
311b753e-708d-4e8b-ac83-f0b3aad08778,Stephen Coste,"the parcel was dumped at my door, I was home all day. The driver didn't knock on the door",1,0,30.17.0.100,2025-09-24 04:21:00,30.17.0.100
b51916dd-f727-47df-8677-1b91de0af51b,Todd M,the new layout sucks. change it back. I want to see the items I've viewed it is impossible now.,1,0,,2025-09-24 04:09:45,
dafa6abb-c98e-4c43-b16a-c4ec589f1a1a,Sandra Herl,2 apps opened. Can combine them???',2,0,30.17.0.100,2025-09-24 03:58:19,30.17.0.100
df92a055-2b60-43a3-97d1-e9934caa9274,Katonya Henson,It's my grandson's 5th birthday on 10/01/2025 It's been fun shopping for his birthday,5,0,30.17.0.100,2025-09-24 03:20:58,30.17.0.100
6e1bb7fd-9444-4db4-892d-0862733342f1,Jalaysha Sanders,Love it that all they have everything I need and want,5,0,,2025-09-24 03:06:51,
99c49c80-809b-462f-af49-b0c24a0f7910,Linda Gracia,I am trying to close my account and it's not letting me.,1,0,30.17.0.100,2025-09-24 02:59:02,30.17.0.100
c32c7ed4-2241-4317-aacd-09ed9ccac127,Fayann Richards,I rate this one star because I couldn't find anything I want even though it was on here I don't like the app I like alibaba more,1,0,,2025-09-24 02:58:07,
c2e91679-8616-44ce-959a-e952bd8e9c34,Grace Havlin,Easy to shop the app. Great value in a number of items.,5,0,,2025-09-24 02:51:18,
a98ef4db-97c7-4762-819e-1348bb8f5c62,Tony Killzoni,absolute pigs,1,0,30.13.0.100,2025-09-24 02:39:42,30.13.0.100
3ebbb078-4d2c-4657-9e10-d19e4e6dd4ee,Adrian Gillock,great stuff,5,0,30.17.0.100,2025-09-24 02:27:18,30.17.0.100
4f11f836-1790-4919-83fd-e2615f7e8bd2,Andres Hernandez,"same day delivery almost always gets delayed to the following day. Just be honest and say delivery tomorrow, and it won't be an issue.",1,0,30.17.0.100,2025-09-24 02:27:07,30.17.0.100
af162866-8b32-4440-94f1-49dc37ef2e4a,Alisha Bowen,Do not really care for this,1,0,30.16.0.100,2025-09-24 02:21:50,30.16.0.100
ab575276-b565-4512-b149-c1cf8971e793,peach suri,"absolutely ridiculous behavior. not even worth purchasing amazon prime considering they just take the standard amount of time to ship anyways. offered no communications and just delayed my package repeatedly after shipping it, leaving it stuck only 2 hours away from my address. and you can't even refund UNTIL the new delivery time has passed. what's the point of bothering with fast shipping if you just delay it to almost 2 weeks since ordering time?!?!",1,0,22.13.0.100,2025-09-24 01:16:21,22.13.0.100
a3a3fa9a-3327-4479-bf79-9fd14df28742,John Fisher,efficient and easy to order,5,0,,2025-09-24 01:12:07,
5e0a9d9a-1ece-4970-88bb-f4b87ff20413,Sherrie Jackson,Easy and you can find anything you want or need!,5,0,30.17.0.100,2025-09-24 00:46:58,30.17.0.100
3b60fae4-d227-4122-b0e4-997a36d5434c,Tina Wrend,This app has taken a down hill Spiral laitly you need to fix it or loose customers you take money quickly for prime but our orders on prime are never sent nxt day del anymore which is what prime is for! you dont tell us when you going to take payments so they get refused then when we try to pay that gets refused because on same card refused b4 🤬 get your app fixed with a proper fix will you!!!! your loosing lloyal customers because of your app & ditch evri as your deliveries there useless!,1,4,30.17.0.100,2025-09-24 00:24:29,30.17.0.100
9e36ae0c-f8bb-4f99-a0f1-fd6f4a8742cf,Sid Johnson,I didn't get my product or my money back on my last order 😤,1,0,,2025-09-24 00:16:13,
4c875d3f-6090-4f6b-a15b-527ef39f2f0b,Alma Navarijo,amazon is kinda bad because it lies so for example it says it will come stember 23 then it's September 23 and now it says September 25,1,0,,2025-09-24 00:15:47,
a0428b8b-2c2b-42c6-920b-a165ed742eb1,Wolf Reading (Personal Account),I love the fact I pay for Amazon prime but yet I still get 3 to 4-day delivery and it comes through UPS and FedEx vehicles And no deliveries on Sunday or Monday I and PAY FOR AMAZON PRIME!!!!,2,0,30.17.0.100,2025-09-23 11:35:21,30.17.0.100
1a2ad56a-23a2-46a6-b7df-5cc6c9d21690,Soha Elsafti,المستوى فالنازل,1,0,30.17.0.100,2025-09-23 11:30:56,30.17.0.100
1ba697c1-e378-44a0-8684-fec3eb82cccb,David Edwards,I had to re order because YOU cancelled the original order for no good reason!,1,0,30.17.0.100,2025-09-23 11:10:00,30.17.0.100
67267423-42d4-4395-b012-7e705992a9ec,Clyde Jr,jm.,4,0,30.17.0.100,2025-09-23 10:50:38,30.17.0.100
d9212e72-8482-453e-9933-0ebb93f4adb9,Bhavana Sharma,amazing experience ✨,5,0,30.17.0.100,2025-09-23 10:41:29,30.17.0.100
954f8199-a780-4ee0-b69b-613ee45668ac,Semor Butts,I been trying to delete this app .,1,0,,2025-09-23 09:06:44,
b4684e5a-bce3-4b2a-ac3e-31d06608707b,Wenona,good,4,0,,2025-09-23 08:46:59,
f25fb209-a929-4dc6-a802-915111fc648a,Nicole Renee Pariseau,overall great service and prices,5,0,30.17.0.100,2025-09-23 08:29:50,30.17.0.100
75828877-fda9-4c1c-bd68-3488e946d897,AHMED ALTAHAN,Very reliable and fast delivery,5,0,30.17.0.100,2025-09-23 08:14:37,30.17.0.100
4b48052c-adda-4191-8221-a7c14fb681c2,Susan Clarke,I can't get text off amazon can help,1,0,30.17.0.100,2025-09-23 08:04:44,30.17.0.100
481c486d-6afb-4db7-ac88-6ce228ae9b14,Carolyn Nurney,enjoy the shopping,5,0,30.17.0.100,2025-09-23 07:41:45,30.17.0.100
a65fdb30-9038-4cfa-a8a4-3392905f28cc,Md Kazi Younus,Good,5,0,30.17.0.100,2025-09-23 07:25:31,30.17.0.100
5f46d741-2bbd-470a-a82c-1eed8a9a5686,Pauline Lister,Great way to Shop.,5,0,30.17.0.100,2025-09-23 07:12:32,30.17.0.100
c552be35-2fb3-4e88-98c4-326f7e39a9fb,Kelly Lester,another garbage route. Amazon still hasn't responded to me getting a gun pulled on me. I could really use a lawyer.,1,0,24.21.0.100,2025-09-23 07:12:02,24.21.0.100
daac5936-9e7c-4aa7-99d8-a2ee87106175,Vee H,good discount for free delivery with membership,5,0,30.16.0.100,2025-09-23 06:29:34,30.16.0.100
13927563-e15d-4fba-bd20-6c91147ca97b,Mark Gunter,"Avoid Amazon at all costs. Tonight is the fifth time I've found they charged me a prime subscription without my permission. It's been years, and they keep doing this to me, stealing my money. I'm currently in the process of taking them to court, I have all the info I need. Found out they do this to many people. They have no excuse. I'm very excited to see the losers in court who WILL lose. STOP STEALING! I am going out and showing everyone what a fraud Amazon is. It should be fun!",1,0,,2025-09-23 05:17:03,
74f3ec28-ba9f-4198-b590-d987fe9b9f44,John Somers,Good,5,0,30.17.0.100,2025-09-23 04:51:49,30.17.0.100
3e46f9e3-749f-4dbf-b349-8d42100bd813,Pamelia Hooks,Amazon is absolutely the perfect app for shopping I highly recommend 👌,5,0,30.17.0.100,2025-09-23 04:30:15,30.17.0.100
0ccb1225-b957-46d4-a305-8da7d3562c9d,Pennie Mike,thank you AtandT,5,0,,2025-09-23 03:44:30,
3a8e2888-f521-4e1b-8fc6-db4e9252cb3f,Mister “R. B.” Ronnie,I switched devices and my Prime didn't and was asked to pay full membership or upgrade Metro plan to a 60 plan. Amazon understood and only charged a affordable amount while I got it straightened out. Thanks to Amazon( big box does care about individuals ) as they made a way for me to continue receiving services ! Your reps didn't argue hang up on me they helped or contacted someone who could ! Great job customer reps and supervisors representing Amazon 👍 Happy Customer Great cust services,5,0,30.17.0.100,2025-09-23 03:40:03,30.17.0.100
233e2c49-ecb4-46a7-a146-32bf5dfb4071,Isoken Precious,nice,5,0,30.17.0.100,2025-09-23 03:28:49,30.17.0.100
c3254b94-5d48-4813-9310-441c7513d3c2,Andrew Howell,no dark mode.,3,0,30.17.0.100,2025-09-23 03:02:45,30.17.0.100
17182473-95dc-4bc4-9272-557b219752e5,Vincent L,"The updated app unable to see my yesterday's Orders. Is this how e-commerce app is maintained? Even Gmail notifies me of my Order coming in tmr. However, Amazon app shows me nothing!!! Keeps loading with loads of sales flashes, pulling data rate at 500KB.. Is the App getting fatter and slower instead of offering the best UI?",1,4,30.17.0.100,2025-09-23 02:49:28,30.17.0.100
e9289266-5fe6-48c7-8eb1-c24d99da7f33,Eusilyn Acojedo,Your company is sucks!! you cancelled my ordé? I expect that you contact me in whatsapp!! and bow I saw in your app that my paid order was canceled? when your delivery person did bot try to contact me?? when can I get my refund???,1,0,30.17.0.100,2025-09-23 02:36:13,30.17.0.100
24da07af-c703-4dba-9ddb-937e375ee449,Sabbir Khan,বাংলাদেশে amazon নেই কেনো,1,0,,2025-09-23 02:15:09,
6c5b397f-cbe9-42ef-a6b2-e77efe863d0f,Andrew Wilson,awesome. it's a life saver,5,0,30.17.0.100,2025-09-23 02:12:15,30.17.0.100
8ea0b418-8f93-4fd8-bf5c-60e5f9ab3e30,Tyler,Dope 🥹,5,0,,2025-09-23 02:09:50,
43e01d2b-756c-4637-916b-a57f1bf58cc9,Supreme Deity,"Amazon has been my go to shopping site for things I need/ want from perfume- home compliances- guarden stuff etc.. However when it comes to clothing / shoes they charge a higher price for larger clothes/shoes. You do not see that bs in regular stores, that's just the stupidest thing I've ever seen & they say it's because of availability &? that's basically robbery. 💀💀💀",3,0,30.12.2.100,2025-09-23 01:26:49,30.12.2.100
29ad962a-1a6a-4191-84f5-04677f388453,Ruthanne Pavelko,".I love Amazon, My E - pad was down and I couldn't wait to get back online for the the things I need and the special items that come up amost weekly. They save me time and money .",5,0,30.17.0.100,2025-09-23 01:07:23,30.17.0.100
531f6ada-76e2-4c65-bc16-4942385de18b,Annette Cantu,Your book spell check doesn't fully work.,4,0,,2025-09-23 00:58:38,
9e685065-533b-4ff9-af59-ff4f74179978,Stephen Williams,There's a big in the address update section of the app. It won't let me remove or edit an old address. It keeps telling me to set up a new home address first which I have already done but it still keeps telling me to create a new address before I can remove the old address. Please fix this ASAP.,2,0,30.17.0.100,2025-09-22 11:39:44,30.17.0.100
642fe7d3-9f1f-4c56-aeb2-eb6dce9e4407,Sulaiman Alghanim,consumer should be given the choice of choosing the courier delivery service,2,5,30.17.0.100,2025-09-22 11:34:55,30.17.0.100
b54349c5-4d36-4545-a392-f100a0600692,Abd El Rahman Waly,أنا ندمان إني لسه باتعامل معاكم بجد. مش ممكن كم الإهمال وحالات النصب اللي بتحصل من خلالكم. المندوبين كل يوم بيتعاملوا بطريقة اقل ما توصف بأنها عربجة. بيسرقوا الاوردرات ويكتبوا تم التسليم طالما مدفوعة مسبقا. الموظفين صفر اهتمام. بجد شركة بقت سيئة جدا.,1,0,30.16.0.100,2025-09-22 11:02:11,30.16.0.100
04d77a86-7ed8-4912-8e87-675de9b3ba95,Musdu Legen,"Eigentlich eine gute App! Leider in letzter Zeit trotz Update immer wieder beim Runterscrollen die Meldung, dass ein Fehler aufgetreten sei. Schade, dass es schon seit mehreren Tagen so ist und nicht behoben wurde/werden konnte. 😞",2,0,,2025-09-22 10:37:40,
a38a5576-77b3-4ff7-994c-e6060ada71a9,Kaintura Jabbar,thanks for the update,5,0,30.17.0.100,2025-09-22 10:20:03,30.17.0.100
7b112168-fe03-45a3-b4df-3227f7b3a628,Harvey Gazzaway,good best buy for everyone,5,0,30.17.0.100,2025-09-22 09:03:50,30.17.0.100
2164527a-9e52-47c6-b047-3e60200b9129,Poonam Pandit,best,5,0,30.17.0.100,2025-09-22 08:57:59,30.17.0.100
8f8901de-df27-4e13-92ef-db167b31c0b2,SomeGuy WithMtnDew,trillion dollar company yet they can't optimize this app for oneui 💔💔 i bet they're paid by Apple to only keep the iOS version of this app smooth,1,0,30.17.0.100,2025-09-22 07:34:36,30.17.0.100
2a9ce3f5-25e6-4782-9405-1af209a15f42,Robert Fairlie,easy,5,0,30.7.0.100,2025-09-22 07:08:19,30.7.0.100
1d7b32d7-7a09-47e7-988c-630938f42aad,Tom B,"Bug with Bluetooth pick up lockers. If you turn up with no WiFi switched on the app tells you to enable location services even though they're already on. The app won't go past this until you turn WiFi on, even though you don't need WiFi and it doesn't tell you to.... it makes no sense",3,0,30.17.0.100,2025-09-22 06:48:14,30.17.0.100
97951241-ec4c-4415-b02d-285b1dddec1c,True Gospel,I am very happy to use Amazon for the first time and receiving a discount of R250 as well,5,0,30.17.0.100,2025-09-22 06:39:39,30.17.0.100
ebbfb9dc-0446-4955-a69a-4ee078c35525,Lily Pearl Donkor,best of best Market.,5,0,30.17.0.100,2025-09-22 04:37:09,30.17.0.100
b526b9f7-8383-4a5a-b0b4-742bdaf4abb1,Abdullah Aldhahri,"need dark mode, please, for more convenient shopping experience",5,0,30.17.0.100,2025-09-22 03:25:00,30.17.0.100
4ed7ac94-87bf-4b74-94e8-f71310c590ea,Hollywood 8,"I pay for Amazon prime. However lately whenever I order a product and it states ""Fast free shipping with prime"" in only a few days..this has been the 3rd time I have ordered something, And it has been late. by a week or 2. its fusturating because why am I paying for prime then?! its a rip off. and im starting to become unhappy. I am sure others feel the same. Something needs to change. I have tried to contact Amazon directly and it just prompts me with A.I as a pose to an agent. False ship, info",2,0,30.17.0.100,2025-09-22 03:12:25,30.17.0.100
376a0b1b-9a2c-4dba-b7ec-dea90fe593d9,Karthick Dhanushkodi,good,5,0,30.17.0.100,2025-09-22 03:10:03,30.17.0.100
a58a2e8b-ec41-4bcd-8d97-41e2078f12d4,greg cheese,barely loads anything after hours of waiting for my search to load and on top of that the images don't load at all so I can't see what products look like,2,0,30.13.0.100,2025-09-22 02:49:17,30.13.0.100
c59f6f8d-2854-4e26-9ab9-06a4b0c69526,Jen Jen,"Not changing from 1 star until you fix the review system. 1. do something about sellers paying for fake reviews with free products. 2. automatically include price and currency reviewer paid (I said a $15 item was worth the price, to later find the price changed to over $50, which is most definitely not worth that). 3. Prevent sellers switching products in the one listing (was checking reviews for a waffle cup maker, only to find reviews and photos of a sandwich press! Not first instance either)",1,10,30.17.0.100,2025-09-22 02:41:41,30.17.0.100
4ba5c002-5290-4201-9401-7e33baa6a5ed,Gavin Williams,"worst app to buy and sell on ever, straight up 🐕 💩",1,1,,2025-09-22 02:03:16,
ba027541-e37e-4992-b707-a3063056c56b,Debra Allen,Love the ease and selection.,5,0,30.17.0.100,2025-09-22 01:33:29,30.17.0.100
79a5c08b-0295-4810-9cf9-03c3c0d2743d,Dee Jae Preston,The only problem I have with my orders is that they do not follow the delivery location instructions.,4,0,30.17.0.100,2025-09-22 01:25:24,30.17.0.100
30035548-cb1c-40ae-8682-5a2b7b78a639,Jared Rudgers,app just pushes what it thinks you want to see. It is terrible. Also I add a review and it doesn't even show it under recent reviews. Amazon app is a terrible app.,1,2,30.17.0.100,2025-09-22 00:54:14,30.17.0.100
726d9901-2003-48d8-8893-ab1fe5e5c678,Haam Soloo,"this platform, it's customer service, it's a-z team have sprinted downhill immensely. bunch of clueless idiots and AI. they literally know about fire hazards listed for sale on their platform for years and they don't put in recall section or refrain from listing on their platform warning free. it's probably worse these days outside of delivery then temu, lazada, etc. also many items are exceptionally overpriced. customer for 9 years that's probably changing today.",1,1,,2025-09-22 00:02:10,
85cd715e-a96a-4dfc-96e2-4192e1836389,Syed Hunain,behtrern,5,0,,2025-09-21 11:45:08,
9601e76d-9c3f-4c4f-8267-c33e92d88db5,ruth lorquet,Run extremely slow and need to be debug.Should offer other option when out off stock the closer alternative to the item.,1,0,30.17.0.100,2025-09-21 11:24:25,30.17.0.100
ef8a421e-c7e8-4a5b-b0c3-6920fc666ce2,Oliver Ford,"Hate the update that now constantly pops up stuff about items as I'm trying to scroll. I don't know what does it, tap and hold maybe? (necessary for scrolling!) but it's annoying as hell, never what I wanted. Engagement with this new feature probably looks great, because I'm doing it constantly, but never deliberately, it's useless and infuriating.",2,0,30.17.0.100,2025-09-21 11:17:50,30.17.0.100
6ba5e5b7-e8e0-414c-929c-3dd1f2349b5a,Ontiretse Senosi,Terrible user experience. All the pictures are blurry. It constantly throws of your location to the USA. Can't just login using your Google account. Signing in still fails after authenticating with an OTP from emails.,1,0,30.17.0.100,2025-09-21 10:47:56,30.17.0.100
212c8dfc-edd2-46e2-9f37-c3c9a7a1a66d,Victoria White,"This app is great for organising different categories and offers an intuitive search, along with many other features that I appreciate. However, I have noticed one issue: when I place an item into a category, that category does not move to the top of the list. This makes adding items more cumbersome. Please fix this bug!",4,0,30.17.0.100,2025-09-21 10:34:36,30.17.0.100
0982f02c-87c1-4b65-805a-c8dcf0826b35,SM Mizan Islam,good app,5,0,30.17.0.100,2025-09-21 10:29:02,30.17.0.100
46ec866f-360e-4f82-903c-06a1a47e4436,Paweł Żurek,"działa bardzo powoli, strona w przeglądarce działa lepiej",2,0,,2025-09-21 10:26:01,
ebf8e180-bb1b-4645-a320-84a7a8ab416f,Herman Hallowell,Have always had a good experience.,5,0,20.20.0.100,2025-09-21 09:51:12,20.20.0.100
7d62ffaa-28e2-4898-94e9-7087bb647fa5,Akoyu Mais,sending er administrator when necessary>>,4,0,30.17.0.100,2025-09-21 09:33:45,30.17.0.100
7efde07d-c822-4da4-88e1-68f6b8cedd96,dennil erick,not able to download the app,1,0,,2025-09-21 08:26:50,
82019fdf-c06d-4502-a415-76976ebbc1a8,Robert Bryant III,⭐️⭐️⭐️⭐️⭐️,5,0,30.17.0.100,2025-09-21 08:24:48,30.17.0.100
f17044ba-84af-4f68-9f25-5d682d6bf280,Kelly Lester,another garbage route. I'm an amazon driver. reporting issues to dispatch does nothing.,1,0,24.21.0.100,2025-09-21 06:57:59,24.21.0.100
8dd8d965-55a3-46b0-846d-8df127b6bc08,E Dog,"easy to use, 1 star since i have to login to my account and attempt to purchase an item just to hopefully find out if it's originating outside the usa and thus if i will be jacked for a 300% tariff. I shouldnt have to login to the app nor website for you to tell me where product is originating from....or at the least if I'm importing it. No longer using the app nor service for this.",1,0,,2025-09-21 06:51:04,
fa7a975f-8739-4059-a93a-3493646aa9e6,Mintu Sabu,3 4th 😊☺️😃🫣🫥1🫣💗🫣5🙃☺️🚗🙃,2,0,30.17.0.100,2025-09-21 06:43:12,30.17.0.100
646bb2d3-f0d8-4b28-8e82-d7867b72233b,Diane Williams,do I have Amazon on my face book.,5,0,,2025-09-21 06:03:49,
857c7eb1-ed2b-41df-abd5-5246d4d653f2,Eugene “Shush You” Corr,Amazon Is Probably My Favorite Online Shopping Application? It Basically Covers Any & Everysort Of Shopping Experience To Help You Find Anything You Could Possilbly Need Or Want? I Love it!,5,0,30.17.0.100,2025-09-21 06:03:05,30.17.0.100
6c27087d-71c5-4a7f-876e-a42996cba71b,Aziza Money,good,5,0,,2025-09-21 04:41:50,
a1d3daa6-94c1-47b6-8438-287fb5af754d,Rose Porter,very difficult to efficiently manage orders...absolutely hate the new changes Amazon recently made,2,0,30.17.0.100,2025-09-21 04:38:26,30.17.0.100
e28da1df-e5ef-4586-8406-c689af1c9c1d,Shade Schneider,this app sucks,1,0,,2025-09-21 04:20:35,
78e1955e-6ebe-426e-943e-8fc39f9dc499,avery kruisenga,my Hatsune Miku flavored body oil came early thank you Mark Zuckerberg,5,0,30.17.0.100,2025-09-21 04:19:49,30.17.0.100
497d6fd1-bf54-42f1-a83a-8051e73b418d,xulu,it's 2025. give us dark mode. I can't be on the app for longer than 5 minutes without my eyes hurting. don't you want our money? 🤣,1,0,30.17.0.100,2025-09-21 03:52:50,30.17.0.100
9d3f3924-6ade-49fb-85e0-3391fe924278,Jahtherealist,great,4,0,30.17.0.100,2025-09-21 03:50:02,30.17.0.100
46bb71e4-777d-4ee8-a823-86e3fbe1298d,Elizabeth Yu,Easy and reliable.,5,0,30.17.0.100,2025-09-21 02:56:02,30.17.0.100
ce7350c5-4459-420b-8973-adef1c764422,Isabel Davila,I love Amazon is so good,5,0,30.17.0.100,2025-09-21 02:28:18,30.17.0.100
952b5fb6-6fb5-4e52-bd40-d344e51f9bb2,François Picalausa,"After I unsubscribed from prime, Amazon decided to continue charging me monthly for it. Their customer support say they can't figure out why I'm charged and still are not providing me service. It's a scam folks, don't buy into prime in the first place.",3,0,24.2.0.100,2025-09-21 02:27:34,24.2.0.100
0cf42b0e-5fe1-4d92-9c2e-68a921775903,Javelin Geerman,good,5,0,30.17.0.100,2025-09-21 01:47:51,30.17.0.100
469159dd-4b5e-4b60-b171-5ec74a1f4b33,Crystal Ann Wilkinson,"I have never received not one order from this deceptive organization, just comforting lies that they will deliver. I really do not care for scammers and I do believe this is one of them.Not one order in ten years or ever have I received. Although there are people who have really been sucksespool with this app receiving every order they did not ask for thinking that I am too lazy to notice. well No names just saying try truth for once. My name is not the name on any order any returnlace so retur",1,0,30.17.0.100,2025-09-21 00:58:26,30.17.0.100
e0c02cb9-5858-454a-9974-24b9a242c4ce,Billy Goodman,"thus app is being used by fake developers to hack and steal your information e erytime you click on an item they get paid and now have you banking information, address, etc. now you will really see the ads coming. even your children, and they have fake call centers in the Philippines. If you have a dispute°",1,0,,2025-09-21 00:22:41,
4846a6b1-1b25-4127-bb56-e91e14e820a1,Craig Nix,Great app with great prices.,4,0,30.17.0.100,2025-09-21 00:15:38,30.17.0.100
73f88518-cade-4626-b8f7-095630b6070e,Andrew Rowland,"Orders that I place constantly go through errors that I have no recourse for. It doesn't matter if you pay for faster shipping, the item will arrive late anyways and all you'll get is an automated apology message. I've had items that simply never arrived, countless items whose delivery times were pushed back, and empty packages placed at my door. The worst part about this system is that the people raking in the obscene amounts of money from these purchases don't have to deal with any of this.",1,0,30.17.0.100,2025-09-21 00:13:27,30.17.0.100
0eb3f0c4-07f7-4ae0-8f33-d669cd0e237b,Nz,"Amazon is horrible lately. ""Next day delivery"" keeps turning into next week delivery. easier and cheaper to go to the store.",1,0,30.17.0.100,2025-09-21 00:12:54,30.17.0.100
06445c79-d803-4366-b567-c538a413981a,Cheyenne Slaustas,I don't support fascism.,1,0,30.17.0.100,2025-09-21 00:00:53,30.17.0.100
175fc6bd-513b-43d3-99a9-5d453c4e02db,Seth Mosier,garbage lives here,2,0,30.17.0.100,2025-09-20 11:16:13,30.17.0.100
2bc5766b-7b63-4718-bd16-8e2ea1b7f615,ARIYAN KHAN,everything is available here ☺️,5,0,30.17.0.100,2025-09-20 11:14:11,30.17.0.100
9b7f08a7-62a0-452b-ad3e-f44d1b271609,Company 7,why is it showing as website quality rather than app ?,2,0,30.14.0.100,2025-09-20 11:10:46,30.14.0.100
ff376815-c230-4c64-a310-0cc0cf6f9da7,Terri,"If ever I had a problem, they went beyond protocol to fix it, I have been an Amazonian for years 🌹🙃",5,0,30.17.0.100,2025-09-20 10:51:07,30.17.0.100
2747b385-5838-436f-a1a9-f166cb4ab651,Yelyzaveta Stupnikova,Got prime subscription. Don't see it on my account but I'm charged for the subscription,1,0,,2025-09-20 10:45:12,
2448a2fb-c051-4476-98fa-51aa3a625f6e,Mark D.,"This app is created and maintained fascist collaborators in the destruction of our constitutional Republic. I encourage everyone to end their Prime subscriptions, delete the app (which illegally tracks your activity), and to steal any Amazon Prime package you see and destroy the contents until people stop buying from these Nazis. Let's start a TikTok trend! #burningprime",1,0,30.17.0.100,2025-09-20 10:36:23,30.17.0.100
579221dc-aee2-4a93-9cd5-f688e76542f7,Steve,"warning: contains Rufus, a so-called AI",1,0,24.18.2.100,2025-09-20 10:20:42,24.18.2.100
d4e4ca78-78aa-4ede-a5f1-27da11bba906,alaa bak,"seriously disappointed with the courrier and customer service this app offers, kept changing the date for my delivery while not respecting the date they gave 3 times, the courrier calls for 5 seconds and then leaves, seriously horrible all around experience, don't recommend this app, going to buy mi stuff from ebay starting today",1,0,30.17.0.100,2025-09-20 10:11:24,30.17.0.100
c77169e1-8d85-45a9-bca1-655dd7cbfee5,Levi Vera,"i ordered a package since Thursday and paid extra for my package to come the next day but now its Saturday and i have an appointment today to braid my hair and my package is what im gonna use to braid my hair,i need a refund for the extra delivery because this is absurd. I can't even cancel my appointment,what was the use to pay the extra money when the delivery will take more than two days. And i cant buy the stuff anymore cause im broke,pay me the extra money back,useless service.",1,0,30.17.0.100,2025-09-20 10:07:28,30.17.0.100
d4c30803-91a4-4a4f-9b56-78dc1c0f1416,Ivan Kvas,"There's sponsored ads in the Search tab, there's sponsored ads in the Orders tab, AND NOW, there's sponsored ads in the damn Checkout Tab. I get that Jeff Bezos lost a lot of money in the divorce and now wants to make the most of it, but this is just crossing the line.",1,0,30.17.0.100,2025-09-20 09:36:28,30.17.0.100
99f4a197-4d86-401b-b216-38c3d12adc2b,LeeLee Bug,"You guys really need to update the UI to be cleaner. Less underlines, easier way to tell items apart horizontally, buttons that pop out easier, like the ""Add to List"" one. And definitely, so much less clutter for both the text and the images, and LESS LAG WHEN SCROLLING!",2,0,30.17.0.100,2025-09-20 09:05:18,30.17.0.100
aed0ff82-915e-4076-9e8f-3a4b70a06032,nik gare,"Vermeiden, da Amazon sich nicht an deutsches Recht hält und die zweijährige Gewährleistung nicht einhält",1,0,30.17.0.100,2025-09-20 08:55:45,30.17.0.100
1be8b7fa-a73c-4f74-8b46-17e65434e31c,Michael Sommer,Great,5,0,30.17.0.100,2025-09-20 08:27:10,30.17.0.100
