reviewId,userName,content,score,thumbsUpCount,reviewCreatedVersion,at,appVersion
bf3d4135-45a1-44b1-ac3d-3f8fad62714f,Mitesh Parmar,Up until the recent update everything was fine. New layout is something I'll have to get used to but when I'm trying to pre order something now it's takes me directly to my trolley and it's not even added to it. Tried with different items for pre order and getting the same result... It's clearly broken,3,126,22.5.0.100,2021-03-03 07:40:52,22.5.0.100
7d2f042c-0813-4460-b5df-2392f3d3adf7,W. Hysell,"App constantly fails to render (tested on Pixel 3XL and Pixel 5), and also does not seem to trigger a crash report. This occurs through device restarts, and happens regardless of how the app is opened (via URL or directly). Clearing Cache and/or Data does not resolve the issue.",2,2,22.6.0.100,2021-03-22 19:46:23,22.6.0.100
607ce6b6-b6bc-48c1-9b70-0e127cedba3a,Shark Man,"For better or worse, modern shopping has evolved to mostly online. For us, Amazon is the most cost effective, and easiest to use. The ability to include your entire family under the Prime benefits makes Amazon a good fit.",5,2,22.5.0.100,2021-03-05 18:12:41,22.5.0.100
990cc00c-e078-401b-96f9-a1d2cdfb67bf,Stacy Folger,"I absolutely love shopping on Amazon. They have every thing you could possibly imagine. They have a ton of brands, prices to fit every ones budget,fast shipping and easy no hassle returns.",5,2,22.6.0.100,2021-03-23 08:45:01,22.6.0.100
f40a25eb-cf8c-4ca3-ac17-203d5f46332a,Kurama Uzumaki,"Amazon clearly is above the rest when it comes to not only shopping convenience, but also in customer service transparency. I'm impressed that even with 3rd party businesses, should something go wrong, their entire team mostly seem to provide the same kind & understanding response. Thank you! - lifetime customer.",5,3,22.5.0.100,2021-03-07 19:05:48,22.5.0.100
7857a748-a377-46f2-a423-2c9b4575dd7b,Roxanne Benitez,"I love Amazon but becareful buying knock off items. I've bought sd cards and they've corrupted my photos and videos. I can never get those memories back. Still great app to buy gifts for Christmas and birthdays for a adequate price. It's very dangerous though I find myself buying items I really don't need. It's like going to the market when you hungry, you go for a few items and leave with the whole store.",5,1,22.5.0.100,2021-03-10 21:40:15,22.5.0.100
6f1bb2f3-f6e4-4c57-a4b4-038a7654460f,Jody Roman,"App has been crashing since yesterday. I've tried to Uninstaller, re install, restart my phone, optimize phone. Nothing helps. I'm normally a huge amazon shopper. May have to cancel subscription if it doesn't stop crashing on my phone.",1,2,22.6.0.100,2021-03-23 06:59:12,22.6.0.100
d222e479-6f6c-4989-9f26-aa2272b7ed36,Loriann Garcia,"Amazon prime is a must, great benefits! Delivery is great! My only complaint would be customer service regarding the wrong card being charged for the annual fee and not being able to correct it and get a refund.",5,6,22.5.0.100,2021-03-14 20:35:44,22.5.0.100
707b270a-593e-4d63-99cc-91ba8b9e4e05,Bob Collier,"I love the variety and when you do purchase, the fact that you can see exactly where your order is on the map is great. The prompt one day delivery service is fantastic and almost always delivered the next day. I have had to return goods and it's never been a hassle as with other online retailers. I would definitely recommend.",5,2,22.6.0.100,2021-03-30 16:31:07,22.6.0.100
f48294b8-b5a6-4cc8-a5f2-d9ba21747703,David Trainor,Nearly always a flawless experience when using Amazon products and services. I've always been happy with my deliveries and to the best of my knowledge I have thankfully never had reason to complain. Good app and I love the new icon.,5,7,22.5.0.100,2021-03-06 17:54:27,22.5.0.100
b9724a1e-a706-49e3-93ec-d69294e710ad,Michael Edwards,"Excellent, but they have stopped me for putting my reviews on. I have asked them so many times why they have done it and they told me I have been advertising and misusing the app which is rubbish. I have been putting reviews on for years and now they stop me. Don't understand the person that makes the decisions. And when you contact customer services about this they contact the department but you never hear back.",3,1,22.6.0.100,2021-03-21 21:30:54,22.6.0.100
a926d8bb-574a-4f01-9698-de1cc4e2c6e2,Action See,"Like others have reported, latest app constantly crashes. Clearing cache & data will allow the app to open once. Same effect as uninstalling and reinstalling app, but will fail to open again after running the app once using the troubleshooting above.",1,2,22.6.0.100,2021-03-23 16:36:35,22.6.0.100
14c0d07d-34ce-4c5d-95b2-cebf047c989c,Fernando Campos,"I would give this app a 5 star rating but all of a sudden, the application simply doesn't open anymore. It crashes even though I've Un installed it and re-downloaded the application. Now I can't open it!!! Amazon, please assist with this as soon as possible.",4,2,22.6.0.100,2021-03-23 04:27:53,22.6.0.100
1bc95b2d-4b57-44ae-8697-5a40c74b72f4,Mike Persin,"Never ordering from Amazon again. I clearly indicate it in my instructions to NOT deliver to back door. I even have a note on the back door to deliver it to the front door. The past 4 or 5 orders the Amazon delivery drivers ignored this simple instruction. I literally cannot open that back door, so I'd have to walk around my apartment to get to the package. I even had a driver with the audacity to step over 4 feet of snow to leave the package at the incorrect door!",2,17,20.22.4.100,2021-03-13 19:28:13,20.22.4.100
7567afbd-ad04-4946-9540-300e6110be49,Ann Pejsa,Love this app.🏆 It's so easy to use and navigate. One of my favorite parts is being able to hold items in my cart until I'm ready to buy. I call it my window shopping 😄😉Amazon will even let me know when something for that item has changed.👍Awesome,4,5,22.5.0.100,2021-03-10 18:28:49,22.5.0.100
c2b59aa3-4314-42d0-a0fa-9b8efd698e21,Turtwig YT,"Can't beat Amazon. Customer service is the best, has the fastest free shipping, has a ton of extras with prime like twitch, free cloud upload, Amazon video, etc. Amazon also has the widest selection of items PERIOD. Taking all of this into consideration, Amazon is amazing for consumers but very bad for other businesses. No one and I mean NO ONE can compete. We'll be an Amazon ruled world in 20 years.",4,2,20.22.4.100,2021-03-03 08:16:40,20.22.4.100
68fb8e2e-be5d-4745-aee8-beadb20e516c,sethnana (nana),"I'm not crazy about the new interface. The previous one was much easier to use 😣 Don't bother calling Amazon, because nobody there uses the app. They use a computer. Having said that, I love Amazon. Please give us back the previous one!",2,2,22.5.0.100,2021-03-19 07:04:19,22.5.0.100
4fd3c430-e736-42e5-9784-868d04300b23,Ian Tomlinson,"Broken by the latest Android Samsung Galaxy firmware update, it simply will not open and just crashes. Was my go to shopping app as well. I'm going to give it a few weeks for updates then I'll try again as I really don't want to have to do a factory reset of my phone again.",1,2,22.5.0.100,2021-03-23 08:11:10,22.5.0.100
1149beab-286b-4f94-8e43-b51da7db2154,Tinna Wilson of N2 The Afterlife,"I love Amazon! It's very user friendly, and very easy to work. The deliveries could be faster on some things. Over all I have has nothing but great service in the last 5 years! I highly recommend people use Amazon.",5,7,22.6.0.100,2021-03-21 18:23:04,22.6.0.100
96d9796a-a4a8-4227-8870-b817742df8b1,Danielle Johnson,"Like most people, I love Amazon. Being an Amazon Prime member is worth it. Faster shipping, cheaper prices in some instances. You can definitely find just about anything on the website. Be sure you check the size charts on clothing, not everything comes from your country. Checkout is quick and wonderful.",4,21,22.4.0.100,2021-03-06 16:36:14,22.4.0.100
ed39d8cf-b054-4d2d-8323-bb20f05c22cd,Jane Yu,"I always enjoy shopping at Amazon, except for one time that I bought an electronic blanket for my sister as a gift, Amazon made a mistake and shipped a construction tool to her! A surprise turned to a trouble, my sister needed to drop off the wrong item to me for return, and I had to reorder the blanket and ship to myself first, because I didn't want to cause anymore trouble to the gift receiver....",4,5,22.6.0.100,2021-03-23 11:53:30,22.6.0.100
94aef7b1-19bd-49fe-905f-4d17d86f5920,Edgar Guerrero,"searching on this app is terrible, many times the top results are product that are ether counterfeit or false advertising. it takes a long time to check to make sure that the product and seller is legit. one mayor problem is that items labelled as prime are also priced higher by about $10 than normal on other sites which gives the impression that 2day shipping is not actually covered by prime membership you really just end up paying more for faster shipping",1,0,22.6.0.100,2021-03-21 23:12:29,22.6.0.100
61db315d-94ea-4a09-8267-99a868b7d66d,Christopher Perkin,"amazon is the best place to find so much in one place. but be careful what you order. there are so many knock off items on there. I bought so many things expecting good quality, only to be sent shoddy second rate items made overseas cheaply. always check the supplier!!!! can't stress that enough!!!!",3,3,22.6.0.100,2021-03-20 07:55:31,22.6.0.100
7adcf09d-b28e-40cc-9698-364156527233,Ell Coulber,I've been using this app a couple of years now. I especially like that I can wake up with a shopping list on my mind at 3am and can put said items in my shopping cart without having to go to my laptop hours later. It is quite handy and simple to use.,5,1,22.6.0.100,2021-03-24 19:53:00,22.6.0.100
2eea6940-d4e3-44c2-b6cf-0fcd8bcdb22a,Blake O'Brien,"After factory wiping my phone due to a virus, the app is requiring me to verify my account via a link sent by text. This would be fine, but the link does not function; I receive the error message ""the web address you entered is not a functioning page on our site."" Thinking of doing all my shopping on ebay from this point.",1,1,22.6.0.100,2021-03-28 17:33:31,22.6.0.100
ed7b1eee-8216-4370-aaf3-917e44089146,Holly Wilkinson,"Normally, this is my go-to app for practically everything that I buy. After this last update though, this app along with a couple others, keeps crashing or just refusing to open at all. Its super annoying and I hope they fix this QUICK:/",3,2,22.6.0.100,2021-03-23 03:29:36,22.6.0.100
60921aa4-9b63-4597-8d42-1ab1f952210a,Meghan Anderson,"I've ordered items tried getting on to see where my order was and now it wont even pull the app up it comes up as a white screen for a couple seconds, and then completely vanishes, very irritating I can not get on the app what so ever, paying for something I can't use and cant even get into the app to cancel it b.s",1,1,22.6.0.100,2021-03-23 18:44:40,22.6.0.100
d2d89cd6-2fd3-4ffe-8b37-b578d1eb67c6,Okinawa Faa,"I have had a great experience with them . They have followed my delivery instructions. I've only had to return one order & great options they have on how wish you refund to be. Give it a shot, that's all you can do . :) HAPPY SHOPPING.",5,4,22.4.0.100,2021-03-02 22:13:04,22.4.0.100
81f132f7-3724-40a3-94d6-bcd592c39e37,Omer Alvi,"Is it me or is the app crashing as soon as it is opened? I noticed it happening today as I've opened it after a few days now. My samsung galaxy s20 ultra had a software update today. I opened the app, it showed a white screen for 2 seconds and back to the list of apps. I uninstalled the app and reinstalled it, it worked for a while. I just tried openning the app again and it started doing the whole white screen then crash... what sorcery is this? Anyone else has this issue?",2,10,22.6.0.100,2021-03-24 04:52:51,22.6.0.100
e52e8c0e-1dbc-46a4-bb34-5490e7cd8329,fadzreen mohamad,"I've made an order since january this year but the item until now still not arrive...the best part is, they're giving fake tracking id.... try to contact seller for the tracking id several time but the instant messaging system is not helping at all...now try to make refund still no answer from both amazon or the seller . In summary, SHITTIEST APP EVER USED",1,4,22.5.0.100,2021-03-10 13:50:14,22.5.0.100
c70622bc-5eb1-4fb5-9feb-1ef1c367b9ee,L. D.,"Personally, I hate the Amazon locker system. Never agreed to it and I hate the fact that when something gets delivered and put inside I have to wait for, MAYBE, an email to pop in that'll have my code to open the locker instead of just being able to find it under the delivered item(s) details.",1,1,22.6.0.100,2021-03-28 20:58:41,22.6.0.100
7bf2e535-1650-40a7-8755-7af6eeb98e47,Kelley Stanley,"I do any and all friend and family shopping through Amazon, all of my personal shopping as well. Mainly due to the fact that if anything, and I literally mean ANYTHING, messes up with your order Amazon will immediately step in and figure it out. Resolving matters quickly with both parties pleased. I have zero worry about the products I buy. Many thanks Amazon!! Kelley",5,11,22.6.0.100,2021-03-20 17:36:03,22.6.0.100
aa383e40-6085-41e9-a8a3-2c0fc23fb199,Ashley R,"I've never had issues when using this app or even shopping with Amazon in general. the few occasions where I've had something I wasn't happy with etc, their customer service went above and beyond to make it right.",5,2,22.5.0.100,2021-03-14 03:46:27,22.5.0.100
f3ae57b1-8845-4e31-a1de-c8c04bdefccf,Empress Love,"I use to get my things when I was told I would. Now I am getting notifications that my things are delivered and they're not. Also lately I select something that I want then within a few hours to a few days if still in my to order list, I will get notice that the price has changed and for the most part it's higher.",2,3,22.6.0.100,2021-03-23 20:59:50,22.6.0.100
cbb5e110-1b9a-4293-8c46-8f25c164bbab,Jennifer Smith,I've used this app for many years now. In fact I use it every day! Almost everything I buy now a days I buy off Amazon but since the most recent update I can no longer use the app!! Every time I open it the app closes. Im very dissapointed. Please fix this so I can continue to use the app! Id rather not cancel my prime & subscriptions.,1,125,22.6.0.100,2021-03-23 00:56:06,22.6.0.100
1d4547e5-4896-400f-82fe-7d9b34c7ed43,Heather Kimble,I really do enjoy using this app. Its easy to use and search for many items. However I do not like that it says my package was delivered to my door but sometimes that's a lie and i should wait 2 more days to see if it shows up. Please stop updating the status as delivered if this is not the case,4,7,22.5.0.100,2021-03-14 23:41:32,22.5.0.100
beb0c64b-9455-4946-b4cb-37e42243581e,Crystal Orasco,it's pretty good inconvenient for me and my family we're not too far from the facilities so it's 99.9% of time either early or or when they say it is but I get kind of frustrated when I get promo codes or keep on stuff and they don't work I have kids and I have a new foster kid so I have to use this a lot and it really helps to save on every little thing you can and I wish there was more programs to save when you're in different situations like I am but overall I loveAmazon community influencers,4,1,22.6.0.100,2021-03-29 16:05:13,22.6.0.100
f701d2c2-deae-4ee7-97c6-593f511edddb,Carei Medeiros,Best shopping experience ever! I use this at least 3 to 4 times a week if not more! Even have groceries delivered from Fresh without the upcharge that other sites have. Absolutely love it and recommend it to anyone that looks for convenience!,5,0,22.6.0.100,2021-03-28 08:25:47,22.6.0.100
c7098725-186c-45e8-b956-28a871291059,Nicolas Saez,"I never had any problem while shopping with Amazon. Great prices, free return and instant refund. If you have any problem with the delivery, they refund you easily (a bit too easily ahah). Everything is made to satisfy the customer",5,3,22.4.0.100,2021-03-02 17:26:47,22.4.0.100
8d8423d1-1c90-4f11-b041-b7fd261f0599,MyPammer,"It's usually pretty user friendly, however, it tends to put It's picks at the top of the list leaving what you actually want lower down. also pictures are sometimes false representations of what you get.",4,1,22.4.0.100,2021-03-01 22:24:28,22.4.0.100
9b2e7c24-cc33-4fa7-aca8-c7bc8ebe476c,Thad B.,"I add a vehicle for what I'm searching for, specifically searching for parts, it shows results for other cars but for the one I put in my search criteria. I select the year make and model of the car, shows up things not for my car.",1,1,22.5.0.100,2021-03-07 00:13:13,22.5.0.100
e7ed0fbc-cba9-44e1-b4bc-ed8737bd6129,Alonzo Francis,"I been shopping with Amazon for about 2 years now! No matter what I need Amazon has it. If all the items were free Amazon would be a Magic Jeannie in the bottle? As far as shipping I only I had one problem. It said, my package was delivered at 1:30 am! I never received the package. Amazon gave me a 100% refund! Usually from when I completed my payment at checkout, my packages usually takes around 5 days to get to my house. I am 💯% satisfied with Amazon! I can go shopping for whatever I want!!!",5,161,22.7.0.100,2021-03-31 00:57:05,22.7.0.100
be562df9-7f39-43ac-b361-594ffa8abb4c,Raven Slack,"It makes links open in the app but usually they won't open at all, just sits there with the app half open (can only the the bar at the top of the so while still seeing the website where I clicked the link on most of the screen....... so i can't view what I wanted to see",1,1,22.5.0.100,2021-03-13 16:51:58,22.5.0.100
53085a50-6659-4f02-b886-00083b1678f5,Rebecca Black,"I absolutely LOVE Amazon!! Once you learn how to navigate thru it, you can find so many awesome deals!! I pretty much do all of my ""extras"" shopping on Amazon. And there are so many ways available that you can earn gift cards...you practically get to shop for free! 5 stars all around.",5,17,22.5.0.100,2021-03-22 19:12:21,22.5.0.100
8abc6254-d3a7-44a5-b521-5e8969b59f47,Shoham Ben Shitrit,"I don't know if it's just a version in my country or something, but I had the most impossible experience, when searching for the things I've wanted, no option to see all departments / all catgeroies in a department, how am I suppose to filter? Very disappointed.",1,0,,2021-03-04 10:59:30,
6d006ec9-94c8-4a5a-8d50-281dbb4f2c31,claudia hawkins,"I can't get my password to work and I haven't been able to use the TV program let alone anything else and now I got this program asking for my password and I can't talk to anybody about it so I would like to cancel all of it. I'm not good at this computer stuff a little help, helps a lot, a human helps me even more",1,1,22.6.0.100,2021-03-30 18:37:54,22.6.0.100
5e272d31-92ea-47f2-9592-e0487c575948,holle walker,I've had this app for a couple years but after this last update it's horrible and will probably go back to desktop. It crashes fails to load pictures and currently I can't open the app at all,2,0,22.6.0.100,2021-03-23 04:27:04,22.6.0.100
9ac85072-b45c-4560-b043-84ac1f24aa78,Renee and Lucas Lierman,"I use to Love Amazon but, since they no longer deliver 2 days after ordering with having Amazon Prime membership. Its disappointing! And rarely do they offer digital dollars like they use to has changed my opinion of them. They aren't so great anymore!",2,0,22.5.0.100,2021-03-17 04:04:52,22.5.0.100
a7d6cfc1-57c5-4803-9b03-04f0b6e260d6,DirtyNut,"IOS apps are always more polished, the android version still isn't using the new Amazon logo. Developers pick Apple over Android even though most of Amazon's devices are android based. They finally updated the android app icon to match the IOS version, so I upped my rating",3,0,,2021-03-03 21:21:15,
fd64b57b-400e-41c0-9b1d-4a971b66e1e5,Peggy Dutton,All of a sudden on my order history I can only see certain things not all my history is available very disappointing. Not to mention a recent order where I ordered a CD and I was sent the wrong one and the seller would not refund my money nor want to hear that they got the order wrong,1,1,22.6.0.100,2021-03-23 00:43:54,22.6.0.100
c79a81cd-9d4c-4878-99a0-35fa6fea410f,Apple Barnes,"Amazon is my favorite way to shop. Its so easy to find exactly what I want or need and its shipped right to my door. Being a mother of 5 with my youngest being only 3 months old, its hard going to the store. Also with kids money is tight so the deals Amazon offers is a live saver. Thank you Amazon for everything.",5,15,22.5.0.100,2021-03-04 16:44:27,22.5.0.100
68602d83-6563-4891-8695-d55e49b37436,Laura Rojas,"I have never known a better customer service than Amazon's. I love its customer oriented policies, the diversity of its products and how easy is to return something and get your money back, if need it. I will never stop recommending Amazon to everyone",5,1,22.5.0.100,2021-03-11 02:33:34,22.5.0.100
1f3e43f7-8d74-4ec1-8312-569a58194a14,Zach Pearce,"Great app that is easy to use, on top of that, being a Prime member definitely has it's perks. And to any small businesses or individuals struggling to make it right now, look into the different platform(s) that Amazon provides for ""the small guys!"" You will be surprised when you figure out what you're able to do on Amazon in regards to making money. So take advantage of the opportunities and resources provided. And no, I don't work for nor am I getting paid by Amazon. lol",5,20,22.4.0.100,2021-03-22 11:42:35,22.4.0.100
7a69d869-9bb9-4e54-878b-9c3a06fe462f,Gonçalo Pinto,"Brexit messed everything up. Ended my subscription for Amazon UK due to customs charges. Other markets don't look that strong, so, will be purchasing less than before, unfortunatelly. Once we get a good and reliable solutiom, I'll sign-up again",5,1,22.5.0.100,2021-03-03 21:16:32,22.5.0.100
176a9579-1fbf-4eed-aa99-38ce137d36d2,Carlos Lopez,"very convenient when you can't go out and shop. possibly one of the best way to avoid contact and being safe. If you have Amazon prime, you can get your items the next day or the next 2-3 days. where if you get it at a local store it would take 3 to 5 days or more depending where is the location of the store. I recommend getting this app and getting prime. it's worth every penny.",5,20,22.6.0.100,2021-03-20 14:00:46,22.6.0.100
c4e0fc9a-becb-4583-bd43-7b37acb9f466,Scott Scarberry,"I have been a prime member for a very long time and order from Amazon atleast once a week and I am always pleased with my orders and delivery times. The few times that there has been ANY issue with an order, Amazon has immediately taken care of the issue and has awesome customer service!",5,2,22.6.0.100,2021-03-25 17:58:03,22.6.0.100
148b99df-54b5-4eb6-89f7-7b1830001294,Wil maximo Ramirez,Amazon Prime is the most convenient way to shop for anything really. I love the reliability and the customer services are also amazing. Amazon is the best we are lucky to have Amazon period.,5,2,22.5.0.100,2021-03-08 03:21:05,22.5.0.100
59cb3473-408e-4b5c-8526-b414e53cab8c,Suriya Farrow-Harris,"I love shopping on Amazon. The only thing that could make my rating better is if they bring back the convenience ""Buy Now"" option on products. It seems to have been removed in a recent update, but it was extremely useful",4,1,22.5.0.100,2021-03-03 13:05:01,22.5.0.100
5069fca7-f0a7-4c03-88cc-095aebf4464e,Will Russell,"Unusable. ""An Error occurred"" and a sad dog. Can't use the app. Tried clearing cache, clearing data, reinstalling... Nothing. Just a dog that tries to send me back to the home page which fails again with a different dog.",1,4,22.5.0.100,2021-03-15 09:18:26,22.5.0.100
ac95fa2a-ee16-4fb1-a7c3-db82e629dde1,Jo Alexander,"I used to love this app, it was easy and quick. They have changed something and now it's slow and cumbersome. Often it does not open properly and I lose the search area. Very disappointing.",2,1,20.22.0.100,2021-03-16 16:31:01,20.22.0.100
de845a48-b0bd-47d1-8969-84bc682bf90a,Justin Rich,"I use amazon for everything you cannot find at the grocery store. Only issue I occasionally have, and its more Amazon's issue then the app, is sometimes I can't have things delivered to my PO Box or the Amazon drop off.",4,0,22.4.0.100,2021-03-03 17:22:08,22.4.0.100
cb93f7c8-3e11-42a1-a345-4cd34fc39717,Derrick Way,"it's always a work in progress, just no complaints right now. I still get everything - pretty much on time. most the time they have everything I'm looking for, not always the same price but it seems that you can get it a day or two sooner than most places. I guess that makes up for it.",4,4,22.6.0.100,2021-03-19 20:47:53,22.6.0.100
d3d85452-3039-4064-826f-916916f356a9,Susana Herrera,It was all good till yesterday. It doesn't want to open at all I thought it was my phone but after restarting it multiple times it keeps doing the same thing. The app opens for a Brief second and closes.,3,1,22.6.0.100,2021-03-23 14:32:13,22.6.0.100
cf6d8044-4abe-4164-a318-ff27a2f07505,Lila Daily,Can almost always find the random thing I am looking for or something very similar. If I had any issue with a purchase they have always been super helpful and fast at getting me my refunds or exchanges. Some days would be unbearable if I didnt have this service!,4,2,22.6.0.100,2021-03-27 23:21:06,22.6.0.100
a14423ae-0ac1-4066-977d-d28a8e5d7632,Kandy Milliner,"Thankfully, I've not been disappointed yet! Even when I ordered a product from someone & it was damaged, the seller was easy to deal with. I was able to return the product for a full refund. They even paid shipping fees.",5,1,22.6.0.100,2021-03-22 17:41:41,22.6.0.100
7057c4c2-073a-4017-a9b1-8140b4487542,Ben Saich,"App is fast and functional. Sometimes links from external sources don't open in the app, which is annoying because I enjoy using the app over Amazon on mobile browser.",4,0,22.5.0.100,2021-03-14 03:53:51,22.5.0.100
