reviewId,userName,content,score,thumbsUpCount,reviewCreatedVersion,at,appVersion
e9958d2f-f345-44e3-adaf-7e46ea1edb70,andy s,can't beat Amazon and prime. I try to shop local but almost all the time Amazon is better value and cheaper. wish I was as Jeff bezos. 😂,5,1,22.5.0.100,2021-03-08 19:15:10,22.5.0.100
63978d8b-792b-4e12-95ec-6cd12282a0aa,Roneika Williams,I love the Amazon app its convenience is always best for me bc I can find everything I want at a lower cost.,5,0,22.4.0.100,2021-03-04 17:58:44,22.4.0.100
8a6d6727-7b04-4756-a704-2797b0f43d2f,Adrian Nieves,It gliches so much!!! The app was perfect why the usless update?? One step foward 10 steps backwards is the motto for this new update. Usless.,1,0,22.5.0.100,2021-03-14 05:21:25,22.5.0.100
4cefea00-cb3e-4058-b035-445472b8623b,Regina G,Now the app constantly closes. I can't view any items. It keeps going back to the main page.,2,1,22.6.0.100,2021-03-18 03:20:51,22.6.0.100
9eb609b2-f0b8-418c-b1ed-4dfda0383110,Danny Thomas,I buy a lot on Amazon. it is nice to be able to shop and keep up with orders and tracking.,5,1,22.5.0.100,2021-03-07 15:12:41,22.5.0.100
37b8741a-cbe1-4b3f-bf34-f179846de4cf,Katrina Maynard,The new update has major glitches. It keeps saying my packages are being delivered the day of and it still intrinsite from states away,2,0,22.5.0.100,2021-03-12 00:43:21,22.5.0.100
54e4ad23-9307-486a-9419-1a89958d04cd,Khan AQSA,"This new update is horrible, when I go back to list the screen is white not showing the list of products.",1,1,,2021-03-29 07:01:23,
16ef077f-f0d0-4d1b-92c3-7dfb933e3677,Gavin Gaynair,"Amazon is too amazing. It's like the Home Shopping Network, but where you can find things you actually need.",5,1,22.5.0.100,2021-03-05 22:28:12,22.5.0.100
bc047ad4-3034-417b-b4bf-dea96f112396,J Salzer,easy and quick. prices a little higher them traditional stores but worth the time.,4,1,22.5.0.100,2021-03-07 04:31:08,22.5.0.100
998cc95d-276e-4748-bea7-20c07c282f22,Michael Rodgers,absolutely love amazon. I find it easy to use and cheaper to shop for most items than other places being a prime member.,5,0,22.4.0.100,2021-03-01 04:51:42,22.4.0.100
6e9d8a33-4904-4c3d-bc06-56a7567b8941,Paige Fregoso,I love all the cool lightning deals. They have amazing products for affordable prices! I love Amazon shopping!,5,1,22.5.0.100,2021-03-18 02:57:56,22.5.0.100
a8282c80-4d44-4c42-998a-53b4734fc94f,David Anderson,With prime how can you resist getting a little something delivered. Anything is better than getting a bill in the mail.,5,1,22.6.0.100,2021-03-23 00:46:25,22.6.0.100
0535bb80-2f7b-4846-bfb1-703d4b830aca,Louise Balshaw,"Since update, it won't let me open the app. The screen is blank and it just closes.",1,1,22.6.0.100,2021-03-23 07:56:17,22.6.0.100
44d946d6-b5a2-432f-aca0-a0e9c1a74177,MrKhaleeb,"In this day and age, using this app is almost always the best and fastest option, especially if you have a busy life where you need to order stuff on a daily or weekly basis.",5,0,22.6.0.100,2021-03-31 04:13:48,22.6.0.100
5bcfb1d5-ded9-466a-bcd1-237e33ef1b69,Joshua R,I will never use Amazon again! The last two packages I ordered were delivered to the wrong address and signed for by someone I don't know. Never again!,1,0,22.2.0.100,2021-03-01 23:30:33,22.2.0.100
abd4bead-1470-4b78-9e2f-1a9720f7fd0e,Kathy Mason,"Amazon is awesome. I am always finding incredible deals, great finds, and new ""stuff"" that I never knew I needed...",5,0,22.6.0.100,2021-03-31 01:50:18,22.6.0.100
d3421181-8873-4ce7-b7c2-51ae054507ae,charles israel,it was all good until i got to check out and they try to get you to do Amazon prime and showing everything else in small print.,4,0,22.6.0.100,2021-03-19 14:02:23,22.6.0.100
ff2c1e2b-6f6f-493a-9be4-98ae8f6108b4,Gabriel Kaufman,"Convenient app but glitchy at times, especially around checkout. Be sure to review your shipping options.",3,1,22.6.0.100,2021-03-26 11:45:32,22.6.0.100
2e20f55b-743c-4f5f-ba60-21d269766ace,Eve Melendez,Excellent sales and services. Amazon meets all your shopping needs. I highly recomment.,5,1,22.1.0.100,2021-03-07 05:24:29,22.1.0.100
734c3a05-50db-4066-87cd-54c3b9785fe3,Laura Tifra,"Good experience so far, for delivery and products. Also good experience with returns.",5,2,22.5.0.100,2021-03-17 20:12:49,22.5.0.100
88f4ad02-28ad-401a-8594-a8a4ea8d1662,Sean Plant,"Was a good app before it went ""woke"" and now bans books and conservative documentaries and commentators such as Parler. Digital form of book burning.Canceling my subscription.",1,0,,2021-03-05 23:16:58,
6a59baf0-515b-44dc-9a7b-a52a3ea6fcdd,Barry Height,New update won't let me pre-order items. Now I have to shop through a web browser. I will reinstall once it is fixed,1,0,20.4.2.100,2021-03-05 13:51:09,20.4.2.100
60fe7e10-eefb-4755-bbe5-7078c6fc7f88,Jeremy Horton,Since last Android update (3/21) it crashes constantly and you have to uninstall/ reinstall over and over.,1,0,22.6.0.100,2021-03-23 10:24:24,22.6.0.100
e13e834a-4dfc-414a-8581-f8700427244e,Dusk Omega,"best online shopping by far. forget alibaba, forget wish, forget every other commercial online store you goto. Amazon will soon hold monopoly, and for good reason.",5,0,22.4.0.100,2021-03-04 12:55:20,22.4.0.100
869abb9e-9a4c-477a-8f00-ffbe40e35961,m p,"convenient shopping right from home, and usally cheaper then going to the stores and so much better then waiting in long lines",5,1,22.5.0.100,2021-03-11 13:23:35,22.5.0.100
3d171e52-8e04-4f56-b39a-90a4a59b2e0c,Tessa,"Keeps crashing, since the last update my app won't load, it opens and then immediately crashes",1,0,22.6.0.100,2021-03-23 09:44:06,22.6.0.100
af63e53f-fa5c-4be8-ae16-b34de7c5e121,Renee Womack,"I never got the items I ordered When the Amazon driver got my package from his van , the shipping packaging was open on one end, and it was empty with no items in it The driver said he would log it in my package was empty and I didn't except the delivery Then I get an email saying my package was delivered The driver is lieing about making the delivery and also there are two (2) witnesses that will give statements that the Amazon driver never left the package Does Amazon encourage lieing",1,1,22.6.0.100,2021-03-18 11:32:21,22.6.0.100
1639449c-7d10-4aa6-8c61-cac042ddabec,Ed “Mike Honcho”,"necessary evil, app works.. don't much care for silencing free speech tho.. hope they can learn from their mistakes they're actions make them seem drunk on power. it's a shame too cause I really liked shopping there..",1,0,22.5.0.100,2021-03-10 22:01:13,22.5.0.100
bb418e76-9c0c-4939-b534-a07a5b7bba79,Kenge T,"Great customer service, Quick shipping, great prices, easy browsing.. Would rate 6 stars if i could. #Jeff",5,0,22.5.0.100,2021-03-08 19:30:10,22.5.0.100
5dc2c833-2ca9-45d7-9fd6-65aa77cdcc3e,bokuma ebengo,it is easier and quicker to order staffs. Delivery service also it is perfect. 😊,5,0,22.4.0.100,2021-03-04 10:51:12,22.4.0.100
6d83178b-fe0e-49d7-baa3-b5d3c0817fcc,helen matchem,I love Amazon its by far the best online shopping app ever. I will continue to buy my products from Amazon. thanks Amazon!!!,5,0,22.4.0.100,2021-03-04 04:18:33,22.4.0.100
e61cadb5-f5ae-41cf-b90d-ea73fe231538,Richelle Irving,"I love shopping on Amazon. they treat me well, and always answer questions and fix errors quickly for me.",5,1,22.6.0.100,2021-03-29 20:37:32,22.6.0.100
7bc14d6f-3c5a-4300-b11a-f5e01e8f48bc,Angie Muller,inline the simplicity and ease of Amazon. I can always find what I want!,5,1,22.5.0.100,2021-03-05 19:53:47,22.5.0.100
8d2f5446-8bd1-42ed-b60c-78f18c7a6617,David Hoye,Easiest way to get the best price on everything you need.... We love the free shipping...delivered right to your door!,5,1,22.6.0.100,2021-03-18 13:13:33,22.6.0.100
6585b0f0-557e-4c52-9741-08da7d3d05c6,Gregory M. Piper,"Freezes my phone whenever I try to use it, and can't be uninstalled for some reason. Unacceptable.",1,0,,2021-03-14 15:07:52,
28bc2569-943d-4e21-af60-f49e0854cee8,Mark King,Needs a text zoom feature. Also when i search for branded products I get off brand garbage pushed to the top of the list.,3,0,22.5.0.100,2021-03-04 17:41:09,22.5.0.100
962bbba2-78cd-4753-a9cf-3b3366bb77ea,DOLLY KSR,I have been using this app for a while and somehow its now not letting me open the app its just a white screen . I love this app but its bothering me i cant track my packages,3,0,22.6.0.100,2021-03-23 11:49:30,22.6.0.100
ccaff79e-e003-49af-bb5f-8f7bf22e3acb,caleb leuck,very easy to use and excellent prices! customer service is very willing to work with you when something unexpected happens.,5,0,22.6.0.100,2021-03-25 17:30:36,22.6.0.100
058a0b5b-25bc-4db3-98cc-8734229459c2,Elizabeth Cardenas,Love how simple you are able to navigate through the app & able find the things your looking for.,5,1,22.5.0.100,2021-03-20 20:41:44,22.5.0.100
4814609d-52c8-499e-b45f-10660b8cb4b3,J. Call,Easy to navigate and easy to use. Customer service is always easy to get ahold of as well.,5,1,22.5.0.100,2021-03-10 14:42:57,22.5.0.100
f39ccc1b-00c2-4ebc-a3a4-667abdf66399,Yvonne Boyd,"Always have the best experience when shopping, purchasing and delivery of my items!",5,1,22.5.0.100,2021-03-16 17:28:12,22.5.0.100
3b186389-48ac-484a-8aea-9c289f9eb5c7,Melissa Rawlins,I love shopping on Amazon! It is simple and affordable. I really appreciate being able to read reviews from verified purchasers.,5,1,22.6.0.100,2021-03-18 05:01:01,22.6.0.100
3238380b-84c6-43ef-8e44-98e18451a3a3,Lawrence Chand,"Please fix the glitch, I can't even open the app anymore.... well there goes a possible transaction.",3,1,22.6.0.100,2021-03-23 03:53:31,22.6.0.100
4ae84492-843e-4552-b0cf-33edca1d98cb,Anthony Dellacroce,"The new update sucks badly... doesn't load, and shows up like old dial-up internet! Please fix this amazon!",1,0,22.5.0.100,2021-03-06 00:17:20,22.5.0.100
c39ac7ec-511d-4f7a-9221-dc300c4a49af,Rinita,"After the last update, app stops working and shuts itself down. Sad.",1,0,22.6.0.100,2021-03-23 02:10:55,22.6.0.100
5d5693fa-611d-463c-9592-73b0901bc1f3,Latisha Wallace,"I agree that this recent update is glitchy! I love the new brand look, but I want the old app consistently back !",3,0,22.6.0.100,2021-03-23 02:25:59,22.6.0.100
bb40bb56-4493-46ef-98f5-dd1081d8a70f,Renee Moore,I love shopping at Amazon because of the price and never have a problem sending it back if you're not a satisfied.,5,0,22.4.0.100,2021-03-07 01:32:23,22.4.0.100
f18c484c-4da3-43cf-883a-62ba80a1f0f6,Randy Arnett,It's a decent app but they really need to work on their subscribe and save workflow.,4,0,22.6.0.100,2021-03-22 21:47:35,22.6.0.100
1bb7e858-95d0-4e97-8425-8d9fd1c64361,Sharon Hines,great shopping experience and prices are affordable and reasonable..and as a Amazon prime member my orders arrives quickly in one or two days in which I am happy,5,1,22.5.0.100,2021-03-18 06:28:06,22.5.0.100
93960ef0-14fb-417c-bde4-2c2f60e0bf35,Arkadiusz Stanczak,"Wow shopping app that won't let you buy stuff... When you click ""see all buying options"" nothing happens. Great job.",1,1,22.5.0.100,2021-03-04 00:27:21,22.5.0.100
4c4b0413-2a59-4e64-bce9-029d845ef46d,Ratboy,Amazon does logistics right. It's handy that they also operate the world's largest marketplace to keep that logistics engine humming.,5,0,22.5.0.100,2021-03-11 23:09:46,22.5.0.100
09a0117a-f886-4243-b85e-dde1cf3500cc,Joseph Rodriguez,I love amazon who doesn't? i could look for the most common item to the weirdest and you guys have it. amazon is everything i need Amazon is number one.,5,0,22.5.0.100,2021-03-06 03:01:31,22.5.0.100
27de72b9-e5e5-4c80-92b5-2bc7d465db88,Steven Ogle,"Really like Amazon, a great company and plenty of items at such an amazing price. very happy.",5,1,22.5.0.100,2021-03-06 01:31:25,22.5.0.100
0802c6c4-5f7a-4d73-b65c-eecf66abfdcc,Marcos Ojeda,Constant crashes on Samsung Note 10+ Verizon. Unable to open app.,2,1,22.6.0.100,2021-03-23 20:20:58,22.6.0.100
2302acc3-9d11-4eaa-8fb5-6f275a26ab4c,Julie Haynes,"I love that when we are vacation, we can order something we forgot. The choices are amazing. I like shopping from my home.",4,1,22.5.0.100,2021-03-05 12:03:42,22.5.0.100
c0549df0-b765-40e8-9384-4c4e32641d3b,Ehsan Rahee,It's pretty great. The only improvement I can see being needed is having a few more niche categories.,4,1,22.5.0.100,2021-03-06 17:16:41,22.5.0.100
6e74b01e-fa8b-4ea4-8058-3d7803a9f8b0,Mark Campbell,"The Mrs is never off this app, she has constantly got parcels arriving at a rate of knots. its a good app but for the sake of your bank balance do not tell your other half you've got it.",5,0,22.4.0.100,2021-03-03 09:42:13,22.4.0.100
9c0a585d-e9be-43b0-8ea9-738ba98920e2,Hassan Ahmed,Easy to use fast delivery. You can get some good bargains. However I don't like the new app logo.,4,0,22.5.0.100,2021-03-17 09:44:21,22.5.0.100
cfc0ee75-e8f2-4924-ad0d-e1c5fee50779,Mason VanSword,"decent app, crashes sometimes and sometimes external links don't open properly in app.",4,0,22.6.0.100,2021-03-28 15:45:14,22.6.0.100
f3cee9a9-3a05-448c-955a-ee327984ba2f,RKnapp,"Cannot open the app anymore on huawei emui 10.0. Any suggestions or advice will be greatly appreciated. Before that, great app.",1,1,22.6.0.100,2021-03-23 16:10:06,22.6.0.100
c6e32776-4a24-4506-bdde-0994f61e258e,Jamie Cooke,Apps crashing but I'm having the same issue with Google and halifax app I think its the last android update not these apps themselves,1,2,22.6.0.100,2021-03-23 07:44:45,22.6.0.100
cd2d0ffd-73c3-403e-ab9a-e5efa4db5603,Karen Huneke,The only problem I had was when I ordered one thing and got another. I was going to return it But I decided to keep it and give it as a gift. They are very helpful so I continue to order.,5,0,22.6.0.100,2021-03-29 15:56:19,22.6.0.100
381c7321-3a05-46da-8878-d658a58c6558,Maesha Hubbard,"Worst shopping experience of my life. Complete rip off. I purchased a macbook pro which the order isn't even available anymore and hasn't been since amazon allowed a ""private seller to sell a defective and broken laptop for $500. And a iphone 8 I never received. Upon contacting customer service I was informed they have no control over private seller so I received a macbook dented, scratched to hell and a shattered screen and no way to fix or replace. I will NEVER NEVER shop on Amazon EVER AGAIN.",1,0,22.5.0.100,2021-03-19 03:42:22,22.5.0.100
29871596-7c9f-4d5e-8ca5-de8d3bfb8054,tina Figueroa,"my order are on time. if for some reason the order doesn't ship, I get notified and my money is returned.",5,0,22.5.0.100,2021-03-08 01:34:05,22.5.0.100
80f5e851-6687-4e14-8c45-c70d49a8b1a4,Lance Kett,They seriously got rid of the Hitler stash. Now it doesnt look cool on my phone anymore so i just downgraded the version to an old version of this app.,1,0,,2021-03-10 06:45:43,
c792056e-a992-4b33-a4c1-036d1c511504,Andrea Curtis,"One Stop Shop Amazon has it all!!! No need to shop everywhere when you can get it here expeditiously. I love Amazon, and you should you. 😍",5,0,22.4.0.100,2021-03-06 06:46:38,22.4.0.100
a33cfaa0-acca-47be-9e0c-4805d4fa8b42,Trevor Wall,Holy lord what a mixed bag... Regular Amazon purchases fine.. Whole foods orders... A damn nightmare.. Come on the old prime shopping app was better.,3,0,22.6.0.100,2021-03-19 21:58:43,22.6.0.100
ec6c82a6-457d-4ed9-b8a4-044c6549f9ba,Bill Bryant,It is the worst card I have ever bought can not call nobody can not check the amount on the card can't tell if someone used it I bought it today and the person said there ain't no money on it and I scratched the 16 digit number off my cell where the receipt,1,0,,2021-03-09 19:47:25,
9dfdfb1f-e584-4c2d-a803-df860f5d5dc4,Alysia Lajune,"App won't open. I keep getting a picture of a dog and a message saying ""Oops something went wrong."" Please fix this.",1,0,,2021-03-09 15:43:20,
533f6482-8d02-431a-b861-2c03a6fb3062,Kee Law,Very heavy on battery on my Samsung S21 Ultra. Uninstalling as no benefit over just using a web browser which is much lighter on battery,1,0,22.2.0.100,2021-03-02 01:31:35,22.2.0.100
4ed61d03-032b-43eb-be7a-bf22f9691cd9,Kimberly Anne,"Keeps crashing no matter what I do. Uninstall, reinstall, restart phone. Nothing works.",1,1,22.6.0.100,2021-03-23 17:12:49,22.6.0.100
ee5da280-d426-4f9e-ba72-8223689cae4f,Leslie Bowles,Love Amazon! Easy to use & literally have just about anything you can think of all in one place (store/site).,5,1,22.5.0.100,2021-03-06 20:00:05,22.5.0.100
e5fc6d52-4c9a-4f7d-a768-c8c052988ffb,Usiale Martins,Amazon is among one of my best shopping sites because its very easy and they offer fast delivery most especially when you have Prime account excellent quality 👌,5,1,22.5.0.100,2021-03-10 09:21:07,22.5.0.100
795846ee-562e-46a2-b8dd-70a891bcd71e,Tat,"first company to make ordering easy and secure. they were the very first, many years ago. still the only online company I order from",5,0,22.5.0.100,2021-03-04 02:05:30,22.5.0.100
c751be09-c2c9-4e6c-9637-2e8a4aa74970,Traci Spagnola - Airgood,before I get anything I check Amazon frist very fast on delivery most of the time on time with the date that they give keep up the great job Amazon employees,5,0,22.6.0.100,2021-03-26 08:23:22,22.6.0.100
3f1e789b-ecab-4e6b-8787-3cb2eb399a0a,BR00KE _Amonalisa,"As an Amazon fulfillment employee, I said ""As much as I shop here, I might as well work here""! I love shopping on the app and seeing all the many packages come to our door.",5,0,22.4.0.100,2021-03-02 20:32:07,22.4.0.100
639c0d4d-4391-4b4c-826e-de5762f5c205,Cece Richardson,very good except what happened to one day delivery? I also had items delivered in three days that was in stock .Some items left on top step not even on the porch .,3,0,22.6.0.100,2021-03-25 18:13:58,22.6.0.100
c164891b-f0b0-4c11-bf21-e0d358f8b015,Brad Mabee,Love the app. Constantly use it. Not a fan of the newer icon. Makes it harder to find.,4,0,22.5.0.100,2021-03-16 18:06:15,22.5.0.100
73485b56-6aa9-4eb2-b409-97793c26f158,Jelene Gouty,New app icon has absolutely nothing to do with identifying it as a shopping app. It looks like a bald guy with a comb-over.,5,1,22.5.0.100,2021-03-06 03:17:13,22.5.0.100
92fa2a1a-3373-4f64-a11d-2ea883e9942a,ranilo cutamora evediente,Great app i can do a lot of shopping but one thing tho could you please add a philipine region it would help a lot or you canignore it and do a backflip,5,0,22.6.0.100,2021-03-25 07:12:13,22.6.0.100
4c8338d3-3650-4a7b-aefa-997d2e531a87,paul,hard to find the right thing filters are rubbish but look hard and long enough could find a bargain just watch out for rip off's always read reviews,3,1,22.4.0.100,2021-03-06 11:55:03,22.4.0.100
b0940cf3-79a9-457e-bc10-96aa72b15c30,Shawn Jannasch (MMZ_Thumper),Past couple weeks the app has been glitching when scrolling. Pages don't render completely.,1,1,22.6.0.100,2021-03-18 21:56:36,22.6.0.100
228e9838-6da4-458c-b7ed-ef2aa6913571,Patricia Miller,I absolutely love shopping with Amazon and I'm always please with any issues that have ever occurred which is rare.,5,1,22.6.0.100,2021-03-19 21:07:44,22.6.0.100
7ec8edc7-1bd2-42d6-a55a-ef768ef999ed,Paula Browning,Love Amazon. We shop more at Amazon than anywhere else. They have everything we need and grear prices too!,5,1,22.5.0.100,2021-03-17 07:23:35,22.5.0.100
3263def0-f736-41b0-a5f7-fa668e35286f,David Graham,"Amazon is wonderful, very reliable. safe and trustworthy. Been a part of my family for very long time.",5,0,22.4.0.100,2021-03-01 16:22:45,22.4.0.100
fb2ca7fa-d1a5-4c98-9755-a27b142bda50,Mandii May,"Updated and it takes so long to do anything - loading my orders, searching products, ect. It is awful...",2,1,,2021-03-19 01:48:12,
6f34093f-82a6-4b51-bc49-745434b932e7,Michael Godoy,If only there was some way Amazon could control the quality of products and removal of products that are misrepresented by their descriptions...,4,1,22.5.0.100,2021-03-03 14:54:33,22.5.0.100
63617484-aecc-4ea7-aba5-3c7c6f0ab21f,Deanna Sarratt,"Amazon has great quality items! And if for some reason you aren't satisfied with your order, their return policy is second to none!",5,1,22.5.0.100,2021-03-07 09:24:57,22.5.0.100
3fdc317b-aff0-462a-8859-36f79cd019b3,Roa E,Customer service is getting worse every day!! When they can't resolve your issue they disconnect you!! As simple as this!!,1,1,22.6.0.100,2021-03-19 12:52:32,22.6.0.100
e7feb37b-0d04-4b48-999f-60c916ac6caa,WEDE WRAYEE,"Amazon amazing as always, with great deals and the fastest shipping ever.",5,1,22.5.0.100,2021-03-15 21:56:33,22.5.0.100
3cb57e28-40d6-436f-afdb-16ad802ecd8e,A S,the buying and return process are plain and simple. but sometime the return locations are nit always available for this one i did not see a khols,5,0,22.6.0.100,2021-03-31 02:37:52,22.6.0.100
7a89a161-90f0-44d3-a275-f0f874b4b5ac,Cheryl Cole,I'm disabled and have immune issues. I'm so thankful for my Amazing Prime quick and convenient!,5,0,22.4.0.100,2021-03-03 22:33:15,22.4.0.100
2f8d4cc1-ab61-4acf-b056-16d40e79f344,Tausha Mclaughlin,I have been using Amazon for 11 years. I always tell people to buy off Amazon apposed to other sites or going to 20 different stores to find what your looking for.,5,0,20.22.2.100,2021-03-04 01:15:10,20.22.2.100
818b7afe-fae2-4e7a-9b09-dc450ed4583c,Alana Tomlin Denton (Alana),"Problem getting app to open, keeps attempting to open, only to shut down. Very frustrating",1,1,22.6.0.100,2021-03-23 11:42:58,22.6.0.100
94abab22-f9b2-48ca-983d-ea734331e0bc,Stacie Lynn Silva,Absolutely love how easy Amazon makes it for me to find those difficult to get items these days! Shopping is a breeze with Prime <3,5,0,22.4.0.100,2021-03-01 20:55:56,22.4.0.100
0b51b3b4-4454-4401-9b09-544422a5d7b2,J J,it's amazon what can say you have to love corporate takeover of all industry if it allows you the benefit of cheap goods delivered quickly.,5,0,22.6.0.100,2021-03-20 16:23:30,22.6.0.100
6c7030a7-7020-4ad5-b65d-715f12507aa1,Stay Metal,"App keeps crashing after latest update. Also draining on my battery, super frustrating.",1,1,20.6.0.100,2021-03-23 03:14:50,20.6.0.100
648b9584-a2a5-4b7b-a218-2ed3c8aca43b,jason haas,It used to work and it worked really well but now I can't even launch it I've deleted it and reinstalled it like four different times,2,0,22.6.0.100,2021-03-29 18:20:59,22.6.0.100
5e91d373-051e-4793-aade-e7dd007e4d89,Mikhail,I wonder when the menus will finally move downwards as in the apple version. Why are Android apps are so often to steps behind?..,4,3,22.6.0.100,2021-03-18 10:11:02,22.6.0.100
bd8c84ab-56ae-4a89-90c3-64635059bd26,Jesse,"easy to find products, can find all past orders easily, easy to navigate app.",5,1,22.5.0.100,2021-03-07 15:27:31,22.5.0.100
a63fc2a8-bb6b-45f6-81a1-31ab69bb6ff6,Ricky Chavez,The amazon app is a great app. Works perfectly and has never given me any problems.,5,1,22.5.0.100,2021-03-18 12:44:40,22.5.0.100
5813dd72-fe91-46df-ad8c-6b5de93151f8,Rhonda Bond,I use my Amazon Prime daily. Its so much easier to shop in my PJ'S and have it delivered to my door!! Love you Amazon.,5,1,22.5.0.100,2021-03-12 22:11:31,22.5.0.100
a76c592f-8c5a-40cd-81bb-f471a396de7a,Tippa “Poppy” Midik,I am one of many family members that love shopping here at Amazon. The variety of the products are perfect for shopping around.,5,1,22.5.0.100,2021-03-06 12:54:06,22.5.0.100
52821c3c-fa7f-4e3e-ab0e-fa18259fe6f3,Daly Shorts,"Mostly good. But you can't ask questions about books. When I'm buying a cookbook or parenting book, I have some questions!",4,5,22.5.0.100,2021-03-15 17:58:16,22.5.0.100
41a40588-884b-4f46-beaf-fae96c6d008c,Michelle D.,"love Amazon!! Makes my life so much easier. I tell everyone, - if I can't get it on Amazon, I don't need it🤗",5,1,22.5.0.100,2021-03-13 04:05:59,22.5.0.100
45afce72-6aa5-423e-806f-fedbbaf75723,Jumaria “Jay” Perkins,love how i can get all my products in obe place...but sometimes local stores are still cheaper..just read reviews and you should be good!,5,1,22.5.0.100,2021-03-04 18:41:49,22.5.0.100
a813ee87-2cd5-47ee-90f2-8c7d7d0a819f,Lynette Dopson,"great selections, easy to navigate, great prices and convenient.",5,2,22.5.0.100,2021-03-07 03:13:03,22.5.0.100
e99864ff-bea3-4871-8332-1fbd7750eaab,Shona Tomlinson,After this new update I can't even open the app. Very disappointed because now I can't even check on deliveries.,1,0,22.6.0.100,2021-03-23 11:14:52,22.6.0.100
479dd69a-81bb-4c14-92cf-c6d207c0f846,Robert Pope,I always enjoy shopping on Amazon and when they have made a mistake they have always corrected it.,5,0,22.4.0.100,2021-03-04 19:18:38,22.4.0.100
82641995-1978-4fc2-873b-45b510f38d29,Brenda Nydam,"Amazon is quick, returns are super easy and quick. Its the Best way to shop online!!",5,0,22.4.0.100,2021-03-07 17:32:58,22.4.0.100
249380aa-ee01-4314-888d-d6076ded9b49,Dave Andrewsmay,"I don't like the new icon! There was nothing wrong with the last one, It is not exciting it is annoying and I wanna change it back to what it was",1,0,22.5.0.100,2021-03-06 10:47:18,22.5.0.100
841401df-9556-4d28-8cfa-3e2b94fec263,JohnnyUniverse,Product images won't load in gallery view.. just spinning wheels all the time. It's all about the grin on a box 😏,3,0,22.5.0.100,2021-03-04 11:52:31,22.5.0.100
f8847d56-8bdf-4633-995d-5c341298552e,William Harris,Pay attention to local prices. Some items are MUCH cheaper locally. Good service that I use often.,4,0,22.5.0.100,2021-03-21 18:46:04,22.5.0.100
fe931d85-7711-45ad-8e7d-7cff6b23af9a,Andrew Samaha,I was never a big fan of using Amazon before but now I order everything on this. they do a great job in every aspect in a service like this.,5,0,22.6.0.100,2021-03-27 02:48:28,22.6.0.100
1b80e086-2da7-4913-b1f6-b5e9eb9d1487,Mathieu Touchette,I love amazon especially since they have put faster delivery without purchasing Amazon Prime it has become very convenient for me good job Amazon 🙏👏👏👏,5,0,22.6.0.100,2021-03-31 16:51:26,22.6.0.100
