reviewId,userName,content,score,thumbsUpCount,reviewCreatedVersion,at,appVersion
23ad5418-11b2-4390-8a1c-a9e8851031c5,Nancy Peña,Amazing app to purchase online and with lots of variety of stuff you may need. But it sucks that it has been crashing on me and it won't allow me to open it,3,0,20.14.0.100,2021-03-23 03:11:40,20.14.0.100
d3137e36-2628-48a9-bae9-dd208e9a3ada,Angela James,"I have used Amazon for years and there is not one thing I have searched for that not found, sometimes prices more expensive, watch out for sellers saying its on prime then you go to check out and not available next day, all in all great store & app 👍🏼👍🏼",5,0,22.5.0.100,2021-03-19 01:10:50,22.5.0.100
de6cde0d-b613-49a1-bed8-ad112f67496d,Joe O 'Gorman,"Excellent experience, massive selection of everything you could imagine. great deals to be had if you spend the time looking",5,0,22.6.0.100,2021-03-28 12:40:10,22.6.0.100
e8079c20-ab3b-498b-a2b8-5977bd06a917,Toney Keys,Prime is not worth it I ordered some stuff and chose for it to be delivered on a Saturday after I was a prime member and after I ordered it the delivery date changed to a Sunday the I called customer service to see if it can be changed back to the day I chose since I paid for prime and no it can't I worked for amazon warehouse and then years later delivery and it can be done but I hope my 400$ order won't be stolen off my porch when I'm at work on the day after I chose for the 400$ order.,1,2,22.6.0.100,2021-03-20 13:05:51,22.6.0.100
4fd609e0-9938-44f0-9d76-73917ab3245f,Adriane Turner,The socks works really great keeping your feet warm in cold temperatures and they last a long time before wearing out. There worth the money you spend on them. This is my 2nd time ordering since 2019.,5,1,22.4.0.100,2021-03-04 22:15:20,22.4.0.100
73150a2e-1f75-43b7-8b28-bbcd32829ec8,Ashley Munoz,"I love shopping with Amazon, they make things so easy for you. From returning items, to customer service help. They completely satisfying my shopping needs.",5,2,22.5.0.100,2021-03-24 04:13:30,22.5.0.100
b73cacd2-e931-4510-a85a-f54c6d83a508,Nathan Glidewell,"I've been a prime member for about a year without any problems but unfortunately starting today my Amazon shopping app constantly keeps crashing and I restarted my phone , uninstalled and reinstalled the app still crashing on me .is it my cell phone ? Or a technical problem?",3,0,22.6.0.100,2021-03-23 01:18:26,22.6.0.100
97efbee7-92a4-473e-80e4-8746898b4a6a,Margaret Juniker,"Love Amazon and love the donating to my charity option but after this new update everything is glitchy, now my app won't even open when I click on it, it just is a blank screen for a few seconds and takes me back to my cell phones home page.",3,1,22.6.0.100,2021-03-22 22:14:00,22.6.0.100
905649ab-dee9-42ec-a793-f4bf21509c6f,Erica Moreno,I really how the search on the app change I feel insee less options now. Looking for shoes was way easier to find before. Because it's become difficult im searching else where for shoes now. Please change it back to how it was,1,0,22.6.0.100,2021-03-27 07:39:14,22.6.0.100
1b08b71d-84a0-48e6-a70d-08be690783c9,Latoya P,Was working great up until yesterday when I tried to add a credit card for rewards. Won't allow me to add any cards. Once I get to the address field it doesn't refresh.,3,0,22.5.0.100,2021-03-04 14:56:06,22.5.0.100
4811f81c-7f25-4ac2-a037-3be968183d36,Liam Duyvelaar,"Just today I went to go scroll through amazon when I realized I was logged out. I signed back in and verified my account. After all that I got back into amazon and none of my info, lists, or anything was saved. My account has been completely wiped.",2,1,22.4.0.100,2021-03-01 02:45:36,22.4.0.100
aaa30922-1e4d-4298-8d33-2d4ef270c72d,Dustin Mason,App works good. Only problem I ever have is that sometimes you get the loading circle when you click on an image and it never loads the image.,4,0,22.5.0.100,2021-03-07 07:36:43,22.5.0.100
b768436c-d54f-4e18-8344-01dbcde2554e,Jennie Redding,An amazing way to shop for whatever your needs are! As a mom of 6 I am able to shop for any of our needs from dresses for school concerts to toys for the dogs on my schedule and delivered right to our door. Absolutely love it!,5,1,22.6.0.100,2021-03-30 04:30:17,22.6.0.100
b65c9f8b-8e2b-4035-b7e9-5652dce11fb3,Dominique Rizk,"Great App. 🔥 i have ordered frequently from US store to Bahraim with expedite delivery and always arrived earlier then scheduled. Though, on the UAE store, many items show as Ships To Bahrain but when clicking on the product, it states Item Does Not Ship To Bahrain. Generally Speaking it is Fun To Shop ✅✅✅ with Amazon !! 👍👍👍👌👌👌",5,2,22.5.0.100,2021-03-09 20:07:21,22.5.0.100
473d7876-7dee-48ff-8062-021392b2eb0c,Harminder Sanghera,Been using this app for decades and for some reason the app won't open and neither will the desktop version... Don't know what has happened 😕 But needs fixing very quickly!,1,0,22.6.0.100,2021-03-23 13:23:22,22.6.0.100
2ecb4557-3e13-45d2-831c-fb9f434fb8ef,Stella Ryan,"Updated version keeps crashing. Was working fine, then started crashing. I updated it and it still crashing.",1,0,22.6.0.100,2021-03-23 06:57:04,22.6.0.100
04af3c7a-35e3-4854-80d8-b78090fec76d,Angela Morgan,"My years of shopping on Amazon has been phenomenal, only a couple of times I've had issues but Amazon is awesome about helping... I ALWAYS recommend to fam and friends, they say I have been looking for this etc I say go to Amazon they have everything.",5,1,22.4.0.100,2021-03-30 03:10:56,22.4.0.100
6eace92a-ff14-45ce-b759-9a4121d8191e,M Tanveer,every single thing is available on Amazon and that's the best thing about it. you can access anytime and find what you need. Amazon prime works the best as you get your parcel within a day. highly recommended,5,1,22.6.0.100,2021-03-22 15:46:04,22.6.0.100
f5ac5e46-7506-4d72-b33e-8734e0056181,Ryan,decent prices but you can find better. prime subscription makes it even better with free shipping on almost everything and all the movies and TV shows you could watch. plus prime come in a monthly rate too,4,1,22.6.0.100,2021-03-20 09:32:22,22.6.0.100
305536de-d676-4590-9586-1f4782fa289e,David Roche,95% Excellent.... always sort out issues with faults and deliveries. Not 5 stars because of that bit of room to get to perfection.,4,0,22.4.0.100,2021-03-03 17:53:35,22.4.0.100
5c34d6bc-6601-440a-a167-9a94e4edf2db,Brian Bloom,"Removed the ability to sort by open orders... AGAIN. So many, much more then half, of the products are not even sold by Amazon. The company has become a drop-shipper for terrible, cheap, Chinese knockoffs. Call out a product in a review for being a knockoff and your review gets removed. Bezos = China at this point.",4,0,22.5.0.100,2021-03-12 04:48:55,22.5.0.100
0a4f5376-542f-40f0-bf0c-ed05749165ee,Jonah Hensley (Jonah Daniel Hensley),"Made quite a few purchases now. When they say you're gonna get a package you can assure you'll get it then or before. Much care is taken with the packages as well, I know from what I have received, but I also have a small amount of inside knowledge from spending a week as a temp in a local warehouse of there's. I won't give any details, but though the process is streamlined, they take no shortcuts I can assure you of that.",5,3,22.6.0.100,2021-03-29 23:34:15,22.6.0.100
9b602e7a-52ec-49cd-9b3e-3053ae0aa12a,marissa lee,"I absolutely love Amazon I use it for my online business, I highly recommend for anyone wanting quick and efficient shipping and delivery. The products on Amazon for 10 out of 10. ☺️",5,1,22.2.0.100,2021-03-03 20:57:52,22.2.0.100
01bbca34-769b-4c8e-8d65-de2f12d2943e,Andrea,I've never went online shopping until the pandemic hit us and I have some just about 80% or more of my shopping for home thru Amazon. it is a HUGE help! From simple stuff like dish soap. Cleaning products to dog food and treats.,5,0,22.4.0.100,2021-03-02 19:50:14,22.4.0.100
f6dd9dae-0f26-445c-b195-41ecf99e72f9,WQKE WQMAN 2Q2Q,Last update messed up all my Amazon Apps. None open and immediately crash. Had to uninstall and reinstall. Hopefully it will stop crashing.,3,0,22.6.0.100,2021-03-23 08:26:09,22.6.0.100
190c5a8c-9574-4545-897d-657e5507e722,mike manning,Works great. However after u make a purchase they constantly harass u with emails to buy what u just bought. Think about I just bought it. I know where to go to get more down the road if I choose to . Amazon annoying its customers is idiotic,2,1,22.5.0.100,2021-03-07 14:15:18,22.5.0.100
f2c21950-1548-4f62-a896-6cad790e19ea,Trudy Heafer,"Always some great deals and usually get my order on or before the delivery date. Only a few times had my delivery been late or wrong item, very few.",5,1,22.6.0.100,2021-03-26 21:55:00,22.6.0.100
7546eee1-d371-4ad6-a8ef-a2da09b0645d,Tracy Curtis,"App is crashing, what gives?! My wallet is GONE, the shipping is giving inaccurate information, it keeps changing my delivery addresses. This cannot even be used now!",1,0,22.4.0.100,2021-03-02 21:01:02,22.4.0.100
524164e0-7166-4432-9dd5-a24f58bba57d,Lanni Smith,Usually easy but good luck if you get stuck in the credit card loop. I had to completeness log out and back in to get out of the offer.,4,1,22.6.0.100,2021-03-31 02:11:26,22.6.0.100
95f816f4-7033-4c74-86ee-57ccb591d663,Sharon Myers,I have used this Amazon Shopping app for years and it has worked well for me. This app has become the easiest way to add a gift card balance in under a minute.,5,3,22.5.0.100,2021-03-16 18:02:31,22.5.0.100
5cc10e56-9e39-432b-9f9e-84bd93b0e1dd,Christian Dynamo,Excellent and very definition of convenience. App always runs smoothly and the deliveries that follow are even smoother.,5,0,22.6.0.100,2021-03-26 13:46:41,22.6.0.100
21a2f84f-0027-473e-9b24-218e24402dc4,Trace Faucett,App was working fine until the last update. Now the app crashes when opening even after a fresh install. Leaving as a 3 star till fixed for s10.,3,1,22.6.0.100,2021-03-22 22:18:44,22.6.0.100
52762f96-e69b-4354-99bc-4c844c8d8f4b,Ryan Bell,"DON'T USE!! It's set up so if you try to pick the ""Free Shipping"" option, it goes into a ""loading page"" format and never resets. If you don't accept the highest cost shipping, you can not order. Jeff Bezos needs to make money after his divorce. Only use Amazon to find your product, copy the name and go to Google and search for another seller.",1,113,22.6.0.100,2021-03-22 20:08:57,22.6.0.100
097131a9-0c54-49ec-b57e-64c439ca5b96,PJPAG,"The app runs smoothly so far. The downside of this app for which I didn't give a 5-star rating is that it shows products that are no longer available and products that cannot be shipped to my country. I mean, come on... What's the point of showing them when I cannot buy them. 🙄",4,7,22.6.0.100,2021-03-27 02:02:36,22.6.0.100
ab6afe6c-bc35-47f5-843a-cf3af1408677,Geraldo Goodwin,I love shopping on Amazon. I've only had a handful of issues but I do order a lot so.... I can kind of deal with lost items or delays.,5,0,22.6.0.100,2021-03-25 15:21:50,22.6.0.100
fffdd0ad-31f7-45a0-99f2-2f21f1af3069,MisterAvesh,"Whenever i try to open the app it keeps stopping. This never happened before. I uninstalled and reinstalled it and that still did not help, idk what else to do to get it to work.",2,1,22.6.0.100,2021-03-23 20:25:25,22.6.0.100
670080b9-5b2f-4221-898b-f848275398ec,Matt,"Unfortunately the Amazon policy used for prim members does not extend to registry items for those prim members. After speaking with 9 representatives and initially told my refund would be available same day shipment was received (I have email confirmation of this), I have been told it will take an additional 2 more weeks! This is sad from a company that has always put customers first, and now my newborn will go without a key item from his baby registry. Please do no use this feature.",1,17,22.4.0.100,2021-03-01 22:19:14,22.4.0.100
5a9a67b5-cec7-48a6-bc1c-03d25b6d9d24,Cally Lazich,"I love Amazon! It is such a convenient way to shop and prime is worth every penny. They are very consistent with delivering on time, all the time. Customer service is excellent. l",5,0,22.6.0.100,2021-03-29 05:35:10,22.6.0.100
c45eb04b-5df4-42e0-96c4-f5c7c37f39ff,Caleb Baker,"Loved App till Update! I used the all the time. But now wont even let me sign in! Quit changing things and let us shop! New is not always better!!!!!!!!!!!!!!!! If you fix the problem I will give better rating. Its still a great store to use, if the app will allow you to even get on",1,9,22.6.0.100,2021-03-22 21:29:37,22.6.0.100
72466222-3f7f-4538-8ca8-d1371c9a7dff,Donna Walsh,Sorry to say this as I have been using this app for ages and never had a problem until now it won't even open on my mobile phone anymore but hopefully amazon will get it sorted ASAP as I have always found that they are on-the-ball with stuff like this.,1,3,22.6.0.100,2021-03-23 00:13:28,22.6.0.100
f3f9f808-e301-4f02-ac44-7d53450f4f42,Guy Aragon,"I spend more than the average person through Amazon Prime, I have only had 3 delivery issues in 3 years and Amazon made those issues right by the following day! love the service!",5,0,22.5.0.100,2021-03-10 00:53:52,22.5.0.100
1897882e-8324-4b7f-aa7e-2cb86f52c11d,Ronn Hicks,"Loving Amazon as a buyer, many items purchased with the same shipping result fast, next day fast with many items. I dont know how they do it but, I appreciate it.",5,1,22.5.0.100,2021-03-14 12:30:12,22.5.0.100
72d8369f-5db0-43cf-b42a-83f1416dd128,R MacKenzie,The icon is smile is the worst. The icon with no eyes. Just a broken smile cause one side has the simple. The blue thing at the top - I don't get that. I understand conceptually where the design is coming from. But gosh it's ugly. ... The no eyes. It's a monster.,1,2,22.6.0.100,2021-03-30 00:58:07,22.6.0.100
dbd6d987-b0ca-4cdc-8252-1519fe2dfa18,Nicole Stiteler,App keeps crashing! Since the update I can't get the app to stay open for more than 10 seconds without it crashing 😡,1,0,22.5.0.100,2021-03-14 20:18:44,22.5.0.100
e074cbea-808c-479d-a22c-16007acce674,toya,"This new update sucks, app keep crashing. Cant open app, hot mess Update review.... issues solved, re installed the app, then it went back to the old looking app tht everyone loves... now it's working as it should.",1,1,22.6.0.100,2021-03-22 21:25:56,22.6.0.100
5ee39945-073d-4a4d-9f0e-4b4c0282f656,Shannon Jackson,Everything was working fine till I updated the app yesterday. Now today when I try to open the app it closes immediately. I have to shop with my web browser. Defeates the purpose of the app. This isn't the only one doing this. Super unhappy right now..,1,1,22.6.0.100,2021-03-23 03:26:45,22.6.0.100
dd0d4732-931b-4880-9994-75f3d45be90e,Dana,"Amazon is too big for our good, squashing competitors, even on shipping ""we"" pay $1.46 for each package Amazon sends through the USPS as it's Govt Subsided so either through taxes or debt the US citizens are getting more poor while Amazon & the small handful other Mega Corps get more rich & powerful.",1,0,22.5.0.100,2021-03-05 02:19:28,22.5.0.100
8eb60146-9347-4e3e-b2e8-8dc83db6809f,Rob Lawson,Currently having issues with the app constantly crashing. Can't even get it to open after a uninstall and then reinstall.,2,0,22.6.0.100,2021-03-23 02:32:51,22.6.0.100
4abd456a-139d-4cc5-8f5b-78f3b33d7474,Amber Black,"After new update, view orders sucks. Can't tell exactly where my orders are because some say arriving today when already got delivered and some say tomorrow before you click on it then says today. Extremely confusing. The way it was before updating was so much better.",1,1,22.6.0.100,2021-03-18 05:36:59,22.6.0.100
ef04e60b-7d13-4ff5-94de-9ddc3849cb3b,Michelle Chavez-Hauer,"It's amazon. Say more?? It easy to use, fun because you get to ""shop without difficulty"". Will be keeping this for sure. Along with all the other Amazon goodie apps! 😁",5,1,22.5.0.100,2021-03-09 21:06:25,22.5.0.100
cc9f7252-7511-4ccc-94e9-4988d551c6f5,Nicole Cox,App won't even open since it updated. Can't even log in using chrome as it won't open the link thru text message either. Please fix it.,1,2,22.6.0.100,2021-03-22 23:39:58,22.6.0.100
4ff01cf6-ad21-4966-9dcf-eccf82da83b4,Tracy Stillwell,I love that they take pics of the package and text it to you. That way if you are able you can get your package faster without it being stolen. Best delivery system out there. this company is the best monster out there!,5,0,22.6.0.100,2021-03-26 05:05:00,22.6.0.100
14460a99-f35e-40cd-ae1a-516eb67b222b,Brandon Clark,"They are poor at customer service ,they always run late on your orders. I ordered two things at one time I should have got them at the same time not two different times. I live by two Amazon but they decide to order my stuff out of the country and like 10,000 miles away I don't understand.",1,1,22.4.0.100,2021-03-01 18:08:03,22.4.0.100
0c0cbbf1-7a1b-4c85-86a7-7afc1a19e688,Hubie Figueiredo,This latest update causes pages to load slowly and header is not shown half the time. Clicking on links leads you to incomplete pages. LG V20.,2,1,10.5.0.100,2021-03-11 17:19:41,10.5.0.100
0df4d981-3e5d-4cad-bc7d-e01efbe80a9b,D J,"The app works well of course but for an organisation set on taking over the world, destroying small businesses and profiting out the the pandemic, what would really expect?! Just because I shop at Amazon, does not mean I'm blind or agree to their methods. Oh yes, did I mention that app is ok?;)",4,0,22.5.0.100,2021-03-11 18:06:37,22.5.0.100
dd1e7b5d-6a97-4802-b7c7-d3d1efa95283,Mariah Austin,"First of all, I would like to start off and say that Amazon used to be a freaking amazing app. Somehow it just changed, now whenever I order ANYTHING my item gets delayed or cancelled. Ebay is literally the only app I use now, becauze it works way better!!",1,0,18.6.0.100,2021-03-08 03:22:48,18.6.0.100
43de3862-51b9-49d2-bf06-e26b2405220c,Wanda Jackson,"I love using this app. I have ordered from them for so many years. My items come and if I have any problems they really comes threw for me. If I need a refund, I get it with no problem. I love this app!!!!",5,7,22.5.0.100,2021-03-13 03:27:42,22.5.0.100
f957b456-8065-4b22-88d1-cec4d71e7355,Khurram Alavi,"I am a big user of Amazon. I use this app to do most of my shopping. I can also use this to view my profile, subscriptions, write reviews, check gift card balance, orders, order history, and co tact Amazon customer service on the chat function.",5,7,22.4.0.100,2021-03-05 22:31:37,22.4.0.100
7250b361-cce6-41f3-9949-1939f5a36d09,Chelsea Conn,"love Amazon. very convenient, just about anything and everything at your finger tips. can't go wrong with the prime 2 day shipping!",5,1,22.4.0.100,2021-03-07 17:02:03,22.4.0.100
b2b06721-e38c-40c4-b905-29ff0d990a71,Kayla Lewis (THeFettbounty),Super glitchy! With the new update when you go to open app it opens for like 2 seconds then automatic closes app. Please fix!,2,3,22.6.0.100,2021-03-23 09:01:42,22.6.0.100
2bfad75d-10c1-42f6-952c-57a4497ad979,jammydodger102,"Was working perfectly upto the last few weeks when became unusable, hanging every time I try to view a product. it's become absolutely unusable.",1,0,,2021-03-26 23:40:56,
f53568cb-3819-4ebf-b8e6-91a32a92662d,Cynthia Rivera,I love shopping on Amazon. It's easy and they have a lot of options to choose from. And if for some reason you need to do a return It's so easy and their customer service is amazing.,5,0,22.4.0.100,2021-03-01 05:35:14,22.4.0.100
abe60f71-80b5-4c3a-9644-4bf06f64d19c,Kevin Brown,"Only Amazon's apps don't work on my Android 10 phone. They fail with a ""check internet"" error. Logs seem to show they call the wrong library.",1,1,22.5.0.100,2021-03-10 17:47:21,22.5.0.100
cf12cbf3-8185-440b-a26b-a2ca021cc13f,Janet Pickford,"Shipping times change in transit. Deliver to wrong address often. Wait 2 weeks for an item only to be told on day of expected delivery it will possibly be another week before it arrives. Refund policy is exceptional, very good.",3,0,22.5.0.100,2021-03-18 02:28:41,22.5.0.100
40a164b7-1856-4506-99b9-4ae1b8afdca9,Redlo,Keeps crashing. A lot of other apps too like mails and google... I have an Huawei P30 Pro and why you guys all crash at once tho. I can't even look at my train connections... What the hell,1,2,22.6.0.100,2021-03-22 22:30:10,22.6.0.100
545df9cc-a88a-412e-9583-41ade7efbec6,Martin West,Please change the icon for this app as its so dull apart from that Amazon and prime is undisputed tops. Perfered the old colorful icon as it was easy to spot on phone,3,0,22.5.0.100,2021-03-14 11:30:08,22.5.0.100
12acdcb7-9b2a-4a3e-af9b-e5bb06c5d8d3,Chris Hanson (SaveVersus),"It's Amazon. If you're considering the mobile app, it because you order too much. I'll give this five stars if Amazon ever decides to quality check and stops cheap sellers from fleecing good people.",3,0,22.5.0.100,2021-03-04 20:47:05,22.5.0.100
73d526da-5965-439a-93df-9a5903c99acb,Alpha Exploration,I have not had any problems with the items I purchase. everything has come in a timely manner and not damaged. so far no problems shopping on amazon. recommended.,5,2,22.5.0.100,2021-03-16 18:58:09,22.5.0.100
5fed85b7-2f77-4adc-9cf4-af08c8f05839,Mihaly Molnar,"It works just fine. Totally doing what it supposed to do. The main thing for me is, that even if you order from the German site, there's still option to translate mostly everything in English. Many other webshops should do the same way.",5,4,22.4.0.100,2021-03-01 14:10:24,22.4.0.100
f5ad6546-6ba8-4664-9280-59b3d79ef924,Reyna Olvera,This new update doesnt allow me to open the app properly. Please fix I have a few items on the way and need to know where they are at and precisely when its dropped off.,2,0,22.6.0.100,2021-03-23 18:38:43,22.6.0.100
679571b6-e047-4f80-b007-e32f27259503,Erghe Poston,"Just stopped working. I click on it, it thinks for a moment then nothing. Repeated attempts and restarted phone. New Pixel and updated.",1,2,22.6.0.100,2021-03-23 03:48:54,22.6.0.100
620f60bf-5b5b-47b8-9617-dc2c66b76434,Nathan Weller,The UI is user friendly and easy to use and you can get great deals for products would recommend downloading and signing up for Amazon prime with discounts and free delivery,4,0,22.6.0.100,2021-03-31 23:28:43,22.6.0.100
4b168d68-7c2e-45fa-a49d-3acdd118db57,Paul Jackson,"New layout is awful and keeps freezing/crashing or get the ""oops, something went wrong"" message. Should revert to the old app. Update 17 March 2021: New update is even worse.",1,6,22.6.0.100,2021-03-17 18:40:28,22.6.0.100
20c56ba5-d77c-4ba2-a0a1-edc2aaf671ef,Emiliano Mejia,"Amazon has been great to us! We've never been stirred wrong. They solve our troubleshooting issues asap, We get our packages with care and they make ordering from the site easy and secure. Thank you Amazon! We love you!!!",5,2,22.6.0.100,2021-03-21 14:08:10,22.6.0.100
9d45efaf-8470-4907-9818-84895155a80b,Steve Gregory,"Amazon is the best shopping experience since the opening of Walmart, yet they have surpassed Walmart with their customer service, their prices and their delivery is outstanding... all this from sitting in my chair without having to track down one single human being to find something on an aisle somewhere. if I was a betting man I would bet on Amazon to absorb the Walmart corporation in the future.",5,6,22.5.0.100,2021-03-15 18:21:52,22.5.0.100
c5a81f42-1296-443d-9b26-8cc36714abff,Nicole's Adventures,"I've used this app for a long time without any issues.....until today. The app will not even open, not at all! Please fix whatever issues are happening so I can change this review back to 5 stars!",1,2,22.6.0.100,2021-03-23 00:48:48,22.6.0.100
be052638-6b8e-4802-adb3-d0c36d9cb5f5,Yulia Goudreau,obviously Amazon is amazing! just wish the return policy wasn't 30 days. I always miss the 30 days because I'm a procrastinator (and tired) personally and really busy professionally.,3,0,22.6.0.100,2021-03-30 12:43:25,22.6.0.100
343eed50-664c-4842-8862-b049e0209233,Tony Brown,Rubbish app crashes and becomes unresponsive when I scroll down to reviews. Must be some sort of bug as only started since the last update,1,0,22.5.0.100,2021-03-11 02:52:57,22.5.0.100
5dd69948-d06c-4d99-8f99-40d6c68da45f,Mark Hill,Amazon prime is well worth it if you like music and do a lot of online shopping. Sometimes a next day delivery promise doesn't quite turn up the next day but otherwise it's a great service.,4,3,22.6.0.100,2021-03-30 11:17:44,22.6.0.100
04c8db21-bcdc-4e64-b2ee-2e8f04779adc,Chris Perkins,Easy to find items you want with search feature..great selection and prices ( with Prime) fast shipping..a few hiccups with sending the wrong item..but quickly resolved by customer service.,4,0,22.4.0.100,2021-03-01 22:26:04,22.4.0.100
cd9d8494-bdbe-4499-95f9-964069e814ae,Abeil Hedgu,I can't no more believable them me and my friend we have lost 7 different items they did give as refunds but after the offer as the same product add 90% more the original price no more this monster Amazon.,1,0,22.5.0.100,2021-03-14 12:30:55,22.5.0.100
e81b60bd-1104-41c8-a220-361118cdf4bd,Young man Old soul Radio (YMOS),it's just to convenient to order whatever you want and have it delivered within days. I use to be one of those who would say don't use online stores but now I say its the only way I shop. it gives me time for more important things like my family and most of all me.,5,3,22.4.0.100,2021-03-03 02:13:43,22.4.0.100
783b0504-8b2e-4826-9b7e-5e893387cc00,philiphough photography,"the Amazon app I've used for 4 items in 2 days .. it really saves login into computers and so easy to use, user friendly.. uploading pictures for reviews and chatting to support at Amazon.. it's a must for all Amazon users .. Enjoy shopping..",5,0,22.6.0.100,2021-03-28 08:35:35,22.6.0.100
