reviewId,userName,content,score,thumbsUpCount,reviewCreatedVersion,at,appVersion
e1101051-7d2a-491d-ba5b-bd72f2c996fe,Jim Dollarhide,"make to difficult real owner , make entering simple for svcum bags in filter again will over haul make inteudera pay",2,0,30.16.0.100,2025-09-17 06:14:08,30.16.0.100
9e5153cf-d64a-41d4-b4d1-a2690ca834c1,D S,well that's stupid. add something to your cart. why make it difficult. then trying to checkout its a fight to get to the point oh checking out. again. why make it difficult?,1,1,30.16.0.100,2025-09-17 05:44:11,30.16.0.100
86d6e339-a5bd-4e9d-be16-d55c284ed8c8,Chloe Yellowknee,"tried ordering something and accidentally bought a prime membership, cancelled it asap but they won't refund me.",1,0,30.17.0.100,2025-09-17 05:25:21,30.17.0.100
5e7e88c8-7325-4f1e-a963-3ef836a6c850,José luis Veloz mayoral,me gusta lo que tiene y me divierte,5,0,30.17.0.100,2025-09-17 05:20:46,30.17.0.100
8c12d26a-1467-4a50-8b98-f59172860cde,Sthabile Zungu,I highly recommend Amazon. They deliver on time and they have great offers,5,0,30.16.0.100,2025-09-17 05:06:12,30.16.0.100
3f1fde12-97d0-446b-aa20-ea3d13fb6cc9,Elijah VanCamp,"want me to login in to buy anything, but you won't let me login to my account, it says ""suspicious activity"", about 82% of your reviews are 1star I won't worry your going out of business soon anyway",1,0,30.17.0.100,2025-09-17 05:04:57,30.17.0.100
fe39e45e-5151-49ea-899c-6d29db98bffe,Shanavas Vp,"very disappointing....If you order any items, it will be 15 or a month after cancel it.If someone orders something for use, they should reply within one month of your request.You can't really ask them anything, you can just listen to what they say.I have experienced this many times.I haven't received any of the items I ordered, everything is cancelled, and it's too late to get the money.",1,0,30.16.0.100,2025-09-17 05:03:25,30.16.0.100
f0e3c1f9-8a61-4965-a37b-891ee00fa519,saint kiziano,"please caution your delivery agent's, they are so stupid and annoying, a delivery agent called me for an order receiving, before I could get down from 4th floor he already cancel my delivery and drove off, meanwhile his call didn't Last for 2 minutes, please this not the first time this happening once they hear your voice to be African they will left your location immediately without even waiting at least 5 minutes of call, Please we are all humans and Amazon is open for everyone to shop in.",1,0,30.17.0.100,2025-09-17 04:48:30,30.17.0.100
230b8f14-af6b-4866-b7c7-fda6f9cab17a,Ted Simmerman,Excellent to order and know your order will be delivered,5,0,30.17.0.100,2025-09-17 04:16:46,30.17.0.100
c46c8e3e-2042-4478-9dad-f88361ab460b,V Esco,huge inventory to choose from for anything and everything.,5,0,30.17.0.100,2025-09-17 04:09:19,30.17.0.100
5dda463d-7f7f-40b2-b02c-ea1316105661,Richard Spears,this is the most ridiculous algorithm I have ever seen. why doesn't Amazon just close its doors and go out of business? Then Jeff bezos can spend all his time playing with rocket ships and missiles,1,0,30.2.0.100,2025-09-17 03:39:33,30.2.0.100
7d46cd74-cb01-4fa4-9878-319cd8ea537c,keke c,"ok, why do I have to wait damn near 24 hours before yall decide to take my payment???? why do I have to wait until my items have been shipped before you take my payment???? Really, what is the issue???????",2,0,30.17.0.100,2025-09-17 03:34:25,30.17.0.100
17561906-f288-4eba-bca5-f623b5e1ad2f,Creative Needs,they don't have anyone to speak to if you have to call customer service when they screw you over because of their stupid ways and then when you do get customer service and somebody in Africa drinking on a Friday night telling me that he's the top of the line for Amazon prime and his name is Mr whiskey,1,0,30.17.0.100,2025-09-17 02:22:05,30.17.0.100
946ece07-34a7-4e17-aba5-1eb093f07e9a,Chris,"Terrible platform, nothing is simple, updating address is a nightmare. Goodluck if you need help with anything",1,0,,2025-09-17 02:08:13,
665019ff-0319-414f-b7b6-9a433525cda2,Jeffrey Justice Losey,"Mostly great, but no way to filter products by nation of manufacture.",4,1,30.17.0.100,2025-09-17 02:07:51,30.17.0.100
14e999bd-2e9b-4f07-b27d-cc787d83acdc,Atul “UH2L”,Predatory selling practices,1,0,,2025-09-17 01:56:08,
f3976273-742d-4ab1-9aa3-74895c44389e,Rick Griff,worst shopping experience ever. spent more time trying to get what I paid for and getting ripped off totally not worth it ever. they out right stole money from me. there delivery drivers leave stuff on side of the road and they are okay with that til you want a refund. customer service was unbelievable rude. they want you to send a copy of license to a link in India. when I googled The link app Red flags came up saying don't do it. they didn't need that information to take my money.,1,0,30.17.0.100,2025-09-17 01:35:57,30.17.0.100
b9a22b12-602f-477f-8c70-f066b16891e1,Ruben Rojas,very satisfied shopping 😀,5,0,22.6.0.100,2025-09-17 01:16:57,22.6.0.100
1b0a4690-59f4-4baa-b09d-d4c998376577,Michael,"App works great minus one thing. When reading all the reviews, the app will randomly scroll all the way up. This is super annoying when trying to read.",1,0,30.17.0.100,2025-09-17 00:45:19,30.17.0.100
3f84ccc2-d275-45a1-8740-f5fb6bedacec,Yessica Ardon,amazing,5,0,30.17.0.100,2025-09-17 00:33:54,30.17.0.100
29261468-d99c-4aea-991f-1b400ed38393,Richard Thiessen,Amazon.ca website baited me into installing the app for a $10 promo that didn't work.,2,0,30.17.0.100,2025-09-17 00:25:06,30.17.0.100
42362314-c17a-49e4-8a1c-e93565ce4e33,Kathy White,terrible,1,0,30.17.0.100,2025-09-17 00:14:31,30.17.0.100
72494a1d-723f-4d59-8ba4-cabc73d5cc19,Todd Barney,App ignores default payment card set in account and seems to want to use an old card that is no longer the default. Had to completely remove the old card for the app not to default to it for payment.,2,0,30.17.0.100,2025-09-17 00:07:14,30.17.0.100
fff289cf-0ecb-444d-ba33-936a1edab911,Thomas Cleveland,begs for reviews and is unusable without cutting edge hardware,1,0,30.17.0.100,2025-09-17 00:02:42,30.17.0.100
085957d2-a3b0-424d-8c0e-196fd2041a3d,Bryson Rose,worth it👍🏽👍🏽👍🏽👍🏽,5,0,30.10.0.100,2025-09-16 11:32:11,30.10.0.100
a3d0c97b-4847-4b27-9582-7275bc140a7c,Cameron Wheat,I can't even get on the app anymore. it's not even available for Pixel anymore,1,0,30.17.0.100,2025-09-16 10:48:02,30.17.0.100
b2dd1f6d-ec83-4912-a424-4233cfa7911d,Felicia Foo,I absolutely love that! I can go on Amazon and buy something in the evening and have delivered to my house very the next morning. it's amazing!,5,0,30.17.0.100,2025-09-16 09:35:10,30.17.0.100
d564c06b-440c-4dbf-8572-ff10ef544bb9,Steev S,"hard to actually get customer service, when you've been paying for over a year and need a pause your order gets pushed back days. still free shipping. If your package blows off the porch they won't refund you. like convenience but lack of care sucks",2,0,30.16.0.100,2025-09-16 09:30:34,30.16.0.100
c4962bfa-4407-4ee2-8999-3cd60fb11a81,i So Psychotic,app does not work on s25 ultra. completely unacceptable.,1,0,30.17.0.100,2025-09-16 08:18:56,30.17.0.100
6339b945-b948-487d-825d-0431852e99ba,Mohammad Mumtaz Khan,good,4,0,30.17.0.100,2025-09-16 08:01:35,30.17.0.100
e5396b1f-9c1a-4a43-b621-7ad038ce22a9,Mahjabeen Mobeen,Best deals delivered to your door! What's not to love.?,5,0,30.17.0.100,2025-09-16 06:56:07,30.17.0.100
691b7ef3-4e43-4456-a78b-61df94eb4d40,Mohammed Gouse,One stop shop for everything.,5,0,30.17.0.100,2025-09-16 06:18:32,30.17.0.100
bd2f8a1a-4432-44c7-b5c1-5ba3bb0ec815,Sunrose Heer,My package got lost in transit And it was a nightmare to get a refund.,1,0,30.17.0.100,2025-09-16 05:29:49,30.17.0.100
3931f538-9afb-4ce3-a22a-54041a14bcbc,Hayley Landers,Amazon is amazing beats shops prices and free delivery,5,0,30.17.0.100,2025-09-16 05:15:38,30.17.0.100
3bdd195a-24a6-45fd-aa99-ed75dafd3a4e,Phrike Onyx Axton,can't delete off phone,1,0,18.19.0.100,2025-09-16 05:00:04,18.19.0.100
a2a565fb-f4a2-4f66-9a26-a6ea996b36fc,Milton Smith,Would give it 5 stars but they advertise things at the same price and tell you that it's a sale. I am a pretty avid price watcher and I have noticed this.,4,0,30.16.0.100,2025-09-16 04:50:40,30.16.0.100
8b158071-5927-415a-99ae-bad0389cf573,Bubbly Scouser,"App doesn't work . Hasn't worked fully & properly for months. All other apps work perfectly on my mobile. If I could I would give Amazon zero stars. Amazon's days as the No 1 shopping app are numbered. It has too many poor reviews and is doing nothing that matters to address the issues . They are haemorrhaging customers . It's the beginning of the end . Goodbye, Amazon .",1,3,30.17.0.100,2025-09-16 04:44:02,30.17.0.100
a0b4021a-9fd0-4f80-a713-6fbf6f9767a0,Michael Emmanuel,Great app for buying good products,5,0,30.17.0.100,2025-09-16 04:43:01,30.17.0.100
d9d2bb54-5918-4019-9530-fd73b14e5042,Austin,"Very broken app, always showing dogsI'm a Vine Voice (I get paid in free items to post Amazon Reviews for these items) - they won't even allow me to post firearms accessories that are being modeled on firearms in my photos and making it so difficult to post these reviews while following their stupid, unlawful guidelines. They try to say oh this could be illegal but what do they want? A copy of my concealed carry or the constitution? Get a grip before you lose your grip on the market as a whole.",1,0,30.17.0.100,2025-09-16 04:41:04,30.17.0.100
3f243bac-b9f4-4e17-aa41-67897fe5409c,Mohammad Alkazmi,اسوأ مندوبين توصيل على الارض,1,0,30.17.0.100,2025-09-16 03:58:05,30.17.0.100
62b4be7d-28d8-4eb2-b1b1-a135cba78f7c,Jacqueline,"I shop Amazon for almost anything for home. my furbabies, and work place. Some prices are a little higher on some but majority are lower",5,0,30.17.0.100,2025-09-16 02:45:27,30.17.0.100
30a91df0-d861-47b2-86a5-fcca77f968f6,Matt M,Slow & laggy constantly on all my devices.,1,0,30.17.0.100,2025-09-16 02:44:23,30.17.0.100
b857bd4c-d196-4df7-817c-8745c76e295a,Abbidale Black,I could tell my parents what I want for Christmas and see if they can get it for me ❤️❤️❤️❤️p.s. add some more stuff (wink),5,0,30.17.0.100,2025-09-16 02:12:35,30.17.0.100
f8143a82-6cbe-4eb7-aa87-6f82724d2b11,Miki Grenier,"Deleted my account. Bad support. Afreen opened a DSN Ticket, then got 5 Amazon emails to describe my issue, device problems, ads I see, give time stamps, etc. This was AFTER a ticket was open. Shopping Temu exclusively from now on. I will not be back. Even ditching Alexa devices. Do your jobs, I would never have left. I'm not sorry to go. Too big for GREAT support to happen. Did you win a JD Powers award??? You act like you did. Adios!",1,0,,2025-09-16 01:14:11,
62d56740-299f-45f8-821e-edc5775f62b6,Harley Davidson,great thank you,5,0,30.13.0.100,2025-09-16 01:01:19,30.13.0.100
292c7ee7-a537-4599-bb19-063f01cf4e70,Sharmin I.,"Delivery dates are just a suggestion, never get delivery from Amazon on time. Recently ordered a few things as the delivery date was showing on a day I'd be at home to receive. On that date, checked the app - saw delivery is changed to a different date. So I had to reschedule again on a day that I'd be home. That date passed too, package is still not here. When ordering at start of this month, it was showing a 4 day delivery in the app. 15 days passed, still no package.",1,0,30.17.0.100,2025-09-16 00:49:14,30.17.0.100
bd3b04a3-9865-49f3-a44b-e0d79e24fedf,Kenneth Ferguson,make me inviable to slam and scams,3,0,,2025-09-16 00:28:36,
ecbbd0c0-4380-4d58-bff2-edcd40703347,Malak Musa,good 👍,5,0,30.17.0.100,2025-09-16 00:26:34,30.17.0.100
62c8fc0b-7333-42b7-8c9e-9b7fc9db9f79,Obscure Nemesis,"Price gouging piece of 💩. Shows one price, then 2 minutes later when you log in it's suddenly £5 more. Last time I use Amazon.",1,0,30.15.0.100,2025-09-15 12:00:22,30.15.0.100
61c119b9-74c4-4149-b954-4a76f54e4b02,Amy Wyma,"Don't bother building up the order to $25 if you have prime and hope for over night delivery. 3 times now I've done that and 3 time it's taken 2 days to arrive anyways. I went to customer service to complain since I'm a small business and the couldn't rush the order, they could only cancel it. I needed the items regardless but each day they were late, as a small business, I was losing money. So I asked for either a refund plus the items or a credit. They said I'd need to prove the original date.",3,0,30.17.0.100,2025-09-15 11:51:04,30.17.0.100
e511c147-a2e4-42f0-a235-de240c452f0f,Mahmoud Elhaddad,in every update the image preview of the product becomes worst,2,0,,2025-09-15 11:15:52,
ccc98648-0ba7-4cb9-9e9c-d4d8260d0475,Selena,"I love Amazon. Reasonably priced. easy to navigate & always guaranteed great customer service. I've never lost a package or had any issues with online security regarding my banking information my identity or my credit cards! Amazon's business model is seco d to none. I get everything I need from them. Areal game changer. User friendly, convenient, & leading edge EVERYTHING. I like love you Amazon. thank u!!",5,0,30.17.0.100,2025-09-15 09:53:19,30.17.0.100
c0001a5b-aec7-4092-b37b-717602c54e63,Ionut-Adrian,Filters do not work correctly and even the sort by price low to high doesn't sort the list correctly by price and a lot of products are missing afterwards! It is too hard to find something that you need this way! The app keeps resetting if you switch to another app and come back to it! Some packages arrived broken and just left in front of the door that is next to a playground and some packages were missing! There are a lot of issues with the company and the employees as well!,1,66,30.17.0.100,2025-09-15 08:52:04,30.17.0.100
7e07cb6a-d0f0-456a-a403-2804ab99f61d,IV,"Bezos and Clancy allow Hassan Piker to incite violence on twitch. Cancelled membership, will not support this organisation 👎👎👎👎👎",1,0,30.17.0.100,2025-09-15 08:47:28,30.17.0.100
ade33694-8071-4ae7-a7bf-6c29fa766f98,Abdulaziz Zahran,أسوء تطبيق,1,0,30.17.0.100,2025-09-15 07:57:18,30.17.0.100
c1f49051-3d87-4238-a1ab-5704ced8369f,Robert Lucas,GREAT PLACE TO BUY ALL THAT YOU EVER WANTED ALL IN ONE PLACE I CAN RECOMMEND THIS APP 100%,5,0,,2025-09-15 07:39:46,
264dd250-5462-4ab0-a3b2-060b43ebcd7d,Carol Mccoy,My name is Carol,2,0,30.17.0.100,2025-09-15 07:29:04,30.17.0.100
7e17f7b7-4e85-4e5d-9c6f-1a87aa7ad0f0,Mr Anurag Singh,ok,4,0,30.16.0.100,2025-09-15 06:39:43,30.16.0.100
115f106c-1d38-4001-8172-08c07e000101,Mike Colbert,I dont want rufus. remove it from the app or let us disable it.,1,4,30.17.0.100,2025-09-15 05:54:05,30.17.0.100
8daf6cbb-0c69-406a-9512-b2f2ab1c2fe3,MARK HOIDS,bargains and has incredible amount of items to choose from at such low prices. always offering future discount for purchasing from them. love Amazon,5,0,30.17.0.100,2025-09-15 05:25:15,30.17.0.100
947e57d7-5aa7-4e74-846c-b4184c68031f,Muhammad Zaid,best price,5,0,,2025-09-15 05:05:00,
548a00de-9619-4767-bfa8-31ee447b3903,Arun Thomas Achankunju,worst customer care ever i see in my life.. i return one iteam and after 2 months i am waiting for my money,1,0,30.17.0.100,2025-09-15 04:39:33,30.17.0.100
cf9e1354-089c-4615-8449-e0ad574b7609,Liam Mouse,I Love Shopping On Amazon And Look For Some Mickey and Minnie Stuff That I Always Love.,5,0,30.17.0.100,2025-09-15 04:33:05,30.17.0.100
23e3dc36-cecc-4896-83a9-8df03576ac32,Rene Reese,Too easy 2 shop!,5,0,24.4.0.100,2025-09-15 04:24:33,24.4.0.100
fa2b517d-c3f0-4998-aa0b-5a1eb68ba8dd,Viviana Garcia-Simon,Can't live without Amazon convenience!,5,0,30.17.0.100,2025-09-15 03:37:13,30.17.0.100
69a17834-34b7-440e-93e1-91252c72b6b7,Kimberly Diaz,love shopping with Amazon,5,0,30.16.0.100,2025-09-15 03:32:08,30.16.0.100
04da09b7-1efd-4525-96fc-7adb79512bbe,Nico Alarie,on fait comment retracer nos commande asteur ça marche pu là,1,0,30.9.0.100,2025-09-15 03:31:14,30.9.0.100
f826b027-b85d-4538-bb4a-6748828ee059,Lyla Hume,LOVE this app has everything. toys stuff animals books plants just love this app,5,0,30.16.0.100,2025-09-15 03:09:58,30.16.0.100
b0e806cb-3a80-4892-a1cd-454867229410,D. Cynthia,"September 2025 The app needs to be revamped there are actual SCAM pages-blocks on the app itself, the management for Amazon for allowing this to happen to millions of us needs to be REPLACED, needs to be fired ../old review; On your app you need a quick fast easy way for us to communicate with you, you don't have that/ You make it so we have to pick some stupid product before we are able to communicate with you ""that is bad business"" that is immature business, whoever thinks that's okay in your.",1,0,,2025-09-15 03:03:36,
8b361d8c-0ecd-478a-886b-d24fcf920ebf,Melissa Wells,like,5,0,30.17.0.100,2025-09-15 03:03:02,30.17.0.100
84c98956-73e1-4ee5-803d-7c650dbbe79b,Ashlyn,"Get rid of the ""product gallery"" and bring back the old way of viewing product images. Terrible.",1,0,30.17.0.100,2025-09-15 03:03:00,30.17.0.100
9e39c2e5-b1c1-41f9-b53a-c1b92aaf8d2c,Carlos,Love the free shipping that comes with Amazon Prime.,5,0,,2025-09-15 03:01:09,
6b0b2802-43e9-4738-845b-36f7cf4c23ac,The Wilkies,awesome 👌 👏 👍 😍 💖,5,0,30.17.0.100,2025-09-15 02:31:09,30.17.0.100
9d0cf891-6eaa-42d3-b17a-8b7581853aeb,Samar Emam,bad experience,1,0,30.17.0.100,2025-09-15 02:23:48,30.17.0.100
ed49a5e0-c6a1-4808-8583-51f4f978cd56,Kevin Wheeler,it's 2025. don't shop on Amazon anymore,1,0,30.17.0.100,2025-09-15 01:46:42,30.17.0.100
7ec9c877-d625-4cca-94b2-e1a88d07fd28,Harlee Dehoyos,thank you,5,0,,2025-09-15 01:34:51,
fda6893b-a102-44f0-9ded-0ee70701fb2e,Mostafa Mohamed,"good, but you have to provide more safe delivery for certain items like smartphones",4,0,,2025-09-15 01:33:33,
564c1891-a3ca-4d05-b113-b1b7d905a5d2,Brandon Jingle,"No skip scene option for prime video, only real dumb fast forward and rewind option. When you go to menu it puts ""my stuff"" all the way at the bottom knowing that's the most used option just so you have to scroll through all the other useless menu options.",1,0,30.17.0.100,2025-09-15 01:16:32,30.17.0.100
cf0962c4-7458-4b9f-a80b-65040f820dd8,sherri diltz,They Always have what I'm looking for& beat Wal Mart every time on in stock !,5,0,30.16.0.100,2025-09-15 01:12:35,30.16.0.100
3e74e831-3fe7-4a47-9b73-dc8ab37a1015,Aslan Gagiev,"My purchase history is not loading on my samsung tab s7+, accordingly I can't find the item I need in my purchase history",2,0,30.17.0.100,2025-09-15 00:12:16,30.17.0.100
a745fb2b-b555-4ff6-a2fe-6186ad8fd85a,Brandon P,Low refresh rate app. Choppy and unpleasant to scroll pages. You'd think a gazillion dollar company could optimize their app for higher refresh rate screens...,1,0,30.17.0.100,2025-09-14 10:50:02,30.17.0.100
0ab9b93e-bcb7-4d38-929e-555db611126f,Tiarnan McKeown-O'Neill,"Useless app and not intuitive. For a company fat with greed they put no money into this clearly, good luck trying to speak to a human or change security settings without spending an hour + on it",1,0,30.16.0.100,2025-09-14 10:24:25,30.16.0.100
8e20e270-889e-450c-8eda-5248b7aeeafa,Jan L. Korrubel,so Easy Peasy to use...,5,0,30.17.0.100,2025-09-14 09:53:02,30.17.0.100
62eaa4d3-81c7-42a5-94c2-70901ae7bb2a,Ashley Monaghan,great products. easy to find,5,0,30.17.0.100,2025-09-14 09:52:10,30.17.0.100
953e81ab-b12b-4365-9bf8-f419f10344fd,ValtTuber Games,خخ,1,3,26.15.0.100,2025-09-14 09:18:45,26.15.0.100
7ee5676f-a47e-453b-a1fd-eda80856042c,Federico,This app is so slow and buggy. It's a pain to use it but I'm forced to use it to open the locker (because I can't in the browser). That's pretty absurd.,2,0,30.16.0.100,2025-09-14 08:54:44,30.16.0.100
0b568e98-5ae5-4b2d-8b05-1dc8b56a024d,Chris Atterbury,can't look at review pictures or watch videos because it just stutters/lags. apparently been an issue for years now but Amazon hasn't fixed it! using on S25 Ultra so it's not an issue with phone performance,1,0,30.17.0.100,2025-09-14 08:40:47,30.17.0.100
78a1d095-0299-410f-b970-4d82bf0284f2,Sylvia Nambozo,ds? ?😊😆😊😀🤨😚🤪😁,5,0,30.17.0.100,2025-09-14 08:34:22,30.17.0.100
24872513-06fc-43d6-94c6-3e70f516aa22,Susan smith,love this app,5,0,30.17.0.100,2025-09-14 08:21:33,30.17.0.100
5eef7499-4194-4bcc-b88a-bd7744a12b4f,Jessica Huynh,can't see reviews anymore,1,0,30.17.0.100,2025-09-14 07:56:51,30.17.0.100
29d3442e-30f5-4466-978b-cc8741d622cb,Andrew Glanz,Horrible app. So insanely slow and hitches when clicking on just about anything. Navigating between pages is incredibly frustrating. I'm on a OnePlus Open and the app behaves like I'm trying to run it on a Windows Phone from 2011.,1,0,30.17.0.100,2025-09-14 06:23:53,30.17.0.100
d2af5279-05c9-4ab7-9e97-79ae8a43dfb5,Hamza Mx,worst,1,0,,2025-09-14 06:15:20,
e170a051-32bd-4d9a-a0ab-28d5578116ea,Reyes Alegria,"It is very useful and saves you a lot of time, easy to use.",5,0,,2025-09-14 06:07:05,
52d3cf0a-b25c-4aa8-9e38-ec3bd0228da8,Vivek Saini,please add dark mode for Android users,3,0,30.17.0.100,2025-09-14 05:35:06,30.17.0.100
1c06c167-8809-41fc-aca8-c924979a276b,arnie rodriguez,Easy and very convenient,5,0,30.17.0.100,2025-09-14 05:31:02,30.17.0.100
02bac692-3e60-4426-9aee-474e8ff7a794,Anirudh Jayendra,why is there no dark mode it's so stupid,1,0,30.16.0.100,2025-09-14 04:52:32,30.16.0.100
e2bfb6ab-51fa-4a18-9c00-424687b25fb5,Zareli Noise,"Scam marketplace. One of my items got lost by their carriers weeks ago and they didn't contact me, didn't refund me, and the customer support is just delaying the refund and offering gift cards because 'they're faster', but the truth is that they really don't issue the refund ever. Avoid Amazon.",1,6,30.17.0.100,2025-09-14 04:45:22,30.17.0.100
370b4d52-a343-4ee1-9e25-e43810b06e7c,Noah Gross,sometimes the prices change within me refreshing my pave so idk why they up after I put then in ny cart,4,0,30.17.0.100,2025-09-14 04:33:48,30.17.0.100
8925da02-4d9d-4d6c-b736-6add2cc0f65e,Sithuwa 123,super,5,0,20.22.0.100,2025-09-14 03:56:08,20.22.0.100
fa4e2b11-7a8a-4027-948a-e1cd07e41063,Nemo Dog,"I hate the nfc payment. Why is it required to use? It takes longer and I don't always have my card on me! Because of it I had to cancel 4 of the same orders and even had it delayed by a day because I had to ""change my payment method"". Now I'm expecting my items a day late! Horrible.",1,0,30.17.0.100,2025-09-14 03:46:49,30.17.0.100
b001a354-9640-4d64-91d0-8ac414f1d9fe,LiNA BUI,Excellent shopping experience,5,0,30.17.0.100,2025-09-14 03:40:30,30.17.0.100
67581f5e-8968-4495-b5e8-319a8048b1e9,Juliet Fox,"Long time user, like since the textbook days, and this is the first time it's really irritated me. Why can I not renew prime on the app? That's the stupidest thing ever? Why? Bad move!",2,0,30.17.0.100,2025-09-14 03:28:05,30.17.0.100
8ec7da4e-b14a-4bcd-a331-70562549599d,Juan Rangel,I love Amazon they literally have everything I'm always looking for!,5,0,30.16.0.100,2025-09-14 03:09:43,30.16.0.100
fe798ba2-4d0c-4bec-89b0-d9e020afbd5b,Liz “crafty_mom”,Stop forcing AI on everyone! I don't want all the extras in the app. Please provide a way to disable all the pop-ups and Rufus junk.,1,0,30.17.0.100,2025-09-14 02:51:41,30.17.0.100
b973ee7b-1e0e-405a-b091-2f0659f8f0a8,Suzette Trahan,This app is converted to an access point to Play Store and I cannot stop the conversion. Developer in Google LLC is updating all my apps bypassing Play Store updates. this developer has destroyed 22 devices in the last year+ some. any app installed in my device is at the developers control and not my control. today I purchased my 23rd device and I am hoping this doesn't cause your site any problems but the developer becomes a developer in all apps that are installed by this developer group.,1,0,,2025-09-14 02:39:55,
ce030ab5-597d-4eb9-8d35-5f675c8117e8,Jeffrey Clement,Amazon gets one star for implementing the reseller program. I can't buy an overpriced yeti cozy selling for over 30$ because someone bought all of them and sells them for over 100$. stop this reseller garbage and let us buy the things we need and want at real prices. instead of lazy resellers ruining our lives. and due to my review Amazon is bullying me by blocking my account. just beware that they are more interested in stealing your dollar than protecting its clients from scams.,1,214,30.17.0.100,2025-09-14 02:08:11,30.17.0.100
c2b56786-8b89-4b11-b91a-20049791abd0,Eduardo Ugalde,good,5,0,30.17.0.100,2025-09-14 02:07:05,30.17.0.100
6fa70a98-8810-4330-90c2-99b5fc54f7a0,Nick Stallard,like it get everything from here,5,0,30.16.0.100,2025-09-14 01:50:52,30.16.0.100
845f7222-aca5-4396-89b3-d424dad55087,Rita Palfreyman,It's ridiculous having to pay sales tax on products you order online. You used to not have to do that until Amazon got too big for his britches.,4,0,30.17.0.100,2025-09-14 01:35:33,30.17.0.100
ada8ecb5-1411-464b-87e8-80b819e9930a,Go Fast,Can't beat the service or the price or the free overnight delivery,5,0,30.16.0.100,2025-09-14 00:55:16,30.16.0.100
453a15b5-4148-4e80-9e28-51d19d9e1dc9,Diane L,Fix your cart not coming up when you press the cart button!,2,0,30.17.0.100,2025-09-14 00:38:50,30.17.0.100
a545e64e-8f3e-493a-9b2e-b553b8906984,Ernie Sendejas,One stop shop,4,0,30.16.0.100,2025-09-14 00:18:09,30.16.0.100
faedd498-9234-4c37-9803-b4299a2497d8,Johnny Kay,love it,5,0,30.16.0.100,2025-09-13 12:00:15,30.16.0.100
dc821cd5-6848-410a-9742-e0862317d59a,tyler laurie,it's very good l got free shipping,5,0,30.16.0.100,2025-09-13 11:43:48,30.16.0.100
9d4ba1d3-ae2b-4797-82d9-2095aaa6195f,Kathryn Mancarella,Your app is taking up space in my phone. I NEVER USE THE APP. I CAN NOT UNINSTALL IT. THIS IS CRIMINAL. I DO NOT WANT IT,1,0,,2025-09-13 11:12:59,
200b77fc-996e-4ae3-b754-de3ed1b3600b,Stanley Manganyi,Best online platform to date. Returns are done easily and best prices if you are like me who loves to compare products prices. Thank you Amazon.co.za,5,0,30.16.0.100,2025-09-13 10:37:47,30.16.0.100
