reviewId,userName,content,score,thumbsUpCount,reviewCreatedVersion,at,appVersion
060946a8-e771-480b-abe7-a551200871dd,Lyra Mider,when i click the app it just shows a white screen and then it would make me go back to home screen..i keep on trying multiple times but it still does the same,1,2,20.9.0.100,2020-05-16 23:42:38,20.9.0.100
0e6fac10-9a07-4837-8d40-fb8cb9b648fd,NavyAirTraffic,Gets worse every time Just uninstall the updates and the stock version works better than this garbage. Need to being back infinite scrolling and stop making it look like your website,1,0,16.20.0.100,2020-05-22 17:01:20,16.20.0.100
eb816876-ffcf-4037-a027-9ac535ba2334,Kazac Kazah,"Removed colour, material, brand filters, recently viewed and keeps recommending me promoted tat like you would find on a market stall with higher price than you can find it in Amazon. how do I remove this update to the previous version?",1,0,20.6.0.100,2020-05-29 09:08:47,20.6.0.100
b72d16d7-655a-4ae0-ac6f-5a1811a1c2be,James,They took away the log out option on the app. Now if I want to switch profiles I have to uninstall it and reinstall it. Just plain dumb.,1,0,20.10.0.100,2020-05-31 17:15:19,20.10.0.100
ccee1d50-b4ab-4c45-8299-ffe045db2119,Omar Ghaoud,"Bad... When i open a pic I can't get back until i lose the product, start from the beginning. Pls fix this bug...",3,0,20.10.0.100,2020-05-25 21:17:45,20.10.0.100
853be4f5-e1a6-4f46-8dd4-f2556828c000,Roger Dutton,"Slick operation, some ""gaps"" But way smoother than eBay. Which is also good but for different aspects.",5,1,20.9.0.100,2020-05-14 10:57:17,20.9.0.100
325ed38b-aa07-4baf-ae21-cda1e51f978e,Devyn Valentino,"I liked it for a while, and i bought something and before it was canceled for some reason so i canceled it, it took my money and never gave it back and the package never got shipped",1,1,20.10.0.100,2020-05-27 17:46:29,20.10.0.100
55b22137-f8f7-48e3-97ba-ab1e83cb0989,Justin,Awful. I won't accept my password when I log on to my pc and it has been reset 5 times now. No customer assistance available.,1,0,20.5.0.100,2020-05-14 18:48:03,20.5.0.100
2244d65d-8164-4510-a8f9-7bf6ef451a79,Jhalil R.,App is great for shopping but one problem I do have is that the View in Your Room feature only works sometimes (less than more) galaxy note 10+,4,2,20.10.0.100,2020-05-31 17:11:21,20.10.0.100
093caa38-c4d8-4447-a277-72892a8be167,Scott Anthony,Love it. Best shopping store online could not live without it. Always fast delivery and great prices what else could you ask for.,5,44,20.10.0.100,2020-05-30 23:11:09,20.10.0.100
0adbe7b4-d1d7-48e7-842a-d9a1c00cbf2c,Kala Shives,Love having Amazon at my fingertips. I can pop on when I am thinking of something and put it in the cart for me to read reviews on later before my final purchase,5,0,20.10.0.100,2020-05-27 17:35:23,20.10.0.100
2f945492-bc94-497d-abc6-c49a987517cf,Chris Batt,"What a piece of broken soulless garbage software. So full of bugs, it just doesn't work in the slightest.",1,0,18.9.0.100,2020-05-20 21:46:25,18.9.0.100
e905e0e8-2e7c-46db-a0f7-bbd1031d47fb,Tammi White,Terrible!!!! My husband ordered me a watch and after weeks of it showing its been shipped we found out it never was!!!!!!😡,1,0,18.21.2.100,2020-05-27 08:42:42,18.21.2.100
901ce2d9-e5d0-41ae-80a1-f71e4b88d346,Michelle Heydon jones,Had for 8 years it does make shopping easier. Good deals and customer service try to help as much as they can,5,12,20.9.0.100,2020-05-07 18:49:08,20.9.0.100
3378735b-3b75-4f76-99ce-4e076d1c6618,David Arundel,"Tried to uninstall, but it reinstalled automatically. Not amused. Would have given more stars, if it hadn't reinstalled.",1,0,8.7.0.100,2020-05-12 08:56:44,8.7.0.100
ba585832-5642-4c1c-8cda-414d6d3a9f34,Edi X,Needs to be reinstalled every so often because loses ability of following links and is useless. I have no idea why it is like that.,2,1,20.10.0.100,2020-05-28 14:03:21,20.10.0.100
fe5e1395-fa37-4caf-88a2-49fc56176297,isBen Kitchen,Dont use this sight there out to get your card info and not send you your product. They better not charge me for something I bought somewhere else because the had to make it difficult to spend my own money.,1,0,,2020-05-13 20:52:06,
61f889d1-a9a1-4ccc-943f-4b9d7350190f,Steven Knapp,"Very great to use, for days you wanna make quick run and stock up. Can't use it on cold or frozen foods but still a time saver",5,4,20.8.0.100,2020-05-06 17:23:50,20.8.0.100
51a54fca-eeb5-4453-bef3-3c9a3aa21a8a,Jared Adams,New update makes it feel like you are in a mobile browser viewing as a desktop site. An enormous step backwards.,1,1,20.10.0.100,2020-05-30 23:34:17,20.10.0.100
6b483e51-96a5-4576-a3d7-dba54f1809cd,dorothy candie,"I bought stuff for my baby which is total more than 3k rupees and they said it delievered but she said she didn't receive any. And we call customer service, they said they will resend it before 9pm but until now we didn't receive any. We called again like few times, all we got is sorry and asking more time. Those stuff I bought is for my baby birthday and they sent it to wrong person, and now my baby won't even have her present. What a wasting time and money. This service is totally suck.",1,1,,2020-05-26 16:00:26,
046f9295-c667-49f7-9903-04cde3ab2a8c,Framilen Novo,Sucks! Taking forever to ship the items I ordered! I understand there's some delay coz of pandemic right now but TOO MUCH DELAY! 😤😤😤,1,0,20.9.0.100,2020-05-16 07:55:28,20.9.0.100
dfd7fcb0-7e0c-482e-be50-edbeb4c83898,Robert Nickerson,I click on the app it keeps shutting down I updated it keeps shutting down I remove and reinstall the app works for a while and shuts down I'm not happy,1,1,16.6.0.100,2020-05-19 17:21:35,16.6.0.100
fdb75bc1-815b-47af-adba-e4dddb7bb2b8,sana,It so cheap and all the items are affordable 👍 but it sometimes comes Abit later than it actually says but I am happy with all my purchases because they are all on good condition,4,0,20.10.0.100,2020-05-31 02:13:29,20.10.0.100
52f40032-2019-4867-8678-756581a0a14e,Angela w,"THIS UPDATE IS TERRIBLE, FIX IT. We can no longer filter searches?? Why would you take away that option?? Ridiculous!",1,0,16.21.0.100,2020-05-22 14:50:04,16.21.0.100
9f8db267-912c-460e-ace9-12d3b75c108a,Jamie Zalot,@Amazon The app no longer allows me to sort my items. I can't even preference Prime or Availability which is important currently.,3,0,20.9.0.100,2020-05-11 17:00:28,20.9.0.100
2f82d756-a1ca-4699-a9a8-4aa29b040cd9,Lee Holloway,"Expected somuch more, most of the products they dont ship to South Africa so yeah its useless, very disappointed, will not recommend this app, wish is so much better",1,0,20.10.0.100,2020-05-27 08:22:47,20.10.0.100
daa6ffe8-f32c-47fa-bff6-08dc4fcbf224,Maribel Rubio,It's quick to process the payments. I found what I want to buy right away. But it's expensive in terms of delivery payment.,5,0,20.8.0.100,2020-05-06 02:55:04,20.8.0.100
b13bf888-b866-4c1e-a4d4-f2f674108ba4,Gulnaz Javed,I actually really irritate from this aap because i delete this app for 15 time but it did not disapeard from my screen so i really want to tell the owner of the app that please do somthing to restore this app😡😡😡😡,1,0,,2020-05-21 19:00:52,
d8e60121-0e55-4913-ba94-962516126401,Tyrica Thornton,"Amazon is the only reliable company I know of to send you your orders on time/In a timely fashion, And in the condition that you wanted and are accustomed too 😁",4,0,20.8.0.100,2020-05-01 05:37:22,20.8.0.100
cdda57fb-3500-46d8-9280-99fff2bf9230,Bonnie A.,"Really good most of the time. I HATE when it tells you it will arrive in two days then all of a sudden, it states that it will be at least ANOTHER day before delivery.",4,4,20.9.0.100,2020-05-07 19:16:32,20.9.0.100
a8384ef2-4c91-4bd3-aa16-1533a8247bdb,Kelli Laws,App not oriented properly after updating. I want it back to list view. It's very unpleasant to use,1,0,20.10.0.100,2020-05-23 21:50:24,20.10.0.100
d6cea7f4-8c8c-43d8-9383-ce7feda80ff0,James Segura,"Product pictures don't load sometimes, something so simple, and so frustrating to see it spinning",2,1,20.9.0.100,2020-05-12 20:28:38,20.9.0.100
366a6bc6-5195-4979-aa9f-eae05124c48c,Will Andrews,"Suddenly Android app went BUO Busting Upon Opening. FYI: If this happens to you, try to reinstall the app. Worked for me.",3,0,20.8.0.100,2020-05-03 14:54:41,20.8.0.100
61bb0e19-d166-4b7d-91e0-6b5ccdef7f7c,Ginger Ziskal,Sight asked what I was looking for then couldn't provide it. Can't get my recent seed purchase and can't find it because I don't have a tracking number,1,0,,2020-05-01 14:59:54,
a05554be-a28c-4083-b82c-afab1c110cf5,Randy,I have been getting some real dense delivery people as of late. Delivery times seem to have added a day or two when screw ups happen.,5,1,20.10.0.100,2020-05-30 09:59:01,20.10.0.100
78f424a0-95e8-40a9-ba8e-a56cd215a1e0,Paul Gray,"Fairly ok, not fully used and abused enough to pick any stand out annoyance, yet, but few niggles and shall see how those develop.",4,1,20.10.0.100,2020-05-27 18:16:22,20.10.0.100
f6192b98-79ea-474d-9ed6-4ad8bfb70303,james harding,I HATE this app. It takes forever to load. It is the only way to contact customer service right now. And through chat no less.,1,1,20.10.0.100,2020-05-28 08:43:22,20.10.0.100
e2247174-859c-48db-aca8-4b35d6773132,suprala family,Good app. Regular user. Very frequently I get something went wrong with pet dog images. Love the pet dog images.,5,0,20.10.0.100,2020-05-31 05:37:59,20.10.0.100
3288d01a-21b5-443e-bf68-533f4509c0e0,Heidi Newsom,They don't seem to know about the tracking device that the United States of America uses which is a 16 digit starts with the number 9 or sometimes,1,2,20.9.0.100,2020-05-06 18:18:24,20.9.0.100
47229caf-201b-40ce-8b01-b9b777096bf4,Rob R,Horrible UI! Why would you change this from the older version. I can't even waste my money on useless stuff anymore.,1,0,20.9.0.100,2020-05-10 19:16:18,20.9.0.100
8d07c3c2-d4e6-4b3f-b09d-ce3641bf0287,Gwynn Scott,"Amazon charged my debt card twice and I only received 1 bundle package for $17.99 Total: $19.07, I also see a charge for $18.98 Why was my card charged 2 times, please cancel that charge for $18.98.",1,0,,2020-05-19 22:40:51,
bbd9200f-e67c-44a4-9fd5-05baed3dbc86,Mike Ottley,Would never use this app or Amazon again. Absolute rubbish customer service and clearly falsely advertising delivery dates!!!,1,0,20.8.0.100,2020-05-02 18:06:52,20.8.0.100
5ae2ca01-6461-4556-8171-b27e84ba6b1c,Alex Mcleod,"very disappointing, it's not as good as old app, which allowed me to look for specific books of genre, or year. this new one doesn't do nothing for me.",1,2,20.9.0.100,2020-05-06 18:10:20,20.9.0.100
cb62d496-9a14-4baf-9e98-99b480085b81,Nisha Hope,I prefer the computer to the app for general shopping but it works conveniently for adding items to cart.,4,1,20.10.0.100,2020-05-28 11:38:13,20.10.0.100
6a0f794d-5ac9-4180-9e90-33e5467b8d95,amanda blosser,App not workikg at all and crashing everytime I try to open it very frustrating worked fine before never had any problems until today,1,0,20.9.0.100,2020-05-22 20:34:26,20.9.0.100
797701b7-01f6-4181-b280-7d32d904baf1,Sunnie L,Just got done at whole foods how many screens does one have to tap before getting to their scan code? 50 whoever designed this app needs a brain transplant because this app is NOT user friendly. The scan code should be on the front home page in big bold brightness with no shroud or.mystery to find it. Why make.things so hard for the customer who buys food? Lazy pea brained people dont know how to Design a user friendly app for whole foods shoppers. Ridiculous fire them,1,0,,2020-05-30 17:17:35,
292339dc-30fa-4070-88ac-50f014edc418,Nicole Demetrak,"Recently ordered some products, damaged by Amazon delivery drivers (not UPS/USPS), said it was going to be delivered anyway. They changed their mind without my ok. Did a return&refund. Went back on to reorder. Price went up on 2/3 of the items. Customer service was a joke. 3 people, 1 hour and no resolution other than reorder and we will give you a refund of the difference after you contact us again. So another hour of my time? No. Tried to write a review&it got denied. Untrustworthy corporation",1,8,20.10.0.100,2020-05-22 16:47:07,20.10.0.100
d2561b77-0624-4cef-ab96-aebb756cdd07,Hal,Filters never work correctly. Finding a link to customer service is a joke. They don't care about the customer experience. Just make Jeff richer.,1,2,20.10.0.100,2020-05-30 09:05:16,20.10.0.100
b276eb38-c6ed-45bc-8afd-f1446ce708c5,Tien N3t,"Fisrt time buying on Amazon, my item just lost without help. What a thrilling experiment!",1,0,20.9.0.100,2020-05-18 08:32:52,20.9.0.100
ed857874-14b4-4e7a-8709-155d39fafd4a,Caleb Ferrell,"Bought an Xbox One Controller (Used) in like new condition and it was sent with a broken joy stick, wouldn't let me return it saying I did it",1,0,20.9.0.100,2020-05-18 07:03:04,20.9.0.100
2c9c0592-bead-457e-9f2f-9f5213e5f59a,george b,i pay for prime (past 3 years) and i get nonprime shipping. if youre going to gyp me in shipping i shouldnt have to pay full price.,1,0,20.8.0.100,2020-05-26 21:08:48,20.8.0.100
2a328dc2-0385-41ef-85d9-419bb1b0d438,Guy Brown,Why does it have to load everytime you click any kind of variation on a product that scrolls horizontally? Takes forever.,3,0,20.8.0.100,2020-05-06 01:49:58,20.8.0.100
18a022f4-0e89-4707-b32c-a5fcf642eb81,Rosa Medina,Very unhappy with this service had to cancle my items because it keep saying there was a problem with the payment but yet they took the money out so thanks amazon,1,0,,2020-05-15 01:26:03,
1046499a-0d74-4e74-9c04-ad8cbacc5500,Eric Carr,"The ""go back"" bug really needs to be fixed. I am shopping via other retail apps until Amazon works properly.",1,0,20.10.0.100,2020-05-24 00:21:45,20.10.0.100
f44a2e59-0f5e-4fab-9c4e-06b936e28f5d,Simon Carter,Used to work okay on my tablet but now is completely broken. Crashes after starting. Tried reinstalling but doesn't help,1,1,20.10.0.100,2020-05-26 19:11:10,20.10.0.100
f5d9beb0-ac15-4ecd-9c3f-45a7dc070364,Roz Venus,Very good information would like more help as I am only a beginner. As I am only a learner and not at work although I do work I am working from home re MOD.,5,0,20.9.0.100,2020-05-04 12:01:26,20.9.0.100
d6c9ef44-f473-410b-95d3-ced973b7d53c,Lali Cruz,"Love using Amazon. Amazon is practically my online mall, I go on Amazon for anything I need, just type in the search and Amazon has it!!! Love their prime shipping. Def. recommend this app to anyone!",5,7,20.10.0.100,2020-05-29 19:08:13,20.10.0.100
60930870-bb35-48bf-a9d6-17164e0aab28,Merissa Ridinger,Ive seen once that amozon was going to make a lot more online sales than any other shipments. Keep up the good work amizon!:) Covid times appreciate your fast. Easy. On time shipping,5,1,,2020-05-11 23:48:31,
e46c9505-91af-4a6b-90b4-78762ae8fa25,Debbie Kelly,Trying to log on to Amazon is crazy you have to do these character challenge and then it says it's too many for you apparatus it's ridiculous so I can't say I got to give them a one,1,2,20.9.0.100,2020-05-19 02:04:01,20.9.0.100
211ccd91-2909-4a4e-b5b8-39a4eb696e6d,Ashley Moses,I used to LOVE using the app. However lately the app doesnt seem to want to work properly. It takea forever to load anything. And to add to cart or list. Please fix this,3,0,20.8.0.100,2020-05-02 21:26:17,20.8.0.100
72991d0e-391a-4f2f-a063-219234e143f0,ken serle,was loaded on my Google slate .Terrible app .Much better to access Amazon via the browser and create a short cut to your desk top,1,6,14.2.1.100,2020-05-16 12:15:24,14.2.1.100
e021a4dd-03ee-4a77-b4fa-d26c94b56406,Matthew Lloyd,"Garbage. Amazon stinks, shipping is inconsistent and slow. Product selection is filled with knock off trash.",1,0,20.8.0.100,2020-05-08 01:19:32,20.8.0.100
f1a24632-020d-4c3c-b936-95e0f3c3b224,Tonya Rego,"Liked this app for a few months, now my purchases are not being delivered and you can't get a reply from anyone to get a refund or explanation of what happened",2,1,20.10.0.100,2020-05-29 00:10:02,20.10.0.100
11a79ab8-9068-4406-8a4c-9cec5acbefe3,tom slattery,Keeps high jacking my browser every time I open my browser. Uninstall it and save some space. Just use a web page.,1,0,,2020-05-22 01:38:09,
7cb70eae-e018-4d74-a2d1-783ccb713a38,Kait Montanari,"Can't search, can't add addresses, can't edit anything. Waste of time and space.",1,0,16.20.0.100,2020-05-12 00:44:08,16.20.0.100
df4e4adc-e5e8-4620-8a8f-5cc33f8d31f3,Cheyenne Navarro,Makes me do on average 15-20 puzzle's Everytime I sign in. I change my password every time too. This is unsatisfactory.,1,0,20.10.0.100,2020-05-27 22:01:54,20.10.0.100
64a0378d-97a6-426a-b552-1b053845e99b,Adrienne S,Crashes. Can't even use the app at all right now after an update. Fix this problem asap please!!,1,1,20.10.0.100,2020-05-28 19:36:17,20.10.0.100
ad725089-e9d7-49b5-9913-a16d48dd36cf,M S,This app is garbage. Forced to download to get customer service. Great ideas on service Amazon no wonder your getting canceled this season.,1,0,20.9.0.100,2020-05-13 21:35:21,20.9.0.100
0042d2c4-ff04-411b-9e05-fecab68fba32,Geraldine Scroggins,"All of a sudden all of my information is in Spanish, there's a mistake somewhere,maybe I pressed wrong thing, please help!!",3,0,20.8.0.100,2020-05-30 13:06:08,20.8.0.100
32701542-a23b-4bbd-8441-3f785f798af8,Arturo Acosta,"English not available in Spain, of course i get why, but english speakers who live here have no choice while other regions support more than one language",4,3,20.9.0.100,2020-05-18 20:28:55,20.9.0.100
7e1f48fc-998d-435e-ba86-46520c9f354d,Evelyn Hanscom,"They do what they say they they will do. I have been buying different things from Amazon for years now, and they stand behind everything they sell. They go by every word that is written.",5,0,20.10.0.100,2020-05-23 21:15:33,20.10.0.100
9c275d70-9e4b-4754-8501-eb7bd977b476,Glenn Hall,"How do I get this off my phone??? Too damn invasive, can't get to anything else!!! Shouldn't have to download an app just clear it off my startup page.",1,0,20.10.0.100,2020-05-30 15:05:39,20.10.0.100
18d1e1ef-8d6e-4aba-806c-b50191df4893,OhLittleFeather Joy,Amazon lost a couple of my packages and they didnt have a tracking number and i cant get a refund for them. 👎👎👎,2,0,18.21.0.100,2020-05-27 18:16:21,18.21.0.100
ff615c99-7242-42d8-9553-4f58b4100438,Jennifer Munro,Everytime i sign in i have to do the challenge (letters in the box) and wverytime i do it wrong. But i dont. Its fustrating,5,1,20.10.0.100,2020-05-20 13:10:26,20.10.0.100
e6ac1f58-afe9-4231-b1be-4f11c87d818b,Shane Clabon,Sort it out guys. Keeps telling to update even though it is already it is very annoying. This is still happrning months down the line...,1,0,20.9.0.100,2020-05-24 22:05:14,20.9.0.100
25215c82-fe36-44c4-9f3f-1f594e86b401,Doris Madsen,Shopping with Amazon is always fantastic. Best Customer services and expeditious deliveries.,5,0,20.9.0.100,2020-05-12 21:01:53,20.9.0.100
19324947-6a41-47e6-b49b-26e05f8fb907,Ahmed Hasan,Hi there You guys please give up multiple page display. It would be more convenient one page with scroll down option for more with item number or page number...,2,2,20.9.0.100,2020-05-15 05:11:56,20.9.0.100
dbd3140a-1ab3-42c3-a24f-4a822bcd12f5,Ben Everette,What is going on with Pixel 2?? Now this app won't open. Phone has become complete piece of garbage following latest system update,1,2,20.9.0.100,2020-05-17 18:35:06,20.9.0.100
ca4c143c-92e7-467b-a085-97c9f5c88156,Ashleigh Ducato,"after updating the app no longer works, just says ""uh oh something went wrong on our end. "" Nothing works.",1,0,20.10.0.100,2020-05-28 19:29:05,20.10.0.100
d6381253-edfb-4501-802d-caa3349f1a1d,Adam Cimina,"Installed on galaxy s7 and cannot open just crashes, Amazon no longer does 2 day shipping why am I being charged for a membership service you no longer provide",1,2,20.9.0.100,2020-05-16 18:14:21,20.9.0.100
b49efe7d-3824-4adf-a993-94da774ed2a8,Suzanne Seidel,"Terrible,will not stay on one item,keeps turning the page and nothing there, I'll keep to my iPad in future.",1,0,20.9.0.100,2020-05-11 10:35:34,20.9.0.100
b06c42ef-1dc3-4839-943c-044a1103064a,Victoria Bell,Great prices. Quick deliveries. Lots of savings. Great deals. Loads to choose from,5,7,20.10.0.100,2020-05-27 04:34:12,20.10.0.100
55f91a25-a091-4349-891a-f75ea8af3d0b,Sebastian Michales (The demon from hell),"what's up with the new update that doesn't show the price right away , I'd rather go to the browser that shows the full price and details",1,1,20.9.0.100,2020-05-19 17:07:24,20.9.0.100
42a15c41-7cab-4b75-a452-a552e7bd2eac,Pete Jeavons,"Can't sign out of account, doesn't recognise action it appears. Can't update app nor remove from phone. Total pants 👖",1,0,,2020-05-17 13:53:15,
cef547a9-7619-478b-a126-dda0046ef071,E Mvs,The delivery e.d is awesome 5 stars for them. Customer service is a nice joke and are not helpful at all. 72 hours later waiting on an email that is 24 hours late.,2,0,,2020-05-08 17:18:17,
84fa49d2-4f12-4772-8d0b-a927e3c4369f,Janet B,This app is now totally unusable on my android phone. I can't even get past the sign in page. Absolute garbage.,1,0,,2020-05-02 07:04:59,
94018a04-9f62-4f0c-9ea0-3ff7b34f2b26,maike bükner,Well it worked fine for like pretty much years... But just recently i cant use my bankcard anymore! It just says that it failed to get the Money and i cant pay anymore. Anyone got an idea or solution?,3,2,20.9.0.100,2020-05-05 08:18:20,20.9.0.100
2caf0fb4-ac9a-4128-bcea-4b53484ab6f6,Carole Taylor,"I'm always pleased with my purchases. They arrive on time, sometimes early. Prices are wonderful.",4,0,,2020-05-28 01:50:14,
5cd71c08-b8e2-4de2-9389-95f2e1c49326,Dave Wedlake,This is a ridiculous confusing mess. I was perfectly happy with the Amazon website the way it was.,1,0,14.2.1.100,2020-05-29 01:54:06,14.2.1.100
e2fd2a57-0e2b-4e5a-b05d-0c349dd907f7,Patricia Coon,"I love shopping on Amazon! Better prices, great selection and customer service and support is really good.",5,1,20.8.0.100,2020-05-04 21:21:52,20.8.0.100
490c3f23-83f5-48c1-9252-74a7c63cec1e,Kris,Packages come late or don't arrive at all and prices are marked up. Won't be renewing my subscription for the next year.,1,2,20.9.0.100,2020-05-07 03:35:13,20.9.0.100
263a0ff0-0b8d-4cde-abae-27b3f504d7cc,Akiema John,I uninstalled this app because it keeps closing and it doesn't want to let me shop at all. It was also moving slow.,2,0,18.21.2.100,2020-05-22 23:45:32,18.21.2.100
59d091f0-c581-45b3-9234-31e4e3986e97,Braydon Dagley,They lie by saying 2 day delivery i orderd something and it got delayed 3 diffrent times it was a prime package to it took 1 and a half months to get something that was supposed to be 2 days,1,1,20.10.0.100,2020-05-24 22:59:30,20.10.0.100
d5aa5aa3-32c1-457c-81f5-3859965a4c4b,James Beams,All it does now is throw errors and show me pictures of dogs. If I wanted dog pictures I would have downloaded another app.,1,0,20.10.0.100,2020-05-30 04:59:06,20.10.0.100
1b43ed82-18f8-418b-8ed2-564d130d6c50,Jeremy Prosser,"Amazon is the best way to get what you must have from an online retailer, period and Prime membership is a must.",5,0,18.21.2.100,2020-05-02 05:38:42,18.21.2.100
fe0b29a0-52ad-4f7f-9d6f-74ef95998cac,Humberto Fernandez,Best and easiest online shopping I've ever done. The customer service is great and the person who drops off the package is awesome.,5,15,20.9.0.100,2020-05-07 01:06:31,20.9.0.100
8b4a3d76-61d3-4da0-a958-08f28e38b860,Zack Ibanez,Love everything about the app except the fact there is no DARK MODE. Please give us dark mode for those late night shopping sessions.,3,2,20.10.0.100,2020-05-25 04:55:27,20.10.0.100
5e22cf40-e3e5-466f-8366-55ba8bbdd782,SP_Dec,Latest update broke the app. Images won't download. Some pages are outright broken. I am put off from making purchases,3,7,20.10.0.100,2020-05-23 10:01:47,20.10.0.100
f9f4a6ff-2245-45a0-9255-a7b59d9c0a4c,Larry Dalsoren,"Tapping back button lately doesnt return to previous page,after multiple taps skips previous pages and returns to main screen?",3,6,20.10.0.100,2020-05-24 19:57:20,20.10.0.100
7bf6a13f-92a7-484b-a551-da61e73c3bb2,Tzardonic,Customer service is currently nonexistand and my shipment is going to the wrong address. It won't let me update this address.,2,0,20.9.0.100,2020-05-12 18:35:51,20.9.0.100
13b31637-6bea-4d1e-b903-2d5e15c92c78,jackie yvette,"Crashes immediately upon launch. Unusable since may12, 2020, and I do have the latest android version.",1,1,20.9.0.100,2020-05-13 18:10:57,20.9.0.100
970bd739-f066-42ac-907d-5802094fffd2,G. Q. Brathwaite,"I have purchased hundreds of books through this app, and it's always allowed me to check price and shipping options.",4,3,20.9.0.100,2020-05-16 11:32:46,20.9.0.100
4edd697c-f5c3-4906-87c6-f020666b6a17,Kaylee Davis,"Held my items when I selected free shipping instead of paid shipping, even tho they were both supposed to be the same number of days.",2,2,,2020-05-03 15:22:01,
7945e19b-e703-4caf-952a-a50dc319cf84,Halie Edwards,Amazon is awesome in so many ways! I love to look/shop on amazon. Their products are amazing!,5,0,18.7.0.100,2020-05-14 05:02:56,18.7.0.100
98372a32-6b6b-4a25-9e7c-c598e4deb7ba,Kyra Llewellyn,New update has ruined the way the app looks on my screen. You have to scroll to the side to see anything.,1,2,20.10.0.100,2020-05-21 23:26:17,20.10.0.100
e233d753-1578-4f87-b622-44c829405a2c,Ashley Marsell,Amazing and efficient. Reliable with great prices and all products of all varieties are available.,5,21,20.8.0.100,2020-05-08 02:53:39,20.8.0.100
c2155476-83cf-409e-80ba-c172d7e5e440,Nate Gantt,"Literally one of the slowest, buggiest apps I've ever had the displeasure of using. How is Amazon churning out horrible apps? Too big a company for this.",1,0,20.9.0.100,2020-05-18 12:39:00,20.9.0.100
