reviewId,userName,content,score,thumbsUpCount,reviewCreatedVersion,at,appVersion
14e9500c-76c3-4ae8-9fca-435d82c59fce,A Google user,I literally don't use or care about amazon assistant and it keeps popping up on my screen every day. I just want the drag to wishlist feature back. Having to go into each item to add to list is time consuming and tedious and more recently when I click add to list nothing happens at all. How am I supposed to save items I like if I don't have the wishlist feature?,1,203,20.1.0.100,2020-01-27 06:25:40,20.1.0.100
efe1a49a-9043-49e4-9fab-fc998333ca99,A Google user,"I tried to buy something, but it said that my order was cancelled even though I didn't cancel anything. I tried to buy the item again and it said that it's duplicated. I'm really confused and worried that I might have to buy for several items even though I only ordered one. Please fix your app. And now my account got suspended because the app kept telling me that my order was canceled and I can't make new accounts because of that ðŸ˜¡",1,1,20.1.0.100,2020-01-20 10:56:53,20.1.0.100
607377c9-143f-4b5c-8e1b-dac4d8b9f700,A Google user,"Technical issues since day one. Very poor quality app. Crashes as soon as you open it. Tried re-installing, updating etc. Nothing . Impossible to use. Not fitting for one the biggest companies on Earth....",1,5,20.1.0.100,2020-01-22 12:51:45,20.1.0.100
06d638a3-d0d4-49e6-977b-27f726a5d29c,A Google user,"So, you have to use a 'one time password' to sign in and it's sent to your phone number. When you go to your messages to get the password,, and then go back to Amazon, the page has an error and it restarts the sign in process all over again. This makes it absolutely impossible to even try to get into my account. I had this same problem in the past and had to make a new account. For such a commonly used service, it's ridiculous that this hasn't been fixed yet.",1,92,18.21.2.100,2020-01-08 22:44:05,18.21.2.100
8e6c77a4-7571-49c1-9ac9-a53012cf1d48,A Google user,All but one experience excellent. The one bad experience involved an independent shipper who couldn't locate my order for at least three weeks. The item was huge and the shipper was very uncooperative despite my numerous chats via Amazon.,4,1,18.21.2.100,2020-01-04 02:50:47,18.21.2.100
244052e2-d6cb-4eb0-9b39-7d3d21199422,A Google user,When you call in. Your delivery preferences are not followed. I've asked more than 4 times not to leave deliveries at the door. They do and make it difficult to get return on products you never received because of their mistake. Was 1 day late of return date and am stuck with speakers for a Samsung soundbar that doesn't work. Hence why I was returning them.,2,0,20.1.0.100,2020-01-22 21:02:07,20.1.0.100
3ab8a26e-7488-4bc2-af18-51fe898d36e7,A Google user,"Shipping options all messed up. Selecting same day shipping turns off prime shipping and changes to standard delivery which is about one week. Also, selecting to use an Amazon shipping box does not work. Size and color selections do not work correctly. Received wrong item many times.",1,2,18.21.2.100,2020-01-16 02:48:56,18.21.2.100
86dbc39f-5bd3-4194-ac57-69132e0776f0,A Google user,"Good quality products, hassle free shopping. Great customer service. Shipping is always on schedule and a lot of times my deliveries come early. Always a great shopping experience. I love the new products that are introduced everyday.",5,0,18.21.2.100,2020-01-06 00:59:30,18.21.2.100
351ff099-72b3-4ec1-908b-2714c4828d66,A Google user,"Getting frustrated with this app not working. I shop with Amazon almost exclusively, but as of yesterday, the app won't work. I've uninstalled it and reinstalled it. Same thing happens.",3,4,20.1.0.100,2020-01-23 01:23:11,20.1.0.100
5137f485-6aad-4d33-8664-22d333c03aa5,A Google user,Can't order items as quickly as I used to as when I want to pay the app is loading for hours and already lost my shopping numerous time. In the pass the app was perfect but recently it is very difficult to place order :(,2,4,20.1.0.100,2020-01-21 22:33:35,20.1.0.100
a847063f-32cb-4e34-bedb-c7721bfba2c6,A Google user,App is very unresponsive! It can take up to 10 seconds to respond after a click. Im ready to remove this and just use a browser. The coders of this app need to be fired. It just seems to get worse with each update.,1,9,20.1.0.100,2020-01-15 17:45:00,20.1.0.100
ea64aaa7-0f98-4af7-95f8-c2288b38b899,A Google user,"Great shopping experience however, recently I just received an order and the tracking information has become very slow because it's still saying I have to wait for it; and some of my packages that I'm waiting for don't allow me to view the tracking information.",4,0,18.21.2.100,2020-01-08 21:37:38,18.21.2.100
1d5e0908-bb05-45d7-93b3-da7a2776b9c7,A Google user,"It works well but it needs an option to set a price range when searching for items, it only lets you sort from low to high or high to low but there's no option to set a specific price range",3,2,20.1.0.100,2020-01-22 03:55:36,20.1.0.100
575e9206-a950-4eff-b539-9ef3f296e608,A Google user,"Very good app! User friendly! My one draw back, while I get my order details, I cannot generate an invoice like I can using the online account. No invoice window. Fix that please.",5,1,18.17.0.100,2020-01-11 21:48:47,18.17.0.100
20a1b46d-df67-47ba-b24a-68ed2f9ca564,A Google user,"After a recent update, it no longer allows me to add anything to my cart, nor does it show the actual item. I've tried rebooting my phone and restarting the app but it doesn't work.",1,6,20.1.2.100,2020-01-28 17:33:33,20.1.2.100
84a57efd-3db5-4ed8-9fc4-3ee374d61871,A Google user,It is a very good app. The only thing that you must receive your items personally. I had a bitter experience with Amazon. I have ordered 2 plastic chairs and I was not in the house when they come to deliver. They given the item to my neighbor as my adviced. But they delivered only one plastic chair instead of two.,4,0,,2020-01-06 16:18:08,
52ed77f2-7434-406f-9982-6191fa3236c3,A Google user,"Wanting people to show ID for items that are restricted to over 18s, you now have to show photo ID like passport or driving licence ect even though your nearing 60 yrs of age and have been shopping with them for years! But don't have any of the items required I don't travel so why do i need a passport? and never learned to drive! Not everyone has these! I've even got a profile photo up so clearly I look over 18. Other companies don't ask for these forms of proof! I've even got an amazon new day",1,0,,2020-01-17 10:36:56,
acb86380-9de4-4b41-9489-9af2836a4c9e,A Google user,"Back in Sept I did the free month trial of prime only for it to be cut off after a few days (a week tops), I put a $10 gift card on my account just to have my account locked the next day... I tried contacting customer service several times and they just send the same bs email asking for proof of purchase and info on my debit card I have sent it several times and don't get a reply after... They won't refund my gift card and I can't use it unless I'm on that account ðŸ¤¬ðŸ¤¬",1,9,,2020-01-05 17:13:32,
28bf4c79-843e-449c-bf09-001784288d30,A Google user,"The best designed shopping app out there. The Amazon membership is well worth it if you buy online frequently. Though the app may glitch sometimes, the amazon team swiftly corrects any issues. Well worth the download!",5,0,10.8.0.100,2020-01-08 00:28:45,10.8.0.100
5c9acad0-3563-433c-bdc2-b51902a18ff8,A Google user,You get thousands of options for your shopping.it gives you the freedom of doing your shopping without putting the kids in the car. You can easily do it at 2:00 am when all the shops are closed. I would highly recommend it . Most of the stuff in my house is from Amazon. And the kids love the boxes they make forts out of the boxes!,5,0,20.1.0.100,2020-01-26 10:53:51,20.1.0.100
6571e2de-a8aa-4005-bc9e-6aa863c86b56,A Google user,"Can't sign into mobile app ðŸ˜£ works fine on the internet site. But mobile site says my password is wrong or my phone number doesn't exist. Try using the regular site while having the app downloaded, still basically says I don't exist or my password is wrong. The second I uninstalled the app and went back to the internet site and everything works fine again. Changed my password re-downloaded the app used new password. Still can't get in. ðŸ¤¬ðŸ¤¬ðŸ¤¬ðŸ˜ ",1,57,20.2.2.100,2020-01-30 00:40:34,20.2.2.100
5599e9db-602a-4c59-817f-e37cbc6d246b,A Google user,"Package never arrive. I am write this here because Amazon didn't publish my review on their app. I order a dog teeth cleaning towels but they never arrive. I went and give a bad review, of course only to that product (because my other products did arrive but not this one). I wrote how I was upset of it never arriving so others will be aware. Sadly Amazon send me an email saying they wouldn't publish it. I need my money back and I need that review to be seen by other buyers.",1,2,20.1.0.100,2020-01-20 06:11:42,20.1.0.100
4626f029-4b4a-4f8f-8d01-b46ccfd1f723,A Google user,"I absolutely love it, personally. I've shopped a lot of places I'm my life but they're so many qualities that seems to almost make this company GLOW for me. First of all, when you are down for any reason and can't get out to a store to get certain things needed, order it next day delivery from Amazon!! I can relate 100%. I love this company so much that I'd pack up and move away just to work with them in their wonderful company!!",5,0,,2020-01-03 05:01:36,
3d060135-bb68-426a-a089-5f37503ed603,A Google user,This is a great app. It's easy to use inconvenience. The only problem is pulling up the barcode when you have to return a product. You have to go into your desktop computer in order to obtain the barcode.,4,2,20.1.0.100,2020-01-22 17:32:48,20.1.0.100
0dea8c87-1129-4b37-ac97-ecfce9688b34,A Google user,Always had a great experience with my RBC account to help me with my Amazon purchases.. Only 1 thing missing is the temp.overdraft I always had at the months end. Its now gone and I always needed it for protection in order to help me with my groceries. I never made a mistake with it and for 6 six months ive been short.The RBC always got it back. Thankyou for all the other things ive experiences at RBC.,4,12,18.21.2.100,2020-01-14 05:23:50,18.21.2.100
0594a2ef-d015-4a02-8f3a-8b268d889d83,A Google user,Amazon is a really good app to shop for many different things. You can buy anything at affordable prices which is perfect for online shopping. Also the customer services are brilliant and very helpful.,5,48,18.21.2.100,2020-01-10 22:49:33,18.21.2.100
bc1b8b82-9988-4e10-b329-80de7fc3a3dc,A Google user,"Even with Prime, waited up to 3 weeks for delivery. Only perc is Amazon Video, but the Kodi does all that for free with more. Shipping is much slower than eBay, would not recommend.",2,0,18.21.2.100,2020-01-02 19:21:50,18.21.2.100
645d1602-1885-4494-bdea-0fcd0f6da173,A Google user,Can't install now!!! I press the install button but nothing happens. I have orders that I need to check but cant even get in. Already reset my phone but still doesn't work. Other apps are able to download absolutely fine so cant be issue with my phone. Fix this now!!,1,0,,2020-01-29 18:19:31,
258fdaa1-9dd0-449c-a45f-0fedcaf7211c,A Google user,"Lots of connectivity issues since the last update. They're trying to block VPN usage, so I prefer switching to the website via phone browser, while still using a secure VPN.",1,2,18.21.2.100,2020-01-14 03:04:25,18.21.2.100
4fd69e90-8801-437a-9f71-cbadf7b34583,A Google user,I order two Galaxy s9pluse case. Sent the wrong ones two times. I sent them back from kohl's. I have called Amazon 6 different times . Said that the cases I sent back was damaged. Strange. Kohl's just the item before the sent them back. Still have not got my money back. Or the correct cases.,1,0,16.21.0.100,2020-01-26 01:35:49,16.21.0.100
ca1339e5-0e5a-4d16-ae74-95b218c62651,A Google user,"The delivery system is not working properly. I am not able to rely on them anymore. Customer service is not able to do anything (according to them) to correct their own mistakes. My item was not delivered. The reason was that the gate of the appointment building was closed, I do not have a gate on my building. I called customer service after a long conversation what they basically told me is that no matter what happened, they are not able to help me. I was forced to cancel the order.",1,0,,2020-01-25 17:05:48,
5aa5ee1d-4958-449e-b1d9-f76dce5b29ab,A Google user,"It's very bad experience. They just cancelled my order, that was just 15 km away from my home. I was waiting for product from 5 days. They give me foolish reason, can't deliver on your address. I will never buy anything from Amazon. It's very very bad experience. I am too angry.",1,1,18.21.2.100,2020-01-05 05:50:31,18.21.2.100
227809f7-47f8-4a59-8c41-ce06afd6b7d0,A Google user,When I open a label for a return on my android device and select print it does not allow to print it just blanks and goes back to the print screen. I can print from my device if app would let me.,3,2,20.1.0.100,2020-01-27 22:08:25,20.1.0.100
31ea0e65-aa76-442a-986b-285adf03ace9,A Google user,"Frustratingly complicated system because of ""child safety concerns."" My account is messed up because I believe it is a shared account, I am unable to add addresses. And then when I go back to try again, it locks me out, asking now for 2-step authetication! It refuses to send me the code because it bases off the information from my account and not from my own personal choice. Of course your website would struggle with collecting the correct information. Why is this a design decision?!",1,472,18.21.2.100,2020-01-02 01:14:49,18.21.2.100
74617f8c-7f02-48c1-956f-0e4036e1b44a,A Google user,"Can't save to wish list. Used to be able to and now the clicking on the ""save to wish list"" link does nothing. Uninstalled/reinstalled and no change. Super inconvenient.",1,0,18.21.2.100,2020-01-14 20:59:51,18.21.2.100
acbec285-3ed8-4e17-9bca-9b5a64c2c8a2,A Google user,"My app setting load any searches anymore!! Now whenever I type something in, it says ""something went wrong,"" and I don't know what to do about this. I've deleted and redownloaded the app multiple times and it doesn't help.",1,4,18.21.2.100,2020-01-11 06:00:12,18.21.2.100
004fb0ab-e910-489c-af9d-9b03067ae061,A Google user,The app is too slow. Please fix the bugs. it lags too much. The dev team need to clear all the lags and optimize the app for smooth and fast processing. UI needs to be updated.,3,3,18.21.2.100,2020-01-12 17:23:27,18.21.2.100
4f8b6a86-bcc2-49ea-ac8a-b5e5b26f9c55,A Google user,Honestly I do like Amazon but it's been getting expensive over the years considering how much money it makes and some things can't even ship to where I live and it sucks it's a great place but doesn't fit my budgets.,4,0,18.21.2.100,2020-01-20 00:45:50,18.21.2.100
6378624c-4f4b-4eec-a034-af89aaebb071,A Google user,"Lacks a lot of features of the website. E.g. can't search within category (can filter, but does not show all of them), can't open tabs, so you can't have two products open to compare, etc...",2,0,,2020-01-17 15:57:24,
01b793de-c0ea-405d-b689-a8a488d699c0,A Google user,"Amazon has always been a steady, reliable, convenient, and cheap online place to shop, it's a a Great place to shop with ridiculously fast shipping. It's Always two thumbs up for me personally when it comes to Amazon.",4,127,20.2.2.100,2020-01-31 07:03:37,20.2.2.100
6d21b8fa-2d65-4dad-905d-09ce6617698a,A Google user,"Love Amazon n I turned my family towards doing there shopping there as well you can't ever find a better place with variety and selection as well as everyday low prices different deals to suit everypersons needs and they also have amazon boxes to buy different things and prices and or where can you ship you buy amazon mystery boxes range amounts are affordable you never lose you even out customer returns you can but them cheap etc and I love Amazon ,10/10 so what's waiting for you'll love it",5,1,18.21.0.100,2020-01-12 02:00:12,18.21.0.100
c547565f-4840-4aa8-b848-9c4dc4c57d04,A Google user,I signed up for the 60 dollar gifted card. When it said it will be shipped the next day it said that I didn't pay for it. And had to cancell my whole order. And been taking money off my card without me ordering things. I know that won't get a refund for the money you steal from me so I'm never using this app ever again.,1,0,18.21.2.100,2020-01-05 00:37:10,18.21.2.100
0ffe2ef1-2700-4259-8599-e0bdc2958eb6,A Google user,Buggy. App freezes while I'm scrolling through items. I don't know if it's a bug with Android 10 or if it's a problem with my device. Oneplus 7 Pro,3,4,20.1.0.100,2020-01-16 22:15:17,20.1.0.100
bb22acb2-0110-461a-ac2b-c1f3161987d3,A Google user,Very bad customer service... my account got blocked for no real reason... I spent hundreds of dollars worth of giftcards i bought from a trusted website.. which i have been buying for years.. and when i got a gift card for amazong.. they blocked my account and won't give me any reason for the blockade of my account and 0 response from the account specialist team.. they keep sending me your account has been locked.. without any real explanation.. extremely disappointed.. lost 300$ in that account,1,2,,2020-01-01 15:09:14,
97679a6e-9e4a-4dc5-b16f-7fb3b95f98e5,A Google user,they change the view to some type of weird grid and you can't change it back to list of view. Makes it feel cluttered and overwhelming,2,0,18.21.2.100,2020-01-07 20:29:50,18.21.2.100
8fbeb1b5-0955-4698-baec-c2714ac25a53,A Google user,They took over 500$ out of my account and wouldn't cancel the order when I asked I had to go to my bank and dispute the charges my bank canceled out my card n I canceled my prime. For some reason though today they charged a different card I had used in the past 2 make a purchase with 12.99$ for my monthly prime membership. A CARD THAT I DIDN'T KEEP ON FILE WAS CHARGED FOR SOMETHING I HAD CANCELED ON RECORDING.,1,0,20.1.0.100,2020-01-26 01:37:20,20.1.0.100
58199ebf-40f5-44cc-9788-af21eb113495,A Google user,"So slow. This app slows down my phone to a crawl, and things take forever to load. It's always freezing up/barely responsive. It's quicker to use my browser.",1,6,20.1.0.100,2020-01-16 22:33:04,20.1.0.100
12a11a9d-89a5-410b-9cff-ed9e1607e710,A Google user,Every single time Im searching for something and on like the 4th-5th search page the app stops and I have to start looking all over again. It's been every day numerous times a day now. It's becoming difficult looking for products.,1,0,,2020-01-31 03:16:12,
fb1d1aa8-095a-460a-91d9-c1f2b9bb46b7,A Google user,"I invite the developers of this app to ask your granma to check the.messages you have sent or received from.sellers. See if she finds that option easily ;) Have some common sense PLEASE, it is almost imposible to find this option and there are no notifications in the app for these messages",1,0,20.1.0.100,2020-01-25 15:18:33,20.1.0.100
899d11f4-9177-4114-a34d-e00b41c15729,A Google user,"Horrible shipping, as time goes on the shipping gets longer and longer or delivered to the wrong house and I have to go knocking on doors asking if neighbors have our package. My current order was at our local carrier and was shipped to another state! It was literally at the last stop before my house... it was supposed to me here Monday and here it is Wednesday and told it will be two more days.",1,0,18.21.2.100,2020-01-15 17:09:34,18.21.2.100
5f8bdd29-62a0-41b9-ab80-ca0e4343062d,A Google user,"My account was hacked shortly after installing, and several weeks earlier was sent a phishing email. In Amazon's name. I uninstalled app. Very leery about the security of this app. Would not recommend",1,0,,2020-01-30 17:44:21,
8d8b8ffc-28a8-4e9e-9268-02ca72cc7709,A Google user,BEWARE if you have a gift card! They will jump through hoops to rip you off and steal your gift card money. I am so frustrated.... They won't even try to solve the problem when I call customer service. They tell me to just keep waiting but nothing is happening.,1,5,20.1.0.100,2020-01-25 05:47:37,20.1.0.100
5025d32f-34bf-4b29-a11e-8bc9ef986e1f,A Google user,The app just keeps uninstalling. My phone has been on and installed it 5 times in the past 72 hours. (I think it's a problem with my phone) Besides that everything's good.,5,6,18.21.2.100,2020-01-26 11:23:43,18.21.2.100
2c8ba060-c06f-4797-be8f-675cc8717541,A Google user,Love this application. It has the best online service. I'm a satisfied customer. Is very easy to work with it. If you need help in anything with your order costumer service is there all the way to resolve and respond all your questions and concerns. Thanks Amazon.,5,14,18.21.2.100,2020-01-06 06:13:57,18.21.2.100
2a45b8b5-c51e-4a5c-94ff-e70cfdb0187f,A Google user,Amazon was great to use. Very fast delivery. But it sign me out. And changed my password. Now I dont know how to sign in. Im soo damm frustrated. I really need to track my other three expinsive packagesðŸ˜ ðŸ˜ ðŸ˜¦ðŸ˜¦ðŸ˜­ðŸ˜­,4,3,18.21.2.100,2020-01-09 02:24:50,18.21.2.100
66c17eab-cb20-47e6-bec4-872be6510cc9,A Google user,"What the hell did you all do to your app? I type in specifically what I'm looking for, and it brings up a suggested option, and that it! There's nothing else to look at. You better get with it and get this app back on track. Quit messing with it and keep it simple, stupid!",1,1,18.21.2.100,2020-01-07 07:39:22,18.21.2.100
9e44fa19-8114-472b-8e8c-532ef295375c,A Google user,"Amazon is such a grest company , i love how fast my orders get to me and if they are not the things i was looking for they retuned it no problem . Thanks amazon youre the best! Subscription sale items are easy and effective way to save money on everyday items. Laundry detergent, body soap, papertowels ext.......so much more to say. Ill just say Love You Amazon",5,3,18.21.2.100,2020-01-15 00:09:56,18.21.2.100
3a4343de-7c72-4719-9f87-e8845fdaf6af,A Google user,Extremely slow for the pages to load. Please update the app. I love the convenience of using Amazon but I rarely get on due to the slowness of the pages loading. Thank you,2,3,20.1.0.100,2020-01-21 03:03:15,20.1.0.100
5dd77ae4-00bf-4490-a9e4-c550d8539f55,A Google user,"If you use the Smile program to donate a percentage to a charity, then you need to make sure you have the right version of this app installed. The problem I have with this app after getting that set up, is that it will not let me go thru the Lighting Deals. I can view the few, Deals of the Day, but not the big list of other deals.",3,17,20.1.0.100,2020-01-16 04:36:52,20.1.0.100
3b60213e-795b-44d3-9a9b-aa81586178c5,A Google user,Inconsiderate employes. I got asked to write a review. I did for 2 items i bought. One came in ok still bad packaging but not broken and wrong like the other. I almost got cut on blades for cutting carpet cause they put it in the plastic envlope bags when it is small plastic box that goes around bouncing inside the vehocles for delivery but got mine with blades all over the bottom of the bag. Then they aaked to write a review and i said the same thing and they won't put it up for bad reviews....,1,0,18.21.2.100,2020-01-11 13:39:21,18.21.2.100
5de0820d-dd51-49b9-9ea0-f3423c93b23d,A Google user,"Crashed on first launch, crashed on entering password, crashed on entering two-factor authentication, if it doesn't crash it's a good app, but it does crash... a lot.",3,1,20.1.0.100,2020-01-26 11:27:50,20.1.0.100
05005a66-fad4-4353-93e9-eaf77b4240b2,A Google user,The prime one day delivery is lie. I have a prime member ship and it shows one day delivery in checkout and everytime the order takes 1 week more than 5 days to deliver. And I called the customers service and the worst customer service I ever had. They said they will look into it and nothing happened.,1,1,18.21.2.100,2020-01-10 15:53:45,18.21.2.100
2ed30a3f-41d7-4915-bb11-709282ff668b,A Google user,"Slowest app in my phone! Something as simple as using filter lags and unchecks options because you thought it was done scrolling, or that it recognized your input. Totally useless.",2,4,20.1.0.100,2020-01-16 17:57:05,20.1.0.100
a82a7e8a-5158-4974-8bba-fcb2dcadcbe4,A Google user,"Not a shopping experience I have found enjoyable...I'll stick to supporting my local businesses, prices aren't that much different for new objects anyway...I don't buy second hand from online, only in person, so I can be sure I'm getting what I'm paying for.",2,0,20.1.0.100,2020-01-28 00:34:35,20.1.0.100
4b08cc89-4c0d-4571-9eff-856aa50429ad,A Google user,"Buggy app, used to run smoothly but I find it crashing and freezing often. Ate up 15 mins just to move 5 items or so to a different list.",2,2,18.21.2.100,2020-01-10 05:28:40,18.21.2.100
e4072190-78d1-46dc-b29f-822a84f35e6a,A Google user,The update is absolutely horrible. No longer easy to use! Very horrible experience. No longer shows all items on same page.,1,2,18.21.2.100,2020-01-09 04:14:36,18.21.2.100
d5f29ba0-4fad-4708-84a3-72348cb73bcc,A Google user,Way to laggy on my Galaxy S8. I Try to scroll by swiping up or down and the screen won't scroll until 2 to 5 seconds later. It's better to just open Amazon in whichever browser you use.,1,0,18.21.2.100,2020-01-01 22:30:03,18.21.2.100
fd3ef12b-56e3-47a1-9ff6-e0ba8a6c7e15,A Google user,"My credit card changed a monthly fee, stated in the bank statement as, GOOGLE *Amazon mobile . Followed by xxx-xxx-xxxx numerals, I have checked into subscription but there's none so how to cancel because there no such menu in the app.",2,1,18.21.2.100,2020-01-23 08:58:08,18.21.2.100
