reviewId,userName,content,score,thumbsUpCount,reviewCreatedVersion,at,appVersion
bf25be20-d93e-4d52-b2b1-396caea7d2b1,Douglas â€œAKA LIL Dâ€ Summers,This is the worst place to buy stuff online if you earn a gift card for doing incentives they will block your account and your out money just because they can't get their facts right it's happened to me 3 times and when you give them documents they still don't lift the ban on your account it's total BS I suggest you don't download this unless you want problems I suggest going through eBay or some other online service,1,0,24.10.2.100,2022-09-15 16:41:33,24.10.2.100
23fdeacd-9088-41fd-af5d-63c392019b41,Tim Johns,Scunbag company removes cases from cell phone packages intentionally for phones that are difficult to find cases for... Then sells the cases separately to try to force you to also buy a case from them. About as dirty as making your rocket falic-shaped. Oh and they take the factory charger also and replace it with a useless 0.2 amp charger.,1,0,22.20.0.100,2022-09-18 17:41:48,22.20.0.100
454568b1-ebaf-43b9-b23f-3933b65b2f34,Rye,"Great app but just slow, laggy, and after being on it for like 10 mins it gets really buggy and stops scrolling and can't tap anything unless I get off and back on or save the tab and get back on the tab.",4,0,24.15.2.100,2022-09-02 08:35:33,24.15.2.100
ec86c3d4-7a0f-49bf-a290-6db3aa2f05d1,Gail Quirk,"WHAT experience??????? All I get is your smiley saying to update, and when I do I get another screen saying to ope. Then, when I hit the open button, it goes back to the screen with the smiley face. I can't even get into the App to do my shopping or to purchase anything!!!!!! It's ""F""ing ""BS"". If it isn't fixed in the next few days I'm going to cancel your app and notify b my new service provider and my old service provider that your App is now PURELY BOGUS!!!!!!!!!!!!!!!!!!!!!!!!!!!!!!",1,0,24.11.0.100,2022-09-28 01:36:04,24.11.0.100
c9ff660b-9a20-48b5-80f4-3435e512ac22,Clyde Lee Lee,"Great for shopping for what you need especially for your pet. Very reliable and backed by the Amazon guarantee when a vendor fails the customer. Can't look at your orders lately or menu yet alone search and place orders- September 13, 2022.",5,3,24.16.2.100,2022-09-13 11:28:53,24.16.2.100
1b39abbc-2390-42ec-aec6-0bcf03b21458,Jason Silva,"Very nice app, I wish it would work better with larger phones though. I have the galaxy fold 4. I wish it would make things smaller to allow more to fit on the display.",3,0,24.16.0.100,2022-09-02 23:19:18,24.16.0.100
ad75e268-2c53-42cb-90c1-249af8a7bd28,Alex Colton,I am incredibly angry that amazon has decided to show ads for their shows when you open the shopping app. If I want to browse shows I will open up Prime Video. I don't want to wait for dumb ads to load when I need to browse or shop.,1,4,24.15.2.100,2022-09-02 01:13:31,24.15.2.100
eccc82cd-d1be-45d1-80ae-1aec810a1222,Tony W,Order page keeps auto refreshing almost every time I go to the page. So I can't search for items I ordered as a result. I end up having to use the web version if I need to search.,2,0,24.17.0.100,2022-09-25 00:54:07,24.17.0.100
469f2dd0-1713-46a7-bf34-fe58c53fa43c,Jmo,"Ayo ayo, how come right after I am forced to buy two more things than i wanted due to 25$ minimum for free shipping, they send a notification less than I have time to look at my order saying free shipping any purchases! That targeted af and they prolly got multiple peopleðŸ˜…ðŸ˜®â€ðŸ’¨",3,0,24.18.0.100,2022-09-30 22:53:37,24.18.0.100
c2d9fabf-7a82-48e3-8f67-13b24f1998be,Angel Reyes,"Note 9 - the app will not load , when it requests me to sign in just an infinite loading screen appears. I can use the website on chrome no problem. Ive uninstalled several times and ive cleared cache/cookies. It continues to not work.",1,2,24.16.2.100,2022-09-10 03:38:55,24.16.2.100
911f0daf-787e-47eb-bca6-4e5fe5ce9d42,OneOfMany,"Great app - but demoting to 1 star until I have the option to disable advertising notifications, without disabling account/order/etc. notifications. Add another notification category, for cryin' out loud!",1,0,24.17.0.100,2022-09-26 19:20:32,24.17.0.100
027fbeae-56ad-4040-8332-c985b1b9df31,Lazy Crump,After amazon repeatedly sending my packages to the wrong address they finally figured out the issue was on their side ðŸ™ƒ so after weeks of waiting for my items and never getting them they gave me a 10$ compensation credit which I can't even use unless the item is sold and shipped by amazon,1,2,,2022-09-02 18:12:30,
5f7d01a8-5d79-444b-b66f-1e1ad13f0d2a,Julian Elizabeth Bathory,Amazon customer service I would say is the best in the world. I totally recommend Amazon for all your shopping needs especially prime. I'm from Singapore and I absolutely can't live without Amazon prime shopping. Their after sales service is exceptional!,5,5,24.18.0.100,2022-09-30 16:41:46,24.18.0.100
19c4675f-fda2-4a29-9307-852ffae3e2d3,Brandey Taylor,The shipping is great and on time the only reason I'm giving it three stars is because when I made the purchase it did not take the money from my account like it should have right then and waited until the last minute and therefore messed up my money this app when making the purchase should take the money out from your account right then,3,0,24.18.0.100,2022-09-30 14:44:31,24.18.0.100
b6357095-9ee6-47f2-a46c-2c817d6cc2ea,I eat kids for breakfast,"Every time I try to make a purchase, it locks my account. I have to show prove its my card and then I get my account back after 24 hours, but then it happens again. I have used multiple of my cards to try this aswell but each time the same thing happens.",1,0,,2022-09-04 07:32:44,
91344b11-f53c-4aa2-9087-8fd98d552e4c,Zhehai Li,This app is totally fine- but it is annoying me to find things! Just ok thing but I would have hoped it would have been better. Besides that is it a great app for shopping books! But is my stupid phone would have bad internet so I cant update - it is not Amazon's problem it is a great shopping app,3,0,,2022-09-20 20:51:05,
e03f2671-d7ea-48d5-8b07-e869fb2c4e81,Brenden Starrski,"Useful but they don't give receipts for your movie purchases. There should be a section in your order for those. I'm sure I've bought some old movies that aren't in my purchases anymore. Otherwise, very useful app.",4,0,,2022-09-16 12:09:28,
0fbbb68a-46c5-4cb0-afa4-3d46c63715a5,Jason,"That unskipable ad that has been added on launch is unacceptable considering how much money is paid to Amazon on a regular basis. I'm not even complaining about the normal ads in app or even the prime video ads, but this one is too much",1,2,24.15.2.100,2022-09-02 06:43:18,24.15.2.100
07a06fbf-93ca-4f2f-8bb0-ab809845e7b7,Greg Diaz,"I have 3 amazon accounts. Unfortunately i wasnt told whenever u switch phones or phone numbers apparently u have to update it on ur account BEFORE u switch, because once u switch u basically cannot log back in. I tried calling Customer service but the security questions are ridiculous 'name some devices with their serial numbers linked to ur amazon account' Who has that!? Especially if u move around every year. Now they told me I can link my previous emails aslong as i make a 4TH account.",1,0,24.18.0.100,2022-09-30 15:50:52,24.18.0.100
9af20265-2f0e-4fa6-a7ac-1c38602f10b8,C L,"Can't do same day delivery, so I need Instacart, also massive -- UNSKIPPABLE ads for their video products. If I wanted to see those I would go to that app. Stop it. Deleted and only using the website from now on.",1,6,24.15.2.100,2022-09-02 01:49:54,24.15.2.100
3201d8dd-4f55-451e-895e-1ffee00e0dc9,A M,It's good to use because it can sit at hm & peruse & order items. The app can be cumbersome bc its added so much info that can make it info overload. Their prices have become outrageous. Amazon & Walmart have the best apps around. I had to spk to an Amazon sup once and he was very rude & not helpful.,3,1,24.16.2.100,2022-09-12 22:59:43,24.16.2.100
890250ed-1045-4449-b21c-f81e8603a8ce,John,It's forcing me to watch an add for their new shows before I can use the app. Not cool. Now I have to wait until I get on PC to use it. I refuse to watch an ad before I'm allowed to shop or check shipping status.,1,3,24.16.0.100,2022-09-02 11:09:15,24.16.0.100
49e3bf7f-3cbc-450c-9e72-765fbe16f68d,Rashaundra â€œRaeâ€ Haynes,"Never receive notifications of the statuses of my items. I use to receive notifications when the order was received. The status of the purchase, and when my iten was delivered. Now NOTHING. I do not receive notifications for anything.",3,0,24.17.0.100,2022-09-18 18:23:34,24.17.0.100
4252e0d6-c204-4670-a0ff-178ae48446bb,Rachel Pierson,"Permission overreach. What the hell do you need access to voice recording for? Or my contacts' details? What used to just be a shopping app / website, now takes way too many liberties with users' personal data. Uninstalled, never to be installed again.",1,0,,2022-09-29 14:24:36,
20265338-6b87-4550-9c58-451ca4450be3,Albert Wilson Jr,"Horrible customer service, especially Amazon Fresh. They didn't deliver my food because of driver problems and then don't properly refund to the correct method when I called to find out what happened. Not to mention I had to make 2 phone calls because they hung up on the first phone call.",1,1,24.16.2.100,2022-09-15 22:51:39,24.16.2.100
245fc7e6-97ac-4a50-a5e3-06837855afc2,Cobalto Iridium,"Lately this app works bad: - If I switch countries I can see at the bottom the amount of items on my cart but if I try to open my cart this app always shows my location geography cart instead - Now I have to resort to use the web-browser to admin my carts (US, MX and JP) Please, fix the application!!!",2,0,24.17.0.100,2022-09-17 15:47:20,24.17.0.100
6633001f-02e2-4529-b34f-167190b5d106,Steven Henderson,"I have to update this app weekly in order to use it. Yes you heard that right, weekly. I attempt to view my order to check the status on them and it just loads and loads and loads. I have to open the play store and sure enough, there's ANOTHER update due.",2,3,24.17.0.100,2022-09-16 15:27:42,24.17.0.100
54be2054-2ecf-4eab-8543-c2cc3b91b1b2,Al B,"I used to like it, but adding autoplaying video ads to the app is the lowest move. Now full screen ad on startup, absolute garbage app, Uninstalled. You get my money but that wasn't enough so forget you!",1,18,24.16.0.100,2022-09-02 03:01:28,24.16.0.100
e6cc7f60-278d-4aef-9848-22f1fab6cb88,Sonya Hamilton Long,I've shopped a lot on the app and the problem I have is the picture Ã²f the products doesn't always show what you are receiving and when you go to send it back you have a problem I want my moneys worth and that's fine final!,3,0,24.17.0.100,2022-09-19 00:46:11,24.17.0.100
56bde89d-78c7-4001-8267-552e63fbc0c1,Sam Nadim,Everything is good but membership is a little high. The app UI is nice but one thing I don't like is the unrelated videos of the product when you scroll down on the product page.,4,1,24.16.2.100,2022-09-13 01:54:10,24.16.2.100
422dede1-6c56-4e9d-beee-90c4f62ed5b3,Matt Rathbun,"Great, a full screen ad that you have to sit and wait through when you open the app. I'm literally opening the app to buy something, why are you keeping me from doing that? The thing you're advertising is already on the home screen anyway!",1,10,24.15.2.100,2022-09-02 13:23:47,24.15.2.100
8cfa8eb8-9c53-4f32-9ac9-9900cd1ccc42,Alan Strachan,"App no longer works. Only the ""home"" and ""cart"" buttons works. Everything else just displays a white screen. It appears as though Amazon no longer want people to shop with them",1,1,24.18.0.100,2022-09-29 22:49:39,24.18.0.100
ca1d9f23-48b1-46dc-b2fa-583344223166,Andrew Bristow,Is this an app for Amazon shopping or a full screen advert delivery app? I know you spent so much money on Lord of the Rings that you had to put the price of Prime up to recoup your losses but annoying your core shopping customers is a really bad idea.,1,6,24.15.2.100,2022-09-02 17:28:29,24.15.2.100
b15b3806-4f51-4787-bf49-588c8b94302e,Calamari Calamari,"The my account tab, or whatever it's properly called, will not load. The rest of the app is basically functional, but can be unbearably slow.",2,0,24.17.0.100,2022-09-23 22:08:11,24.17.0.100
21176bf1-5d96-4e25-ab7f-0b09b86392a3,Molly Barist,"App is unusable since the latest update. Constantly getting the error ""unable to add to cart"". Search function brings up items completely irrelevant. Awful.",1,4,24.17.0.100,2022-09-17 18:28:36,24.17.0.100
0a6956d1-8b5b-4db2-8c6a-6c4ab717d035,mark yearwood,3 times now i purchased something that advertises as delivery next working day for it change it as soon as the purchase is complete and amazon have taken my money. All the times amazon have said its logistical so why not advise this before you take my money and give me option of going elsewhere instead.,1,1,24.17.0.100,2022-09-22 16:34:22,24.17.0.100
4927ad5a-73e1-434f-926e-c1df41f4f4bc,Thomas Dean,Terrible customer service... their product has steadily gotten worse...shipments not being delivered...or deliver to the wrong address...then they make you got back and forth between them and the shipper. Makes you really value the old brick and mortar business for your ability to see what you're getting.,1,0,,2022-09-28 10:07:34,
3da56b3f-2533-472b-9137-03ba8cf35c81,Estefania Romero,The worst thing since they change the app and mixed all the settings around. I feel like in a circus... It is a headache just to check orders... Why did you guys change a perfectly made app to this ridiculous thing? I can't for the love of God change the country and the agent is taking centuries to respond a single request. RIDICULOUS!!!!,1,1,24.17.0.100,2022-09-17 22:15:33,24.17.0.100
cf976b32-6f20-4e35-beb5-6903639c1785,Shelley Pinegar,The latest version forces me to watch a commercial upon opening?? I couldn't possibly dislike this more. I pay for prime and just want to shop for something. I don't want to have to watch your promo for some movie you are promoting first. Horrible mobile experience!!,2,2,24.16.0.100,2022-09-02 17:55:49,24.16.0.100
13745ce6-4eaa-4803-ac1e-c03a145e4754,Ace Watson,"Everytime I go to purchase something it goes through but keep saying check payment details. I know for a fact my card is active, I have money to get the item so why do I need to check the details for my payment? Once thats fixed maybe I'll buy from Amazon again. For now no never again.",1,0,22.12.2.100,2022-09-06 00:18:12,22.12.2.100
695913f3-a7cb-4beb-9ceb-2bb04b3c876d,CRABST3R !,New update is a joke been getting adds trying to reach out to support is way harder then it should now things are horribly laid out. And top it off a multi billion dollar company who net profiter over 350billion dollars from COVID in one year is now pushing ads in the app. Lately I've been getting a lord of the ring add on launch,1,3,24.16.0.100,2022-09-03 02:11:46,24.16.0.100
db596aea-c5e5-4ed2-9118-c8fa3cb468d0,Ray Parker,"Amazon: if you don't kill the NFL notifications, or give me a setting that does, I will not only uninstall this app, but will also consider cancelling my Prime subscription. I do not pay you for the privilege of becoming your advertising crash test dummy, and I am offended you think otherwise.",1,1,24.16.2.100,2022-09-14 15:41:41,24.16.2.100
192fd6b9-f3fa-4089-996b-b522ad884c29,BRENDA BEE,Not liking the new update. It is not clear of which ones are my recent orders. Total mess. They need to separate the delivered orders and the ones that are still pending.,3,0,24.18.0.100,2022-09-27 23:33:57,24.18.0.100
a5f1bba3-9a05-4add-9b78-12c0f8e1a097,M M-Z,"Despite having a yearly household subscription to Amazon Prime, this app says that my prime membership was paused asking with my benefits as a Prime member. The only way to prove that I have a membership is to order something with Prime, which makes it difficult to get anywhere about Prime with their CS reps. Useless.",1,4,24.17.0.100,2022-09-18 04:04:55,24.17.0.100
5482de2d-e33b-4dfb-af12-f91ab8b80800,Kevin,"I just made an order and while all items were free shipping, they still wanted to charge me $6 for s&h. This kinda goes along with McKenzie Scot's review of her ex-husband and his lack of character. I'll be buying my items on EBay, where they don't scam you.",1,1,24.15.2.100,2022-09-01 00:53:40,24.15.2.100
67738e9e-b006-4851-9e1f-b95a6e38a50c,Darlene Hendershott,I am so glad to see that I'm not the only one I just got done telling somebody on the customer service and I don't understand what's happening to Amazon because this past year at least since like beginning of Summer and right now since like January I've had nothing but problems with Amazon with their delivery we're trying to talk to somebody I just found out 10 minutes ago they've been charging me for for months since 2020 since 2020 for prime and I'm supposed to get it with my phone membership,1,0,24.17.0.100,2022-09-24 12:13:36,24.17.0.100
9e44eb19-e33e-4b8e-8a4b-7840225cd221,Retr0,"stuff bought here is wish level quality, even if you try to find quality products. ***UPDATE*** why is it when i search for a certain product and sort low to high, i end up with products that are not what im looking for?? stop letting your sellers tag stuff their scam merchandise. oh, and good luck getting a hold of support, they dont exist",1,0,24.16.0.100,2022-09-07 16:54:10,24.16.0.100
ac75cbee-574a-4a8f-8f6c-126a0a2521b1,Sandra Gregory,"Not much on posting reviews but decided to today. Amazon helped me out with an issue on one of my orders and I have to say, I was very happy about how they went about it. I will definitely keep shopping with Amazon...",5,2,24.15.2.100,2022-09-10 19:58:40,24.15.2.100
a8144b15-3223-4c70-943d-440c830ee232,Mark Reis,"Returns are annoying. I used to be able to print a label, and drop the item in the USPS or UPS box. Both of which are on my way to work or home. Now to ""reduce"" the trucks on the road I have to drive 30 minutes to make a return. Great way to shift the expense to the consumer and put more cars on the road.",2,1,24.16.2.100,2022-09-11 23:15:00,24.16.2.100
a06933f4-45ab-404e-b831-8c1146a80442,Anna RaczyÅ„ska,Why the hell can't I browse products in many countries and languages? In mine there's nothing available so I usually order from abroad but I can't do that through the app which makes it unusable for me. And having to stick to the language I don't want just because of my localisation is so annoying,1,0,,2022-09-18 00:13:10,
b92a2b96-494e-400c-bf55-1cd370bb3e52,Jeremy Griffin,I don't recommend using Amazon if you ever actually need help from somebody you'll never get help all they do is keep giving you stupid screens telling you to do this do that but they never actually give you someone to talk to or someone to reach out to when you need real help. In short Amazon sucks.,1,2,24.16.2.100,2022-09-09 17:42:36,24.16.2.100
8caf59e0-6433-4fc0-a7da-875766dc64da,eat1ng fl3sh,"Sure, its a good app, but it is so ANNOYING that i have to get a verification from both an email and a phone number just to make an account. Its really frustrating especially when my phone number doesn't even give me my codes.",1,0,24.13.0.100,2022-09-11 07:12:32,24.13.0.100
64f22aa9-a725-4b53-86d7-71aaa6a57dc7,Thomas White (GeekofNature),Forcing me to watch an ad every time I open the app is an easy way to lose me as a customer. For the foreseeable future I have deleted the app and will only access Amazon in a web browser.,1,3,24.15.2.100,2022-09-02 15:53:33,24.15.2.100
e1207087-1a5c-44f1-bb50-d6d1652dc631,cheyenne ngoytz,I called customer service to see if the packages I had already paid for were coming and it ordered but never shipped...I spent $300 for the items in the packages that were supposed to be delivered to my house on September 1st. I would give it no stars if I could cause Amazon corporate headquarters kept me on hold a whole hour,1,1,24.16.0.100,2022-09-05 20:38:27,24.16.0.100
57438817-a03b-4f93-98f9-70ccbd0c0431,Cheryl Wilson,"Uh oh something went wrong... This app keeps crashing. I've tried force stop, clear cache, clear data. I've even uninstalled and reinstalled this foolish app with the same results. This thing is junk",1,1,24.17.0.100,2022-09-20 12:09:42,24.17.0.100
c6543ea9-9725-40dc-8e1c-43531b350187,Jessica Steele,"For whatever reason, the emails & notifications from this app have been coming en EspaÃ±ol lately. Luckily I'm moderately fluent in Spanish but HuH, what's the deal with that Amazon ðŸ¤” The only other issue I have with Amazon is that my delivery preferences are NEVER followed. Me: Leave the package & please ring the doorbell. Each & Every Amazon Driver (except ONE): NAH BRUH... Takes picture ðŸ“¸ then leaves... Me: ðŸ™ Make it make sense Amazon ðŸ¤”",4,0,24.15.2.100,2022-09-01 09:26:21,24.15.2.100
5f7c9f4a-631f-4139-8cb6-8525feb0ae5e,Jess V,Needs Dark Mode. The app is easy enough to use. Sometimes it locks up and has issues that shutting down and restart helps. Just really needs to have a dark mode.,1,3,24.16.0.100,2022-09-03 08:22:58,24.16.0.100
ca8a97af-7686-45ba-bb9c-e1dcab368d1e,Mark Beals,Fing terrible. My phone number changed. I logged into my account and tried to change it. Amazon locked me out of my account and every time I try to logg in they send a confirmation code to my old phone number. Tried customer service but even though I could name everything in my last 3 purchases and gave them my address and billing info. They won't help me. After I get this fixed to have access to my digital content on the account I am done shopping on Amazon. They just lost thousands a year.,1,0,,2022-09-12 14:06:22,
74acc5d9-4f34-4a1b-97d6-c449c485478c,Andrea L,Absolutely hate the ad that pops up immediately upon opening the app. I don't care how short it is. We are bombarded with Amazon ads everywhere online as it is and now we're forced to see yet another ad when we voluntarily open the ap? When is it enough?,2,3,24.15.2.100,2022-09-02 17:56:00,24.15.2.100
ecb71a97-dac0-4fa5-b938-7b6dfe6aaf57,Christopher Acosta,they clearly don't want me shopping. first i was getting ads to join prime despite being on prime through a household. now there's also a full screen ad for video every single time I open the app. ridiculous. uninstalling,1,15,24.15.2.100,2022-09-03 13:22:36,24.15.2.100
c1f3bdb8-d9f9-450e-9537-9ab50ad48853,CLAUDE SINGLETARY,I always order from Amazon. I like the cheapest deal. More convenient earlier to order online. You can't get better deals any place else,5,0,20.14.0.100,2022-09-18 22:45:14,20.14.0.100
2a47b681-963c-454f-9f18-25415a2ee0ce,Tony Stephenson,"What a pain! I just wanted to get my locker items not download a huge app in an area with bad service, wait outside because I don't get service in the store. Go through allowing a bunch of permissions I don't want to give it.",1,0,24.18.0.100,2022-09-28 23:12:22,24.18.0.100
52beb43b-b1b7-4097-a545-5dfca0538f2c,Webster Daniel,"Amazon is like a Mega-Mall of an app. It has millions of merchandises, an eGrocery store that takes E.B.T. Cards, also gives you half-price prime membership discount for SNAP/Medicaid Recipients!! It also provides two day-delivery, NEXT Day Delivery, and Same Day Delivery, how cool is that!! They also notify you when on delivery day when your package is on it's way, you can even track the driver on a map your phone that also tells you how much delivery stops the delivery guy has to make first!!",5,1,24.17.0.100,2022-09-24 03:16:08,24.17.0.100
469a6b98-828d-41cc-b3fc-ec32458fc26e,Apple Apple,I just wasted 25$ because I bought the book with a gift card no problems for 3-4 days but then they locked my account asking me to verify ownership of the gift card only problem I threw the gift card to the trash because everything was fine but now theys no way of verifying ownership so I just wasted 25$ on that gift card but now I know to not buy from this app,1,0,,2022-09-01 03:28:41,
56379be0-2ccf-48b3-81d3-458278f2b942,Katie (Vintagemomma),App tends to crash on me lately in the middle of searching and then I lose what I was looking at. The font is smaller than usual. Stop trying to fix what wasn't broken in the first place.,3,1,24.17.0.100,2022-09-18 01:36:53,24.17.0.100
7c6848ea-8dfb-430c-b597-aa48aa4459ce,Zach Coakley,"Suddenly I'm getting a full screen ad I cannot skip when opening the app. I already pay for Prime and never actually get 2 day shipping, now I have forced ads too.",1,17,24.15.2.100,2022-09-02 10:48:39,24.15.2.100
75a33ff1-f223-43d5-af39-8a7ce56610c5,Chopper Krios,"The view invoice option does not exist. I've searched the section that the Amazon official help page says to find it and it's not there. Either they moved it and failed to update the information, or this is a malicious attempt to avoid RMA by making the proof of purchase inaccessible.",1,0,24.16.0.100,2022-09-03 19:05:00,24.16.0.100
1296b923-9556-4c0d-ba86-26112ff0cc68,Liz Albertson,I Love it but you are taking 14.95 for one thing every month and 14.99 1 is for Prime Video and I don't know what they are both I think when was one is prime but I don't have a prime card if did I would be able to shop for food and drinks as well snacks for my Grandkids and for the big kids to my daughter and her husband to so the little kid has their own snacks and daddy will have his own snacks but you my snap was turned down by whom ever is on the other end of my order and all food is good,5,1,24.16.0.100,2022-09-07 05:11:51,24.16.0.100
3a803e08-a0fb-46b0-9a69-7a1130c674d5,Kate Winder,Doesn't work. Simple as that. Considering Amazon is one of the world's biggest companies there's no excuse for an app that doesn't work. Doesnt load. Have tried on 2 different phones and an android tablet.,1,0,,2022-09-16 08:59:28,
