reviewId,userName,content,score,thumbsUpCount,reviewCreatedVersion,at,appVersion
17fb5c3f-8706-4f45-8380-916a9c8cf598,rad guy,"How do I go back to previous versions, you would think Amazon would be all about fixing this as it makes me not even want to use the app, can't scroll, doesn't load products, freezes.",1,3,22.20.0.100,2021-10-20 23:41:03,22.20.0.100
28991a73-137a-46f6-b530-9ddcabcb6db4,TenseS1N1STER,"Absolutely horrible! I used to love Amazon back in 2018, then in 2020 thats when they started locking my accounts for no absolute reason. I would submit so many documents and it just never work! So like two days ago I created a new account in hopes to get my girlfriend a gift and my mom helped me pay for the gift with her card but since my account was new, it was locked due to ""suspicious"" activity and I've submitted 3 documents proving i had permission to use the and card and still locked :/",1,0,20.22.2.100,2021-10-17 15:54:01,20.22.2.100
d3eabe84-c647-46d0-bcf1-c5b123141ae8,John Anderson,The app is obviously having issues and wish they would fix it as cant scroll through my wishlists and it keeps jumping and wont scroll i have tried this online and in the app and either way wont let me do it. Really bloody annoying so amazon sort out ur app!!,1,2,22.19.0.100,2021-10-07 14:16:58,22.19.0.100
4b43eba8-d6fe-469b-9c96-a70c9537997a,SHANNON DAVIS,Horrible!!! The app was working fine. Now I can't order anything on here. It shuts down immediately. I use to order every other day to nothing!! Too bad!! Still no resolution...keeps saying oops something is wrong!! I would like to use this app one day. I reinstalled 3 times! What is the problem?,1,17,22.20.0.100,2021-10-27 20:41:43,22.20.0.100
8151e656-ce14-4dd7-a8f3-0d96d4bfbafb,Kate Bramley,Since the update there are so many issues with the app. Mine constantly freezes and boots me out and it's almost impossible to use the chat facility.,2,2,22.20.0.100,2021-10-19 11:47:24,22.20.0.100
e0aebef9-58a8-4b2c-81d7-51208c853a68,jesse alkema,"Almost instantly crashes after app install, made a choice for region and language. After this the app keeps crashing at boot. Deleted cache and app data but keeps reoccurring.",1,2,22.20.0.100,2021-10-27 18:59:06,22.20.0.100
c5bd928c-46a2-4c1f-ab09-391851198abc,Lukas Manion,"Until Amazon fixes the use of scam accounts and fake products that never arrived from Yung Express, this app deserves a 0 star. Shipping times are ridiculous anymore, it's easier just going to a store now. Of course Amazon won't fix it either but it's money first, customers second. Kind of sad we didn't send Jeff to space permanently, he's no use down here obviously.",1,1,22.19.0.100,2021-10-15 13:31:15,22.19.0.100
ac4ccda9-6aa8-4597-9ca4-a8c05616b739,Valnie Romain,I don't know what happened but app sucks now. Almost every times I search for something I get a pop up oops something went wrong and I can no longer view my Alexa shopping list. Please fix this problem before you start loosing customers.,2,2,22.20.0.100,2021-10-15 19:00:39,22.20.0.100
554f16e5-5ff9-4c1c-af2b-bbea657bb1c5,Potato Chip,"Forcing me to receive notifications for things I have never wanted disrupts my peace. But yet you think your too valuable to be muted. So quite frankly this is useless to me because I don't want unnecessary useless annoying notifications, just so a tiny percentage can be donated. Just sounds like your trying to get some tax benefit at the cost of my peace.",1,0,22.19.0.100,2021-10-17 16:37:54,22.19.0.100
3eb9c339-60b4-48f5-9c66-ddc915cd1c3e,Jonathan Daylett,"Very frustrating to use. Can't scroll down a wishlist because it keeps glitching, can't see what I'm typing on support chat because the text box is hidden behind the keyboard, etc.",1,3,22.19.0.100,2021-10-13 02:28:32,22.19.0.100
2d81037e-27ea-40c6-8266-e26b48c4b2dc,Marne Burke,I've been an Amazon shopper for years. Spending thousands every year. I had a phone glitch and am not getting a search bar in the application. A offered 60 help IF I pay for it!!!! Give me back my account and a search bar.,1,1,22.20.0.100,2021-10-21 03:51:29,22.20.0.100
93f0b02f-f7dd-4277-91af-8eb3f24f494e,Lyndsey,Hate the Ui now. Ever since this new Ui has been released its doesn't function well at all. Almost every single time I choose any of the tabs/categories etc it opens a different one then intended. Navigating this app is horrible with this Ui.,2,1,22.20.0.100,2021-10-28 18:05:38,22.20.0.100
ceb46506-1b59-42e2-ad07-d479e02be1fa,Brenda Davis,"Amazon shopping is convenient and helps me to avoid crowds associated with brick and mortar shopping. Prices are within my budget, and items are received timely and are easy to return if needed. I'd rate them a 5 out of 5 for custermer satisfaction.",5,0,18.14.0.100,2021-10-04 12:06:44,18.14.0.100
b86e3737-f9d5-41d8-869f-aa7256823f80,Jennifer Davis,"The last update RUINED it. It's really frustrating to use now. Slow, freezes, can't navigate account details. It was great before. Why did they mess with it?",1,2,22.20.0.100,2021-10-22 11:48:53,22.20.0.100
ace1a79b-f9f1-438d-8ae5-a3b24d75bd05,Must Haves Amazon,"I love the app, but Inhave to agree that lately it's slow to load some info or my loved wish lists, I thought it was all the junk on my phone and but still after clean it all... same goes for the tablet version. Yeah guys fix it and everything it will be alright!",4,10,22.20.0.100,2021-10-23 07:33:06,22.20.0.100
d53a4cf7-02b1-431d-a71c-cc631d4fae35,Kaylee Cancino,"I like using can be cheaper than other places majority of the time. Still love this App can find lots of good deals and cheap prices. Since COVID starting to do more online shopping for certian things, AMAZON has been a huge money saver this last year. 10/21",5,9,22.19.0.100,2021-10-11 12:24:33,22.19.0.100
b8aac298-7bb3-4627-b3db-62e20b4dec35,Anne Mason,App has been terrible lately. Loading horrifically slowly and constantly freezing for extended periods. This is a new problem and it should be addressed.,1,3,22.19.0.100,2021-10-09 04:25:18,22.19.0.100
b6c7ebd6-b537-486d-92d9-5d0c1a303736,Chary Vazquez,"I don't have any complaints at all. But they should modify, I'll explain: if someone that is an Spanish speakers do the search in my account Amazon automatically change the language in spanish without asking... then comes the problem: if Iam a English speaker finding out how to change the Language is a PAIN. I can't find where. Please modify to 👉🏼ask👈🏼 before automatically change it.",4,10,22.21.0.100,2021-10-31 23:40:01,22.21.0.100
100f8a43-b754-4629-9aa6-8da689c08cd3,Ed Marmon,Edit. Still having the same issue as of October 8th. Not working anymore. Have to uninstall and reinstall on my A71 to get it work. When it is working it does work great.,2,2,22.19.0.100,2021-10-08 22:19:03,22.19.0.100
b3d606cf-f1cd-4035-9555-748900a12b89,Fred Lennox,"Don't like that it stays open. App could be useful as I shop all the time, but I want it logged out when I leave. But when I go to open again it recognizes me, and that tells me other information is there also. So stop hitting me with the app pop-up every time I want to go into my account. 👎",3,0,,2021-10-22 14:08:44,
ea62bb8b-4faf-4985-8d1a-7834f8a7b4ae,This-N-That Custom,"This update made the app useless. Keeps freezing, white screen. I've tried uninstalling and reinstalling many times. Recycled power. Nothing. Can't shop! Thanks for saving me money amazon!",1,1,,2021-10-15 12:06:21,
fdf7750b-109f-415c-a661-fde17df474a3,FAT BEARD (Fat_Beard),"It does the job, but i like the website better when shopping. I feel like i can do campair more items. Sometimes i find the same item on the website cheaper then the app.",4,1,22.20.0.100,2021-10-18 16:34:20,22.20.0.100
f10fece3-7ba6-4695-b558-9a9925645361,Mitch McQuoid,Hasn't worked well for a month. Something is causing lots of bugs rendering useless. Needs major overhaul. All links lead no where.,1,1,22.19.0.100,2021-10-13 01:31:42,22.19.0.100
d1eb130c-e9d1-4341-932d-373761b42a16,Stevie Zerø,This app has been driving me insane since I started using it years ago.Screen freezing and going blank unable to do anything in peace.I stopped shopping on Amazon because of it and also how insecure it is.If u forget to log out you can guarantee your account is going to be hacked more than once.,1,0,,2021-10-19 07:38:05,
1fa29620-ca2b-402c-b438-34721ef526b9,Taylor Sellers,"Used to work fine but now glitches and freezes so often it's become unusable. Wouldn't recommend using the app - it works better via the website, at least on a google pixel.",1,3,22.20.0.100,2021-10-23 15:19:18,22.20.0.100
03fd37a5-8ca1-4c1e-8efe-356b938ca1d4,Menu Mystique,I have used Amazon about a half dozen times over the past few years. Not once have I had a good experience... never. I have been waiting about 2 weeks for a tent that I purchased. It is late and I just found out that delivery was redirected and now I have to drive 20 miles to pick it up. There are Amazon trucks all over my neighborhood 7 days a week. These tend to ignore basic driving laws and are butt ugly. They congest local traffic by using double parking as the norm. Prices not good.,4,5,22.20.0.100,2021-10-16 20:50:30,22.20.0.100
63bc0613-0905-4098-818d-8c749b1973f3,Kevin Coggins (KevC),"Constant lag and freezing as of most recent Android update. Uninstalling before Prime renews. Will definitely attempt to use Amazons app again down the road sometime. It's a mess right now, though.",2,3,22.20.0.100,2021-10-24 00:49:42,22.20.0.100
75768048-e4ca-45cb-a9a2-d48038e62fa2,Ant Morgan,"Latest update is terrible, item name / text when browsing lightning deals is partially obscured by timers. Looks like a poorly implemented web app now, with wasted space and boxy appearance.",1,1,,2021-10-21 23:58:52,
78e9f5b3-1717-4426-a46b-00ca1c3bcca4,Gabriel Tobing,"When I opened the app today, they showed me a screen to pay for Amazon Prime. There was no 'No Thanks' button visible, and you had to scroll down. Making people believe the only way to use Amazon is if they use Amazon Prime. This is scummy, and because of this, I'm giving it 1 stars.",1,19,22.19.0.100,2021-10-13 21:54:19,22.19.0.100
f38d6c2b-1cc3-4dc7-9ea4-13a7e6d75f44,Peter Szymanski,"Roughly since the change of the icon the performance of the app went down. Issues with scrolling pages, irrelevant advertisement on the home page/screen.",3,0,22.20.0.100,2021-10-26 01:41:34,22.20.0.100
e02b4f7a-51df-4990-8e37-6f63bd1d6f89,Stephanie Lynch,Why is this app freezing ALL THE TIME now?! It's extremely annoying and makes searching for things very difficult because the only way to fix it is to close out of it and reopen it.,3,3,22.19.0.100,2021-10-03 20:36:26,22.19.0.100
b1c0938c-bfbd-4fa2-ab97-dc7157c97d0e,Pamela Healy,"Hi I get phone calls from Amazon every week, about purchases, and I am sick and tired of telling these people that I have not purchased any thing from Amazon and I never use the app. I wish they would stop ringing me, and when I explain they swear and curse me. And I get there calls and answer and they hang up at least 3 + a week, I have an idea that it has to do with a scam, my be. I get messages saying that my parcel is ready to be sent but of course I have to pay for shipment.its a scam.",1,0,14.0.1.100,2021-10-11 09:21:36,14.0.1.100
51fb51c5-b19b-49b6-a48a-a22bf5c4c7bd,Carl Douglas attuned,"They will charge for products you have not ordered. They will sell you Amazon made products when you do a search for a brand name, and wont even tell you. They use other brands marketing to push their own cheaper products, they will scam you. They lose your orders, they just erase history. NO CUSTOMER SERVISE.",1,0,22.20.0.100,2021-10-19 16:31:50,22.20.0.100
f0652237-f282-4750-8cae-5cda818e9b90,Stephanie Gemino,"What is happening? All of a sudden I can't see all the photos, every time I click something the app lags, and I can't even get to the reviews sometimes or the app totally freezes",2,1,,2021-10-17 21:01:55,
22285ad4-69be-4dc8-a525-529a6bda6a93,Kanishka Jaiswal,Returns policy is getting worse and worse. Replacement only on products like non-electronic laptop stands or furnitures doesn't make sense as you need to check the quality before buying. But thanks to amazon I was already stuck with an office chair that costed me 15 k and wasn't even good. Gonna use this app less and less now onwards.,2,2,22.16.0.100,2021-10-01 05:41:31,22.16.0.100
5b2a082d-539c-49ce-8734-60787691c5d0,Kerem ÖZIŞIK,"You can't see the invoices of the products you bought in the mobile app, while you can in the desktop version. Asked the customer support for the reason and they said ""the mobile app is designed that way"". Huge inconvenience.",3,11,22.20.0.100,2021-10-22 09:31:25,22.20.0.100
82753bc1-4c68-4f26-8e70-7f712003f749,Karlee Allison,Keeps reverting to Spanish ever single time I open the app. Extremely extremely annoying. No matter how many times I change it back to English it keeps reverting back.,1,2,22.20.0.100,2021-10-19 11:29:06,22.20.0.100
f81fa3c3-819f-4e24-8890-dde6f8d27b1f,Oz Ozel,The new app logo is really bad and I don't get why it was redesigned. I can almost promise purchases will drop because users will be less likely to tap on the logo to browse for products. It's a very unfortunate miss for the Amazon UX team.,4,2,22.18.0.100,2021-10-01 07:58:49,22.18.0.100
e9ae5f4e-a581-4c73-ac32-712daf768179,Marvius von Borillian,"Suddenly started to show me ""Something went wrong on our end"" for every page in the app. Clearing storage and reinstalling the app didn't help.",1,1,22.19.0.100,2021-10-14 07:00:59,22.19.0.100
dd0c9e42-4e2d-4f6f-8e69-3598a871e8a4,Angela Marino,"I've always loved the Amazon app but lately it's been very glitchy, lagging and when I try to scroll through the pictures they won't move. Hope to see this get fixed!",2,29,22.20.0.100,2021-10-22 09:10:32,22.20.0.100
a8b65640-6b39-4017-9320-c0e58780e278,Nicole Miller,New update is so slow it's unusable. Every scroll or swipe takes 10 seconds to catch up. None of my other apps are doing this. It's been a week now and nothing has changed. Guess I won't be buying anything.,2,1,22.20.0.100,2021-10-24 21:21:49,22.20.0.100
a4fd1a7e-2598-4afd-a4bf-aa0817efd1e8,E2008GTGUY,"Generally good. However, even on the latest Samsung S21 ultra, when opening the app i just get a blank white screen, and only pressing the back key does it finally show anything.",2,3,22.20.0.100,2021-10-17 17:25:24,22.20.0.100
bb0a3077-16fd-494a-ab44-2407d8440436,Jason Pollace,"I Love Amazon. The prices may not be as cheap as Ebay at times but, there's a ton of other items to choose from. And, I would say there is more items that have more quality.",5,8,22.19.0.100,2021-10-07 04:55:24,22.19.0.100
87ffb605-90fc-4e2c-9d45-652341d4541b,Janelle Goring,"Since last update: the app barely runs, pages taking forever to load (if they load at all), after pages finally load they refresh for no apparent reason. What exactly was wrong that you thought needed fixing?",1,3,22.19.0.100,2021-10-07 21:59:03,22.19.0.100
aea26781-e6d5-4d37-a199-3abdf2803617,"aka.christian, dylan Moreland","Ever since update this app has been garbage! Every single time I try to check my order status I get error messages and cannot check on my orders. But yet, I can browse and buy and everything else. Multi billion dollar company should not have sub par application",1,2,22.18.0.100,2021-10-01 15:54:07,22.18.0.100
8032ef34-513b-47d3-b1de-4a5d5c71f363,we_the_people_racing,Update so we had a registry for our baby shower and people ordered them last month like right when we posted it up and the ones that have prime and one of their few gifts they have ordered inky showed up the rest who knows where they are . Its multiple people.! Have prime and everything I've been ordering that says it will come the next day has been lost or taken weeks and things that say will get in a week haven't shown up for weeks it has been everything I've ordered the past few months.,1,5,22.19.0.100,2021-10-07 23:24:06,22.19.0.100
bdf5353b-0670-41cb-aa0a-c921648dbfa4,Jacob White,Last 2 updates have half broken what didn't need fixed. Additional colors/options will cause it to hang and ruin the shopping experience. Terrible.,1,1,22.20.0.100,2021-10-20 16:44:23,22.20.0.100
f1e1e459-5663-4332-ac33-e9e0a5f1951d,Pratikshya Khatiwada,"Extremely unsatisfied with the delivery service....They just handed over my packet to somebody else while I was in the room and they didn't even mention the name of the person who took it....I never received the packet.... Trusted them for once and ordered from Amazon again But same thing happened...I was waiting for the packet in my room and they delivered it to somebody else, that too without mentioning their name anywhere....Can never trust Amazon again...Lost two of my important packets",1,0,22.19.0.100,2021-10-09 13:42:29,22.19.0.100
0a8aac89-6066-49f2-a6d0-42de87dcd350,April Goodwin,"Since the update, I randomly get sent back to the home page. Very frustrating when searching for items or reading the details.",3,0,22.20.0.100,2021-10-22 21:03:25,22.20.0.100
29b88e2c-971a-48af-b095-ec1492d75c61,Davi Martis,"Amazon sucks, false delivery dates upon purchase, always late. Many damaged items delivered by our door step. Drivers are unprofessional delivering items knowing its damaged. Some customer service reps. Don't know nothing and just play by the book. Mobile app makes it hard to get a customer service help right away.",2,0,,2021-10-09 16:31:46,
a6491ae8-ca48-4a92-9f87-10cc40285d5f,Cecile Ferreboeuf Clayes,Very frustrated with the update version that will 'jail' you into à spécific version of the country. Had to uninstall the app to be able to switch back to US.,1,0,,2021-10-23 16:50:28,
faf24d49-b91b-4305-82a5-cc8989b336fd,Janet Thomas-Hirsch,This app used to be great. Now I'm getting oops messages. I can't cancel any subscriptions either because the cancel button is missing. Why do they mess with an app that works?,2,0,22.19.0.100,2021-10-14 03:46:55,22.19.0.100
d3d97c33-fd5d-4c90-b01c-2f186f9adf2a,Ron Hunt,"Absolutely useless if you suffer with no short term memory, nothing stays still for few seconds, giving one no time to read anything!!!!!!!!!!",1,1,22.20.0.100,2021-10-17 11:05:12,22.20.0.100
d7ac348b-a761-472b-bc77-12dbf5086c6a,JAAN MOTI,Annoying app. I prefer the weblink over app. It's much quicker to navigate and access what you need. App takes you through 2 click process to sign in,2,0,,2021-10-22 14:44:51,
90ec2d84-3f9a-403b-92c1-434f8a19dbeb,Michael Caril,Shopping on the has gotten progressively more difficult over the years to the point where i shop in a browser and use this app to track orders but that's barely worth it.,1,0,22.18.0.100,2021-10-06 18:11:09,22.18.0.100
6cced350-aa76-4d46-82a7-f081386f3ef7,Indi Garcia,I like Amazon but yall need to make sure to stick to your delivering times if it's one day delivery it need to stay that way otherwise I could have ran to the store in the day that I had to wait. Now I'm stuck waiting for the package or for a refund. Terrible service,3,1,22.20.0.100,2021-10-23 19:20:26,22.20.0.100
c94f9899-dbf9-41ac-ad62-bd1a24516eca,Muhammad Taahaa Abu Hassan,"SCAM! I made a purchase n cancelled it since the shipping process was too slow and the delivery fees charged me too much..they DID NOT refund the money,it written in my account that my card were charged by amazon,they just dont admit it..!",1,2,22.20.0.100,2021-10-28 06:34:44,22.20.0.100
7d936a44-e836-4baa-b636-872e5a45552b,David Bryant,"App Freezes and Slow! The new up won't let me choose an option and it freezes up and can't do anything! I have to go to the website to do anything, Terrible. Please Fix ASAP!",1,1,,2021-10-26 02:10:21,
fedaa1d2-d0f5-4a3a-acee-f3c36295bf48,Jeannette Månbrink,I get locked out and haven't been able to shop at all. Suspicious activity by you maybe. I just try to log in. Even had order cancelled because I've been blocked. I am not logged in from my home country but I like to shop anyway and have it shipped to my summer house hu! I can't even log in even though confirmed my MasterCard once.,1,8,22.19.0.100,2021-10-05 21:43:43,22.19.0.100
360bccbe-f6f3-4fe4-ba65-53163aa61da3,whoviansam,"You're delivery driver was literally at my house and didn't deliver the package. First time it's happened. Asked ""can I leave it at the gate"" but I was busy and didn't have my phone to respond. So he just left and now it's been 2 days and no one has ""tried again"" to deliver it. Also just a bad company in general.",1,1,22.20.0.100,2021-10-22 16:46:03,22.20.0.100
4e937451-492f-45d3-85b7-8de7d7515a10,Kirito,Amazon is retarded so is this app nearly broke my phone and I can't see how much my purchases will be unless I enter debit card it's like they do everything in their power to make sure you enter your debit card or credit card and I don't want to cuz I know someone who's had their identity stolen on Amazon for that Amazon get the message not everybody likes to use cards on Internet cuz of identity theft and hackers also they charge 10 dollar tax don't buy from them buy from other store fronts,1,0,,2021-10-05 06:52:11,
ef7d545e-782c-4ff8-b4b7-1bfdc563e5e5,John Blake,"Amazon in my opinion is loosing ground quickly. An Amazon prime membership used to mean two shipping. Now customer service is scripted to inform you that PRIME means when it leaves the local facility it will be to you in two days after that. You never had to double check arrival time before, if it was prime it was on your doorstep in two days. Amazon wants to eliminate the carrier so they have changed the PRIME rules. PRIME does not equal 2 days anymore",2,11,22.19.0.100,2021-10-06 12:20:50,22.19.0.100
952f79e0-dc6a-4175-ba4e-d58890cc50b3,LizAnAngel Icy,Installed it for 20 seconds and already but without saying if the number is incorrect then change it but yet it's sent me a code then it didn't work saying that my number was wrong so I tried it two more times and it sent it two more times but didn't want to accept the code when I put the code in. Make it make sense please.,1,0,,2021-10-11 17:50:48,
2178cdb6-332c-46ce-8b8e-9deaac7465a2,Bobbi Franco,"A great place to shop. You can find everyday common things to special gifts. Quick shipping, quality products, easy returns and user friendly. My grandchildren know how to shop on here. You will not be disappointed! Give it a try. Join Amazon Prime for special deals and guaranteed shipping!",5,0,,2021-10-20 03:50:53,
050e888a-928b-463f-9333-6865ec8e205c,Maria T,IMPOSSIBLE to search for anything if you're not just browsing. where TF are ANY filters?? or the sort function?!?!? I don't have time to rifle through your entire stock to find the specific thing I want.... tell you what. I go on this app to buy items. guess what I do? buy items from somewhere else cuz i can't search for anything!! for being such a big company your app sure sucks. have never seen such a poorly designed thing by anyone. bye girl 👋,1,9,22.19.0.100,2021-10-05 18:15:34,22.19.0.100
ba297b71-94dd-4339-9c9d-7fa497c158f0,Rik De Busser,"Used to be a good app, but with the last update, scrolling stopped working in all wish lists! Not really something that should happen with such a large retailer.",3,5,22.21.0.100,2021-10-30 16:32:48,22.21.0.100
62411b11-2ca0-4deb-9b1e-b131aac03e26,Julian Kazar,"App is great but the service sucks anymore. I order something that has prime shipping but the item doesn't ship until 2, 3, 4, or more days later. You pay for 2 day prime shipping you should receive it in 2 to 3 days or at least give me back the money I paid for prime",1,6,22.19.0.100,2021-10-04 22:56:10,22.19.0.100
e45d8e74-627a-47d4-8b22-8636f6a46439,Kris Smith (Dwinchester45),I've always liked Amazon but now that I've switched services and numbers I can't get passed this stupid 2 step verification and there's no chat and calling is a nightmare. Then I use my new number and it signs me into someone else's account that easy. C'mon this customer service sucks,2,1,22.19.0.100,2021-10-02 01:45:45,22.19.0.100
31368547-1c3a-4610-ac24-c2310adff1eb,Martin Whitehouse,The amount of lag is incredible. Also the share button hides when you scroll through the photos. This app is really badly designed.,2,1,22.19.0.100,2021-10-06 18:04:05,22.19.0.100
4020e358-8fd0-41d3-8735-0eeb056a6252,T *,I don't get the appeal. And having Prime is a joke......now seeing commercials while watching movies. WHY????? Ordered boots that I was so excited to find. Get them over a week later and have 2 left foot boots in 2 different sizes. HOW CAN YOU MESS UP A SHOE ORDER??? A 2 year old could ship the orders more accurately.,1,10,22.19.0.100,2021-10-03 10:12:00,22.19.0.100
7da97c0f-298c-4eae-a33d-fcd8b9f94c08,Taylor Doimer,"Since the recent update I been having issues. I keep getting errors when I'm shopping and it tells me to go back to the home page. When I try to, I still get the error message. The app is also very slow. I tried everything to fix this.",1,32,22.20.0.100,2021-10-15 16:03:30,22.20.0.100
f25baf92-c398-4473-ad63-f2d7be5668bc,Chanda,Shopping at it's best. Hassle free and convenient. I really like the tracking feature which enables me to monitor the where abouts of my order. Love It!,5,2,22.20.0.100,2021-10-28 19:58:15,22.20.0.100
e5d13a92-6d6a-4854-9946-04ad6019e48a,cody weaver,"I use amazon alot, and love it. However my wishlist i have made for christmas is basically useless, i cannot scroll at all. I even sent a link to another persons phone and it does the same so it's not just my phone or app.",3,0,22.21.0.100,2021-10-31 17:40:51,22.21.0.100
61ec3ba8-5e5c-453b-af69-b34c402b8ade,Christina Williams,Great products with a wide array of options. They often have issues with deliveries or vendors running out of items after I place my order. Overall it's a great site.,4,2,22.19.0.100,2021-10-03 19:48:03,22.19.0.100
