reviewId,userName,content,score,thumbsUpCount,reviewCreatedVersion,at,appVersion
6642e96f-b1c8-4576-b72c-4bdf0fe3c9c1,Shari Mannering,You can find ANYTHING you'll ever need for EVERYTHING,5,0,30.15.0.100,2025-08-25 03:39:15,30.15.0.100
af729930-0827-4bef-8d01-22fce49a4685,The campus Television Event,My first Amazon is two step authentic with Google until I created my icloud email,5,0,30.15.0.100,2025-08-25 02:40:51,30.15.0.100
63c11e34-3a54-4911-8dd5-6e4b620fdf3a,Tony Poulis,Thanks for every thing good jab .,5,0,,2025-08-25 01:46:30,
3195ba80-46e5-44ce-b9e3-0108acea19b3,Ronald,locked up can't open Amazon app,1,0,,2025-08-25 01:25:30,
d777654a-d688-440c-ae39-9caa6cdaae52,TALI Mo,"i am not sure who is delivering for amazon now, but I keep having deliveries missing. Recently had someone caught on camera bring package to door, take it back to his car and hand it to someone else to open. Making me not want to order anything else from Amazon.",2,0,30.15.0.100,2025-08-25 00:34:44,30.15.0.100
aee4077a-d898-41d7-942b-4d3596c3bc58,leadfoot8199,making people verify their card by tap to pay is kind of retarded not everyone has tapped to pay,3,0,30.15.0.100,2025-08-24 11:00:53,30.15.0.100
81300d96-0ef3-4708-98df-3da936c6cc11,Jordan Doucette,"Beware using this, they use dragonfly for deliveries they can't make and they have a guy that will just come into your house and look around. delivered here a couple times, was terrible asked to not use them again. Shows to Saturday morning and walked right into our home and proceeded down the stairs. when I asked what he was doing he started to play dumb asking about another apartment. you can clearly see from the doorway there's not. he's been here before, and the delivery he had was not ours.",1,0,30.15.0.100,2025-08-24 10:26:59,30.15.0.100
9d769794-75f2-4e2a-a4cf-88c5f7e8345b,Mariam Ahmed,Amzing excellent app iam going to order a pc set in September yay!!!! iam loveing this app everything i need is there thanks 😊 🙏 🙂 ☺️ ❤️ 💕 😊 🙏 🙂 ☺️ ❤️ 💕 😊 🙏 AGAIN hehe 💖 💕 ✨️ ❤️ 😘 ♥️ 💖 💕 ✨️ ❤️ 😘 ♥️ 💖 💕 ✨️ ❤️ 😘 ♥️ 💖 💕 ✨️ ❤️ 😘 ♥️ 💖 💕,5,0,30.15.0.100,2025-08-24 09:57:53,30.15.0.100
c8f0affd-c032-42a1-b4ad-c40a7c655699,Josh,"Tries to trick you into paying for shipping if you dont have amazon prime on qualified $35+ orders. This should be illegal. They lie and say you will have to pay shipping on this... but with prime you dont, and put a big sign up for prime bitton and underneath, obscurely says to continue without prime. then you can scroll down and select free shipping from the options. ive had to help a fee friends understand that no... this is eligable for free shipping... amazons just trying to trick you...",1,0,30.15.0.100,2025-08-24 09:47:49,30.15.0.100
d34a9460-953f-401d-ab2a-dc524113fdc6,Dominique Vincent,"Amazon is one of the greatest apps to buy all of your wants, needs, and desires. Fantastic app.",5,0,30.15.0.100,2025-08-24 09:40:49,30.15.0.100
f9aa77f6-0318-4ef6-b636-2970153cd257,Jan Toomey,does not open most of the time still not working,2,0,30.15.0.100,2025-08-24 09:25:59,30.15.0.100
00120c21-6ae3-4f49-b161-4ddc81fe1664,Tarek Maarek,"im dealing with Amazon since 6 yrs , the service became too bad and untrusted , 5 calls 5 times waiting to collect back item , no respond ,watch out return service no trusted at all .requested the manager call 3 times ,no response as they don't care , will have to limit amazon purchase , very bad experience, zero support .you will lose tons of customers soon .",1,3,30.15.0.100,2025-08-24 08:49:25,30.15.0.100
3ec89441-ebf5-4c60-bb11-07cf63fdbd5e,Vincent Rumo,steals your money,1,0,,2025-08-24 08:16:38,
413314c0-8d5f-4d10-9986-57abec202003,22fire2727 Jones,be careful If you order something that same day or next day delivery and then you order something that's today delivery they are going to hold your product for 2 days They just started doing this and I started canceling orders.,1,0,,2025-08-24 07:45:30,
aab0a4a3-15c8-4534-b28e-8f7a21e16ee6,Cerena Sloan,"don't want it, don't need it I don't order anything on line",1,0,30.14.0.100,2025-08-24 07:39:41,30.14.0.100
b3fd7b5b-485f-44e0-967b-e011a723a27a,Jim,app is slow and glitchy. uninstalled reinstalled and still slow AF !,2,0,30.15.0.100,2025-08-24 06:49:08,30.15.0.100
72277afe-bf5b-4afd-b754-42d6f30c8c86,Joe A.,"Love the coupon discounts , and fast delivery service",5,0,30.15.0.100,2025-08-24 05:30:04,30.15.0.100
952d5b74-7b88-479c-97be-8902b84e0718,Ashley Taylor,I love it,5,0,30.15.0.100,2025-08-24 05:12:43,30.15.0.100
c0903fff-b53e-4acb-a181-9d398bfd2010,Sine Nomine,"Amazon Haul, in case the quality of amazons usually products wasn't shoddy enough! Less garbage, more real products pls.",1,25,30.15.0.100,2025-08-24 05:11:43,30.15.0.100
5a15b181-1260-4401-b280-5143d5a43edd,Genet Neguise,good,5,0,30.15.0.100,2025-08-24 05:11:22,30.15.0.100
c40997ac-a83c-412c-a412-04da99755e5d,King (Not Sure),Where is the AI button? please bring it back! 🙏,1,46,30.15.0.100,2025-08-24 04:37:30,30.15.0.100
5c604704-cb2d-4823-b33f-acd4e6d0a325,Ginger Hannah,"If there were 10 stars, I'd give it to them. I have bought from them for years and they never disappoint. If anything was unsatisfactory they took care of it immediately. Always plenty to choose from and you can't beat the fast delivery time.",5,0,30.15.0.100,2025-08-24 04:01:29,30.15.0.100
fe32915c-49fb-47a2-bfba-0fade972b537,Alan M,I have had good luck with the app overall. I use my phone for like 99% of things as I don't have a PC.,4,0,30.15.0.100,2025-08-24 04:00:20,30.15.0.100
c9a1404e-10af-42fe-a281-1d62a4161eeb,Eric Chew,I love Amazon!!!,5,0,30.15.0.100,2025-08-24 04:00:16,30.15.0.100
e3fbfbef-eb86-4ab7-b20e-aeabca39a264,Lisa Duplessis,love to browse and buy,5,0,30.11.0.100,2025-08-24 03:59:30,30.11.0.100
3105e4fc-7e18-45f3-ad5a-936837faa5c5,Leiddy Rincon Infante,☺️,5,0,30.15.0.100,2025-08-24 03:28:37,30.15.0.100
a1198f17-271a-4735-8a0d-1820a545aef8,Eliana Palacios,good app,5,0,30.15.0.100,2025-08-24 03:22:59,30.15.0.100
0c1b0ffe-53c8-4868-b20c-70a047c08676,Leon R,Terrible!! I'm purchasing e-gift cards for someone and it doesn't go through. I'm having to cancel my order through the bank and all of a sudden the process is completed!! Don't want to go the extra steps to complete the order. Horrible service as I attempted a second time and the same thing happens. Deleting the app of how useless they are!!,1,0,30.15.0.100,2025-08-24 03:20:58,30.15.0.100
c67e9a11-108c-4632-bb1d-7b4304f54b1c,Ronald Jackson,Very Useful app,4,0,30.12.4.100,2025-08-24 03:02:10,30.12.4.100
a8d1fc99-ec64-4c33-9f49-8599ce8f6910,Dylan Bishop,most things are great some not so much.. I one day hope too meet a woman of the Amazon...,4,0,30.15.0.100,2025-08-24 02:15:43,30.15.0.100
d7746795-a52b-493a-976d-76facad39b88,Jeffrey Mizell,Love Amazon Prime!,5,0,30.15.0.100,2025-08-24 01:59:45,30.15.0.100
6ad657b4-57ae-4a66-9783-6bf919feb3f7,Stephen Loftsgaard,barcode scanner,3,0,30.15.0.100,2025-08-24 01:13:34,30.15.0.100
0b65c612-08ed-4fbe-9c33-001f055678de,Guerry Amertil,good and nice,5,0,30.14.0.100,2025-08-24 00:51:27,30.14.0.100
87b4c7bd-bff9-459f-8f20-b22289287f4b,Niputoidea,Renewed my Prime membership just for a delay on my first order might as well just steal my money. The company never fails to remind me why I stopped using it constantly.,1,0,30.15.0.100,2025-08-23 11:38:43,30.15.0.100
630acd2a-fedf-40e8-9d2c-23bac08be45e,Michael Hill,simple to search for anything.,5,0,30.15.0.100,2025-08-23 11:14:57,30.15.0.100
00a184c8-4de3-4b98-ba68-8c8fb6d807d1,laughing jack11567,had a few things break and some broke on arrival so I put in refunds and apparently that was something they don't like u doing and now I can't even make a new account,1,0,,2025-08-23 10:03:47,
bb6a38f9-259d-4853-8e66-17f4018d1667,Emma Hasney,Its been weeks now and still can't submit a return without having to call Amazon.,2,0,30.15.0.100,2025-08-23 09:59:06,30.15.0.100
3556540c-c8a1-4325-b1ec-8ca7d946bb3b,James,l rate this as above standard.,3,0,30.14.0.100,2025-08-23 09:22:19,30.14.0.100
0de68afa-29f5-4952-85f0-b25384b26a06,Mohamed Badr,شركة غير موثوق بها انصح الجميع بعدم التعامل معها عن تجربة شخصية,1,0,,2025-08-23 09:09:43,
ba122e84-4bb7-4845-bda8-23f86d1a82d4,Katerina Holm,"Horrible app and an even worse company. It overheats my phone to the point the screen goes too dark to use. Music freezes, then it all crashes. Wishlists are randomized and searching one doesn't bring anything up, even if you've literally just added it to a wishlist. Searching the app brings up completely random items. You can't effectively filter searches or results any more. Expected delivery dates change immediately after ordering. Delivery's not guaranteed and drivers ignore instructions.",1,0,30.15.0.100,2025-08-23 09:03:08,30.15.0.100
653162a0-23d1-42aa-b3d9-778e3b956032,Derek Rogers,unable to get otp to my phone,1,0,30.15.0.100,2025-08-23 08:52:53,30.15.0.100
65ad2172-7026-48b0-9231-ce00328fb732,Kandy More,work better,5,0,30.15.0.100,2025-08-23 08:43:07,30.15.0.100
2b8c8f94-d27d-402c-971a-21f9e2fb27ce,Lilian Fabrizio,Sono veloci con gli ordini ma complicati per i restituire i prodotti. I loro punti di spedizione a Roma non hanno il materiale per effettuare il reso. Ho fatto spesso in viaggio a vuoto.,1,0,,2025-08-23 07:56:52,
433a3090-ebb3-4790-a448-4c1787323cdf,Ross Jones,stop messing around with the Amazon app leave me alone,1,0,30.15.0.100,2025-08-23 07:23:00,30.15.0.100
ee2b8663-8cb7-4728-8138-bbfe24151685,Kenneth Jones,great shopping app very reasonably priced worth downloading 👌,5,0,30.15.0.100,2025-08-23 06:45:11,30.15.0.100
455f2399-af74-47ae-879e-fdfc8123ae49,Anamika,"Shopping made easy, the availability of super quick delivery (next day) which is fantastic. Great discounts! and bargains on everyday household items if you have the patience to shop the huge wide range. 😀",5,0,30.15.0.100,2025-08-23 05:37:15,30.15.0.100
74ae9ae0-b7de-4dd4-9c73-7cc0353b8137,Kristen,love amazon,5,0,30.15.0.100,2025-08-23 05:28:47,30.15.0.100
ba62f7bb-922c-42b0-bd11-4ef12272dc02,Philip Bains,good stuff,5,0,28.13.6.100,2025-08-23 04:06:45,28.13.6.100
3bf001ba-4085-4c63-9311-23eb0095fd37,Gray Twinkle,So the app works better than before.,4,1,30.15.0.100,2025-08-23 03:25:44,30.15.0.100
68363556-8774-41aa-a31d-b74c74b18e3c,Joe Hunt Photos,needs more cowbell.,1,0,22.22.2.100,2025-08-23 03:06:31,22.22.2.100
ad1612fc-a7f5-49dc-9d73-ece73111ca1d,Samantha Lugo,There is always something wrong with this app.,1,0,30.15.0.100,2025-08-23 03:02:48,30.15.0.100
152116dc-ac01-486c-accc-49858290f52c,plant,"Nice when it works. It freezes a lot and sometimes it wont take you to the cart. Recently, and the reason I am uninstalling it, it is making my phone overheat. Like uncomfortable to hold hot.",3,0,26.7.0.100,2025-08-23 02:46:09,26.7.0.100
eef6bd8f-e0a5-46f2-b2c3-f153ac27e92e,Lochy B,give it a 0 stars because I got logged out for no reason I can't logged back in cause it blocked i had $130 dollars and now I can't get it back😭😭,1,0,30.15.0.100,2025-08-23 02:42:26,30.15.0.100
8d53db36-28f8-4907-9e38-f72114251509,Andrea Davidson,accidents happen errors happen Amazon customer service are great and I can tell they don't work on the whole scripted so thankyou for helping me when you are able too. some of the couriers should learn how to be more respectful of their customers,5,0,30.15.0.100,2025-08-23 02:37:40,30.15.0.100
ed2ffbd4-79bd-4f72-907d-84af29ecc1f4,Penelope weber,love it's,5,0,,2025-08-23 02:08:10,
203eb917-7438-44f8-8005-442b7efe1424,Early Shabbir,"Tried Amazon Fresh today, horrible! You don't get the products you order. Grapes are over ripe, and the sardines are not what we ordered. Back to my supermarket, I get what I want there because people care. Amazon don't care! Very disappointed and I would not recommend Amazon Fresh to anyone.😔😞👎👎😭",1,0,30.15.0.100,2025-08-23 01:34:14,30.15.0.100
7e03c9f9-8c99-4abd-8cb4-66b4b8b7be9b,Jonathan Dills,"why are you reloading the entire page?!? If I was already looking at something, I want to keep looking at it, not have you refresh the content. came back to complain again, stop refreshing the page, sat my phone down and the screen went off. Turned it back on, item I was looking at, gone.",1,0,30.15.0.100,2025-08-23 01:32:19,30.15.0.100
f5816e25-8c1e-44ba-9724-113126a2d23b,Raymond Harris,I love it. it has been my best friend since the pandemic,5,0,30.15.0.100,2025-08-23 00:35:55,30.15.0.100
f2280137-12fb-44da-81c4-fd75bafd2e7b,William Palma,wanted to give Amazon Prime 30 day subscription a go for a few days since I needed it for some purchases and wanted to cancel before the free membership ended but it wouldn't let me and also wanted to purchase other things and kept asking me for my credit card info and apperatly I didn't have any on file so now I don't know what to do,1,0,30.15.0.100,2025-08-23 00:20:49,30.15.0.100
11dccae7-4253-4a44-8b7b-fa2711077da4,Ben,haul? lol name it something like Teey Moo two point ow? connecting westerners directly with Chinese factories. no more cringey comic book looking sales guys,2,0,30.15.0.100,2025-08-23 00:02:07,30.15.0.100
67b248be-f0fe-4b03-a2a2-5f2091d783a6,XOXHyuugaNejiXOX,"Makes everything as hard as possible. Hides cancelation methods, or has just removed the ability to cancel product, tv channels etc. Subscriptions are now forever. Actually had to cancel my credit card to make it stop charging. Even tried googling how to cancel subscriptions, and the links and buttons needed are not present.",1,0,30.15.0.100,2025-08-22 12:05:55,30.15.0.100
dfd04711-a629-498e-b9db-e35694af20b0,Lori Mills,"Dear Amazon quit emptying my cart, why have the check boxes if you're going to empty the whole thing when I order 1 or 2 things out of it!!",1,79,30.15.0.100,2025-08-22 11:03:10,30.15.0.100
f306c418-90bd-44ca-85e5-760ca08f30af,Anthony Rudnicki II,they made signing up for a yearly subscription so difficult that I gave up and canceled. their AI was zero help. Just kept giving me links to the same page that was zero help. it should not be so difficult to switch to a yearly subscription. so I will not be using their services anymore,1,0,30.15.0.100,2025-08-22 10:52:23,30.15.0.100
48565d55-c103-4917-b514-1908db1e3135,Malika Asser,I like ittttttttt🤩🤩🤩,5,0,30.15.0.100,2025-08-22 09:52:08,30.15.0.100
252ac598-f482-4929-a37f-b8f926312c1a,Mind,very bad experience i will close my account,1,0,30.15.0.100,2025-08-22 09:42:34,30.15.0.100
14cccd4a-e594-421e-a485-d6e5196c9306,Josh Woody,"I'm going with two stars for two reasons. One star to emphasize that I do like the app, and use it regularly with no major problems or bugs, anything like that. The other, because this app seriously needs dark mode, for God's sake. It's 2025 Amazon. Every other app in the world except yours has dark mode. Get with the picture. For real, how hard can it be to add that feature? You could probably do that in a day. Doubtfully this will reach anyone, but when it happens, I'll bump it to 5 stars",2,1,30.15.0.100,2025-08-22 09:08:02,30.15.0.100
741a26e3-c3b0-46e1-8ce4-7c5f210a4466,Ryan W.,"I hate the new quick view. Every time I'm scrolling it keeps opening items. Terrible idea. At least make the feature and opt-in, as nobody is going to want it. I'll avoid shopping with Amazon for a while until your remove it.",1,4,30.15.0.100,2025-08-22 08:40:55,30.15.0.100
d1523ce2-dd22-4a22-ade1-d1e6ea3cb66e,Anzu love,why can't I see the reviews? I can't even tap on the number of stars so I can go see them. Fix the glitch.,1,0,,2025-08-22 08:18:46,
16641393-f605-4070-b4f3-575c63c97757,lia son (Xx.Gacha_Panda.xX),Can't access account. Can't speak to anyone unless I want to pay god knows how much on some dodgy number.,1,0,30.15.0.100,2025-08-22 08:00:45,30.15.0.100
4a2e7cc4-4d7d-42b8-8052-d5739ab16c69,Kelly Williams,it works for 0,5,0,30.13.0.100,2025-08-22 08:00:14,30.13.0.100
2c0bb010-5438-4d83-8c52-cb8faaf79e7b,the gaming dicks,"what's the point of paying for prime if I'm not getting the famous two day shipping,most of my packages have been a few days late recently because they've been shipping it via usps. I only got this app to avoid the usps",2,0,30.15.0.100,2025-08-22 06:54:14,30.15.0.100
76a35e2f-5aae-473d-b7da-19b44056471c,Peter Coe,Unable to down load this app,1,0,26.22.0.100,2025-08-22 06:52:34,26.22.0.100
f8496bef-d0eb-4323-b903-16911dcd9f49,Penny Wolfe,I really enjoy shopping with Amazon,5,0,30.15.0.100,2025-08-22 04:54:14,30.15.0.100
778ebd38-d216-4ab9-8a26-5498f2781247,Madelyn Daisy,I am so appreciative of this wonderful company as a seattle resident you make my whole life so much easier and thank you fron the bottom of my heart 🌞🏡,5,0,30.15.0.100,2025-08-22 04:50:46,30.15.0.100
a2628f69-31d6-45d5-a406-5f59114767ff,Jillian Stevenson,Signed me out and won't let me sign back in because it wants me to verify a credit card in the account that hasn't been used in YEARS. Guess I can't sign in and I'll have to cancel my membership. Why are your bills so messed up? Why can't just see the entire bill? Why are you breaking it up by item? And I can't see the prices. It makes it impossible to track on my goddamn credit card. this app literally does nothing but load for hours on end.,1,2,30.15.0.100,2025-08-22 03:52:02,30.15.0.100
a0b41dd6-3bca-4df6-830c-81547b1001db,hayward hillbillies,Indeed,5,0,30.15.0.100,2025-08-22 03:21:52,30.15.0.100
bbf64171-0759-4fe8-b37d-ded1d2809e95,Donna Dennis,Easy to use. Always able to help.,5,0,,2025-08-22 03:05:55,
e1032ca4-04b7-4476-9802-e57a481c00dc,Heather,App is glitchy with return QR codes and it's impossible to connect with a live customer service rep,3,0,30.15.0.100,2025-08-22 02:46:11,30.15.0.100
66deec0d-3b3c-4ef5-afa9-dd1ffa275f35,David Saavedra,"Detesto el anuncio ultra invasivo que tiene youtube sobre esta app, nisiquiera me deja usar el teclado",1,0,,2025-08-22 02:13:32,
6a305606-493e-4842-9c30-cbe15eb7fe10,Simon Mitchell,"Becoming a worse version of itself. I have a prime subscription but stopped using prime music (ads and restrictions), I chose Netflix and Disney over Prime video, and now the downgrades are rolling out to Amazon shopping. Instead of the premium shopping centre, it's becoming the rundown mall. competing with Temu and Ali Express for dodgy promotions and coupons with impossible T&C's, vouchers etc. I chose Amazon to escape those dingy places.",2,0,30.15.0.100,2025-08-22 01:37:30,30.15.0.100
55639b60-f50c-44e4-980c-70d92f59e83d,Kirito Kun,stupid Amazon always late delivery by days,1,0,30.15.0.100,2025-08-22 01:31:38,30.15.0.100
a9509617-c71a-4fbf-9c3a-53eb53b8f5f2,Joseph May,awesome,5,0,,2025-08-22 01:23:07,
cc3c289a-e931-4087-bb6a-aca6f711eae3,William Rodriguez,"nunca funciona, cancelan compras",1,0,,2025-08-22 01:04:10,
44ec100d-5591-41e5-b525-1b68393ceb28,Beverly Osborne,somehow I changed language to Spanish!!!! I uninstall shopping on line. Re install hoping Spanish version will be gone,1,0,,2025-08-22 00:50:00,
08fee5a9-f634-4135-9d7d-b84d8a10b72f,Lisbeth Nunnaley,"I have been with Amazon for at least 5 years and they have been good to me until I moved up north and it's a very rural area, so my stuff was being shipped to our local post office and I had to drive and pick it up, pay for Prime I didn't get anything with a day let alone 3 days! So I kept asking myself what am I paying for every month? So I was going to cancel my Prime, and that same day... Here comes up the hill..... Amazon truck with my orders. So not cancelling just yet!",4,0,30.15.0.100,2025-08-22 00:49:11,30.15.0.100
2cda74ed-ee97-4414-ab43-43134fdf4c0e,Rey Rodriguez,"Lately Amazon has been slacking, they have become irresponsible with the customers needs. You can place an order and 10 days can have passed and still the item purchased has not been even shipped. WATCH when you purchase, the supposedly estimated date of delivery its not the REAL date. Once you place the order, you will notice its estimated date of delivery is far later than the one provided before purchase. AMAZON poor service 👎👎👎👎👎👎👎👎👎",1,0,30.15.0.100,2025-08-22 00:22:44,30.15.0.100
f992eaa4-6c37-48d6-8e9b-660b18783ad3,K S,it's 2025 and still no dark mode,1,0,30.15.0.100,2025-08-21 11:58:33,30.15.0.100
928338d0-c162-481e-b9dc-f2f0622ba7b5,Brian Menendez,love this app,5,0,30.15.0.100,2025-08-21 11:42:42,30.15.0.100
c2c4de66-a25d-4670-bab0-4eaf2a92db79,Sue Morris,"Selection, availability, and quality of products are unsurpassed. Delivery of products is fast (if a Prime Member). Subscribe and Save is an added benefit that ensures frequently used products are delivered on a schedule that I control. I don't spend my time running errands when I'd much rather enjoy the beauty of life, friends, and family. Gratitude!",5,0,30.15.0.100,2025-08-21 11:09:45,30.15.0.100
a4e1dd12-58bc-49bc-a3da-8f1587c6da50,Riska Siyam,the price are lucky for me,5,0,,2025-08-21 10:48:09,
5bbbdcee-0012-4435-be8a-78d6ba9fb597,Nilsa Riley,love the ease,5,0,30.15.0.100,2025-08-21 10:16:34,30.15.0.100
33e3cca4-d39a-4635-901f-087f4180e7e2,Danielle P.,Okay but glitchy,4,0,30.15.0.100,2025-08-21 10:09:26,30.15.0.100
e21e6f3f-a9a2-403d-824a-35b8259e1e66,Michael Remeta,Just horrible experience......,1,0,30.15.0.100,2025-08-21 09:57:20,30.15.0.100
37385c59-b012-451d-94cb-af637b2f363f,Robert Black,easy to use,5,0,30.15.0.100,2025-08-21 09:35:04,30.15.0.100
c7ae2d3a-60c8-42a9-a204-4c46499a9326,John McKenzie,Great choice fantastic price.,5,0,30.15.0.100,2025-08-21 09:03:33,30.15.0.100
4a04850d-bdca-4188-b716-b7a46ee5c0b3,Lori Westerfield-Nottestad,too much to pay out for free shipping. get real people! remember the poor? it looks like you don't and you don't care.,1,0,30.15.0.100,2025-08-21 08:41:31,30.15.0.100
cd115470-ada0-4e80-9be3-57cc263f4b31,Justin Lindell,Only useful to watch Amazon not process your orders because they dont care about actually fulfilling orders or shipping items on time.,1,0,,2025-08-21 08:33:33,
8058c7f1-c1cc-4e91-97dd-df9d8591722f,Jay,"""get Adidas must have items"" notification every single day",1,0,30.15.0.100,2025-08-21 08:09:08,30.15.0.100
385a548f-d0ca-4a61-924d-7a9477183001,Eliya,Excellent customer service!!!,5,0,30.15.0.100,2025-08-21 06:29:26,30.15.0.100
2b738900-09dc-4f24-94dd-840714be4363,Kelly Archie,I love Amazon! My friends call me...✨The Amazon Queen 👑🙏❤️🫶,5,0,30.15.0.100,2025-08-21 06:26:24,30.15.0.100
1df715b5-b141-47a5-9ec5-b56582a9eedf,ahmed atout,اسوأ خدمة عملاء,1,0,,2025-08-21 05:29:06,
6605e965-5d6f-4ff0-8b62-ea1250806df5,Siphiwe Mncwangi,Satisfactory,5,0,30.15.0.100,2025-08-21 05:15:02,30.15.0.100
62f4cae2-e99f-4736-806e-774750a8ca8a,David Shaw,Ever since we got Amazon Flex where I'm at packages don't make it to me. Absolutely ruins the experience. I'm going to start shopping elsewhere if this doesn't get fixed.,1,0,30.15.0.100,2025-08-21 05:07:59,30.15.0.100
d25b6ff7-b6d5-45b6-aa85-94814fb8045d,Brandon Woodard,easy to navigate and alwase on time,5,0,30.15.0.100,2025-08-21 04:59:24,30.15.0.100
70999fc1-0ab6-4e57-8560-dad208c7bbb7,Luke Smith,"Add dark mode already, it's 2025! Using this all is like staring into the sun.",1,1,30.15.0.100,2025-08-21 04:47:41,30.15.0.100
124d9b1e-418c-4203-bf5c-6a1b8dc15334,Marcus Finch,"They have everything, most at good prices. But I've had a increase in order mistakes lately. I order auto parts in bundle deals by the system I'm working on... ½ the order will be right but the other half no good. I find out after I install the correct part. then they want whole order to process a refund. I'm not taking parts off to be stranded while they do whatever.... not get in a rush?",4,0,30.15.0.100,2025-08-21 04:43:36,30.15.0.100
3c56fe8b-09b7-4686-b091-0be23407f83d,Rob,"Very hard to order anything. I usually give up and order from Walmart, but they have no problem charging me for Prime.",1,0,30.15.0.100,2025-08-21 03:49:18,30.15.0.100
f9d16fb4-47a1-4d2e-8d1f-b8def69d6156,Rosemarie Eggen,it is getting too expensive,2,0,,2025-08-21 03:38:11,
f773c2fb-b4a4-4c3e-b680-61e3173e7327,Jamie H,quick and easy. I can even use tap to pay in the app now!,5,0,30.15.0.100,2025-08-21 03:35:57,30.15.0.100
8ab8379d-fc98-4175-aa68-f2147b3dfc8b,Kenesha Brown,I like bowering on this app on all different types of things.,5,0,30.15.0.100,2025-08-21 03:28:01,30.15.0.100
619472e8-c81a-4921-8eda-c4bfc87b422d,fuzzymontreal,Great shopping app,5,0,30.15.0.100,2025-08-21 03:18:30,30.15.0.100
607b0bdb-890f-436a-9170-910ead8599eb,No One,yucky,1,0,,2025-08-21 03:01:20,
27b7e5d4-3dc6-44a8-a5d1-a9ad4e222b16,topeye,"Even if you cancel prime, they take money each month anyway. Be careful with this app... 8/20/25 another reason to hate: keep declining my card that works perfectly fine anywhere else. I guess they don't want me shopping with them? guess I won't...",1,1,30.15.0.100,2025-08-21 02:53:27,30.15.0.100
16608ba5-2577-4006-9d98-ec787a7951b0,Gina “Gigi” Cristobal,work for the company for a lot of years and I love their apps shopping especially shopping during primetime lots of good deals and the great company to work for MC money on shopping,5,0,30.15.0.100,2025-08-21 02:37:04,30.15.0.100
64d552b8-c2f1-4bf7-ac65-fc4b3b2c403c,Patricia Gibson,"Amazon will only sporadically come up. it frequently says ""Try Later"". I wish they could go back to before the update.",2,0,30.15.0.100,2025-08-21 02:27:09,30.15.0.100
ffbf4a78-33a6-4892-bc38-adc5551bdc1d,Sandile Phillip Mjikwa,Good,5,0,30.15.0.100,2025-08-21 02:20:14,30.15.0.100
fc19d513-54b2-4fef-b78a-9a7f6f0532a3,Andrea Miller,love the items recently purchased thanks,5,0,30.15.0.100,2025-08-21 02:00:14,30.15.0.100
6b8a20f6-1270-4e94-a24f-856f357ba549,Vikki B (ME),I'm not paying for finger authoe,1,0,30.15.0.100,2025-08-21 01:36:37,30.15.0.100
