reviewId,userName,content,score,thumbsUpCount,reviewCreatedVersion,at,appVersion
cf092727-772c-495f-bd5a-8c3ac0851462,CJ,"Amazon will rip you off I bought something that had same day delivery, in the time frame given I get a notification that my package was delivered and signed for. Nobody ever knocked on my door nor was my package sitting by my door. spoke a rep end result I was supposed to get a full refund. Never got a refund upon calling them back I learned that the rep I spoke to cancelled my refund. I don't trust this company they been getting real shady",1,1,,2025-08-11 06:38:42,
02e1bc56-f5e6-4abf-bd04-789cf5a2036f,Johnny Money,"good products and great price,Johnny",5,0,30.5.0.100,2025-08-11 06:37:10,30.5.0.100
a106dcfd-45fd-486f-a926-60ba3007151b,Cynthia Teeples,"Amazon has everything I need and want. Thank you, Amazon.",5,0,30.14.0.100,2025-08-11 06:35:51,30.14.0.100
2d805fac-f44e-40af-83cf-425ac6d184b5,A Google user,Search still sucks. Ignores terms. zero settings. ads. video ads. can't disable. horizontal scrolling. bright white. horrible modern design with zero thoughtful features for the user. battery hog. i still miss the old app. inconsiderate in general. more sparse but also a hindrance with no settings.,1,16,30.11.0.100,2025-08-11 06:33:09,30.11.0.100
f59929c2-ab91-4b0b-9717-ec26a939ffd5,Ursula Saul,best customer service and prices are so affordable,5,0,30.14.0.100,2025-08-11 06:26:30,30.14.0.100
881ed095-a622-4720-849e-f6344a1e3c01,Magdalina Hyppolite,perfect 👌,5,0,30.14.0.100,2025-08-11 05:46:34,30.14.0.100
1112f9a7-a8a5-4499-bd0b-c9884b60f872,Cynthia,it was great for a long while but two days ago my payment didn't go through and my prime benefits was suspended I have been paying with gift cards and when I tried to do it myself it still wouldn't work so now I don't have prime anymore. Not happy at all makes me not want to use Amazon anymore. So disappointed. Talked to two people and nothing has been resolved no help at all.,3,0,30.14.0.100,2025-08-11 05:37:06,30.14.0.100
964add9e-a1d2-4a62-af7e-d3f9e5153ab3,samy samy,no headache,5,0,30.14.0.100,2025-08-11 04:34:34,30.14.0.100
de7b3b1d-497d-4410-9c76-7011a62d5723,Salma Nour,very bad,1,0,30.14.0.100,2025-08-11 04:28:42,30.14.0.100
b97969b7-2612-4a31-bf7e-aa11e8ae08d1,Ricky Trugler-Ramirez,billion dollar company and the least functioning app I've ever seen... pathetic,1,7,30.14.0.100,2025-08-11 04:08:41,30.14.0.100
391de545-c4f7-45d5-b540-c0a7c789e07b,Christopher Mann,using the chat feature has taken customer service to a negative experience. it didn't understand my issues and hasn't resolved my problem. I've tried 3 times. c'mon Amazon you can do better than that,2,1,30.14.0.100,2025-08-11 03:45:27,30.14.0.100
a72e5586-152b-46d4-9d37-77f6ae896375,Brooke Shelton,Would it let me make an account.,1,0,30.12.4.100,2025-08-11 03:29:28,30.12.4.100
454b6e32-f655-4261-83c1-2914621f979d,Blair Piper,app will not update,1,1,28.7.0.100,2025-08-11 03:08:47,28.7.0.100
4ae4d1c7-9171-4481-9f39-698fad96e694,LOUELLA BROCK,love ❤️,5,0,,2025-08-11 02:36:49,
a9d388c4-412e-4736-b1c9-89676b801bff,Tyson Trevino,Great experience,5,0,30.14.0.100,2025-08-11 02:16:23,30.14.0.100
a6bcabc8-9c32-4f6f-8ed3-bbd61a824b54,James Hill,Soeasy and earn rewards by using Amazon card.,5,0,30.14.0.100,2025-08-11 02:13:07,30.14.0.100
19ce1523-4ec1-4ab6-8365-1816dfd16896,Matthew Stinar,Terrible user experience. Sluggish performance. Constantly trying to manipulate you into buying what you don't want while hiding what you're actually searching for. Deliberately misrepresenting the price in order to promote subscriptions. Distracting videos automatically play in search results making it difficult to read product descriptions.,1,2,30.14.0.100,2025-08-11 01:41:35,30.14.0.100
83521da3-fe69-4596-87f1-693436a5b138,Nestor Cuellar,"Super slow app, Freezes randomly and have to restart the app",1,2,30.14.0.100,2025-08-11 01:36:51,30.14.0.100
9d5cb3bd-dc77-4cb4-a892-995e9a8e62d3,Nina Yobiz,"not a problem per se with the app, but more so with the company and the shipping issues. so very sick and tired of them not committing to the day/time they say an item is going to be delivered. if I didn't provide services in my business like I have agreed to with my client, I would be shut down in now time. do better Amazon! I pay too much monthly to not get my deliveries when you say I am going to!",1,1,30.14.0.100,2025-08-11 01:17:57,30.14.0.100
1b0220b6-f2e9-409f-b267-5ce9b1c12eab,Agustina Waters,I like shopping,5,0,30.14.0.100,2025-08-11 01:16:43,30.14.0.100
f92011da-557d-4288-a363-3f87f2eb95d9,Isaac Palomo,doesn't work,1,1,30.13.0.100,2025-08-11 01:14:09,30.13.0.100
ac555937-b1e5-4c4e-b3a2-7e4c1acf268f,David Goodnow,"I needed powdered milk, some rice, and wanted instant coffee. I could have walked to the Dollar General, but I wanted brands it didn't have at this store. Buying using the Amazon Shopping app is something I won't try again. This app kept emptying my cart, so I spent from 6:30 to nearly 7:30 just to buy those three things, as I had to search and add the same things over and over and over until all three were in the cart to check out.",1,3,30.14.0.100,2025-08-11 00:34:43,30.14.0.100
d5ca8f67-dc24-4459-b67a-9c3c7e26c120,John samrano,I trust and prefer Amazon.,5,0,30.14.0.100,2025-08-10 12:26:52,30.14.0.100
c8fb3132-31b9-4405-973c-d0026d75580a,Andrea Brackner,"Why do I have to use cash still to order EBT eligible products? If I purchased at a store, I'd only be charged on my food stamps. But ordering food here, they still charge you taxes which should be exempt for EBT users.",1,0,30.14.0.100,2025-08-10 12:06:27,30.14.0.100
25cc8ead-9ab2-41b5-a0cc-3796b2fa8c78,Dhiraj Rambhookan,easy payment method. love the free delivery service.,5,0,30.14.0.100,2025-08-10 11:56:18,30.14.0.100
cf5019f2-36c5-4723-8cbf-5cd9f269cb91,Slavica Pulic,pls you have dilan dog?,5,0,30.14.0.100,2025-08-10 11:53:53,30.14.0.100
92801513-6ad0-4379-bd0c-a066a0f2811d,Felicia Strașnei,"constantly having errors and preventing me from being able to cancel an item, fix this now",1,0,30.14.0.100,2025-08-10 11:29:34,30.14.0.100
bb43866f-b5ee-4859-aee0-223146b76f58,Benu Tamang,it's just a wow,5,0,30.14.0.100,2025-08-10 10:39:54,30.14.0.100
93c43f91-4c85-4d4a-a85c-650aa53f532c,GinkoMan03,l'app crasha di continuo......,3,0,30.14.0.100,2025-08-10 10:28:46,30.14.0.100
72c428de-ba8d-4dd3-abda-087386f75253,Kenry Morton,awesomeness,5,0,30.14.0.100,2025-08-10 09:58:43,30.14.0.100
42241744-28a0-4859-ab64-cef926236aae,Alialjihad Jepang,My package is lost and there is no respond from amazon,1,0,30.14.0.100,2025-08-10 09:42:01,30.14.0.100
c56e751b-b1a4-41e9-933b-404450ac395c,Caleb Paul,literally won't let me use my account or checkout as guest or make new account like dang I really tried giving you my money but I guess y'all didn't need it anyways,1,0,30.6.0.100,2025-08-10 09:35:32,30.6.0.100
9d628bec-796e-4399-b3f4-f2a39a3da5ca,Sarang Khan,it's World number one Company,5,0,30.11.0.100,2025-08-10 09:31:55,30.11.0.100
da25b546-b943-4aa8-add8-302bb13b0692,Andy Gardner,Should be renamed Scamazon as it has become just like Ali Express or Temu. Absolutely flooded with fakes and chinese garbage. So much so that it is now much harder to find the decent quality products amongst all the trash.,2,0,30.14.0.100,2025-08-10 09:13:35,30.14.0.100
c4cf4c59-16b0-4cbf-a378-8b080d2b451a,oscar fabian,excellent platform to buy everything. I love it,5,0,30.14.0.100,2025-08-10 09:11:41,30.14.0.100
27b9e012-a275-42cb-80ca-1c14b73b7bd5,Jacqueline Helen Pretorius,❤️ this app,5,0,,2025-08-10 08:36:13,
6123e696-30f8-4f66-a402-fb2abfb5fd13,Jit Majumdar,The delivery service is awful. They mark the product delivered without actually delivering it. customer support is very poor It takes a long time to investigate then after a few days they mention it was a technical fault and propose for refund. This is really a waste of time and effort.,1,0,30.14.0.100,2025-08-10 08:25:53,30.14.0.100
64ae863d-005c-479b-9d13-6cd13398ca0e,Jonathon [REDACTED],"payment options and address editing are trivial and annoying. straight up the most complicated system, you think it changed and yet it didn't. hardest to navigate and use ui because it just doesn't work and is too secure and doesn't let the original account owner do anything. trying to manage packages is a hassle and it literally never had ever once delivered on time. stop over promising.",2,0,30.14.0.100,2025-08-10 07:44:23,30.14.0.100
f5265944-da99-4d0e-b050-e4237fd35f5e,Çağdaş Yıldırım,awesome,5,0,30.14.0.100,2025-08-10 07:34:25,30.14.0.100
9e51080c-3330-4434-a929-89241db22ef6,Justin-Wade Mitchell,"Amazon is what it is. It is super convenient, has many benefits, and can potentially save you money. That said, here is the devil in the details. There is no intention of selling quality goods. Their algorithm shows the same chinese manufactured products over and over, unless you specifically type in quality brand names. Many reviews are fake or bought. They've become pushers of junk products. They lose 3 stars for allowing dishonesty but gain 1 back for easy return policy and shipping speed.",3,0,30.14.0.100,2025-08-10 07:23:09,30.14.0.100
277293c3-7570-49d7-974f-83768d8a14c4,Clayton Tate,great,5,0,18.17.1.100,2025-08-10 06:17:03,18.17.1.100
16e10900-51f5-43d9-a603-33d24a2670f3,Alyssia Taylor,The app has been locking me out of my account 3 times in one month and a half.,3,0,30.14.0.100,2025-08-10 05:42:47,30.14.0.100
b62e940d-e30e-4283-98d2-5fa61d7b096d,Leah Andres,"I experience too many times that my parcels don't arrive on the day I expect ,sometimes undeliverable, delayed or any reason that can't be delivered, why are you even offering 1day delivery, too frustrating and Refund is too hassle too, not real time",1,0,30.14.0.100,2025-08-10 05:42:41,30.14.0.100
a75d0f96-89a6-4d71-b432-3f66e12220db,NOBLE ARCHON,locked me out of my account and customer service said it cant be unlocked. yea I'm not creating another account. EBAY TEMU HAVEN'T LOCKED ME OUT OF MY ACCOUNT! After further research I found out Amazon locks your account. Because of other online shopping sites you many be using. like Ebay and temu... so sad for Amazon! and just like that Amazon doesn't exist to me no more!,1,0,30.13.0.100,2025-08-10 04:55:55,30.13.0.100
cff2619d-702d-4ced-8f77-400cc9eb6a8e,Johnnie Harrison III,"I've just been having bad experiences with Amazon, especially lately. Only 1 of the last 5 things I ordered off Amazon showed up so I had to get a refund. my most recent order says problem occurred yet it won't even say what the problem is. it just says problem occurred and it is not deliverable. when things do get delivered it takes a very long time without Prime. also they have odd resellers but at least nothing I've ordered broke. but dang I feel like half of my orders haven't been delivered.",2,0,30.14.0.100,2025-08-10 04:36:36,30.14.0.100
2fdae32a-5bc4-4e8c-ab1c-35ef23694aa5,Wes Williams,I Don't thank you could do it any better than Amazon does today but they continue to try. Can't imagine what they will do next and can't wait to see. Thank you for being consistent in your operation and bringing the very best to the table daily. We appreciate U.,5,0,30.14.0.100,2025-08-10 04:36:00,30.14.0.100
e92d0272-194b-46fa-8016-c41e29e4ecfd,Darren Thompson,Edit: and back to 1 star for bringing back that horrible scrolling pop-up feature.,1,5,30.14.0.100,2025-08-10 04:30:26,30.14.0.100
a8184d94-8bfb-487b-aa35-0455949a0abe,Yolanda Hernandez,very good product,5,0,30.14.0.100,2025-08-10 04:27:59,30.14.0.100
3659d7fb-389e-48bd-8a4a-a966a680f41c,Gwen McDaniel,I ❤️ Amazon,5,0,30.14.0.100,2025-08-10 03:32:35,30.14.0.100
e78c3e74-b6b2-4874-9155-8c459995d62e,Secret Smith,"they will tell you 2 different prices at check out, and neither of them are the correct price. you have to have enough on your account to see the mystery 3rd price, that is the actual price of your order. after 3 years of avoiding this company after their last attempt at stealing my money, I come back to find that they are still awful at running a company some how.",1,0,30.14.0.100,2025-08-10 02:49:09,30.14.0.100
d73d3596-8fe8-45b9-91dc-238aa46494db,Steven Graziano,easy to navigate through the website!,5,0,30.14.0.100,2025-08-10 02:36:00,30.14.0.100
2802e808-a6cc-441e-b0c6-da2493402710,Anita Siu,"Doesn't work properly. Order history is empty and Prime status is incorrect. In comparison, everything works as it should with the iOS version of the app.",1,0,30.14.0.100,2025-08-10 02:04:50,30.14.0.100
f7bd5495-c3e8-4bae-a00b-c9623d4c9d1c,Corey Lindsey,Amazon is awesome,5,0,28.9.2.100,2025-08-10 01:36:37,28.9.2.100
47c3078c-d3da-472a-8b0e-146850fc4601,Cornell Glover,the app keep messing up start to be a real pain in the you know what🤬🤬🤬🤬🤬,2,0,,2025-08-10 01:28:20,
70ee3cd1-e585-4d20-8c98-db78d0f51332,W G,Best place to shop!!!!,5,0,30.14.0.100,2025-08-10 01:09:27,30.14.0.100
6922aa91-c310-4d1c-ba7d-4acdd05b5fcb,Adam Frank,"Now that they killed the majority of physical stores, Amazon has lost everything that made them great in the past. Amazon sucks now!!",1,5,30.14.0.100,2025-08-10 00:38:34,30.14.0.100
f5072cdf-77f6-43bf-9308-a6d00b18f081,Khumbi Tsela,it fast for me so it is good,5,0,20.22.0.100,2025-08-09 12:27:07,20.22.0.100
5f7bc9f0-58a1-483b-8382-daf3c1c8325b,Serafin Solis,just an excellent app to buy all you needs,5,0,30.14.0.100,2025-08-09 11:37:01,30.14.0.100
d74cece0-d867-4eca-8c7a-ea33c66ad0d8,Jujard Belleza,I like to buy here online seller 💯% recommend thank you for the good service amazon saudi,5,0,30.14.0.100,2025-08-09 11:12:55,30.14.0.100
a492ebdf-356e-487a-b0b2-e0de0f3f3827,Gary Hayman,I like how fast I get my items. This order was a little longer for shipping but items weren't that important.,5,0,30.14.0.100,2025-08-09 11:09:51,30.14.0.100
4d8f319f-0ec3-481f-8364-37db2c2da0f9,Ramona Rivera (Mony),Tried to do my membership payment. And the app is acting up. Might as well go shop somewhere else.,1,0,30.14.0.100,2025-08-09 11:06:21,30.14.0.100
cd313feb-eabc-4b10-8f9f-1caefffcd474,Ed Hendricks,get what you need fast no hassle shopping,5,0,30.14.0.100,2025-08-09 10:44:02,30.14.0.100
74c725ad-f29a-48e7-b67c-ca0b7637532b,Rich,"Driver's damage things. Do not follow delivery instructions. Wrong items, I can keep going. Some deliveries are okay, most.... are not.",2,0,30.14.0.100,2025-08-09 10:28:27,30.14.0.100
21f1619c-019a-4def-94cb-f709d637ac58,Mark Melhus,"eventually they will come to understand, I am AlphaOmega. that is my software company registered official Animus, Lux, and Nano. “™®©SM”. 🦉",5,0,28.4.0.100,2025-08-09 08:18:32,28.4.0.100
d40f90c4-6bbd-499e-b49f-8a9c0c1339e8,Mike Larsen,ugh this new app... made me start using the webpage. where are the sure options? like price low to high or customer review from best to worst? I'll rarely use the mobile app now. this is terrible.,1,0,30.14.0.100,2025-08-09 07:53:51,30.14.0.100
5f746f61-11d7-4ff9-bb51-99d91d459af5,Abraham Chavez,grasias por los envios,5,0,28.6.0.100,2025-08-09 07:50:12,28.6.0.100
24ee2b43-0443-4571-908a-5595d0126437,Komal Gaikwad,"amazon is India's New scam portal, please don't buy anything",1,1,30.14.0.100,2025-08-09 07:36:24,30.14.0.100
ab5f4b33-0808-46c4-82fa-9c0f4271c503,death's touch (sk8-goddess-101),tearable app don't recommend all iv done is add stuff to my cart now it's flagged for unusual behavior and I can't login or make a new best bet is to use a different app,1,0,30.14.0.100,2025-08-09 07:31:51,30.14.0.100
6152c24e-e7fc-4d7a-959f-4a2e9a6de129,Gracie Ceja,great app.,5,0,28.18.4.100,2025-08-09 07:29:54,28.18.4.100
a2fc7b50-4fd1-4007-b36e-ed1018d4cb8a,Tanveer ah,"I am consistently experiencing delivery issues with orders fulfilled by Amazon's own shipping service. While deliveries from third-party carriers like Aramex and Naqel are always successful, Amazon's delivery personnel do not deliver to my location.",1,0,,2025-08-09 07:28:53,
1b0e1308-d89d-4042-a154-1827ffb6f579,Ayesh Sachitha,Perfect,5,0,30.14.0.100,2025-08-09 07:07:32,30.14.0.100
144b5cda-247e-472c-aba5-41bc38aee6af,Alaa Sharaf,تطبيق شراء ممتاز وأحببته جداً ♥️🌹🌺💞.,5,1,30.14.0.100,2025-08-09 06:54:35,30.14.0.100
17c670f0-332d-482f-9959-b5cc11d1c879,Stephen,Great and fantastic.,5,0,30.14.0.100,2025-08-09 06:39:16,30.14.0.100
6123b649-872d-4e99-9b9c-33a7c77388cf,Marianne Carandang,you broke the shipping address feature. i have an alternate address and the app won't let me set it to that. now i can't order what i need.,2,0,30.6.0.100,2025-08-09 06:38:59,30.6.0.100
2ea39ccc-2821-4913-acae-7cd7e181e034,Ron,love the progress in the direction of your customers 🙏🫡,5,0,30.14.0.100,2025-08-09 06:36:11,30.14.0.100
0cd0ef69-0c55-4c08-9070-443f3794994c,Rj Rameez786,good experience,4,0,,2025-08-09 06:23:25,
beaf30f1-be8b-4d1e-9e06-f9ec49b6bff8,Maribel Flores,excelente,5,0,30.13.0.100,2025-08-09 06:22:53,30.13.0.100
dbbc544c-1271-4e14-9103-be5f42a45a24,Farhan Tanvir Nayeem,why doesn't this have a dark mode yet?,1,0,,2025-08-09 05:25:27,
2c24c46a-a51b-4327-bd69-44c1f4c06eed,Mohamed Ehab,التطبيق سيء جدا طلبت 4 اوردرات و كل مرة بيحصل مشكل و بيرجعو لوحدهم,1,0,30.14.0.100,2025-08-09 05:09:55,30.14.0.100
de43116f-0a6e-48d4-976a-b3ac0d5fd2cd,Pebbles Jones,I can't even get the app since I got a new phone I have to go to the plastered and open it,1,0,30.7.0.100,2025-08-09 05:02:52,30.7.0.100
c9803dce-81a4-4bd2-9454-15e7d9c8b0ad,dontno4,Easy to find what you need and convince of purchasing wide range of products with confidence of previous reviews.,5,0,30.14.0.100,2025-08-09 04:52:46,30.14.0.100
47d5d666-5816-44b8-9ac9-9613a058371a,Che King,such amazing ways to find all kinds of new products. super fast deliveries and easy communication between buyers.,5,0,30.14.0.100,2025-08-09 04:48:54,30.14.0.100
52290264-717f-46b1-abfe-fa0222afbf5b,Charlie M.,this f'd up create a account page wont accept my information ... I'll stick with Ebay i like Ebay .,1,0,30.14.0.100,2025-08-09 04:43:49,30.14.0.100
89db93a9-bc89-405b-b5e2-5e532a0b87bd,Zero Cool,"I have a massive amount of lists, with all of the items in them ordered in a particular way. It would take a bit to explain why, but I use them and make changes to them constantly. And for like the past 15 years or so, when I pull up any of them the default sorting that they come up in has always been 'Custom.' However, today Amazon decided to change their default sorting to 'Most recently added.' And so, in my opinion that's just plain mean...",1,0,30.14.0.100,2025-08-09 04:00:02,30.14.0.100
aae7c920-e16e-4388-9d74-a9079d8b5bb3,Casey Korver,Bad user experience and literal spyware.,1,0,30.14.0.100,2025-08-09 03:24:53,30.14.0.100
7609d6e2-e5dc-4312-bf9c-d6642ce7fb3a,Cylinder Shadow,"I love the Amazon app and prime I just wish it cost less for the prescription, or if you have to pay the full cost a month that you actually get it with no commercials.",5,1,30.14.0.100,2025-08-09 03:02:21,30.14.0.100
a01451ea-6cee-48ce-91dd-417904f5e45f,Destiny Destiny,"glitching really bad, can't click links, constantly says Amazon has encountered an error & shows the dog picture.",1,1,30.14.0.100,2025-08-09 02:50:09,30.14.0.100
63bc5897-88c9-4a57-a2ee-0eeca16c7d41,M Krause,Good stuff,4,0,30.14.0.100,2025-08-09 02:46:42,30.14.0.100
66e96cb5-30ef-4053-b213-01196cbb7dd8,Jesse Salazar,cheap always get my packs,4,0,30.14.0.100,2025-08-09 02:34:19,30.14.0.100
c858fb7e-1c13-457b-afbb-97bd108dbf20,Darcy Leszinske,easy to search! fast shipping!,5,0,30.14.0.100,2025-08-09 02:17:11,30.14.0.100
4458939c-dad3-4a73-af06-c29940ceb372,H A,Not performing correct. has been affected by malware breach ECScape,1,0,30.14.0.100,2025-08-09 02:01:39,30.14.0.100
9e9c5613-1f1e-4ad7-97a7-495ab5010e15,pam riley,it's always on time,5,1,30.14.0.100,2025-08-09 00:04:30,30.14.0.100
c7842d57-6314-483f-904b-f642e5186bac,Debbie Douglass,fast & reliable,4,0,30.14.0.100,2025-08-08 12:04:30,30.14.0.100
9797d66b-3843-4c18-bcc2-c7ad4e3b1c98,Brenda Meris,block this hacker,1,0,28.21.6.100,2025-08-08 11:46:23,28.21.6.100
e5803e56-7369-4eaf-b01d-05971d8c3177,Moustafa El Fakhrany,"Within a week, my old Amazon account was hacked and I couldn't get it back. I created another account and enabled two-step verification. I was logged out and couldn't access it again. What are they smoking on Amazon?",1,0,30.14.0.100,2025-08-08 11:40:54,30.14.0.100
da3f613d-ef79-448e-a8cf-c9dec8a565b8,Andrew Wilson,"Good when everything works but hope to god nothing goes wrong because getting through to support is aw-ful. Used to be super easy and helpful and lightened the service experience, now there's 100 steps and by-design friction between your pain point and a resolution to get you to give up than contacting support leaving you with unresolved issues and buyers remorse. Using Amazon less now because of this.",2,0,30.14.0.100,2025-08-08 11:23:35,30.14.0.100
d42f8297-2672-4e20-a002-61770954b045,Mohamed Rinawi,3 days laying and no delivery application freeze and slow,1,0,30.14.0.100,2025-08-08 10:06:42,30.14.0.100
2ae2c9ff-81cf-4c93-ae3d-b0ad62be4562,Me Myself,The new floating popup thing that always accidentally opens because I scroll slow is so annoying. Remove it. It's a pain.,1,0,30.14.0.100,2025-08-08 10:06:37,30.14.0.100
1297c021-d2e6-45ef-836d-d8582dbb76bd,S W,Doesn't load or is super slow freezing every time you try to scroll down. Uninstalled and about to cancel Amazon prime too.,1,1,30.14.0.100,2025-08-08 09:45:20,30.14.0.100
e2b7c18d-1ab3-4097-9969-92369365a2fd,jeffery blevins,Great on-time delivery service,4,0,30.14.0.100,2025-08-08 09:31:09,30.14.0.100
6664717e-7a55-460e-b351-369d13c97c03,Nicole Successful,every time I buy something I have to return it cuz its not like wat I think its supposed to be amazon is getting to be like temu lol temu is the worst thing in the entire world I hate to think amazon is getting to b like that,1,0,,2025-08-08 08:59:27,
8b8b504c-bc68-4495-a9bb-85caf1284413,Avisha jasubhai,I am not getting an option to call the customer service and the delivery person just threw the package and left. Also every time I try to leave a rating for the delivery person it shows an error. please fix this,1,4,30.14.0.100,2025-08-08 08:48:40,30.14.0.100
f05958a0-3e30-425c-b1b2-17684abb4ef2,Suzy Elly,worst customer service ever!!!!,1,0,,2025-08-08 08:43:46,
ba29ae6a-fbc2-4a09-bc81-0daa5f47528f,bongiwe zitha,i love the service,4,0,30.11.0.100,2025-08-08 08:41:50,30.11.0.100
2dc32268-de62-4eff-b670-36d43cf0d641,Tony Burke,AI messed up my account 100 percent,1,0,,2025-08-08 07:31:37,
c05926fe-c332-4e15-9049-a2f45e34ad19,Skye,great time ⏲️ ❤️ 💕 😀,5,0,30.14.0.100,2025-08-08 07:21:43,30.14.0.100
4a52acdc-3ece-4bb5-b01e-867a1e744b23,Wayne W,somehow I don't have Amazon Prime but they were taking money for it will be calling customer service today we'll never shop Amazon again,1,0,30.13.0.100,2025-08-08 07:16:52,30.13.0.100
46a1cc30-33a4-4fce-8eb9-c9af12876bd0,Josiah,Again the Amazon app is faster easier way to get to Amazon to buy things brand new its an 80% chance they will have what you need somethings not really but most things you need Amazon is the go to.,5,0,30.14.0.100,2025-08-08 05:45:27,30.14.0.100
068bdcb3-beab-4ed9-b43b-082ea3dd2c27,Saša Marić,2nd time amazon freezes my order and locks me.out of my acc. they call it suspicious activity for some purchase of watch or mobile. but everything was done over my phone and not third party involvement. and they simply keep me.from shopping an item i want. no support service just rendom ai b.s.,1,0,,2025-08-08 05:08:02,
234a9cce-3516-4d27-be37-e60911798bd6,Boboloboloo (Boboloboloo),Added a new AI and no way to opt out,1,0,,2025-08-08 05:06:24,
66818277-eeef-44e0-af82-1f9895a8b5b3,Prasanna Waniga Baduge,no reliable hidden charges when pay never ever buy from this company and never talk with friends,5,0,,2025-08-08 03:47:14,
8fefd91d-fefb-4fd1-9039-fa814266bd82,Harper,best shopping experience I've ever had in my life,5,0,,2025-08-08 03:30:57,
c31cfa67-248f-4ae5-8f32-e027a78f2534,Samantha De la Rosa,"there's always an error while signing in with an account, specially when entering a password or trying to change said password.",2,0,30.14.0.100,2025-08-08 01:41:33,30.14.0.100
7e6eed8c-d7cb-4210-a4d5-8195e3eb7495,Charles Ellenbeck,next level guys!,5,0,30.14.0.100,2025-08-08 01:30:42,30.14.0.100
79a1681f-9cdf-4686-96be-2e82bd7ad7db,Marcusnbyb11 Mcgee,Amazing,5,0,30.14.0.100,2025-08-08 01:19:59,30.14.0.100
3eb1a0be-fd73-4fe3-863d-6eeec0535ba6,courtney r,horrible,1,0,20.20.0.100,2025-08-08 01:19:46,20.20.0.100
662e0290-a1a3-4aa7-8286-14f64bd31996,Paul Maitland,glitchy instead of pictures I keep getting numbers down the left hand side vertical,2,0,30.14.0.100,2025-08-08 00:42:33,30.14.0.100
153eb455-b522-48f6-94ba-92e596cb244f,David Leonard,Fun way to shop. 😀,5,0,30.14.0.100,2025-08-08 00:02:34,30.14.0.100
4e9c6e50-b8a1-4890-9415-02991bfece21,Ronda Rathburn,I love Amazon! They have stuff no one else has!,5,0,30.14.0.100,2025-08-07 12:36:45,30.14.0.100
a2fc7b50-4fd1-4007-b36e-ed1018d4cb8a,Tanveer ah,"The app experience is generally good, but the customer care is extremely frustrating. It is nearly impossible to follow up on a previous complaint because there is no clear record of past conversations. Each time you contact support, you have to re-explain your entire issue from the beginning to a different representative, which is a an exhausting process. This makes solving even simple problems a huge challenge. Improvements are urgently needed in this area.",2,0,,2025-08-07 11:52:10,
d556ae49-6784-4548-b84e-a57a915dbbd3,Conor Hughes,Morrisons order cancelled. Thanks a lot for not delivering my food shop. Let's hope I don't starve 👎 you haven't placed any orders in 2025... Yes I have! I placed one yesterday,1,1,30.14.0.100,2025-08-07 11:46:33,30.14.0.100
