reviewId,userName,content,score,thumbsUpCount,reviewCreatedVersion,at,appVersion
bdad5412-90cd-494f-9e06-246f9d492765,Shelby Stirling,"I wouldn't bother with prime trials. Even if you cancel through google play, they'll still charge you 9.99$ at the end, with nothing showing up on Amazon or Google Play about you having an active subscription or payment cards listed. Extremely scummy practices, but why am I surprised. Amazon CS & Google CS are extremely useless, not providing any help due to ""not being able to find that subscription on your account,"" so just avoid altogether. Amazon prices aren't really cheaper anymore anyway.",1,4,26.15.2.100,2023-08-15 16:54:41,26.15.2.100
669f85dd-9d80-4936-9cc4-6aa037384ef8,Chris Fausch,"I hate that they basically took away the Q&A section from the product pages. It probably saved them some money. I hope they change it back to the way it was. I used it all the time to get info on products. I will change my rating when that happens, I will probably start shopping elsewhere. Also put the search bar back to the top where it belongs. Make things easier, not harder for customers to find and purchase things.",2,2,26.15.2.100,2023-08-16 23:06:17,26.15.2.100
25f88485-0536-4e50-8ebc-3fb3e1bf8228,Tia Brown,"The selection of products is good and i order from here frequently. The reason for the 3 star rating is 1 they changed where the wish lists are found its not as user friendly 2 i can no longer press and hold the heart on an item to save to a specific wish list. 3 this is a personal preference but i wish they allowed an option for which delivery service we could use because, imo UPS is the only good one and i'm tired of having to track dowm my packages from other carriers.",3,2,26.16.0.100,2023-08-21 18:39:50,26.16.0.100
7b44864b-a4f0-4a02-9248-63fcc006ffa2,M,"Always an issue trying to see order history. Says ""Oh no something went wrong "" and then gets stuck. Can't write reviews any longer since I wrote one where I called out the vendor for not sending the item advertised. I used to buy EVERYTHING on Amazon but between the app never working properly & taking away my ability to review without an explanation and paying for prime in order to get 2 day shipping but usually never do; I'm shopping elsewhere. Before buying on Amazon check Shein for better $",1,27,26.15.2.100,2023-08-14 01:33:23,26.15.2.100
1e84335d-1ab9-49b9-be5f-e85c0f689bd7,D D,"The team at Amazon always tweak the UX/UI with the ultimate goal that you'll spend more. Lately they have moved around/removed features on Lists ( on the application and web ). Without easy access and the ability to reorder, this has curtailed my spending. Sorry Amazon. Bad move.",2,6,26.15.0.100,2023-08-11 21:37:26,26.15.0.100
267d7700-4117-41d5-8a77-9fc9b98274a0,william compton,"Whenever I go to a product page, it keeps giving me an error multiple times. Also for some reason I can't even contact customer support in the app, I tried doing the product thing and no option to talk to an agent just pre selections to choose from, then I tried to do the help and no luck with that with either. I just need help with a live person and no help from the app or website. I even searched for customer service number and was a medical alert number? Like what?!",1,1,26.14.2.100,2023-08-01 19:27:58,26.14.2.100
9fb235e0-57cc-44ce-b1ba-30037e1ebeee,Nia D,"This app has always been a tad problematic, but with each change they make it gets more counter-intuitive. And with the most recent update, it is flat out unusable. I can't access my account area nor my orders. Not sure what they did, but they broke it. Very frustrating.",1,29,26.15.0.100,2023-08-05 05:35:29,26.15.0.100
e62659cb-7882-4bf3-9d95-0f36429b69d1,tomons 1,"They changed the layout of the app's interface. What for? So that the developer would have something to do? It has been working perfectly before and I prefer the search bar located at the top. You can barely post your review this time because that UGLY search bar covers the ""POST"" tab. Another thing, Bezos has become SUPER GREEDY his minions won't let you use your gift card balance to be credited to your Amazon store card balance. They'd like you to buy some more! THESE PEOPLE ARE CROOKS!",1,64,26.15.0.100,2023-08-06 23:19:24,26.15.0.100
e36805fe-5e85-465e-8cf2-5a44dfd910ef,Yuri Pena,"Anything I need for my business! Even better than vendors. Unfortunately, Amazon makes it difficult to open a business account as it asks for information that is not applicable. Either way, I still get great deals and am able to file them as business expenses. Best perk is next day delivery! 🙌",5,15,26.15.2.100,2023-08-18 23:13:25,26.15.2.100
9dad605e-17e9-4d27-a527-b01a7d9c88ae,S,"Not a fan of this app. As a decently tech savvy person, this app is hard to navigate. Where is the search by department feature? Doesn't exist. Only a recommended short list of the departments previously looked at. It randomly created a wishlist I never made, and there is no way to reorganize the order of items on wishlist.",1,6,26.15.0.100,2023-08-11 19:36:02,26.15.0.100
361f73c7-8201-4d14-a76f-fa6d6ecac5df,Timi LeCroy,"The change format is completely user unfriendly. Search bar at the bottom, really? The orders tab is so confusing, just to find when my orders are on there way takes 6 steps. And for the love of.... I'm on a tablet and no matter what I do, followed all Amazon ""help"" I can not get it off desk top. Great news for me is I shop less on Amazon, can't buy what I can't see.",1,5,26.15.0.100,2023-08-09 02:38:49,26.15.0.100
7716eaa0-2cd7-4c1b-9f1b-023385b2508f,Sandon Fetters,"The newest update that reorganized how we view our wishlists is horrendous. For anyone with more than 2-3 wishlists, it makes view them rather annoying the the auto grouping if items from different wishlists is not only stupid, but completely unnecessary. I don't need Amazon specializing my wishlist groupings; I've already done that by organizing my one set of wishlists. What an unnecessary and regressive update. If you really think people want this, at least provide an option to view as classic",1,2,26.15.0.100,2023-08-05 12:50:54,26.15.0.100
96b2c1e0-f81c-4e49-947b-65f5183dbe83,Dawn Renee,"The update stinks! The app now NEVER opens correctly! I ALWAYS (yes, always!) Get an error message now saying they are ""attempting"" to resolve the issues. Riiiight. I hate the search bar on the bottom! Look, 90% of my shopping is done thru Amazon, but if things don't improve soon, that will change!!",1,5,26.15.2.100,2023-08-12 19:31:38,26.15.2.100
55ec3665-a4be-47e2-8543-611c9cb7a45c,Surreal Politiks,"There is much I dislike about Amazon as a company, but I have not a negative word to say about this app. It just works. The notifications are always pertinent, the functionality never fails, and everything happens just as fast as I can tap away. I wish I had a better alternative, because I despise what I fund politically by shopping at Amazon, but nobody has yet to provide a better system.",5,5,26.14.2.100,2023-08-08 09:33:54,26.14.2.100
592a55ae-3909-4ee6-b91b-d2cb1de8f3c0,D. Wolf,"Still, after years, remains buggy. UI update is not good and, like others have said, counterintuitive. Now, when get to the page to change my delivery address, it just won't. I have to preemptively change the delivery address before I get to the cart now. For being one of the richest companies, it is pathetic how horrendous the app has become. A frustrating experience, but they know they can remain low effort because we still have to order items...",2,8,26.15.0.100,2023-08-05 20:26:27,26.15.0.100
49d3c269-ccf1-46f0-80c5-4cceaaa7c1c7,Butt Munch,"been a customer since 2010. always loved amazon & invested lots. began to notice that over the past years, the quality of the business has plummeted abysmally. last 6 months is where i have begun to notice this & turn towards leaving amazon entirely. there are two main reasons why. Your customer help service center . It needs fixed. It's terrible to navigate. Secondly. The quality of the products that amazon allows to be sold has gone down in quality as well. Disappointed. There's more too.",1,3,26.16.0.100,2023-08-28 22:13:28,26.16.0.100
65a21061-37dd-4d3a-a057-d0619bb1c2ba,Raelle X,"Although I love Amazon shopping and I'm a loyal customer, this app is irritating. It comes pre-installed on my phone and when I google an item on Amazon so I can open the link in my browser so I can send it to my friend, it launches the APP instead and refuses to let me find the URL. I want amazon in my BROWSER not an app. The app is dumb!",1,1,26.14.2.100,2023-08-04 23:10:33,26.14.2.100
1e0fe1d3-933e-4bc3-b3e3-2a86daf7cf96,Joel H.,"Since the Aug 9, 2023 update, the app doesn't display properly on my Samsung Galaxy Tab A8 unless I pivot it to widescreen. Also, when I find an item I want to add to a list for the future, my lists do not exist. If I click to create a new list, it takes me to a dead link, ""Sorry, that page does not exist."" HOW DO I ROLLBACK THE UPDATE TO THE PREVIOUS VERSION?",1,5,26.15.2.100,2023-08-17 22:01:04,26.15.2.100
e96aedf7-3514-4a51-ba7f-d53c76a027fc,Harold Lloyd,"Terrible customer service. They destroyed one portion of a delivery, but they have no mechanism to re-add that portion. I must individually repurchase the items. On top of that, I had to wait over a week on TIME SENSITIVE items just to request a refund. It's all automated with no human interaction, and their system simply cannot fathom someone still wanting their package or having an option to easily select the damaged items. Who is rating this trash company with 5 stars?",1,2,26.15.0.100,2023-08-04 15:13:58,26.15.0.100
7046fccc-d21d-49bc-a7be-a15dddf70eb7,Erika Wyss,"First the search bar moves, now you relocate my wishlists? Why? Why is it always a scavenger hunt whenever I open this app? Please, stop moving things. Just put them back where they were. Search bar: at the top where the rest of the world keeps their search bars. Wishlist: back where it was so its 1 click away instead of 2 or 3. Its like you want me to buy less or something.",1,0,26.15.0.100,2023-08-11 22:06:21,26.15.0.100
00c02e91-990b-4aec-8882-76610f3e7385,Thomas Novitsky,"shopping with Amazon is easy but their delivery drivers are illiterate morons who can't follow even basic instructions. The instructions are simply to deliver to the back deck, not to drop by front door. it's not hard to get to, no locked gate or other obstacle. Even with the front door, they can take the time to set up a photo op of the box, yet ringing the door bell is too much effort for them. They are just lazy, or ignorant. so -2 stars for that. otherwise it would be a 5 star rating.",3,38,26.16.0.100,2023-08-27 05:09:01,26.16.0.100
bb9a6062-bd1b-456b-b93a-42ceb6d01406,Andrew Smith,Why do I use Amazon? it is because they are reliable. The stuff arrives when they say it will or before. The customer comments and star ratings are very helpful and fair assessments. No quibble returns and no delivery charge. I know that's covered by my subscription and the price of the goods. I find it to be a very trustworthy company. The range of goods is huge.,5,4,26.15.0.100,2023-08-07 06:54:13,26.15.0.100
30f3f4b5-0e0f-4dfd-a875-bf108644f455,Dawn “gumdrop66” Goodwin,"I love shopping with the Amazon app, but now the page view has changed. Instead off having the original full screen of the item you are looking at, they have made it smaller with boxes to the side for description and buy. Why? When this makes everything smaller, it feels crammed and you cannot even zoom to see the wording or item. How do I change it back to the original?",2,17,26.16.0.100,2023-08-21 11:49:41,26.16.0.100
c38a95fc-7620-4ced-a851-669b3b81ee29,Daniel Detwiler,Received another person's package from another town inside my package. Amazon has a process to ensure quality and for some reason every person in every job along that process screwed up or just didn't care. Amazon is going to trash. Some products I do receive but gotta search for the true price bc a lot of sellers upcharge for the same product. Will change to 5 stars when my review of the product i received incorrectly is posted.,1,0,20.19.0.100,2023-08-13 17:03:13,20.19.0.100
c7f99f19-81ce-45e4-949b-b8604aa661ce,Tom Allison,"It's very confusing why Amazon makes it so difficult to reconcile transactions. There's no simple view to show a charge amount clearly displayed against what was purchased (not an order number). Orders are taken for $X but the bank reports this as multiple transactions, also making reconciliation extremely difficult. I understand it's to your advantage to conceal expenses from the customer but it's ""bad form""",2,4,26.16.0.100,2023-08-19 12:33:11,26.16.0.100
8885b8a7-53b5-4a57-b287-d0124d6a46dc,It'sMe412,"I didn't think it could get worse but this latest July update is just awful. Blows my mind that someone thought the new layout when viewing items was a good idea and even more that it actually got approved to roll out. It's a simple shopping app, it shouldn't be this complicated. Get it together over there and fix this mess!!",1,2,26.15.0.100,2023-08-05 06:27:40,26.15.0.100
7e82fe1b-d5af-4698-9f52-76e52b87ac91,Christine Day,"Amazon!!! What's happened!!! I cannot get a full view on page anymore. We need to see larger product. It won't enlarge items!!! It's not compatible with my 9 inch Tablet (portrait). Even on (landscape) you have to scroll sidways. It's a horrible experience now. The screen looks bitty and jumbled. Not crisp, and keeps moving around and unstable. On my phone it's ok, you can still scroll down.",2,10,26.16.0.100,2023-08-23 20:29:03,26.16.0.100
040a9be1-de23-4ab7-af8e-5d648351c9a5,JAYJAY SOLIS,Fine app. I don't know why but when I click on a item it's shows desktop mode even tho I'm on tablet!!!😒 This is really annoying and it's hard to put things in my list and I had a giant party COMING up and now I'm having trouble putting things in my list.plus it's laggy and slow ! 😕,3,2,26.15.0.100,2023-08-04 23:19:30,26.15.0.100
edd04293-af31-4140-8c7b-1ea434a803d7,Terry “Nudist Priest” Traynor,"Will say free shipping if over $25, or if delivery after certain dates, but don't believe it. They will charge anyway. Customer service once great, now terrible and with Reps that barely speak English. Qualifying government programs for reduced Prime membership sound good but Amazon makes signing up for these nearly impossible. Spent 1 1/2 hours with them and accomplished nothing. If you can get your items from anywhere else I highly recommend you give others your business.",1,6,26.14.2.100,2023-08-01 18:43:36,26.14.2.100
6ea9e93d-260f-43b1-8181-c5cb0c6495cd,Ted Faircloth,"One very disappointing thing to note is the ""wishlist"" section is now trash, takes too long to access the comments for each item and they get categorized without my consent! NOTE TO AMAZON: I don't like the fact that you can't add your comments to the item saved to the wishlist the moment you are selecting the list 2add2 , you have to dig deep into the personal,lists,selected list, then select the item to comment on which defers you from the product page where YOU COULD BE MAKING A PURCHASE!",3,3,26.15.2.100,2023-08-13 14:40:46,26.15.2.100
a9b6d18b-2601-4e5c-9ebc-9bcd0e30ecd2,Gabrielle Hayes,"The app is currently glitching out. Every time I press the proceed to checkout button my cart loads for a second and goes right back to the cart. I've tried closing and reopening the app, Uninstaller and reinstalling the app as well as restarting my phone and reopening the app. Still happening. I have a lot of money on my Amazon gift card and would like to be able to to use it. Thank you",2,103,26.16.0.100,2023-08-30 17:46:05,26.16.0.100
3c013eca-bc9e-4a24-9d2d-a333af491e54,Randall Derby,"Ordered a set of 3 pans. Amazon sent me email and message through the app ""Your package is arriving earlier than we previously expected. It’s now arriving:Thursday, July 27. Then ""Your package is on the way but running late. We’re sorry for the delay.Now arriving tomorrow by 10 PM."" Not received. But, the worst of it is, when I checked the charge on my credit card, they charged me twice for the same order! $212.99 both times. I will now spend a day contacting them to correct their error!",1,1,26.15.0.100,2023-08-04 00:50:37,26.15.0.100
e7a7ad42-44d1-4861-873a-ec43637662e8,Mike Vidal,"I love Amazon Shopping! Everything is so easy, including returns. I shop Amazon more than anywhere else. Great customer service. I love that you can find almost anything you could want, and more. If I don't need it today, I'll most likely get it from Amazon. Most items arrive anywhere from 2 days, to under a week. There are lots of products at Amazon you can't find anywhere else. Lots of good deals too. Again, since returns are easy, I can buy with confidence. I've never had a problem.",5,7,26.15.0.100,2023-08-12 05:05:43,26.15.0.100
e30f0b62-5cb6-4116-be8b-8a2b707a52b0,Adrian McCarthy,"I like this app some of the times. Most things ship as you would expect. The issues I have are with anything pre-ordered and with things that are not marked as being sent with UPS. If pre-ordering a video game, expect to wait days after the game releases before getting it. (You should buy digital or go to a store for physical copies.) I also tried pre-ordering a small statue for my desk. They canceled my pre-order, then doubled the price. With UPS, if the item is lost, you can't get a refund.",1,148,26.16.0.100,2023-08-26 14:50:48,26.16.0.100
cf6a512f-638f-471a-9c73-2b5d5f7ab68e,James Gaskell,Why cant you use the auto password genarator to put in your password? Whole point is for it to be more secure yet you're terribly designed app (the rest of it is just everywhere and isnt straight forward) wont allow me to auto insert passwords from apps that create auto passwords for more security. Absolutely backwards app designers/coders,1,3,26.14.2.100,2023-08-01 17:46:48,26.14.2.100
aaa6d4ac-9227-4ca4-bab4-6b52a6f14e05,Steve,"Hello, could we please remove the little ""heart"" button for adding items to favorites list? The one which appears on the product listing details? Why? I am *constantly* accidentally triggering it as I swipe back and forth through the listings. This only recently started happening. Is the favorites button placement new? It's never happened before, and now it's happening to me all the time. I guess it's too close to the edge of the screen, directly in the path where it's natural to scroll. :(",2,57,26.14.2.100,2023-08-03 22:13:13,26.14.2.100
12124ef1-ddd8-4fc0-b7ac-020c23a79aa0,Jessica Weeks,"This is NOT user friendly, it is horrible! If anything the website should have been given a change because the app was great before. The color\option choice is all over the place now and now we can't even zoom in which was a very useful feature. Makes the online shopping experience annoying. Change it back, please!",1,7,26.15.2.100,2023-08-18 18:10:32,26.15.2.100
c7bd8525-e63d-41cf-b2c6-a9138ba32f55,Lucy Watts,"Not real happy with their stringent return policy. I was happy to send a photo of the box as it arrived, upon opening and seeing nothing but loose face powder completely coating the box, falling out. It WAS pressed face powder, but I am busy and to have to take time to get to the UPS facility to send back the empty powder container was ridiculous. It costed less than $15.00 for Pete's sake!! Also can't add an item to an order anymore. G'bye Amazon.",2,0,,2023-08-24 08:32:46,
2486626f-e174-40f4-a1bb-69dc1ed5863e,Paige,"Ok this app it great, your packages come to your house and they have great stuff. But I give it a 2 star because after awhile I find an item I like and I go to change the color and the little heart in the corner just disappears so I can't add that color or that item to my like list anymore. I also deleted the app because even if I don't change the color I can't add any product at all to my liked list anymore. Please Amazon fix this. I really like your products so please fix this🥲🥲",2,0,,2023-08-04 04:11:11,
7e2023b9-b414-452f-a4db-3466ea24615f,Empty B,Just a pita. You took away the visual for star rating which is one of the main efficiencies of having a rating system!!! Why bother having stars at all? It's so clearly a manipulation and ridiculous. Also as others have mentioned the search algorithm has noticeably gotten worse with tons of unrelated sponsored content being introduced. There are so many awful things about the site and app at this point. It's about to enter the age of more effort than it's worth.,1,3,26.15.2.100,2023-08-17 13:23:21,26.15.2.100
77f19fcb-2a96-4799-821c-c4c842f9d0b8,Kyle Walker,"Not worth it anymore. Amazon used to be a great place to shop when you needed to find something not in your area or to get a good deal. Now, everything is 2 to 4 times more expensive than in stores and only goes on sale after you buy it and it ships. This has been so disgustingly consistent that I don't even want to be a prime member anymore. Amazon is slowly becoming another Wish or Aliexpress selling cheap Chinese products for insane prices. Even their customer service has gone downhill.",2,385,26.16.0.100,2023-08-29 00:53:15,26.16.0.100
a7580cb2-2633-4d96-9d93-eb40f70ee053,Brainiac Fingers,"What the hell has happened to this app? 30 minutes ago it was a well designed and functioning app . When I returned to it after a 30 minuet break, it had been changed into an horrendously confusing piece of garbage that won't let me purchase anything. This level of incompetence is ,sadly, a sign of the times.",1,3,26.15.0.100,2023-08-05 00:02:37,26.15.0.100
eb1f5915-4f46-4add-86e8-6837a2845401,Kimorah Longsworth,"🌟🌟🌟🌟🌟 I absolutely love Amazon! This online marketplace has revolutionized the way I shop and has become my go-to destination for all my needs. The convenience of browsing through a vast selection of products from the comfort of my home is unbeatable. With speedy delivery options, I always receive my orders on time, sometimes even earlier than expected! I appreciate the detailed product descriptions and customer reviews that help me make informed decisions. The customer service is great",5,10,26.15.0.100,2023-08-07 04:34:00,26.15.0.100
1f74078d-485e-49ca-a8b5-8eb01d54567b,Mark Ruane,Several issues with the supply chain. Had multiple attempts to contact the customer service. They direct any questions to an internal department who deal with the issue. They never followed up after multiple messages over several weeks. Then they finally respond to say that the internal department have decided to cancel our order and have not given a reason. That was a iteam that was sold and distributed by Amazon. Dealing with third parties through Amazon is also terrible.,1,2,26.15.0.100,2023-08-08 15:13:37,26.15.0.100
dc81bb2c-8734-4593-9df6-64c5380f9bf7,Kelly Krohn,"double charged multiple times, refused to refund my money. i had to have my bank do a chargeback each time for which Amazon will send you to collections. i keep receipts of calls and chats, and send my bank statements to the collections company to get it cleared. they have lost a customer over a simple error on their end they refuse to fix.",1,4,26.15.2.100,2023-08-16 20:46:28,26.15.2.100
d83fe6ca-004e-43a5-8131-50de254cd23a,Ingrid Owings,"Getting fed up with ultra slow shipping. It seems that prime is worth nothing... 2-4 weeks to even ship? 6-8 week arrival time? Ordered an item today that used to ship within a day or two and I'm told it's over a week out but it's in stock. Amazon blames it on 3rd party shoppers... Ok, then stop doing that or stop charging for prime. It's like prime is sudenly only good for the cheapest of the cheap stuff. I can shop at Walmart for that... But my scarf.. maybe next year.",2,7,26.15.2.100,2023-08-14 19:46:26,26.15.2.100
00585d59-6b57-46c7-afbd-c92bbc4587aa,Darby O'Connor,"Quality of items bought off Amazon is pure garbage. Many returns on items not fully functional or didn't work as advertised.Some items I opted to keep,but had to buy replacement parts from someone that sells quality products. Customer service is also trash, multiple times refusing to work with me. Wouldn't send replacement even though the item said it was eligible for replacement, but upon calling Amazon they claim it is not. Tried canceling prime on multiple occasions, to my surprise it was not",1,2,26.15.0.100,2023-08-11 22:39:53,26.15.0.100
b862803f-0946-4b5c-a484-49b711ccc678,Manny Johnson,Amazon took a order for a item I placed that only has one in stocks. Half way through they turned around and said that they canceled my order. Stating my payment method was not going though. Although it went through when I bought it . . . And I can not even recover the money back which is 50 dollars. This is the worst experience I've had with a app.,1,4,26.16.0.100,2023-08-24 14:56:57,26.16.0.100
0e2b0321-1bad-4eee-973b-f575ef2e3518,Charlotte Mainprize,"Usually I like the amazon app, however, it hasn't been running so great since the last update. When I'm viewing items, particularly reading reviews for an item. The app will suddenly go white and a few seconds later the home page of the amazon app will load. First World problem I know, but it's a bit irritating.",4,7,26.16.0.100,2023-08-30 05:53:02,26.16.0.100
eb509245-a4c7-4234-83c1-ad1da377f1ef,Eissa Guardian,"Whenever I click on notifications for daily deals or any deals, it wouldn't actually show me, the page would be blank, and I can't create deal notifications anymore. I reinstalled it and cleared cache and data but nothing works. Its been like this for almost 3 months now, it's annoying.",3,4,26.15.2.100,2023-08-12 00:30:01,26.15.2.100
