reviewId,userName,content,score,thumbsUpCount,reviewCreatedVersion,at,appVersion
32daa990-62c0-4618-ac69-947f5dd2cc79,A Google user,"Lately I've been having issues with Amazon app. Specially learning that the sellers are using drop shipping to sell the items. It does not allows you to choose from which country the items gets shipped from. The ones I've ordered with Amazon prime have been getting shipped from China, which takes almost a month to be delivered. So, why pay prime then if most this will be as late as the one you order off from Wish or Alli Express. Total disappointment and loss of money on a membership.",2,0,18.21.2.100,2020-01-15 22:06:32,18.21.2.100
05feae79-0955-4b0b-877c-0d1bbbae78b4,A Google user,"one of the richest companies in the world and their app is ass. it's basically pulling everything up like a webpage inside the app. the buttons are extremely hard to touch and basically give no feedback and it takes about 15 tries in order to bring up a product image. WALMART has a better and more user friendly app than amazon. it's 2020, not 2005.",1,3,18.21.2.100,2020-01-08 16:26:39,18.21.2.100
58e68414-9229-4f2b-b220-fb3870003bf4,A Google user,"They updated the app to make it as useless as possible. You can't just scroll down through all options. You have to tap to go through page after page. You can't select US only vendors, which means it's more difficult to weed out the Chinese counterfeits...and they are everywhere on Amazon. You can filter by brand, but doesn't show every brand and won't allow you to select several at one time. You have to tap on filter again to select each additional brand. They ruined a perfectly good app.",1,145,18.21.2.100,2020-01-16 04:20:30,18.21.2.100
5f851212-13f3-4802-8c17-f8644cbb23fc,A Google user,I use amazon constantly it is very convenient. I have noticed a spike in pricing on items that i know i could get cheaper if i had the time to go to the store and purchase it myself. I pay for prime benefits to guarantee a faster delivery being in the same day. Now i have contacted customer care through their chat feature lastnight when a $30 gratuity was offered for my inconvenience and still have not received the gratuity.,3,1,18.21.2.100,2020-01-13 23:21:17,18.21.2.100
a9f799a1-ae22-412f-93a6-04f8c2607243,A Google user,"This app is so frustrating. There is an ongoing problem with getting things I click to register. For instance, when I try to click on a size for ordering shoes, nothing happens. Then if that finally decides to work, I can't get the 'add to cart' button to click no matter what I do. None of the updates have ever resolved this issue, and it's been a problem right from the start. I just might be done with Amazon!",1,56,20.1.0.100,2020-01-23 04:21:34,20.1.0.100
277e7d51-2d40-4f5e-902d-67dfbfd29358,A Google user,"Poor customer service. Was left on hold for over 10 minutes after being pushed off from one cs rep to another. Deliveries are always late. Even with prime membership, no more 1 to 2 day delivery. They didn't honor their ad. They didn't match the price. Definitely not worth paying $13 a month anymore. I'll just stick with Netflix and Roku for movies and shows, and cancel prime.",1,2,18.21.2.100,2020-01-11 20:37:08,18.21.2.100
2843192f-886c-4ab9-8f46-18c0ae8f699b,A Google user,"It works. Slowly. Startup takes forever and it feels like a glorified web app. The menu and many buttons don't feel native at all. That said, prime shipping is great usually. Except for the occasional problem where they mark an item as having prime shipping, but it takes 4 or 5 days. Then it feels like a scam. Overall, Amazon has good products at decent prices, but the app is kinda meh.",3,109,20.1.2.100,2020-01-28 06:01:28,20.1.2.100
89a5455f-b554-4845-bc3d-ce1f7098fb96,A Google user,"Worst app ever! Refreshes after each selection so you have to go back every time you want to add a condition, Amazon expects you to have the sorting options committed to memory since hitting the back button goes back to the search page, have to press the next button to see the next batch of products instead of seamless scrolling. Worst user experience in all the shopping apps I've used.",1,0,,2020-01-01 16:31:20,
222e1698-67cd-442e-9efb-a26a61fc6807,A Google user,"I've been an ebay shopper for many. Friends talked me into trying Amazon. This app is bad. I did a search for milwaukee packout dolly on ebay app and 90% results was what I was looking for, Amazon's results revealed bubblegum machines, golf clubs, etc, oh, and 1 of what I was looking for. Wth? The other issue is you can only review a few results at a time, then keep tapping next. Thanks but no thanks.",1,0,18.21.2.100,2020-01-13 06:31:30,18.21.2.100
7648139f-8274-43f8-9dde-78148388cd8e,A Google user,"I am a long time customer and primarily have done my shopping via the app. Like several reviewers, the past update has caused it to be annoying and frustrating. First of all, what's with the ads replacing the ""see more like this""? Secondly, hitting the next button was an unnecessary addition. However, one thing I do like is the ability to rate the delivery experience.",3,135,20.1.0.100,2020-01-25 21:53:48,20.1.0.100
be072b15-5857-439c-a605-ad2a33ff9261,A Google user,"Lowered app rating from new update when they removed the option to see similar items at the bottom of a listing and instead replaced it with ""related posts"" that just look like ads. Much less helpful when searching for what you want to buy. Terrible to have to search through pages of listings, hitting next and not being able to easily find a prior listing. Long lag times and frustrating to not be able to choose multiple filters then apply them all. It's all directed at showing more ad listings.",2,239,20.1.0.100,2020-01-18 05:09:23,20.1.0.100
aff2d157-9f1d-4846-848a-19e5d5ae071b,A Google user,"Load times for filters ruins this. So slow! No different than using the site on a mobile browser in which case why bother using an app. Too bad Amazon will miss out on purchases of mine because I always say....nah I'd rather just wait and do it on my pc or laptop. By then I often forget what I was shopping for and don't shop for several more weeks, if at all. If I were Bezos I would tear his IT department a new one for still not having fixed this. You're losing revenue due to this guaranteed.",1,0,,2020-01-22 23:02:50,
c1444e8c-f16e-4e42-816e-aa9ac6c36612,A Google user,"The app works really well until I get to the payment/delivery options screen. If I try to make an adjustment - for example, when changing from standard delivery to free delivery - I just get a spinning wheel and I can't complete my order. It is very frustrating. This has been a long-standing issue, across more than one device. If not for this bug, I would give the app a five star rating.",1,98,18.21.2.100,2020-01-09 22:08:48,18.21.2.100
fa2c7c08-0392-4529-8d78-c545902a1523,A Google user,"I love Amazon but after the last update you can only look at 10 items per page and you can only filter searches one at a time. It has made shopping in Amazon an annoyance which makes me look elsewhere for product. Dropped my rating down to one star. I just can't anymore with the app. The new filtering makes the app mind numbingly slow. And each update adds a new problem or a ""feature"" that makes it less user friendly",2,88,20.1.0.100,2020-01-17 02:31:08,20.1.0.100
9588283f-9f60-4826-b3c6-2790660a0ae3,A Google user,As a Amazon Prime member I like using this app. However I notice it has been gotten a bit worse. Lately I tried to filter out my search in order to get the things I need. Like 90% it glitches and does not work. Besides that interface could be more smoother. I like the Amazon but this app could be better in my opinion. Update: they have sorted of fixed the filtering feature but it's far from perfect. It's a bit laggy but doable...,4,97,20.1.0.100,2020-01-15 02:45:03,20.1.0.100
a1b67b6f-2482-470a-abd7-4b60e687c96f,A Google user,"Careful with the ""free"" Prime trial.. it does not automatically cancel . Therefor they end up charging you without any notice. No wonder its a multi-billion dollar company when they can reach into your pockets and simply take money (Yes.. I know... read the fine print right, cause everyone does that). I have also found that there is a lot of cheap knock off products through amazon posing as the the real thing. Read about your purchases and research the seller carefully if you are looking for quality products.",2,15,20.1.2.100,2020-01-28 14:24:35,20.1.2.100
ec58b185-edb4-4fff-a2d3-f7c655192f5c,A Google user,"When I purchased my mobile, it came with an Amazon app. Then Amazon stopped supporting that app, forcing me to download this ""new"" one to continue using its service (the old app just links to the download page of the new one when launched); however, I can't uninstall the old, bloatware app to make room for the new one. The additional kick in the pants was after deleting other apps to fit this new one, it runs worse than the old one! It's consistently loading slower if at all! Absolute garbage.",1,34,18.21.2.100,2020-01-08 16:55:05,18.21.2.100
f969108f-8d2d-4146-a678-aeac6d60c05c,A Google user,"Why is this app so slow? One of the world's largest tech companies that specializes in shopping and this is the worst, most frustrating app I am currently using. Images take more than 7secs to load and then only potato quality, you have to load another image to zoom in on it wasting further time, size and colours are selectable to only be told they're out of stock, scrolling is unresponsive... the list goes on. Sort your app out Bezos!",2,18,20.1.0.100,2020-01-25 22:20:42,20.1.0.100
e233631c-bda2-499f-a590-318e55f67074,A Google user,"The app is really easy to navigate. However, I end up having to use the desktop site a lot as there is no option to filter by my own set price range on the app. E.g. if I'm searching for an item that I don't want to pay more than Â£5 for, I can only filter items under Â£15, so 2/3 of the items are useless.",3,29,18.21.2.100,2020-01-12 18:08:08,18.21.2.100
f83e194a-13f8-47fa-b708-883c2a084c96,A Google user,"Doesn't work anymore. This update made your app useless. Keeps crashing. Fails to load. Yes, I've tried to delete and reinstall but the app came preloaded on my cell and all I can do is disable, but then it still won't work. Tried turning off my phone also, still won't work. Nice work.",1,0,,2020-01-29 22:56:49,
eb56a0ef-c849-462d-bfe4-0fbfd9d64180,A Google user,"Awful. The app is so glitchy and difficult to navigate, that I typically end up throwing my phone aside frustrated and pulling out my laptop. It isn't worth spending triple the time to find something that it does using the browser. Only reason I keep the app is so I can check the progress on my orders. That part works fine thankfully.",1,33,18.21.2.100,2020-01-10 01:50:11,18.21.2.100
7929fc46-53cc-4580-ace3-cac1de6d0b12,A Google user,"Big Enterprise Small Development I've been a prime customer and I am not satisfied with the service that amazon provides. Firstly, their customer support is untraceable via the app. The app has a poor design and looks primitive. The returns/refunds & track shipment section is useless as it keeps you in loop no matter what option you select. There is no live tracking for your ordered goods.",1,5,20.1.2.100,2020-01-28 16:04:41,20.1.2.100
3ebeba59-e2b0-4f38-8fc0-86c3ab10d6ae,A Google user,All of the newer versions error every time i try to look something up. I looked on the forrums and there are no fixes and amazon support are obviously incompetent due to the fact that they are incapable of anything other than copy pasting some tech support bs. Its a good thing I actually have a brain and can do troubleshooting otherwise I wouldn't have been able to figure out that the only way to fix this is to download an older version apk from the internet and not update it.,1,27,18.21.2.100,2020-01-10 15:52:49,18.21.2.100
9c810463-4302-42de-a1e4-7de8e98e14b4,A Google user,"Update! The issue with the crashing has been resolved with newer updates. It works great, just like it used to prior to the issues. The 9/3/2019 update causes my app to crash each time I try to search for an item. The app was great until the update. I have to go to the Playstore to uninstall the updates and it will work fine a few times before it is automatically updated again. I have to start the process again.",5,109,20.1.0.100,2020-01-19 01:09:49,20.1.0.100
7676821b-7931-4caf-8c3b-8f4fe18adb38,A Google user,"Too many fake reviews, but would greatly appreciate a dark mode. May have some issues with some products' images being indistinguishable from the background, but I'll take that over burning my eyes and having a slightly reduced battery life. Besides, dark mode would make users want to stay on the app longer, making them more likely to make a purchase. Win win for all.",4,59,20.1.0.100,2020-01-26 01:36:59,20.1.0.100
5f61427b-0f08-456c-a25e-d535bae65b60,A Google user,Literally the worst app on my phone. It freezes if you click a picture. It freezes if you click a quantity. It freezes pretty much doing anything except scrolling. I've started shopping more on my Walmart app since it actually works better (which isn't saying much). Get your stuff together Amazon. All of your apps are a joke!,1,1,18.21.2.100,2020-01-13 00:24:20,18.21.2.100
d1f63866-7837-403e-9dc3-9478cfb21469,A Google user,"Can you please update this app to a 2020 standard? Feels like it's been stuck in 2012 and a mere webview is being used to display Amazon's website. You guys are also super rich, can't you just do that like every other service? Follow the Material Design guidelines, please. The performance of this app is also not optimal: I've been using it on a Google Pixel (1st gen, quite old), and some parts of the UI are just laggy. You have to remember it's just a simple shopping app â€” it MUST NOT do this.",2,7,20.1.0.100,2020-01-20 08:33:56,20.1.0.100
44bc78a9-f216-48fb-95ac-03b9fd8c337d,A Google user,Just type in the name of a description of item you want to purchase and hit enter. You will have a lot of items and price ranges for you to pick from. Read other consumers opinions which might guide you in a better direction. Put purchases in cart and check out. You have an opportunity to change information before everything ships. I have never had anything but easy transactions.,5,0,16.21.0.100,2020-01-08 19:35:00,16.21.0.100
937ff8ec-bbfd-41e0-ae24-794d0a555f23,A Google user,Why auto-playing advertising videos?!?! Everyone hates those. App has no forward button. If you accidentally hit the back button twice like I do because my fingers shake then you have to start all over again. I much prefer the web browser even though it is not fully functional. I can't imagine it would take too much effort to add a forward button...,1,64,18.21.2.100,2020-01-03 15:56:01,18.21.2.100
c53e279e-2e83-4ad6-b56f-3fe15ea5ed06,A Google user,"Don't count on delivery dates. Twice in a week Amazon has failed to deliver my order. They claim on one that the labels fell off. The newest one hasn't been explained. They expected me to be there and decline delivery to get a refund. The burden shouldn't be on me. After speaking to 6 CS reps they finally promised to refund my money, but I haven't seen it yet. We'll see in 3-5 hours. I'm ready to cancel my Prime account. Why pay for horrible service when I can get it for free? Amazon sucks.",1,0,18.21.2.100,2020-01-06 14:17:38,18.21.2.100
6f2ea95f-9850-4a91-82b7-b5550df93d43,A Google user,"Its all about service well,. I surely was able to save some money and time wise two out of three items out of three were there in a reasonable time frame the other the third well took a extra two weeks. But all in all it worked out fine. For the price and quality I was over all very satisfied as well as got a ton of compliments on my over all attire and appearance from head to toe thanks to the wide variety of color and styles that were available from Amazon.",4,3,18.14.0.100,2020-01-19 23:28:39,18.14.0.100
cb5951ea-a174-46f8-9441-40c9564d73c5,A Google user,"Looking for pencil cases and Amazon is only showing 1 product. Literally. It was fine a few days ago but everything I search, there's only 1 item that pops up. Not even a page of results. I even looked up something basic, like shirts and still the same issue. Is there something I can fix in the settings?",2,1,18.21.2.100,2020-01-07 07:45:51,18.21.2.100
37dd23f8-23a3-4472-9d6d-431efe91eb83,A Google user,"Prior to the filter update I would have rated 4-5 stars, but the new filter and ""Next Page"" outweigh all the good. Somehow they managed to make the filter worse than it was previous. Getting to correct department without quantities visible is going to be even more difficult. It's hard enough trying to figure out where Amazon puts items the way it was, and now it just seems like they want to persuade what people buy.",1,182,20.1.0.100,2020-01-15 09:56:19,20.1.0.100
205eb366-92a4-4c96-a225-f5f8281810bf,A Google user,"Any time I select an item to view it none of the preview pictures show up, nor do the ""add to cart"" or ""buy now"" buttons. It goes straight to ""items frequently bought together"" and then customer reviews. It is no longer possible for me to make any purchases at all and is frustrating to use. Also the new ""next"" button is somewhat pointless.",1,224,20.1.2.100,2020-01-28 19:29:34,20.1.2.100
b7193455-061f-4ae5-8bd0-8d0182d0ad90,A Google user,"Not gonna lie I expected more from you Amazon... The apps feels clunky and weird. It looks like the app someone would make after a year of programming classes. It is literally disgusting to navigate. Also, too many weird bugs. They should have made it like their website. It gets the job done but jeez it's not optimized worth anything. Everything seems rectangle shaped and looks like it's made with freaking html boxes. Please update to make it better and fix these problems",2,10,18.21.2.100,2020-01-12 04:44:44,18.21.2.100
30309229-3560-462c-805b-1cf9e2d61f90,A Google user,"The filters feature has been improved and is much faster!!! Enough to make me immediately come and adjust my review. So far images have been actually loading for a bigger preview when I tap them as well, the only noticable delays I'm seeing at a glance are page changes like going back to the home page or selecting a new style/ model of the same item. Thank you for this update! S9+ User",4,13,18.21.2.100,2020-01-15 01:18:48,18.21.2.100
1637ead3-ecef-4b5a-a95f-2fe3354dc952,A Google user,"App barely works for me. There's usually a 5-10second wait after every tap (I counted), cart won't update, buy with one click doesn't always work. Every so often the app is usuable but for the most part it's unuseable and constantly freezing. I've been hoping they'd update and fix whatever's causeing the issue but since I got this phone 3 or 4 years ago I don't think it's wide spread enough of a problem for then to care/know about.",1,57,18.21.2.100,2020-01-12 00:24:27,18.21.2.100
99ae48d1-3105-43a4-ad45-487e7e2905d9,A Google user,"Overcharged/ scammed I cancelled my subscription and days later was charged again for monthly membership and instead of my membership ending the end of the month it was immediately cut once they took money out. And that's not even the best part, there noone that you can direct your complaint to just trouble shooted avenues. I'm sooo done with Amazon!",1,1,18.21.2.100,2020-01-21 23:22:33,18.21.2.100
4ba90fc0-00cc-42d8-bc71-59ecbc784a3f,A Google user,"Before I tell you the reason why I'm giving three stars; let me express that I love Amazon! they have so many things to offer on their website. But, logistically they are flawed. There's major inconsistency on how & where your packages are delivered, there is no way to compromise in a manner to meet them to receive a package, or go even to the warehouses to pick up the package. Yes, C.S. will request immediate expedition of the package, but they'll avow to say that's all they can do for you!",3,0,18.21.2.100,2020-01-13 21:21:44,18.21.2.100
6b90a747-3dac-4a71-8a46-adf4171ebaf0,A Google user,"I have been a prime customer with amazon for years and regularly buy from them. However the latest update to this app has made searching for specific items nearly impossible without clicking through a hundred different windows. Its so difficult to use now that I won't be using the app, such a shame as the previous platform worked well enough",1,18,18.21.2.100,2020-01-07 07:48:40,18.21.2.100
c63dea49-6224-4a33-b676-d22e2ad97669,A Google user,Clunky app. Buttons randomly don't work. The app is pretty slow. This is on an s9+. Incredible that Amazon can't even get an Amazon shopping app right. Like how?? Edit: It is 2020 and this app is still awful. How is Amazon the literal most profitable company on Earth and yet its app is worse than YouTube music. I can't believe it sometimes.,2,10,18.21.2.100,2020-01-03 00:18:46,18.21.2.100
fa7c36c2-8f78-4b73-b51d-039846bb6f3a,A Google user,"Constantly freezing and crashing when I try to look at options for an item. Tried to get a filter and it crashed. I used to be able to use it just fine, but now it's terrible. Although I can still purchase items just fine, kinda hard to do if you can't cluck on something without ot crashing",2,31,18.21.2.100,2020-01-01 02:59:42,18.21.2.100
fc79e9ec-41a2-4bc4-88a8-fbfe5d9cb642,A Google user,"For many months now whenever I atempt to get into Amazon via this app within seconds I receive a new screen saying something went wrong on our end. Same thing when I try to get in via a link from another site or an email. Customer support first attempted so.e 3-4 months was completely lame, ineffective, with 0 follow up from Amazon. They are losing a lot of my business.",1,40,18.21.2.100,2020-01-02 23:09:17,18.21.2.100
b8f76179-45d2-4f8c-9141-0d770bfea5f0,A Google user,"Generally works well but I would say for the last couple of months there been lots of glitches with this app. Hangs up frequently, in fact to the extent that I have uninstalled it and I'm going to try a reinstall and hope that takes care of the problem. Amazon, you make too much money to not have a top-notch app.",3,1,,2020-01-03 22:53:41,
721e07a3-73bb-43d9-8bce-dce98b278a7c,A Google user,"Nothing but issues on their end, and customer gets the shaft every time. Promotional deals are a scam just to get you to add a card to your account and then they come up with a reason why they can't give you the promotion after being on the phone with them for days because they messed something up. Very bad customer service, have an excuse for everything they mess up and turn it around on the customer. Do tons of business with them and get shafted time and time again",1,1,18.21.2.100,2020-01-05 22:43:07,18.21.2.100
d839fbf0-889e-42c5-b565-0dbe684c58cc,A Google user,poor customer service...got a gift for xmas that i needed to return. customer service told me i would have a credit to my account for the price of the item in 24 to 48 hours. i contacted them after 48 hours after not receiving the credit to my account and now have to wait 7 days for it. They also wanted information from the purchasers account that was irrelevant since i was returning it as i got it as a gift. I am beyond PISSED with Amazon!!!!,1,0,18.21.2.100,2020-01-06 22:59:41,18.21.2.100
9cecb45d-30d6-4a93-a680-f2c05acacffb,A Google user,"Since the last update, this app just takes forever to load a product page. It was slow already and now it's way slower. I believe it's the recent ads and brand or seller recommendations, also images take forever to load. As a Prime member, I use the app more than the website and its sad how even the Amazon website slow it is. The same goes to the business prime; there's no difference. New phone Samsung Note 10+, fast processor and 12Gb of ram. $300 Router w/WiFi 6. Internet 100 MB. No excuses",2,14,18.21.2.100,2020-01-13 06:11:53,18.21.2.100
d871aec4-16a4-4e1c-8811-ec3023bf0528,A Google user,"I tried the ""free Trial membership"" and I specifically remember canceling it the day it was going to renew and you guys charged me after it stated that it was cancelled, I didn't have any money in my account at the time, making me go in the negative then you guys requested to give me a refund, but the bank already hit me with an overdraft. Thanks ALOT. A**holes.",1,16,18.21.2.100,2020-01-02 20:05:32,18.21.2.100
eb44bf9a-b14c-4366-b323-a010c69f0003,A Google user,I absolutely love Amazon as a whole however I really despise the new way to filter when searching products. I wish you would change it back. It now takes entirely too long to filter. It makes no sense to me why you can only choose 1 filter option at a time. AMAZON CHANGE IT BACK!!!! Sincerely a long time loyal customer,4,20,18.21.2.100,2020-01-04 18:32:07,18.21.2.100
31593154-a4cf-4803-a99c-6f7af260f9ac,A Google user,"Ok, I dont usually write reviews, but this really makes me mad: When you open the app, the first screen is a button which, with one accidental click, signs you up for a subscription to Amazon prime. I've already had to call and reverse charges once on my credit card, since they basically are trying trick ppl into signing up with accidental ""one-clicks"". Please Stop trying to trick us into joining prime, AMAZON!!! you get enough money without the lame trickery!!!!",1,15,18.21.2.100,2020-01-12 16:56:06,18.21.2.100
47af0ec2-0541-416e-96e6-e6e60448b570,A Google user,No option to print a label... App works fine. I just don't like that the name of the product isn't fully readable and you just see the top half. Same happens with prices in some screens. Maybe it was done on purpose to make you click on the product but it's annoying not being able to see/read the full name of an article or its price.,3,24,18.21.2.100,2020-01-06 15:51:19,18.21.2.100
