reviewId,userName,content,score,thumbsUpCount,reviewCreatedVersion,at,appVersion
76f86f99-a057-42a3-b451-4a0851920b62,Zogar â€œZogar77â€ 77,"Sinse the last update it's next to impossible to find an order. They divided it in months and years so your tapping in and out of needless pages. Plus it's also a nightmare to change countries. In Ireland we have to to avoid huge embargoes because of Brexit. Frustrating, unesseaary and annoying. Please change it back from this pointlessness.",1,6,24.16.0.100,2022-09-08 12:33:40,24.16.0.100
67fd36ad-8353-40b0-923c-3fec4df3c397,Samuel Weeks,"Most convenient place to shop - IMO. You can find just about every legal item on here, as well as items intenteded to go along with items that are not of legality lol. But it always gives you an ETA for your package and it even allows progress tracking. My favorite shopping outlet even over in person shops, I still prefer Amazon",5,4,24.16.0.100,2022-09-20 08:42:31,24.16.0.100
e051fb81-df83-4827-b84a-624dce31a3a1,Reham Ahmed,Very bad experience. I made an order for books ..the transaction is doubled (not the bank( but because the shipping fees tripled without any reason ..then tried to cancel it ..not accept cancellation ..dont know why...it was just few minutes later of course not shipped yet or even assembled. Now i have to pay about 3 times the price of the book for no reason,1,3,24.16.2.100,2022-09-10 09:15:25,24.16.2.100
406a7eb2-1fe4-4ca8-a1d6-0b32235e61fa,Brenda Galvez,"Awful service. My account was hacked and over the course of 3-4 months, I called several times with different people and was always assured the problem was fixed or going to be fixed. I was promised a follow up call or email and it never happened. They have my family and I paying for an account that I can no longer access. They cannot retrieve it or even delete it so I can create a new one. Its so hard to get in touch with them and when I have, no one has done a single thing to fix this.",1,3,24.17.0.100,2022-09-29 04:59:23,24.17.0.100
9e243115-15d2-471c-a2f8-29e40a99d627,Owen,"Expensive Online dollar store. Sellers sell garbage products with huge mark ups. Not worth using Amazon anymore as they have let the quality of service fall dramatically over the last few years. Better to shop directly on the manufacturers site for; 1. Better price, 2. Better shipping, 3. The actual product without missing parts, 4. Avoids Amazon sellers trying to scam $$$ out of your pockets. This could all be fixed if Amazon was more selective of who they allowed to sell on their site.",1,1,,2022-09-28 13:57:39,
d32d4fc8-d9f5-455f-a415-9f01239cd206,c kova,"Terrible, even went through the phone support and was told I did everything possible and it still did not work. Bluetooth pick up what could go wrong. How about a simple code we enter and door pops open. Ground breaking ideas from one infuriated customer that can't pick up their order and is now going to best buy.",1,1,24.17.0.100,2022-09-25 22:13:32,24.17.0.100
1856569c-9793-4770-ad00-4f2c284b05ba,ãƒžãƒªã‚¢ãƒ³,"In the past month or so, there's bunch a bunch of issues with my orders. I've received broken items, incorrect items, or even missing items. I ordered a 2 pack of dishwasher deodorizers, and they sent me an empty package. I'll be looking into other online merchants now since more than half of my Amazon orders have had problems recently.",2,3,24.16.2.100,2022-09-09 18:19:16,24.16.2.100
d2cb6852-654c-4965-a5c7-84da2bd98860,dalaoshuable,"Desastrous updates. I don't know what you guys did, but the app stays stuck in one country. I'm shopping in the Netherlands, Germany and the UK, but when I go to another country everything or just about everything gets stuck on the country I was before. Closing and opening the app again only fixes this about ten percent. Utterly annoying. Please unupdate asap!",3,8,24.17.0.100,2022-09-17 20:43:28,24.17.0.100
941d7ba9-b199-4885-8487-8c87d2306569,Trevor Gregory,"Horrible Experience. Lost access to thr phone on file and the password, ended up calling customer service and they said my account is dormant and can no longer access the account, to top it all off gift cards were put on account upwards to $50 and they won't credit me for my money or help me out in any way. Again, horrible experience",1,5,24.16.0.100,2022-09-03 20:41:44,24.16.0.100
acb55604-920e-4532-987b-3096c3733a60,Shaunie Gaudet,So I can't buy kindle (amazon) books through the amazon app which is convenient and makes me inclined to purchase more... Now I have to open amazon on my laptop and do it that way which makes me never want to use kindle. Seems pointless for a shopping app where you can't buy things. It'd be great if you could come to an arrangement with Google and go back to letting people buy straight from the kindle app like we can with the Google play books app.,1,21,24.16.2.100,2022-09-09 04:10:14,24.16.2.100
fef03a89-374c-423d-aa88-b6bbe9c57f50,C Thieman,"You can no longer cancel subscriptions through the app, which means you have to drag out a laptop every time you want to cancel anything, because the phone gets redirected to the app any time you open Amazon on the web. Not worth it anymore, at all.",2,2,24.15.2.100,2022-09-01 22:20:22,24.15.2.100
84934877-45f1-4c93-97b5-ecf997859d89,Ben Bee,"This app has gone downhill. The search function returns all kinds of trash that is only vaguely related to the search terms. Also, I've had multiple packages delayed several times over recently, so maybe Amazon as a whole is in decline. But hey, I'm sure all the corporate officers are swimming in money, so it's all good.",1,9,24.17.0.100,2022-09-27 23:20:12,24.17.0.100
ba072fff-dbca-4873-97bc-b024f14f5e61,Shlyn,"Terrible, I used to love Amazon but lately you pay for 2 day prime shipping but yet the packages usually come late, alot of times they come damaged, sometimes with missing parts or not at all. These are not the only issues but these are the ones im most frustrated with. It's only worth keeping for prime video and photo storage.",1,1,24.16.2.100,2022-09-15 07:35:20,24.16.2.100
bc8b0a69-6b86-4e26-b55c-f16aed2c70dc,Michael M,"Making shopping in person more convenient it seems. What's the point on purchasing something online because you have a busy life, can't find the time to bjy said items, make an order and payment doesn't get taken out until days later which actually delays such product I purchased. Thanks Amazon, you made shopping in person more enjoyable at this point. What a joke.",1,1,22.22.0.100,2022-09-19 14:38:44,22.22.0.100
2476815c-8235-4e28-a9f3-ddaa9c4a2c23,Zen Lip,"Stupid lord of the rings promotion pops up every time you open the app. Who puts forced full screen pop-up ads on a shopping app? You cannot use the app without watching a 10 second lord of the rings ad every time you open it, the ad cannot be skipped and every time you close the app you're redirected to the lord of the rings promotion page",1,7,24.15.2.100,2022-09-02 09:54:42,24.15.2.100
d882b9ad-a329-4d55-8e2b-8b31646ae0d8,Haitham Mahmoud,It feels like some scam in the process with discounted product from china. It just disappear in the way and neither amazon or the currier knows where is the shipment. Is amazon keep the shipment in their store here to sell again with higher price. Why amazon generate one tracking for more than one shipment This is the way steal your product and at the end you will get refund and the seller will lose. While amazon or one prime member will get your product delivered right away on next or same day,1,2,24.16.0.100,2022-09-09 06:04:46,24.16.0.100
de4e3950-e074-48fb-948b-07199fe91043,K,REALLY unhappy being bombarded with ads for Lord of the Rings EVERY time I open the app. Even more unhappy that every time I leave app open and go to another app what I was doing is erased and I'm back to the home page again and ANOTHER video plays. You make a ton of money. Stop annoying your best customers with ads. Just stop it.ðŸ˜¡,1,6,24.16.0.100,2022-09-02 19:32:58,24.16.0.100
e33518fa-c579-41f2-b82a-1ddadb17b856,Chi Lau,"On multiple occasions, I scoured the products to look for particular ""same day delivery"" with my Prime membership that they boast so much, because I needed the item urgently, I was given the estimated delivery time of ""same day"" e.g. 1pm or 7pm, and I'd set aside all day to wait for it. But then the item doesn't show and there are no updates until the estimated delivery time has passed, then the ""tracking"" updates with the next ETA of 2 to 4 days. May as well buy from ebay on 2nd class post.",2,2,24.18.0.100,2022-09-30 18:22:52,24.18.0.100
e9fff5a7-61b3-4218-889b-e8f14dcb4ed0,Lukasz Filipowicz,"I noticed that Amazon is trying to fool people. A lot of people are busy and buy and returning a lot. Amazon has a habit, once you return a few items, after a few days, change your status of the item, as if you would not returned, there is only information about the item delivered to your home, but the information of return disappears. My advice - be careful and check all Amazon returns statuses and always keep a return receipt and don't delete your e-mail too early ,lest you get scammed .",2,4,24.17.0.100,2022-09-17 14:14:12,24.17.0.100
85be1731-0f10-4f26-a740-160a77d1ea06,Catherine Maskrey,"I've had the app less then an hour and I'm already having issues, first it wont work if any other app or tab is open, even the app i installed it from, and when I was trying to resolve an issue in relation to two orders going to the wrong address as soon as the assistant had changed one, even though we had yet to discuss the other, the app shut me out of the chat and wouldn't let me back in. I have to say though the assistant I spoke to was amazing and this is in no way a reflection on them.",3,24,24.17.0.100,2022-09-27 11:23:06,24.17.0.100
83e47077-49d7-430b-afb2-d9b649a3693f,Louise McKiernan,I purchased in total 20 books on Amazon a while back. Now I am only able to access one. Having no luck wit Amazon agent on chat I uninstalled Kindle app and installed anew one. They kindly downloaded 1 book. All 19 others are not showing. No more purchasing anything on Amazon again for me. If I could give them a minus zero review I would.,1,2,,2022-09-20 17:16:05,
5ab80bcf-9e96-45b9-8aa2-81497bb4f8a4,louis a. martinez,"This is a big issue, for when you want to leave positive feedbacks. Every time I leave a positive feedback it doesnt go through or something I get an message at the end that it will take a cuple days for it to process but it doesnt cause when I check if it went through it ask me again if I want to leavce a feedback. And to me this is a big issue cause my positive feebbacks dont go through.",3,2,24.16.0.100,2022-09-06 16:27:26,24.16.0.100
2001ce19-9116-4e9a-beb0-eaddc6c97cb1,Christopher,Recently started spamming annoying ads on startup. I have no interest in whatever lord of the rings stuff is coming out and every time I open the app it shows me this annoying clip. I just want to see the status of my order. Why do companies insist on putting spam into their apps.,1,6,24.15.2.100,2022-09-02 19:58:44,24.15.2.100
c6af83a0-a176-4b2e-af43-520fa1516968,Abeer Mostafa,"I am overwhelmed by the number of wrong orders i had to return since souq has become amazon The number of times that I ordered something and turned out something different from what the title or description said or the photo is daunting. The user experience especially the filter is barely useable. I remember writing about ""souq is now amazon"" on a well known online blog and how i was excited about it, but now ai regret it. I'm switching to noon and jumia.",1,0,24.17.0.100,2022-09-17 11:09:28,24.17.0.100
951942c9-fbfa-4518-864e-38d8383438db,matthew wagner,New update! The most recent update for this app is terrible. It no longer shows your wish lists on the app and trying to find your way through these new menus are terrible. If you can a previous version of the app I highly recommend that instead.,1,3,24.15.2.100,2022-09-01 21:47:58,24.15.2.100
952c1ae1-63e7-4fca-a946-bfd27c877393,Jim Ross,"More and more often now, when I look for something; tools, clothes, jewelry for my wife, mostly what comes up is cheap Chinese reproductions, or bad Chinese products. Not sure what's going on here, but I'm going to start looking somewhere else. The deal on the shipping just isn't worth coming back for anymore.",2,4,24.16.0.100,2022-09-07 04:05:16,24.16.0.100
6cd6595a-9d64-4454-ac93-b087c397c95d,Chloe Williges,I downloaded it three days ago and literally have not been able to use it. It keeps saying 'oops page not found'. I have uninstalled and reinstalled it. I have connected to wifi. I have full bars. Nothing is working. Horrible experience,1,1,24.17.0.100,2022-09-26 20:59:27,24.17.0.100
47f26e16-8acd-4f9a-bcdb-23929b227049,J P (JudgeRightly),"When I open a store app, I expect to be able to see the home page, not a full screen ad for a movie I'm not interested in that I can't close and when I hit the back button, I don't want the app to close. Really terrible idea, Amazon.",1,3,24.15.2.100,2022-09-02 12:43:59,24.15.2.100
6e7efa16-b15c-4957-b007-6e79d5b405ae,John Jago,This app is terrible if you want to use it for shopping at Amazon Fresh. Totally UNintuitive and definitely not designed by somebody who would be considered a savvy supermarket shopper. I'm not going to spend an hour listing what it cannot do properly or the few things that it does do properly.,2,2,24.16.0.100,2022-09-04 07:07:30,24.16.0.100
fb1f874d-cc46-48ab-82ab-87436dad9953,Tribe,"I normally avoid online shopping as find some sites difficult but you can speak to an actual person who helps with anything, automotive chats don't answer your questions and texting so much hurts so for me this is a big help. They have lots to choose from and deliveries can go to local drop off point if your not in.. it's just easier.. thanks",4,4,24.16.2.100,2022-09-16 07:36:04,24.16.2.100
cc3c4c5e-02a3-439a-a909-cfed99d52138,Juanita Proctor,"I've been ordering from Amazon for about a year or so now, it's one of my favorite apps, because they have so many different varieties of products, and I've never had any trouble with receiving my orders. Plus, they are always on time, or early! Yep, I love Amazon shopping!!",5,6,24.17.0.100,2022-09-22 15:37:21,24.17.0.100
8c5ab14d-8ec5-45ca-9f97-08a93c1b6f4b,Jeff Brigman,"If I open up my Amazon app again, and have to sit through an advertisement before I look at whatever I need to look at, I'm going to cancel my Prime Membership immediately. I hope everyone else will join me on this. Having to sit through ads for Lord of the Rings garbage when I pay an exorbitant Prime membership fee is ridiculous",1,2,24.16.0.100,2022-09-02 13:12:10,24.16.0.100
a05efed8-72d8-415e-9063-6e52ff15cc6b,Luke Goodman,Why is the buy now button gone?! It's a little ridiculous I have to add everything to my cart and then purchase from there. There's several reasons to purchase items individually without having to go through the cart. It's aggravating at the least.,2,3,24.17.0.100,2022-09-23 22:38:31,24.17.0.100
9eb7c2ce-32e7-4bca-8b03-cc6c314a40b0,Robert Connolly,"Multi-page advertisements abound. The app is now loaded with multipage advertisements for paid features, it interrupts the shopping.. which makes very little sense considering they make money from my shopping. going to avoid",1,1,24.17.0.100,2022-09-15 11:43:33,24.17.0.100
17c163b6-f494-4c1b-8e75-2e2e3ffd0583,Kevin Kirchhoff,"You'd think a company as large as Amazon would put a bit of effort into their mobile app. It is the slowest, jankiest app I have on my phone. Any time I am on another app and accidentally click on an Amazon ad, I cringe as the app slowly takes over my screen and struggles to load.",2,1,24.17.0.100,2022-09-26 03:24:13,24.17.0.100
4e171828-70fd-4090-8e68-e8cf42c73ce5,Melissa Messersmith,"Amazon has just turned into a straight up scam. I ordered an espresso machine. Was charged for it. Order just DISAPPEARED. Doesn't even show up on my order page. Like it never happened. ""Customer service"" is, of course, completely useless. This used to be a real marketplace. Now it is just a scam!!",1,7,24.17.0.100,2022-09-29 08:39:07,24.17.0.100
9241bc8f-84f9-4032-9af5-64ffde346166,Linda Binns,Every time they send me notification supposedly on my phone number it doesn't occur. Then your representatives tells me it would be in your app. I go to your app and it shows me nothing but pictures of videos of a trilogy. Some representatives can't even help me because they tell me to go to my phone number and it's not there. I can't even hook up Alexa because of this problem.,2,1,24.15.2.100,2022-09-02 02:05:52,24.15.2.100
af53c207-e95a-47bb-b50a-3792ef38bf85,Rag doll 2277,I used to think this was one of those apps that filtered out the broken knock off stuff but as of recent if gotten like 3 bad packages that were like fake copies of games when I'm dropping like 30 40 dollars on them it just kinda syck that they label some bad stuff as good. A little bit more monitoring and maybe this could be an actual shopping app,2,3,24.16.0.100,2022-09-04 18:50:28,24.16.0.100
3ad052d9-d2a6-4da4-a5a2-a2062e4c633c,Samantha Cottam,Had this app for god knows how long. But recently it's been playing up. At first I thought it was because there was an update that needed to be done. Nope not that. First I was getting the home screen but nothing loading. So thought okay maybe I need to clear the cache. Did that no change. So thought maybe I need to uninstall and reinstall. Nope. Restart my phone?. Nope. Won't even open now. I don't know what else to do my end. Think I've done everything. So must be a developer issue right? Idk,1,2,24.17.0.100,2022-09-17 10:33:21,24.17.0.100
4ac1ced9-5424-4f73-9d8c-32134c053967,Jonathan Rutan,"In no way whatsoever do I recommend Amazon. I'll be doing my best to garner as much attention on social media as possible in this matter, but they rip you off constantly. You pay an indeterminable monthly fee due to them repeatedly charging for membership. Then most your orders get delayed. There's supposed to be rewards accrued over time when ordering no rush delivery but it doesn't occur. They don't care about employees or customers because they're so massive and owner is filthy rich.",1,1,24.17.0.100,2022-09-25 21:03:51,24.17.0.100
2831e3b4-9f34-4f40-9b05-53517eaf6484,Tristan Stolz,"I thought they removed 'Sort by' options from both the app and mobile page.... But after troubleshooting looks like it was just the app not playing nice. I still uninstalled it though, not with the headache of keeping it around.",1,0,16.13.0.100,2022-09-18 04:29:01,16.13.0.100
9ad8c4ca-8e66-47f1-90eb-f95d2affa91b,Alicia Fitts,I do a NOT pay $140 a year for you to STILL force STUPID ADS on me EVERY TIME I OPEN YOUR APP! I could not care less about your dumb Lord of the Rings show and the fact that you feel that it's necessary to force me to watch the SAME AD for it over and over every single time i open the app with NO option to opt out?!?! What am I giving you all this money for if it's not to have an ad-free experience?! This is the stupidest thing your marketing team has ever done. Your users do NOT want this.,1,2,24.15.2.100,2022-09-02 14:40:49,24.15.2.100
01097436-31b7-4618-94c9-ab733c289961,Cecilia Phua,"Still unable to update my address even after talking to the CSO and updated the app. Don't know what the hell is wrong. Why make it so not user friendly? Error msg: ""This address is used as your residential address for digital purchases. To edit this address, first set a different residential address for your digital purchases."" Already not a fan of Amazon. So after this, makes me hate it.",1,0,,2022-09-12 15:12:07,
2c906776-7b70-402e-ae86-cbc4060a1c88,Kim Carter,Can't even clear the search box when navigating through various options. It's clears then refills Amy time you navigate elsewhere. Some really basic UI issues with the app that make it very frustrating,1,1,24.14.0.100,2022-09-01 07:57:54,24.14.0.100
16593a78-1171-4934-bf45-511eed2eb7a1,Natasha Ryan,Needs work. It annoying to subscribe to channels etc to find you can't watch the shows you purchased for. And cannot reach anyone to fix that. I see s10 Chicago fire but doesn't play?? Amung other shows I try watch. If it cannot play in my area why is it on my list? Do I get refunds for purchasing the channel that I cannot watch??,2,1,24.15.2.100,2022-09-01 10:07:22,24.15.2.100
fdb07b09-faa1-4bc3-a600-0675e4e84c48,Cody Davis,"A fantastic service! I love the ease and haste of the service. I also love the notifications and emails giving me updates every step of the way. People are crazy for hating this company, yet they still use it. It's great!",5,3,24.17.0.100,2022-09-28 12:55:48,24.17.0.100
7fa46d44-f8a7-4b4c-bdf0-74126f948c37,Gummy Bear,I do not know what on EARTH they did with this last update. Everything is glitchy. Everytime I do anything in the wishlist area the app crashes and totally resets. Searching for items normally???? Crashes. What??? Why???? Please fix it!!,2,0,24.17.0.100,2022-09-27 05:23:44,24.17.0.100
29be3d92-ec8b-49ca-90d2-d9629e410eb4,Chris Beall,Aside from search engine not being very consistent. And the absolute need for search filters in order to get just a few in list to be what you're actually looking for. Best thing ever,5,3,24.16.2.100,2022-09-07 22:39:10,24.16.2.100
3bc1af20-224d-4b21-929e-6df58a4cd066,Maggie Williams,"Amazon Shopping is the best way to do online shopping. There are a variety of items to choose from in every category. If you haven't tried it yet you are missing out on online ordering. Fast, easy and affordable delivery options as well. I don't order online any other way.",5,2,24.16.0.100,2022-09-30 06:57:38,24.16.0.100
3b4cea2a-c2bc-4b35-b2b0-660ade4a972f,Dara Nelson,"I can honestlly say Ive had nothing but positive experiences within the apps customer service. If I ever have an issue, they are always polite and quick to fix it, alot of times going above and beyond. Its a rare find these days. The people I speak with need a raise because customer service jobs are NOT easy, it takes a special breed to do those jobs, any service jobs for that matter. Much respect and appreciation.",5,5,24.15.2.100,2022-09-03 22:14:14,24.15.2.100
658b3140-47c5-402f-b987-ca95bf69b5f4,My Crazy Grandkids,"Just started up with these annoying ads when I open the app. If I can't figure out how to stop it I am closing my account I get enough ads all over the place. Stop it, cause it's a guaruntee the whole ountry is gonna go elsewhere rather than be inundated with your crummy ads",1,4,24.15.2.100,2022-09-02 18:19:24,24.15.2.100
9555f884-5c4d-453f-87b9-d449ada9b411,Eric Ovelgone,The section on Your Orders has not worked in monthes. I always have to go to my computer to check on prior orders and deliveries. I expected it was a problem that would be fixed right away but it persist. Everything else is good.,3,1,24.18.0.100,2022-09-30 23:54:32,24.18.0.100
1e53a55b-88b4-4d50-8bb7-b139be676e86,Andrew Wong,"This pertains to the Amazon Fresh part of the app. I have no idea why their UX is so awful. Here's what I expected: 1. Open Amazon app, 2. Tap hamburger menu, 3. Tap Amazon Fresh logo, 4. Tap option to get in-store code. That's already pretty bad, as the code should be available at step #3. But the actual process is to select in-store from the Fresh section of the app, and the notice the bottom nav has changed and there's now an in-store code option.",3,1,24.16.0.100,2022-09-04 22:47:59,24.16.0.100
232e60ff-a4a9-4f60-8c0f-adcb1e669103,Rebecca O'Donnell (LifeSpice94),"Company is going downhill. Should be working on amazon drones and prime same/next day delivery to improve service, instead they remove the ability to buy kindle books easily and make it 10 times harder to download an Ebook.... why change something that didn't need it but keep ignoring the few ideas you have that might actually be beneficial",2,3,24.16.0.100,2022-09-07 11:20:10,24.16.0.100
31c2e91c-e24e-40b5-8cf8-b666c3b51d0a,Shubhdeep arora,Such Massive company with Ridiculous Authorization System. What the hell is Notification Approval Method for Giving access to the account? I am trying to access my account which I haven't used in few months from a different country but cannot login due to notification send to method. Ridiculous system with massive fault. Good luck. Not gonna use Amazon again.,1,1,,2022-09-07 08:20:16,
8b75e78c-1ce6-43d9-8673-5dd986360901,George Avina,"You guys absolutely ruined the delivery/ shipping look. Now nothing is in order, everything is arbitrarily put wherever, some items are above the delivered items, some delivered items are above the shipping items, like. Please fix this, it looks so awful now.",1,1,24.17.0.100,2022-09-17 20:42:04,24.17.0.100
97081ee9-159c-48c5-b0d8-0c9fc4a52a8d,kerry boardman,sick of seeing that stupid popup forst thing for lors of the rings. that should only.be advertised in the prime video app as that is a streaming movie/tv show. also so annoying if an item is to be delayed I shouldn't have to login on a desktop website to approve the delay.,3,4,24.14.0.100,2022-09-03 01:39:43,24.14.0.100
e7a05b9b-b2a6-4a02-a7e7-5fb2025a4cec,Stephanie Martinez,wont let you upgrade it or uninstall. Found a few problems such as fake links etc and yes it was addressed to the customer service team. They will follow up with me like some other apps that also had problems.,3,0,20.20.0.100,2022-09-12 22:08:35,20.20.0.100
