reviewId,userName,content,score,thumbsUpCount,reviewCreatedVersion,at,appVersion
a5d712d9-0edc-49e2-9bfb-6fd430ff179b,Jason Bartholomew,Why the heck do you think we want a search bar at the bottom instead of the TOP WHERE WE KNOW TO LOOK FOR IT? Apple did that and it was a bad design.,1,1,26.15.2.100,2023-08-13 22:52:59,26.15.2.100
e91333a5-7365-4dfa-86b9-35f783748dde,Dont worry About it cuhh,There is no such thing as one day delivery packages come within 3 day sometimes it takes longer there is no use of paying for prime anymore. How does it say 1 day shipping and it's always a couple days late,1,0,26.16.0.100,2023-08-28 03:24:25,26.16.0.100
2d15ff25-d56d-43fe-b0ac-0b60bbeca511,Treezy DCM,"Lists gone with this new update. Then a new update and back. Like please use common sense, don't update an app unless properly updated.",4,0,26.15.2.100,2023-08-12 11:54:35,26.15.2.100
27778103-0954-4509-b8d1-982ac3a8f60f,Jacob McQuillin,"This app has become so data intensive, I can't use it on my at&t cell network. I have to wait till I get home and use my wifi.",2,0,,2023-08-09 11:03:49,
0d6da4e6-68e6-4167-92d8-34a48468b758,Adam Demas,"I feel like taking a star off cuz they keep moving my orders button location, but everyone knows Amazon is amazing and the app works every time, so five stars.",5,0,26.16.0.100,2023-08-26 21:52:33,26.16.0.100
0468b55e-49b0-4804-9984-07c6ea4518fd,Shrouk Aboali,I paid for the thing and returned it because it came wrong and still the application is not returning my refund it's been over a month and I keep talking to the company and they keep telling me maximum 2 days and the refund still didn't apply to my account what am I supposed to do more to get my money back???,1,0,26.15.0.100,2023-08-14 01:44:06,26.15.0.100
513081c0-56fb-4e0f-824c-1bef96fcacfa,Phone Bone Malone,"2GB? I cleared the cache, there's 79mb of data. Why is this so big? My only guess would be hidden data. My whole Brower doesn't use that much.",1,0,,2023-08-12 23:11:00,
3436076e-6d5f-48c2-82f0-b2f9c0146834,Luis Ortiz,"Great convinient delivering system, easy returning if need it, lots of choices, love it.",5,0,26.16.0.100,2023-08-21 13:08:57,26.16.0.100
ea754549-75ea-4a1a-a624-c4fa0a237962,Ashery Corbin,it's a beautiful experience shopping from Amazon but delivery in not sure about when they drop off they don't deliver to your door they just dropped your hundred dollars products any place any where no regard for you money n time for shopping from they stores plz do better job,4,0,26.16.0.100,2023-08-31 15:27:00,26.16.0.100
85978e13-6dc9-4e53-948f-652a6e0c615f,Fitsum Asgedom,Amazonis one of my favorite online e stores. There are varieties of stuff. The app basically has anything you need or want.,5,0,26.15.0.100,2023-08-08 03:08:57,26.15.0.100
5534736d-d808-42ce-9fb0-38a947083292,Chris Walmsley,The app burnt through 1gb of data in about 20 mins even though I had data saver on - because I was on mobile roaming data. Very poor,1,0,22.22.8.100,2023-08-24 06:11:36,22.22.8.100
a4aa69a6-b24d-43aa-9ee8-162d201d64d7,Hanna Walinska,I will rate you one star untill you return to the previous display. Don't destroy something that's good!!! This new display is a BS that hurts one's brain.,1,6,26.15.2.100,2023-08-16 15:22:05,26.15.2.100
46c3b284-71b4-410b-a264-9bf098ae895e,Jason Dando,Still one star for the horrifyingly rude and inexperienced staff and supervisors. Also for trying to charge one of my cards without permission.,1,0,26.14.2.100,2023-08-02 00:36:09,26.14.2.100
466d7e45-9338-4338-8615-ef68ec83991a,Adam,"New changes are not app viewing optimized. Its like browsing via a website, which sucks. I'm not shopping till this get fixed.",1,3,26.15.2.100,2023-08-17 00:04:01,26.15.2.100
d39fdca3-c24e-44a6-b85e-673ae880b535,Heather Viveiros,"Amazon is the best app out there i am dißabled and count on them for multiple orders always courteous respectful and always get quality items thankyou Amazon,!!!",5,0,26.15.0.100,2023-08-09 00:54:43,26.15.0.100
3e941877-5a2c-41e6-80d3-aa413fe6ca14,Mr mbrana,"I am trying to subscribe to Prime membership, and it's not working .I called multiple time to helping they are not able to fix my problem.",2,1,26.16.0.100,2023-08-31 16:55:28,26.16.0.100
07ca1677-3f79-41cb-8db2-03952f78afc5,Gracie,App removed the ability to change language and currency and store easily. Pointless.,1,0,26.16.0.100,2023-08-19 22:22:44,26.16.0.100
2034461a-4967-4fbc-a152-0aaf093916ae,Ms Amaral,"Not Saving variations of items & Wishlists options no longer function. Super, super Slow now too..",1,1,26.15.2.100,2023-08-14 16:44:58,26.15.2.100
c03243b1-f82d-4363-8e4b-421d8a2f7a68,Margie Reynolds,Great! Couldn't do without it!!my app on Amazon showed uninstalled! I don't know what I did wrong! I have it back !! Yes thank you!!! Amazon,5,1,26.16.0.100,2023-08-29 01:42:21,26.16.0.100
201c1341-94dd-47c6-bb2c-fbbc280d97cc,John McDevitt,The new star system is awful. Making changes just to make changes. They are boooored at Amazon. Ffs just stop. Lol. The app gets worse with every update.,1,1,26.16.0.100,2023-08-26 02:54:24,26.16.0.100
b21ff79d-4baf-4c66-b55e-eeb6a52584ee,Bertha Burrell,Amazon is the best place to shop...it has everything. Also if you need to return anything it is very simple to do. I love Amazon!!!!,5,0,22.13.0.100,2023-08-26 21:43:25,22.13.0.100
4c887ef7-00e2-4fe1-86e8-70b849d34d47,Alexandra Villanueva,Updates don't help on android. App crashes constantly. Can't see previous orders to return them,2,0,26.14.2.100,2023-08-02 20:33:27,26.14.2.100
da09d6b7-ce59-4255-95a6-037d312cfa90,Robert Hoover,WILL NOT let me get a verification code. All of a sudden it freezes and refuses to send a verification code ..,1,0,26.1.2.100,2023-08-10 01:29:42,26.1.2.100
b25e40fe-6afc-462d-a27b-ead73c9adcf5,Ricky,When you want to see your orders the entire screen starts flashing so have to use the browser. What a waist of time.,1,2,26.14.2.100,2023-08-09 14:30:54,26.14.2.100
4f2833fc-9b33-4cc0-a9c9-50c9182e24b5,Debra Poindexter,"I am being charged 7.55 for 2 months. I am not a member, I have tried to talk to a representative, and they said if I wasn't going to be charged for the 7.55. But it was a complete lie cause I was charged today from my debit card. I don't know how they got my debit card information. But they said I became in July this year. An what so funny, whoever ordering the items. They live in Florida, but I live in Alabama. SO why would I order things and send them to Florida. So I being fraud .",1,0,22.5.0.100,2023-08-06 03:26:13,22.5.0.100
56568dee-1cb7-4ca6-b839-916066237af0,Jack,Lost ability to view number of reviews on product without clicking it. Please switch it back to how it is on the desktop.,1,0,26.15.2.100,2023-08-17 15:11:32,26.15.2.100
b22daa22-28c8-4ae4-993f-1fffe6906416,Angela Truly,"love Amazon shopping. Fast, precise, and love the options for shipping.",5,0,26.16.0.100,2023-08-28 16:08:44,26.16.0.100
eb675c50-fcc0-4d48-9030-9456d1365354,Wickus Booyse (Wick),The opened Lists are squashed to the side of the screen. Been like this for well over a year.,2,0,26.15.0.100,2023-08-11 19:13:41,26.15.0.100
fa181683-b655-4ff5-a09c-07944da1dee6,Trinity Da Gamer,Great customer service and great items verry good quality but the shipping is most of the price I tried to get a $1 thing it came out to be $10,4,0,26.15.2.100,2023-08-14 20:40:59,26.15.2.100
731698d5-3068-4f6a-9f5d-e2260d98992d,Chad Walters,Doesn't load. Just shows the Amazon logo in the center of the screen and nothing further happens.,1,0,26.15.2.100,2023-08-16 01:51:26,26.15.2.100
ce335e04-d7b8-4178-ac22-cc4592607c95,Josephine Del Villar,Amazon is my go to app I love shopping on Amazon I love the prime free shipping I only had wonderful experiences with them Delivery is fast and always on time I highly recommend Amazon,5,0,26.16.0.100,2023-08-26 13:44:54,26.16.0.100
cf2c5957-9a50-4987-85c8-7ee1103d06a9,Linda Hay,Like Amazon & purchased most of my Christmas gifts this year. As for the app I just installed it as I usually through there emails sent to me,5,1,26.15.0.100,2023-08-10 22:15:00,26.15.0.100
2d7b3ff5-1f33-4871-80eb-9b56ad45f5c5,Linette Ross,Don't bother ordering anything from Amazon because they always cancel! And if they ever do deliver it's late!,1,1,26.15.2.100,2023-08-11 19:19:40,26.15.2.100
4236f051-6b8b-47b2-88a2-75e9c627b0a5,Kim B,Love Amazon great app. Wonderful selections and wide variety of stuff. Convenient shopping for busy people!,5,0,26.14.2.100,2023-08-02 13:53:49,26.14.2.100
71489ad6-df79-4afa-a9a9-9bdf1ad40a39,Maureen A Brill,"I have been an AMAZON shopper for years. Recently, my app is now in Spanish & I changed nothing fir this to happen. Help! I can't order in Spanish.",4,0,24.16.2.100,2023-08-21 02:02:32,24.16.2.100
4a59c734-65d7-4061-8c62-a7276bbc1200,N8 Davis,"Orders 70$ worth of items,Amazon's system changed my adress ,items were canceled no refund. All call recordings I took will be on YouTube,and ticktock",1,0,,2023-08-03 16:47:40,
299a2c43-08fe-4257-b665-1e28cdfb7925,Jeff,BBB you guys need to do something about this trash company stealing money from people Absolute trash all they care about is money their 2 days shipping doesn't include their fine print 5-12 days for processing probably will not use or be an Amazon prime member anymore after 4 years they finally killed it cause they only care about money Walmart + here I come and on top of it they keep stealing their customers money and trying to get away with it,1,0,26.15.0.100,2023-08-04 16:37:19,26.15.0.100
81761f94-12c4-401d-a0ce-c32f39ef1cb4,Rachel Hoe,"Reliable, offordable, and original, whist dealing with real people. Items delivered that you can count on. Thank you",5,1,26.15.2.100,2023-08-14 21:03:49,26.15.2.100
23441efb-4e10-49c8-bb65-c520bf43257d,Tanisha Huggins,"The Amazon app is great to have when you are an online shopper, it's easy to use and you can find anything you need.",5,0,26.16.0.100,2023-08-20 20:47:06,26.16.0.100
aede6a21-be20-4a11-b607-87f74f80c392,August Moon,Beware of the free trial. It will not let me cancel and I have already had two attempts and my card was declined. I call them and they still can't help me.,1,0,,2023-08-02 11:12:05,
d29933ee-d168-46bb-b2f6-37bc5ebb4de5,Andrew Barbato,"Was working okay. Past week or so, not working properly. Trying to chase a refund on a product. Funny coincidence...",1,0,26.15.0.100,2023-08-09 06:36:52,26.15.0.100
4a71ae60-3b2f-4ca8-aba0-867397866400,Roy Logsdon,"Live shopping on Amazon. We live in a small town in S.E. New Mexico. The shops here don't carry a lot of items we shop. We buy locally as much as possible, but mom and pop stores can't carry it all.",5,0,26.16.0.100,2023-08-25 12:54:32,26.16.0.100
1a87ac10-1477-48b0-9cbe-89986ba851f9,Lisa Brownfield,"Thank you for history to repeat purchases. Easy returns, esp now through Staples. Speed of delivery, All of it.",5,0,26.15.2.100,2023-08-19 15:00:58,26.15.2.100
1c3083ec-a156-424b-954f-40d0ca971728,Holly Jones,always have what I'm looking for at a very decent price and gets delivered on time with great tracking!,5,0,26.15.2.100,2023-08-17 22:50:32,26.15.2.100
4814bbf5-805a-4512-9776-d61d504100d8,Jamie Hunt,Can always count on AMAZON for great products and guaranteed 100% satisfaction or return the product. Nothing beats that deal.,5,0,26.16.0.100,2023-08-26 05:11:06,26.16.0.100
dd79a9f8-4018-4b67-a161-74771831d6e6,Robert Barker,"A lot of ""try again"" messages. If you can do a simple search then don't expect me to purchase anything from this app",2,2,26.15.0.100,2023-08-12 17:54:20,26.15.0.100
2cd68dce-4f6b-45f2-a936-5b1b5496259e,Mike Montecalvo,"So awful, barely responsive, lags, and now the add to list feature just doesn't work",1,0,26.15.0.100,2023-08-09 01:15:18,26.15.0.100
650e381b-719b-4b6e-8084-c98a458b3870,Bobby Grubiak,"love Amazon! easy to navigate, intuitive, great customer service, A+++",5,0,26.16.0.100,2023-08-27 17:09:01,26.16.0.100
5b9f6fd2-2b28-4200-8ddd-d76dc2dc7aea,Jesse Eason,"No option to sort by price, and now the app won't even open; I even tried deleting all stored data. :(",1,0,,2023-08-06 03:41:15,
641c2e28-3834-469a-9516-b0d47a80ff3a,D LoJo,Irritating when you're in the middle of looking at something or scrolling and it jumps to the home screen.,3,1,26.15.0.100,2023-08-07 06:33:29,26.15.0.100
594cff6e-88ef-46db-bca5-d06c1dbf9c55,Jason Miller,Can no longer see the number of reviews along with the rating making it impossible to see if it's a new product with 3 reviews at 5 stars or 12000 reviews with an average of 4 stars. Very disappointing to see this change.,1,1,26.16.0.100,2023-08-31 23:44:09,26.16.0.100
f821430b-eeb9-49d2-ab86-c640cba4adc2,Me,This app sucks ...only gives option to buy bulk when purchasing groceries...very hard to navigate and outrageously priced .Horrible app.Amazon jus lost a customer.,1,1,,2023-08-02 09:23:49,
53a0ca24-b318-4d23-ab4e-1a2258b71845,Sid Milani,"It's so easy and convenient to shop here. Prices are mostly competitive, but it still pays to shop around before making a purchase.",5,0,26.15.0.100,2023-08-07 11:37:54,26.15.0.100
45df9210-888f-4712-b88d-59592f08b64c,Caleb,"They removed the ability to see how many reviews a product has. Now you can't tell the difference between a 5-star, 1 review item and a 4.6-star, 4000 review item. UI is growing increasingly not user friendly",1,3,26.15.2.100,2023-08-16 00:05:10,26.15.2.100
2db55d8e-8ad6-4b7f-8b83-125a6f8c70e5,Becca D,"It's gotten worse with this app. The idea lightbulb garbage placed where it is, is garbage. I don't care to place plants in someone's virtual room or whatever the thing is. Making it more difficult to start a return, and saying items will arrive on the 7th then paying and saying they will arrive on the 12th is deceiving. Amazon tactics are getting worse each day. The customer service is disgusting and the sellers are just as bad. Horrible company and I'm actually ashamed I use them.",1,1,,2023-08-22 09:47:01,
8c1cab89-dcde-4ee3-9667-bc8c9e807dc2,Linda Shay,I enjoy shopping on Amazon most everything is no fuss shopping and I get good quality items and returns are simple and straightforward !!;,5,0,26.15.0.100,2023-08-07 19:53:03,26.15.0.100
b8a65d9d-c0b4-4125-bd31-71d1d465d5aa,Gillian Russell,I love The ease of searching for the product you need then ordering and being able to get next day delivery on most items with my prime account have used azon for approx 10+yrs and will continue to use and refer them to friends family etc,5,0,26.14.2.100,2023-08-03 15:39:27,26.14.2.100
a09ffccd-0a7a-4d6e-9010-324adaa50ebf,Ultimate Dragon,This app used to be really good. Now it is absolute trash 🗑 giving contradictory and wrong information about orders. Absolutely 💯% needs work before I'll give this app a better review.,1,1,26.16.0.100,2023-08-22 22:55:59,26.16.0.100
799ea67b-b498-41b3-9644-6bb9e653a0e6,Shaina Johnson,Why is their no customer service number listed on your site or the web how am I suppose to trust the phone numbers listed on the web.Why is it not on the actual Amazon website or app.,1,2,26.15.0.100,2023-08-08 23:15:59,26.15.0.100
dd8f566d-6b8b-4203-a04c-2003e85c394b,Scarlett Svaleson,It is too difficult to find the return option. The latest update was NOT an improvement.,2,0,26.15.0.100,2023-08-08 12:24:21,26.15.0.100
f43c208f-fd2c-4f16-a4e1-a20f8ca23adb,LA C,Latest update: color/size options do not show up. I guess Amazon doesn't want me to purchase anything.,1,1,26.16.0.100,2023-08-20 04:55:04,26.16.0.100
1fc9a079-e3d7-4074-9fbf-b971e4ae3b37,Noor El Eman,"Souq was much better than Amazon, its very bad service at the moment including the products . They are frequently damaged or wrong items delivered",1,0,26.15.0.100,2023-08-04 17:53:25,26.15.0.100
11ff6657-8d0a-44e5-9bd5-edaa81f2cf8a,Stella Macdonald,"I can't speak highly enough of all services: products, Prime benefits, customer service, delivery, and returns! Excellent all-round.",5,0,26.12.0.100,2023-08-05 17:39:55,26.12.0.100
94e3d480-b886-4a7c-9694-843d96aae560,Lashawnna “Peaches” Holder,Always able to find what you need. Now the quality is sometimes worth paying price for name brand.,4,0,26.14.2.100,2023-08-02 04:17:49,26.14.2.100
cabbc366-4177-4442-8175-514156f4afa7,Yeni Curtis,"Very convenient, and liked the return options, never had any issues with shopping or retuning product",5,0,26.16.0.100,2023-08-29 16:38:43,26.16.0.100
cc5db3c0-0f68-4d77-bf9f-69ddc04a4c72,Elliott Haviland,Why in the world are my Wishlists seemingly inaccessible on the app? Does Amazon expect me to just search for any items on my wishlists manually??,2,0,26.15.0.100,2023-08-11 21:15:49,26.15.0.100
e2893ddb-8447-4edb-aa6b-d7cbab45f257,Andrew Cheese,Now unable to change countries and language. There seems to be zero testing of new releases of this app.,1,2,26.16.0.100,2023-08-19 18:08:33,26.16.0.100
45cd9d11-1c14-4952-b563-f74bf1e11b52,m burrill,It keeps sending emails to me in spanish even when the language says english. Help fix or uninstall. Choose please.,1,1,26.15.2.100,2023-08-14 14:46:48,26.15.2.100
54f706d6-4884-4ae2-b5f7-36868c3e417c,Sebastian,0 STARS...WalMart+ Is MUCH Better Than Amazon Prime...They Don't Keep Increasing The Price For The Membership I Wanted To Join When It Was $99...Then It Increased To $119...I Was Going To Join Even Then...Now It's A RioOff $139...And #14.98 From $10.99 For The Monthly Membership...I Don't Give A Bloody Hell What Excuse They Have For TWICE The Price Of Amazon Prime Membership!...ZERO STARS...,1,10,26.15.2.100,2023-08-14 01:06:51,26.15.2.100
e015d689-da88-4e41-8e85-a5d269b55962,Christine Lombardo,The size estimator function was awesome until it stopped working. Thanks for making it hard to see what fits as I try to buy clothes on the internet,1,1,26.15.2.100,2023-08-13 22:36:46,26.15.2.100
e49b5ed4-47f8-4207-be03-cfccd35f998b,Tnarg “Shmootentaag” Ecirp,"App is alright, but Amazon STAFF have ZERO BRAINS!!!! They left BABY MILK OUTSIDE IN THE 37°C heat after being told not to leave delivery unattended!!!!!",3,1,26.15.2.100,2023-08-22 08:24:15,26.15.2.100
59d4c66e-5fcd-4a82-bdac-deb6a137f8e3,Rebecca Hoke,Please fix this sucky app! I don't understand why it refreshes every time I toggle through my screens. This is the worst update too buggy.,1,3,26.16.0.100,2023-08-17 20:44:21,26.16.0.100
015c8cc8-1e96-4214-9955-6de153fb815d,Vive Viveka,"Buggy, frustrating, and time-consuming. I'm deleting it and going back to using the non-app site.",2,0,26.13.6.100,2023-08-05 03:33:42,26.13.6.100
d64ed088-0197-4cdb-aef8-d4b1a2b8b091,Muzammil Shaikh,"Very bad experience and no way to approach customer care. Amazon team is very irresponsible in handling the shipment, without contacting customer they reject the delivery. Waste of moeny and waste of time.",1,0,26.14.2.100,2023-08-03 12:28:46,26.14.2.100
790309b6-b7e6-4754-9ff0-8761410051e5,Dori Cuarisma,"I know I can buy the items I bought cheaper on other sites, but they do not send as fast as Amazon (Prime).",4,0,26.13.6.100,2023-08-06 01:55:02,26.13.6.100
d2b92d1b-4c6a-4100-b5ae-3f884c149ef2,Marie DS,Prices are getting more expensive on Amazon than in some stores. Plus they have a problem with losing packages...get your s*** straight.,3,0,26.15.2.100,2023-08-13 03:59:08,26.15.2.100
ff1412e3-6db9-4022-995e-325d16f04772,Marcel Dupre,Why has the search bar been moved from the top of the page? Stupid idea. Looks like a cheap chinese app full of dumbed down ads.,2,0,,2023-08-04 00:15:02,
795f25d3-eeb2-4ea6-a66b-b479245bd9af,Nashe Clarke,"both the app and the amazon page are not letting me watch some products, instead it takes me to the prime video website.",1,0,26.16.0.100,2023-08-22 23:16:29,26.16.0.100
93995623-e436-4323-8411-377fb52f10f8,Aziza Ashirova,Useless customer support. Waiting for the delivery for a week and no1 calls just cancelled orders from their end. Now need to wait for a refund another 3 days.,1,0,26.13.6.100,2023-08-04 08:38:43,26.13.6.100
26a56909-362e-4416-8261-3f51f84969e0,Matthew,What is the point of having the option for delivery instructions if they aren't looked at? Stated that deliveries cannot happen after 5pm at it is a business address. Amazon continually tries to deliver after 6pm.,1,3,26.15.0.100,2023-08-09 01:22:07,26.15.0.100
30787f2b-cfde-4137-ab0f-ce7e4ad4bdf4,Brandon Hickey,Garbage I placed an order which qualifying for free shipping over $25 but instead amazon split my order into 2 orders and was forced to pay shipping,1,0,26.16.0.100,2023-08-20 01:13:33,26.16.0.100
45c5e9b2-efe0-403a-9d09-dfc979034866,Anthony Lock,"generally good - but 1 item shown as delivered, wasn't - can't find an option to follow this up!!!",3,0,26.14.2.100,2023-08-04 09:55:40,26.14.2.100
b237b6a4-7efe-4e26-8dfe-f8c81dd91abe,Dara Official,"amazon really bad experience for me, always failed send the package never on time and always late, Shopee better than amazon",1,0,26.15.0.100,2023-08-08 15:55:24,26.15.0.100
b712d85f-0717-45d9-bfbc-d94cdf630c01,Jamela Story,Okay so I love the fact I can shop from where I'm at and pick up from a drop box but I don't like to call about missing orders or empty package left in the locker very irritating when I have to reorder,2,0,26.15.2.100,2023-08-23 21:20:49,26.15.2.100
9dd354ac-bc9b-4346-92f4-f13979613fd0,Ajit patil,"What's the problem with settings, I don't see option to change country settings and default its going to Amazon us, I want a app for Amazon uk",3,1,26.15.2.100,2023-08-17 13:42:37,26.15.2.100
4e36b04e-2a24-44f6-b73d-b2f55444e5cc,j harris,"Garbage app, garbage service even when paying prime membership and garbage products. I paid 250 for a brand new pair of Sony headphones and what I received was opened earbuds with pieces missing",1,0,26.16.0.100,2023-08-27 21:54:50,26.16.0.100
5b75e5a1-0fc7-4912-960e-a75e59e11fcf,Christine Lopez,Deserves ZERO stars! They charge the wrong credit card and they won't fix it. Customer service is non-existent and incompetent,1,1,26.16.0.100,2023-08-28 23:53:55,26.16.0.100
c23a0304-f021-413d-92c3-65b8d54f2165,Richard Jordeth,"Be careful I got this strange call saying that they said that I have $8,000 Bill I never once in my life bought anyting I had just browse through, as soon as I said that I was going to cancel the app the lady hung up on me and she called me on a hidden number I would say that was the scammer. Don't use Amazon. It's a scam.",1,0,,2023-08-10 19:54:09,
0e5fd6e9-199e-4c3c-bf0d-79e27f11ea43,Barry Kercher,"really enjoy Amazon, with my busy schedule it just makes it easier to not have to run around.",5,0,26.15.2.100,2023-08-15 13:17:15,26.15.2.100
88fed7a4-8342-45c1-8834-4dbd3b894cc9,Jesse Chapman,I was tricked by Amazon to sign up under Google and now I can't get rid of it and now I'm being charged by Google and can't figure out how to get rid of it it's a scam!!!!!,1,0,,2023-08-02 08:23:56,
296608bc-7d3d-4a08-993c-783b926cbe8c,Elizabeth Whitfield,"I enjoy my Amazon account because of the prices, quality and delivery of packages. I've always received my orders as promised.",5,0,26.15.2.100,2023-08-16 00:08:58,26.15.2.100
852c1918-d06d-48ca-9757-98bd2d44d3fa,Sonya Johns,"Not sure if there is a glitch in the app, because as of yesterday the App keeps closings while I am scrolling to shop.",1,0,26.15.0.100,2023-08-06 15:18:06,26.15.0.100
04ac05d4-a702-4112-aaa4-34b233243e4e,Philip Hull,None of us need corporate apps. Browsers protect users while apps supply their sponsors with user data that's then sold. Demand browser access to all sites you visit!,1,0,26.3.0.100,2023-08-12 21:34:44,26.3.0.100
fb95023f-e2cc-460e-96f5-4d92ffcde672,Cari,The new single star review preview when you search for an item that makes you open every item to see the number of reviews is not a good change.,3,1,26.15.2.100,2023-08-15 19:54:50,26.15.2.100
d935d00c-f4e4-4ec7-a2c8-4b807124dcd0,Tracy Ellis (Tracybell),I don't care for Amazon never have and I never will if there is a bill better go elsewhere looking for the tab to be paid won't be paid by me got it Google I don't deal with amazon don't like them never have never will if there's a bill deal with it,1,0,,2023-08-08 00:08:19,
5131ebf3-508d-4c75-83a6-7064463cbdcf,Sohail,Please add a button for us to report scam reviews. Saw some progress with high sell counts but the pictures were for a different product.,3,0,26.14.2.100,2023-08-04 03:14:07,26.14.2.100
76994a29-8d23-4736-a05f-560b1f143760,Dustie (Erie),"My package was delivered to another apartment complex my mine and when I called customer service they hung up on me after placing me on hold to transfer to fresh food service. The call never transferred and the original guy said I didn't provide information and hung up. Tell me if the fresh food people didn't pick up how am I supposed to tell them the information?Customer service is rude, and packages say they delivered with photo means nothing when it's not even delivered in the complex u live.",1,0,26.15.2.100,2023-08-17 00:49:27,26.15.2.100
259a6ddf-2947-4223-bbd1-a8ea4f0523d7,Jatinder Sandhu,Drops frame rate eveywhere this app is horrible while viewing pictures and videos for products please fix it.,1,0,26.14.2.100,2023-08-04 19:45:50,26.14.2.100
b92baa3e-c249-4441-8473-3ca87a6a07f7,Twilight Huntress,Has been working well and not super easy to navigate to messages at least but the rest is straight forward,5,0,26.15.2.100,2023-08-12 16:07:06,26.15.2.100
3bcd1db0-468d-4933-9dec-ce161644f7e1,Elizabeth Torres,I've gotten a dayled message in my email for same day delivery never came passed the time and and then says running late sorry for the inconvenience then time done now it saying preparing for shipment Amazon is dying out like Kmart bout to give them up not worth time and money anymore,1,0,26.15.2.100,2023-08-16 05:24:36,26.15.2.100
7c1a3dcf-df38-4303-9ceb-6a3b2b30dd40,Kay Williams,"Timely, accurate, Savings with each order. Great with returns and refunds!",5,0,26.15.0.100,2023-08-11 20:08:20,26.15.0.100
