reviewId,userName,content,score,thumbsUpCount,reviewCreatedVersion,at,appVersion
c593e36a-ab67-432d-8bad-d14a4be54a74,Fielonn,"Package tracking Awesome. Beyond that the app is slow, and hangs. The app has caused performance issues on 5 different device. Cant simply share items or its not intuitive. Contacting a sell is far to difficult! I can go on. Let put it this way, I would bet a dollar to a donut that if Amazon has a Usability Analyst, the Analyst used to be a software engineer so they can't see the problems, and never will.",2,20,20.9.0.100,2020-05-19 18:56:38,20.9.0.100
f10a5fb2-ef78-4c0e-ba32-5929b73a7177,Matthew Correia,"Full-screen product images is broken - you can't exit. 'Back' no longer works, until eventually after pressing it repeatedly, the app finally exits you from the product image, and returns you to your very initial search, no matter how deep in the Amazon rabbit-hole you had gone, all progress lost. At least the app is faster than their website; trying to move items between lists is unresponsive af.",1,49,20.10.0.100,2020-05-24 15:08:55,20.10.0.100
277e8556-1f10-496c-9165-181cfdf88ec3,Catch22Warrior,"Having amazon prime was amazing and the app made thing super easy and simple. But the problem i had, and it came out of nowhere, was that one day i logged on to buy a blanket. When i loggoed on, it asked for a two step verification code, which i had never done before. And on top of that, it was sending the code to a phone number i haven't used in 7+ years. I tried to call the help line but with corona running rampant, there is no one to answer calls.",3,1,18.21.0.100,2020-05-06 08:17:25,18.21.0.100
7dfa9f08-e1eb-4038-94bd-f41c2c293206,Saira Jhingan,"I've had the app on my phones for years and NEVER had any issue. Worked great, very convenient. All of a sudden something happened and last week the app kept crashing and then wouldn't even open, despite multiple restarts etc. In the end I had to just delete it from my phone and am back to using the Amazon mobile website, which is not as convenient and I can't even track my subscribe and save orders/packages.",2,1,18.10.0.100,2020-05-20 16:15:08,18.10.0.100
d642467d-a097-403e-9996-de6253f3f0f0,Vicktoria Tacos,"Most recent update has made shopping difficult. When I expand product images for a closer view, I can no longer go back. I hit the back button multiple times & it won't go back to the item, but eventually goes back to the search instead. Also, half of the time now when I try to type in an item to search, it instead blocks out the app & shows a lady in a dress & tells me I can search using a photo. Um... no... I don't own the item yet if I'm looking to buy it, so I clearly can't take a pic of it.",2,351,20.9.0.100,2020-05-18 11:25:36,20.9.0.100
5ba11f00-7c49-442b-89f7-8c54534790cd,Deliah Bist,"Canceling my prime, it's a scam now. They're completely taking advantage of the COVID-19 situation. Delayed orders were fine but now they're doing it on purpose and blaming it on covid (we're opening up where I live). Orders get delayed over two weeks. I'll get something stupid the next day but won't get an essential for almost a month. Also, they charge you to return items unless you drive all the way to another town for their drop off hub. Rediculous!!!",1,1,20.1.0.100,2020-05-26 15:41:23,20.1.0.100
f241110e-dead-40b0-9ed6-e18bda067686,Kevin Higgins,"Amazon seems to be okay for the most part, unless it's Prime we're talking about---then it's a different story. They're real good at advertising the free shipping and everything that's included in a Prime membership, but don't let them fool you. Some of it is as advertised, but most movies, videos and TV episodes will require an additional subscription to Hulu, Boomerang or the various other sites which own the rights to the particular item. Most items DON'T fall under the free shipping. BEWARE!",4,20,20.9.0.100,2020-05-13 22:36:07,20.9.0.100
79b1ed1a-ba85-4e52-af40-3e64647eb5f9,Kim Brown,"At first it was amazing...The new update definitely messed something up. Amazon is making unknown orders and it took at least $80 off my card..and the order is not even showing up in the order history. Called costumer service ( what was I expecting, they don't help) and they said they couldn't find the charge. Seriously?? Had to remove my payment option because they kept taking the money off my card. Disappointed is an understatement!!",1,2,18.6.0.100,2020-05-31 22:24:13,18.6.0.100
98c501a9-3d7c-4ca5-9c5a-6f503c1262fd,Rachel Engraf,"I find this very difficult to navigate now with the last couple of updates. I can't find the filter button. I don't care what's popular. I don't care what's recommended to me or what everyone else has either wished for and others. I want all of the choices given back to me. In each category, you then need to click see more to be shown more in that category. Just show me the items again!!!! PLEASE!!!! It also sends you to the beginning after looking at pictures.",1,2,,2020-05-26 05:40:28,
c7f8927f-74e3-4c0e-9d69-fb53eff80679,Terry Kovach,"Not worth the costs. Had stuff on subscription since 2015 and haven't been receiving my items. Items ship separately so there's 15 different tracking numbers and they show up at different times (if at all!). Customer service is terrible. Every thing that can go wrong, does. Every Amazon app is also garbage. Riddled with problems, nothing but headaches. If there is any other possible app to try instead, definitely use any thing other than Amazon. They are absolute trash.",1,0,,2020-05-07 12:42:10,
728abe15-72ca-4252-a3ea-b45123c7615f,Stephanie Ash,I put in orders every 1-2 weeks at the very least and these new updates were they screwed around with the search filters is ridiculous. I don't even know if something is prime or not until I click on it. I'm beyond disappointed and I spend a lot of money with Amazon. I hope they're paying attention and get things back to where they were when you clicked the filter button and had choices and not this ridiculous list across the top or not having it at all.,1,1,18.11.0.100,2020-05-29 07:35:59,18.11.0.100
73f18ab8-5548-4ccf-a8c4-1f56ca8ea33a,Tera Esplin,Ok. That's all. Why? Because it's nearly IMPOSSIBLE to get in contact with them + the vendor's when you buy something & it comes wrong or anything like that (when the item does come damaged or just looks and resembles nothing as expected). Cancelling orders is a pain because the money can take 10 to 15 days to get back into your account. I'm giving 2 stars because I have bought a lot of nice things but I have also received bad service & items that didnt even match the picture/display & no refund,2,0,20.9.0.100,2020-05-21 00:32:03,20.9.0.100
ad0350fc-98b5-40b1-b168-f8d80901c6e3,Allie M,"Been using this app for a long time with no problems but over the last week or so its stopped working properly. Freezes often, sometimes doesn't load wish list properly. When searching for an item if I click on an item to view it & want to click the back button to go back to search results it wont & I have to keep clicking a few times & it just ends up taking me back to the start of the search again which is so frustrating when I'm like quite a few pages in to viewing. Have to restart app often.",1,2,,2020-05-28 16:13:23,
e076132a-3cc1-4c3d-8eba-29464e8ca544,Vincent Simons,"the update from April 30 makes using this app absolutely maddening. to parrot other recent reviewers: looking at an item's pictures causes you to be stuck until you've tapped the back button so many times that once it finally lets you out of jail, it's kicked you way back to the beginning of your search. also, re: filtering/refining product/department search parameters. whatever you did to force filtering selections to only happen one at a time, let's go ahead and undo that madness too. cool?",1,27,20.9.0.100,2020-05-20 20:47:08,20.9.0.100
3e50aec8-902b-413e-b07d-3ea0aae7157f,Taylor Wickens,"Couple issues: 1. The search results do not properly format if you have your system font set to large. Text is cut off. 2. The ""Share"" menu does not have a way to copy to clipboard. 3. Clicking on images sometimes shows a magenta background in the thumbnails. 4. Clicking on links to Amazon will temporarily show an Android Amazon title bar from 10years ago.",3,26,20.9.0.100,2020-05-21 04:45:53,20.9.0.100
befeca92-ca60-445b-bfb8-71464131315f,Kaitlyn King,"I used to love this app, but with the most recent update using this app has become extremely annoying!! I used to have no problem with looking at an item and being able to hit the back button and go back to the list & page I was previously on. Now that's a rare occasion bc most of the time I have to hit the back button a bunch of times without anything happening until it finally responds, but takes me back to the first page of my search results. Please fix this & the new layout, bc both suck!!",1,4,,2020-05-19 04:32:15,
ba9d622d-3a53-4920-84dc-983c7b9c6472,Ned Sparrow,"Fix it or I'll stop talking to Alexa! No seriously, it used to be good but now it's all screwed up. Android and tablet versions are both an horrific experience and trying to shop or browse for items has never been so frustrating. Loading thumbnails or enlarging pics takes ages and once on a close up picture there's no way to go back, back button just doesn't do anything... Until it jumps all the way back to the hlme page. FIX IT! pretty please",1,49,20.10.0.100,2020-05-23 22:59:43,20.10.0.100
0eae6e73-02f5-46e7-a968-e3ba64c07c85,Hunter,"In terms of the app itself its usually fine. I use it a lot and there are still tons of bugs that don't get fixed One annoying one is the picture issue. You can't click on some pictures and when they do become clickable they won't load? On top of that when you try to exit the picture ""mode"" it will send you back to the first page when you are trying to exit that page and you lose your product. If you can't remember what product that was at all you have to get lucky and find it again.",3,160,20.9.0.100,2020-05-18 16:14:19,20.9.0.100
c3ee1510-6195-4a5a-acf1-4be2f4dbb891,Matt Hepworth,"2020 update. Worse each update. More ads. Fewer items shown per page in search results. No way to grid anymore. Alexa has taken the location of the search button, making accidental Alexa instead of search, and can't be disabled. Forcing my location to always be shown in search and browse results is also useless and just eats up precious screen real estate.",2,91,20.9.0.100,2020-05-17 00:55:45,20.9.0.100
054b2dea-948e-424b-82fd-8707a0cb2ef6,Specific Gravity Atomic Weight,"Up until this last update (may 2020, version 20.10 xxxx or something) the ability to filter search results was mostly working as it should. However, with this latest update, filter options have gone from a drop-down menu with lots of selections to a small amount of basically useless options positioned in the top of the results section. Also, when you go to enlarge a photo of the selected item, the back button usually takes you out to the results pages, instead of closing the photo. So, 2 stars.",2,7,,2020-05-26 19:22:42,
a29a69fe-cd72-46c8-b7ce-f9f8392e5acb,Adam Dodson,"Absolutely horrid. I have been using this company for my purchases (probably 90% of things I buy) for years, and have spent many many thousands of dollars. Just recently, for whatever reason, they can't seem to deliver my packages. I order something, it shows as ""delivered to mailroom"" (I don't have a mailroom), and I never get it. I waste my time and effort to complain, they refund me, I purchase the item again, and the same thing. I have complained so many times, and they apparently ignore my delivery notes. Their service has gotten so bad. A lady yesterday ensures me she has put a permanent note on my account, and this will never happen again. It happened THE NEXT DAY. I am unable to get packages from Amazon anymore. They are apparently unable to do their jobs, right when I most need a service like this. I contacted support to get a refund and cancel my account, and the woman disconnected me! Rude, unprofessional and inept.",1,0,20.9.0.100,2020-05-16 23:18:00,20.9.0.100
2cfff52b-d6c6-4aa3-843c-ee50e421fbce,Tyler Watkins,"The orders section needs to have the option to sort orders by DELIVERY DATE as well. Also, it would be nice to be able to EDIT general information on orders as far as quantity of an item, instead of having to cancel the order and placing a new one. Definitely like that you can see if an order is secure before it's placed. I DON'T like how you just use general explanations of updates that never changes. Other apps say what the app specifically updates....I.E. ""bug fixes, security updates...",3,28,20.9.0.100,2020-05-18 18:51:45,20.9.0.100
3a58af70-31e7-4de9-bf43-e153b17306ce,gmaki53,"Latest update sucks! Slow, freezes often, layout was better on old app. Search filters make you want to smash your phone. You click ""more filters"" a bunch of categories with options under each show up. After picking one option, it pops back to results screen. To select another option you have to go back and repeat. Why not let me pick all the option, then select done to see results. Can't believe they can't test/debug. Bezos must not have enough money to hire some software testers?",1,33,20.9.0.100,2020-05-29 01:55:11,20.9.0.100
71a22dcc-b745-41a0-94b5-ea74f20dd996,Stevie French,"I love using the app when I suddenly think of something I need and want to browse without booting up my laptop. But whenever I go to order something and change the delivery method, it then just buffers and doesn't complete the order! Pointless having the app ig you can't actually order anything. I've tried reinstalling, closing it down and reopening, everything. Also think it's really cheeky that Amazon default the delivery method to standard which you pay for in the first place!",2,11,20.10.0.100,2020-05-24 14:33:36,20.10.0.100
bcfd3c76-aea2-42d5-821b-f4f5f3f1644e,Heather Blum,Can no longer view my recent orders without going in and changing filter settings to the last 30 days. It is showing me 3 months ago. Also when you make product images bigger you can not go back to the product it sends you back to your search. Hope they fix these weird bugs soon. Very happy about being able to use amazon smile from the app now however.,3,15,20.9.0.100,2020-05-20 17:20:00,20.9.0.100
f875c5f8-bbe3-4a9c-843f-39ad1c262974,Deann Thomas,"App has been great until recently. It has made shopping very difficult and frustrating (which is maybe what Amazon wants so we'll buy less of their stuff?) I am unable to go back to where I was in the list after clicking on a product. I have to use the back button several times for it to respond, then takes me all of the way back to the first page. Please fix this!!!",1,797,20.10.0.100,2020-05-20 13:25:29,20.10.0.100
0195f8d3-c2fe-4df6-b95f-94873d8a2526,H G,"Prior to the update filtering was very specific. After the update the filter feature was changed/simplified which prevents the user from narrowing results and now instead of 30-50 results i have 2000. Cant begin to say how many of those results arent even close to what was entered in the search. Also, while viewing & selecting the picture for a product, retirning to the item page is impossible without selecting the back button many times and eventually arriving at the 1st page of the search",1,50,20.9.0.100,2020-05-15 21:52:34,20.9.0.100
d0e4053f-7d52-4550-9b48-4895bcf8b2ca,Breanne Mueller,"Does what I need, but not worth taking up space on my phone. I had Amazon's app earlier on my phone but removed it in an effort to not shop as much. I decided to reinstall the app for 2 reasons: 1) the ability to drag and drop products into a list below for easy navigation of all your options 2) being able to swipe between customer photos, which is a nuisance to deal with on mobile site Both of these features are gone, which is upsetting. The ONLY perk of this app is order status notif.",3,22,20.9.0.100,2020-05-16 19:36:57,20.9.0.100
ecee4f6a-4ce9-4a15-8052-0059b6cdd341,Ricci June,"When viewing results of searches, my other shopping apps have an endless scroll of items. For some reason, Amazon app makes me go to the next page after only about 25 items. So if my search returns 500 results, I have to page through about 20 pages to see every item rather than all items on one page. If I want to go back to a previous item, it's very tedious to find. If this were resolved, 5 stars!",2,260,20.9.0.100,2020-05-10 03:13:15,20.9.0.100
37e5f1f1-849d-4461-8536-a0796f1f655f,Marcio Furtado,"I'm wondering who in the development team had the idea to group the search filters by tabs instead of a simple menu. Also, the filters don't work properly. For example, filtering 4 stars or more shows items with average of 3.5 stars. To complicate more, the new update doesn't show the number of items found after each search. It's a nightmare, why call it an update? It's more like a child's toy. I'm uninstalling the app and canceling my prime membership until the app is fixed. Wake up Amazon.",1,448,20.10.0.100,2020-05-28 05:04:06,20.10.0.100
2d8b797c-ad0c-4efc-8c84-23daa2f29103,Danielle McElroy,"Twice, I have made a purchase & for some reason, the package can't be delivered. Amazon, fix your game. Not even during this quarantine affair, it canceled my order. Let's look @ why it canceled. First, Amazon doesnt even provide you with a reason. Sec., potentially an item does ""not ship to your location"". I can understand that but when the person I sleep above orders the same thing, sends me the link, & in a few weeks she gets the same product & I get ""undeliverable"". Equal Opportunity much?",3,7,20.9.0.100,2020-05-13 10:49:16,20.9.0.100
ab77bc56-acd7-4872-86b6-b2dbd7af858d,Jai Cabryizky,"It used to be amazing, seems to be super slow now. Lags and delays on clicking. Plus the fact that they don't allow you to call customer service anymore, and instead they try to force customers to communicate with customer service associates via this new instant-messaging/chat feature, which can be quite frustrating at times. Hopefully things pick up again when the pandemic nonsense is behind us all🤙🙏🏼",3,57,20.9.0.100,2020-05-19 00:05:59,20.9.0.100
cc2a4440-f00d-4961-aeaa-16db0188443d,Magrified Monkey,"I don't know how amazon can take a completely functioning app and break it so badly. It was funxtioning perfectly in January then I installed the update and it ran so slow that I couldn't use it. I then deleted and reinstalled it, same thing, slow as molasses. Deleted everything on my phone and did a factory reset. Amazon app was the first and only app installed still too slow to be usable. Then I installed it on my tablet and other phone. Too slow on those devices also. Garbage app.",1,109,20.7.0.100,2020-05-18 06:22:42,20.7.0.100
4d1690cc-bb7d-4fc3-b260-e57e8a2488e1,Colette Tauzin,"I would give the app 3 stars, but it loses 2 stars for extreme intrusiveness. When I grocery shop (a non-Amazon store) it follows me through the aisles and makes Whole Foods suggestions. I find no way to turn that feature off and Amazon ignores inquiries. They evidently feel they have every right to spy on you and don't intend to stop. This is heinous. I have to uninstall to shop or constantly close suggestions to reaccess my shopping list. Every time I want to look at my list.",1,18,20.10.0.100,2020-05-26 17:51:54,20.10.0.100
448dc900-d64c-4ad0-9066-9d856e229cd4,Alias 47,"Mixed bag. It's surprisingly good and efficient for searches and general browsing. However once you go a layer or 2 deeper you (I) run into problems. Adding items to wishlist slows the app down almost to the point of unresponsiveness. Similarly it doesn't seem to like removing items from wishlist either - it often gives me error messages when I try to do that. But like I said, good for the basics.",3,96,20.10.0.100,2020-05-30 13:45:25,20.10.0.100
db427d9a-5e18-4e3c-8065-20091664c246,Charlie S,"Amazon prime memberships are a waste of money right now. Shipping takes a week. I've been ordering from any other store possible and getting faster shipping, and I don't even have to pay a membership fee for it. Walmart and lowes still have 2 day shipping while Amazon takes over a week even with a $100+ yearly membership. Its ridiculous",1,1,20.8.0.100,2020-05-06 13:56:34,20.8.0.100
c263986c-e43e-4b4f-a4c8-c25cf0430e06,Michael Ferrer,"After update app, will not open, I haven't liked the Amazon app as far back as the 2 previous updates with the changes that were made especially with having to go from page to page to look for items and constantly resetting your filters, it was much better when you did you item search on a single page with scrolling till you reached the end of items listed ""no page turning"" to be honest that's why I haven't made any purchases from Amazon in almost 2 years, because the app is user unfriendly",1,40,20.10.0.100,2020-05-22 19:54:55,20.10.0.100
cd8eb229-4468-4d2f-b3cf-2bb3d25a6bdc,Amanda Laird,Amazon has been a ridiculous mess. Order stuff and it takes 1.5 months just to ship. During an issue like corona it still shouldn't take 1.5 months to ship an order. I have ordered from other companies and everything shipped faster. Will not be ordering from Amazon ever again. I normally spend about $5000 or more a year. Granted it isn't a lot a year but it was good while it lasted.,1,1,20.9.0.100,2020-05-13 15:04:40,20.9.0.100
c2f3649f-e83f-4c7a-a3ab-b57ec0fdf1fa,Gabriella Gregson,Easy to use and simple. Amazon is as expected on here. The wishlists could use some improvement from my experience but I will spend the time fixing mine up so they are how I prefer. I turn off notifications so I don't know about them but it functions well and I haven't had any issues other than the wishlists being a bit difficult compared to how I would like them,4,91,20.10.0.100,2020-05-25 21:06:13,20.10.0.100
8bb87a80-138c-469e-9b82-529b011bd58a,Laurie Heise,"Due to a couple recent issues that I've been having with my Amazon app, I decided to uninstall it and reinstall the app again to give it a fresh start. But now every time I go to my play store to reinstall the app the status continuously shows that it's waiting for download and never goes any further with the install. Is there a reason or fix for this new issue I'm having??",1,1,,2020-05-20 22:30:38,
24f9d947-3b98-4b5d-979d-91df798bb061,Marcia Yoder,"The latest app update is horrible. When I search an item, the way the results are listed they are hugely magnified and it is very hard to browse because you have to scroll back and forth to see each one. I tried everything possible and wasted way too much time trying to fix the setting. Just give up and shop the smaller online websites. They need the business.",1,371,20.10.0.100,2020-05-25 03:29:21,20.10.0.100
dd321089-9794-41b7-bb19-0a0d0402c300,Anthony Trujillo,"Don't even bother ordering anything through Amazon for a while. I have placed an order well over 2 months ago and still have not received my product. Getting in contact with customer support is absolutely impossible. Then when you do get a hold of someone, they're pretty rude and only offer a refund. When I tell them I don't want a refund, I want my product, they usually just end the chat or stop replying. So you can count on me ordering through FedEx for quite a while.",1,0,20.9.0.100,2020-05-14 03:05:35,20.9.0.100
18c9d0cb-a81c-42c7-9a8c-3f3620385126,Chris Morris,"I use this app all the time, but recently it's started causing my whole phone to freeze up for up to 30 seconds before a popup says the app isn't responding and prompting me to close it. This app is no good to me if it keeps completely locking up my phone. Edit 20May2020: I just noticed that despite still having all of my smile settings in place, it had disabled smile for my account on my phone. I just reenabled it, but warned me it would disable itself after two months. Absolute nonsense.",1,17,20.9.0.100,2020-05-20 12:30:48,20.9.0.100
2c8bd476-619d-471a-b229-e469cc180d96,Ash Steenkamp,"For the worlds most used online buying service it sure does have a glitchy, slow, buggy app. Back button doesnt work when viewing product images to exit out of image full screen to product page. I press it multiple times to get the back button to exit the images and it takes me all the way back to the first search I did. Time consuming and annoying. Pages and searches load slow. No other app on my phone does this. Interface for scrolling and choosing things is clunky. App needs a revamp bad..",1,18,20.10.0.100,2020-05-22 07:21:17,20.10.0.100
2adc017f-4162-4665-8079-5b40ccd32190,Zachery Anderson,"I have been trying to cancel my Amazon account for five days now. They have a new policy that is really hard to find where they decide what is ""low"" or ""high"" priority items. They no longer just charge your account and put your order in... Oh no... They will charge and cancel your account at random until they get around to actually shipping your item at which time they will charge your account for it one last time. Unable to get customer service on phone after a week of trying. Never use again",1,1,20.8.0.100,2020-05-02 02:18:31,20.8.0.100
b8a51afe-2441-4f9a-b00f-c46f67dd2d5b,Samantha Chapman,"App barely functions lately. It usually won't let me view my orders, and when it does, I can't see any detail. Also, when looking at a product photo, have to push the back button several times to exit, and it takes me all the way back to the lost of search results rather than just closing the pictures. It's really irritating.",3,33,20.10.0.100,2020-05-24 23:37:07,20.10.0.100
