reviewId,userName,content,score,thumbsUpCount,reviewCreatedVersion,at,appVersion
c08194de-8891-4933-b2b5-b0ca72fe7aee,Rose Rote,"This app is amazing, once someone tried to get into my account and they were on it right away. I buy all my stuff there, I am always happy with my products and I also get the prime membership. It's a very good subscription. I would tell everyone to shop Amazon",5,1,24.20.2.100,2022-11-11 20:15:31,24.20.2.100
4b39d9e5-a279-4e3a-9621-cc144a9b0277,Katy Rogers,"Some pages won't load at all sometimes. Layout and visibility much worse than using the mobile site. When the mobile site is refusing to load my cart page I use this, but only if I have to.",2,0,24.21.4.100,2022-11-22 15:33:34,24.21.4.100
f33f9241-2da3-4775-96ab-ca47dc3faf98,Bill Carden,"Whenever I open a product page I get ""We're sorry, an error has occurred. Please reload this page and try again"" on my Z Fold 3 This happens for any product It works fine with the web browser.",1,2,24.21.0.100,2022-11-13 11:05:02,24.21.0.100
184dffeb-3b97-40fd-9066-19754378d130,Kayla Herrera,"Please fix this app. It used to work great but recently it's terrible, slow to load anything, lots of video ads popping up. So terrible.",1,0,24.21.4.100,2022-11-22 19:57:56,24.21.4.100
998ac9c6-55ff-444c-9534-aafab0d5cb2f,Nicholas Khane Glaspey,"So many people in the reviews bitching about how the ads and others getting in the way and basically just saying they can't use amazon with common sense. Great app, use it for shopping 24/7.",5,0,24.20.2.100,2022-11-05 20:28:06,24.20.2.100
18bafbf9-1793-4dc6-9eb5-f024691dc10b,Katherine â€œBooâ€ Gebhardt,Service from Amazon has gone downhill. Multiple items never delivered and the shipping has gone from next day to next week or month. No longer worth the subscription.,1,0,24.21.4.100,2022-11-17 15:13:45,24.21.4.100
feb0e5ce-3923-47e6-a4fa-c0c05d3aad29,C Top,"Can anyone explain why this app can randomly use half a gig of dara in one day? I'm talking about the shopping app, nothing to do with Prime video. Will have to disable on mobile networks so it doesn't use up all my allowance.",1,0,22.18.0.100,2022-11-26 09:50:36,22.18.0.100
14829d7a-25e1-459e-a82a-3d8b32b0b3fb,Jim Cutler,"Shipping has become a joke. 139 for prime 2 day, and nothing shows up 2nd day anymore. Blame it on the shippers. What a joke. Convienent excuse for Amazon for sure!! Also, trying to filter Made in the USA has become impossible",1,0,24.21.4.100,2022-11-26 22:40:47,24.21.4.100
22967877-7413-4315-ba08-30cc9cf1d7d3,Mike Lynn,It won't let me access my account. It keeps sending notifications to a phone number I no longer have and there's no way to unlock my account. Customer service is a complete failure.,1,0,24.8.0.100,2022-11-05 17:40:28,24.8.0.100
01389c36-b6f3-4cee-ae19-af7af0be41ca,Urah Khunnt,Was great at first now I'm locked out my account cause of the activity on my card when I'm the only one using it I even sent pictures of reciepts from other places I used it at in person and yet still locked out so don't enjoy it to much they will lock you out and want you to share your personal business to get back in,2,0,24.21.0.100,2022-11-14 05:03:05,24.21.0.100
54dce26b-d8db-4d72-bebd-cffd9ecf88b1,AMMO Box Gaming,"It's currently black Friday, yesterday I saw deals on many items that I was interested in. Now every item I looked at is no longer on sale. Today is the actual day sales should be happening. Hard fail amazon, hard fail",1,0,24.21.4.100,2022-11-25 20:37:20,24.21.4.100
d1dee633-f400-443c-b8c0-864d9972e828,Jeff Kubel,"New ""influencer"" videos and livestreams embedded in product pages are incredibly annoying. They freeze scrolling and cause you to inadvertently click them.",1,0,24.21.4.100,2022-11-26 08:05:45,24.21.4.100
98da1bb0-2adb-4ac2-9510-1f2a0dbd01d2,Sunny Webb-Brazelton,It's suddenly in Spanish so I googled how to change back to English and found directions that told me to go to languages and change to English. I can't find that because it's in Spanish and I don't speak Spanish. Which is the problem.,1,0,,2022-11-04 20:22:58,
dfecad92-e056-44ac-90cd-606abeb55106,k smith,First the app.stopped working on my lg..when I got a new samsung 22 still wouldn't perform right..and customer service hunny worse and worse...chat online is horrible ...lost packages independent contractors..so prime delivery becomes standard delivery with a 3 for day wait...next day yeah right..most refunds this year yet ..charge uore and still don't gave5 access to unlimited music and reading ..18.00 more on top of 129.00 for I guess 3 day delivery if u get ur package at all..sad,2,0,24.18.2.100,2022-11-01 16:13:58,24.18.2.100
60823c9c-b49b-416f-a7c6-2095b3f39f57,Leo Ferretti,"Spoke with customer service, no help, the app is listing fake prices on items that increase by over $10 when you add them to your cart. Disgraceful, dishonest business practices!",1,0,24.21.4.100,2022-11-25 16:26:14,24.21.4.100
70cc1ae9-0ab3-476b-9f0f-56b2df2945c9,Oliver sama,"Worst app ever don't download it because it charges items ridiculously high, it doesn't matter what you want this business will always charge items so high no honest man can afford them and sometimes they send you an OLDER version of what you bought, I would give this app zero stars if I could",1,0,24.21.4.100,2022-11-28 18:39:56,24.21.4.100
b22fb7b7-9a84-4420-ae8d-daa594881089,F. Neal,"I ""remembered"" a list from a friend in Canada and now the app is stuck in Amazon Canada and I've lost all the items in my cart and don't have access to my original account! Send help!!!",1,0,24.21.4.100,2022-11-22 17:37:32,24.21.4.100
dbe4a452-d3fd-45df-b54c-d02a0653d311,Tobie Frey,The only problem I have is Amazon will revert to Spanish and I do not speak Spanish. We called Amazon and the could not help. There is a place that shows the language it is in and it shows English??,4,0,24.21.4.100,2022-11-26 00:47:16,24.21.4.100
68b9a454-2826-4eaf-b9cb-140b5cd931f4,Tony Gaught,Hate this company they can't get their packages delivered properly . No way to actually talk to a live representative. Very bad business practices shown. Will definitely find other options when I shop from now on. I would give a zero rating or lower.,1,0,24.21.4.100,2022-11-25 18:43:28,24.21.4.100
8221d1b4-a76b-4f80-9e70-c7cdb7329405,Jacob Payne,"Not sure what happened but I cant dislike songs, cant like some songs, and cant go back a song sonetimes. Random bugs make it frustrating.",2,0,24.20.2.100,2022-11-02 14:46:15,24.20.2.100
ab86c3dd-7a02-4ed3-b2ae-c51a7594cbf8,Chris,"Please fix returns through the app the button stays greyed out despite having your ""recommend"" service selected, yes you don't f up often but a mattress topper is not a turntable or a suitable substitute!",1,0,24.20.2.100,2022-11-06 19:39:05,24.20.2.100
17527f13-da5e-4562-9b53-44acb28531ab,Matthew Gaier,"Promised a discount on my order if I downloaded and used the app to order. When I placed my order, no discount was available or offered. Another reason to be disappointed with Amazon. Uninstalled the app after confirmation of my order.",1,1,,2022-11-13 18:56:29,
9fd7c800-cb64-47da-a14c-f87ec6cb3f97,Sonja Farrar,The app and the website keep changing to Spanish for no reason. This has happened multiple times. I'll even get emails from Amazon in spaish,1,0,24.21.4.100,2022-11-23 21:12:55,24.21.4.100
3cec108e-d711-480d-aa4d-0086db2e385b,SHEILA FREUND,"The app often crashes with the excuse ""oops something happened on our end"". IF YOU KNOW THERES A PROBLEM, FIX IT!!!!!!! IE you don't care about your customers.",3,2,24.20.2.100,2022-11-12 20:50:43,24.20.2.100
9ca67a61-f513-4e29-b2dd-52fb05f8bf97,Doug Brown,I've always found amazon safe and easy to use. I am adding a quick question. My background recently changed from blue to green was this an update or did i mistakenly turn something on?,5,0,24.21.4.100,2022-11-18 21:25:28,24.21.4.100
ca213fd6-bd15-40bf-a76b-b7b5c0440b22,dan MCCUE,It sucks got it so could track package in real time on a map to know where order is like it says in the description. Nope cant do that. Only thing you can do is the same as in the email they send.,1,0,,2022-11-06 19:08:39,
eae27661-77ad-4ff2-bd04-72d885f2f6ec,Cheyenne Ness,"Love the app so much! I go on it almost daily. Unfortunatly I am experiencing bugs with the new update (as of 11/24/22), still love it though.",5,0,,2022-11-25 06:40:37,
7d438c01-a999-4775-90aa-f2d8ba58fe3c,Jayy Roberts,"I had the items I wanted, went to checkout and they deleted my account, I called customer service and they claimed to delete it for lack of use. I'll never use Amazon again.",1,0,,2022-11-09 05:45:21,
e6ffad56-282e-4fe1-8ca5-14c23c658933,Preston Harper,"I ordered some ""Alex plus"" caulk for some renovations because my house is leaking water, the caulk that ended up being delivered was ""Alex fast dry"" and I didn't realize until I was done with the tube, I tried using the wrong item was sent option and it wants me to return the used caulk before I can get my new caulk shipped out, my house cannot wait, parts of my house are now ruined because I have to wait longer to get it, why should we use Amazon if you're not going to send the right things",1,0,24.20.2.100,2022-11-07 20:58:04,24.20.2.100
018f9dba-b820-4795-ad59-4f85e6dec23a,Clint Coon,"Can't connect to site using mobile app. Have done restart, full shutdown, and uninstall/reinstall app. Don't know what else to do.",1,0,24.21.4.100,2022-11-17 19:52:29,24.21.4.100
accd0726-e0e6-49ce-b842-3bdde98bd605,Michaela Sanchez,I love the variety of items you can find. Mostly fast shipping. And super good prices and sales.,5,0,24.21.4.100,2022-11-30 06:16:33,24.21.4.100
52b05296-c329-40d0-9ab3-7371a395cdc1,Dan Prout,"2 maybe 3 years since the xbox series x came out. Still no black Friday deals, literally nothing amazon has offers on is useful. Absolute piss take with the amount of profit they make",1,0,24.21.4.100,2022-11-25 08:55:01,24.21.4.100
0cd0b568-b13e-4f65-b295-9a03bb0eeb65,Pierre,"its a nightmare to find the right site, even the acc setup is so slow 60sec run out and the pin still pending, we run on fibre.",1,0,24.15.2.100,2022-11-18 13:02:03,24.15.2.100
673ec526-af2c-4b46-af28-19cd924cf2f5,Gae Bolg,I find what I'm looking for. Always good deals and prices. Shipping durations are either on time or sooner than expected. GREAT JOB!! KEEP IT UP!,5,0,,2022-11-02 04:54:56,
3a5de448-409f-4604-8d7c-5985854c7147,Matthew Collins,May as well buy on ebay. The only reason to have prime is 2 day shipping. I'm not paying monthly for you to tack on three handling days.,1,2,24.20.2.100,2022-11-03 03:41:06,24.20.2.100
e2c068b7-0c8a-4b79-9f16-c5c52726b2fe,Ned Schneebley,"Music changed to them picking my play list shuffle. Next day delivery can be 1 or 2 days. Service is sucking for the price increase, but they own rockets so screw us customers.",2,0,24.20.2.100,2022-11-04 18:20:03,24.20.2.100
0cd06326-0000-43cf-ae13-9a5b5af4ccba,Joy T,Love it. My go to online shopping app. Prime membership is affordable and worth it because most items qualify for free shipping with membership.,5,1,,2022-11-14 18:32:09,
b7f3b0d5-d0c8-4d85-b6ba-6453f0e9f876,Felicia Doran,I am very very upset with Amazon and Prime I had 10 dollars left in my case app account they I needed for gas and Amazon took $6.86 from me and I had no clue because I didn't order anything from them at all I want my money back.....,1,1,24.20.2.100,2022-11-12 05:04:47,24.20.2.100
a4cc6e24-4a6b-4600-8e68-24d5c304a8ea,Becky Wilder,"Its too bad I'm not filthy rich. I love ""window"" shopping on Amazon, and would buy much more than I do, if I had the money. You can find just about anything on Amazon.",5,0,24.6.0.100,2022-11-22 14:02:56,24.6.0.100
f7f0e935-18a4-499d-8ba1-a48fe1ff9ea8,Gloribel Velazquez,"Filters don't work well, so sometimes is hard to find what u want. The custumer service is good but delivery tracking is not so good at times",3,0,,2022-11-17 04:18:17,
a6ece0be-294e-46fe-aceb-8a122019c13d,Robert Osory,"2 weeks refund on gifts. Up to 1 week ""prime"" shipping. No Atmos in video. Annoying saturation of elements on the website. No wonder why is losing money.",1,0,24.21.4.100,2022-11-23 12:53:16,24.21.4.100
334ed2a6-bb80-4bef-a5a5-a69b360dfc08,Sachin Shaw,I order few items with amazon it came out for delivery but I was not available as I was in office and it was COD. so delivery guys are refusing to deliver my item by saying their shift are done by 6pm and says sorry. It happend 3days in a row such an unprofessional behaviour by delivery person they call but then says no I cannot come at 6:30pm .still waiting for it .,1,1,24.21.4.100,2022-11-30 16:40:16,24.21.4.100
ef5c49a9-ec04-46ed-902e-a92438d5ff45,Mari Wolf,"Disgusting abuse of charging and cancelling orders and then recharging without your knowledge or permission. Absolutely NO help whatsoever by anyone!! Jammed my checking account up and destroyed my Thanksgiving due to double and triple charging!! Had to report it to my bank and then I tried cancelling the order myself and what do you know?! It won't let me!! Had to cancel my card so the constant charges would stop. I'd give a negative 1000 if I could. Straight up illegal activities, reporting!",1,0,24.21.4.100,2022-11-22 13:13:00,24.21.4.100
15c1fa4a-4e67-433e-870a-5a44780877c3,Cris Lorenz Gamit,"Beware of SCAMMERS in Amazon Warehouse. Amazon won't give me a refund for an item which was replaced by a Plastic PCB. They cant give a refund even though I have the official statements from the Freight company that I used, Photos while unboxing, uncut version of the Video of actual unboxing. Associate are not being honest and too lazy to provide correct answers",1,1,24.21.0.100,2022-11-15 00:31:32,24.21.0.100
3ab80c31-2f85-48c0-8857-ceb01141c8f1,Paul,"Please please stop everytime I open the app putting a full page ""get prime today"" sales pitch which locks up and causes me to have to force close and reopen the app multiple times. I am already a family prime member. This is driving me nuts and has been going on for months and months. Also, do you not monitor sellers who increase prices by 50-200% the week before black Friday and then list black Friday deals at 25% off! Dont tell me you can't monitor that.. Black Friday on amazon.. pricing scam",1,13,24.21.4.100,2022-11-24 19:21:20,24.21.4.100
a015f1db-b355-4816-b3c2-9068ba400c33,Pixie,I had to download the app because everything in my basket disappeared but when I add over 13 things to my basket in the app everything disappears from my basket so I have to find everything again which I really hate. Please sort this out,1,0,24.21.4.100,2022-11-20 11:25:35,24.21.4.100
769be9f4-656f-47a6-ad60-9c947ffd549e,Shane Holtzclaw,"Today while on Amazon looking for an e-bike, I found one and there were no reviews on it yet so I went to look at the seller and almost all of his reviews were great but there was two other e-bikes he was selling and all the reviews on those said scams when I asked Amazon how come this guy has these reviews on two items why do they still allow him to just keep selling those items because more people are getting ripped off every day the item's are still there for sale IS AMAZON RESPONSIBLE?",1,1,24.20.2.100,2022-11-03 18:12:45,24.20.2.100
d205c8c4-1f80-4891-af8d-e29e57ccf3d0,Anthony Hopper,I do a lot of Shopping Online because you simply get better deals and prices. Amazon has this and so much more. Be a Smart Buyer. Amazon Buyers are really smart. Don't be fooled by Wantabes and Copycats. Trust Amazon; I certainly do because they have proven themselves again and again.,5,0,24.21.0.100,2022-11-13 13:36:31,24.21.0.100
d8a8d0eb-ce90-4278-ab6f-c49a59fe059a,Alana Taylor,"Trying to return a completely damaged item sent to me yesterday and I cannot return or replace it! I've gone through all the steps online and it's non returnable, I just got it.",1,0,,2022-11-19 14:55:58,
9289933e-cf39-42fa-8721-97b6973ea0d3,M S,I uninstalled this app because Amazon started forcing video ads on the platform. You can't block them or skip them. Amazon has gotten worse than Google amd YouTube.,1,0,24.21.4.100,2022-11-24 14:43:59,24.21.4.100
fb259b11-83ba-44cd-bd32-6e6add6871eb,Levi Ghezzi,"Their ""cyber Monday"" is a scam. All they did was raise the price on items, and then put them on ""sale"" which lowered them back to the original price. Super scummy.",1,0,24.21.4.100,2022-11-27 00:53:46,24.21.4.100
04be1b76-13da-4da1-ba96-c84bedd596ac,Megan Johnson,"No longer supports the purchasing of ebooks, which is absolutely ridiculous. If a purchasing app no longer supports purchases, doesn't that mean the app is redundant?",1,0,24.21.4.100,2022-11-21 19:42:52,24.21.4.100
d72127a9-dc4a-44a3-b2c4-13864d3c1cc9,Maxine Hu,Very slow after update in my new phone. Use wifi or data. It's takes long time to load the items.,1,0,24.21.4.100,2022-11-21 19:12:21,24.21.4.100
65d30b9e-9846-4509-ae35-c88bd9fc5b7c,Noreen Walker,"I don't know what is going on, but all my deliveries come on different days than the date I'm told there coming. I never know what time they'll arrive because they don't update you as to how close they are to you, if they do it's after they've delivered the package(s), they may or may not ring the doorbell, and they never ask me if I'm the correct person, just ask if the package is for me. I think things could be handled a lot better, there doesn't appear to be much care or concern apparently.",2,1,24.21.4.100,2022-11-23 17:27:49,24.21.4.100
f458cd8b-0ab3-4b1a-9934-5ac611a6fd58,EZEKIEL SAMUEL,"Is vey educatimg ,,,for has many that want to improve their skill, potential...is not only to publish your work,,, but as well full your carrier.",5,0,,2022-11-17 17:33:29,
52fcfe22-fb52-4790-a335-440a2d95d3c2,Nyctophile,so flippin slow. most functions do not work. lags significantly. very frustrating.,1,0,24.11.0.100,2022-11-23 18:43:37,24.11.0.100
e43a4195-96da-4941-bc50-8d82e12497c0,Ben Fournier,Installed the app everything is fine for years now everything is in french and can't seem to be able to change it back.,1,0,24.21.4.100,2022-11-26 18:44:28,24.21.4.100
3d3d21df-dd26-401c-ad9a-9dc1d2877d21,Tash Thumwood,"Awful. Since update it lags, ful of annoying bugs. And why can't I track drivers anymore.",1,0,24.20.2.100,2022-11-03 14:09:17,24.20.2.100
0d8d5c2e-3e6a-40cd-a670-843f2fea5ab1,Brianna Winter,Wishlists for friends no longer showing date item added to the list. Now i have to ask people what they want..no more surprises.,1,0,24.20.2.100,2022-11-02 22:44:36,24.20.2.100
9826fb9c-926f-4dc3-a82f-0447b6df3844,J Rowe,"Please move the save for later items to a tab by itself and make it searchable. Move the Alexa button, it's annoying.",3,0,24.20.2.100,2022-11-04 18:53:45,24.20.2.100
8cfa0514-f9e5-43bc-b000-9d229bb8f184,Ciera,"This app has a bug. It won't show my orders, it keeps glitching out, it's been happening for days...",2,0,22.19.0.100,2022-11-20 18:06:09,22.19.0.100
ef4ccea5-9796-4890-a4d4-fd4d7cb74f82,Nadine Leapoldt,The worst customer service which lies and doesn't help with order or return issues. Amazon gladly takes your money but doesn't care about customers etc. Very bad,1,0,24.21.4.100,2022-11-28 01:49:10,24.21.4.100
ffe465b7-1ced-4732-acb0-3451f278eb48,Randy Klopp,I have been using this for about 1 year and yhe BPS-5 has lowered by blood pressure down about 20 points..I would recommend this to anyone and I just love the product..,5,0,16.20.0.100,2022-11-14 22:35:44,16.20.0.100
5d4da282-67ff-4794-910f-67919f5a407c,Food of Art & Art of Food,"A good app until the last update, now it crashes all the time. It will cost them some of my money because I can't use the app.",1,0,24.21.4.100,2022-11-25 21:12:38,24.21.4.100
2ef67629-a11a-4678-8ac9-f8f04d9088f4,Millie Craig,"*correction, the App is not showing the saved favorites heart while shopping. However, they are saved within the list file.",1,0,24.21.4.100,2022-11-25 21:06:06,24.21.4.100
35a42b12-e98b-43bd-aa4c-45a633967266,Stefani Maldonado,Everytime I'm shopping I add items to my cart and keep shopping and when I go to my cart the items I previously added to the cart are gone. It's hard to buy things when the items I was disappear.,3,0,24.21.4.100,2022-11-25 23:42:09,24.21.4.100
8fc7cc00-8e74-40a2-ba91-fbfb37e168f8,Michael Ramsey,Get with the times and offer a dark mode. I can't be the only one tired of burning their eyeballs out while online shopping in the bed at night...smh. UPDATE: Two years have passed since initial review and still no dark mode. Seriously?,1,3,24.20.2.100,2022-11-02 00:36:03,24.20.2.100
8e133ca5-d47d-4146-9575-e6ae10cec3af,Comfort Ankunda,all effort to create an account in vain! previous account became a mess...and now I cant create a new one because the damn otp wont show in my inbox. literally gutted afðŸ™„,1,0,24.21.4.100,2022-11-29 14:36:48,24.21.4.100
4c4ba957-a5ec-4264-a3e3-710fd6db4685,Coy Hisaw,"I ordered items ,then I was informed they were not deliverable. Ordered on another address and my account hasn't been corrected yet.",3,0,24.20.2.100,2022-11-02 15:56:00,24.20.2.100
6022ea81-fb4b-4bc3-a19b-a85e1b1a152f,Jeff N,Tried shopping on Cyber Monday but I couldn't disable the TikTok/YouTube videos that automatically play. I wasn't forced to watch these with Walmart or eBay apps.,1,0,,2022-11-28 22:08:42,
c596c288-3c70-4d3a-9320-23d7b922c283,IMOLDIN,From exploding plugs-Light up gloves for the kids that leak battery acid-Chargers that break within 1 month-Last year we lost over Â£350 on Amazon due to faulty stuff been sent and the hassle of returning-Every year we at a loss minimum Â£200-Parts missing-broken items-Even had items sent into Ireland and abroad which got damaged in transit. Paid for prime subscription for years watching the same old boring stuff never updated or constant repeats-Goodbye Amazon and good riddens...Speak my mind!,1,1,,2022-11-24 12:33:19,
d00a297c-010f-44d0-b501-4c4e3965c506,Star Fox,They don't filter and they allow fake reviews this is really bad. 50% of the things I bought are not functional. Wish app = Amazon (same same),1,0,24.21.4.100,2022-11-23 01:51:19,24.21.4.100
dec2038e-8309-4f60-86a8-9d895be2315c,Jenner McGump,"My app was always in English, now for months, it's all Spanish. I don't understand Spanish and can't figure out how to change language to Englush. Should I uninstall, then reinstall?",1,1,24.21.4.100,2022-11-25 22:15:37,24.21.4.100
f222f854-d0e3-4f49-a8e5-a01a57cd4f56,Jay Z,I been block from reviewing or asking the community questions about the products for no reason! And nobody can help me to fix the problem! So I can still buy products but not comment on them?! That's Bs..,3,0,24.21.4.100,2022-11-25 03:46:04,24.21.4.100
4c91ef74-ab48-4488-bc34-9907b249b638,Daniel H,Imagine being one of the largest companies in the planet and not taking the time to implement a dark mode in your app. Embarrassing. Take some time to unify your teme across desktop/mobile too.,1,0,24.21.4.100,2022-11-22 06:02:51,24.21.4.100
b8ae16e0-78fe-4c33-a966-37c31c375160,Amiya Challenges,I'm always buying things off of Amazon and it's amazing better then wish and there's not really any ads so on plus point and if I could rate it 100 I would and it's so easy to use,5,3,24.21.4.100,2022-11-23 05:19:27,24.21.4.100
36a69316-8bb6-4a7d-9a96-979611a8d937,TurningBoss,The app keeps crashing and everything else from Amazon stopped working and crashes too. Please help,1,0,24.21.4.100,2022-11-20 06:54:52,24.21.4.100
216799f6-58ad-435c-a6f1-1ffed88cb988,Norma Sandvick,"WHY does the language keep switching to Spanish???? It's happening very often, and I'm not changing any settings. REALLY TICKS ME OFF!!!",4,0,24.21.4.100,2022-11-20 01:51:17,24.21.4.100
3ae13788-2c82-49b7-b784-e5d81ecf758a,Celita Cantrill,"What's not to love? Just be aware of where you're shopping and what you're shopping for and you will be fine. I have Amazon Prime, I love it and it'll save you money in the long run with deals and free shipping. I would be a spokesperson for them if I could be.",5,2,24.20.2.100,2022-11-06 01:36:20,24.20.2.100
4c7e1ad6-fb40-4609-8654-abd193717674,Brenton Pomeroy (Brent),Teen settings are broken. My teen can't buy anything after recent update. Spent 3 hours on phone with customer service but it still doesn't work.,1,2,24.21.4.100,2022-11-26 17:47:19,24.21.4.100
a8e26644-22fb-4e7d-952a-8244799211fd,Roy Palmacci,I have had a lot of problems with Amazon but they have always worked with me to correct them. Great customer service and decent product ðŸ‘Œ,5,0,24.21.4.100,2022-11-21 23:55:19,24.21.4.100
1e71acbd-f03e-442d-8c7f-448098fdeaab,theresa delisle,After the new update I am not able to log out .why... I TRIED TO FIGURE IT OUT.i would like this feature back.if it's not back I will consider canceling my membership.,1,1,24.20.2.100,2022-11-09 02:07:57,24.20.2.100
9d535c9c-df3a-45e3-a0f3-46c428b289e4,April Smith,I literally can find everything I need. I am such a last-minute shopperðŸ¤¦ðŸ¾â€â™€ï¸ . I get it delivered when I need it Amazon is truly a lifesaver!!!,5,0,24.21.4.100,2022-11-30 01:41:33,24.21.4.100
0b72ac8e-ced5-43d9-9917-394691353d95,nick flores,This looks another like a scam. In an attempt to contact Amazon it instructed me to down load this app. Still no way to contact Amazon.,1,0,24.21.4.100,2022-11-18 20:30:56,24.21.4.100
b408a05c-8827-4e3d-8274-32659ed3fd1d,william akiki,"Bad service, bad delivery agents, bad customer care... 2 days waiting my order, i call the customer care they postpone me , delays after delays, they don't know how to be honest and professional liers... i didn't get my order after many complaint, after many calls, i canceled it and they didn't take any action toward the negligence, they are not professional...",1,0,24.21.4.100,2022-11-29 19:57:07,24.21.4.100
