reviewId,userName,content,score,thumbsUpCount,reviewCreatedVersion,at,appVersion
0711f1a7-66b6-4a6e-af51-4eaa16865174,El Dy,Once you ordered and pay it online they deduct it immediately then when you want a refund you'll wait for 2-3 days for the process then another 5-7 days for the refund. Wth is this service. They dont even inform you that they processed it or not if you don't follow up. Never again will order on this app. Waste of time ðŸ‘Ž very bad service,1,0,24.21.0.100,2022-11-15 16:35:55,24.21.0.100
0717eaf3-e5b7-48a0-bbc0-2e5b0af42985,Heather Brophy,"I give 0 stars! Won't let me log into my account just because I got a new phone even tho I know my email and password, keeps sending the code to my old phone number and should have the option to send it to my email like every other app! Customer service is no damn help at all either! The hell with Amazon for real!",1,0,24.16.0.100,2022-11-19 20:36:33,24.16.0.100
3b075509-1674-4a85-9abf-92baf2a8c3f5,Farhat Ayubi,"Worst exp from amazon,I've ordered shoe on 4 Nov and estimated delivery date at first was 7 Nov ,after that they extended itself to 13 Nov and till now no any messages and calls ,very much disappointed with their service . Worst service update: @ amazon I didn't recieve my prodct after 20 days of online pay and confirmation from amazon ,they are giving excuse that this product z not available ,then how come u have confirmed product that time when I was doing online payment? Pathetic service",1,1,24.21.4.100,2022-11-24 19:46:06,24.21.4.100
ba8bac98-570c-4399-9844-af9aac8a4667,Travis Cramer,"App keeps changing all notifications, email, etc to Spanish while it's defaulted to English. Only option is to Uninstall and reinstall. 3rd time having to do this",1,0,24.21.4.100,2022-11-28 05:03:18,24.21.4.100
adab65a8-f457-4942-b73c-779b687d9d9f,Lila R Metz,"Goodbye Walmart... Hello Amazon!!! I love the selections more, I think they offer more items and more varieties for great prices. I don't have any headache's any longer ðŸ˜±. Alot of fun shopping ðŸ›’ ðŸ›ï¸ now. I no longer feel like it's a dreadful chore. Thankx Amazon, I ðŸ˜ u",5,0,24.21.4.100,2022-11-27 22:50:28,24.21.4.100
d8e8eddf-352a-4da7-aa64-da17a410f1b4,Evey,"Terrible I made a few orders for my 13yr old boy, mine you he has sensitivity issues -Autism. I recall everything I bought as this was my son's wish. I made sure I purchased items in enough time not just X-,mas and his birthday . He was soo looking forward to have his gaming chair, headphones, Nintendo switch controller, and 2 Nintendo switch games. One 5 nights at Freddy'sa plushy,etc. I've tried to contake Amazon to no availability. Got email stating suspicious activity ?!",1,1,24.21.0.100,2022-11-15 23:04:34,24.21.0.100
f4bead8e-94f2-4257-b439-12e0e65dda24,AmyCakes,Honestly the app barely works for me anymore. Just looks like it's constantly trying to load. Tried everything to help and make it work but it's not. Pain just before Christmas too when so much I want to buy!,2,0,24.21.4.100,2022-11-23 21:48:43,24.21.4.100
1edf26e3-de7f-49b2-b707-73962b3dccf2,Chris Lockwood,"After the latest update (15 Nov 2022), the app immediately shuts down with this message: ""Unfortunately, Amazon Shopping has stopped."" Researched online, and all suggestions failed. Is there a way to roll back to the previous version? Samsung S22 Ultra.",1,1,24.21.4.100,2022-11-25 03:14:45,24.21.4.100
d6715c60-a4ae-41de-bead-3cfaf51e13ef,Milk Stoned,"everytime I go to Amazon I am flooded with woman's clothing, accessories etc completely unrelated to me. it's infuriating, I pay for Prime(not sure why anymore) I also have my search preferences setup..",1,1,24.20.2.100,2022-11-06 09:50:57,24.20.2.100
ab005a56-15ce-458c-bee2-33786e5e308c,Ruz Maharjan,"Don't fall for their prime trap, they can't deliver item on time and they ask you to wait more after the delivery date and customer service is overseas with no control over shipment. you will just wait. I waited more than 14days for prime shipping and yet they couldn't deliver. use alternative plus.",1,0,24.20.2.100,2022-11-04 22:44:41,24.20.2.100
e4c15a9e-0194-4407-83dd-26a5ee999945,Ricky Wong,"Latest update has issues, Cart action did not actually take me to cart. It would reload to a page I was previously looking at which was item delivered with photo of delivery until I cleared the app and restarted it.",2,0,24.21.4.100,2022-11-27 09:40:14,24.21.4.100
83dfe2ed-031d-4d44-add4-72e540fd4064,Brittany Love,What happened? Having a hard time loading items & navigating. Restarting app & clearing cache no longer helps. Ever since Black Friday started it's been acting weird.,3,0,24.21.4.100,2022-11-26 03:22:50,24.21.4.100
0ea88907-2ad5-4592-a773-7f8344c98669,Rae,"As much as I hate to admit it I do love Amazon shopping -- every once in a while an update to this app breaks down, but for the most part it works well and the interface is (relatively) user-friendly.",4,375,24.20.2.100,2022-11-06 22:31:53,24.20.2.100
0472a4ab-9c8c-462f-9441-7b0091b03ab0,Bobbijo Little,Horrible experience...ordered a parcel and it never showed up on the expected delivery day...When I contacted AMAZON they told me it was lost in transit...Dnt understand how they keep losing all of the parcels cause this now the 3rd time that I have ordered something and it doesn't show up,1,0,24.21.4.100,2022-11-23 17:20:52,24.21.4.100
72a15ff7-9b0b-4cd9-94bb-990656da75fe,josh anderson,I use Amazon. Alot and well today the app decides not work and force close when it finally decides to work it decided to log me into a old account I don't use and can't log in to my everyday Amazon account thanks Amazon you are now useless I'm uninstalling the app and will never use the app ever again lost a costumer.. very not happy ðŸ˜¤ðŸ˜¤ðŸ˜¤ðŸ˜¤ðŸ˜¤ðŸ˜¤ðŸ˜¤,1,0,24.21.4.100,2022-11-18 21:01:23,24.21.4.100
d984a760-a7c5-435a-a327-b8b77116b1ab,Cande Cruz,"I don't use Amazon nor ever wish to, however this app keeps installing by itself on my device. It feels like a major breach of privacy and consent, as I feel like it's trying to pressure me to use it. I have to keep uninstalling it.",1,0,24.21.4.100,2022-11-16 23:06:13,24.21.4.100
e77775ba-3c3a-4dc5-840c-5d692e3e5f1c,Jonathan Marshall,"Installed this thing because of a promo they said would give you $10 voucher for installing it, right on the Amazon site. Nothing came of it, and it's a worse experience to use than just visiting the site on mobile.",1,0,24.20.2.100,2022-11-26 01:49:43,24.20.2.100
f018ff46-b37b-4cb4-8cd4-774ea870c529,JackIe Richardson,Amazon will take money out of your account for items you returned. They will rip you off. Don't order off here! They took money out four different time and they don't want to give it back! YOU SUCK BALLS AMAZON!!!!!,1,2,24.20.2.100,2022-11-03 22:03:02,24.20.2.100
a4c6b74b-12ea-44b6-bf0f-da9cac4ee1fc,Bella Zsadist,I am missing my prime button at the top of the screen and now when I search anything all the prices are missing I have to open each individual product to see. This new change is awful.,3,0,24.20.2.100,2022-11-10 00:15:17,24.20.2.100
aa33333d-910a-483f-b81f-8b49cd750a94,Frank,"Good for shopping, but membership management not supported in the app? Come on, Amazon. Also, it's be nice if there was a dark mode setting or at least one that reacts your system settings to save energy.",2,357,24.21.0.100,2022-11-14 14:26:46,24.21.0.100
38622f10-6682-4dab-9cb4-1806f9e76c30,anne Vidal,"Amazon really sucks now. Every. Single. Time. I order something that is guaranteed to be delivered the same day, it never is. Especially if I have something being delivered the next day. 40% of the time, is delivered to the wrong address. Don't even get me started on their grocery delivery...",1,0,24.21.4.100,2022-11-19 14:25:42,24.21.4.100
39c4196c-19db-4afc-9c37-b698112419e0,Les 10SN,"I just go to their website. I only installed the app because I had questions about an order and it forced me to download this to ""talk"" with someone about an issue I was having. The problem is, there are only preloaded questions to ask what seems to be a chatbot. It's absolutely useless. It did not cover what I needed. Don't bother.",1,0,,2022-11-29 05:14:52,
cb649dd9-9573-4b75-af15-6de87cd736af,Rain_OwO,"Man this app blows, I absolutely love getting deadnamed after setting my name correctly in every single possible way. Plus, all of your orders older than 3 months vanish, never to be seen again, I would really like to know if I got a warrenty on my now half broken headset, but I cant. Sucks to be me.",1,0,24.20.2.100,2022-11-06 07:45:09,24.20.2.100
7cf0a2df-cd2b-4130-86dc-5f7aad5896d2,o matar,"The first purchase experience from Amazon UAE was unsuccessful. When purchasing and paying the amount, my shipment was sent to another country, although my address and phone number are very clear. In the end, they promised to return the amount to my card, and I decided not to buy from Amazon UAE",2,0,,2022-11-20 06:53:51,
c20d3a9a-5315-48ad-ba81-4ed6a3890363,Crystal Dunaway,Scumbags!!! They made it disappear!!!!! My whole oredere!!Â¡!?!I owned a nice electric bike. It allowed me to get around and be able to earn a income that was actually liveable!!! It changed my life until these hurricanes came thr. I have recently lost my jobs and I almost gave up on life. I was browsing through electric bikes and found one for a penny with free delivery!!!!! This is a true life changing situation! If it's honored (tbc .),1,0,24.21.4.100,2022-11-22 20:15:14,24.21.4.100
c7962e12-cc38-40d3-89a0-47f9c22799d0,Abby A,"I love amazon like everyone else but please update or fix the ""Review past purchases"" feature. Been suggested to rate some of the same products and services for like a year now!!! No matter how many times I've rated it, the System doesn't seem to register.. .",4,9,24.20.2.100,2022-11-10 13:36:35,24.20.2.100
5c5f0b09-9fe4-4ef1-99b1-164b4137a7db,DRU G.,Watch out for Chinese counterfeit items. If you see something priced way too low it's a fake! But when there are real items the app is very useful and intuitive,5,0,24.21.0.100,2022-11-17 11:00:39,24.21.0.100
976353ad-3492-4e29-b773-d6a4a63d81fe,Susanna Perkins,"What's the point of a shopping app that doesn't let you buy? It's bad enough I can't buy books directly from the Kindle app any more, but now I can't buy them from the Amazon app either. No, I have to open Amazon in my browser to buy a Kindle book. Ridiculous.",2,2,24.20.2.100,2022-11-07 18:49:37,24.20.2.100
15f436bb-15c9-4c15-b9f2-8e2ec3765bc4,DARCON SILVERBACK,"The App. Sucks now that you can't manage your prime subscriptions on your phones anymore have to use a computer. Who uses a computer anymore when we all have a mini computer in your hands ""smart phones"" everyone in my family used to have Amazon we all going to other providers because can't renew our prime accounts on phones.",1,0,24.21.4.100,2022-11-23 17:05:13,24.21.4.100
e494ecf3-0418-4981-88de-5c87be876f16,S S,The app itself is good. Amazon has great products. My only thing with Amazon is really why even after I cancelled my membership they continue to try to run my debit card every month since.,4,0,,2022-11-09 12:50:10,
877303a7-099e-457e-9c88-f5ad3904e1d7,Makayla,Great product an what not but absolutely suck at delivering. Even when I pay for faster delivery options but again they have great products an are reliable to a degree.,2,0,,2022-11-11 04:02:54,
2212ec48-3414-4553-b792-d50e33cb6c3b,Britt C,The app automatically changes my default wish list. This is so annoying and now I can't change it back. Very buggy sometimes.,3,0,24.21.4.100,2022-11-21 15:43:29,24.21.4.100
c4196b08-00f2-4172-a8ec-c65ee1a3ddb7,Rohan Raj 16,Before I use to like this app but now a days I don't because the item I order it delays and says that your order is cancelled because of delay of the product. And I can't order the item. Please fix this problem and don't delay any ordered product.,3,0,24.21.4.100,2022-11-19 20:50:04,24.21.4.100
d74f748c-c829-4d5e-a542-99ff06fb92c6,Tegan Lawrence,"I can usually find what I'm looking for, but it's so hard to shop on the app because no matter how much I turn my screen down the brightness bothers me. Please consider adding a dark mode for your shoppers with light sensitivity!",3,0,24.20.2.100,2022-11-03 02:27:11,24.20.2.100
14edb163-b08e-4fe4-898f-0fff0dc0a6b5,Lucy B,The Amazon app & services are great. It's just really annoying that I can't buy kindle books or prime films here - sort it out Google Play! What a ridiculous policy.,2,0,24.21.4.100,2022-11-22 14:09:13,24.21.4.100
b4116841-700a-4343-a88e-ccd41af1e5dd,Karen Miles,App will not allow you to use the smile section as it comes up with page not found. I feel Amazon have hardly any customer service as their website also has faults it shrinks pages on the tablets and that is getting worse. Amazon please start giving us customers a decent way to buy otherwise you will lose us,1,3,24.20.2.100,2022-11-05 15:34:31,24.20.2.100
dd7576ce-7400-4db7-a450-71ad7145762b,Mike Morton,"Kept switching me to Spanish, don't speak Spanish, very hard to switch back, had to call Spanish some speaking people. They did it like ten times, I'm done. Good luck!",1,0,20.11.0.100,2022-11-10 00:44:35,20.11.0.100
2224e4ab-4a0b-4282-b6b8-b6bd5257013e,Henry Brown,I felt like it was misleading and it's wording you guys say comforter blue red comforters set with sheets not blue red cover or comforter cover and now I'm stuck with something I can't use I don't even know what comforter with fit that are go in it or what's best to get and I feel like if you need guys know that and can facilitate it would think that you can reconcile this with sending me the comforter that goes inside of that I would have never paid $60 for cover when I paid less for the sheets,3,0,24.20.2.100,2022-11-06 04:03:17,24.20.2.100
d08894d2-fe96-4359-a2b3-f6ca1afb4bf8,Lela Reavis,"Please, PLEASE, fix the app!!! I don't speak Spanish, but now all my alerts and notifications are coming in Spanish. This has been going on for about 4-5 days. The rep I spoke with said it was a glitch that would be fixed in 24 hours. It wasn't. ðŸ˜’",3,0,24.21.0.100,2022-11-15 16:55:13,24.21.0.100
dcc4582e-3a27-4faa-9457-594ec82a2308,Z3R0 G3N3S1S,"Very intrusive but other then that, if you are willing to sacrifice privacy for convenience then the app itself is very useful and well designed.",4,0,,2022-11-05 19:10:07,
e551c3ac-763f-40f5-839c-7e7d157e7d68,Kristian Shellman (heiroPhantom),"I have problems seeing items after I order them. Something about my Z Fold 4 screen's aspect ratio. Once that's fixed, I'll give 5 stars, because it's a well made app.",4,1,24.21.0.100,2022-11-11 21:29:08,24.21.0.100
25ccfde7-ced7-437f-95fe-16fbec9fc303,Branden R. Heller (God's gift to the world),"I had nothing but great service from Amazon the products came when they were supposed to with no questions if not sooner on top of all that the products have been great never once had an issue with them so far we actually shot me and my family at the shop for Amazon quite often probably we say we got to spend somewhere around $1,000 a month on Amazon between food products and everything else that we order so great thank you guys from Amazon for doing such a wonderful job and thank you",5,0,,2022-11-28 04:05:47,
5908b316-c0fc-4d04-9001-86093c0f7cb1,Ashley Tlahuel,When I place orders through this app Amazon authorizes the charge multiple times and sometimes the totals do not add up to my order total more times than i can count so idk what they think they are doing with my bank information. This last time it happened they overdrew my bank account and when I called and asked them what we should do about this the representative kept trying to blame bank (but I'd already spoken with my bank) so I asked for a supervisor to speak with and they hung up on me.,1,0,24.21.4.100,2022-11-19 15:34:46,24.21.4.100
3609fd96-200a-48f0-abfc-7f909accb4b6,Tanya Baier,I don't understand why the app and the website can not be connected to each other. It's stupid that you have to sign in to two different accounts and try to find the same thing in two different places I don't like the app I'd rather go through the website.,1,1,,2022-11-30 17:44:58,
f0468264-5a39-4251-b6ba-f656b6e2e2ad,Richard Waring,The new shortcuts lead nowhere . My order pages and search pages do not load so the app is totally useless now. The remedy was to delete and then reinstall the app,4,1,24.20.2.100,2022-11-01 09:28:06,24.20.2.100
094b4bee-a467-411f-a372-d09b272a7206,Filipe D.,"Good app, but please stop saying an item is available for next day delivery (with prime) and after making the order it says it will be in 3 days only. We pay prime for next day delivery like it shows and sometimes even with prime items that doesn't happen.",4,1,24.20.2.100,2022-11-09 13:14:11,24.20.2.100
1663848e-0e26-411e-b53c-3f20bdc03bb1,D W,"Too many ads. Search any item, over half the results will be ""Sponsored"" ad results. Lots of knock offs. Too many scalpers.",1,1,24.21.4.100,2022-11-23 15:11:45,24.21.4.100
508b3c70-ad45-48e7-8f59-9520be83c55d,Francisco Abrego,"I subscribe to try the Amazon fresh service, I make the purchase, I reserve a space and the driver does not appear with the order and they ended up canceling the order, now I am without the week's purchases and without the money",1,0,24.21.4.100,2022-11-21 18:02:16,24.21.4.100
c5e2d1ed-cfb2-405c-be32-444ce073bf91,john nguyen,"It has been supper glitchy on the ""Orders"" tab it's like they don't want you to view your order to make returns. Making it difficult for the customer to return items.",1,0,24.21.4.100,2022-11-29 05:42:06,24.21.4.100
11efb18b-74be-4ed5-8e3a-1336e5931f29,Matt McCrary,"Live Stream feature annoying. On the home screen you have to dance around the new live stream ""feature"".. if you try to scroll down the page like normal, there is no click, pull the screen up motion on the live stream, as soon as your finger touches it.. boom, you're watching Greta talk about some new fancy caffeinated water with 0 carbs, no trans fat and it's gluten free too.. wow. Amazon, stop ""making"" us think about how we scroll. We won't buy as much stuff if we're not mindlessly scrolling.",3,0,24.20.2.100,2022-11-04 13:07:42,24.20.2.100
5143b233-937a-4239-9ced-e9fc0e6fe926,T-A H,"App keeps freezing or says, ""Oops! Something's wrong on our side"". This happens constantly: very frustrating and inconvenient!",1,1,24.21.4.100,2022-11-24 11:46:18,24.21.4.100
029df4ac-5ff3-4503-b036-8c3bc01ef4bd,Gary Pomeroyq,The app keeps switching the language from English to Spanish. I have changed the language back to English and within hours it is back to Spanish. I don't have this problem with the website.,1,0,24.21.4.100,2022-11-29 20:57:03,24.21.4.100
17fcdae3-558b-4785-a51a-e739e3d87e9b,OTM Reeper,I've been trying to purchase an electric bicycle for weeks and each time I put my payment through my order mysteriously disappears. This is the third time this has happened. I'd like to speak with someone in customer service about this because this is getting to be ridiculous.,3,0,24.21.4.100,2022-11-16 13:36:32,24.21.4.100
c518f2d6-bd6c-4379-8feb-b5b36df639f4,Lawrence Li,"When I click orders, the screen flashes & I cannot see my orders. This has been like that for a long time. Hope they will fix this bug.",4,0,24.21.0.100,2022-11-15 18:17:03,24.21.0.100
5f8a3921-5193-4ea3-ae42-ef88c28d5219,Thomas Lessman,"As much as I appreciate the service provided by Amazon, the app itself works but it's unfortunately almost infuriatingly slow at times.",3,0,24.20.2.100,2022-11-23 03:40:53,24.20.2.100
9e334805-f704-4177-ad62-88bf0731770f,Tim Hare,I have an immediate distrust of anything that I did not directly install and does (this part I like) has a disable button. It would be better to just let users install it and then decide.,1,2,24.20.2.100,2022-11-15 07:05:17,24.20.2.100
97021fed-2706-4436-9b7f-447929960dfd,LargeHippo,"This app is horrible, it put my account on hold for 0 reason and then refused to give me any options tog etc it off hold, I tried making a other account as well, but that was also put on hold immediately and again I was given no way to take it off. I'd give this company a 0/5 if I could",1,0,,2022-11-11 15:41:27,
4ca809ae-4182-4b56-8e74-a6807ac6632a,MORKOVKA ?,"O my good I fkn hate this shop, yeah sometimes it's useful but design really bad, prime cost to much and of course a lot of bugs we need amazon competitor, because this shop is not going to become better without competition.",1,1,,2022-11-01 23:56:49,
49266aac-987f-418e-97c7-5d4a6b22bb30,Atomic Soul,"The save for later is unmanageable for people like me. Can you make the save for later section click-able, so it will take you to graphed/listed pages with everything on it?",5,0,24.20.2.100,2022-11-05 21:23:30,24.20.2.100
b850456a-c491-4582-b264-84fe7e21a260,Nate,"Haven't had prime in months because I can't find a job and can't pay for anything, parents let me use their card for food, I consider buying something in Amazon but don't, input card but never charge anything, Amazon automatically started pulling $16/mo off the card without consent. Deleted the card, scum bag Bezos is out to steal from the poor.",1,1,24.20.2.100,2022-11-08 15:20:33,24.20.2.100
c1455712-1330-4552-9b48-3e4345879d34,Terence Curtis,"No free shipping? Now can not get the free shipping when ordering over $35 CAD, even when it says ""eligible for free shipping""! Impossible to find an email address to connect to customer service. Back to the Brick and Morter retail store for me now...",2,6,24.21.4.100,2022-11-22 01:32:15,24.21.4.100
cce59a20-acf4-45de-a875-6b76c2cdd87f,Rebecca Perron,"For whatever reason the filters aren't working as well. Also, there is a disparity between ship dates, prime takes longer to arrive.? So once you've bought your membership they don't care? It takes over a week to get to you? What happened to my 2days to my door? Even in Kodiak it only took 4 days to my door. 9 days from order to door is unacceptable. Gonna go shop at one of the big box stores.. w literally delivered to my door within 2 days.",1,1,24.21.4.100,2022-11-19 18:36:03,24.21.4.100
097cdf2d-6979-403c-8faa-c49d398e3f08,Denise Everheart,Up until recently the app worked beautifully. But now it continues to choose Spanish rather than English. I have had to un-install 5 times! Very strange glitch!,3,0,18.21.2.100,2022-11-22 15:23:47,18.21.2.100
0ba43f44-6a61-42db-ac67-01d7cf0d74fa,B Clay,"Very easy shopping. Too easy! great service without leaving your home, especially wintertime. But, sadly this is also closing our Town/City centres. Local shops can't compete ðŸ˜”. I still shop locally and use the small shops in the village.",5,3,24.21.4.100,2022-11-23 03:02:00,24.21.4.100
186bc10b-1d44-4db8-835b-426c3f7d6e33,Jay W,"I use vpn on all my devices and since the last update if I select my location any other than UK it says ""uh-oh something went wrong"" Never had this issue in the last 8 years since using vpn...",2,0,,2022-11-27 18:41:51,
972190b9-57da-435c-9235-42407b60126e,Acacia Gass,The app has started glitching when you go to the tracking page...the page will slightly flicker. App functions properly other than that,3,0,24.20.2.100,2022-11-04 00:38:10,24.20.2.100
cad484d4-29c9-44d3-8c73-016d1afac24c,Cody Manhard,"Amazon now running shipping fee scam. When making an order over $25 for items eligible for free shipping, they still charge you for shipping.",1,3,24.20.2.100,2022-11-04 03:22:41,24.20.2.100
5c3f673e-ef42-446c-be6b-f4052f547b00,Sherri,"I am unable to download the app. My prior phone ""died"" and I now have a new phone with the same number. Amazon app thinks I'm trying to download the app on my old phone, and shows I already have the app. Grrrr, please help.",1,0,24.21.0.100,2022-11-18 22:26:24,24.21.0.100
96c4ddfd-5f46-49aa-80a4-1c8f876373c1,Lynda Pearl,"I am disgusted with dealing with amazon/audible,I have changed my password 3 times I created a new email and nothing works I paid for audible,can't sign into because Amazon didn't update anything,now I can't even cancel audible because their not doing their job",1,0,24.21.4.100,2022-11-17 15:55:36,24.21.4.100
89c72394-093e-48f2-962f-d8888c539585,G M,I've been trying to get my money refunded on an item bought via Coozo. I've been told it's been approved & will be refunded to my credit card. The acceptance was agreed over three weeks ago but still no refund has arrived. Now I am unable to contact Amazon customer service or Coozo.,1,1,,2022-11-06 00:26:34,
a6d59316-c484-4b4e-bff1-9f69b0b7d81a,Jase Quinn,Changed it so you automatically change payment methods and charge second card without authorization. Just desperate. Also can't cancel right after I ordered the package,1,1,24.21.0.100,2022-11-12 14:55:27,24.21.0.100
294c3336-3eec-462c-9b1f-4f3bb119fa20,patrick blake,"ðŸ’ðŸ’œVery easy too make purchases. However almost, actually impossible to return items successfully (if you don't have access to a printer!!!)Very dissatisfiedðŸ’ðŸ’œ",1,0,24.21.4.100,2022-11-28 04:31:38,24.21.4.100
b5cbaf91-c228-43d0-a084-b95470dd5703,Clair Cambridge,"Always asking to join prime upon opening the app..even though I'm an active member and won't let have prime deals, even though it shows my active account at the top. Very frustrating, especially during black Friday week!",2,1,24.21.4.100,2022-11-20 14:40:39,24.21.4.100
67b76155-a47c-4229-85c0-d84951698543,Alex O'Sullivan,When making a payment on a new card they shutdown my account because I wasn't able to provide information that I had absolutely no access to. After I had written and provided all details required New update I am unable to search any itmes,2,0,24.17.0.100,2022-11-08 22:52:55,24.17.0.100
