reviewId,userName,content,score,thumbsUpCount,reviewCreatedVersion,at,appVersion
c53c3a09-e5d4-4faf-80fc-219160aa0cad,Pastor D. Lee,Pastor D. Lee I actually like shopping with Amazon it's convenient and I find most of the things that I want and 90% of the time I get a great price I highly recommend it to anyone that is interested,5,1,24.16.2.100,2022-09-09 02:56:12,24.16.2.100
553247ef-f104-4ce7-9237-93222f59a195,Drew Fridley (BeefNCheez),"I enjoy the app but it keeps disappearing from my phone for some reason. Every time I have to come back here and tap the ""enable"" button",3,0,24.17.0.100,2022-09-25 12:26:02,24.17.0.100
664ec67f-7806-41d9-a386-09ec81cef069,Allen Hackbart,"Slow, very slow. It acts like it doesn't know what it's doing, all I wanted was to check order status .it only says pending and never starts",1,0,24.10.2.100,2022-09-01 18:16:59,24.10.2.100
97cfc1bc-f9b1-48f8-9d57-268019f485aa,John Berdou,Every time I open the app I'm now forced to watch a teaser for rings if power. I don't care about your garbage show stop getting in my way when I'm trying to shop.,1,3,24.16.0.100,2022-09-03 02:10:02,24.16.0.100
d1409295-f2e7-46db-8e7e-66a97ddb8d97,Mackins VII,Needs a dark mode desperately. Search results are extremely bad and show way too many things that aren't even related to what I searched for.,2,2,24.16.0.100,2022-09-08 15:44:36,24.16.0.100
0269dccf-f463-437f-9bfa-cfa12eef2947,Maria Rodriguez,Highly disappointed I needed this blouse for this weekend. I placed order with a reasonable time. It was estimated for the 13th giving me a few days but now having a hard time to find else where.,1,1,,2022-09-14 21:07:09,
a9dc8d1c-1f40-4487-a19b-c3eee8918d7f,Alex Knight,"More garbage compliments of google play and Amazon. Can't just shop and purchase items. No, oh no....have to play games and jump through hoops. Ridiculous",1,0,24.17.0.100,2022-09-23 15:57:30,24.17.0.100
5a3faee3-ae6b-4983-8038-509393d8fe66,Oleksandr Timofieiev,"I had only good experience with shopping here. Also, when I needed help, I had a very kind, quick, helpful assistant Igor in chat.",5,0,24.17.0.100,2022-09-29 18:11:29,24.17.0.100
a1b2c264-ef3d-4e53-9c01-b1c414cf2473,MetalShadow Mario,"Package tracking is downright mediocre. Thing arive early, and it is never updated when I check my order list.",1,0,24.17.0.100,2022-09-27 09:52:12,24.17.0.100
21357726-291a-4311-9269-4a6c57abfed4,Kyle,Amazon is a joke they highway rob very body so I was shopping for some outfit on sale now I found outfits the issue the outfit is 99 cents each now I went to buy 3 pairs on Amazon. Amazon wanted to charge me 98.00 for shipping and handling on a 99 cent outfit so in total maybe 5-25 $ for the outfit with tax and shipping would be responsible ut Amazon is a joke they milk money out of people,1,0,24.16.2.100,2022-09-19 00:49:11,24.16.2.100
76c56cae-e624-4b98-84f3-62823af3221a,Margi Avery,Shopping made simple so much better than having to schlep through stores dealing with crabby people and sales clerks Then not finding what you are looking for. Amazon presents the opportunity of finding what you want and sometimes a better one all you have to do is browse from the comfort of an easy chair and not changing out of your pj's,5,5,24.16.0.100,2022-09-06 20:10:56,24.16.0.100
e0b3ccd1-c1c6-4a17-aa75-8ebf809f9537,Carol Zurlinden,Amazon would not trun my money..i ordered a cat scratcher i was sent a cupcake holder...the operaters all played a game with me about refund upon retun of cupcake holder..they wanted password..i never made a actual account i didnt have to Amazon is a built in app on my phone...i lost $13.99 never got the cat scratcher and stuck with a stupid cupcake holder..im on a limited income...this company took my money and cant own up to there mistake...i asked for mailing lables ..none were ever sent..,1,0,22.7.0.100,2022-09-10 20:13:52,22.7.0.100
bd95e829-d995-4716-9b72-ec338621599e,alesia Turrentine,"Quick, easy & colorful images! I'm pleased with the option of buying items. Thank You",5,0,24.16.2.100,2022-09-13 00:03:43,24.16.2.100
43714019-3a35-4512-9479-c3a7106ef3ce,Gail Centers,Everything I order from here I never d o get my stuff. When I place my order it's says it's was accepted even gives me my confirmation number but I never do receive my stuff never I have ordered the last three things that I needed five times still never yet my stuff,1,2,22.14.0.100,2022-09-20 13:55:31,22.14.0.100
dcf52723-6e1f-43eb-a8f2-6262b40deca5,Randy Suwandee,"Great app, makes shopping a breeze. The only downside is the review pictures and videos take forever to load",4,0,,2022-09-11 08:57:31,
785f50e0-af24-4789-a34d-7ef351efb549,Ann-Marie Bennett,The app used to be good... but now pages take a long time to load.. and forget prime two day shipping... every order recently has been delayed multiple days,2,0,24.16.2.100,2022-09-12 17:15:11,24.16.2.100
d9863c96-a56c-4265-99f7-224860e7bdf8,Renju Rajeev,"Beware: False Advertising - This is actually the new Lord of the Rings app.. nothing to do with Amazon! Also please share the donation details to send money to Amazon, didnt realize Amazon was in such economic crisis to be a sellout to LOTR. Pathetic!",1,2,24.15.2.100,2022-09-03 01:46:13,24.15.2.100
cef1d2f1-9436-40ad-9b13-7292f2ddc46e,ducpat,I like it because all the free shipping with sub and you get TV with it I don't like where Amazon is politically they for sure are not on my side.,4,2,24.16.0.100,2022-09-04 23:43:30,24.16.0.100
1fb8174f-9872-41cb-aafa-fc15b7772c72,Zainab Ogido,I love these app easy to navigate and use I have one problem shipping and delivery is too expensive sometimes delivery even cost more than the item I'm buying,5,0,24.17.0.100,2022-09-25 20:46:50,24.17.0.100
60920d97-6557-4996-b221-0975a27957f3,Aaron McLain,If i have to watch an ad to enter your app i will be canceling my membership and removing ypur products from my home. I do not pay over $120/year to have EVEN MORE ADS SHOVED DOWN MY THROAT.,3,0,,2022-09-02 02:30:47,
88c7c394-41b8-47ce-ab43-ea9734fcd967,cecilia onuorah,"They force you to update, then doesn't update so you can't use the app or website until it decides to. I've been waiting 3 hours",1,0,24.15.2.100,2022-09-23 16:43:20,24.15.2.100
bbf3de67-9c99-4bee-8d0f-76017f8a74af,Justin Kern,You can't cancel subscriptions with this app. But you sure can add them. Sneaky sneaky Amazon. please add this function,2,0,24.17.0.100,2022-09-26 17:28:21,24.17.0.100
4544e759-ce96-4ea8-8d12-2cd9d3a2cd1f,Esu Daniel Nte,The full screen Rings of Power ad that pops up everytime I open the app is obnoxious at best.,1,5,24.16.0.100,2022-09-02 18:55:26,24.16.0.100
01b332ba-74f1-44bb-b1db-743bdc803065,Bryan,It's not okay to display full screen ads for Amazon Prime shows every time I open your shopping app.,1,9,24.15.2.100,2022-09-02 15:17:22,24.15.2.100
85acb77f-0e1f-4acf-bfb6-f667d146e485,Korbin,Amazon prime has gone down hill don't expect 2 day shipping with prime anymore and don't bother reviewing products. They ban you when you try to help the community by telling them that a seller is price gouging and where to buy it cheaper. The whole point of reviewing is to help the community but then they can't take the truth smh what a joke it has become.,1,1,24.16.2.100,2022-09-15 02:17:21,24.16.2.100
2cdcb929-50bb-48c9-a6be-858da5e4beaf,OAXACALIFORNIO LOCO,No dark mode yet. I buy a lot at Amazon through my browser. After several years of being a customer I'm still waiting for the so needed dark mode. Starting to feel discriminaded.,1,2,22.1.0.100,2022-09-05 20:39:24,22.1.0.100
721ff627-f05b-4aee-9216-4d3cbb76927a,Heinz Elmann,"After the latest update, an annoying and unwanted trailer starts to play at startup. Don't install!",1,6,24.16.0.100,2022-09-02 21:18:02,24.16.0.100
0cb87275-5657-4435-9758-4048f49b65bd,Iam Mee,"Says that delivery is 2 stops away then arrives hours later, what is the point in having a notification system if it is never correct.",1,1,24.16.2.100,2022-09-09 09:29:10,24.16.2.100
b14e418a-c13a-4d90-950f-c459f82b41ce,Mike Brant,I used to like this app but they changed how the filter works and I can't find the star ratings and lowest price. Jesus Christ people when an app works leave it the hell alone ........,1,1,24.16.2.100,2022-09-13 23:36:04,24.16.2.100
cfb77df8-c072-4f1e-ac7b-b0c69a7c5fb2,Shawne Farmer,"Can't filter to prime shipping anymore. Please fix, I don't want to sort through all of this garbage that takes 2 weeks to get here",1,0,24.16.0.100,2022-09-04 18:59:44,24.16.0.100
4fd147bf-fa63-474c-aca2-9a3221b72882,Teresa Ray,I dont like the fact that i cant update the app right now & cant get into the app without downloading it. I have placed orders but cant get tracking info.,1,0,22.13.0.100,2022-09-29 23:08:48,22.13.0.100
fd6ac390-a679-44a1-965a-2b85d033db2b,Corey Smith,I get an ad for some LoR show when I open the app that takes up the whole screen. Sheesh. Amazon continues to go downhill.,1,4,24.15.2.100,2022-09-02 18:52:28,24.15.2.100
67adfb3e-f614-468b-a036-e7685a56ca12,G Olds,"For the past few days I have ordered items and I've had no notification, stating where my parcel was or how long they'll be. This has happened 3 times now",1,3,24.17.0.100,2022-09-21 14:00:30,24.17.0.100
6bf91a81-fa71-469c-abcd-a5bb5936851a,Ronan C,"When is Amazon Ireland going to be added to the app? The new depot in Dublin has been open 2 months now. Can't buy anything of amazon, especially from the UK with the ridiculous import charges.",2,0,24.16.0.100,2022-09-04 11:21:03,24.16.0.100
892d084a-ef96-47c7-ae34-421fc3dd4320,Parker Lewis,No longer supports 2 day shipping Every item takes at least 5-6 days to get to me. Don't blame COVID. You're still taking my money every day and it's not worth paying for slow shipping.,1,2,,2022-09-07 03:53:11,
3b8070e2-be71-40e9-af9f-07c4d6577ff7,Anon ymous,"I'll be honest, I'm not at all a Tolken, nor LOTR fan. Is there anyway I can skip/turn off the ad for this new Lord of the Rings show; everytime I open the app?",3,1,24.16.0.100,2022-09-02 16:25:29,24.16.0.100
b39fdf63-2f5a-4c4f-b5c7-502cc0279ea2,A N,With the latest update you can no longer filter by seller to avoid all the dropshippers dealing in fakes and rip-offs.,2,3,24.17.0.100,2022-09-25 06:18:40,24.17.0.100
e8f19b50-091b-4063-904b-d297723d5beb,Holiday,"Digital only, support your local businesses, more likely to get the item you want instead of having it stolen from your front door, cause people see the obvious Amazon vans and think hey! Free stuff, i hope who ever stole my stuff enjoys craft supplies! Going to shop local from now on.",1,0,,2022-09-03 15:59:14,
7f2b6166-6cbb-4f7b-ad94-63b78d91198c,Stan S.,"Switched to espanol. For some reason, this app has changed my default language from English to Spanish which has rendered it useless.",1,0,24.16.2.100,2022-09-09 21:19:13,24.16.2.100
f9e59d82-bdbe-47be-8bc5-0e3beb756e19,Tamara Wynn,Having a very hard time updating. Just continues to buffer going around and around.,1,0,18.8.0.100,2022-09-15 20:45:26,18.8.0.100
e490648b-19dd-4780-8778-fe6dc91f80bd,Josh Simmons,Rings of power power power really amazon? I was literally scrolling through what I searched and what happened mid search? You splash the Rings of power ADs. Everything it Turing into an AD opportunity isn't it?,1,1,24.15.2.100,2022-09-02 13:06:16,24.15.2.100
af2b5ff6-26cb-487c-9d42-a2a33304a392,C MacDougall,"It glitches, blinks and then shuts down. Doesn't give the option to update.",2,0,24.17.0.100,2022-09-25 23:56:47,24.17.0.100
c14c4166-6e36-435e-8766-253b898fe7af,that guy,It opens strait to video adds and you can not skip or exit them without not using the app or watching it through,1,4,24.15.2.100,2022-09-03 00:36:38,24.15.2.100
7864bbd4-4364-4419-8dd6-ad0cd8c17607,Brandon Williams,"Crashed while working, lost work. Quit forcing prime video ads just because you spent a lot on LOTR. ESPECIALLY since I already watched it. Get your s&it together!",1,1,,2022-09-02 14:42:34,
8d612959-c406-49e0-8644-da4339c76018,Jaden Wood,"Charging more for worse service. Seller fees, user/customer fees all being jacked up. Yet now 2-day Amazon shipping is no longer a thing with prime. Garbage, greedy company.",1,0,24.16.2.100,2022-09-12 05:48:14,24.16.2.100
ef276673-60f8-45f1-809d-e65458b89c60,Brian Medway,your app no longer works on older Samsung devices. You will lose business because of this lack of support for those who cannot afford to keep upgrading their devices.,1,0,24.16.0.100,2022-09-03 22:27:28,24.16.0.100
77df663c-40fc-4a0b-8b3f-1b6458f8aa6f,Maegan Brownrigg,"This app keeps opening up in Spanish, and I am English speaking. And there is nothing that I can find to help me switch it back to English",1,1,24.17.0.100,2022-09-20 16:20:59,24.17.0.100
ef3e337a-aef2-4fd5-93bc-be7119b3d210,Clifford Hammond,Having to watch an advertisement before I even get into the store. Very poor decision amazon. Deleted app won't be shopping with you again,1,2,24.15.2.100,2022-09-02 11:19:42,24.15.2.100
1cc82066-245e-4642-9be9-c1c7171bb7d3,"Wanda Swiggett-Walton, PhD","It looks weird on the Galaxy ZFold 4. It used to look normal on my ZFold 2. I hope this will get updated over time. It still works fine, though.",5,2,24.15.2.100,2022-09-01 22:22:20,24.15.2.100
8cd166cb-86a9-4991-9296-fa221b471002,It's Raymans,"Waited weeks for a refund only for Amazon to send me a link on twitter reseting my whole account making all previous orders get deleted and all my wishlists to vanish, never had an issue before until I asked for a refund on ONE single item.",1,0,,2022-09-26 14:43:15,
8f3b1c9e-d5bf-42dd-bc29-bb26de22a998,Jenet Brooklyn,I'm tired of placing orders and bring told that they're shipped only to get a notification that they need a payment revision and my stuff isn't actually coming!! I ordered birthday invitations for my daughter's party and they won't send them after I paid,1,0,24.17.0.100,2022-09-26 04:03:20,24.17.0.100
5ffb5c12-0b9e-4fba-b6f2-c40a4d405ad7,Mikhail Erdman,"The worst customer service which I ever have. You always talk with the robots, and if your case is not in the robot scripts you simply cannot solve it. There just will never options to talk with a human.",1,0,24.17.0.100,2022-09-27 14:35:10,24.17.0.100
98fc3713-63aa-488e-aadb-0bb54c79ce94,Anne Sheri,Delivery notifications come AFTER I open the app. What's the point of having push notifications if I have to constantly open the app?!,1,0,24.15.2.100,2022-09-01 21:49:26,24.15.2.100
8d7ba0c4-71cd-412d-9697-9a100320ca1f,J Somebody,Constantly changing to Spanish. Other than the fact I can't read it and have to constantly change it...the app is fine,2,0,24.17.0.100,2022-09-24 15:47:45,24.17.0.100
f92f3608-17a3-4f08-b203-249ac01da92c,Andrew Sides,"The app sucked before, but they went back to the drawing board, and in group discussion, found a way to make it suck even more.",1,1,24.17.0.100,2022-09-19 01:53:22,24.17.0.100
019b5043-bbc9-47dd-9acb-4d22d22f6c79,Jackattack,"Annoying ad when opening the app, eating data (doesn't matter if it's a small amount) eating away at my time. Did i say Annoying ad when opening the app ðŸ¤¬ðŸ¤¬ðŸ¤¬",1,3,24.16.0.100,2022-09-02 19:46:37,24.16.0.100
b0717bdd-8b5e-41b0-8ff8-20ef005c015e,Angela Gerger,I never installed this app on my phone. I don't want it. I don't use Amazon to shop. ever. I can't seem to be able to uninstall the app it is forced on your phone,1,0,,2022-09-12 23:46:09,
8f3280be-d5e2-47f4-8164-8408b416ad3e,Patrick Hagerty,"Horrible, absolutely a way to get your information stolen. I can't get anyone that speaks English United States of America in the North American continent that would care that my The items that i ordered were magically doubled in quantity and sent to the wrong address. Then the suspended my account so I can't find out where the packages went . Then I get emails Non-Stop about we need more information about your bank bank statement bank statement bank statement.",1,0,22.14.0.100,2022-09-17 21:16:59,22.14.0.100
919f2a5e-41ea-4d21-ad34-9b223f542058,Nicholas Sewell,Pretty good most of the time. Not a fan of the new advert for LoTR that shows every time you open the app!,2,3,24.16.0.100,2022-09-02 10:54:51,24.16.0.100
a629e4a5-a6e8-4575-8802-c7eddeb1f640,Larry,Everytime I open the app it's shows a lord of the rings ad that takes forever to get through. Super annoying.,1,6,24.15.2.100,2022-09-02 18:10:24,24.15.2.100
2b91a79b-96bb-4ed6-93af-d908d9459e39,Steve Kathcart,Pretty good. But most the time it says next day if ordered by a certain time . Then they send update that it's delayed 3 or 4 days. And I paid prime for this...,4,0,24.17.0.100,2022-09-25 19:12:17,24.17.0.100
f8848e49-7d2a-4af7-b1a7-53093e5648ad,John Adams,"Every time this APP comes up, it's in Spanish. I've changed it to English at least 25 times but it still comes up in Spanish.",1,0,24.16.2.100,2022-09-14 16:21:56,24.16.2.100
99c4f113-72af-431f-81fb-a087e3603a85,Charles Bronson (CNorris),The search bar willl clear out the text when i try to paste after typing. So i cant type part of a search and past the rest. Super annoying.,3,0,24.17.0.100,2022-09-30 01:17:33,24.17.0.100
e9797b9c-5248-4c36-9021-dc65f2733cff,Douglas,Amazon is the worst app ever to buy from if you use a gift card that you want doing surveys they will bend your account they gave it to me three times and it's BS I mean for real who's going to steal a $5 gift card that's stupid,1,0,,2022-09-26 21:29:43,
b9e5498a-4465-4af7-aa28-11dbe3625892,Jen B,"What the heck? I can't buy Kindle books on my Amazon app now?! Why...so lame and inconvenient. What next, no movies or music?? Ridiculous.",1,0,24.15.2.100,2022-09-01 00:04:30,24.15.2.100
c4283675-cee6-4fc1-abea-04dee6e65d02,H. Alejandro Corona,"Ads in your app? I pay for a service from you, not like I'm receiving the service for free, Lord of The Rings ad upon opening the app, freaking stup*d. We pay for service not for ads",1,5,24.16.0.100,2022-09-02 17:29:02,24.16.0.100
2a30814b-745b-4d60-949d-207aa0deb494,Christina W (QueenAzazel),It shuts down as soon as I go to open it. Makes my phone glitch out. I didn't have this problem until I went to redownload it.,1,1,24.16.2.100,2022-09-09 14:59:06,24.16.2.100
d1f95f9a-012e-4cff-b597-e9dc8750dda1,Travis Marquardt,"Forced to watch a damn ad when you open it up now. I get you spent a lot of money on Lord of the Rings Amazon, but I don't care.",1,3,24.15.2.100,2022-09-02 05:11:17,24.15.2.100
04cc4999-655e-426e-9753-4078d212ad4e,Dale Forrest,The app works. It does not obey dark mode setting. The user interface is mediocre. No tablet layout...,2,0,24.16.2.100,2022-09-08 12:22:21,24.16.2.100
d6a749c8-fc0e-4520-85be-723b11a05f9f,James Pierce HD 720p,Amazon shopping is awesome Because has sale for anything best deals for the good price! And like for example if you want to get your yourself a atsc 3.0 next gen converter box like the HD home run like the best deal the price will shrink on the HD home run if you purchase it up on Black Friday or Cyber Monday!,5,14,24.16.2.100,2022-09-11 19:40:09,24.16.2.100
409a61ef-80c9-43ca-a1ef-78e0a55e7488,John Doe (Teamrealll32),Amazon continues to marker orders as delivered that never even get delivered. I had a package that they marked as delivered and when I called they stated the driver marked it as delivered but it was still in the truck they said it would be delivered in two days but still was marked as delivered still never got my package. Even now it's still marked as delivered but they never even came they should be fine for false advertising,1,1,24.17.0.100,2022-09-23 09:24:12,24.17.0.100
b88aad2d-f5e7-47ae-8cb7-2db309e6cdac,Evan Bristol,"I was going to give one star because I ordered a package and it was delivered to the wrong house. Not just the wrong house but none of my neighbors. The handler took a picture and it was at a house not even on my street. However the lady who took my call was very polite and prompt. She offered replacing it or refunding. I chose replacement, but only because she guaranteed me 1 day delivery. So 24 hours to get it? Heck yeah. Now if I don't get my package tomorrow, your getting one star!",5,0,24.16.2.100,2022-09-16 04:31:23,24.16.2.100
80417ffc-6f55-4a4b-9229-564b5c8a13dd,Testimony Omokaro,"I can't see my wishlist and other stuff , i thought it was my connection but then when I downloaded the app 2 times again it didn't work",3,1,24.14.0.100,2022-09-10 16:39:44,24.14.0.100
1ef12f1a-37d5-4b3f-9dc5-c83969802776,Adam Jacques,The app is still a poor performing and janky web view app. Full screen ads when I start the app? Really is Amazon that desperate for ad money? Come on,1,10,24.15.2.100,2022-09-03 03:35:26,24.15.2.100
b88d96c9-6629-497d-824e-afdcd3a27819,Gerald Bowman,If you need something you got a 99.9% chance the Amazon will have it Top Notch service excellent return policy and had other added benefits such as Prime video and subscribing in my opinion you can't go wrong,5,0,24.17.0.100,2022-09-15 22:42:01,24.17.0.100
bdf7fb1e-398f-4213-978f-5ac98eb7df4b,Bones â€œcjâ€,"Always great no problem, great shipping fast delivery, tracking works great , highly recommend",5,1,24.15.2.100,2022-09-02 18:25:38,24.15.2.100
cf600bf7-2a16-45ae-8463-f54c7619585e,Hammad bahman,Laetly when i add items tonthe carts and prepare to checkoutbit shows empty.. but itbshows items counters in the logo . Till reinstall the app it work .. ot happenes everytime since 3 weeks ago,2,0,24.16.2.100,2022-09-14 11:43:46,24.16.2.100
4a3bb6c0-74d9-473b-ae93-59724c01de89,Joseph Smith,"They want you to review the products, but when you give an accurate review they block you from posting. I never used any foul language in my reviews so it wasn't for that.",1,1,24.16.2.100,2022-09-11 21:08:43,24.16.2.100
631f5c6e-6965-4310-b750-d4eaf99a5cc7,Jeff,I hate Amazon now! Amazon is blocking renting movies on Google TV and trying to force consumers to use their app or website for rentals so they can weasel out of paying Google license fees! What a scummy company Amazon had become,1,0,24.17.0.100,2022-09-18 00:08:33,24.17.0.100
3c691da9-420a-4c12-b83e-d77104fe5114,Chadd Walters,I would like to know where the buy now option went . This seems more cumbersome to now have to add items to your cart then purchase them,2,0,24.17.0.100,2022-09-27 22:57:54,24.17.0.100
eedca431-1d5f-4e95-bbe5-61dfeb4dd7a1,Chris,I am a prime member. Forcing me to watch a lord of the rings advertisement just to open the app to check my orders is unacceptable. I have already paid to use your app ðŸ˜¡,1,3,24.15.2.100,2022-09-02 10:08:14,24.15.2.100
375e4062-dcb1-417e-8cd5-1acecfd54848,Hel,Works fine and I like the fact I have a very quick shortcut to amazon and has everything I need on it.,5,1,24.15.2.100,2022-09-03 11:14:02,24.15.2.100
d8b902ed-e21c-468f-85ac-a93db0a712c0,Nick Negusse,"Usually fine, but recently has started using 100 megs of mobile data randomly every hour.",1,0,24.14.0.100,2022-09-04 02:47:48,24.14.0.100
bb6d947b-2add-413d-a4a2-cf6354cce464,LETRIC Studios Chase Nichols,I use this on both my phone and computer but for some reason the 2 have completely diffent prices and the lists I made on computer are not on my phone,1,0,24.16.0.100,2022-09-01 21:41:23,24.16.0.100
c52a35d1-2596-419b-a2c5-ace2a0820aaf,Nobody4pink,Have to watch an add before you can use the app now. . . I thought I was paying to buy stuff not paying to watch adds.,2,3,24.15.2.100,2022-09-02 19:38:26,24.15.2.100
137c320b-44e2-4714-93a1-82cd118d5b8b,Emily,"Jesus Christ the Lord of the Rings ad almost had me uninstalling the app, if this becomes a regular thing I can guarantee you're going to lose a lot of customers.",1,1,24.16.0.100,2022-09-03 17:15:50,24.16.0.100
c9fb095a-fe5b-4364-aee3-f5737dbfaf74,Florian Lauckner,Bad security issue: It is obviously not possible to keep kindle login to read ebooks without keeping shopping log-in with permission to spend money!,2,1,24.18.0.100,2022-09-30 23:36:37,24.18.0.100
0df0d896-7b95-442d-a8c7-47785223f205,Lisa Conklin,Has some trouble loading from time to time. Really sad that this is the only way I can buy the books I enjoy and not straight from the Kindle app.,3,1,24.17.0.100,2022-09-25 22:02:44,24.17.0.100
d301b061-5b7e-4641-8212-d721c8d36bae,Tiffany Kristen Monday,Poor.. this app is requiring an update...& will not allow me to update!!..So i gave up...have not ordered for 2+months( because i can't!!! This app is not user friendly...at least not for me!),1,0,20.6.0.100,2022-09-28 21:52:41,20.6.0.100
11daa4bf-af35-4cc5-9129-6b97ac2e3495,Alex Ram,Puts me on holf and Keeps asking to verify if the card is mine and when i do it dosent work yall shutdown my account and also every time i make a new account it does the same thing every time.,1,0,24.17.0.100,2022-09-16 01:42:27,24.17.0.100
85e18e44-0ca0-46ef-8f1e-66243501cf4f,R S,Forcing me to watch ads for Lord of the Rings before letting me access the actual app is a quick way to get deleted from my phone.,1,7,24.16.0.100,2022-09-02 20:32:20,24.16.0.100
3d4842b2-c934-46b7-84a6-974fac04cabe,Suzzanne Marie,"Do not update on your phone. It now crashes my phone, I can't order or check orders. Online it says I don't exist. Nothing works now!!!! I can't uninstall it, or do anything",1,0,24.17.0.100,2022-09-21 19:29:28,24.17.0.100
d5c2d28c-9bc9-4fa2-8d86-5d2e09e76a55,Jake Allen,Forced to watch ads before I can use the app. I'm literally trying to spend money but not until I watch an advertisement?,1,3,24.15.2.100,2022-09-02 23:08:01,24.15.2.100
1696319a-87b2-44de-899f-a870e00c862f,Ana La Paz,"Your ads are so prevalent and so obnoxious that I'm reconsidering my use of this. I don't want to support such a pushy, needy, bossy company.",1,0,18.19.0.100,2022-09-23 01:53:53,18.19.0.100
5d563112-841a-4e60-9374-97400853cd4e,David Pankin,I like shopping on Anazon and they usually meet my needs. I think prices are good and they make shopping easy and convenient.,5,0,24.16.2.100,2022-09-08 15:21:34,24.16.2.100
