reviewId,userName,content,score,thumbsUpCount,reviewCreatedVersion,at,appVersion
fb4d0562-0019-439a-9f0b-7c95e7c34417,Jackie Dunnagan,"Don't buy!!!! I'm 99.9% sure that this third party private seller is having these rebuilt or buying them with the forknowledge of and with non Microsoft certified hardware,which is not at all difficult to do. They will of course deny this. I am very familiar with hardware and the Xbox console. Even the interface is different and it lags doing the most simple of menu tasks . Not to mention the loading icons and colors are all slightly different to the trained eye. Amazon is USA,s ALIBABA.",1,6,22.20.0.100,2021-10-17 13:51:49,22.20.0.100
b0cf32e0-6b6a-407c-81cb-123032549a2d,Winter Harvest,"The Amazon App freezes a lot some of the built-in additional features don't work at all. The app is constantly closing on its own. Additionally, when trying to retrieve my saved list it doesn't scroll it's freezes. And then the app closes so it makes it really difficult to shop for hours at a time and make a purchase. There's a ton of bugs in this app",2,4,,2021-10-30 08:05:29,
aa285cee-f5d9-495d-aee4-62ecc6d95d51,Rachel Dunning,"Prior to the new UI update, I could easily navigate and purchase items I was interested in, now the UI is now garbage; it has been oversimplified to the point of being unintuitive. Instead of a sidebar with useful options listed, there are now just three buttons at the bottom. I'm now stuck pressing button after button trying to find menus that were previously one click away. And if I want to go to the home page, I can't just press home, I have to back out of the menus I entered previously.",1,276,22.19.0.100,2021-10-07 18:16:45,22.19.0.100
e63a2df5-3bf9-4b95-bd95-61b849209a77,Donna Silvio,"I love & use Amazon for so many things, like getting my energy drinks sent to my house. But the app freezes like crazy. If I'm looking at a product w multiple variations it'll freeze up entirely as I click to see the options. Or it'll make the item pic sorta hazy so I can't see the color properly. Or I can't scroll thru the pics to see multiple angles. Sometimes just the item pic freezes, but I can still click the bottom icons. And then it'll just spin trying to load a screen. Needs fixing.",3,100,22.20.0.100,2021-10-25 19:15:05,22.20.0.100
f498971d-1cd4-4821-8c26-edeab6753677,Jessica,"New update caused issues with browsing options. When you click on what you want to look into further, trying to explore other options (different colors of item, sizes, shapes, and so on), it doesnt load. You arent able to see the picture clearly, swipe them, or enlarge them. The only option is to purchase and you are unable to save to favorites. Its very frustrating. Please fix soon! Thanks!",2,287,22.20.0.100,2021-10-19 03:46:34,22.20.0.100
a53044dd-4a3a-4673-a434-afb8e1cf12d9,Raven Kennedy,"Would be better if it responded the first three times you clicked on something. It does my head in when I try to click, for example ""add quantity"" and it doesn't respond, only to then click on something completely random. Or if i add something to a list, it takes several goes before it comes up with anything. I get frustrated with this a lot.",3,121,22.19.0.100,2021-10-15 09:00:28,22.19.0.100
077376e5-e634-4563-9785-b1bbe627e021,April Slampak,"I shop on Amazon a lot. But this last app update is a disaster. I don't really like the new interface, but I know I'll adjust. The main issue is glitchy things. I can't scroll through my wishlist anymore. It's stuttering and won't actually scroll down. The whole app in general is so slow to load now and going between sections of the app is a mess.",2,209,22.19.0.100,2021-10-07 15:09:24,22.19.0.100
72304489-a079-4f00-a094-e92891aa6ee9,Mariah,"The products are good quality, never had any complaints. The issue I'm having and it's only been lately is the app. It takes longer to load and I have great internet service so it's not that. The app seems to freeze sometimes to the point when I was trying to add something to my cart I had clear the app from my recent apps and start all over again. It's just frustrating because I pay for prime and apparently I'm paying for an app to work decently half the time hopefully.",3,110,22.19.0.100,2021-10-08 02:59:26,22.19.0.100
e4320154-4182-4e03-a977-b60dada9fdbe,RJ McCall,"Not a fan of the new UI, but it's decent. The really bad thing about the last update, is items that have choices are now broken. You can still choose the other options, but once there, can't scroll through or click on the picture to see the multiple pictures. Seems to be every other option on a page will have this issue. Please fix this ASAP. If I can't see all the pictures to compare, I won't buy. My household approaches 6k spent yearly on Amazon.",3,0,,2021-10-07 08:57:28,
4e755d68-889d-4b66-8c53-dc391d43702d,Salma Shami,The app keeps freezing and each item takes 5 times longer to load. I can't back out or do anything until it unfreezes. And that happens in every screen for every item. I have to go do something else while waiting and waiting! Very frustrating and inefficient. It's faster to get in my car and go shopping at a store for what I need...,1,4,22.17.4.100,2021-10-15 06:37:20,22.17.4.100
d26e3aee-da7d-4ef7-9e24-2621141bba85,E A5,"Love to shop on Amazon, but the app needs fixing. Lately, when on an item multiply color available, can't bring up the next, only a faded color version shows. Other issue, is a deal breaker. Many times getting just a blank page, as the item trying to show up. Only a restart of my tablet make it work, but happening too often. For years, never had any issues, but this is way too annoying. Please Amazon, pay attention!",3,240,22.20.0.100,2021-10-17 12:00:33,22.20.0.100
4a1cf88b-95f1-4fb4-b2af-f2169fc8c00e,Shá Dee,"I've had this app for years, but recently the Compare prices feature has stopped working altogether from my list. When I add it to the shopping cart that's the only way it works. It isn't the products that's the issue, it just one day stopped working. Tracking packages feature could also use some work. It had trouble scrolling and keeps popping up that ""something went wrong"" when clicking list or products.",1,68,22.19.0.100,2021-10-11 16:14:02,22.19.0.100
a00f4667-664d-4bab-92ef-ea99f9d0bd6e,Moonlit Honey,"Hate it! Scrolling isn't as smooth. Trying to look at my wish list and I can't get past the first 2 items. It takes forever for an image to load. Adding something on a wishlist is hard as well. The heart takes forever to turn red to add an item. Then you can't view any items because the wishlist does not work. Ever since the update, this app has gotten worse.",1,90,22.19.0.100,2021-10-11 16:21:05,22.19.0.100
b8aa25ba-f532-448d-b9d9-90c869327ae6,Stevie thunder,"I don't if it's just my phone, but every time I put it on in the morning and it doesn't matter how long I leave it, when I open this app it always opens up to a white screen and does nothing then I have to shut the app down completely, then re open it and it works, very frustrating 😤. My phone is S9 plus android 10 If it's the app hope for a fix please. Thanks.",3,17,22.19.0.100,2021-10-10 11:39:57,22.19.0.100
94aa3095-06b3-4079-a956-c84080721af9,Jackey Carkey,"Don't love it, don't hate it. The app works all right, but sometimes it gives me an error after loading the page I want. Being a prime member not everything is delivered in the promised 2 day delivery. Even if you check prime when searching, the search tool is awful at filtering that out so when you get to check out, you're annoyed and disappointed and have to look again for an actual prime item or risk not getting the third party seller item if shipping isn't ridiculous. It's just all right.",3,25,22.19.0.100,2021-10-11 13:44:43,22.19.0.100
6f578072-1c72-433f-b4b7-6febd8682367,Jordan,"Recent updates does not allow you to browse different color choices and/or options, swiping through photos is unreliable. Many times trying to swipe through pictures, the app won't even respond. I now tend to just open the web browser and browse Amazon that way. Pretty worthless update. I'm using a Pixel 4A, and it is not my phone. I have no trouble browsing the web version of the Amazon site.",1,61,22.20.0.100,2021-10-20 23:39:51,22.20.0.100
96b7ae4e-0010-4224-bba9-3234028fa541,Lauren Walker,"Love Amazon shopping, but this app is a disaster and always has been. It's never gotten better in all the years I've used it despite the updates. It's slower than the old dial-up internet, it frequently freezes, scrolling often isn't smooth, buttons aren't always responsive, and the pictures and videos not loading is a common occurrence. With all the money Amazon makes, you'd think they'd invest in a functional app.",1,256,22.21.0.100,2021-10-28 21:53:43,22.21.0.100
074c663c-89ad-431f-bde3-a5b9035d4c71,Matthew Bolstad,"What happened Amazon? Last few months this app has become plagued with bugs. Deleting/moving items in lists can take up to a minute for the 3 steps! Pages will disappear, and upon an auto-reload, it defaults to the home page 😒 Search results are a joke at times, the auto-correct does nothing to ""correct"" your search terms half the time. Someone, please, consider an overhaul of the front-end of this app. Trying to scroll within lists causes ""jumping"", where it wants to scroll the other way! Ugg.",3,44,22.20.0.100,2021-10-22 09:39:49,22.20.0.100
ad5c04b6-dd04-4245-b69c-4653bf2ea4ad,Mike Bishoff,"Dreadful Update since Sept 2021. The app is now slow, common uses come up slowly and are not logically placed. I've been using the Amazon app for years and this is by far the poorest update ever. For example, finding order updates is now a multi step process and slow. I don't see any advantages of the new UI. The logo change last year was poorly executed as well.",1,2,20.9.0.100,2021-10-05 18:52:13,20.9.0.100
db1c95bf-3262-4bb4-855b-f9211af560b5,N. A. Wennerholm,I have found with the vision issues I have developed for the last year or so. It has been becoming harder to read and see the print is to light. It would be nice if you incorporated a dark mode where black background and white print I find easier to read. Plus those with dyslexia also do better with dark mode for which I do have and has been acting up as well plus it would be nice if you also incorporate the ability To Adjust text size and style along with text to speech.,3,29,22.19.0.100,2021-10-11 21:17:54,22.19.0.100
da4c43dd-351f-4846-b657-f50cb44b3181,NNA,"The latest update is horrible. I shop on Amazon because I have a wider range of product styles/colors/better quality for what I need/want at reasonable prices instead of having to settle for what's available at the local store and cost twice as much. The design before this latest update was perfect and user friendly, but now, it is just awful.",3,94,22.19.0.100,2021-10-07 15:56:53,22.19.0.100
73c4a9a3-4e80-4fe3-b6e2-eedff284c6a4,Çınar Sovány,"The app had become progressively slower with recent updates, but still usable. The Oct 6th update however has now made it almost impossible to use. Scrolling and navigating through menus and pages is a struggle, with pages sometimes even freezing altogether. I thought it was just my 3 year old phone struggling, but even a much newer phone with a much more powerful Snapdragon 765G chipset is struggling. Going back to the website for now as I can barely use the app anymore.",1,67,22.20.0.100,2021-10-17 22:43:04,22.20.0.100
77a81c38-e877-4c9d-91b4-ed4322d541aa,Rachel Cooper,"Stop changing the layout of the app and now you have made it nearly impossible for me to return items that either didn't work or weren't as described. I have been super disappointed with Amazon these last few months, between items never arriving and now trying to do a return. The fact that the app keeps crashing and pages won't load properly make it all the less appealing.",1,477,22.21.0.100,2021-10-31 18:14:12,22.21.0.100
203b049d-fc03-49f4-8ad4-6dffd9bb9578,Nymphia Nunes,"The app works great, makes it all so easy to find what you need. But I am very disappointed with the payment (checkout) procedure since past 3-4days. It just keeps declining. I dnt know if its the payment gateway error or something to do with amazon, but after complaining all I hear is that I might have made a mistake in entering the details. This issue is for Amazon.in",2,0,22.1.0.100,2021-10-21 14:20:59,22.1.0.100
4d400800-ddd2-46d2-8973-f90c6e57294c,Staines Mom,"Since the update beginning of May 2021 the app performance is terrible. Lag times in searches, can't always see past orders and subscriptions. Very often get the 'uh oh something went wrong on our end' message. Revert back to the old one for goodness sake, at least that worked. Edited October 2021 - still issues. Pretty much useless unless you have wifi on, so then what's the point?! Frustrating and annoying. Come on Amazon, put some of your profits into creating a usable app.",2,31,22.19.0.100,2021-10-10 02:56:40,22.19.0.100
5085cfdb-db2f-4cf3-b973-1787ee350213,Mike Cohen,"Ever since the last update, app is mostly useless for shopping. When viewing an item details, app completely freezes after about 20 seconds. You can hit the back button. But then it no longer receives any more data from the internet. So you get a lot of blank pages. You have to close the app and reopen it. But if you go back to viewing an items details, it freezes again. Currently the app is only useful for viewing your account or tracking a shipment. It does not freeze doing those actions.",2,317,22.20.0.100,2021-10-19 15:40:22,22.20.0.100
eb9899c1-2828-4d0c-8083-0b3011493b53,Jerri Noll,"This last update has been a pain. Keeps freezing, glitching, can no longer see the different prices on colors/sizes without clicking on each item and option. Used to be great. Because of all the issues, I've spent a couple hundred dollars on other sites because I've been frustrated with Amazon and not willing to restart my searches 30 times to get 1 item.",3,217,22.19.0.100,2021-10-10 16:23:26,22.19.0.100
2d1d867d-5a2d-49f5-a284-6a42ca7e7282,Joe Godfrey,"If you want to buy something you have already/ text searched for or that Amazon suggests it's great. If however you want to browse by category there is no option anymore. Scroll all the way to the bottom for 'all categories/depts/ it just takes you back up to the top of almo st an identical page, no way to pick, books, clothes, pet products, hardware, just loads of things you've probably already looked at, but no easy way to just shop without an algorithm directing you.",4,65,22.20.0.100,2021-10-20 00:51:46,22.20.0.100
da352f3e-adc8-4e07-b534-0def677f5904,Jaded Irish,"App constantly freezes and pics won't load. I'm using a new Samsung Galaxy S21+ . All other apps work fine. Home page content isn't consistent or relevant. Frequent programs shows programs I've never used! Deals constantly refresh and you lose your place when browsing. When shopping after style ratings, most items are currently unavailable. I buy most household items and toiletries through Prime. Lately I just get frustrated when shopping and give up. Also, too many scam sellers.",2,30,22.19.0.100,2021-10-07 09:33:25,22.19.0.100
7128cb3d-a74c-4110-ad44-8ba013fcf986,joecollins1313,"When it works, it's good, but only slightly better than just using the website. However, the app crashes a lot. I can normally look at an item page for 3 seconds before I get a picture of a dog and the words ""Uh oh - Something went wrong"" This has been the case for months and months. I find it easier to visit the website in my browser, but doing that will often mean the app tries to start up... It's a pain.",3,129,22.20.0.100,2021-10-28 05:53:34,22.20.0.100
733e5188-b3b8-4afe-aca4-d30bb690421a,Ember Foster,"They've removed a lot of the clutter to streamline the app, but in doing so, they have also managed to remove entire features. Would you like to browse by department? Sucks for you. Want to search something specific? Sorry, Amazon's search algorithm is still hot, salted garbage. Much functionality available on desktop is either hidden under a maze of unnecessary menus or absent entirely. The app is actively hostile to use.",1,12,22.19.0.100,2021-10-10 07:55:52,22.19.0.100
878cb7c2-28ac-4275-bdaa-1a4394c0709a,John Ly,"Dang Amazon app at it again... They won't allow me to change my default list anymore. Had that option on the old app, idk why change it -, - everything is out of place and you have to tap then hover then tap then hover again just to get to a simple area, the old app is a click of a button. Smh 🤦🏻 Update: 10/19/2021 Thanks to the new update, whole looking at item photos, it's sooo slow it freezes and takes a while to view the next photo. Please fix Amazon. Dropped another star.",1,22,22.20.0.100,2021-10-19 19:31:14,22.20.0.100
ff93a7e4-38b8-49d5-aca5-c0e91a200d1f,Norgas D. Serrin,"Overall the app is pretty good. But there's a glitch that I really want fixed. Sometimes when I scroll down one of my wishlists it doesn't let me scroll smoothly. I scroll and then it stops, then goes, then stops and makes it very annoying to try to make it down my wishlist. Sometimes I don't even try to make it all the way down. If you can fix this, Amazon, I'd really appreciate it.",3,205,22.19.0.100,2021-10-09 16:59:18,22.19.0.100
feca2aac-2fae-4b89-9b78-5dedb516110e,S Taylor,"The person who said it is working flawlessly is either a liar, or works for Amazon. The updated app keeps glitching: can't see pricing for all colors, it gets stuck on a page, won't scroll, won't go back, goes to error screen. I spend so much time force stopping the app, only to have it happen again IMMEDIATELY, that it isn't convenient anymore. Bezos is raking in the cash, only to provide services that are getting progressively worse. I'm going to the store, could use the vitamin D anyway.",1,306,22.20.0.100,2021-10-15 12:33:36,22.20.0.100
f67ef150-d62c-440d-b9c3-f32b4594d1b5,Bob McCann,"Refreshes view every few seconds when looking at deals, which moves where you are on the list, and by the time you get back to where you were, it refreshes and does it again. If you want to make sure people will give up and close the app instead of maybe buying something, design your app like Amazon's. If you actually want people to stay on your app and use it, look at the Amazon app for examples of what *not* to do.",2,239,22.19.0.100,2021-10-03 17:23:27,22.19.0.100
1f091ab6-39b9-4bed-8fd7-1e88b5e40e7d,Maria White,"As per other reviews - lately the app isn't running smoothly - takes an age to load a page or won't at all - also when clicking on different items the page doesn't load - just not smooth or fast enough and makes it a very frustrating experience, especially when I'm paying monthly for the service. I think the whole app needs a modern retake/refresh on it. (P.S - Please change the logo, or give a choice of different styles - really don't like this one 😔)",2,45,22.19.0.100,2021-10-08 07:40:32,22.19.0.100
472dfb06-e594-437c-8539-569547fefbee,Kimberly Zacha,"Installed the app so I could chat with customer service. The app not only lagged, but my cursor would jump all around the page. While I was typing my message random prepared replies would enter the conversation. I never got a reply to what I wrote. I ended up uninstalling the app since I couldn't even use it for its intention. I'd give it 0 stars if I could.",1,1,20.13.0.100,2021-10-23 16:56:59,20.13.0.100
304e7eac-d831-4fb5-b2d0-3329707c8f5d,ПГ',"Laggy and clunky. Awful functionality and UI. Search filters does not work properly and on purpose shows irrelevant (pushed by Amazon) items. Prime subscription is fine as long as you use few services and like convenience of Prime delivery. But other services like Prime video, books, music, etc is sooo meh... Really depends on how you use it.",3,9,22.19.0.100,2021-10-11 01:17:49,22.19.0.100
ecadf545-708f-491e-97cf-c7310cebf198,Karin Lickers,Never had an issue until tonight. Clicked a link on social and redirected to the app. Out of the blue it changed the language from english to french. Figured out how to change it back by googling it and thankfully a link that took me straight there and selected English and saved. Appeared to work until I left that page and it's still in French. Went back and tried 3 times to get it to save and it doesn't. Had to uninstall and reinstall to fix it.,3,35,22.20.0.100,2021-10-16 01:35:25,22.20.0.100
16e82683-6f52-4dd6-8e8d-eacbb9e909bf,Michelle Pouzol,"Love amazon, but after update I can no longer use voice to text option and only the Alexa option and it cuts me off half the time or doesn't get it right when I try to speak and say what I'm looking for. I have severe arthritis and typing is hard and painful for me so I depend on voice to text. Ironically I do not have this issue in Chrome. Only in the app so until the issue is resolved I'm reducing my 5 stars to give three stars to an app I love very much but not happy with currently",3,32,22.20.0.100,2021-10-24 21:19:13,22.20.0.100
e8314a34-e54f-40da-aecb-6b7b84d74d81,curtis wilson,"It's slow AF! When they redesigned it, it made the speedy process slow AF, and those delays of making the next screen is horrendous! Whoever came up with all that loading time in the programming needs not only more training, but their *ss whooped! It still works, don't get me wrong, but that's why the 2 star drop, the speed vs the old way.",3,34,22.21.0.100,2021-10-28 14:16:40,22.21.0.100
407bf4ab-5896-4ab4-a4b1-1749ecea39de,A L,"Annoying UI design created to maximize clicking and increase browsing time. Examples: 1. It is ridiculous to get a smaller number of results when you sort by price low to high, vs. high to low. 2. No back/return arrow if you use a phone with swipe enabled navigation. So if you swipe left, the app will completely exit your search, and bring you to the home page. You cannot return to your search. 3. Printing. It is 2021 and the app redirects you to a BROWSER sign in to print labels.",1,90,22.19.0.100,2021-10-05 17:12:45,22.19.0.100
df14c3b8-fe42-4654-85b4-428dbe675705,b meyer,"the ""auto-renew on/off"" and the ""advanced controls"" links, used to cancel prime channels in ""manage subscription"", are no longer listed in the list of prime channels. i had to call amazon to cancel auto-renew. they are constantly making changes to the moving the subscription menu to the extent i suspect amazon is purposely doing this as an impediment to force the customers to keep the channels out of frustration for having to figure out their ever changing access to managing subscriptions.",1,34,22.20.0.100,2021-10-23 05:32:52,22.20.0.100
b6155ff3-ed87-4df6-9015-03b43b5431d8,Matt Black,"Honestly this app is kind of a mess. It's got a lot of nifty features (barcode lookup, AR clothing... etc.) but it's bloated, slow, and clearly has a memory leak because it gets progressively laggier the longer you use it. Bizarre requirement to turn on ALL notifications if you want to order through Amazon Smile. There's potential but as it stands this is a downgrade from just using the website, even on mobile.",2,13,22.20.0.100,2021-10-20 10:53:01,22.20.0.100
430b9d68-544a-4c4c-9f7d-c4fd6d1e8986,Rick Kross,"The Last 2 AMAZON APP updates performance wise are horribly bad! Laggy isn't a good enough adjective to properly describe the screen freezes, the unresponsiveness of this app! I mean my wife and I can't even swipe through pictures of a product on both of our phones without it just staying Frozen, until it eventually moves on its own! Both of our phones have the App updated and our phones act exactly the same with this app!So it is clearly the messed-up software of this app! Need New Developer's!",1,16,22.20.0.100,2021-10-16 20:32:02,22.20.0.100
521badbb-d018-40e5-8491-6d0d6dd7a8f3,David McClain,"When you select music category from the top of the home screen it tries to get you to sign up for Music Unlimited. There is no way to close this offer screen, so there is no way to browse music. This is asinine. Especially as the music app no longer lets you shop for music within the app. Not having a way to provide feedback within the app is also poorly designed.",1,134,22.19.0.100,2021-10-15 02:10:36,22.19.0.100
36dfa7b8-163b-4f1a-ac91-621464017669,Brenda K,"My app on my Samsung Note 20 stopped working a couple days ago. I've tried uninstalling and reinstalling, but it didn't help. The app opens, but all I get is the picture of the dog saying ""oops, something went wrong."" And a ""Go Home"" button. If ai click the ""Go Home"" button, I also get the picture of the dog and ""Oops.... Something went wrong."" I have not added any recent apps or changed any settings on my phone at all. The Amazon Shopping app on my phone is totally unusable and worthless.",1,178,22.20.0.100,2021-10-23 15:58:09,22.20.0.100
3c0f40de-7198-4901-8b98-dcb74f27fbba,CP,"Since 10/23 the shopping app is having A LOT of problems.. freezing, lagging, reloading old items just stop functioning intermittently after a few minutes of seamlessly working. I'm constantly having to restart my phone because it just freezes. I've tried changing connection from WiFi to Mobile Data while on the app and it doesn't make a difference. Hope the developer can issue an update or fix soon because I do a lot of shopping through this app. Never had a problem until now.",1,54,22.20.0.100,2021-10-26 16:47:26,22.20.0.100
c1da0474-dcfb-4544-9b4e-7957074a9b98,Stephan Peters,"I used to like it a lot. I had to change phones to something that worked better in rural areas (Galaxy S7 Edge), and Amazon Shopping no longer works on that Android OS version at all. Too old or something. That surprised me! Anyway, I downloaded Walmart and NewEgg to try. They seem to work fine. So, I guess it's no big.",2,1,22.18.0.100,2021-10-21 02:55:01,22.18.0.100
