reviewId,userName,content,score,thumbsUpCount,reviewCreatedVersion,at,appVersion
cdc6d762-87ca-4a9d-97e2-bbcd95c75885,A Google user,This app is a life saver for me. Being disabled and unable to go shopping in a store alone is impossible for me. This app allows me to browse and buy with great ease. I love this app! This year I did all my Christmas shopping here and the first time in 9 years my family didn't know what they were getting for Christmas. I have had a couple issues with delivery and Amazon addressed them instantly when I reported them. One billing issue we'll see how they handle that today.,5,1,18.21.2.100,2020-01-14 15:53:46,18.21.2.100
aa4d90fb-11ad-437d-8b70-a0d739ce96ea,A Google user,"Signed up for Amazon and ordered product with no issues and credit card charges happened like they should have. Then a couple days later get a email from Amazon saying my account is suspended cause of a bad credit card. The transaction went thru on the card just fine and no there is no issue with that card. This is the 2nd time in the past couple years this happened with them so go ahead and suspend it I will take my money else where. SIGNED A VERY ANGRY ""EX CUSTOMER""",1,0,,2020-01-23 22:12:34,
54a6d33c-c673-4adf-a7f8-b4c2b382de46,A Google user,"No way am I giving it all the permissions it wants!!!!! For instance, it wants access to all my contacts!!!!!! Amazon can go to hell!!!!!!!!!!!!!!!!! But then, I hate Amazon because they are trying to drive all other places to buy anything out of business, and take over all shopping on the planet, while paying zero taxes on its enormous profits. I never buy from Amazon if I have any other option.",1,0,20.1.0.100,2020-01-20 01:23:09,20.1.0.100
e9433f54-f14c-4490-bf64-3173b7301cf5,A Google user,"I don't use this app and it can't be uninstalled, I hate when certain phones have apps / app sponsors make it mandatory for the phone companies to put apps on your phone that are permanently installed, regardless of weather you use it or not. I understand that some of them do support some of the things you do use, so you have to have it installed but why can't it be part of the programming system instead!",1,0,18.8.0.100,2020-01-03 00:30:53,18.8.0.100
3cbc7202-d264-4168-9a5e-1d61e659ce20,A Google user,"I am having problems adding items to my cart with this app, specifically the New & Used button choice does not work for me. The app will show, for example, there are 28 new and used choices, but when I touch that button to access them, nothing happens. When I login and use the Amazon site through an internet browser on my phone, I can access that button and choose a seller for that same item.",1,168,20.1.2.100,2020-01-30 10:33:56,20.1.2.100
ef6049ca-42af-46b7-880d-3e65755ca51b,A Google user,"They locked my account, cancelled my orders and deleted all of my order history for no reason. Now it's like I had no orders or bought anything. I paid for overnight shipping only to wake up to all of my orders being cancelled and my account locked. This is why I never shop online. I tried to give it a chance but forget that. It's way more convenient to just go to a store.",1,0,18.21.2.100,2020-01-11 13:01:34,18.21.2.100
9099272a-b76c-4b37-afbd-69277027a213,A Google user,I had to give 1 star because it doesn't let you give less than that. I've had problems since the last update. I lost my prime icon and now i can't filter my search by prime items anymore. I have to click everything individually and it tells me the next shipping date. Basically the same as people who don't pay for prime... i called costumer support and they told they would look into it... still waiting to hear back ....so sad i night have to cancel my subscription,1,79,18.21.2.100,2020-01-11 21:29:27,18.21.2.100
6517a993-90ac-4b84-b310-ac3926313b74,A Google user,"I'd been using Amazon Prime for a couple years, but when I moved and the Amazon Flex drivers became suddenly incompetent to follow my very clear, very precise delivery instructions, I went to customer service. I've had more interactions with customer service due to terribly delivery way more times than I am comfortable with in a very brief time. Twice I was offered a credit to maintain customer loyalty for these bad experiences. Both times I was then told they couldn't honor their promise.",1,2,18.16.2.100,2020-01-23 18:10:08,18.16.2.100
e0010bb8-edd3-4e4d-a5ca-14652e43dd15,A Google user,"Changes to search and filters have RUINED this app. Having to tap next after only a few results only to lose the filter preferences, app autocorrects properly spelled terms into different words when I hit next meaning i lose what I was searching for, WAY too many taps to change filters, the same chinese items repeating over and over, no quality items in search results. Also, as of today crashes upon opening/ unusable. Customer service is USELESS or non-existent. It's like you want us to delete.",1,145,18.21.2.100,2020-01-10 18:59:18,18.21.2.100
a2bbe75b-7617-4b77-8cec-b0a3a53363f7,A Google user,I don't know if It's the app or the site... but its so slow i found it barely usuable. Amazon also could use a major site redesign also. It isn't very user friendly. Very frustrating to wait for up to 30 seconds for each click. It adds up.,1,10,18.21.2.100,2020-01-09 20:01:50,18.21.2.100
4772d855-babf-42b9-876c-f3f627f0ed3e,A Google user,"The app is just rubbish I can't believe that a company like amazon can't develop an app good enough for its products and customers. It crashes very often and every time I put what I'm looking for it gives me on the list items completely different, there are not many choices on the filter as you have through the Web site and even if you write bagpack for men it gives me Eyeglass Cases!!!!! ðŸ˜¡ With more than 10000 items to go through. Absolutely rubbish, it makes me furious...",1,10,18.21.2.100,2020-01-06 02:27:01,18.21.2.100
ce27318e-3fad-4967-ab31-1366f9b7df08,A Google user,"I just bought a gift card and had trouble checking out. I chatted with customer service for 40 minutes and they asked me to call. They told me I couldnt use the gift card without a credit card, I dont have one, it worked fine with every other amazon gift cards I've had. It said my total was $25.97, I had a balance of $26.03, I couldnt continue past the payment selection page. i removed an item and payed $5.99 for shipping instead of getting free shipping for having a total of $25.",2,28,20.1.0.100,2020-01-18 00:07:43,20.1.0.100
b2640196-0bce-4677-b630-0d58b3c2bbca,A Google user,"Been a customer for some time now and I have not had any problems with Amazon. When I did have questions I called the service department and immediately I was helped. I know that I can always depend on Amazon for any item I am interested in. As a Prime member things get even better. I also tend to do price checks even when I am in retail stores, alot of the time I can get a better price here on Amazon.",5,8,20.1.2.100,2020-01-28 01:53:52,20.1.2.100
ad1527b0-ed4c-4dfc-b8b4-29ac8f5449e4,A Google user,"How could you trust a company that will give you 3 different prices depending on you're search history? I looked up a key chain for mass effect on 2 cell phones and 1 pc, 1 of them give me the price for 7.99$ the other for 22.75$ and one for 10$. All these searches were done with in 3 minute of each other. Just because they knew I was intrested in mass effect they were going to charge me an extra 15$ that's like 1.8x the regular price. So freaking glad I do all of my shopping in stores",1,0,16.02.0.100,2020-01-18 03:21:43,16.02.0.100
64117951-2a60-41fd-a202-6ebd8c36e3cb,A Google user,"I did not receive all of the items orders, the delivery person left the paper bags on the wet concrete instead of call me or k locking on the door. I do not like the invasion of privacy that this app requires to be down loaded. Although I did like the way the complete list of premissions were hidden until after you down load the app.",1,1,,2020-01-28 21:54:16,
c3790549-22bb-4e25-aa95-c5efea222b71,A Google user,"It was great, up until I needed to save things. It has a default list, so whenever I have to save something other than the list, I have to change the default list. Can you make a feature where when you try and save something it popups with all the lists you have and you click on the one you want?",4,0,16.20.0.100,2020-01-12 04:06:22,16.20.0.100
10928e66-76ab-44ce-94ee-029a8861c23a,A Google user,Frustrating. Please change the filter feature on the search so that you can select more than 1 filter option at a time. As soon as you hit any filter it automatically refreshes the results and it takes forever. I want to be able to set all of my filters and then hit 'Done' to refresh my results all at once.,2,28,18.21.0.100,2020-01-05 06:44:20,18.21.0.100
6177dfe0-81d9-4087-b7d8-e8f861cae1f3,A Google user,"Who came up with the update changing the filter options and add the ""Next"" button at the bottom of the screen? Being taken back to the main screen everytime I chose a filter option is ridiculous. Amazon used to be my 1st, and often, only stop when shopping online but not anymore.",2,24,20.1.2.100,2020-01-29 04:46:56,20.1.2.100
547c5236-7c52-4ae8-96fb-e6511fb26213,A Google user,"Disappointed: account disabled and orders cancelled because of buggy fraud system. They say my account has been hacked but it was me doing the orders. Support does not help. Account assistant cancelled all my orders. This is not just an app but a service as a whole. Jeff, put more money in Amazon research instead of space flights. Hire me to work for you and I'll fix this issue.",1,9,18.21.2.100,2020-01-10 21:49:53,18.21.2.100
5fb8d475-5e4f-4cf7-bb87-49f308fdfd35,A Google user,"Over the past few months I've noticed that this app has become very laggy and unresponsive. I will have to uninstall it and only shop when I'm at a computer = Shopping less. It can take 5 or more taps for common actions, while others result in an unresponsive app for several seconds at a time, and then accidental presses. I have a Samsung Galaxy Note8 with 6gb of ram, 256gb+ of storage, and home wifi is testing at 274Mbps with the phone. I'm only having this problem with the Amazon app.",1,273,20.2.2.100,2020-01-31 11:48:06,20.2.2.100
6f05818a-6f39-4070-827b-fcd66ddfa782,A Google user,App is fine. The only issue I face which is quite annoying is the shipping notifications do not appear at all anymore for the past few orders. I have notifications enabled and still nothing. I have to constantly check the app to see where my package might be. Fix and I'll give five stars.,4,17,20.1.0.100,2020-01-23 18:08:20,20.1.0.100
6098c9de-3b7e-4f1f-9a50-5b85d5b27f7d,A Google user,"I like shopping through Amazon's app. However, idk what happened to it but it seems like the app changed. Or it's my phone. Everytime you want to see something, sometimes it shows it other times I get nothing but customers frequently bought this together. And it's taking forever to load. Like what gives Amazon. I used to love this app. Not so much right now. Might just uninstall it for a while. What's the point, it's useless.",2,98,20.1.2.100,2020-01-28 19:10:12,20.1.2.100
25c67683-02f7-4393-bd46-1197dbbe48b4,A Google user,"The app is very slow to respond to almost every action (opening the filter menu, viewing images full-size, searching for answered questions, opening the search bar for past orders ...), and slow to load pages and product images. Clicking the x in the search bar clears the text for a moment, but when you start typing the old text reappears. Filtering search results is frustrating (and again, very slow) - you cannot filter by price until you select a category, and only one filter per menu open.",1,123,18.21.2.100,2020-01-06 08:37:33,18.21.2.100
5db117fc-310c-4df0-9b48-d85917d8909b,A Google user,"My go to for Shopping. Would love to have the option to choose my method of delivery. Tired of Canada Post with they're snail mail BS, Nothing ever arrives on the date it's much after. Doesn't pay to cheap out sometimes opting for the free shipping. Get what you pay for sometimes I suppose! Overall very happy with the App",5,2,20.1.0.100,2020-01-27 15:25:47,20.1.0.100
d2abfb06-d781-4b57-a2b6-3790446c3739,A Google user,"So freaking slow, and buggy. Images take forever to load...literally they never load. I have no problems on my laptop viewing images of products, but the app just doesn't work. Menus sometimes don't load, searches sometimes don't do anything, the whole app is just super buggy.",1,16,20.1.0.100,2020-01-26 02:07:14,20.1.0.100
8dc47409-d937-47eb-bea7-9137194d3e9f,A Google user,"I'm so sick of the uh oh there was a problem error when viewing any product page. I've gone through the troubleshooting steps to fix it so many times over the past year, but sooner or later it's always back. I'm on the latest Android version and in install any updates. This is absolutely maddening. Can you guys not fix the fundamental issues with your error handling approach please?",1,276,20.1.0.100,2020-01-20 00:54:40,20.1.0.100
5e41a9bb-1d79-44a0-ad8a-c9b515aff58d,A Google user,Ever since i canceled my prime account (which was right after i was charged for it) i cant get on my amazon app. I had to uninstall. I was expecting to be able to contact about a refund seeing as ive used NONE of the benefits this bill pay yet i cant seem to get on my account without everything shutting down,1,0,16.20.0.100,2020-01-12 14:37:41,16.20.0.100
34c550e8-c750-4dfb-a6d6-efe2f904bcd5,A Google user,"Irritating, I can only have one filter at a time yet the old version I could select multiple filters at any one time. There's also too much irrelevant content when I do a search for a specific brand or item e.g. Men's Batman baseball cap. The search result included children's and unisex caps as well as swimming cap, bean cap and army hat. I ended up cancelling my search and buying from elsewhere. I've used Amazon shopping less since my update to Version 20.1.2.100 revert back to the old app",1,158,20.1.2.100,2020-01-29 09:41:35,20.1.2.100
aaba8a75-a06e-4185-bc2a-d5fb38470958,A Google user,I dont appreciate Amazon tricking me into doing a customer survey by promising me free merchandise only to found out you must pay SHIPPING for the merchandise when your done. Amazon doesn't mention the shipping cost until after the survey. I feel chumped. Free means free. Very disappointed. I won't involve myself with any other surveys from Amazon. As much stuff as I buy from Amazon I feel this is inappropriate.,1,0,10.3.0.100,2020-01-20 03:12:36,10.3.0.100
3284108a-7478-4e8d-aa70-6f94be513277,A Google user,"What happened? I stupidly updated the app and now when I put in a search I get ONLY sponsored options and "" brands related to your search"" instead of infinite scroll options. I wanted to diminished my Amazon spending and this will definitely do it. Is there any way of going back to the previous version? I guess programmers for the app have to justify their existence and therefore keep ""upgrading"" the apps. This last one was definitely a downgrade.",1,10,18.21.2.100,2020-01-07 08:03:57,18.21.2.100
2c822d07-e3c8-4cb9-bf37-001a65b5c860,A Google user,"Its hard to review something that doesn't work. The summation of my experience: Crashes. That is pretty much all I ever got from the app. It would briefly open, then show me a consolation picture of a cute dog, and crash with the ""Uh Oh! Looks like something went wrong...."" message. ""Home"" uh oh! ""Account"".. Uh Oh!.... ""Search""...Uh Oh!.",1,0,,2020-01-22 10:28:42,
ad349e0a-a3d8-4083-81b2-5a2cfac47456,A Google user,"Takes forever to load (just to add an item to your list). And it keeps going to the home page, after failing to load different products, time and time again. The old version didn't have these problems....",2,2,,2020-01-04 01:34:02,
9388000c-4e41-4443-9792-05dd22083b96,A Google user,"1 star is too much ... sluggish, poor responsiveness, inane filter behavior, no sorting options ... infantile gui ... discourages use ... Google search results linking to Amazon, viewed in the Amazon app yield NO RESULTS when the same Amazon product listing keywords are copied and pasted into the app search ... WORST shopping app, EVER",1,9,18.21.2.100,2020-01-08 01:38:55,18.21.2.100
02efe7bf-8c5a-4d25-868d-610b523f41b7,A Google user,Who in there right mind thought autoplaying video ads was acceptable in a mobile shopping app? Well Amazon did. I just wanted to say thank you to the exec who thought it was a good idea to waste people's mobile bandwidth. You have finally given me the reason I needed to delete the app and break the buying cycle! Thank you!,1,0,16.12.0.100,2020-01-17 07:31:41,16.12.0.100
5aba2357-8507-4660-a5da-3d765a6a17b9,A Google user,"This app is great, easy to use and the shipping for Prime is super fast. The main thing that is super annoying and the reason I didn't give it five stars if they ask you for a review within literally minutes of getting your item. How are you supposed to review an item if you haven't had time to use it. Amazon, maybe you should take an idea and snooze your reviews for a week or even 30 days.",4,17,20.1.0.100,2020-01-29 16:07:50,20.1.0.100
08507a1e-2974-4e8d-9b83-666181500065,A Google user,"Sometimes it wont load searches more than a few result, I reset my phone and app and it still didnt work. It took over night for it to come up. Luckily I didn't need the shop just wanted too but still annoying when it happens.",3,5,18.21.2.100,2020-01-07 15:59:07,18.21.2.100
5fe59c33-9017-40c3-9f30-bdc03591831f,A Google user,Literally just the mobile website in an app. But you cannot use amazon smile without allowing the app to send advertising notifications. See no reason to use this app instead of a shortcut to the website.,1,0,16.17.0.100,2020-01-21 10:05:07,16.17.0.100
56db8613-baaa-4362-89b3-07e6b9af25c1,A Google user,"I absolutely LOVE this app. I've bought items from Amazon for about 3 years now and I love the simplicity of the app, it offers millions of products for all different tastes and styles, and the delivery is always on time, if not early! Amazon, you go sis!",5,216,20.1.0.100,2020-01-27 00:50:07,20.1.0.100
a7be4ff6-94e5-43a6-9ac6-ac6dc74a3ddb,A Google user,"Love Amazon , I thought it was all about books and movies but there's shopping even for us plus size women and I saw Xtra small for smaller ladies , even mens clothes. I also got a nice clock with radio with dual plugs for cellphones. I saw sales on really cute dresses and more. Free shipping on some or after you spend so much. Easy returns too. ðŸ˜Š",5,0,18.21.2.100,2020-01-13 03:45:43,18.21.2.100
bfbcbb96-6493-4127-a3d5-1b53d2bb84e8,A Google user,"I live in a small town, and only a Dollar General and Family Dollar, to do any kind of shopping,witch is a nightmare!!! you're always tripping over inventory that needs to be shelved and we can never find anything that we need the only other choice is to go 300 miles in one direction to Albuquerque 111 miles to another state Amarillo are there 97 miles to the next closest town I've recently been diagnosed with gastroparesis and unable to travel thank God for Amazon Prime. Christmas was saved!",5,0,18.21.2.100,2020-01-03 03:15:19,18.21.2.100
811689bf-9ef2-403f-864e-a2b2f9eb76b4,A Google user,Amazon use to be good. Now days all you can buy is junk. Nothing is really as advertised and way too many 3rd party vendors that rip people off. Prime service is not worth the headache. I will not renew my prime membership ever again. Everything is made in china. App sucks lag lag lag when trying to add a item to list #Fix it,1,7,20.1.0.100,2020-01-19 02:46:37,20.1.0.100
d1500b4c-3a35-412a-aa4b-8e4cd81c20f9,A Google user,I do think that it is great that instead of you going to the product the product comes to you although I have lost a couple packages it is a great app with great prices I would say that the most inconvenient thing is losing packages and waiting for it to get to you but I would definitely recommend.,4,61,20.1.0.100,2020-01-27 16:02:56,20.1.0.100
7d92d6e7-b257-4d43-b632-9854a5f97f6a,A Google user,The only reason I installed it was to get the $10 coupon. Which it told me I was ineligible for after about 5 days. The reasons listed didn't match anything I had done before. I've never used the app prior to this. Also the ads were pretty ridiculous.,1,1,,2020-01-29 01:24:19,
082cb352-444b-422b-9873-c2ab9963e382,A Google user,App and website drilling down to category is so time consuming and frustrating compared to other sites. The sort by option such as Price Low to High will remove several available search results (this seems intentional to me as it's been reported for years and it wouldnt take a large company this long to fix that issue). View in Room options not working.,1,27,20.1.0.100,2020-01-15 15:20:29,20.1.0.100
e9e30771-8b17-4bf9-8b6d-3881371be19b,A Google user,Literally you can find everything you need. Ive bought random nic naks to tires for my car. Just like everything else its always better to check locally to see if prices are lower but still great if you need things in a hurry. Prime is worth it as well.,5,6,20.1.0.100,2020-01-28 11:05:33,20.1.0.100
00173526-eaaa-43d6-9c06-8a723442dabe,A Google user,Horrible! Why do they need my bank statement. Signed up and placed an order for $700 worth of items. Amazon then locked my account saying I had to verify my billing. Nobody gave me a clear answer to my questions. So I guess I won't be using Amazon and take my business else where. Let my bank worry about fraud that's why I pay extra for my account. Wasted hours today thanks Amazon.,1,0,18.21.2.100,2020-01-09 18:38:48,18.21.2.100
5a21143f-83d8-4c56-b892-cad910f16122,A Google user,I usually love this app but lately there have been a lot of bugs like not being able to click on items and search results dissapearing which is frustrating when you have to start searching all over again.,4,5,20.1.0.100,2020-01-25 19:09:14,20.1.0.100
688d3b7e-7833-4e69-bc7d-2e6ce5205407,A Google user,I Really like this site! I've ordered all sorts and never had a problem. The help service is great when I've got muddled and the staff kind and patient. The amount of goods available is astounding. It really is the Easiest site I've ever used,5,0,16.13.0.100,2020-01-28 13:37:37,16.13.0.100
0ba81729-3c1a-464f-9934-00e03fc912a2,A Google user,"just downloaded it to see if they sorted when you search for something you scroll down so many then have to go to the next page which makes a horrible experience when searching for something, that's why I cancelled my prime membership and started using eBay much better experience",1,7,18.21.2.100,2020-01-07 11:23:47,18.21.2.100
92c4ef93-c165-407a-b6a6-a9e224c286eb,A Google user,So far everything I have ordered is either broken or missing parts . And the customer service is quick to answer but no good with any help as I'm just trying to buy gifts and there all crappy and amazon will put u threw hell just to get a refund so u can re order . I most likely wont be using Amazon and will be attending my local stores . Better customer service and supplies,1,0,,2020-01-11 14:32:07,
7f2f76de-3bf6-4e1d-932d-56f53824ca38,A Google user,"AMAZONS PRIME used to be excellent, but regardless of the holidays it has been some time before I have received anything on time. I get so tired of opening the app up and there's a little puppy on there saying 'OOPS your order is running late'! I pay for prime membership to get my order here on time. I would rather pay another site to get it here WHEN WE NEED IT and not have to return it which cost GAS & TIME neither of which I have a lot of. There are other sites.May cost more but I'll get it.",3,1,18.21.2.100,2020-01-12 04:48:25,18.21.2.100
820b0cd8-97bc-4ecb-a5dd-7ae34c1e3afb,A Google user,"Very easy to understand what it says but for most people over 55 years old, who are not very computer literate, like myself, it still is very hard to figure things out such as lights, tv channels and all those things i know it can do. However nowhere foes it explain, at least not to where i can figure out I will have go get one if my teenage grandchildren to help me",4,0,,2020-01-01 22:42:01,
30453082-c4c3-40ad-a015-3480ae2c3376,A Google user,"Why did Amazon discontinued Amazon Black and replaced with this application? It seems that good apps are replaced by lazy attempts at an app such as this one. This app disrupts other apps and if you deal in different languages, this app will not work properly . Bring back the Amazon Black/dark. Whoever made the decision to make this app the sole app for Amazon, probably, never used or uses the app him/herself.",1,0,20.2.2.100,2020-01-30 21:54:09,20.2.2.100
bee8373f-b323-4e99-824f-f69324f6d218,A Google user,"You guys have terrible customer service. I went and put 360$ on my account and then they locked me out. A day later I contact them they do nothing, another day later I contact them and they say stuff like we don't have to give the money back you had unusual activity on your account, but provided no evidence on it and all I did was add money to my account and apparently its against your terms, real smooth guys, real smooth",1,1,18.21.2.100,2020-01-17 20:52:31,18.21.2.100
3f17465e-e60f-4a39-b69e-1847d3107d1f,A Google user,"Horrible with keeping there shipping dates, paying for their ""plus"" service is a waste of money - multiple occasions half to 2 weeks late. I have even paid for things they didn't end up having and they have to cancel the order 2 weeks after it was supposed to already be shipped.",1,0,20.1.0.100,2020-01-18 03:18:26,20.1.0.100
