reviewId,userName,content,score,thumbsUpCount,reviewCreatedVersion,at,appVersion
1585e59e-4642-4823-a850-165f8e6359dc,Zandra Vautaw (Zandy),This shopping app has almost anything I could ever imagine!! Also the prices are pretty fair. You just have to watch which products have ridiculously high shipping. Even if the first one you find does have it really high normally u can find another from another salesman that has lower or even no shipping! I am a prime member now so I get my packages really quickly but even before that the packages never took more than 7 to 10 days to get to my house! Never had a problem and WAY better than wish!,5,121,20.9.0.100,2020-05-08 18:53:41,20.9.0.100
b071159d-7c0a-4489-b6ae-7a45363e4979,Quirky Developer,"Amazon has been using COVID-19 as an excuse to not fulfill their end of their Prime service, but still want to charge for the service they have stopped providing. Like 2 day shipping. They put my last order to ship 6 days away and then rescheduled it 4 times. I raised concern with their support and decided I'd just close my account after they arrived. That night, after I spoke with them, they shipped it out of a city that is less than a 2 hour drive and arrived 12 hours after shipping. No excuse",1,7,20.10.0.100,2020-05-22 20:20:00,20.10.0.100
a1fef577-71cd-4dee-afe9-2168e94f2b96,Yabe noyb,"Although the app itself is pretty good and mayby deserves like a 3 or 4 star review the actual shipping and you know getting it to your house has problems like in order to ship your product a day or two earlier you have to pay like 4 dollars more which in itself is fine so i paid for the shipping only for it to be ""running late"" and make me wait two more days which completely undermines the fact that I paid more for quicker shipping. I feel as there should be some sort of discount or something.",2,1,20.9.0.100,2020-05-13 03:49:00,20.9.0.100
e867a44b-d392-44b0-b632-6246163a51aa,Jennifer Almodovar,"I don't know what happened to this app, but it has been awful to navigate lately. It's not letting me use the little prime switch on top of page, to navigate between pages is horrible because for some reason the page is not fitting on my phone screen. It is terrible. Needs to be fixed.",1,25,20.9.0.100,2020-05-20 03:38:29,20.9.0.100
e6f57221-77ae-4d66-aeb9-29c6932a9031,Sammantha Aynes,"Annoying af. You have to scroll to the side and then down. Back and forth and back and forth and theres no option to change it. Ill be deleting the app and using my browser where everything pops up in a list as I've always known my app to do and now it very disappointingly does not. Im very aggravated. And as of late, it hasnt mattered that I pay 13 dollars a month for prime, as it still takes a week+ to recieve items which has caused me to fail assignments for school three times now.",1,30,20.10.0.100,2020-05-22 03:32:40,20.10.0.100
62d431be-fdb6-4e05-b643-e35b808966b0,Hank Keown,The search filter is why i give this a one star. Its obvious the reason the search doesn't let you endlessly scroll is so they can shove adds in your face everytime you have to click on the next page. The app was great before and didn't really need to be changed. It just goes to show corporate greed!,1,13,20.9.0.100,2020-05-17 18:04:33,20.9.0.100
d8236cdd-df0f-49fd-aad2-d34a4b2a7c56,Joline Benson,"Love that chat keeps hitting a snag, no email support, no phone support! My package has been marked as handed to residents but changed to now left at mail box when it wasn't delivered at all. I HAVE CAMERAS! I also took screen shots of these changes. Thanks amazon. I canceled prime, will be selling all my amazon devices. I will no longer do business with a shady company that has zero customer support if my package is not delivered in the next 4 days. I'm doing a charge back! I'm done.",1,1,,2020-05-04 15:04:46,
43575c8e-15db-4c6e-8e3c-1e6030a90183,M Murase,"The ""search image"" and another search button can be invisible but still tappable just above the keyboard, which makes for an obnoxious result when Amazon pauses for two seconds while opening the camera. Best thing to do is to have an app option to disable the camera, but of course Amazon will never do this. Search filters are even more useless than an ashtray on a motorcycle. There's no way to access delivery feedback except through the notification, which is stupid.",3,122,20.10.0.100,2020-05-31 22:50:40,20.10.0.100
95d73562-4d5e-4e6a-9333-a5581d170d77,aqwkPF dHTLA,"Every time! Every time when you are editing something, whether it is an address or payment info, when you switched the app to copy the information you need and switch back, the fields you filled are gone! Whole webpage is refreshed again! What the h**k! The sharing is also incomplete, only allows you to share to a limited list off apps. Not even allow you to copy the link to share.",1,149,20.9.0.100,2020-05-09 02:27:49,20.9.0.100
870cbfee-7582-44af-911b-a8ceecda213d,Bartosz Jankowiak,"One sentence? Here you go: Annoying shopping experience! - insufficient and very cumbersome filtering - CHAOS on search results page - too little searched products, too much all other information; very messy, eyesore - 80% of products I search for, cannot be delivered from Germany to Switzerland - why even bothering showing those? To annoy me even more? So currently I use Amazon Shop as ""ideas mine"" - and then I go to other shops.I've just searched for specific messenger bag and it was a pain...",2,1,20.9.0.100,2020-05-21 17:52:24,20.9.0.100
485ab5ef-4199-4673-937d-a39b01058b16,Marilyn Ramirez,"I downloaded the app primarily because of the 10 dollar coupon they advertise for the people who's first time download. I had to delete other apps in order to do this cause my memory was full and I NEVER recieved it. It glitches because whenever I open it, pop ups come out. I have a better time in the website. :/",1,22,20.9.0.100,2020-05-12 08:10:57,20.9.0.100
2d89bcd1-14a4-49cb-b6e4-4b8f138fe8ed,L. E. Smith,"I love having subscriptions for stuff I know I'll buy over and over again like cleaning supplies and dietary supplements -the things I forget to put on my grocery lists anyway. The Amazon clothing line makes getting a men's business wardrobe put together on the fly, with a limited budget a breeze, and my husband looks great in the classic cuts of slacks and oxfords they offer. There's a wide range of shirt colors, to complement any complexion or preference too, not just white and light blue.",5,29,20.10.0.100,2020-05-21 22:36:12,20.10.0.100
d904e486-6855-4672-876b-31f0c13ac7f0,J K,"The interface color change and getting rid of lightning deals is somewhat annoying. I enjoyed the randomness of it. Now it feels much more search oriented. Which I suppose is good for most. Dispite those minor annoyences, it's still the best place to shop online for everything!",5,11,20.9.0.100,2020-05-13 16:44:53,20.9.0.100
c03070d8-2ed6-4fb6-8c95-a24eb2d3d5aa,Melissa Dubinsky,"The search option is horrible. You have to keep going back into the filters adding them one at a time instead of adding them all together and then updating the search like it used to be. Also, the Amazon smile button is not appearing like it is supposed to with the new update.",1,26,20.8.0.100,2020-05-01 21:37:00,20.8.0.100
fb448797-75d7-415c-bbe3-659a85d7ae66,Mary Trask,"I enjoy browsing and discovering new things I never knew existed, but I love to shop, and have found everything I've ever searched for on Amazon. There's nothing that Amazon doesn't offer, and at very competitive but affordable prices, as well as prompt customer service and delivery. Amazon does a great job anticipating the needs of shoppers, along with offering an abundance of options to provide their customers with the best shopping experience possible.",5,109,20.9.0.100,2020-05-18 06:34:48,20.9.0.100
76a5bda4-d028-408e-8006-d2c6f1900560,Aoife Campbell,"A must have for any device. Great for online shopping I find that I use it so much I may as well have he app over the website. Amazon has absolutely everything you could possibly need/want. It is Brilliant and prime is 100% worth the money. For prime video, kindle books and fast delivery I just love it. You can also track your orders which is Brilliant I cannot say a single bad thing about this app.",5,413,20.9.0.100,2020-05-09 23:39:29,20.9.0.100
40d96cd6-a188-47ed-8f49-7eebb43c1b26,Joseph L Filtranti CEC AAC,"I think that this app is well designed & very organized. However, I wanted to give it 1🌟, not bcuz it's a bad app, no, I wanted to give it 1🌟bcuz it's so organized that I spend WAY TOO MUCH MONEY! I had 2 get a part time job to supplement my SS chk. I'm a 68 yo retired chef who has MS. I'm suppose 2B lying on a beach somewhere here in Florida. Come 2 think of it, it's a good thing that it's keeping me off the beach, if you seen me, you would agree.",5,15,20.9.0.100,2020-05-12 15:44:43,20.9.0.100
45ca6128-0142-43eb-bb14-075fcb9051db,Zach,I have to go thru a whole procedure to even open the app. I tried describing it here but I'm not allowed more than 500 characters in the review. Amazon said they would reach out to me after numerous calls and being on hold for hours. It's been months and still no responce. I keep trying every month or so and get told the same thing that their app team or something would reach out to me. Never happened. I've deleted and re downloaded the app many times with no change. I now use other retailers,1,0,,2020-05-09 17:17:08,
961d7418-3e98-4f7c-b297-c3e9d545e790,Michael Kelly,"Latest version 20.10 BROKEN SEARCH. You only get ONE search. If you try again, your previous search terms keep populating the search box. Out of control. The only way to stop it is to close the app, then reopen to do one more new search, then close again. I've uninstalled and then installed previous version 2.9 Turns out it's the same mess in that version. And the website won't even let a keyboard stay open long enough to type anything. Plus all the other things noted by reviewers. WHAT A MESS.",1,288,20.9.0.100,2020-05-22 17:55:32,20.9.0.100
ea4fc66d-e83c-4c1c-80c6-02acbed69ea9,Shannon Galbreath,"The app used to be a 5 star app... now its very slow, can no longer add a product to your default wish list from the search results page (have to go to each product to add), used to be able to apply multiple filters before they were applied (it now applies each filter immediately after you select it). Change it back Amazon.",2,57,20.9.0.100,2020-05-23 11:53:38,20.9.0.100
941bcc14-4c97-4761-8877-0a77662b0cc4,Jace,"The mobile app is really poor, why must I press next to see more items, that is so old school and very annoying..I am start to use other apps now to shop. If they don't improve it very soon, I'll be cancelling my Prime membership, the filter options are also badly designed. Come Amazon app Developers fix up your app, you will be losing my membership and others fast!!!",1,47,20.9.0.100,2020-05-07 09:14:14,20.9.0.100
3cbbc992-8fa6-4ea5-b195-3a69c8b0d6ca,Ralph ZombieKiller,"Appears to have been coded by someone who is still learning how to write apps. If you sort your search results by price- low to high, you don't get all of the results. I searched for video doorbells and sorted low to high and apparently the most expensive doorbell is £25! I'm sure Ring will be happy to know that their products do not show up in search.",1,38,20.10.0.100,2020-05-22 13:02:02,20.10.0.100
fb527617-ff63-43cb-ba5d-04d7540c8920,t ch,Could be better! For the money Amazon makes they could spend some in an app that doesn't constantly crash. Making it harder to ship on the app everyday! Doesn't add items to cart or just completely freezes. Bad enough sometimes I'll shop other sites for the product I'm looking for! You've got the money!! Fix the app.,3,52,20.9.0.100,2020-05-13 14:50:03,20.9.0.100
d09ac674-fa48-4bba-8932-ef8ddcb59f25,J Kim,"The lastest update version is not optimized in terms of battery usage. Likely inefficient codes leading to high consumption. It was fine before. But now my phone gets hot so fast with starting the app. When I close it, my phone goes back to normal room temperature as it was. Strongly needed optimazation!!",1,10,20.10.0.100,2020-05-28 05:52:24,20.10.0.100
874e03b5-8bfd-4c60-83bb-b48228c954f7,Matthew Fontaine,"I've frequently joked that the Amazon app is the worst app developed for Android by a billion dollar company. It truly is. The UI is trash, looking at images is inconsistent (some products, the image expands, others don't), the orders search bar is laggy, and the app doesn't respond to touch input on several occasions. It's unacceptable.",1,10,20.10.0.100,2020-05-23 05:38:46,20.10.0.100
4ed5a1de-9e9d-4c26-97ad-12f9dce97dac,"Rebecca Levesque, Brehm, Daley (Becky)",I've been trying to place an order for a couple of days now but it's taking FOREVER as the website keeps crashing. Also when I use Subscribe and Save it doesn't add things to my cart. I also put a few things in my cart and they disappeared! I had to go out and come back in the app to get the correct amount. If I didn't need some things I wouldn't use it at all. Thanks,3,11,20.9.0.100,2020-05-12 16:07:17,20.9.0.100
55ad31c5-e694-4790-9c4d-5cf5dfef04fd,Mickey M. Ray,"I have not been able to get into Amazon to buy stuff. Frustratimg!!! It says ""Enable."" Then when I tap Enable, it goes to ""Open"" for about a half second, then back to enable again. And there is NOBODY you can talk to about it....only recorded runaround! Frustrating!@!#!!",1,0,,2020-05-28 16:29:42,
2e6735a0-19a3-43cc-9056-a972eb8c1a7f,Dmitry Grinberg,"Whatever was recently done to search results now has the screen that is double width, so I have to scroll to the right every time. This is unlike Amazon, very poorly tested. I'm on the most popular device, so there is no excuse for lack of testing. Every bit of everything needs to be tested on top 10 devices.",1,116,20.9.0.100,2020-05-06 22:54:21,20.9.0.100
a1776f97-62af-422e-aa3e-d295fb233f6e,Antoine NUTCHOU,My review is not so much about the functioning of the but about the fact Amazon has been secretly activating subscriptions without customers consent and charging them for it. Check your subscriptions and check your bank and/or credit card statements. I had to call them a little over a year ago to get refunded and remove the subscription. I just checked yesterday and have four other subscriptions on top of my prime(only subscription I agreed to). Amazon is pulling Wells Fargo 2.0. Watch out! 😠,1,6,20.9.0.100,2020-05-17 16:07:47,20.9.0.100
15b2f791-e1c6-4d26-8bcc-448a11836ae9,Lizzy Hardman,I have been trying really hard to get ahold of amazon. I am locked out of my account which they have been continueing to charge me for months on a card that i did not authorize for them to use. I have cancealed multiple cards now. The customer service line is down and i have no way to email them.... I am so frustrated with amazon..... I dont even wany to give them a full star.,1,0,20.10.0.100,2020-05-22 18:13:45,20.10.0.100
c914c2f5-83ae-4c2c-9f42-337fd1d23c01,NonameH 01,"I love the app, though what I don't like is that some stuff are overpriced. For example I found the vr headset with 2 games (borderlands2 + beatsaber), with the controllers and the camera. It costs from 500-1000$ depending on how new you want it? And in GameStop, new, it costs about 350$",4,0,20.4.2.100,2020-05-28 20:14:59,20.4.2.100
6ef095eb-240a-4c79-a8ba-4cef36e9aa71,Corey Michaels,"This app has lost my 5 star rating and is now a 1, due to the recent update to the app. I'm already seeing comments from others that are having the same issue as me. Unable to back out of photos without going all the way to the main search page. Plus the visual layout is terrible now. If I'm being honest, there was nothing wrong with the app before. Change it back. Will rate again if changes are made for the better.",1,308,20.10.0.100,2020-05-25 18:02:33,20.10.0.100
a96f3b16-0703-4c60-a9cb-7c939feaa541,Jenni A,"I absolutely love Amazon! I have been shopping with Amazon for a little over 10yrs now and one thing I love is the fact that if I have a question or concern I can get actual help from a real person not like on other sites where all you get is a virtual assistant that is zero help. The prices are very reasonable and you get good quality stuff, I like how you get order notifications and how you can have your order sent to a secure Amazon locker or your home its awesome!!",5,0,20.10.0.100,2020-05-25 20:06:58,20.10.0.100
c30e3c12-5a6f-4b4e-85f0-d02f8472d36a,Andy Ewing,"Apparently, for security reasons, even though I use 2-step authentication, this app is no longer useable while I'm on a VPN. Where was the communication that this change was coming? Switch to open network, app works as it should. Boooo!",3,6,20.10.0.100,2020-05-30 14:34:27,20.10.0.100
08a0a1cc-4df8-4028-9bd8-6fdf6fc25167,Laney Stutz,"I have no clue what happened to Amazon because it was so easy to use before but now im having a really hard time. I was trying to buy a penny board but when i searched it, sunglasses, masks, pads, and very random things would show up. Also when i found one, it was more than 100 dollars!! Unbelievable.",1,22,20.10.0.100,2020-05-23 01:09:41,20.10.0.100
47fb553f-b24c-4d1b-bb51-440e87b05522,Ken Dickie,"It's not terribly convenient to log open this app, log in, go to My Account/Orders/Track. I liked it better when Amazon shipped with third party shippers. Tracking packages was MUCH easier. I suggest adding an app dedicated to tracking packages shipped WITH Amazon.",3,6,20.9.0.100,2020-05-16 04:34:13,20.9.0.100
5a67ac3c-b6c4-401f-b76f-3d295b0d1dcc,Genieva Herrera,"Love Amazon... Everything I have ever purchased was good quality, timing of shipments is awesome and customer service goes above n beyond... You can easily track packages as well as gift them... Recommend this app especially if you do lots of online shopping, not to forget toention if your a prime member tons of extra benefits such as free shipping, movie watching n special discounts...",5,21,20.10.0.100,2020-05-24 11:17:03,20.10.0.100
13f53423-0ef3-4328-9355-0251018095e5,Hirak Choudhury,Amazon is becoming completely autocratic..no way to contact support.. irresponsible delivery agents who bar incoming calls and cancel return pickups. Delivery agents who order customer to search and fetch orders..no door step delivery.. selling faulty products at lower prices with no option of refund.. etc ...I am writing all this so that the customer support gets back to me... experience is very poor..sellers are fraudulent..taking advantage of the covid situation scamming people of their money,1,0,16.17.0.100,2020-05-27 07:59:09,16.17.0.100
5c7a6fa4-e16c-4956-be15-e74c9ed6240a,Joanne Willson,I love Amazon shopping so much I can find anything and their prices are usually better than anybody else's and if I don't like the item it's so easy to return it the UPS comes to my door and picks it up and you don't have to worry about boxing it up either. I've been using Amazon for years now I am a faithful customer,5,3,20.10.0.100,2020-05-28 02:27:54,20.10.0.100
5d64ed35-0684-4a98-b7bf-c92890f0ada8,Frederik Grondin,"I'm a prime member and use amazon regulary however the new ui just plainly suck. All I have is ads for amazon video and all I have on the home page are book and other stuff that I wont buy. Before, there was the daily deal page which was a way better experience. Now I just cannot find anything interesting by just looking at one place.",3,13,20.9.0.100,2020-05-15 21:43:46,20.9.0.100
06587408-9ad7-4d81-a1d8-d144cc834d0a,Sharla Gist,"I hate the OLD new look, I want the black & gold back. I hate having to go to NEXT page, instead of continuous rolling view of items. I hate the revised filter. Why can't things that work just be left alone?!?!",1,0,16.14.0.100,2020-05-28 02:16:42,16.14.0.100
bee38cd3-6ff4-439a-b61e-e52210dee230,Tom Ahearn,"Lastest update make it almost unusable. This version is just a shell for the mobile webpage. Hard to filter, unresponsive, just horrible overall. The previous version was optimized and was wonderful to use.",1,3,20.10.0.100,2020-05-22 13:19:50,20.10.0.100
3de56a45-30fa-4fb9-ae4f-cccc4f984769,Marcus Montgomery,"Paid my 12.99 after my free trial and I have to say I dont think I have EVER been more disappointed in a service than Amazon. First, the FIRETV stick I purchased did not work. Cant replace it due to COVID19 fears so I bought a 2nd one. Few days later, I purchased an 80"" VIZIO TV for my parents 35th annaversary. It never shipped!! They said I was never billed for it, But I have the bank record and when I sent it in to them like they asked, all of a sudden they have no idea what Im talking about.",1,3,20.9.0.100,2020-05-23 05:41:14,20.9.0.100
0ebc0a10-d4bb-4f1a-bd9b-8de8be0f5fc2,Synthetic Danimal 90,"Absolutely ruined the shopping app. I used to be able to scroll through and see interesting stuff related to my previous buys or views. Now, literally nothing is a match for me cause its pushing house deco, womans clothing, and beauty supplies in my face. Way to make less money Amazon. Good job. Junk...",1,7,20.9.0.100,2020-05-19 10:46:17,20.9.0.100
4a772e3c-e598-4b67-b8f0-f67a70384943,Addison Moreno,"Seriously bare minimum and nothing more. I've also had it crash twice now to the point where I can't open the app and have to uninstall and reinstall to get it working. How much is Amazon worth again? Why can't they get a damn app right? No streamline, no user interaction, almost no discerning it from the website, I'd make the argument the website functions better. What's the point?",1,77,20.10.0.100,2020-05-21 22:53:20,20.10.0.100
06d82c68-1be1-4694-931d-faa733dfc56e,PAT TURNER,"Doesn't work on my android phone, as it keeps coming back to the screen that says amazon no longer supports it. Now I have no way to shop on Amazon. Bye, Amazon! You'd think you would have tested the new app before forcing your useless one on customers. How incredibly stupid!",1,0,20.10.0.100,2020-05-29 01:58:40,20.10.0.100
3d76e634-30d2-4c80-8ef3-7be3c0f8e892,Sarah Hammons,"Worst update. Please stop changing the search filter options area, this is so annoying! And like others said, you can't look at enlarged photos and go back, it takes you ALL the way back. Leave this alone! Go back to the last update!",1,7,20.10.0.100,2020-05-25 18:15:23,20.10.0.100
32ceabe3-8eeb-4961-8a67-7046b10a6544,Nathan Svensson,"Too many flaws to list. Amazon itself is not the company it used to be. Unless you pay for prime or 4.99 postage you are expected to wait almost 7 days for delivery. 9/10 I have found the same items elsewhere online and free delivery that takes about 2 working days. Secondly, think about where your money is going to and check online, do your research and see for yourselves how much Bezos has done to help during the Covid-19 pandemic. The world's richest man does almost nothing.",1,3,18.19.0.100,2020-05-01 22:11:44,18.19.0.100
7de94c0a-b8ea-4eb1-bf45-d3dfd45acd7b,Tiffany Donnelly,"New update changed everything. Please fix issues with back button taking you all the way back to begining, having to scroll to find the next button to go to the next page, clicking on picture. I shop Amazon all the time from my phone but this is ridiculously annoying 😡",1,6,20.10.0.100,2020-05-22 03:33:27,20.10.0.100
2d8ed676-26d4-47cd-b70e-3901e7593d51,Bettie Castro,"I used to love amazon. Until their delivery driver dropped my items at another apt & amazon wont refund my order. They said bc my order is too high ($85) that they will do an investigation. They did do an ""investigation"" they just sent me a copy of their policy. You can clearly see in the pictures my screen door is black and where they dropped it off the screen door is white. Whats the point of taking pics if it isnt going to do anything? Now they claim after delivery its not their fault.",1,1,20.9.0.100,2020-05-27 02:22:14,20.9.0.100
2aaa13d7-e270-47b7-b50c-f171f9cfbfc3,D Ditlevsen,"Long delivery time, very limited product selection available, expensive products, search function suck. Give us souq back ! If you dont know how to run an online store, then close it. Update: even more hopeless now. Ordered and paid a valve, a week later: no updates, no delivery, no nothing. Sellers email system does not work, amazon will now spend 4 days on emailing this fraudulent seller - and I need to wait for that. What a hilarious joke amazon is.",1,0,18.19.0.100,2020-05-16 17:21:48,18.19.0.100
9aa1bf4c-f65e-442e-958e-86743a3777f9,mark robinson,"I've waited a month and a half, no package , money is currently in limbo, customer service is useless and so is the seller. DO NOT trust Amazon partners, they're crooks and Amazon does everything in it power to protect these people while holding your money hostage. Still don't have my money , still don't have my package. I've had to report the transaction as fraudulent. Definitely not the way you want to do business.",1,0,20.8.0.100,2020-05-08 19:01:17,20.8.0.100
d4908239-e3cb-46a7-bb36-40835cbdcb04,Ianina Letiagina,First and last time I have ordered from this platform. I got charged for 2 of my orders. And it was removed from the system. And than they sent me email that I was never charged. And now they are not returning my money and dont show that I have history in my account. But all the orders and confirmation in my e_mail as proof. Worst service ever 👎👎👎👎👎👎,1,0,20.7.0.100,2020-05-01 20:07:47,20.7.0.100
af859af0-3e47-44e8-9560-c73ed344bb63,Thorsteinn Sverrisson,"Good app but I'm getting a little tired of Amazon saying ""out for delivery"" and ""arriving by 8pm"" only to change it to ""shipped"" and ""arriving in 2 days"" for a total shipping time of 4 days ""Prime shipping"". Still a modern luxury but it's all about expectations.",3,3,20.10.0.100,2020-05-27 13:57:35,20.10.0.100
