reviewId,userName,content,score,thumbsUpCount,reviewCreatedVersion,at,appVersion
650c19d4-73e5-4f00-a117-41296d31ed29,James Dolamore,"I'm consistently unable to change the delivery options from checkout without hitting an endless loading wall. This forces me to choose standard delivery when ordering from the app, when I usually want free or fast.",1,0,20.9.0.100,2020-05-06 09:38:58,20.9.0.100
e180915b-cb2a-4afa-bbaf-a30d8c270a13,Michael Gillette,"Awful update. I'm not against new upgrades and changing things to make life easier, but this new update is incredibly annoying. Instead of completely changing how the layout was, why not upgrade it? Needs to be reverted back to old display layout.",1,11,20.10.0.100,2020-05-21 06:04:38,20.10.0.100
26abd286-b7b7-4ece-be77-69c8f8ac9b61,Ryan Neighbors,"Slow as heck on every device I own. After clicking buttons, links, etc, it takes forever for the app to respond to the click. And heaven forbid you click again before it responds, because there's no telling what it will click on then.",1,3,20.10.0.100,2020-05-27 03:29:06,20.10.0.100
f7cf082e-3f86-4d75-a3c6-5e7533a20c3a,Stefany Ferrara,Just started on Amazon however however the phone that I received is defectiveI will need to send it back and receive a new one hopefully it will work fine then the phone is great I want the same phone just not a defective one. I am willing to try again phone is phenomenal.,5,0,20.9.0.100,2020-05-07 18:30:47,20.9.0.100
e51a1492-3e7b-47fc-a777-496283f225c2,C.J. McCarroll,Amazon is the top selling app in this modern world of bloody technologybut it really has made a name in the game as far as everything needed being found in one place with easy access and anything you could want is to be found there anytime day or night keep up the good work amazonians!!!!!! 🚾🇺🇸,5,0,18.21.2.100,2020-05-15 13:05:26,18.21.2.100
d216629b-52ca-4b7b-b550-35bb6b54a48c,Juan-Gloria Gomez,"Horrible, I use the Google Chrome to do my ordering and everything but I was double-charged on an item so I tried to chat with somebody said they had to use the app so I downloaded the app try to chat to sorry there's a problem with chat then it says calls I pushed the call so sorry but this you have our number blocked so I am blocked every single number in my unblocked list try to call again. Doesn't work so I uninstall this app I think it's worthless",1,0,18.6.0.100,2020-05-06 17:17:50,18.6.0.100
5f20b079-a85e-4f52-9aad-d233b61d3184,Leonor Camacho,App keeps closing when I go on my list. Very annoying Updated! App is 1000 times better. It hasnt crashed once since Ive started using it.,1,2,20.9.0.100,2020-05-16 04:51:00,20.9.0.100
183aa8c7-2486-4e6b-9e18-99bf2e4f2df1,Nick L.,"Amazon is the worst company I've ever had to deal with. I inquired about the return process due to the pandemic and I was given a ridiculously incorrect timeframe for when I'd receive my refund. They admitted their wrong doing but they refuse to process my refund in the time they said it would be processed and refuse to compensate me. It's been over a week and they haven't even received the return. I'm in CA and it was sent to AZ. AZ is only 3 days out max. AMAZON IS A SCAM, BUY LOCAL!!!!",1,0,,2020-05-13 07:01:34,
cc1c2d12-5a3f-4944-a343-db195136fdb3,Donald Avery,It is not letting back out of photos. If i look at the bigger pictures I have to hit back multiple times before it responds. Then it's backed out of the item I was viewing.,1,2,20.10.0.100,2020-05-26 16:36:47,20.10.0.100
517cbede-37cf-47aa-933d-2ec38c8e4173,M,"WARNING DO NOT ORDER FROM CHINA your orders will not come through ,, every order that I've purchased from amazon I've had no problems BUT when I ordered from THIRD PARTY on amazon ( mostly CHINA) NOT one of my packages have come through ,, they get lost , they take about a month then they say oops lost parcels,, getting a refund is ridiculous and Amazon has to pay the price ,, not fair ,, I like Amazon for sure but plz watch out where your order comes from ,, china NO amazon YES!! BE CAREFUL,,",4,0,20.10.0.100,2020-05-24 22:31:48,20.10.0.100
258b1fe7-050d-4eb7-987d-8bc8704c06be,ET,"App is great, but can't turn off email notifications. Also no way to report an item as missing when the app says it's delivered. (and forget trying to talk to someone on the phone!)",3,7,20.10.0.100,2020-05-28 18:22:25,20.10.0.100
6334fa83-ae53-4995-b54b-0ad40f73e896,Gabriel Hernandez,"Amazon has amazing customer service and their products are very well within reasonable price and are very well-maintained! Not only is there service fantastic, but you will receive your product days earlier than expected. Keep up the good work Amazon!!",5,0,20.9.0.100,2020-05-20 22:57:09,20.9.0.100
31f66571-b410-44dc-8769-732c00be8f91,Nikki,"Great. I love amazon its my go to. Whatever i need i look it up on amazon find different options, different prices. I havent had to call costumer service for a purchase. Amazon makes it so easy to send items back and track them.",5,7,20.10.0.100,2020-05-31 18:19:46,20.10.0.100
8a8e3eb2-8a81-4af1-bab2-01ef5039fca4,S T,"Paid over $50 on ""prime"" benefits when I haven't used it even once because their delivery takes more than a week. Whats the whole point of being a prime member and pay $15 a month when you can't get those benefits? They didn't offered to waive the payments like other companies did. Canceled my membership. Scam company.",1,0,20.7.0.100,2020-05-18 01:49:00,20.7.0.100
01b51ebe-439a-4cc2-b840-071e0e5d2384,Darwin Francisco,I have an order confirmation and by the time Amazon charge my bank...they blocked my account so now i can't track my orders and Amazon is sending me an email that they have delivered the items. And i keep on trying to contact their costumer service all voice mail...great service...🙁,1,9,20.10.0.100,2020-05-29 20:54:57,20.10.0.100
ca48a28b-c312-4ab7-bd4a-f2a4fdfd6a98,Joel Wilson,The app does a great job of showing pictures of dogs. Unfortunately I wanted to use it for ordering and tracking things other than dogs and unexpected errors.,1,4,20.9.0.100,2020-05-19 15:32:04,20.9.0.100
5c0d20f0-e94f-4252-996f-b83318197a56,Kyle B,"Even in the home screen it pops up saying something went wrong, click button to go to the home screen..... Wash rinse repeat. Amazon's app is unusable now. Which sucks because I have an Amazon phone through Motorola so I can't delete the app to reinstall it to see if it would fix it.",1,63,20.9.0.100,2020-05-03 15:31:01,20.9.0.100
a6409283-821a-417a-8992-b915b62b3be2,Lucy West,"Been spending on here way too much during lockdown but generally I always find what I need and usually quick delivery, even during these tough times. Also worth getting Amazon prime for extra bonuses (ie free delivery etc.)",5,0,20.9.0.100,2020-05-19 12:28:19,20.9.0.100
622de2c8-abc0-4708-97d9-22944fc841b9,Forcerunner -,"To be honest this app is the best way how not to get scammed but here's my issues, i ordered 3 stuff and it never told me it got shipped or was delivered and it isn't on my ""Your Orders"" So i think i got scammed but they did email me that i order them. And i ordered other stuff and it came in a month a freaking month and the 2 days shipping is totally a scam i remember 3 months ago i ordered a fan for my ps4 and it said get it 2 days got it in like 2 weeks. Thats my experience.",2,1,20.8.0.100,2020-05-02 04:23:35,20.8.0.100
93a88c9a-8a2c-4dc0-a058-a29608621735,Chad Beukes,"Amazing variety Great customer service no matter what country you get through to. 💛💙 As they work from the customer, backwards. Customer comes first the app could do with some use. But what app couldnt haha. Wish amazon prime could move to SA. Only reason i gave 4/5 ☆",4,0,,2020-05-21 19:16:06,
8e6ccfbd-81a3-483a-bb34-35de4e71fcf3,Edith Ruiz,"Excellent shopping experiences. Read customers review when buying, they are very helpful. App has a lot of variety of products. Excellent choices. I love it.",5,5,20.9.0.100,2020-05-27 00:49:00,20.9.0.100
167e4784-11a4-4d62-a603-2df1902a72f0,Alan De Smet,"It's Amazon, what do you want? It's fast (probably faster than the website) and gives me notifications as my orders ship and arrive. That's all I want, and it delivers.",5,0,20.9.0.100,2020-05-18 17:24:06,20.9.0.100
2b2930c1-03b1-4218-bacc-2130dd005d2f,Connor White,We have had 2 late deliveries in a row now and just ordered new USB C charging cables last night and were given the option for prime overnight delivery by 8 am however now that item isnt going to be delivered for 2 entire days after you just told me last night you could get it to us by the next morning? The entire purpose of us buying those phone cords were because ours dont work and we needed new ones asap and now they will be 2 days late.,1,0,20.9.0.100,2020-05-22 12:10:00,20.9.0.100
8a55d008-171f-43fa-b98f-b740a0900e2e,El Trompas,"2 separate orders are late by almost 2 months and now they're lost. !?!? But theirs no option for Amazon to step in for the item that was lost in their own chain of delivery, not going to order anything serious again.",1,0,20.9.0.100,2020-05-16 20:53:01,20.9.0.100
bd2ad6de-72fe-4999-9faa-958dfed069dd,Sharon Taylor,I don't care for the update. Having to scroll to the right is bothersome. Reminiscent of old days when websites weren't optimized for mobile usage and we had to scroll around to view page. Ugh. Please fix!!,3,5,20.10.0.100,2020-05-23 19:20:45,20.10.0.100
ed1ca1cd-a3e0-4967-a269-cf4a03800775,Elliot Parrott,Latest update makes backtracking impossible if you clicked on an image to view in more detail. Keeps crashing in a perpetual loop sometimes too. (Galaxy Note 10),1,8,18.21.2.100,2020-05-24 14:39:30,18.21.2.100
450f9416-5d71-46b4-912d-cfa44f0fa8b5,Jamie-Lynn Repstock,Automatically links accounts to prime video app. This makes it impossible for me to use without having to log out and back into both this app and the video app as i have a shared device.,1,1,18.12.0.100,2020-05-16 18:05:59,18.12.0.100
4dbbc681-b9bc-420b-b160-0c92dbe56073,Lynette Scribner,"It's not just a bore, but a waste of time trying to find something while digging through Amazon's myriad ads for other items they assume I want instead. Uninstalled.",1,1,18.19.0.100,2020-05-11 05:29:15,18.19.0.100
76206182-9ef7-49cf-b3a4-b9a441c3930f,Harley Edmonds,Everything was ok then my account was comprimised and the hacker appeared to put a credit card on with a fake billing address i did not realise until my account was locked and i could not get it back. So in a nutshell instead of Amazon helping me they closed my account i lost my gift card balance. So practically Amazon stole my money because they couldn't care to help me!!!,1,10,,2020-05-22 09:44:14,
fad4e867-b14a-454b-ad9e-11846076a187,JDauen KE0MJE,Amazon has been terrible since the beginning of the year. They do not offer the 2 day shipping on hardly any items and now the don't even answer the phone because of this virus! We pay for a service and should receive it and there's no reason your call center should be closed down! Would not recommend,1,0,,2020-05-05 14:52:17,
c6f5301f-a0c4-4706-8a98-02f0bc3168bf,Harrymac 13,"Terrible app, when you search for a product it continually goes back to the last previous item you searched for. This has been going on for quite some time now. Really putting me off shopping with amazon.",1,10,20.9.0.100,2020-05-04 23:20:18,20.9.0.100
006180ac-6205-4e20-b48a-2149280d047e,carrie campanella,What happened?... worst update ever. 1 product is half my screen and It takes forever to scroll... ROLL BACK. I sure hope this is a bug and not what you were going for. Its not user friendly. I literally have to search on the computer now... guess that will stop me from buying so much.,1,9,20.10.0.100,2020-05-22 21:51:21,20.10.0.100
fe3c542b-84c4-4f44-81a8-16cec6063fd8,Emilia K,Great app for buying stuff but when your searching for something with the filter low to high only show me items that aren't sent to me so why show me that item if i can't get it? Also it sometimes shows me items not releated to my search. Good if you know what item you want not good for searching.,3,4,20.10.0.100,2020-05-24 23:00:46,20.10.0.100
f1a13e88-95d0-4147-abf9-b677e22fd453,Base Evangelique,"One of the worst things ever with Amazon, I have been waiting for a package since March now it's May and still not getting it and customer service don't answer no phone calls use Corona virus for they excuse but took my money and never send the package I am going to social media with that issue so they could be aware of not getting into the same straps",1,0,18.6.0.100,2020-05-09 14:55:08,18.6.0.100
8a84458b-1555-4528-9905-68dcca7b380a,chad boyle,"Don't waste your money until shipping goes back to normal, i can get the same stuff off ebay 7 days sooner. Every ""prime"" item I've ordered the last 2 months has took 2 weeks+ to ship, absolutely un acceptable for something thats payed for.",1,0,20.9.0.100,2020-05-17 22:19:25,20.9.0.100
32eba980-24ff-4d68-8ae5-a2853336b8c8,Alex Hawn,"Works when it wants. Won't load at all on home WiFi even though every other app works just fine, deals page either doesn't load or takes at least ten minutes no matter what time you try it.",1,2,20.10.0.100,2020-05-27 18:24:12,20.10.0.100
fb1f092a-9f1d-4e41-9f66-b8ef1c8f235b,Sherri Smith,"The search feature is so flawed, it is hard to find all the deals on the same product, not to mention unrelated products show up in the list. I have purchased and that was flawless. It is just search that really lets this down",2,1,20.8.0.100,2020-05-02 05:31:12,20.8.0.100
b62cb65d-0225-4051-a0f8-ff4e5418b464,Astrid Gomez,"Would be 5 if I could add to my list much more smoothly. I keep accidently adding dash buttons because 'add to list' is so close, and that option (add to dash buttoms) is fine. Everything else works great, except for adding items to my lists??",4,3,20.9.0.100,2020-05-10 16:28:06,20.9.0.100
742598e1-ce27-458b-a989-b77537649245,T R,"Good luck trying to see vendor reviews in the app. I got fleeced by vendor that had an @90% negative feedback score but the app showed them first and cheapest. How the vendor was even allowed to be a vendor makes no sense. My item never arrived & after excuse after excuse I finally got Amazon to refund after a month and a half. They do not show, not make available the vendor rating in the app. Apparently you have to go to the website to see this information. Then why have an app to begin with?",1,1,20.10.0.100,2020-05-29 20:12:12,20.10.0.100
f07a1ce9-0dca-44d4-8eb4-9ee027f46348,Wayne Marsh,"Uh-oh something went wrong our end! Broken for OnePlus users.launches but can't fully load the homepage 90% of the time.filter system sucks, recommendations and other useful features replaced with ads for Amazon services. The app just an advertising platform now.",1,1,20.8.0.100,2020-05-03 16:20:03,20.8.0.100
3803f4d6-adb3-4155-8bc5-79bf5f69522e,Matt,"It offered me an Amazon Kindle subscription, but the Amazon Kindle app doesn't work, all I wanted was to read an interesting book. Prime isn't that great anyways.",2,2,20.6.0.100,2020-05-23 02:41:56,20.6.0.100
bc5a5cda-045c-4be4-8aec-009faf1712eb,Nathan Borges,My sons laptop broke i ordered a new one so he wouldnt miss school. Was stolen right after delivery. Started a claim for replacement and mentioned that this was needed quickly for school. Was told on Sat that the entire situation would be resolved by monday. Checked back on the progress later that same day and was told there was no possibe way that this could be resolved by the date i was given. I had to argue with a rep for close to an hour just to begin the refund process. Thanks Amazon,1,1,20.8.0.100,2020-05-02 20:15:09,20.8.0.100
ad9bc7d7-9fba-43cc-b888-e296ab437074,Savannah Smolders,constant redirecting to download new app when I already have downloaded it. Everytime i open the app it notifies me it no longer supports this and directs me to the play store. When I click download it opens the app. I have tried uninstalling and redownloading and updating.,1,1,20.8.0.100,2020-05-05 01:30:28,20.8.0.100
48b16805-2aa7-41db-8187-f94f1a2979df,Alison Leigh,"This app is extremely laggy and you can't tell where the seller of your item is located until it ships, which in my case has been 16 days and still no shipped items. Now the app is being so laggy that I can't even search for new items. The hell",3,1,20.9.0.100,2020-05-19 21:03:11,20.9.0.100
742ef38f-de0d-43e2-b9ab-353a83fc123a,Naelak Drawde,"Love it! I have never had trouble with it. The only thing I wish is that you could delete past purchases, that way when your kids get on your account they can't check your purchases!!",5,0,,2020-05-11 13:06:42,
08bdea03-208a-4402-a58f-02335c70406c,Jamie Owen,"Not been able to get it to work on my new phone at all, previously loved it, hope it's to do with the current outbreak. Uninstalled it for now, gave up. Same on my fire tablet.",1,2,20.9.0.100,2020-05-22 21:46:17,20.9.0.100
c754c553-b34c-48f7-a4b9-b87b630ef44d,Jeff Gunter,App used to be great but they keep making horribly thought out updates that are simply making it inconvenient to use. Getting to the point I'm thinking about uninstalling it entirely and just ending my prime membership.,1,5,20.9.0.100,2020-05-17 10:45:34,20.9.0.100
133ef5d2-7ad9-4ac4-833e-c254697619c5,Ruben Borjasramos,Is good but it seen some one is getting my packet it will be cool if they can send me a camera so I can see the packet when they trip it because it seems there with this pandemic I'm a start order more stuff from Amazon don't have the money to spend a lot camera for outside if you guys send me one it don't have to be expensive on a longest I can check my pack is at the door . The person who is keep getting my package I'll we have to stop the person I need help and a camera that connect internet,5,0,20.9.0.100,2020-05-10 22:10:32,20.9.0.100
423bebd0-d65e-4420-b670-0229e4b9c74f,Brian H,"Difficulties backing out of any items ""zoomed view"". Must tap back button 3 times, which takes you back to search results instead of back to item details.",1,2,20.10.0.100,2020-05-25 06:52:54,20.10.0.100
26df431f-9e2b-4454-930d-a24ddd04289e,Lyra Schroeder,"I hate the new update. Amazon used to to recommend things to me that i had intrest in, this would lead me to find many things that i would buy. Now its just a bombardment of stuff i don't care about on a app to buy things. Bring back the recommendations on things i looked at and bought.",2,3,20.8.0.100,2020-05-03 21:20:42,20.8.0.100
4ef81f97-524e-4135-9bd7-431661773ee1,Yaboi Mo,"Constant error screens since last update. This is consistent across all of my devices, including TV's for prime video.",1,0,10.2.0.100,2020-05-28 11:39:59,10.2.0.100
edf47667-7bdd-4ae9-837b-e7ecf61dea10,A Z,App crashes A lot of sellers shouldn't be on Amazon Poorly packaged received damaged food It's funny you can't write a review Every electronic was repackaged/used not NEW One was a cell phone when I took to activate I was owner #3 they said they would take the seller off reappeared same contact info Also a Bluetooth so many stickers couldn't tell what was in the box When I contacted Amazon they didn't care The food is the real problem now,1,0,20.8.0.100,2020-05-16 01:26:14,20.8.0.100
45dfc032-f9f7-497f-88d8-82780e79bc57,Potato Salad,"I like this app, but the search engine needs to be fix. Whenever I search for something the layout expands on my small phone so it becomes hard to navigate.",3,1,20.10.0.100,2020-05-30 17:12:06,20.10.0.100
086a5e6a-757f-45e1-afcb-efea7ca2b931,Dorie Heriot,"Wish Amazon would tell you where your items are coming from ie; US, Canada, overseas; before you order. I should not have to contact seller to cancel order, I didn't order from sellers website or app, I ordered from Amazon.",3,0,20.9.0.100,2020-05-16 11:40:11,20.9.0.100
ad44369f-dea9-4ded-aa1f-1204f4d4f6f2,Denise Neely,"I recently got a new phone and no longer have the basic ""copy link"" or ""copy to clipboard"" option when I want to share an item in my previous bought items. I never had this problem until I got my new Samsung Galaxy S20+ 5G. I have sent 2 emails now with no response. Please answer",1,5,20.10.0.100,2020-05-29 17:36:45,20.10.0.100
1e27194b-84d4-4dc6-b677-60bc6dfce003,Janet Kovatch,The prices and quantity of each item must be watched carefully for persons on a fixed budget without large storage areas. Large quantities of higher priced items were offered first. Accepting these could result in later regrets for me. Extreme patience is required to use this app successfully. I do not think that I have enough patience & time to tolerate use of the app.,2,39,20.9.0.100,2020-05-18 08:41:41,20.9.0.100
1ff9c313-9a36-42c4-9556-2bc9fb0eb291,B Casterlin,App freezes on all my devices while browsing cannot hit back to search results. Please fix. I cleared my cache too deleted and installed older versions 20.1.0.100 NO more stupid ad's prime members shouldn't have put up with this,1,4,20.10.0.100,2020-05-25 22:16:23,20.10.0.100
4053497f-6eec-47d6-b1b7-5c1cb2e3fc0d,Suki Abeywickrama,"Oh god, your ads so irritating, just too many. Can't watch anything online. Someone comes with ugly voice, ask us to start selling. Anything too much is not good. This is a kind of pollution. Amount of money spend on ads rather give people a gift or charity.",1,0,,2020-05-26 11:08:16,
952adafd-f09e-4c1e-bfda-28bb10ac58e1,Jean Higgs,Cant get onto my account to check orders.also sent an email complaining I want my money back for an item sent I didnt order.no response what so ever.i will not be using amazon again if they dont respond.after years of using them.they tell you to contact seller.they NEVER RESPOND EITHER.this is the 3rd time this as happened.so I'm left out of pocket with rubbish items.imported from other countries.,1,1,20.8.0.100,2020-05-03 09:07:29,20.8.0.100
8b328650-a640-4738-99b1-6e8ae55f1e29,Gia Hulsey,When you click an item from a search result page on this app there is no way to go back to your search results page making this a very frustrating shopping experience. It didn't used to be this way. Please fix.,3,4,20.9.0.100,2020-05-20 12:23:28,20.9.0.100
417123f2-c145-4fd8-abdc-75398acc0186,Lorrie Hackett,"I left a review about affirm last month. They owe me over $70 and here we are in May and I still haven't received my money. However, that does not stop them from harassing me nearly every day for additional payments on something I returned in February. Supposedly they opened an investigation and are ""looking into the matter"" and even informed me not to make payments, but yeah they still send me texts everyday telling me how much I owe them. This is the worst company to do business with! GTHellMF",1,0,,2020-05-13 20:29:25,
97ec3700-baa4-48d6-96e4-bd04a8f4aaa4,Kelly Snow,Since this virus has disrupted or lives the delivery has been at a three but when things go array like my mail ending up down the block hanging on someones fence posts needless to say ...I wasnt a happy camper. I tried calling Amazon to let them know that I didnt receive the package but to no avail. Not one person to speak to not one.. kind of hard to believe.,3,0,20.8.0.100,2020-05-10 07:07:53,20.8.0.100
4058229a-3870-418b-a917-9a67a4b1ce27,MoahGentle,"I don't know what amazon is doing. Can't watch pictures properly anymore. Back button doesn't work properly within the app. Freezes, lags.",1,1,20.10.0.100,2020-05-24 06:42:57,20.10.0.100
db3d5678-6f4e-4e31-9974-9af2bb2b4557,Martin Assmann,Very bad performance on my galaxy (S10 Plus Snapdragon) device. I keep my phone very clean app wise and it runs perfectly in almost all situations but when I use the Amazon App it usually starts making my whole phone lag after a while until I force stop it. Please fix that.,3,3,20.9.0.100,2020-05-06 16:05:06,20.9.0.100
8d3bb42d-4b3a-4a40-9bcf-1ae46524d6bd,Elisabeth Rocero,Unsatisfied. I order last may 17 I paid for it and yet after paying the order I made. You cancelled it. And no one from your customer service tried to help me out. Or even refund the hard earned money I lost in just a snap. I hope someone from your team settle this issue.,1,0,20.9.0.100,2020-05-24 08:29:15,20.9.0.100
407bc13d-1ff5-4618-a4d5-89f1d1b2908f,Collin Brown,"I love Amazon but am sevearly disappointed with the services, 3 days ago I bought a moniter and a keyboard and mouse bundle both were prime and I selected 2 day shipping, how ever it has been 3 days and still nothing. I would be happy to change my review to 5 stars if this is fixed",1,1,,2020-05-04 02:28:41,
9d9dbff9-f6ea-4df1-890e-bfafe0f7a4ca,Angela Norman,"The last update made it worse. When trying to view the full size pictures of the item, it freezes up on me and the app stops on me. Fix it!!!",3,1,20.10.0.100,2020-05-26 22:11:46,20.10.0.100
cedf9c5f-8389-4440-9bd4-c928a7dd7a76,Michael Mugnani,"Very slow-loading app - often appears to blackout screen and then reload. Don't have this problem with any other app, and for an uber-riche company this level of development is very disconcerting",2,1,20.9.0.100,2020-05-27 20:20:08,20.9.0.100
47eede23-5e8e-42a8-ae33-323eba0fbfd5,The indifferent Bystander,"My amazone app has crashed all the time today, I dont have access the only thing that I have is a white screen and never starts. But, I am able to get access to your homepage. Please do something. My phone is a Samsung galaxy a10.",2,0,20.10.0.100,2020-05-29 18:25:55,20.10.0.100
8744f6cd-3779-4feb-a7eb-c654dec7c1e1,Emil Filipov,"The app is good overall, but there are still things to be desired. I ordered a couple of things and because the delivery address was old I have to wait for the items to be returned to the seller and then order them again? Or what do I do? There are no options except return or replace and the only thing I want to change is the address and I can't.",2,1,20.9.0.100,2020-05-16 13:32:08,20.9.0.100
